pub_date,main_headline,article_url,classification
1865-01-17T00:03:58Z,Board of Councilmen.,https://www.nytimes.com/1865/01/17/news/board-of-councilmen.html,0
1865-01-17T00:03:58Z,"GEN. THOMAS' ARMY.; Gen. Thomas at Clifton, Wayne County, Tenn., on the 14th Reports About Rood Supplies for Thomas' Army.",https://www.nytimes.com/1865/01/17/news/gen-thomas-army-gen-thomas-clifton-wayne-county-tenn-14th-reports-about-rood.html,0
1865-01-17T00:03:58Z,The Sherman Testimonial.; A TRIBUTE FROM GEN. GRANT.,https://www.nytimes.com/1865/01/17/news/the-sherman-testimonial-a-tribute-from-gen-grant.html,0
1865-01-17T00:03:58Z,MR. FOOTE'S CASE.; The Charges Not yet Made Public Mr. Foote's Family to Proceed to Nashville.,https://www.nytimes.com/1865/01/17/news/mr-foote-s-case-charges-not-yet-made-public-mr-foote-s-family-proceed-nashville.html,0
1865-01-18T00:03:58Z,FROM SAVANNAH.; Development of Union Sentiment in Georgia. Union Meetings Held in Several Counties.The Savannah Resolutions Indorsed by the People. A Messenger Sent from Savannah to Governor Brown. Aspect of Social and Political Affairs in the City. Reinforcements for Gen. Sherman.,https://www.nytimes.com/1865/01/18/news/savannah-development-union-sentiment-georgia-union-meetings-held-several.html,0
1865-01-18T00:03:58Z,STATE LEGISLATURE.,https://www.nytimes.com/1865/01/18/news/state-legislature.html,0
1865-01-18T00:03:58Z,OPERATIONS OF FRIDAY AND SATURDAY.; REPORT OF ADMIRAL PORTER.,https://www.nytimes.com/1865/01/18/news/operations-of-friday-and-saturday-report-of-admiral-porter.html,0
1865-01-18T00:03:58Z,"MARINE INTELLIGENCE.; Cleared. Arrived. Sailed. By Telegraph. Spoken, &c. Foreign Ports.",https://www.nytimes.com/1865/01/18/news/marine-intelligence-cleared-arrived-sailed-by-telegraph-spoken-c-foreign-ports.html,0
1865-01-18T00:03:58Z,Peace Discussions.,https://www.nytimes.com/1865/01/18/news/peace-discussions.html,0
1865-01-18T00:03:58Z,MARRIED.,https://www.nytimes.com/1865/01/18/news/married.html,0
1865-01-18T00:03:58Z,THE REBELLION.,https://www.nytimes.com/1865/01/18/news/the-rebellion.html,0
1865-01-18T00:03:58Z,Jeff. Davis' Army.,https://www.nytimes.com/1865/01/18/news/jeff-davis-army.html,0
1865-01-18T00:03:58Z,LAW REPORTS.; Court Calendar THIS DAY. The Trial of Barney Friary for Murder. Preservation of Iron Ships.,https://www.nytimes.com/1865/01/18/news/law-reports-court-calendar-this-day-trial-barney-friary-for-murder-preservation.html,0
1865-01-18T00:03:58Z,HELD FOR BURGLARY AND ATTEMPTED MURDER.,https://www.nytimes.com/1865/01/18/news/held-for-burglary-and-attempted-murder.html,0
1865-01-18T00:03:58Z,THIRTY-EIGHTH CONGRESS.; SECOND SESSION. SENATE. HOUSE OF REPRESENTATIVES.,https://www.nytimes.com/1865/01/18/news/thirty-eighth-congress-second-session-senate-house-of-representatives.html,0
1865-01-18T00:03:58Z,SHERMAN AND CHARLESTON.,https://www.nytimes.com/1865/01/18/news/sherman-and-charleston.html,0
1865-01-18T00:03:58Z,OUR SOUTHERN FILES.; SHERMAN. FORT FISHER. WANTED-NERVE. LINCOLN AND DAVIS CONTRASTED. The Proposed Testimonial to Mr. Corsen. Board of Supervisors.,https://www.nytimes.com/1865/01/18/news/our-southern-files-sherman-fort-fisher-wanted-nerve-lincoln-davis-contrasted.html,0
1865-01-18T00:03:58Z,DIED.,https://www.nytimes.com/1865/01/18/news/died.html,0
1865-01-18T00:03:58Z,THE CITY GOVERNMENT.; [OFFICIAL.] BOARD OF ALDERMEN. [OFFICIAL.] BOARD OF COUNCILMEN.,https://www.nytimes.com/1865/01/18/news/the-city-government-official-board-of-aldermen-official-board-of-councilmen.html,0
1865-01-18T00:03:58Z,CONGRESS.,https://www.nytimes.com/1865/01/18/news/congress.html,0
1865-01-18T00:03:58Z,GENERAL NEWS.,https://www.nytimes.com/1865/01/18/news/general-news.html,0
1865-01-18T00:03:58Z,DETAILS OF OPERATIONS.; SECOND DAY OF BATTLE.,https://www.nytimes.com/1865/01/18/news/details-of-operations-second-day-of-battle.html,0
1865-01-18T00:03:58Z,CITY NOTES.,https://www.nytimes.com/1865/01/18/news/city-notes.html,0
1865-01-18T00:03:58Z,Passengers Arrived.,https://www.nytimes.com/1865/01/18/news/passengers-arrived.html,0
1865-01-18T00:03:58Z,NEWS FROM WASHINGTON.; Another Prussian Forger.,https://www.nytimes.com/1865/01/18/news/news-from-washington-another-prussian-forger.html,0
1865-01-18T00:03:58Z,WILMINGTON.; Fort Fisher Carried by Assault. Official Reports from General Terry and Col. Comstock. Twenty-five Hundred Prisoners and Seventy-five Guns Captured. Gen. Whiting and Col. Lamb Taken Prisoners. OUR LOSS NINE HUNDRED.ADMIRAL PORTER'S OFFICIAL REPORT. General Grant orders a Salute in Honor of the Victory. REBEL ACCOUNT OF THE FIGHT. Official Dispatch from General Lee.[OFFICIAL] THE NAVAL DISPATCH. [OFFICIAL.] THE REBEL ACCOUNT. [OFFICIAL.],https://www.nytimes.com/1865/01/18/news/wilmington-fort-fisher-carried-assault-official-reports-general-terry-col.html,0
1865-01-18T00:03:58Z,THE REBELS ON WILMINGTON.,https://www.nytimes.com/1865/01/18/news/the-rebels-on-wilmington.html,0
1865-01-18T00:03:58Z,END OF BLAIR.; The Result of Mr. Blair's Visit to Richmond Most of His Private Papers Recovered Nothing Further Accomplished.,https://www.nytimes.com/1865/01/18/news/end-blair-result-mr-blair-s-visit-richmond-most-his-private-papers-recovered.html,0
1865-01-18T00:03:58Z,COTTON AT SAVANNAH AND WILMINGTON.,https://www.nytimes.com/1865/01/18/news/cotton-at-savannah-and-wilmington.html,0
1865-01-18T00:03:58Z,"RELEASE, OF MR. FOOTE.; The Rebel Congress Recommend That He Re Discharged. A Family Letter from Mr. Everett. Arrivals in the City.",https://www.nytimes.com/1865/01/18/news/release-mr-foote-rebel-congress-recommend-that-he-re-discharged-family-letter-mr.html,0
1865-01-18T00:03:58Z,Our Victory at Wilmington The Final and Stupendous Combinations of Grant.,https://www.nytimes.com/1865/01/18/news/our-victory-at-wilmington-the-final-and-stupendous-combinations-of-grant.html,0
1865-01-18T00:03:58Z,VERY LATEST FROM FORT FISHER.; The Bloody Nature of the Fight The Rebel Gen. Whiting and Col. Lamb Both Wounded Our Loss 800 The Rebel Pirates Chickamauga and Tallahassee Both Driven up the River Accidental Explosion of Fort Fisher's Magazine. Secretary Welles Congratulates Admiral Porter and General Terry A National Salute Ordered at the Navy-Yards. Rejoinings Over the Victory. A SALUTE IN WASHINGTON. Brevet Major-Gen. Alfred Howe Terry. News from Albany. Movements of the Rebel Gens. Vaughn and Breckinridge. The Case of Burleigh.,https://www.nytimes.com/1865/01/18/news/very-latest-fort-fisher-bloody-nature-fight-rebel-gen-whiting-col-lamb-both.html,0
1865-01-19T00:03:58Z,FROM THE SOUTH.; SPIRIT OF THE SOUTHERN PRESS. FURIOUS TIRADES AGAINST DAVIS. One Hundred and Fifty Thousand Bales of Cotton Reported in Savannah. Depreciation of the Rebel Currency. One Dollar in Gold Worth Sixty inPaper.,https://www.nytimes.com/1865/01/19/news/south-spirit-southern-press-furious-tirades-against-davis-one-hundred-fifty.html,0
1865-01-19T00:03:58Z,STATE LEGISLATURE.,https://www.nytimes.com/1865/01/19/news/state-legislature.html,0
1865-01-19T00:03:58Z,BLAIR IN RICHMOND.; Rebel Reports of the Result of His Inter- view--Arrival of Mr. Singleton in Rich- mond.,https://www.nytimes.com/1865/01/19/news/blair-richmond-rebel-reports-result-his-inter-view-arrival-mr-singleton-rich.html,0
1865-01-19T00:03:58Z,GENERAL NEWS.,https://www.nytimes.com/1865/01/19/news/general-news.html,0
1865-01-19T00:03:58Z,MARRIED.,https://www.nytimes.com/1865/01/19/news/married.html,0
1865-01-19T00:03:58Z,THE PIRATE CAPTAIN BELL.,https://www.nytimes.com/1865/01/19/news/the-pirate-captain-bell.html,0
1865-01-19T00:03:58Z,"FORT FISHER.; DETAILS OF THE VICTORY. Official Dispatch from Secretary Stanton. REPORT OF ADMIRAL PORTER. Full Particulars of the Assault. THE BLOODY WORK ON THE RAMPARTS A Nine Hours Struggle in the Fort. ""From Traverse to Traverse, and from Bomb-proof to Bomb-proof."" Heroic Gallantry of the Soldiers and Sailors.",https://www.nytimes.com/1865/01/19/news/fort-fisher-details-victory-official-dispatch-secretary-stanton-report-admiral.html,1
1865-01-19T00:03:58Z,Gen. Sherman on Reconstruction.,https://www.nytimes.com/1865/01/19/news/gen-sherman-on-reconstruction.html,1
1865-01-19T00:03:58Z,STATE LEGISLATURE.; SENATE.,https://www.nytimes.com/1865/01/19/news/state-legislature-senate.html,0
1865-01-19T00:03:58Z,MORE PEACE COMMISSIONERS.,https://www.nytimes.com/1865/01/19/news/more-peace-commissioners.html,0
1865-01-19T00:03:58Z,LAW REPORTS.; A Naval Case of Criminal Conversation-- The Validity of Divorces Obtained in other States to be Tested. SUPREME COURT--TRIAL TERM. Before Judge Leonard.,https://www.nytimes.com/1865/01/19/news/law-reports-naval-case-criminal-conversation-validity-divorces-obtained-other.html,0
1865-01-19T00:03:58Z,The Testimonial Business.,https://www.nytimes.com/1865/01/19/news/the-testimonial-business.html,0
1865-01-19T00:03:58Z,THE PUBLICATION OF INCOMES FORBIDDEN.--,https://www.nytimes.com/1865/01/19/news/the-publication-of-incomes-forbidden.html,0
1865-01-19T00:03:58Z,OUR ALBANY CORRESPONDENCE.; The Contested Seat Case in the Senate Decided in Favor of Henry R. Low--Meetingof Supervisors in Regard to the CountyQuestion--The State Military Association--The Railroad Bills--Proposed Amendment of the City School Laws.,https://www.nytimes.com/1865/01/19/news/our-albany-correspondence-contested-seat-case-senate-decided-favor-henry-r-low.html,0
1865-01-19T00:03:58Z,Obituary.; WILLIAM H. FRY.,https://www.nytimes.com/1865/01/19/news/obituary-william-h-fry.html,0
1865-01-19T00:03:58Z,HOUSE OF REPRESENTATIVES.; OUR INDIAN POLICY.,https://www.nytimes.com/1865/01/19/news/house-of-representatives-our-indian-policy.html,0
1865-01-19T00:03:58Z,SOUTH CAROLINA.; SHERMAN'S NEW MOVEMENT. Official Dispatch from Secretary Stanton.THE CAMPAIGN INAUGURATED.Advance of General Howard toPocotaligo.The Enemy Abandon theirWorks.BRANCHVILLE CLOSELY THREATENED.The Commercial Aspect of Savannah.,https://www.nytimes.com/1865/01/19/news/south-carolina-sherman-s-new-movement-official-dispatch-secretary-stantonthe.html,0
1865-01-19T00:03:58Z,STEAMER OCEAN QUEEN.,https://www.nytimes.com/1865/01/19/news/steamer-ocean-queen.html,0
1865-01-19T00:03:58Z,NEWS FROM WASHINGTON.; MINISTER FROM SWEDEN.,https://www.nytimes.com/1865/01/19/news/news-from-washington-minister-from-sweden.html,0
1865-01-19T00:03:58Z,Amusements this Evening.,https://www.nytimes.com/1865/01/19/news/amusements-this-evening.html,0
1865-01-19T00:03:58Z,LIFE IN CHARLESTON.; PRICES.,https://www.nytimes.com/1865/01/19/news/life-in-charleston-prices.html,0
1865-01-19T00:03:58Z,GEN. GRANT'S ARMY.; An Important Report--Rumored Destruction of the Danville Road by Freshets--Lee's Army Short of Food.,https://www.nytimes.com/1865/01/19/news/gen-grant-s-army-important-report-rumored-destruction-danville-road-freshets-lee.html,0
1865-01-19T00:03:58Z,GEN. SINGLETON IN RICHMOND.,https://www.nytimes.com/1865/01/19/news/gen-singleton-in-richmond.html,0
1865-01-19T00:03:58Z,MR. BLAIR'S RETURN.,https://www.nytimes.com/1865/01/19/news/mr-blair-s-return.html,0
1865-01-19T00:03:58Z,Arrival of the Atlantic.,https://www.nytimes.com/1865/01/19/news/arrival-of-the-atlantic.html,0
1865-01-19T00:03:58Z,THE OFFICIAL REPORTS OF ADMIRAL PORTER; AND GEN. TERRY.--,https://www.nytimes.com/1865/01/19/news/the-official-reports-of-admiral-porter-and-gen-terry.html,0
1865-01-19T00:03:58Z,Special Dispatch to the New-York Times.,https://www.nytimes.com/1865/01/19/news/special-dispatch-to-the-new-york-times.html,0
1865-01-19T00:03:58Z,"FRANCIS P. BLAIR, ESQ.; From the same.",https://www.nytimes.com/1865/01/19/news/francis-p-blair-esq-from-the-same.html,0
1865-01-19T00:03:58Z,The Wrangling of the Rebels in the Hour of Ruin.,https://www.nytimes.com/1865/01/19/news/the-wrangling-of-the-rebels-in-the-hour-of-ruin.html,0
1865-01-19T00:03:58Z,THIRTY-EIGHTH CONGRESS.; SECOND SESSION. SENATE.,https://www.nytimes.com/1865/01/19/news/thirty-eighth-congress-second-session-senate.html,0
1865-01-19T00:03:58Z,CONGRESS.,https://www.nytimes.com/1865/01/19/news/congress.html,0
1865-01-19T00:03:58Z,DIED.,https://www.nytimes.com/1865/01/19/news/died.html,0
1865-01-19T00:03:58Z,Election of State Treasurer in Maine.,https://www.nytimes.com/1865/01/19/news/election-of-state-treasurer-in-maine.html,0
1865-01-19T00:03:58Z,Sherman in South Carolina.,https://www.nytimes.com/1865/01/19/news/sherman-in-south-carolina.html,0
1865-01-19T00:03:58Z,CHAMBER OF COMMERCE.,https://www.nytimes.com/1865/01/19/news/chamber-of-commerce.html,0
1865-01-19T00:03:58Z,Passengers Arrived.,https://www.nytimes.com/1865/01/19/news/passengers-arrived.html,0
1865-01-19T00:03:58Z,THE FORT FISHER VICTORY.,https://www.nytimes.com/1865/01/19/news/the-fort-fisher-victory.html,0
1865-01-19T00:03:58Z,THE REBELLION.,https://www.nytimes.com/1865/01/19/news/the-rebellion.html,0
1865-01-19T00:03:58Z,THE WAR IN VIRGINIA.,https://www.nytimes.com/1865/01/19/news/the-war-in-virginia.html,0
1865-01-19T00:03:58Z,MARINE INTELLIGENCE.; Cleared.,https://www.nytimes.com/1865/01/19/news/marine-intelligence-cleared.html,0
1865-01-20T00:03:58Z,"PROCEEDINGS OF THE REBEL CONGRESS; TREASON"" IN THE WIND.",https://www.nytimes.com/1865/01/20/news/proceedings-of-the-rebel-congress-treason-in-the-wind.html,0
1865-01-20T00:03:58Z,HOUSE OF REPRESENTATIVES.; PROPOSED TAX ON INCOMES NOW EXEMPT. LIGHT-HOUSE DUES. PACIFIC RAILROAD CONVENTION. TO AMEND THE STEAMBOAT LAW. STATES. THE INCREASED DUTIES ON IMPORTS. RECORDS OF A COURT-MARTIAL CALLED FOR. CREDITS FOR HUNDRED DAYS' MEN. THE AMENDMENT OF THE ENROLLMENT ACT. THANKS TO GEN. THOMAS. THE APPROPRIATION BILL.,https://www.nytimes.com/1865/01/20/news/house-representatives-proposed-tax-incomes-now-exempt-light-house-dues-pacific.html,0
1865-01-20T00:03:58Z,DIED.,https://www.nytimes.com/1865/01/20/news/died.html,0
1865-01-20T00:03:58Z,MARRIED.,https://www.nytimes.com/1865/01/20/news/married.html,0
1865-01-20T00:03:58Z,"THE SOUTHERN CONFEDERACY.; ITS ""INTESTINE DIFFICULTIES."" Emeute in the Rebel Congress. Peace Commissioners Appointed in Secret Session. ""The Carnival of Dealth to be Ended by Negotiation."" DAVIS' ORGAN CALLS IT ""TREASON."" Mr. Davis and His Organ Defied. Withdrawal of Another Member of the Rebel House. Mr. Blair on Another Mission to Richmond. Peace Resolutions in the North Carolina Legislature.Sherman's March to be Stayed orRichmond Given Up.Rebel Comments on the Fallof Fort Fisher.IS IT A ""BLESSING IN DISGUISE?""",https://www.nytimes.com/1865/01/20/news/southern-confederacy-its-intestine-difficulties-emeute-rebel-congress-peace.html,0
1865-01-20T00:03:58Z,THE AGONY OF DESPAIR.,https://www.nytimes.com/1865/01/20/news/the-agony-of-despair.html,0
1865-01-20T00:03:58Z,FROM NORTH CAROLINA.,https://www.nytimes.com/1865/01/20/news/from-north-carolina.html,0
1865-01-20T00:03:58Z,THE FALL OF FORT FISHER.,https://www.nytimes.com/1865/01/20/news/the-fall-of-fort-fisher.html,0
1865-01-20T00:03:58Z,NEWS FROM WASHINGTON.; THE ALBANY BRIDGE CASE. THE DUTY ON PAPER. THE TOBACCO TAX. Dispatches to the Associated Press. PROPOSED REVIVAL OF LAWS TO PREVENT SMUGGLING. Arrival of a Prize-Disaster at Sea. Terrible Railroad Accident. A WHOLE TRAIN THROWN OFF THE TRACK BETWEEN FORTY AND FIFTY PERSONS INJURED.,https://www.nytimes.com/1865/01/20/news/washington-albany-bridge-case-duty-paper-tobacco-tax-dispatches-associated-press.html,0
1865-01-20T00:03:58Z,GENERAL NEWS.,https://www.nytimes.com/1865/01/20/news/general-news.html,0
1865-01-20T00:03:58Z,THE GAS QUESTION.; Comptoller Brennan's Remonstrance to the Common Council. THE OPENING OF THE BIDS POSTPONED.,https://www.nytimes.com/1865/01/20/news/gas-question-comptoller-brennan-s-remonstrance-common-council-opening-bids.html,0
1865-01-20T00:03:58Z,THIRTY-EIGHTH CONGRESS.; SECOND SESSION. SENATE. JUSTICE IN THE DISTRICT. THE TREATMENT OF INDIANS. COMMERCE BETWEEN THE SEVERAL STATES. THE PAY OF ARMY OFFICERS. THE SPECIAL INCOME TAX. IMMIGRATION. ADJOURNMENT.,https://www.nytimes.com/1865/01/20/news/thirty-eighth-congress-second-session-senate-justice-district-treatment-indians.html,0
1865-01-20T00:03:58Z,Publication of the Income Tax Lists.,https://www.nytimes.com/1865/01/20/news/publication-of-the-income-tax-lists.html,0
1865-01-20T00:03:58Z,OPENING OF THE CANADIAN PARLIAMENT.,https://www.nytimes.com/1865/01/20/news/opening-of-the-canadian-parliament.html,0
1865-01-20T00:03:58Z,THOUGHTS ON HEALTH.,https://www.nytimes.com/1865/01/20/news/thoughts-on-health.html,0
1865-01-20T00:03:58Z,CONGRESS.,https://www.nytimes.com/1865/01/20/news/congress.html,0
1865-01-20T00:03:58Z,The Resurrection of the South.,https://www.nytimes.com/1865/01/20/news/the-resurrection-of-the-south.html,0
1865-01-20T00:03:58Z,Court Calendar THIS DAY.,https://www.nytimes.com/1865/01/20/news/court-calendar-this-day.html,0
1865-01-20T00:03:58Z,THE REBELLION.,https://www.nytimes.com/1865/01/20/news/the-rebellion.html,0
1865-01-20T00:03:58Z,THE GAS MONOPOLIES AND STREET-LIGHTING.,https://www.nytimes.com/1865/01/20/news/the-gas-monopolies-and-street-lighting.html,0
1865-01-20T00:03:58Z,"LIST OF LETTERS.; Remaining Unclaimed in the New-York Post-office, Friday, Jan. 20, 1865.",https://www.nytimes.com/1865/01/20/news/list-letters-remaining-unclaimed-new-york-post-office-friday-jan-20-1865.html,0
1865-01-20T00:03:58Z,THE CASE OF MR. FOOTE.; HE TRIES THE HABEAS CORPUS. MR. SINGLETON.,https://www.nytimes.com/1865/01/20/news/the-case-of-mr-foote-he-tries-the-habeas-corpus-mr-singleton.html,0
1865-01-20T00:03:58Z,OUR ALBANY CORRESPONDENCE.; The Bounty Bill The New-York City Investigations The Bank Committee.,https://www.nytimes.com/1865/01/20/news/our-albany-correspondence-bounty-bill-new-york-city-investigations-bank.html,0
1865-01-20T00:03:58Z,THE REBEL SECRETARY OF WAR.,https://www.nytimes.com/1865/01/20/news/the-rebel-secretary-of-war.html,0
1865-01-20T00:03:58Z,A Card from Mr. Muren.,https://www.nytimes.com/1865/01/20/news/a-card-from-mr-muren.html,0
1865-01-20T00:03:58Z,"MARINE INTELLIGENCE.; Cleared. Arrived. Sailed. Spoken, &c.",https://www.nytimes.com/1865/01/20/news/marine-intelligence-cleared-arrived-sailed-spoken-c.html,0
1865-01-20T00:03:58Z,Chamber of Commerce.; MEMORIAL FROM THE BOSTON BOARD OF TRADE LEGISLATIVE AMENDMENT.,https://www.nytimes.com/1865/01/20/news/chamber-commerce-memorial-boston-board-trade-legislative-amendment.html,0
1865-01-20T00:03:58Z,GOSSIP FROM RICHMOND.,https://www.nytimes.com/1865/01/20/news/gossip-from-richmond.html,0
1865-01-20T00:03:58Z,DR. SCHENCK'S PULMONIC SYRUP.,https://www.nytimes.com/1865/01/20/news/dr-schenck-s-pulmonic-syrup.html,0
1865-01-20T00:03:58Z,The Income Tax.,https://www.nytimes.com/1865/01/20/news/the-income-tax.html,0
1865-01-20T00:03:58Z,EDWARD EVERETT.; Honors to His Memory in Boston. The Funeral Obsequies in Boston Yesterday. Resolutions of Respect in the Maine Legislature. A Letter from Mr. Everett. The Second Annual Congress of the Fenian Brotherhood. Honors to Maj.-Gen. Terry at Home. Explosion of Three Powder Mills.,https://www.nytimes.com/1865/01/20/news/edward-everett-honors-his-memory-boston-funeral-obsequies-boston-yesterday.html,0
1865-01-20T00:03:58Z,"CANADA.; Meeting of Parliament--Speech of Lord Monck, Governor--General--What is Being Done for the Protection of the Frontier. Our Relations with Canada--Failure of a Produce-Dealer.",https://www.nytimes.com/1865/01/20/news/canada-meeting-parliament-speech-lord-monck-governor-general-what-being-done-for.html,0
1865-01-20T00:03:58Z,PEACE PERSONALITIES.,https://www.nytimes.com/1865/01/20/news/peace-personalities.html,0
1865-01-20T00:03:58Z,GAY LIFE IN THE METROPOLIS.; The Domestic Trials of Messrs. Millspaugh and Adams. SUPREME COURT TRIAL TERM. Before Justice Leonard.,https://www.nytimes.com/1865/01/20/news/gay-life-metropolis-domestic-trials-messrs-millspaugh-adams-supreme-court-trial.html,0
1865-01-20T00:03:58Z,STATE LEGISLATURE.; SENATE. ASSEMBLY.,https://www.nytimes.com/1865/01/20/news/state-legislature-senate-assembly.html,0
1865-01-20T00:03:58Z,Amusements this Evening.,https://www.nytimes.com/1865/01/20/news/amusements-this-evening.html,0
1865-01-20T00:03:58Z,ARMY OF THE POTOMAC.; Review of Gen. Mott's Division News of the Fall of Fort Fisher in the Army. Arrival of a Prize-Steamer.,https://www.nytimes.com/1865/01/20/news/army-potomac-review-gen-mott-s-division-fall-fort-fisher-army-arrival-prize.html,0
1865-01-20T00:03:58Z,Passengers Arrived.,https://www.nytimes.com/1865/01/20/news/passengers-arrived.html,0
1865-01-20T00:03:58Z,STATE LEGISLATURE.,https://www.nytimes.com/1865/01/20/news/state-legislature.html,0
1865-01-21T00:03:58Z,The Rebellion and Opinion in Europe.,https://www.nytimes.com/1865/01/21/news/the-rebellion-and-opinion-in-europe.html,0
1865-01-21T00:03:58Z,MARINE INTELLIGENCE.; Cleared. Arrived. Sailed. By Telegraph. Foreign Ports.,https://www.nytimes.com/1865/01/21/news/marine-intelligence-cleared-arrived-sailed-by-telegraph-foreign-ports.html,0
1865-01-21T00:03:58Z,STATE LEGISLATURE.,https://www.nytimes.com/1865/01/21/news/state-legislature.html,0
1865-01-21T00:03:58Z,THIRTY-EIGHTH CONGRESS.; SECOND SESSION. HOUSE OF REPRESENTATIVES.,https://www.nytimes.com/1865/01/21/news/thirty-eighth-congress-second-session-house-of-representatives.html,0
1865-01-21T00:03:58Z,MR. BLAIR'S SECOND MISSION.; Second Departure of Mr. Blair for Richmond Important Meeting of the Cabinet Object of Mr. Blair's Second Visit.,https://www.nytimes.com/1865/01/21/news/mr-blair-s-second-mission-second-departure-mr-blair-for-richmond-important.html,0
1865-01-21T00:03:58Z,The Pope's Letter.,https://www.nytimes.com/1865/01/21/news/the-pope-s-letter.html,0
1865-01-21T00:03:58Z,Front Page 1 -- No Title,https://www.nytimes.com/1865/01/21/news/front-page-1-no-title.html,0
1865-01-21T00:03:58Z,FROM EUROPE.,https://www.nytimes.com/1865/01/21/news/from-europe.html,0
1865-01-21T00:03:58Z,"FOUR DAYS LATER FROM EUROPE.; ARRIVAL OF THE CITY OF BALTIMORE. Affect of Our Military Successes in Europe. GREAT DECLINE IN THE REBEL LOAN. Candid Admissions from the English Press. INTERESTING CONTINENTAL NEWS. Excitement in France About the Pope's Encyclical. FINANCIAL AND COMMERCIAL INTELLIGENCE. AMERICAN TOPICS. GREAT BRITAIN. FRANCE. ITALY. GERMANY. SPAIN. INDIA, CHINA AND AUSTRALIA. THE BRAZILS. FINANCIAL AND COMMERCIAL. VERY LATEST BY THE CITY OF BALTIMORE. LATEST COMMERCIAL.",https://www.nytimes.com/1865/01/21/news/four-days-later-europe-arrival-city-baltimore-affect-our-military-successes.html,0
1865-01-21T00:03:58Z,SHERMAN'S NEW CAMPAIGN.; His Veteran Columns Again in Motion. Movements of the Right and Left Wings. THE VICTORY AT POCOTALIGO. The Left Wing Marching on from Savannah. ITS DESTINATION UNKNOWN The Rebels Preparing to Evacuate Charleston. Highly Important and Interesting Facts.UNIONISM IN GEORGIA.,https://www.nytimes.com/1865/01/21/news/sherman-s-new-campaign-his-veteran-columns-again-motion-movements-right-left.html,0
1865-01-21T00:03:58Z,ADVANCE ON POCOTALIGO.; The Advance of Gen. Howard--Movements of Troops--The Cotton Question--Handsome Promotions by Secretary Stanton. Another Order by Sherman---Miscellaneous Items. MILITARY ORDERS. MISCELLANEOUS.,https://www.nytimes.com/1865/01/21/news/advance-pocotaligo-advance-gen-howard-movements-troops-cotton-question-handsome.html,0
1865-01-21T00:03:58Z,"THE BILLIARD CHAMPIONSHIP.; $1,000 Match between Dudley Kavanagh and Wm. Goldthwait. KAVANAGH THE WINNER BY 94 POINTS. CORPULENT MAIL. TRADE-MARKS FORGED.",https://www.nytimes.com/1865/01/21/news/billiard-championship-1000-match-between-dudley-kavanagh-wm-goldthwait-kavanagh.html,0
1865-01-21T00:03:58Z,THE CANADIAN RAIDERS.; Burley Committed for Extradition His Counsel will Apply for a Writ of Habeus Corpus.,https://www.nytimes.com/1865/01/21/news/canadian-raiders-burley-committed-for-extradition-his-counsel-will-apply-for.html,0
1865-01-21T00:03:58Z,The New-York Central Railroad.,https://www.nytimes.com/1865/01/21/news/the-new-york-central-railroad.html,0
1865-01-21T00:03:58Z,The Counter Revolution in the South.,https://www.nytimes.com/1865/01/21/news/the-counter-revolution-in-the-south.html,0
1865-01-21T00:03:58Z,"FROM WILMINGTON.; FORT CASWELL BLOWN UP OUR GUNBOATS IN THE RIVER. THE SEARCH FOR TORPEDOES. A Diagram of the Torpedo System Found.ANOTHER REPORT OF ADMIRAL PORTER. THE CAPTURE OF FORT FISHER. Official Dispatch of Rear-Admiral Porter. NORTH ATLANTIC SQUADRON, FLAG-SHIP MALVERN,",https://www.nytimes.com/1865/01/21/news/wilmington-fort-caswell-blown-up-our-gunboats-river-search-for-torpedoes-diagram.html,1
1865-01-21T00:03:58Z,European Naval Squadron The Brazil and East India Squadrons to be Increased.,https://www.nytimes.com/1865/01/21/news/european-naval-squadron-the-brazil-and-east-india-squadrons-to-be-increased.html,0
1865-01-21T00:03:58Z,"Discouraging to ""Common Barrators."" COURT OF GENERAL SESSIONS.",https://www.nytimes.com/1865/01/21/news/discouraging-to-common-barrators-court-of-general-sessions.html,0
1865-01-21T00:03:58Z,"Massachusetts United States Senator Re-election of Hon. Henry Wilson,",https://www.nytimes.com/1865/01/21/news/massachusetts-united-states-senator-re-election-of-hon-henry-wilson.html,0
1865-01-21T00:03:58Z,NEWS FROM WASHINGTON.; Dispatches to the Associated Press.,https://www.nytimes.com/1865/01/21/news/news-from-washington-dispatches-to-the-associated-press.html,0
1865-01-21T00:03:58Z,OUR ALBANY CORRESPONDENCE.; The Bounty Question Assuming Shape Business Pouring In New York Railroad Bills.,https://www.nytimes.com/1865/01/21/news/our-albany-correspondence-bounty-question-assuming-shape-business-pouring-new.html,0
1865-01-21T00:03:58Z,The New-Jersey Legislature.,https://www.nytimes.com/1865/01/21/news/the-new-jersey-legislature.html,0
1865-01-21T00:03:58Z,Passengers Arrived.,https://www.nytimes.com/1865/01/21/news/passengers-arrived.html,0
1865-01-21T00:03:58Z,Arrivals in the City.,https://www.nytimes.com/1865/01/21/news/arrivals-in-the-city.html,0
