pub_date,main_headline,article_url,classification
1865-01-31T00:03:58Z,TWO DAYS LATER FROM EUROPE.; ARRIVAL OF THE PERUVIAN AT PORTLAND Favorable Speeches on American Affairs.Effects of the Great Gale on the British Coast.A DUEL FOUGHT BY TWO FRENCH NOBLES.Continued Excitement About the Pope's Encyclical.FINANCIAL AND COMMERCIAL. Mr. Bigelow's Appointment The Vacancy in the French Legation at Washington Winter Davis' Mexican Resolutions. GREAT BRITAIN. MESSRS. SCHOFIELD AND BRIGHT ON AMERICAN AFFAIRS. FRANCE. PRUSSIA. GERMANY. SPAIN. ITALY. BRAZIL. LATEST BY THE PERUVIAN. COMMERCIAL AFFAIRS. LONDON MONEY MARKET. LATEST VIA GREENCASTLE.,https://www.nytimes.com/1865/01/31/news/two-days-later-europe-arrival-peruvian-portland-favorable-speeches-american.html,0
1865-01-31T00:03:58Z,THE OFFICIAL CORRESPONDENCE IN THE FLORIDA CASE.,https://www.nytimes.com/1865/01/31/news/the-official-correspondence-in-the-florida-case.html,0
1865-01-31T00:03:58Z,CONGRESS.,https://www.nytimes.com/1865/01/31/news/congress.html,0
1865-01-31T00:03:58Z,FROM NASHVILLE.; Patriotic Powder-Burning Porter's Feat a Surprise Tennessee Redivivus as a State Sherman's Army Swelling Hospitals Decreasing Help for the Orphans.,https://www.nytimes.com/1865/01/31/news/nashville-patriotic-powder-burning-porter-s-feat-surprise-tennessee-redivivus.html,0
1865-02-01T00:03:58Z,BROOKLYN NEWS.,https://www.nytimes.com/1865/02/01/news/brooklyn-news.html,0
1865-02-01T00:03:58Z,THE CONFEDERACY AND ITS SLAVES.; The Question of Arming the Southern Negroes Discussed in the Confederate Congress.,https://www.nytimes.com/1865/02/01/news/confederacy-its-slaves-question-arming-southern-negroes-discussed-confederate.html,0
1865-02-01T00:03:58Z,FRANCE.,https://www.nytimes.com/1865/02/01/news/france.html,0
1865-02-01T00:03:58Z,From Fortress Monroe.,https://www.nytimes.com/1865/02/01/news/from-fortress-monroe.html,0
1865-02-01T00:03:58Z,MARRIED.,https://www.nytimes.com/1865/02/01/news/married.html,0
1865-02-01T00:03:58Z,The Pacific Pirates Again.,https://www.nytimes.com/1865/02/01/news/the-pacific-pirates-again.html,0
1865-02-01T00:03:58Z,Northern Feeling Toward the South.,https://www.nytimes.com/1865/02/01/news/northern-feeling-toward-the-south.html,0
1865-02-01T00:03:58Z,"MARINE INTELLIGENCE.; Cleared. Arrived. Sailed. By Telegraph. Miscellaneous. Spoken, &c.",https://www.nytimes.com/1865/02/01/news/marine-intelligence-cleared-arrived-sailed-by-telegraph-miscellaneous-spoken-c.html,0
1865-02-01T00:03:58Z,"HOUSE OF REPRESENTATIVES.; MR. WOOD OFFERS A RESOLUTION. THE PRESIDENTIAL VOTE. THE ANTI-SLAVERY AMENDMENT. YEARS (DEMOCRATS IN ITALICS.) ABSENT, OR NOT VOTING.",https://www.nytimes.com/1865/02/01/news/house-representatives-mr-wood-offers-resolution-presidential-vote-anti-slavery.html,0
1865-02-01T00:03:58Z,FROM SAVANNAH.; The Cotton Fleet Prepared to Sail.,https://www.nytimes.com/1865/02/01/news/from-savannah-the-cotton-fleet-prepared-to-sail.html,0
1865-02-01T00:03:58Z,"THE PEACE QUESTION.; ITS LATEST ASPECT. Three Commissioners Coming from Richmond. They Apply for Admission to General Grant's Lines. A.H. Stephens of Georgia, R.M.T. Hunter of Virginia, and A.J. Campbell of Alabama. A FLAG OF TRUCE AND A PARLEY. General Grant in Communication with the Government. Expected Arrival of the Commissioners at Annapolis.",https://www.nytimes.com/1865/02/01/news/peace-question-its-latest-aspect-three-commissioners-coming-richmond-they-apply.html,0
1865-02-01T00:03:58Z,Glimmerings of Peace.,https://www.nytimes.com/1865/02/01/news/glimmerings-of-peace.html,0
1865-02-01T00:03:58Z,DIED.,https://www.nytimes.com/1865/02/01/news/died.html,0
1865-02-01T00:03:58Z,"For New-Orleans, the West Indies.",https://www.nytimes.com/1865/02/01/news/for-new-orleans-the-west-indies.html,0
1865-02-01T00:03:58Z,From Chattanooga.,https://www.nytimes.com/1865/02/01/news/from-chattanooga.html,0
1865-02-01T00:03:58Z,Movements of Mrs. H.S. Foote.,https://www.nytimes.com/1865/02/01/news/movements-of-mrs-hs-foote.html,0
1865-02-01T00:03:58Z,The Departure of the Commissioners from Richmond.,https://www.nytimes.com/1865/02/01/news/the-departure-of-the-commissioners-from-richmond.html,0
1865-02-01T00:03:58Z,RUSSIA.,https://www.nytimes.com/1865/02/01/news/russia.html,0
1865-02-01T00:03:58Z,CONGRESS.,https://www.nytimes.com/1865/02/01/news/congress.html,0
1865-02-01T00:03:58Z,Williamsburgh.; AN UNKNOWN MAN FOUND DEAD IN HIS ROOM.,https://www.nytimes.com/1865/02/01/news/williamsburgh-an-unknown-man-found-dead-in-his-room.html,0
1865-02-01T00:03:58Z,The Terminus of the Hudson River Railroad Opinion of the Attorney-General.,https://www.nytimes.com/1865/02/01/news/the-terminus-of-the-hudson-river-railroad-opinion-of-the-attorney-general.html,0
1865-02-01T00:03:58Z,REPORTS VIA PHILADELPHIA.,https://www.nytimes.com/1865/02/01/news/reports-via-philadelphia.html,0
1865-02-01T00:03:58Z,Secession in a New Form.,https://www.nytimes.com/1865/02/01/news/secession-in-a-new-form.html,0
1865-02-01T00:03:58Z,Affairs in Kentucky.,https://www.nytimes.com/1865/02/01/news/affairs-in-kentucky.html,0
1865-02-01T00:03:58Z,The French Designs.,https://www.nytimes.com/1865/02/01/news/the-french-designs.html,0
1865-02-01T00:03:58Z,European Mails.,https://www.nytimes.com/1865/02/01/news/european-mails.html,0
1865-02-01T00:03:58Z,Movements of European Steamers.; FROM AMERICA. For Havana and New-Orleans. For California.,https://www.nytimes.com/1865/02/01/news/movements-european-steamers-america-for-havana-new-orleans-for-california.html,0
1865-02-01T00:03:58Z,"Vagaries of Mr. Tibbetts He Claims that his Character has been Injured to the Extent of $64,000,000.; SUPREME COURT CHAMBERS. Before Justice Ingraham.",https://www.nytimes.com/1865/02/01/news/vagaries-mr-tibbetts-he-claims-that-his-character-has-been-injured-extent.html,0
1865-02-01T00:03:58Z,Brant's Indian Pulmonary Balsam; BRANT'S INDIAN PURIFYING EXTRACT.,https://www.nytimes.com/1865/02/01/news/brant-s-indian-pulmonary-balsam-brant-s-indian-purifying-extract.html,0
1865-02-01T00:03:58Z,Lecture by Henry Ward Beecher.,https://www.nytimes.com/1865/02/01/news/lecture-by-henry-ward-beecher.html,0
1865-02-01T00:03:58Z,Recent Decision of the Commissioner of Internal Revenue.,https://www.nytimes.com/1865/02/01/news/recent-decision-of-the-commissioner-of-internal-revenue.html,0
1865-02-01T00:03:58Z,GENERAL NEWS.,https://www.nytimes.com/1865/02/01/news/general-news.html,0
1865-02-01T00:03:58Z,NEW-JERSEY.; Camden and Amboy The Late Mr. Dayton.,https://www.nytimes.com/1865/02/01/news/new-jersey-camden-and-amboy-the-late-mr-dayton.html,0
1865-02-01T00:03:58Z,REPORTS FROM BALTIMORE.; SECOND DISPATCH.,https://www.nytimes.com/1865/02/01/news/reports-from-baltimore-second-dispatch.html,0
1865-02-01T00:03:58Z,[Extract.]; [Extract.],https://www.nytimes.com/1865/02/01/news/extract-extract.html,0
1865-02-01T00:03:58Z,GENERAL CITY NEWS.,https://www.nytimes.com/1865/02/01/news/general-city-news.html,0
1865-02-01T00:03:58Z,FROM EUROPE.,https://www.nytimes.com/1865/02/01/news/from-europe.html,0
1865-02-01T00:03:58Z,From San Francisco.,https://www.nytimes.com/1865/02/01/news/from-san-francisco.html,0
1865-02-01T00:03:58Z,Amusements.,https://www.nytimes.com/1865/02/01/news/amusements.html,0
1865-02-01T00:03:58Z,Meeting of Loyal Georgians A Card.,https://www.nytimes.com/1865/02/01/news/meeting-of-loyal-georgians-a-card.html,0
1865-02-01T00:03:58Z,"THE MORAL AND SOCIAL ASPECTS OF THE WAR IN THE SOUTH.; The Southern People Unwilling to Fight Longer Richmond Evidence of This The South Getting Rid of Delusions Character of Davis No Use in Peace Negotiations States Must Return, or there willbe Universal Confiscation.",https://www.nytimes.com/1865/02/01/news/moral-social-aspects-war-south-southern-people-unwilling-fight-longer-richmond.html,0
1865-02-01T00:03:58Z,STATE LEGISLATURE.,https://www.nytimes.com/1865/02/01/news/state-legislature.html,0
1865-02-01T00:03:58Z,THE PRISONERS IN THE SOUTH.; Richardson's Testimony Before the Committee on the Conduct of the War.,https://www.nytimes.com/1865/02/01/news/prisoners-south-richardson-s-testimony-before-committee-conduct-war.html,0
1865-02-01T00:03:58Z,"A World before is Worth Two After,""",https://www.nytimes.com/1865/02/01/news/a-world-before-is-worth-two-after.html,0
1865-02-01T00:03:58Z,POLAND.,https://www.nytimes.com/1865/02/01/news/poland.html,0
1865-02-01T00:03:58Z,FROM WASHINGTON.; ABOLITION OF SLAVERY. Passage of the Constitutional Amendment. One Hundred and Nineteen Yeas against Fifty-six Nays. Exciting Scene in the House. ENTHUSIASM OVER THE RESULT THE PEACE MISSION IN THE SENATE A Resolution Calling for Information. Passage of Retaliation Resolutions in the Senate.THE PASSAGE OF THE CONSTITUTIONAL AMENDMENT. PETITIONS OF THE NAVAL CONTRACTORS. THE TAX BILL. THE NAVAL DEPOT AT CLEVELAND. THE TRADE IN COTTON. THE VOTE ON THE AMENDMENT. MR. WADE ON THE PEACE MISSION. THE CIVIL GOVERNMENT OF VIRGINIA.,https://www.nytimes.com/1865/02/01/news/washington-abolition-slavery-passage-constitutional-amendment-one-hundred.html,0
1865-02-01T00:03:58Z,"Capt. Boggs, U.S.N.; PRESENTATION OF A TESTIMONIAL BY THE NEW-JERSEY LEGISLATURE.",https://www.nytimes.com/1865/02/01/news/capt-boggs-usn-presentation-of-a-testimonial-by-the-new-jersey-legislature.html,0
1865-02-01T00:03:58Z,Colgate's Honey Soap.,https://www.nytimes.com/1865/02/01/news/colgate-s-honey-soap.html,0
1865-02-01T00:03:58Z,THE BRAZILS.,https://www.nytimes.com/1865/02/01/news/the-brazils.html,0
1865-02-01T00:03:58Z,"Galvanized Yankees,""",https://www.nytimes.com/1865/02/01/news/galvanized-yankees.html,0
1865-02-01T00:03:58Z,Another Accident on the Hudson River Railroad Five Cars Smashed One Person Injured.,https://www.nytimes.com/1865/02/01/news/another-accident-hudson-river-railroad-five-cars-smashed-one-person-injured.html,0
1865-02-01T00:03:58Z,THIRTY-EIGHTH CONGRESS.; SECOND SESSION. SENATE. CLERGYMEN AND THE DRAFT. THE SCHELDT DUES. CONGRESSIONAL DIRECTORY. CALL FOR INFORMATION ON MR. BLAIR'S MISSION. SECRETARY WELLES INTERROGATED. NEW-YORK AND PACIFIC MAIL. THE BILL TO BRIDGE THE OHIO. THE PROPOSED COMMITTEE ON CORRUPTIONS. THE QUESTION OF RETALIATION.,https://www.nytimes.com/1865/02/01/news/thirty-eighth-congress-second-session-senate-clergymen-draft-scheldt-dues.html,0
1865-02-01T00:03:58Z,Cotton for Cincinnati.,https://www.nytimes.com/1865/02/01/news/cotton-for-cincinnati.html,0
1865-02-01T00:03:58Z,AUSTRIA.,https://www.nytimes.com/1865/02/01/news/austria.html,0
1865-02-01T00:03:58Z,Amusements this Evening.,https://www.nytimes.com/1865/02/01/news/amusements-this-evening.html,0
1865-02-01T00:03:58Z,FROM CITY POINT.; Imposing Military Execution near City Point Full Details of the Event Intensely Cold Weather Satisfaction Through the Army at the Efforts to Increase the Pay of Officers.,https://www.nytimes.com/1865/02/01/news/city-point-imposing-military-execution-near-city-point-full-details-event.html,0
1865-02-01T00:03:58Z,Departure of Domestic Mails.,https://www.nytimes.com/1865/02/01/news/departure-of-domestic-mails.html,0
1865-02-01T00:03:58Z,OUR ALBANY CORRESPONDENCE.; Passage of the Bounty Bill by the Senate What will be done in the Assembly.,https://www.nytimes.com/1865/02/01/news/our-albany-correspondence-passage-bounty-bill-senate-what-will-be-done-assembly.html,0
1865-02-01T00:03:58Z,Boston Bank Statement.,https://www.nytimes.com/1865/02/01/news/boston-bank-statement.html,0
1865-02-01T00:03:58Z,The Army of the Potomac.,https://www.nytimes.com/1865/02/01/news/the-army-of-the-potomac.html,0
1865-02-01T00:03:58Z,Arrival of the City of Cork The Peruvian's Mails via Portland at Hand Miscellaneous News.,https://www.nytimes.com/1865/02/01/news/arrival-city-cork-peruvian-s-mails-via-portland-hand-miscellaneous.html,0
1865-02-01T00:03:58Z,No Arrival yet from the James at Annapolis.,https://www.nytimes.com/1865/02/01/news/no-arrival-yet-from-the-james-at-annapolis.html,0
1865-02-01T00:03:58Z,FROM ILLINOIS.; A New Journal in Chicago The Proposed Removal of the Capital The Chicago Conspirators. POLITICAL. THE CHICAGO CONSPIRATORS. THE PEACE RUMORS. MILITARY. VARIOUS MATTERS.,https://www.nytimes.com/1865/02/01/news/illinois-new-journal-chicago-proposed-removal-capital-chicago-conspirators.html,0
1865-02-01T00:03:58Z,THE REBELLION.,https://www.nytimes.com/1865/02/01/news/the-rebellion.html,0
1865-02-01T00:03:58Z,STATE LEGISLATURE.; SENATE.,https://www.nytimes.com/1865/02/01/news/state-legislature-senate.html,0
1865-02-01T00:03:58Z,"THE ALBANY INVESTIGATING COMMITTEE.; CITY INSPECTOR'S DEPARTMENT. Testimony of Thomas N. Carr, Charles D. Blisch and Others. AFTERNOON SESSION.",https://www.nytimes.com/1865/02/01/news/albany-investigating-committee-city-inspector-s-department-testimony-thomas-n.html,0
1865-02-01T00:03:58Z,"The Seventy-ninth Regiment, Cameron Highlanders, New-York State Volunteers.",https://www.nytimes.com/1865/02/01/news/the-seventy-ninth-regiment-cameron-highlanders-new-york-state-volunteers.html,0
1865-02-01T00:03:58Z,The United States Christian Commission.,https://www.nytimes.com/1865/02/01/news/the-united-states-christian-commission.html,0
1865-02-01T00:03:58Z,Return of Mr. Singleton.,https://www.nytimes.com/1865/02/01/news/return-of-mr-singleton.html,0
1865-02-01T00:03:58Z,FROM HAVANA.; Arrival of the Havana Pirates Released Spanish Neutrality.,https://www.nytimes.com/1865/02/01/news/from-havana-arrival-of-the-havana-pirates-released-spanish-neutrality.html,0
1865-02-01T00:03:58Z,The Strong Divorce Suit.; SUPERIOR COURT CHAMBERS. Before Judge McCunn.,https://www.nytimes.com/1865/02/01/news/the-strong-divorce-suit-superior-court-chambers-before-judge-mccunn.html,0
1865-02-01T00:03:58Z,FREE FIGHT AMONG THE SUPERVISORS' CLERKS.,https://www.nytimes.com/1865/02/01/news/free-fight-among-the-supervisors-clerks.html,0
1865-02-01T00:03:58Z,Article 1 -- No Title,https://www.nytimes.com/1865/02/01/news/article-1-no-title.html,0
1865-02-01T00:03:58Z,"Participation.; MARKET INSURANCE COMPANY, No. 37 Wall-st. NOT IN ""THE RING,""",https://www.nytimes.com/1865/02/01/news/participation-market-insurance-company-no-37-wall-st-not-in-the-ring.html,0
1865-02-01T00:03:58Z,From Hilton Head.,https://www.nytimes.com/1865/02/01/news/from-hilton-head.html,0
1865-02-01T00:03:58Z,"MORE LETTERS FROM THE PEOPLE.; IF YOU WANT TO KNOW what people think of MEDICAL COMMON SENSE,",https://www.nytimes.com/1865/02/01/news/more-letters-people-if-you-want-know-what-people-think-medical-common-sense.html,0
1865-02-01T00:03:58Z,FROM GEN. GRANT'S LINES.; The Commissioners Appear in Front of Petersburgh--Application for a Permit to Come Through--Scenes under the Flag of Truce--Excitement among the Soldiers.,https://www.nytimes.com/1865/02/01/news/gen-grant-s-lines-commissioners-appear-front-petersburgh-application-for-permit.html,0
1865-02-01T00:03:58Z,The Abolition of Slavery.,https://www.nytimes.com/1865/02/01/news/the-abolition-of-slavery.html,0
1865-02-01T00:03:58Z,The Rebel Peace Commissioners.,https://www.nytimes.com/1865/02/01/news/the-rebel-peace-commissioners.html,0
1865-02-01T00:03:58Z,ASSEMBLY.,https://www.nytimes.com/1865/02/01/news/assembly.html,0
1865-02-02T00:03:58Z,RODDY SUBMITS.; He Receives a Pardon from the President.,https://www.nytimes.com/1865/02/02/news/roddy-submits-he-receives-a-pardon-from-the-president.html,0
1865-02-02T00:03:58Z,"FROM SAVANNAH.; Arrival of the Steamship Suwo Nada Destructive Fires in Savannah Fiendish Powder Plot. Sherman's Movements A Column Moving Against Augusta, Another Against Branchville, and a Third Against Charleston.",https://www.nytimes.com/1865/02/02/news/savannah-arrival-steamship-suwo-nada-destructive-fires-savannah-fiendish-powder.html,0
1865-02-02T00:03:58Z,Movements of European Steamers.,https://www.nytimes.com/1865/02/02/news/movements-of-european-steamers.html,0
1865-02-02T00:03:58Z,Mexico-Maximilian.,https://www.nytimes.com/1865/02/02/news/mexico-maximilian.html,1
1865-02-02T00:03:58Z,From New-Orleans.,https://www.nytimes.com/1865/02/02/news/from-new-orleans.html,0
1865-02-02T00:03:58Z,European Mails.,https://www.nytimes.com/1865/02/02/news/european-mails.html,0
1865-02-02T00:03:58Z,Obituary.,https://www.nytimes.com/1865/02/02/news/obituary.html,0
1865-02-02T00:03:58Z,BROOKLYN NEWS.,https://www.nytimes.com/1865/02/02/news/brooklyn-news.html,0
1865-02-02T00:03:58Z,CHARITABLE CONCERT.,https://www.nytimes.com/1865/02/02/news/charitable-concert.html,0
1865-02-02T00:03:58Z,From the Pacific Coast.,https://www.nytimes.com/1865/02/02/news/from-the-pacific-coast.html,0
1865-02-02T00:03:58Z,From Fortress Monroe.,https://www.nytimes.com/1865/02/02/news/from-fortress-monroe.html,0
1865-02-02T00:03:58Z,Dispatches to the Associated Press.; OFFICERS IN THE REGULAR ARMY. THE ARREST OF COL. WOLFORD. THE ARREST OF GOV. JACOBS. SEIZURE OF ARMS IN CALIFORNIA. THE UNITED STATES SUPREME COURT. THE NIAGARA SHIP CANAL. SERENADE TO SENATOR HENDERSON.,https://www.nytimes.com/1865/02/02/news/dispatches-associated-press-officers-regular-army-arrest-col-wolford-arrest-gov.html,0
1865-02-02T00:03:58Z,THE BOND-STREET HOMEOOPATHIC DISPENSARY.,https://www.nytimes.com/1865/02/02/news/the-bond-street-homeoopathic-dispensary.html,0
1865-02-02T00:03:58Z,THE QUOTA OF THE STATE.; Message of the Governor to the Legislature on the Subject of the Draft Patriotic Address to the People of the State.,https://www.nytimes.com/1865/02/02/news/quota-state-message-governor-legislature-subject-draft-patriotic-address-people.html,0
1865-02-02T00:03:58Z,For Havana and New-Orleans.,https://www.nytimes.com/1865/02/02/news/for-havana-and-new-orleans.html,0
1865-02-02T00:03:58Z,The Drift of Political Organizations.; THE NEW BIRTH OF DEMOCRACY.,https://www.nytimes.com/1865/02/02/news/the-drift-of-political-organizations-the-new-birth-of-democracy.html,0
1865-02-02T00:03:58Z,VISIT OF THE COMMITTEE OF THE SENATE TO...,https://www.nytimes.com/1865/02/02/news/visit-of-the-committee-of-the-senate-to.html,0
1865-02-02T00:03:58Z,Opening of a New Public Petroleum Exchange.,https://www.nytimes.com/1865/02/02/news/opening-of-a-new-public-petroleum-exchange.html,0
1865-02-02T00:03:58Z,The State Legislature and Gen. Grant.,https://www.nytimes.com/1865/02/02/news/the-state-legislature-and-gen-grant.html,0
1865-02-02T00:03:58Z,NEWS FROM WASHINGTON,https://www.nytimes.com/1865/02/02/news/news-from-washington.html,0
1865-02-02T00:03:58Z,THE REBELLION.,https://www.nytimes.com/1865/02/02/news/the-rebellion.html,0
1865-02-02T00:03:58Z,ASSEMBLY.; REPORTS. NOTICES. BILLS INTRODUCED.,https://www.nytimes.com/1865/02/02/news/assembly-reports-notices-bills-introduced.html,0
1865-02-02T00:03:58Z,The Bankrupt Bill Southern Statutes of Limitation.,https://www.nytimes.com/1865/02/02/news/the-bankrupt-bill-southern-statutes-of-limitation.html,0
1865-02-02T00:03:58Z,GANG OF BURGLARS CAPTURED.,https://www.nytimes.com/1865/02/02/news/gang-of-burglars-captured.html,0
1865-02-02T00:03:58Z,Arrest of a Sea Captain. &c.,https://www.nytimes.com/1865/02/02/news/arrest-of-a-sea-captain-c.html,0
1865-02-02T00:03:58Z,"COMMENTS OF THE REBEL PRESS.; Editorial from the Examiner. From the Richmond Sentinel, Jan. 30. From the Richmond Whig-Jan. 31. PEACE FEELING IN THE REBEL ARMY.",https://www.nytimes.com/1865/02/02/news/comments-rebel-press-editorial-examiner-richmond-sentinel-jan-30-richmond-whig.html,0
1865-02-02T00:03:58Z,Letter from Gen. Thomas A Testimonial Declined.,https://www.nytimes.com/1865/02/02/news/letter-from-gen-thomas-a-testimonial-declined.html,0
1865-02-02T00:03:58Z,The Missouri State Convention.,https://www.nytimes.com/1865/02/02/news/the-missouri-state-convention.html,0
1865-02-02T00:03:58Z,MINIATURE ALMANAC THIS DAY.,https://www.nytimes.com/1865/02/02/news/miniature-almanac-this-day.html,0
1865-02-02T00:03:58Z,Passengers Arrived.,https://www.nytimes.com/1865/02/02/news/passengers-arrived.html,0
1865-02-02T00:03:58Z,The Michigan Southern Company.,https://www.nytimes.com/1865/02/02/news/the-michigan-southern-company.html,0
1865-02-02T00:03:58Z,The Street Cleaning Commission.,https://www.nytimes.com/1865/02/02/news/the-street-cleaning-commission.html,0
1865-02-02T00:03:58Z,THE FIFTH-AVENUE SKATING POND.,https://www.nytimes.com/1865/02/02/news/the-fifth-avenue-skating-pond.html,0
1865-02-02T00:03:58Z,The Peace Commission.,https://www.nytimes.com/1865/02/02/news/the-peace-commission.html,0
1865-02-02T00:03:58Z,MARRIED.,https://www.nytimes.com/1865/02/02/news/married.html,0
1865-02-02T00:03:58Z,GENERAL NEWS.,https://www.nytimes.com/1865/02/02/news/general-news.html,0
1865-02-02T00:03:58Z,THE WASHINGTON TRAGEDY.; An Interview with Miss Harris Her Statement of Her Relations with the Deceased.,https://www.nytimes.com/1865/02/02/news/washington-tragedy-interview-with-miss-harris-her-statement-her-relations-with.html,0
1865-02-02T00:03:58Z,OUR ALBANY CORRESPONDENCE.; Rejoicings in Albany--The Constitutional Amendment--The Quota Under the Last Call--Confusion in the Bounty Bills.,https://www.nytimes.com/1865/02/02/news/our-albany-correspondence-rejoicings-albany-constitutional-amendment-quota-under.html,0
1865-02-02T00:03:58Z,NEW-JERSEY.,https://www.nytimes.com/1865/02/02/news/new-jersey.html,0
1865-02-02T00:03:58Z,THE SENATE INVESTIGATION.; THE INSPECTOR'S DEPARTMENT Adjournment of the Examination.,https://www.nytimes.com/1865/02/02/news/senate-investigation-inspector-s-department-adjournment-examination.html,0
1865-02-02T00:03:58Z,LATEST FROM THE ARMY LINES.,https://www.nytimes.com/1865/02/02/news/latest-from-the-army-lines.html,0
1865-02-02T00:03:58Z,CONGRESS,https://www.nytimes.com/1865/02/02/news/congress.html,0
1865-02-02T00:03:58Z,Board of Education.,https://www.nytimes.com/1865/02/02/news/board-of-education.html,0
1865-02-02T00:03:58Z,Massachusetts Action of Gev. Andrew.,https://www.nytimes.com/1865/02/02/news/massachusetts-action-of-gev-andrew.html,0
1865-02-02T00:03:58Z,STATE LEGISLATURE.; SENATE. PETITIONS PRESENTED. BILLS INTRODUCED. BILLS PASSED. BILLS REPORTED.,https://www.nytimes.com/1865/02/02/news/state-legislature-senate-petitions-presented-bills-introduced-bills-passed-bills.html,0
1865-02-02T00:03:58Z,Sale of a Newspaper.,https://www.nytimes.com/1865/02/02/news/sale-of-a-newspaper.html,0
1865-02-02T00:03:58Z,The Battle of Chickamauga A Letter from Gen. Rosecrans.,https://www.nytimes.com/1865/02/02/news/the-battle-of-chickamauga-a-letter-from-gen-rosecrans.html,0
1865-02-02T00:03:58Z,"For New-Orleans, the West Indies.",https://www.nytimes.com/1865/02/02/news/for-new-orleans-the-west-indies.html,0
1865-02-02T00:03:58Z,From Albany.,https://www.nytimes.com/1865/02/02/news/from-albany.html,0
1865-02-02T00:03:58Z,Amusements this Evening.,https://www.nytimes.com/1865/02/02/news/amusements-this-evening.html,0
1865-02-02T00:03:58Z,A.A. Provost-Martial-General Hays Relieved.,https://www.nytimes.com/1865/02/02/news/aa-provost-martial-general-hays-relieved.html,0
1865-02-02T00:03:58Z,From Havana Arrival of the Steamship Columbia.,https://www.nytimes.com/1865/02/02/news/from-havana-arrival-of-the-steamship-columbia.html,0
1865-02-02T00:03:58Z,NEW-JERSEY.; The Camden and Amboy Monopoly The People's Convention at Trenton.,https://www.nytimes.com/1865/02/02/news/new-jersey-the-camden-and-amboy-monopoly-the-people-s-convention-at-trenton.html,0
1865-02-02T00:03:58Z,HOUSE OF REPRESENTATIVES.; THE NIAGARA SHIP CANAL.,https://www.nytimes.com/1865/02/02/news/house-of-representatives-the-niagara-ship-canal.html,0
1865-02-02T00:03:58Z,THIRTY-EIGHTH CONGRESS.; SECOND SESSION. SENATE. TAXING IMPORTS. PETITION FOR THE CREATION OF A NEW BANK. SALARIES OF DISTRICT JUDGES. THE NEVADA COURTS. THANKS TO GEN. SHERIDAN. GENERAL APPROPRIATION BILL. SALARIES OF MEMBERS OF CONGRESS. STATES NOT ENTITLED TO ELECTORAL VOTES. THE SENATORS FROM NEVADA. NATIONAL BANKING ASSOCIATIONS. CLASSIFICATION OF THE NEVADA SENATORS. MR. TRUMBULL'S RESOLUTION AGAIN. ADJOURNMENT.,https://www.nytimes.com/1865/02/02/news/thirty-eighth-congress-second-session-senate-taxing-imports-petition-for.html,0
1865-02-02T00:03:58Z,THE PEACE SITUATION.; Last Position of the Rebel Commissioners. Still in Front of Our Pickets on Tuesday Morning. Departure of Secretary Seward for City Point. THE PEACE QUESTION IN RICHMOND. Consternation of the Rebel Press. They Fear they Will be Caught Napping. PEACE ALONG THE ARMY LINES. Exciting Scenes Among the Soldiers. DISPATCH TO THE ASSOCIATED PRESS. THE EXCITEMENT IN WASHINGTON.,https://www.nytimes.com/1865/02/02/news/peace-situation-last-position-rebel-commissioners-still-front-our-pickets.html,0
1865-02-02T00:03:58Z,THE PENDING DRAFT.; Address of Gov. Fenton to the People of the State.,https://www.nytimes.com/1865/02/02/news/the-pending-draft-address-of-gov-fenton-to-the-people-of-the-state.html,0
1865-02-02T00:03:58Z,THE CONSTITUTIONAL AMENDMENT.; The Constitutional Amendment in Maryland.,https://www.nytimes.com/1865/02/02/news/the-constitutional-amendment-the-constitutional-amendment-in-maryland.html,0
1865-02-02T00:03:58Z,The Perils and Glories of Democracy Our Brazilian Relations.,https://www.nytimes.com/1865/02/02/news/the-perils-and-glories-of-democracy-our-brazilian-relations.html,0
1865-02-02T00:03:58Z,OUR NEW-ORLEANS CORRESPONDENCE.; Gen. Banks The Plantation and the Laborers Trade Regulations with the South.,https://www.nytimes.com/1865/02/02/news/our-new-orleans-correspondence-gen-banks-plantation-laborers-trade-regulations.html,0
1865-02-02T00:03:58Z,STATE LEGISLATURE,https://www.nytimes.com/1865/02/02/news/state-legislature.html,0
