pub_date,main_headline,article_url,classification
1865-02-14T00:03:58Z,NEW-JERSEY.,https://www.nytimes.com/1865/02/14/news/new-jersey.html,0
1865-02-14T00:03:58Z,HOUSE OF REPRESENTATIVES.; MR. POWELL'S NAVAL PICTURE. EXPORT DUTIES. THE FREEDMEN'S RELIEF ASSOCIATION. PEACE RESOLUTION WAR RESOLUTIONS. THE AMENDATORY REVENUE BILL.,https://www.nytimes.com/1865/02/14/news/house-representatives-mr-powell-s-naval-picture-export-duties-freedmen-s-relief.html,0
1865-02-14T00:03:58Z,The People of Savannah and Our Military Officers.,https://www.nytimes.com/1865/02/14/news/the-people-of-savannah-and-our-military-officers.html,0
1865-02-14T00:03:58Z,For California.,https://www.nytimes.com/1865/02/14/news/for-california.html,0
1865-02-14T00:03:58Z,Departure of Domestic Malls.,https://www.nytimes.com/1865/02/14/news/departure-of-domestic-malls.html,0
1865-02-14T00:03:58Z,GENERAL MARKETS.,https://www.nytimes.com/1865/02/14/news/general-markets.html,0
1865-02-14T00:03:58Z,CONGRESS.,https://www.nytimes.com/1865/02/14/news/congress.html,0
1865-02-14T00:03:58Z,"HENRY S. FOOTE GONE TO EUROPE.; 'Hebson's Choice"" Presented Him His Views of the Rebel Situation The ""Confederacy"" on the Eve of Disruption ""Rats Leaving the Sinking Ship"" The Late Peace Conference A Scrap of Personal History.",https://www.nytimes.com/1865/02/14/news/henry-s-foote-gone-europe-hebson-s-choice-presented-him-his-views-rebel.html,0
1865-02-14T00:03:58Z,DIED.,https://www.nytimes.com/1865/02/14/news/died.html,0
1865-02-14T00:03:58Z,TWO SIDES TO THE CASE. A distinguished,https://www.nytimes.com/1865/02/14/news/two-sides-to-the-case-a-distinguished.html,0
1865-02-14T00:03:58Z,Board of Aldermen.,https://www.nytimes.com/1865/02/14/news/board-of-aldermen.html,0
1865-02-14T00:03:58Z,"BOUNTY BROKERAGE FRAUDS.; A CITY PROVOST-MARSHAL IN TROUBLE. SWINDLING IN HIGH PLACES. A Bounty-Broker Offers Six Thousand Dollars for a Parole, INTERESTING SCENES AND INCIDENTS. Col. Baker Run Down by Visitors He is Attacked in New Chambers-street, but takes His Prisoner. Interesting Affidavits, &c, BOUNTY BROKERAGE FRAUDS.",https://www.nytimes.com/1865/02/14/news/bounty-brokerage-frauds-city-provost-marshal-trouble-swindling-high-places.html,0
1865-02-14T00:03:58Z,Fire.,https://www.nytimes.com/1865/02/14/news/fire.html,0
1865-02-14T00:03:58Z,Supreme Court-Chambers.,https://www.nytimes.com/1865/02/14/news/supreme-court-chambers.html,0
1865-02-14T00:03:58Z,THE REBELLION.,https://www.nytimes.com/1865/02/14/news/the-rebellion.html,0
1865-02-14T00:03:58Z,AFFAIRS AT ALBANY.; Business Progressing The Union League Club Removing the Fare Restriction on the Railroads.,https://www.nytimes.com/1865/02/14/news/affairs-albany-business-progressing-union-league-club-removing-fare-restriction.html,0
1865-02-14T00:03:58Z,Relief for Contractors.,https://www.nytimes.com/1865/02/14/news/relief-for-contractors.html,0
1865-02-14T00:03:58Z,THIRTY-EIGHTH CONGRESS.; SECOND SESSION. SENATE.,https://www.nytimes.com/1865/02/14/news/thirty-eighth-congress-second-session-senate.html,0
1865-02-14T00:03:58Z,EMANCIPATION IN KENTUCKY.; Gov. Bramlette's Message to the Legislature. ARTICLE III.,https://www.nytimes.com/1865/02/14/news/emancipation-in-kentucky-gov-bramlette-s-message-to-the-legislature-article-iii.html,0
1865-02-15T00:03:58Z,STATE LEGISLATURE.,https://www.nytimes.com/1865/02/15/news/state-legislature.html,0
1865-02-15T00:03:58Z,PERSONAL The telegraph operators of the...,https://www.nytimes.com/1865/02/15/news/personal-the-telegraph-operators-of-the.html,0
1865-02-15T00:03:58Z,CONGRESS.,https://www.nytimes.com/1865/02/15/news/congress.html,0
1865-02-15T00:03:58Z,Passengers Arrived.,https://www.nytimes.com/1865/02/15/news/passengers-arrived.html,0
1865-02-15T00:03:58Z,Another Candidate for Secretary of the Treasury.,https://www.nytimes.com/1865/02/15/news/another-candidate-for-secretary-of-the-treasury.html,0
1865-02-15T00:03:58Z,Complaint Against a Provost-Marshal's Office.,https://www.nytimes.com/1865/02/15/news/complaint-against-a-provost-marshal-s-office.html,0
1865-02-15T00:03:58Z,The State Capital.,https://www.nytimes.com/1865/02/15/news/the-state-capital.html,0
1865-02-15T00:03:58Z,SECOND LETTER.; Increase of Insane Patients Their Destitution a Disgrace to Our Country The Remedy.,https://www.nytimes.com/1865/02/15/news/second-letter-increase-insane-patients-their-destitution-disgrace-our-country.html,0
1865-02-15T00:03:58Z,MARINE INTELLIGENCE.; Cleared. Arrived. Foreign Ports.,https://www.nytimes.com/1865/02/15/news/marine-intelligence-cleared-arrived-foreign-ports.html,0
1865-02-15T00:03:58Z,From Louisville Guerrillas Routed.,https://www.nytimes.com/1865/02/15/news/from-louisville-guerrillas-routed.html,0
1865-02-15T00:03:58Z,A Glance at Our Future.,https://www.nytimes.com/1865/02/15/news/a-glance-at-our-future.html,0
1865-02-15T00:03:58Z,"Firing the Southern Heart.""",https://www.nytimes.com/1865/02/15/news/firing-the-southern-heart.html,0
1865-02-15T00:03:58Z,The Bounty-Brokerage Frauds.,https://www.nytimes.com/1865/02/15/news/the-bounty-brokerage-frauds.html,0
1865-02-15T00:03:58Z,The Lazarus Murder.; COURT OF GENERAL SESSIONS. Before Recorder Hoffman.,https://www.nytimes.com/1865/02/15/news/the-lazarus-murder-court-of-general-sessions-before-recorder-hoffman.html,0
1865-02-15T00:03:58Z,HOUSE OF REPRESENTATIVES.; TERMS OF ENLISTMENT. THE GREEN BAY AND LAKE MICHIGAN SHIP CANAL. EXTENSION OF TIME. THE AMENDATORY INTERNAL REVENUE BILL.,https://www.nytimes.com/1865/02/15/news/house-representatives-terms-enlistment-green-bay-lake-michigan-ship-canal.html,0
1865-02-15T00:03:58Z,THE CITY GOVERNMENT.; [OFFICIAL.] BOARD OF COUNCILMEN. BILL. PETITION. COMMUNICATION. INVITATION. MOTION. MOTIONS RESUMED.,https://www.nytimes.com/1865/02/15/news/city-government-official-board-councilmen-bill-petition-communication-invitation.html,0
1865-02-15T00:03:58Z,NEWS FROM WASHINGTON.; MR. FESSENDEN'S FINANCE BILL. THE SECRETARY OF THE TREASURY. THE LOUISIANA ELECTION. MILITARY NOMINATIONS.,https://www.nytimes.com/1865/02/15/news/washington-mr-fessenden-s-finance-bill-secretary-treasury-louisiana-election.html,0
1865-02-15T00:03:58Z,NEWS FROM REBEL SOURCES.; THE REBELS WILL ARM THE NEGROES. MOVEMENT OF UNION TROOPS.,https://www.nytimes.com/1865/02/15/news/news-from-rebel-sources-the-rebels-will-arm-the-negroes-movement-of-union-troops.html,0
1865-02-15T00:03:58Z,Supreme Court Trial Term; Before Justice Johnson.,https://www.nytimes.com/1865/02/15/news/supreme-court-trial-term-before-justice-johnson.html,0
1865-02-15T00:03:58Z,THIRTY-EIGHTH CONGRESS.; SECOND SESSION. SENATE. CIVIL APPOINTMENTS FOR DISCHRAGED SOLDIERS AND SAILORS.,https://www.nytimes.com/1865/02/15/news/thirty-eighth-congress-second-session-senate-civil-appointments-for-dischraged.html,0
1865-02-15T00:03:58Z,The St. Albans Raiders.,https://www.nytimes.com/1865/02/15/news/the-st-albans-raiders.html,0
1865-02-15T00:03:58Z,"REBEL REPORTS.; From the Richmond Dispatch, Feb. 11.",https://www.nytimes.com/1865/02/15/news/rebel-reports-from-the-richmond-dispatch-feb-11.html,0
1865-02-15T00:03:58Z,NEW BOOKS.,https://www.nytimes.com/1865/02/15/news/new-books.html,0
1865-02-15T00:03:58Z,Intercepted Letter of John A. Campbell His Views on Peace Last September.,https://www.nytimes.com/1865/02/15/news/intercepted-letter-of-john-a-campbell-his-views-on-peace-last-september.html,0
1865-02-15T00:03:58Z,INSANITY IN AMERICA.; Views of a Distinguished Foreign Savant. The Rebellion Its Effects on the Nations Mind North and South.,https://www.nytimes.com/1865/02/15/news/insanity-america-views-distinguished-foreign-savant-rebellion-its-effects.html,0
1865-02-15T00:03:58Z,Winding up the War.,https://www.nytimes.com/1865/02/15/news/winding-up-the-war.html,0
1865-02-15T00:03:58Z,An Ingenious Method of Counterfeiting the Postal Currency.; UNITED STATES COMMISSIONER'S OFFICE. Before Commissioner Osborn.,https://www.nytimes.com/1865/02/15/news/ingenious-method-counterfeiting-postal-currency-united-states-commissioner-s.html,0
1865-02-15T00:03:58Z,DEPARTMENT OF THE GULF.; Evacuation of Pascagonia by Our Troops.,https://www.nytimes.com/1865/02/15/news/department-of-the-gulf-evacuation-of-pascagonia-by-our-troops.html,0
1865-02-15T00:03:58Z,The Last Hours of Ex-Gov. Hicks.,https://www.nytimes.com/1865/02/15/news/the-last-hours-of-ex-gov-hicks.html,0
1865-02-15T00:03:58Z,Amusements this Evening.,https://www.nytimes.com/1865/02/15/news/amusements-this-evening.html,0
1865-02-15T00:03:58Z,Closing Exercises of the Fifth Ward Evening School.,https://www.nytimes.com/1865/02/15/news/closing-exercises-of-the-fifth-ward-evening-school.html,0
1865-02-15T00:03:58Z,The Draft in Kings County and their Quotas.,https://www.nytimes.com/1865/02/15/news/the-draft-in-kings-county-and-their-quotas.html,0
1865-02-15T00:03:58Z,FROM THE PACIFIC COAST.; Arrival of the Ocean Queen.,https://www.nytimes.com/1865/02/15/news/from-the-pacific-coast-arrival-of-the-ocean-queen.html,0
1865-02-15T00:03:58Z,THE PEACE CONFERENCE. The World has the following:,https://www.nytimes.com/1865/02/15/news/the-peace-conference-the-world-has-the-following.html,0
1865-02-15T00:03:58Z,"BEALL, THE PIRATE AND SPY.; Proceedings and Sentence of the Court-Martail The Prisoner to be Hung next Saturday Gen. Dix's Order for the Execution Complete History of the Case The Trial of the Rebel Captain Kennedy. THE CASE OF CAPT. KENNEDY.",https://www.nytimes.com/1865/02/15/news/beall-pirate-spy-proceedings-sentence-court-martail-prisoner-be-hung-next.html,0
1865-02-15T00:03:58Z,FROM CITY POINT.,https://www.nytimes.com/1865/02/15/news/from-city-point.html,0
1865-02-15T00:03:58Z,SHERMAN'S CAMPAIGN.; The Army Steadily Advancing.THE EDISTO RIVER CROSSED.Movement on Columbia the capital of South Carolina.THE REBELS FALL BACK GENERALLY.All the Leading Railroads Severed.REBEL ADMISSIONS AND FEARS.,https://www.nytimes.com/1865/02/15/news/sherman-s-campaign-army-steadily-advancingthe-edisto-river-crossedmovement.html,0
1865-02-15T00:03:58Z,"List of Deaths in United States, General Hospital, Fortress Monroe, Va., During the Week Ending Feb. 11.",https://www.nytimes.com/1865/02/15/news/list-deaths-united-states-general-hospital-fortress-monroe-va-during-week-ending.html,0
1865-02-15T00:03:58Z,Reorganization of the County Clerk's Department.,https://www.nytimes.com/1865/02/15/news/reorganization-of-the-county-clerk-s-department.html,0
1865-02-15T00:03:58Z,BROOKLYN NEWS.,https://www.nytimes.com/1865/02/15/news/brooklyn-news.html,0
1865-02-15T00:03:58Z,STATE LEGISLATURE.; SENATE. PETITIONS. BILLS REPORTED. BILLS NOTICED. BILLS INTRODUCED. BILLS PASSED. ASSEMBLY. BILLS ORDERED TO A THIRD READING.,https://www.nytimes.com/1865/02/15/news/state-legislature-senate-petitions-bills-reported-bills-noticed-bills-introduced.html,0
1865-02-15T00:03:58Z,SHERMAN'S CAMPAIGN. The rebels are,https://www.nytimes.com/1865/02/15/news/sherman-s-campaign-the-rebels-are.html,0
1865-02-15T00:03:58Z,Union General Committee.,https://www.nytimes.com/1865/02/15/news/union-general-committee.html,0
1865-02-15T00:03:58Z,Evening Exchange.,https://www.nytimes.com/1865/02/15/news/evening-exchange.html,0
1865-02-15T00:03:58Z,THE DRAFT.; Progress of Enlistments The Bounty Fund Loan.,https://www.nytimes.com/1865/02/15/news/the-draft-progress-of-enlistments-the-bounty-fund-loan.html,0
1865-02-15T00:03:58Z,Amusements.,https://www.nytimes.com/1865/02/15/news/amusements.html,0
1865-02-15T00:03:58Z,NEW-JERSEY.,https://www.nytimes.com/1865/02/15/news/new-jersey.html,0
1865-02-15T00:03:58Z,Marine Disaster.,https://www.nytimes.com/1865/02/15/news/marine-disaster.html,0
1865-02-15T00:03:58Z,Missouri Affairs.,https://www.nytimes.com/1865/02/15/news/missouri-affairs.html,0
1865-02-15T00:03:58Z,"Movements of European Steamers.; FROM AMERICA. FROM EUROPE. For Havana and New-Orleans. For California. European Mails. For New-Orleans, Havana, &c. Departure of Domestic Mails.",https://www.nytimes.com/1865/02/15/news/movements-european-steamers-america-europe-for-havana-new-orleans-for-california.html,0
1865-02-15T00:03:58Z,Jefferson Davis Abraham Lincoln.,https://www.nytimes.com/1865/02/15/news/jefferson-davis-abraham-lincoln.html,0
1865-02-15T00:03:58Z,AFFAIRS AT ALBANY.; The Senate Refuses to Take a Recess The Matter Likely to be Fixed Health Bill Railroad Matters.,https://www.nytimes.com/1865/02/15/news/affairs-albany-senate-refuses-take-recess-matter-likely-be-fixed-health-bill.html,0
1865-02-15T00:03:58Z,GENERAL MARKET.,https://www.nytimes.com/1865/02/15/news/general-market.html,0
1865-02-15T00:03:58Z,Williamsburgh.,https://www.nytimes.com/1865/02/15/news/williamsburgh.html,0
1865-02-15T00:03:58Z,Naval Movements.; ARRIVAL OF THE SUWANEE. PRIZES READY FOR DISTRIBUTIONS THE WASHINGTON NAVY-YARD. THE PROPOSED NAVY-YARD ON THE LAKES.,https://www.nytimes.com/1865/02/15/news/naval-movements-arrival-suwanee-prizes-ready-for-distributions-washington-navy.html,0
1865-02-15T00:03:58Z,DIED.,https://www.nytimes.com/1865/02/15/news/died.html,0
1865-02-15T00:03:58Z,PANAMA.; The Right of Transit Across the Isthmus The Cathedral at Panama Gen. Sickles Miscellaneous. [INSTRUCTIONS.],https://www.nytimes.com/1865/02/15/news/panama-right-transit-across-isthmus-cathedral-panama-gen-sickles-miscellaneous.html,0
1865-02-15T00:03:58Z,"LAW REPORTS.; Court Calendar THIS DAY. Supreme Court Circuit. The Express Case, NEW-YORK COMMON PLEAS CHAMBERS.",https://www.nytimes.com/1865/02/15/news/law-reports-court-calendar-this-day-supreme-court-circuit-express-case-new-york.html,0
1865-02-15T00:03:58Z,MARRIED.,https://www.nytimes.com/1865/02/15/news/married.html,0
1865-02-15T00:03:58Z,GENERAL NEWS.,https://www.nytimes.com/1865/02/15/news/general-news.html,0
1865-02-15T00:03:58Z,"Burning of the United States Laboratory at Astoria Loss $60,000 Large Quality of Drugs Destroyed.",https://www.nytimes.com/1865/02/15/news/burning-united-states-laboratory-astoria-loss-60000-large-quality-drugs.html,0
1865-02-15T00:03:58Z,The Overland European Telegraph.; PREPRATIONS FOR THE CONSTRUCTION OF THE LINE VIA BEHRINGS STRAITS.,https://www.nytimes.com/1865/02/15/news/overland-european-telegraph-preprations-for-construction-line-via-behrings.html,0
1865-02-15T00:03:58Z,"OPERATIONS OF THE COAST.; Expeditions Under Lieut. Cushing to Little River Lulet, S.C., and Lockwood's Folly Lulet, N.C.",https://www.nytimes.com/1865/02/15/news/operations-coast-expeditions-under-lieut-cushing-little-river-lulet-sc-lockwood.html,0
1865-02-15T00:03:58Z,GENERAL CITY NEWS.,https://www.nytimes.com/1865/02/15/news/general-city-news.html,0
1865-02-15T00:03:58Z,"The Quota for Hudson County, N.J.",https://www.nytimes.com/1865/02/15/news/the-quota-for-hudson-county-nj.html,0
1865-02-15T00:03:58Z,AFFAIRS AT FORTRESS MONROE.; An Arrival from Fort Fisher Rebel Prisoners for Exchange Gen. Grant Again Gone to the Front Promotion of Col. Dodge.,https://www.nytimes.com/1865/02/15/news/affairs-fortress-monroe-arrival-fort-fisher-rebel-prisoners-for-exchange-gen.html,0
1865-02-15T00:03:58Z,Dispatches to the Associated Press.; CONFIRMATIONS. A PRIZE CASE.,https://www.nytimes.com/1865/02/15/news/dispatches-to-the-associated-press-confirmations-a-prize-case.html,0
1865-02-15T00:03:58Z,From Omaha.,https://www.nytimes.com/1865/02/15/news/from-omaha.html,0
1865-02-15T00:03:58Z,ANOTHER DISPATCH.,https://www.nytimes.com/1865/02/15/news/another-dispatch.html,0
1865-02-15T00:03:58Z,CENTRAL AND SOUTH AMERICA.; The Discussion Between Costa Rica and Salvador The Spanish-Peruvian Question Settled. HONDURAS. SOUTH AMERICA. CHILI.,https://www.nytimes.com/1865/02/15/news/central-south-america-discussion-between-costa-rica-salvador-spanish-peruvian.html,0
1865-02-15T00:03:58Z,The Cotton Fleet.; THE VESSELS ON THEIR WAY TO THIS PORT.,https://www.nytimes.com/1865/02/15/news/the-cotton-fleet-the-vessels-on-their-way-to-this-port.html,0
1865-02-15T00:03:58Z,THE REBELLION.,https://www.nytimes.com/1865/02/15/news/the-rebellion.html,0
1865-02-15T00:03:58Z,The Seven-Thirty Loan.,https://www.nytimes.com/1865/02/15/news/the-seven-thirty-loan.html,0
1865-02-15T00:03:58Z,New-Jersey Legislature.,https://www.nytimes.com/1865/02/15/news/new-jersey-legislature.html,0
1865-02-16T00:03:58Z,The Central American Troubles San Salvador and Costa Rica A Presidential Message.,https://www.nytimes.com/1865/02/16/news/the-central-american-troubles-san-salvador-and-costa-rica-a-presidential-message.html,0
1865-02-16T00:03:58Z,Sherman's Great Campaign Through South Carolina Its Progress and Triumph.,https://www.nytimes.com/1865/02/16/news/sherman-s-great-campaign-through-south-carolina-its-progress-and-triumph.html,0
1865-02-16T00:03:58Z,CONGRESS.,https://www.nytimes.com/1865/02/16/news/congress.html,0
1865-02-16T00:03:58Z,STATE LEGISLATURE.,https://www.nytimes.com/1865/02/16/news/state-legislature.html,0
1865-02-16T00:03:58Z,"THE FREE STATE OF TENNESSEE.; Detailed Account of Its Resources, Climates, Productions, Manufactures, Railroad System, &c., &c.",https://www.nytimes.com/1865/02/16/news/free-state-tennessee-detailed-account-its-resources-climates-productions.html,1
1865-02-16T00:03:58Z,The Count Johannes.; COMMON PLEAS TRIAL TERM.,https://www.nytimes.com/1865/02/16/news/the-count-johannes-common-pleas-trial-term.html,0
1865-02-16T00:03:58Z,The Office Hours of the Eighth District Prevost Marshal.,https://www.nytimes.com/1865/02/16/news/the-office-hours-of-the-eighth-district-prevost-marshal.html,0
1865-02-16T00:03:58Z,"The Recent Capture Mobley, Payne and Mackenzie Promotions Deaths.; Howell Cobb's Early Expectations as to the Duration of the War.",https://www.nytimes.com/1865/02/16/news/recent-capture-mobley-payne-mackenzie-promotions-deaths-howell-cobb-s-early.html,0
1865-02-16T00:03:58Z,The Trial of Bernard Friary.; COURT OF GENERAL SESSIONS. Before Recorder Hoffman.,https://www.nytimes.com/1865/02/16/news/the-trial-of-bernard-friary-court-of-general-sessions-before-recorder-hoffman.html,0
1865-02-16T00:03:58Z,"THE QUOTA OF THE STATE.; Remarks of Mr. Andrews, on an Erroneous Claim of a Committee of the New-York Supervisors.",https://www.nytimes.com/1865/02/16/news/quota-state-remarks-mr-andrews-erroneous-claim-committee-new-york-supervisors.html,0
1865-02-16T00:03:58Z,THE REBELLION.,https://www.nytimes.com/1865/02/16/news/the-rebellion.html,0
1865-02-16T00:03:58Z,ROBBED BY A HYPOCRITE.,https://www.nytimes.com/1865/02/16/news/robbed-by-a-hypocrite.html,0
1865-02-16T00:03:58Z,The Patriot Orphan Home.,https://www.nytimes.com/1865/02/16/news/the-patriot-orphan-home.html,0
1865-02-16T00:03:58Z,"BEALL, THE PIRATE AND SPY.; Revelations Concerning His Arrest and Identification. His Attempt to Bribe Our Detective Police, &c.",https://www.nytimes.com/1865/02/16/news/beall-pirate-spy-revelations-concerning-his-arrest-identification-his-attempt.html,0
1865-02-16T00:03:58Z,Railroad Accident.; THREE CARS THROWN OFF THE NEW-HAVEN TRACK NEAR WESTPORT.,https://www.nytimes.com/1865/02/16/news/railroad-accident-three-cars-thrown-off-the-new-haven-track-near-westport.html,0
1865-02-16T00:03:58Z,DIED.,https://www.nytimes.com/1865/02/16/news/died.html,0
1865-02-16T00:03:58Z,Our Agricultural Progress.,https://www.nytimes.com/1865/02/16/news/our-agricultural-progress.html,0
1865-02-16T00:03:58Z,Amusements.,https://www.nytimes.com/1865/02/16/news/amusements.html,0
1865-02-16T00:03:58Z,Petroleum.,https://www.nytimes.com/1865/02/16/news/petroleum.html,0
1865-02-16T00:03:58Z,THE BROKEN-DOWN CONFEDERACY.,https://www.nytimes.com/1865/02/16/news/the-broken-down-confederacy.html,0
1865-02-16T00:03:58Z,Union State Convention of Connecticut.; RENOMINATION OF GOV. BUCKINGHAM.,https://www.nytimes.com/1865/02/16/news/union-state-convention-of-connecticut-renomination-of-gov-buckingham.html,0
1865-02-16T00:03:58Z,Passengers Arrived.,https://www.nytimes.com/1865/02/16/news/passengers-arrived.html,0
1865-02-16T00:03:58Z,"MARINE INTELLIGENCE.; Cleared. Arrived. Spoken, &c. Foreign Ports.",https://www.nytimes.com/1865/02/16/news/marine-intelligence-cleared-arrived-spoken-c-foreign-ports.html,0
1865-02-16T00:03:58Z,FROM EUROPE.,https://www.nytimes.com/1865/02/16/news/from-europe.html,0
1865-02-16T00:03:58Z,Court Calendar THIS DAY.,https://www.nytimes.com/1865/02/16/news/court-calendar-this-day.html,0
1865-02-16T00:03:58Z,"SOUTH CAROLINA.; SHERMAN'S SUCCESSFUL PROGRESS Operations of the Right Wing Along the Coast. A Ledgment made within Two Miles of Charleston. Advance of Gen. Howard along the Savannah Railroad. Capture of a Strong Line of works on the Salkehatchie. Movements of the Right Wing in the Interior. The Edisto River Crossed by Gen. Slocum. Orangeburg Occupied and Branchville Flanked. Doubtful Reports of Rebel Preparations. Beauregard and the Remnant of Hoad's Army Said to be Opposing Sherman. SHERMAN'S RIGHT WING. OUR HILTON HEAD CORRESPONDENCE. Gen. Sherman's Advance--Passage of the Salkehatchie--Gen. Gillmore Succeeds Foster--The Cotton Fleet. REBEL REPORTS. SHERMAN'S LEFT WING. REPORTS VIA PHILADELPHIA. REBEL REPORTS. REPORTS VIA PORT ROYAL. A STRONG LIFE OF EARTHWORKS CAPTURED ON THE SALKEHATCHIE. NEWS FROM REBEL SOURCES. THE EXCHANGE OF PRISONERS. A RAID BY REBELLIOUS REBELS. A UNION FORCE IN STAFFORD COUNTY, VA. MOVEMENTS AGAINST MOBILE.",https://www.nytimes.com/1865/02/16/news/south-carolina-sherman-s-successful-progress-operations-right-wing-along-coast.html,0
1865-02-16T00:03:58Z,No Signs of the Asia.,https://www.nytimes.com/1865/02/16/news/no-signs-of-the-asia.html,0
1865-02-16T00:03:58Z,"JOHN STUART MILL.; Dissertations and Discussions, Political, Philosophical and Historical, by John Stuart Mill 3 Vols. 12mo. Boston; Wm. V. Spencer.",https://www.nytimes.com/1865/02/16/news/john-stuart-mill-dissertations-discussions-political-philosophical-historical.html,0
1865-02-16T00:03:58Z,European Mails.,https://www.nytimes.com/1865/02/16/news/european-mails.html,0
1865-02-16T00:03:58Z,NEWS FROM WASHINGTON.; MR. FESSENDEN'S SUCCESSOR.,https://www.nytimes.com/1865/02/16/news/news-from-washington-mr-fessenden-s-successor.html,0
1865-02-16T00:03:58Z,For Havana and New-Orleans.,https://www.nytimes.com/1865/02/16/news/for-havana-and-new-orleans.html,0
1865-02-16T00:03:58Z,Movements of European Steamers.,https://www.nytimes.com/1865/02/16/news/movements-of-european-steamers.html,0
1865-02-16T00:03:58Z,The Storage of Petroleum Proposed Action of the Authorities.; Suicide of an Alleged Confederate Agent.,https://www.nytimes.com/1865/02/16/news/storage-petroleum-proposed-action-authorities-suicide-alleged-confederate-agent.html,0
1865-02-16T00:03:58Z,THIRTY-EIGHTH CONGRESS.; SECOND SESSION. SENATE. THE DEATH OF SENATOR HICKS. HOUSE OF REPRESENTATIVES.,https://www.nytimes.com/1865/02/16/news/thirty-eighth-congress-second-session-senate-death-senator-hicks-house.html,0
1865-02-16T00:03:58Z,AFFAIRS AT ALBANY.; The Recess a Fixed Fact The Broadway Tunnel Railroad The Niagara Fulls Ship Canal. STATE LEGISLATURE. SENATE. ASSEMBLY. Paid Fire Department Report of the Majority Committee.,https://www.nytimes.com/1865/02/16/news/affairs-albany-recess-fixed-fact-broadway-tunnel-railroad-niagara-fulls-ship.html,0
1865-02-16T00:03:58Z,"Immense Sales of ""Seven-Thirties.""",https://www.nytimes.com/1865/02/16/news/immense-sales-of-seven-thirties.html,0
1865-02-16T00:03:58Z,City Railroad Accidents How to Prevent Them.,https://www.nytimes.com/1865/02/16/news/city-railroad-accidents-how-to-prevent-them.html,0
1865-02-16T00:03:58Z,GENERAL NEWS.,https://www.nytimes.com/1865/02/16/news/general-news.html,0
1865-02-16T00:03:58Z,Semi-Annual Exhibition of Columbia College.,https://www.nytimes.com/1865/02/16/news/semi-annual-exhibition-of-columbia-college.html,0
1865-02-16T00:03:58Z,FOUR DAYS LATER FROM EUROPE.; News of the Capture of Fort Fisher--Improvement in American Securities--The Cession of Sonora--Prussia and the Duchies--Interview between Minister Adams and Earl Russell--Continuance of the Great Storm. GREAT BRITAIN. FRANCE. PRUSSIA. INDIA. The City of Dublin. FRANCE. PRUSSIA. SPAIN. ITALY. LATEST VIA GREENCASTLE. COMMERCIAL BY THE NORTH AMERICAN. LATEST VIA GREENCASTLE.,https://www.nytimes.com/1865/02/16/news/four-days-later-europe-capture-fort-fisher-improvement-american-securities.html,0
1865-02-16T00:03:58Z,"For New-Orleans, Havana, &c.",https://www.nytimes.com/1865/02/16/news/for-new-orleans-havana-c.html,0
1865-02-16T00:03:58Z,THE DRAFT.; No Postponement Ordered Official Order from Gen. Fry. Filling up the Army. NO ORDERS YET RECEIVED TO GO ON WITH THE DRAFT IT MAY TAKE PLACE ON ANY DAY RAPID ENLISTMENTS THE PROBABLE CAUSE OF THE DELAY RECRUITS RECEIVED AT THE RATE OF ONE HUNDRED PER DAY THE WORK OF THE COUNTY VOLUNTEER COMMITTEE.,https://www.nytimes.com/1865/02/16/news/draft-no-postponement-ordered-official-order-gen-fry-filling-up-army-no-orders.html,0
1865-02-16T00:03:58Z,FROM SHERIDAN'S ARMY.; A False Rumor A Scount in Trouble How a Brave Soldier Acts Casualties-Lovettsville Hospital.,https://www.nytimes.com/1865/02/16/news/sheridan-s-army-false-rumor-scount-trouble-brave-soldier-acts-casualties.html,0
1865-02-16T00:03:58Z,THE EXPLOSION AT FORT FISHER.; Finding of the Court of Inquiry.,https://www.nytimes.com/1865/02/16/news/the-explosion-at-fort-fisher-finding-of-the-court-of-inquiry.html,0
1865-02-16T00:03:58Z,"The Home for Children of Seamen, on Staten Island.",https://www.nytimes.com/1865/02/16/news/the-home-for-children-of-seamen-on-staten-island.html,0
1865-02-16T00:03:58Z,Amusements this Evening.,https://www.nytimes.com/1865/02/16/news/amusements-this-evening.html,0
1865-02-16T00:03:58Z,For California.,https://www.nytimes.com/1865/02/16/news/for-california.html,0
1865-02-16T00:03:58Z,GENERAL CITY NEWS.,https://www.nytimes.com/1865/02/16/news/general-city-news.html,0
