pub_date,main_headline,article_url,classification
1870-02-01T00:03:58Z,BURGLARS.; An Interesting Detective Case--How a Gang of Burglars Were Traeed and Captured.,https://query.nytimes.com/gst/abstract.html?res=9906E6D6103BE63BBC4953DFB466838B669FDE,0
1870-02-01T00:03:58Z,COAL.,https://query.nytimes.com/gst/abstract.html?res=9A02EED7103BE63BBC4953DFB466838B669FDE,0
1870-02-01T00:03:58Z,Naval Intelligence.,https://query.nytimes.com/gst/abstract.html?res=9C00E7D6103BE63BBC4953DFB466838B669FDE,0
1870-02-01T00:03:58Z,THE GRAND JURY.; A New City Prison Urgently Recommended--The Fifth-Avenue Asphaitum Denounced.,https://query.nytimes.com/gst/abstract.html?res=9A0DE7D6103BE63BBC4953DFB466838B669FDE,0
1870-02-01T00:03:58Z,Philadelphia Stock Board.,https://query.nytimes.com/gst/abstract.html?res=9500EED7103BE63BBC4953DFB466838B669FDE,0
1870-02-01T00:03:58Z,Closing of Foreign Mails at Post Office.,https://query.nytimes.com/gst/abstract.html?res=9903EED7103BE63BBC4953DFB466838B669FDE,0
1870-02-01T00:03:58Z,"ANOTHER SHOCKING MURDER; A Man Beaten to Death near Bloomingdale, N. J.--The Murderer Still at Large.",https://query.nytimes.com/gst/abstract.html?res=9E07E6D6103BE63BBC4953DFB466838B669FDE,0
1870-02-01T00:03:58Z,ITALY.; The Weather in Florence--Parlimentary Proceedings--The King and Francis Joseph of Austrin--Political Prospects-Italian Views of American Affairs. The Ecumerical Council--An American Worldling Takes the Cowl.,https://query.nytimes.com/gst/abstract.html?res=9907E6D6103BE63BBC4953DFB466838B669FDE,0
1870-02-01T00:03:58Z,Abuses of Our Cattle Markets.,https://query.nytimes.com/gst/abstract.html?res=9905E6D6103BE63BBC4953DFB466838B669FDE,0
1870-02-01T00:03:58Z,CUSTOM HOUSE CARTAGE.; The New System in Operation--Another Order from the Collector.,https://query.nytimes.com/gst/abstract.html?res=9B0DEED7103BE63BBC4953DFB466838B669FDE,0
1870-02-01T00:03:58Z,"THE BOOT AND SHOE TRADE.; Proliminaries to the Formation of a Manufacturers' and Jobbers' Board of Trade-Labor, Freight, Insurance and Oredit to be Placed on a Business Footing.",https://query.nytimes.com/gst/abstract.html?res=990CE7D6103BE63BBC4953DFB466838B669FDE,0
1870-02-01T00:03:58Z,LOCAL NEWS IN BRIEF.; NEW-YORK. BROOKLYN. LONG ISLAND. WESTCRESTER COUNTRY. NEW - JERSEY.,https://query.nytimes.com/gst/abstract.html?res=990DEED7103BE63BBC4953DFB466838B669FDE,0
1870-02-01T00:03:58Z,Annual Report of the Central Park Commissioners.,https://query.nytimes.com/gst/abstract.html?res=9B06E7D6103BE63BBC4953DFB466838B669FDE,0
1870-02-01T00:03:58Z,STEAMBOATS.,https://query.nytimes.com/gst/abstract.html?res=9504E7D6103BE63BBC4953DFB466838B669FDE,0
1870-02-01T00:03:58Z,Supposed Wife Murder.,https://query.nytimes.com/gst/abstract.html?res=9D00E7D6103BE63BBC4953DFB466838B669FDE,0
1870-02-01T00:03:58Z,"FIRES.; Insurances in the Holyoke, Mass., Fire Losses in the West.",https://query.nytimes.com/gst/abstract.html?res=9F01E6D6103BE63BBC4953DFB466838B669FDE,0
1870-02-01T00:03:58Z,"OBITUARY.; Hon, Alexander McLeod.",https://query.nytimes.com/gst/abstract.html?res=9A01E7D6103BE63BBC4953DFB466838B669FDE,0
1870-02-01T00:03:58Z,COMMON COUNCIL.,https://query.nytimes.com/gst/abstract.html?res=9E0CE7D6103BE63BBC4953DFB466838B669FDE,0
1870-02-01T00:03:58Z,THE MAGDALEN ASYLUM.; Some Account of the Institution and the Good Work it is Doing--Reforming the Erring by Kind Treatment.,https://query.nytimes.com/gst/abstract.html?res=9F01E7D6103BE63BBC4953DFB466838B669FDE,0
1870-02-01T00:03:58Z,BANKRUPT NOTICES.,https://query.nytimes.com/gst/abstract.html?res=9D07E7D6103BE63BBC4953DFB466838B669FDE,0
1870-02-01T00:03:58Z,Union Republican General Committee-Contested Seats.,https://query.nytimes.com/gst/abstract.html?res=9F0CE7D6103BE63BBC4953DFB466838B669FDE,0
1870-02-01T00:03:58Z,MARINE INTELLIGENCE.; By Telegraph. Notice to Mariners. Foreign Ports. EUROPEAN MARINE NEWS.,https://query.nytimes.com/gst/abstract.html?res=9E02EED7103BE63BBC4953DFB466838B669FDE,0
1870-02-01T00:03:58Z,Passengers Arrived.,https://query.nytimes.com/gst/abstract.html?res=9A03EED7103BE63BBC4953DFB466838B669FDE,0
1870-02-01T00:03:58Z,THE STATE LEGISLATURE.; SENATE. ASSEMBLY.,https://query.nytimes.com/gst/abstract.html?res=9906E7D6103BE63BBC4953DFB466838B669FDE,0
1870-02-01T00:03:58Z,"WASHINGTON.; A Fundings Scheme Agreed Upon by the Finance Committee and Sccretary Boutwell-Large Increase in Revenue Receipts-Currency ""ballooning"" The Gold Plot Investigation-Miscellaneons. Dispatch to the Associated Press.",https://query.nytimes.com/gst/abstract.html?res=9D06E7D6103BE63BBC4953DFB466838B669FDE,0
1870-02-01T00:03:58Z,FORTY-FIRST CONGRESS.; SECOND SESSION. SENATE. HOUSE OF REPRESENTATIVES.,https://query.nytimes.com/gst/abstract.html?res=9404E6D6103BE63BBC4953DFB466838B669FDE,0
1870-02-01T00:03:58Z,After the Swill-Milk Dealers.,https://query.nytimes.com/gst/abstract.html?res=9E05E6D6103BE63BBC4953DFB466838B669FDE,0
1870-02-01T00:03:58Z,Labor Movements.,https://query.nytimes.com/gst/abstract.html?res=9D00EED7103BE63BBC4953DFB466838B669FDE,0
1870-02-01T00:03:58Z,"THE SOUTH.; A $50,000 Bank Robbery in New-Orleans - Louisiana Taxes-The Tennessee Legislature-The Loursville Bridge.",https://query.nytimes.com/gst/abstract.html?res=9F04E6D6103BE63BBC4953DFB466838B669FDE,0
1870-02-01T00:03:58Z,ALBANY.; The Case of Supervisor Foley-Interview of the Executive Committee of the Democratic Union Organization with the Governor-Threatening speeches.,https://query.nytimes.com/gst/abstract.html?res=9F06E7D6103BE63BBC4953DFB466838B669FDE,0
1870-02-01T00:03:58Z,"A CUBAN EDITOR SHOT.; An Affray Between Cubans at Key West--Castanon, Editor of a Havana Paper, Killed--The Feeling in Havana.",https://query.nytimes.com/gst/abstract.html?res=9C01E6D6103BE63BBC4953DFB466838B669FDE,0
1870-02-01T00:03:58Z,THE FALLEN HOUSE.; The Inquest on the Body of John Bohmer Continued--Interesting Testimony.,https://query.nytimes.com/gst/abstract.html?res=940DEED7103BE63BBC4953DFB466838B669FDE,0
1870-02-01T00:03:58Z,Must We have Lynch Law?,https://query.nytimes.com/gst/abstract.html?res=9A02E7D6103BE63BBC4953DFB466838B669FDE,0
1870-02-01T00:03:58Z,Erie's Trials-Trains Discontinued on the Paterson and Newark Railroad.,https://query.nytimes.com/gst/abstract.html?res=990CEED7103BE63BBC4953DFB466838B669FDE,0
1870-02-01T00:03:58Z,NEWS OF THE DAY.; EUROPE. CONGRESS. THE STATE LEGISLATURE. LOCAL. GENERAL.,https://query.nytimes.com/gst/abstract.html?res=9D02E7D6103BE63BBC4953DFB466838B669FDE,0
1870-02-01T00:03:58Z,Metropolitan Museum of Art.,https://query.nytimes.com/gst/abstract.html?res=9401E7D6103BE63BBC4953DFB466838B669FDE,0
1870-02-01T00:03:58Z,Effects of an Anonymous Pamphlet--An Imperial Despondency Explained.,https://query.nytimes.com/gst/abstract.html?res=9C06E6D6103BE63BBC4953DFB466838B669FDE,0
1870-02-01T00:03:58Z,Solution of the Indian Problem.,https://query.nytimes.com/gst/abstract.html?res=9802E7D6103BE63BBC4953DFB466838B669FDE,0
1870-02-01T00:03:58Z,RAILROADS.,https://query.nytimes.com/gst/abstract.html?res=9404E7D6103BE63BBC4953DFB466838B669FDE,0
1870-02-01T00:03:58Z,WORKMAN'S EXHIBITION.; Proposed International Display in London.,https://query.nytimes.com/gst/abstract.html?res=9F06E6D6103BE63BBC4953DFB466838B669FDE,0
1870-02-01T00:03:58Z,Opening of a New School in Brooklyn.,https://query.nytimes.com/gst/abstract.html?res=9405E6D6103BE63BBC4953DFB466838B669FDE,0
1870-02-01T00:03:58Z,International Patent Fuel.,https://query.nytimes.com/gst/abstract.html?res=980DE7D6103BE63BBC4953DFB466838B669FDE,0
1870-02-01T00:03:58Z,Article 2 -- No Title,https://query.nytimes.com/gst/abstract.html?res=9800E7D6103BE63BBC4953DFB466838B669FDE,0
1870-02-01T00:03:58Z,Weather Report.,https://query.nytimes.com/gst/abstract.html?res=9D03EED7103BE63BBC4953DFB466838B669FDE,0
1870-02-01T00:03:58Z,Navigation on the Hudson.,https://query.nytimes.com/gst/abstract.html?res=9F05E6D6103BE63BBC4953DFB466838B669FDE,0
1870-02-01T00:03:58Z,HAYTL; Salnave's Family--Conduct of the American Minister--Formation of the New Government--A General Election Ordered--Miscellaneous.,https://query.nytimes.com/gst/abstract.html?res=9801E7D6103BE63BBC4953DFB466838B669FDE,0
1870-02-01T00:03:58Z,"Newtown, L. I., Declines to Employ a Police Force.",https://query.nytimes.com/gst/abstract.html?res=9E0CEED7103BE63BBC4953DFB466838B669FDE,0
1870-02-01T00:03:58Z,Yellow Fever at Quarantine.,https://query.nytimes.com/gst/abstract.html?res=940CEED7103BE63BBC4953DFB466838B669FDE,0
1870-02-01T00:03:58Z,THE PEABODY OBSEQUIES.; Crowds of Visitors in Portland--Good Sleighing--Governor Chamberlain's Dinner to the Naval Officers.,https://query.nytimes.com/gst/abstract.html?res=9904E6D6103BE63BBC4953DFB466838B669FDE,0
1870-02-01T00:03:58Z,Heavy Safe Robbery in Brooklyn.,https://query.nytimes.com/gst/abstract.html?res=9F00EED7103BE63BBC4953DFB466838B669FDE,0
1870-02-01T00:03:58Z,MINIATURE ALMANAC--THIS DAY.,https://query.nytimes.com/gst/abstract.html?res=9C02EED7103BE63BBC4953DFB466838B669FDE,0
1870-02-01T00:03:58Z,Article 1 -- No Title,https://query.nytimes.com/gst/abstract.html?res=9A07E7D6103BE63BBC4953DFB466838B669FDE,0
1870-02-01T00:03:58Z,A Shocking Accident in Buffalo-A Kororene Explosion in a Bedroom-Suicide by Burning.,https://query.nytimes.com/gst/abstract.html?res=9C04E6D6103BE63BBC4953DFB466838B669FDE,0
1870-02-01T00:03:58Z,"THE LATEST HORROR.; Funeral of the Murdered Grocer, Townsend. Intense Indignation of the Public-Threats of Lynching Still Heard-Aid for the Family of the Deceased,",https://query.nytimes.com/gst/abstract.html?res=9C07E6D6103BE63BBC4953DFB466838B669FDE,0
1870-02-01T00:03:58Z,Baron Haussmann -- His Fabulous Wealth.,https://query.nytimes.com/gst/abstract.html?res=9507E6D6103BE63BBC4953DFB466838B669FDE,0
1870-02-01T00:03:58Z,DIED.,https://query.nytimes.com/gst/abstract.html?res=9E05E7D6103BE63BBC4953DFB466838B669FDE,0
1870-02-01T00:03:58Z,"TELEGRAMS.; A Duel on the Tapis Between Spanish Political Leaders. The German Bishops and the Dogma of Infallibility. End of Monopolized Cable Privileges in France. A TRAGIC AFFAIR AT KEY WEST Shooting of Castanon, Editor of the Havana Voz de Cuba. Decision of the Supreme Court in the Blair Vote Case. EUROPE. Threatened Duel Between Prim and a Spanish Deputy--The Pope and the Intractable Bishops--Attitude of the German Governments. The Great Eastern Heard from--French Cable Privileges--Diplomatic Change.",https://query.nytimes.com/gst/abstract.html?res=9406E6D6103BE63BBC4953DFB466838B669FDE,0
1870-02-01T00:03:58Z,CURRENT NOTES.,https://query.nytimes.com/gst/abstract.html?res=9B07E6D6103BE63BBC4953DFB466838B669FDE,0
1870-02-01T00:03:58Z,"DOUBLE DIVORCE SUITS.; The Galsson and Howell Family Troubles--The Case of Glasson vs. Glasson Before Judge Barnard and a ""Struck Jury""--Testimony of a Mother and a Daughter Against the Husband and Father.",https://query.nytimes.com/gst/abstract.html?res=9C0CE7D6103BE63BBC4953DFB466838B669FDE,0
1870-02-01T00:03:58Z,The Currency and the Debt.,https://query.nytimes.com/gst/abstract.html?res=9E02E7D6103BE63BBC4953DFB466838B669FDE,0
1870-02-01T00:03:58Z,REAL ESTATE TRANSACTIONS.,https://query.nytimes.com/gst/abstract.html?res=9405E7D6103BE63BBC4953DFB466838B669FDE,0
1870-02-01T00:03:58Z,Miscellaneous Telegrams.,https://query.nytimes.com/gst/abstract.html?res=9B04E6D6103BE63BBC4953DFB466838B669FDE,0
1870-02-01T00:03:58Z,THE BROOKLYN ALDERMEN.; The Charter Amendment Question Finally Disposed of--The Prospect Park Commissioners' Report.,https://query.nytimes.com/gst/abstract.html?res=940DE7D6103BE63BBC4953DFB466838B669FDE,0
1870-02-01T00:03:58Z,Article 3 -- No Title,https://query.nytimes.com/gst/abstract.html?res=9402E7D6103BE63BBC4953DFB466838B669FDE,0
1870-02-01T00:03:58Z,GENERAL BLAIR'S VOTE.; The Appeal to the Supreme Court Against the Missouri Judges of Election--Decision of the State Court Sustained.,https://query.nytimes.com/gst/abstract.html?res=9D04E6D6103BE63BBC4953DFB466838B669FDE,0
1870-02-01T00:03:58Z,FINANCIAL.,https://query.nytimes.com/gst/abstract.html?res=9D04E7D6103BE63BBC4953DFB466838B669FDE,0
1870-02-01T00:03:58Z,MEXICO.; Unsettled State of Affairs in Vera Cruz--The New Revolution Increasing--Telegraphic Communication.,https://query.nytimes.com/gst/abstract.html?res=9D01E6D6103BE63BBC4953DFB466838B669FDE,0
1870-02-01T00:03:58Z,"POLICE AFFAIRS.; A Charge Against Captain Petty--Transfers, Dismissals and Resignations--Dishonest Milkman.",https://query.nytimes.com/gst/abstract.html?res=9E0DE7D6103BE63BBC4953DFB466838B669FDE,0
1870-02-01T00:03:58Z,Movements of Ocean Steamers.,https://query.nytimes.com/gst/abstract.html?res=9F03EED7103BE63BBC4953DFB466838B669FDE,0
1870-02-01T00:03:58Z,A Politican's Perplexitics--The Cost of Electioneering.,https://query.nytimes.com/gst/abstract.html?res=9C0CEED7103BE63BBC4953DFB466838B669FDE,0
1870-02-01T00:03:58Z,The Police nnd the Panel Thieves.,https://query.nytimes.com/gst/abstract.html?res=9C05E6D6103BE63BBC4953DFB466838B669FDE,0
1870-02-01T00:03:58Z,LAW REPORTS.; COURT CALENDARS--THIS DAY. DECISIONS. UNITED STATES DISTRICT COURT SUPREME COURT SUPERIOR COURT,https://query.nytimes.com/gst/abstract.html?res=9A00E7D6103BE63BBC4953DFB466838B669FDE,0
1870-02-01T00:03:58Z,Temperance Meeting at Trinity Methodist Episcopal Church.,https://query.nytimes.com/gst/abstract.html?res=980CEED7103BE63BBC4953DFB466838B669FDE,0
1870-02-01T00:03:58Z,Unsafe Buildings.,https://query.nytimes.com/gst/abstract.html?res=9B0CE7D6103BE63BBC4953DFB466838B669FDE,0
1870-02-01T00:03:58Z,Arrival of Notable Passengers from Hayti.,https://query.nytimes.com/gst/abstract.html?res=9B0CEED7103BE63BBC4953DFB466838B669FDE,0
1870-02-01T00:03:58Z,Article 4 -- No Title,https://query.nytimes.com/gst/abstract.html?res=9D0DE7D6103BE63BBC4953DFB466838B669FDE,0
1870-02-01T00:03:58Z,AMUSEMENTS.; Musical. The Charity Ball. Young Men's Christian Association--Harlerin Branch.,https://query.nytimes.com/gst/abstract.html?res=9506E7D6103BE63BBC4953DFB466838B669FDE,0
1870-02-01T00:03:58Z,Fire in Fulton-Street.,https://query.nytimes.com/gst/abstract.html?res=9F00E7D6103BE63BBC4953DFB466838B669FDE,0
1870-02-02T00:03:58Z,THE PEABODY OBSEQUIES.; Final Solemn Ceremonies at Portland. Imposing Religious Services in the City Hall. Removal of the Remains to Peabody.,https://query.nytimes.com/gst/abstract.html?res=9D02E4DB133BE63BBC4A53DFB466838B669FDE,0
1870-02-02T00:03:58Z,LAW REPORTS.; COURT CALENDARS DECISIONS. UNITED STATES SUPREME COURT. SUPREME COURT--WEST CHESTER COUNTY--SPECIAL TERM. SUPREME COURT COURT OF SPECIAL SESSIONS.,https://query.nytimes.com/gst/abstract.html?res=9E05E3DB133BE63BBC4A53DFB466838B669FDE,0
1870-02-02T00:03:58Z,Movements of Ocean Steamers.,https://query.nytimes.com/gst/abstract.html?res=9B0DE4DB133BE63BBC4A53DFB466838B669FDE,0
1870-02-02T00:03:58Z,"CONGRESS.; Slight Progress of the Currency Bill in the Senate. The Tariff Bill Reported in the House. SWEEPING CHANGES PROPOSED BY IT. Virginia Fully Admitted to Representation. The February Sales of Gold--Additional Ports of Entry--The San Domingo Treaty--The Navy Line and Staff Difficulty--Miscellaneous. FORTY-FIRST CONGRESS. SECOND SESSION. HOUSE OF REPRESENTATIVES. THE TARIFF BILL. The Bill in Full, as Reported by the Ways and Means Committee--Duties Imposed--Articles Free.",https://query.nytimes.com/gst/abstract.html?res=9D0DE4DB133BE63BBC4A53DFB466838B669FDE,0
1870-02-02T00:03:58Z,RUFFIANISM RAMPANT.; Another Citizen Assailed at His Own Door--The Murders Foiled by Accident--Desperate Affray in the First Ward.,https://query.nytimes.com/gst/abstract.html?res=9505E3DB133BE63BBC4A53DFB466838B669FDE,0
1870-02-02T00:03:58Z,AMUSEMENTS.; Musical.,https://query.nytimes.com/gst/abstract.html?res=9F0CE4DB133BE63BBC4A53DFB466838B669FDE,0
1870-02-02T00:03:58Z,MARRIED.,https://query.nytimes.com/gst/abstract.html?res=940DE4DB133BE63BBC4A53DFB466838B669FDE,0
1870-02-02T00:03:58Z,EUROPEAN NEWS BY MAIL.; ARRIVAL OF THE STEAMSHIP CITY OF LONDON. TRAUPMANN. Execution of the Assassin of the Kinck Family--No Confession Made by the Criminal-His Self-Possession and Calmness in His Last Moments Curious Statement of the Priest in Attendance.,https://query.nytimes.com/gst/abstract.html?res=9402E4DB133BE63BBC4A53DFB466838B669FDE,0
1870-02-02T00:03:58Z,"DISASTROUS FIRE.; Burning of a Cotton Warehouse-Loss 830,000.",https://query.nytimes.com/gst/abstract.html?res=9D05E3DB133BE63BBC4A53DFB466838B669FDE,0
1870-02-02T00:03:58Z,NEWS OF THE DAY.; EUROPE. THE STATE LEGISLATURE. GENERAL. LOCAL,https://query.nytimes.com/gst/abstract.html?res=9C0DE4DB133BE63BBC4A53DFB466838B669FDE,0
1870-02-02T00:03:58Z,Excursion of the Health Officers to the Quarantine Islands.,https://query.nytimes.com/gst/abstract.html?res=9904E3DB133BE63BBC4A53DFB466838B669FDE,0
1870-02-02T00:03:58Z,Raids Upon RIver Thieves--Arrest of Two Notorious Depredators.,https://query.nytimes.com/gst/abstract.html?res=9D04E3DB133BE63BBC4A53DFB466838B669FDE,0
1870-02-02T00:03:58Z,The Time to Act.,https://query.nytimes.com/gst/abstract.html?res=9A05E3DB133BE63BBC4A53DFB466838B669FDE,0
1870-02-02T00:03:58Z,CUBA.; Remains of Castanon at Havana--The Cubans at Key West--The Spanish Consul's Residence Guarded.,https://query.nytimes.com/gst/abstract.html?res=990CE4DB133BE63BBC4A53DFB466838B669FDE,0
1870-02-02T00:03:58Z,REAL ESTATE TRANSACTIONS.; Auction Sale Yesterday. Transfers of Real Estate.,https://query.nytimes.com/gst/abstract.html?res=9D00E4DB133BE63BBC4A53DFB466838B669FDE,0
1870-02-02T00:03:58Z,Article 3 -- No Title,https://query.nytimes.com/gst/abstract.html?res=9A02E4DB133BE63BBC4A53DFB466838B669FDE,0
1870-02-02T00:03:58Z,ALBANY.; A Partisan Police Bill--About Canvasers and Inspectors of Election-Hardenbergh's Canal Bill--The New charter for New-York--Another Voice from Greene County. The New-York Supervisorship--Mr. Smith's Right to be Legally Tested.,https://query.nytimes.com/gst/abstract.html?res=9501E4DB133BE63BBC4A53DFB466838B669FDE,0
1870-02-02T00:03:58Z,Passengers Arrived.,https://query.nytimes.com/gst/abstract.html?res=9C01E4DB133BE63BBC4A53DFB466838B669FDE,0
1870-02-02T00:03:58Z,NEW-YORK BAR.; Important Meeting of Members Last Evening--Preliminary Steps Towards the Formation of an Organization.,https://query.nytimes.com/gst/abstract.html?res=9502E4DB133BE63BBC4A53DFB466838B669FDE,0
1870-02-02T00:03:58Z,An Arson Case--Confession of the Calprit,https://query.nytimes.com/gst/abstract.html?res=9401E4DB133BE63BBC4A53DFB466838B669FDE,0
1870-02-02T00:03:58Z,FINANCIAL.,https://query.nytimes.com/gst/abstract.html?res=9A03E4DB133BE63BBC4A53DFB466838B669FDE,0
1870-02-02T00:03:58Z,What the Administration Has Done and Is Doing.,https://query.nytimes.com/gst/abstract.html?res=9B05E3DB133BE63BBC4A53DFB466838B669FDE,0
1870-02-02T00:03:58Z,RAILROADS.,https://query.nytimes.com/gst/abstract.html?res=9F00E4DB133BE63BBC4A53DFB466838B669FDE,0
1870-02-02T00:03:58Z,Personal.,https://query.nytimes.com/gst/abstract.html?res=9804E3DB133BE63BBC4A53DFB466838B669FDE,0
1870-02-02T00:03:58Z,NEWS PACKAGES FOR THE PRESS.,https://query.nytimes.com/gst/abstract.html?res=9D01E4DB133BE63BBC4A53DFB466838B669FDE,0
1870-02-02T00:03:58Z,CITY GOVERNMENT.; Board of Aldermen--Stated Session. Board of Assistant Aidermen-Stated session.,https://query.nytimes.com/gst/abstract.html?res=9A06E4DB133BE63BBC4A53DFB466838B669FDE,0
1870-02-02T00:03:58Z,Tammany Against the Public.,https://query.nytimes.com/gst/abstract.html?res=9805E3DB133BE63BBC4A53DFB466838B669FDE,0
1870-02-02T00:03:58Z,STEAMBOATS.,https://query.nytimes.com/gst/abstract.html?res=9800E4DB133BE63BBC4A53DFB466838B669FDE,0
1870-02-02T00:03:58Z,THE PUBLIC DEBT.; Another Reduction of About Four Millions--Comparison Between the January and February Statements.,https://query.nytimes.com/gst/abstract.html?res=9B02E4DB133BE63BBC4A53DFB466838B669FDE,0
1870-02-02T00:03:58Z,CURRENT NOTES.,https://query.nytimes.com/gst/abstract.html?res=9503E4DB133BE63BBC4A53DFB466838B669FDE,0
1870-02-02T00:03:58Z,MINIATURE ALMANAC--THIS DAY.,https://query.nytimes.com/gst/abstract.html?res=9E01E4DB133BE63BBC4A53DFB466838B669FDE,0
1870-02-02T00:03:58Z,"PRINCE ARTHUR.; His Movements Yesterday-He Spends a Quiet Day and a Gay Evening, The Ball at Delmonico's.",https://query.nytimes.com/gst/abstract.html?res=950CE4DB133BE63BBC4A53DFB466838B669FDE,0
1870-02-02T00:03:58Z,Some Suggestions About Congressional Debates.,https://query.nytimes.com/gst/abstract.html?res=9905E3DB133BE63BBC4A53DFB466838B669FDE,0
1870-02-02T00:03:58Z,Closing of Foreign Mails at Post Office.; Closing of Domestic Mails.,https://query.nytimes.com/gst/abstract.html?res=980DE4DB133BE63BBC4A53DFB466838B669FDE,0
1870-02-02T00:03:58Z,A BROOKLYN SWINDLE.; A Rig Job Unearthed--Plan to Defraud Neighbors for Personal Convenience--Sneaks at Albany.,https://query.nytimes.com/gst/abstract.html?res=9E04E3DB133BE63BBC4A53DFB466838B669FDE,0
1870-02-02T00:03:58Z,Escape of Mary Ann Smith from a Convent.,https://query.nytimes.com/gst/abstract.html?res=9404E3DB133BE63BBC4A53DFB466838B669FDE,0
1870-02-02T00:03:58Z,BANKRUPT NOTICES.,https://query.nytimes.com/gst/abstract.html?res=9C0CE4DB133BE63BBC4A53DFB466838B669FDE,0
1870-02-02T00:03:58Z,Passengers Sailed.,https://query.nytimes.com/gst/abstract.html?res=990DE4DB133BE63BBC4A53DFB466838B669FDE,0
1870-02-02T00:03:58Z,MARINE INTELLIGENCE.; Cleared. Arrived. Railed. By Telegraph. EUROPEAN MARINE NEWS.,https://query.nytimes.com/gst/abstract.html?res=9906E4DB133BE63BBC4A53DFB466838B669FDE,0
1870-02-02T00:03:58Z,Reward in the Case of the Missing Man Robert Harper -- The State Medical Society.,https://query.nytimes.com/gst/abstract.html?res=940CE4DB133BE63BBC4A53DFB466838B669FDE,0
1870-02-02T00:03:58Z,Article 2 -- No Title,https://query.nytimes.com/gst/abstract.html?res=9903E4DB133BE63BBC4A53DFB466838B669FDE,0
1870-02-02T00:03:58Z,Excise Fees Increased.,https://query.nytimes.com/gst/abstract.html?res=9E0DE4DB133BE63BBC4A53DFB466838B669FDE,0
1870-02-02T00:03:58Z,LOCAL NEWS IN BRIEF.; NEW-YORK. WESTCHESTER COIUNTY. BROOKLYN. LONG ISLAND. NEW-JERSEY.,https://query.nytimes.com/gst/abstract.html?res=9806E4DB133BE63BBC4A53DFB466838B669FDE,0
1870-02-02T00:03:58Z,Chess Game--Thompson vs. Perrin.,https://query.nytimes.com/gst/abstract.html?res=9504E3DB133BE63BBC4A53DFB466838B669FDE,0
1870-02-02T00:03:58Z,Article 1 -- No Title,https://query.nytimes.com/gst/abstract.html?res=9803E4DB133BE63BBC4A53DFB466838B669FDE,0
1870-02-02T00:03:58Z,Castle Garden Labor Statistics.,https://query.nytimes.com/gst/abstract.html?res=9C05E3DB133BE63BBC4A53DFB466838B669FDE,0
1870-02-02T00:03:58Z,MEETING OF VESSEL OWNERS.; Election of Officers--Proposed Changes in the Pilot Laws.,https://query.nytimes.com/gst/abstract.html?res=9A04E3DB133BE63BBC4A53DFB466838B669FDE,0
1870-02-02T00:03:58Z,"THE RED RIVER REBBLLION.; A Coup d'Etat Against Rielle--His Deposition, Capture and Imprisonment.",https://query.nytimes.com/gst/abstract.html?res=9A0CE4DB133BE63BBC4A53DFB466838B669FDE,0
1870-02-02T00:03:58Z,THE TOWNSEND MURDER; SCENES AT THE INQUEST YESTERDAY Exciting Meeting Between Townsend's Family and the Prisoner--The Evidence--Angry Feelings of the People. The Reynolds Case.,https://query.nytimes.com/gst/abstract.html?res=9A01E4DB133BE63BBC4A53DFB466838B669FDE,0
1870-02-02T00:03:58Z,DIED.,https://query.nytimes.com/gst/abstract.html?res=9400E4DB133BE63BBC4A53DFB466838B669FDE,0
1870-02-02T00:03:58Z,FIRE DOWN TOWN.; Conflagration in Rose-street-Destruction of a Sugar Refinery.,https://query.nytimes.com/gst/abstract.html?res=9B06E4DB133BE63BBC4A53DFB466838B669FDE,0
1870-02-02T00:03:58Z,The Fighteenth-Street Distillery Case--Another Useless Government Witness.,https://query.nytimes.com/gst/abstract.html?res=9C04E3DB133BE63BBC4A53DFB466838B669FDE,0
1870-02-02T00:03:58Z,COAL.,https://query.nytimes.com/gst/abstract.html?res=9506E4DB133BE63BBC4A53DFB466838B669FDE,0
1870-02-02T00:03:58Z,A Curious Lawsuit in Boston--The Yale Alumni.,https://query.nytimes.com/gst/abstract.html?res=9B0CE4DB133BE63BBC4A53DFB466838B669FDE,0
1870-02-02T00:03:58Z,Weather Report.,https://query.nytimes.com/gst/abstract.html?res=9C00E4DB133BE63BBC4A53DFB466838B669FDE,0
1870-02-02T00:03:58Z,THE GLASSON DIVORCE SUIT.; Testimony for the Defence--Mr. Howell's version of the Story--The Case to be Summed Up To-Day.,https://query.nytimes.com/gst/abstract.html?res=9405E3DB133BE63BBC4A53DFB466838B669FDE,0
1870-02-02T00:03:58Z,THE ERA OF MURDER.; Criminal Records for the Last Month of January. Will New-York be Driven to Lynch Law ?,https://query.nytimes.com/gst/abstract.html?res=9B01E4DB133BE63BBC4A53DFB466838B669FDE,0
1870-02-02T00:03:58Z,GENERAL TELEGRAMS.; EUROPE. Fresh Rumors of the Death of the Pope--The Commercial Debates in the French Chambers--The Lancashire Strike.,https://query.nytimes.com/gst/abstract.html?res=9F0DE4DB133BE63BBC4A53DFB466838B669FDE,0
1870-02-02T00:03:58Z,Brooklyn Board of Education.,https://query.nytimes.com/gst/abstract.html?res=9B04E3DB133BE63BBC4A53DFB466838B669FDE,0
1870-02-02T00:03:58Z,THE CENTRAL PARK.; Further Details Regarding it from the Annual Report--Improvements Effected and in Progress.,https://query.nytimes.com/gst/abstract.html?res=9F04E3DB133BE63BBC4A53DFB466838B669FDE,0
1870-02-03T00:03:58Z,Soldiers' Bounty Claims.,https://query.nytimes.com/gst/abstract.html?res=9D0CEED81E3CE13BBC4B53DFB466838B669FDE,0
1870-02-03T00:03:58Z,AMUSEMENTS.; Musical.,https://query.nytimes.com/gst/abstract.html?res=9904E7D71E3CE13BBC4B53DFB466838B669FDE,0
1870-02-03T00:03:58Z,How Shall the Census be Taken?,https://query.nytimes.com/gst/abstract.html?res=9D04E7D71E3CE13BBC4B53DFB466838B669FDE,0
1870-02-03T00:03:58Z,LAW REPORTS.; COURT CALENDARS UNITED STATES SUPREME COURT. UNITED STATES CIRCUIT COURT-SOUTHERN DISTRICT. SUPREME COURT SUPERIOR COURT,https://query.nytimes.com/gst/abstract.html?res=940CEED81E3CE13BBC4B53DFB466838B669FDE,0
