pub_date,main_headline,article_url,classification
1870-01-11T00:03:58Z,Another Fire in the St. Nicholas Hotel Laundry.,https://query.nytimes.com/gst/abstract.html?res=950DE2DF113BE63BBC4952DFB766838B669FDE,0
1870-01-11T00:03:58Z,Virginia in Congress,https://query.nytimes.com/gst/abstract.html?res=9E00E1DF113BE63BBC4952DFB766838B669FDE,0
1870-01-11T00:03:58Z,MINIATURE ALMANAC--THIS DAY.,https://query.nytimes.com/gst/abstract.html?res=9C01E1DF113BE63BBC4952DFB766838B669FDE,0
1870-01-11T00:03:58Z,Passengers Arrived.,https://query.nytimes.com/gst/abstract.html?res=9B01E1DF113BE63BBC4952DFB766838B669FDE,0
1870-01-11T00:03:58Z,Labor Movements.,https://query.nytimes.com/gst/abstract.html?res=9A02E1DF113BE63BBC4952DFB766838B669FDE,0
1870-01-11T00:03:58Z,Brooklyn Common Council.,https://query.nytimes.com/gst/abstract.html?res=9A0DE1DF113BE63BBC4952DFB766838B669FDE,0
1870-01-11T00:03:58Z,CANADA.; The Red River Rebellion--Disturbance of Religious Service in Montreal.,https://query.nytimes.com/gst/abstract.html?res=9C02E1DF113BE63BBC4952DFB766838B669FDE,0
1870-01-11T00:03:58Z,DIED.,https://query.nytimes.com/gst/abstract.html?res=9403E2DF113BE63BBC4952DFB766838B669FDE,0
1870-01-11T00:03:58Z,Christian Temperance Convention in Brooklyn.,https://query.nytimes.com/gst/abstract.html?res=9B07E1DF113BE63BBC4952DFB766838B669FDE,0
1870-01-11T00:03:58Z,"The ""Executive Officer"" in the Navy.",https://query.nytimes.com/gst/abstract.html?res=980CE1DF113BE63BBC4952DFB766838B669FDE,0
1870-01-11T00:03:58Z,"FRANCE.; Visit of Mr. Washburne and Senator Fenton to the Champagne District--Baptism of a New Brand ""The President's Cabinet""--Banquet and Speeches--Vine Culture and Wine Statistics.",https://query.nytimes.com/gst/abstract.html?res=9D07E1DF113BE63BBC4952DFB766838B669FDE,0
1870-01-11T00:03:58Z,LOCAL NEWS IN BRIEF.; NEW-YORK. BROOKLYN. LONG ISLAND. WESTCHESTER COUNTY. NEW-JERSEY.,https://query.nytimes.com/gst/abstract.html?res=9F00E2DF113BE63BBC4952DFB766838B669FDE,0
1870-01-11T00:03:58Z,CURRENT NOTES.,https://query.nytimes.com/gst/abstract.html?res=990CE1DF113BE63BBC4952DFB766838B669FDE,0
1870-01-11T00:03:58Z,Suffrage in Missouri--Forward Steps.,https://query.nytimes.com/gst/abstract.html?res=9C0DE1DF113BE63BBC4952DFB766838B669FDE,0
1870-01-11T00:03:58Z,A GAME WITH GOLD.; A stormy Scene--A prominent Gold Operator Asserts His Rights--Singular Proceedings at the Treasury Sale.,https://query.nytimes.com/gst/abstract.html?res=9D01E1DF113BE63BBC4952DFB766838B669FDE,0
1870-01-11T00:03:58Z,NEWS PACKAGES FOR THE PRESS.,https://query.nytimes.com/gst/abstract.html?res=9A00E1DF113BE63BBC4952DFB766838B669FDE,0
1870-01-11T00:03:58Z,Opening of Brady's Jersey City Skating Rink.,https://query.nytimes.com/gst/abstract.html?res=9C03E2DF113BE63BBC4952DFB766838B669FDE,0
1870-01-11T00:03:58Z,Movements of Ocean Steamers.,https://query.nytimes.com/gst/abstract.html?res=9900E1DF113BE63BBC4952DFB766838B669FDE,0
1870-01-11T00:03:58Z,TEMPERANCE.; Interesting Meeting Last Evening--Addresses by Horace Greeley and Rev. Dr. Hall.,https://query.nytimes.com/gst/abstract.html?res=9E03E1DF113BE63BBC4952DFB766838B669FDE,0
1870-01-11T00:03:58Z,THE PUBLIC DEBT.; Mr. Boutwell's Theory for the Necessity for a Loan--A Lecture by the Secretary in Washington.,https://query.nytimes.com/gst/abstract.html?res=9D02E1DF113BE63BBC4952DFB766838B669FDE,0
1870-01-11T00:03:58Z,Disbanding of the Veteran Zouaves.,https://query.nytimes.com/gst/abstract.html?res=9D00E1DF113BE63BBC4952DFB766838B669FDE,0
1870-01-11T00:03:58Z,The Shipping Interest--Measures for its Relief.,https://query.nytimes.com/gst/abstract.html?res=9506E1DF113BE63BBC4952DFB766838B669FDE,0
1870-01-11T00:03:58Z,How to Lighten the Income Tax.,https://query.nytimes.com/gst/abstract.html?res=9D0DE1DF113BE63BBC4952DFB766838B669FDE,0
1870-01-11T00:03:58Z,ANOTHER CHURCH SCANDAL.; THE CRIMES OF A FAITHLESS SHEPHERD. Flight of a Methodist Clergyman of this City with a Confiding School Girl--A Wife and Son Cruelly Deserted--An Elective Affinity and what Came of It.,https://query.nytimes.com/gst/abstract.html?res=9E0DE2DF113BE63BBC4952DFB766838B669FDE,0
1870-01-11T00:03:58Z,Anniversary of the New-York Marine Society--An Interesting Meeting.,https://query.nytimes.com/gst/abstract.html?res=9401E1DF113BE63BBC4952DFB766838B669FDE,0
1870-01-11T00:03:58Z,SAN DOMINGO.; Annexation of the Island to the United States. The Treaties Sent to the Senate by the President. HISTORY OF THE NEGOTIATIONS. The Terms of Annexation Finally Agreed Upon. Present Government and People of the Island. What the Government Will Gain--The Feeling of the People on the ChangeFinancial Condition of the Island. A Proclamation Expected from President Baez--The Annexation Feeling in the City and Country--Movements of the Revolutionists.,https://query.nytimes.com/gst/abstract.html?res=9B04E1DF113BE63BBC4952DFB766838B669FDE,0
1870-01-11T00:03:58Z,CUSTOM HOUSE REFORMS.; The Cartage Business--Interesting Interview Between a Poor Cartman and a Government Agent.,https://query.nytimes.com/gst/abstract.html?res=9907E1DF113BE63BBC4952DFB766838B669FDE,0
1870-01-11T00:03:58Z,The Funds Stolen from the Glenn's Falls Bank.,https://query.nytimes.com/gst/abstract.html?res=9F01E1DF113BE63BBC4952DFB766838B669FDE,0
1870-01-11T00:03:58Z,"TELEGRAMS.; Prince Pierre Bonaparte and Rochefort's Journal. The Bearer of a Challenge Murdered by the Prince. Surrender of the Murderer to the Authorities. Political Acrimony in the Corps Legislatif. GENERAL FOREIGN AND DOMESTIC NEWS. EUROPE. A Tragic Affair in Paris - A Second, Bearing a Challenge. Shot and Killed by Prince Pierre Bonaparte-M. Ollivier and the Opposition--An Excited Discussion in the Chamber. A Replay to Sir Curtis Lampson's Sneers--Five-Twenties vs. Consols--Affairs in Spain.",https://query.nytimes.com/gst/abstract.html?res=990DE1DF113BE63BBC4952DFB766838B669FDE,0
1870-01-11T00:03:58Z,REPUBLICAN REUNION.; Successful Organization of the New General Committee--Reference of the Contested Seats Dispute to a General Committee.,https://query.nytimes.com/gst/abstract.html?res=9B01E2DF113BE63BBC4952DFB766838B669FDE,0
1870-01-11T00:03:58Z,The Young Men's Democratic (Tammany) Committee.,https://query.nytimes.com/gst/abstract.html?res=9E01E1DF113BE63BBC4952DFB766838B669FDE,0
1870-01-11T00:03:58Z,"MARINE INTELLIGENCE.; Arrived. By Telegraph. Miscellaneous. Notice to Mariners. Spoken, &c. Foreign Ports. EUROPEAN MARINE NEWS. Arrived Out.",https://query.nytimes.com/gst/abstract.html?res=9D06E1DF113BE63BBC4952DFB766838B669FDE,0
1870-01-11T00:03:58Z,NEWS OF THE DAY.; EUROPE. CONGRESS. GENERAL. LOCAL.,https://query.nytimes.com/gst/abstract.html?res=9F06E1DF113BE63BBC4952DFB766838B669FDE,0
1870-01-11T00:03:58Z,FINANCIAL.,https://query.nytimes.com/gst/abstract.html?res=9901E1DF113BE63BBC4952DFB766838B669FDE,0
1870-01-11T00:03:58Z,Five Children Burned to Death.,https://query.nytimes.com/gst/abstract.html?res=9F02E1DF113BE63BBC4952DFB766838B669FDE,0
1870-01-11T00:03:58Z,Article 2 -- No Title,https://query.nytimes.com/gst/abstract.html?res=9F0CE2DF113BE63BBC4952DFB766838B669FDE,0
1870-01-11T00:03:58Z,LAW REPORTS.; COURT CALENDARS--THIS DAY. UNITED STATES CIRCUIT COURT. UNITED STATES DISTRICT COURT-IN ADMIRALTY. DECISIONS. SUPREME COURT- SUPERIOR COURT- SUPREME COURT SUPERIOR COURT- SUPERIOR COURT COURT OF GENERAL SESSIONS.,https://query.nytimes.com/gst/abstract.html?res=9501E1DF113BE63BBC4952DFB766838B669FDE,0
1870-01-11T00:03:58Z,Probable Homicide at Tuckahoe.,https://query.nytimes.com/gst/abstract.html?res=9D03E1DF113BE63BBC4952DFB766838B669FDE,0
1870-01-11T00:03:58Z,Release of the Steamer Anna at Charleston.,https://query.nytimes.com/gst/abstract.html?res=9C05E1DF113BE63BBC4952DFB766838B669FDE,0
1870-01-11T00:03:58Z,The Homicide at Tremont.,https://query.nytimes.com/gst/abstract.html?res=9507E1DF113BE63BBC4952DFB766838B669FDE,0
1870-01-11T00:03:58Z,CONGRESS.; Efforts in Behalf of the Immediate Admission of Virginia. Proceedings in the Matter in Both Houses. Long and Sharp Debate in the Senate. IMPORTANT NEW BUSINESS INTRODUCED. Proposed Repeal of the Bankrupt Laws. The Cuban Question--Another Debate in Prospect--Appointments Seni to the Senate--Miscellaneous.,https://query.nytimes.com/gst/abstract.html?res=9D0CE1DF113BE63BBC4952DFB766838B669FDE,0
1870-01-11T00:03:58Z,RAILROADS.,https://query.nytimes.com/gst/abstract.html?res=9503E1DF113BE63BBC4952DFB766838B669FDE,0
1870-01-11T00:03:58Z,Newark Board of Trade.,https://query.nytimes.com/gst/abstract.html?res=9B02E1DF113BE63BBC4952DFB766838B669FDE,0
1870-01-11T00:03:58Z,Skating Yesterday.,https://query.nytimes.com/gst/abstract.html?res=9B0DE1DF113BE63BBC4952DFB766838B669FDE,0
1870-01-11T00:03:58Z,Seventh Regiment Veteran Organization.,https://query.nytimes.com/gst/abstract.html?res=9F0CE1DF113BE63BBC4952DFB766838B669FDE,0
1870-01-11T00:03:58Z,ALBANY.; Illness of Speaker Hitchman--The Chairmen of Committees.,https://query.nytimes.com/gst/abstract.html?res=940CE2DF113BE63BBC4952DFB766838B669FDE,0
1870-01-11T00:03:58Z,COUNTRY PRODUCE MARKET.,https://query.nytimes.com/gst/abstract.html?res=950DE1DF113BE63BBC4952DFB766838B669FDE,0
1870-01-11T00:03:58Z,TENNESSEE.; The Constitutional Convention at Nashville--An Ex-Rebel General Elected Permanent President.,https://query.nytimes.com/gst/abstract.html?res=9805E1DF113BE63BBC4952DFB766838B669FDE,0
1870-01-11T00:03:58Z,THE TELEGRAPHERS; The Strike--Cards on Both Sides--The Situation in Other Cities. Another Card from the Operators.,https://query.nytimes.com/gst/abstract.html?res=9B0DE2DF113BE63BBC4952DFB766838B669FDE,0
1870-01-11T00:03:58Z,Drainage Meeting at Flushing.,https://query.nytimes.com/gst/abstract.html?res=9501E2DF113BE63BBC4952DFB766838B669FDE,0
1870-01-11T00:03:58Z,AMERICAN SHIPBUILDING.; Meeting of the New-York Association for the Protection of American Shipping--Report of the Special Committee that Visited Washington.,https://query.nytimes.com/gst/abstract.html?res=9900E2DF113BE63BBC4952DFB766838B669FDE,0
1870-01-11T00:03:58Z,AMUSEMENTS.; Theatrical.,https://query.nytimes.com/gst/abstract.html?res=9802E1DF113BE63BBC4952DFB766838B669FDE,0
1870-01-11T00:03:58Z,ALASKA.; Report on the Geographical Position of Fort Yukon-The Yukon River and its Tributaries.,https://query.nytimes.com/gst/abstract.html?res=9E02E1DF113BE63BBC4952DFB766838B669FDE,0
1870-01-11T00:03:58Z,What is to Become of Cuba!,https://query.nytimes.com/gst/abstract.html?res=9502E1DF113BE63BBC4952DFB766838B669FDE,0
1870-01-11T00:03:58Z,The Century Club.,https://query.nytimes.com/gst/abstract.html?res=9505E1DF113BE63BBC4952DFB766838B669FDE,0
1870-01-11T00:03:58Z,FORTY-FIRST CONGRESS.; SECOND SESSION. SENATE.,https://query.nytimes.com/gst/abstract.html?res=9E0CE1DF113BE63BBC4952DFB766838B669FDE,0
1870-01-12T00:03:58Z,REDUCTION OF TAXATION.; Opinions of the Republican Press.,https://query.nytimes.com/gst/abstract.html?res=9803E6DA153BE63BBC4A52DFB766838B669FDE,0
1870-01-12T00:03:58Z,NEWS OF THE DAY.; EUROPE. CONGRESS. THE STATE LEGISLATURE. GENERAL. LOCAL.,https://query.nytimes.com/gst/abstract.html?res=9B04E5DA153BE63BBC4A52DFB766838B669FDE,0
1870-01-12T00:03:58Z,LOCAL NEWS IN BRIEF.; NEW-YORK.,https://query.nytimes.com/gst/abstract.html?res=950CE6DA153BE63BBC4A52DFB766838B669FDE,0
1870-01-12T00:03:58Z,Passengers Arrived.,https://query.nytimes.com/gst/abstract.html?res=9502E6DA153BE63BBC4A52DFB766838B669FDE,0
1870-01-12T00:03:58Z,A Singular Appearing Water Fowl.,https://query.nytimes.com/gst/abstract.html?res=9B03E6DA153BE63BBC4A52DFB766838B669FDE,0
1870-01-12T00:03:58Z,RAILROADS.,https://query.nytimes.com/gst/abstract.html?res=9C0CE6DA153BE63BBC4A52DFB766838B669FDE,0
1870-01-12T00:03:58Z,LAW REPORTS.; COURT CALENDARS--THIS DAY. UNITED STATES CIRCUIT COURT--SOUTHERN DISTRICT. UNITED STATES CIRCUIT COURT--SOUTHERN DISTRICT. UNITED STATES COMMISSIONERS' OFFICE. DECISIONS. SUPREME COURT--GNERAL TERM--JAN. 11. SUPERIOR COURT--TRIAL TERM--PART I.--JAN. 11. SUPERIOR COURT-SPECIAL TERM-JAN. 11. COURT OF SPECIAL SESSIONS. COURT OF GENERAL SESSIONS. POLICE COURTS.,https://query.nytimes.com/gst/abstract.html?res=9D00E6DA153BE63BBC4A52DFB766838B669FDE,0
1870-01-12T00:03:58Z,THE FREE LIST.; The Work of the Committeee of Ways and Means--Articles Agreed on to be Exempts from Duty Thus Far.,https://query.nytimes.com/gst/abstract.html?res=9F05E5DA153BE63BBC4A52DFB766838B669FDE,0
1870-01-12T00:03:58Z,CURRENT NOTES.,https://query.nytimes.com/gst/abstract.html?res=9900E6DA153BE63BBC4A52DFB766838B669FDE,0
1870-01-12T00:03:58Z,CITY GOVERNMENT.; Board of Aldermen-Stated Session.,https://query.nytimes.com/gst/abstract.html?res=9E04E5DA153BE63BBC4A52DFB766838B669FDE,0
1870-01-12T00:03:58Z,MARRIED.,https://query.nytimes.com/gst/abstract.html?res=9C04E5DA153BE63BBC4A52DFB766838B669FDE,0
1870-01-12T00:03:58Z,Mr. Boutwell's Plea for Oppressive Taxation.,https://query.nytimes.com/gst/abstract.html?res=9D03E6DA153BE63BBC4A52DFB766838B669FDE,0
1870-01-12T00:03:58Z,THE BULLS AND BEARS.; Alleged Effort to Explode the Gold Exchange Bank. A Stormy Executive Session of the Gold Exchange. PROMPT EXPULSION OF A MEMBER. The Rules Sternly Vindicated. AN INSIDE VIEW OF THE WHOLE AFFAIR.,https://query.nytimes.com/gst/abstract.html?res=9806E5DA153BE63BBC4A52DFB766838B669FDE,0
1870-01-12T00:03:58Z,The Smallpox Still Prevalent--Arrival of an Infected Schooner in the Bay.,https://query.nytimes.com/gst/abstract.html?res=9807E5DA153BE63BBC4A52DFB766838B669FDE,0
1870-01-12T00:03:58Z,A Wreck and a Rescue.,https://query.nytimes.com/gst/abstract.html?res=9C00E6DA153BE63BBC4A52DFB766838B669FDE,0
1870-01-12T00:03:58Z,The Telegraphers' Strike.,https://query.nytimes.com/gst/abstract.html?res=9C06E5DA153BE63BBC4A52DFB766838B669FDE,0
1870-01-12T00:03:58Z,Closing of Foreign Mails at the Post Office.,https://query.nytimes.com/gst/abstract.html?res=9A02E6DA153BE63BBC4A52DFB766838B669FDE,0
1870-01-12T00:03:58Z,Movements of Ocean Steamers.,https://query.nytimes.com/gst/abstract.html?res=9902E6DA153BE63BBC4A52DFB766838B669FDE,0
1870-01-12T00:03:58Z,CUBA.; Fighting Near Puerto Principe-Insurgents Surrendering. The Spanish Gunboats--Anxiety for Their Safety.,https://query.nytimes.com/gst/abstract.html?res=9E05E5DA153BE63BBC4A52DFB766838B669FDE,0
1870-01-12T00:03:58Z,Passengers Sailed.,https://query.nytimes.com/gst/abstract.html?res=9B02E6DA153BE63BBC4A52DFB766838B669FDE,0
1870-01-12T00:03:58Z,Navy Yard Intelligence.,https://query.nytimes.com/gst/abstract.html?res=9A03E6DA153BE63BBC4A52DFB766838B669FDE,0
1870-01-12T00:03:58Z,THE CHURCH SCANDAL.; Further Particulars of the Cooke-Johnston Case--No Tidings of the Fugitives--Singular Letter of the Recreant Clergyman.,https://query.nytimes.com/gst/abstract.html?res=940CE6DA153BE63BBC4A52DFB766838B669FDE,0
1870-01-12T00:03:58Z,HELL GATE; New Submarine Drilling Apparatus--Another Step by the Government.,https://query.nytimes.com/gst/abstract.html?res=9E07E5DA153BE63BBC4A52DFB766838B669FDE,0
1870-01-12T00:03:58Z,Trial of Edwin Perry for the Murder of Thomas Hayes.,https://query.nytimes.com/gst/abstract.html?res=9A07E5DA153BE63BBC4A52DFB766838B669FDE,0
1870-01-12T00:03:58Z,MARINE INTELLIGENCE.; Cleared. Arrived. Below. By Telegraph.,https://query.nytimes.com/gst/abstract.html?res=9E0DE6DA153BE63BBC4A52DFB766838B669FDE,0
1870-01-12T00:03:58Z,The Primary Wheat Market of the World.,https://query.nytimes.com/gst/abstract.html?res=9504E5DA153BE63BBC4A52DFB766838B669FDE,0
1870-01-12T00:03:58Z,REAL ESTATE TRANSACTIONS.,https://query.nytimes.com/gst/abstract.html?res=9C03E6DA153BE63BBC4A52DFB766838B669FDE,0
1870-01-12T00:03:58Z,DIED.,https://query.nytimes.com/gst/abstract.html?res=9800E6DA153BE63BBC4A52DFB766838B669FDE,0
1870-01-12T00:03:58Z,Albany and Susquehanna Railroad Case.,https://query.nytimes.com/gst/abstract.html?res=9A05E5DA153BE63BBC4A52DFB766838B669FDE,0
1870-01-12T00:03:58Z,German Liederkranz Society.,https://query.nytimes.com/gst/abstract.html?res=9D06E5DA153BE63BBC4A52DFB766838B669FDE,0
1870-01-12T00:03:58Z,The Persecution of Virginia.,https://query.nytimes.com/gst/abstract.html?res=9E03E6DA153BE63BBC4A52DFB766838B669FDE,0
1870-01-12T00:03:58Z,AMUSEMENTS.; Theatrical. Musical.,https://query.nytimes.com/gst/abstract.html?res=9F03E6DA153BE63BBC4A52DFB766838B669FDE,0
1870-01-12T00:03:58Z,Aid for the Cubans--Departure of Another Vessel.,https://query.nytimes.com/gst/abstract.html?res=9C07E5DA153BE63BBC4A52DFB766838B669FDE,0
1870-01-12T00:03:58Z,Award of Contracts for Street Paving.,https://query.nytimes.com/gst/abstract.html?res=9907E5DA153BE63BBC4A52DFB766838B669FDE,0
1870-01-12T00:03:58Z,EAST RIVER NAVIGATION.; Its Perils on Account of the Sound Steamers--Memorial to the Legislature Concerning it.,https://query.nytimes.com/gst/abstract.html?res=9F07E5DA153BE63BBC4A52DFB766838B669FDE,0
1870-01-12T00:03:58Z,EUROPEAN MAIL NEWS.; ARRIVAL OF THE UNION AND CITY OF PARIS. THE ALABAMA. Lord Clarendon on the Amercian Claims--Excerpts from Dispatches to Minister Thornton.,https://query.nytimes.com/gst/abstract.html?res=9805E5DA153BE63BBC4A52DFB766838B669FDE,0
1870-01-12T00:03:58Z,The Drawback Frauds.,https://query.nytimes.com/gst/abstract.html?res=9F02E6DA153BE63BBC4A52DFB766838B669FDE,0
1870-01-12T00:03:58Z,The Spanish Government and its Alleged Advocates..,https://query.nytimes.com/gst/abstract.html?res=9E02E6DA153BE63BBC4A52DFB766838B669FDE,0
1870-01-12T00:03:58Z,BANKRUPT NOTICES.,https://query.nytimes.com/gst/abstract.html?res=980CE6DA153BE63BBC4A52DFB766838B669FDE,0
1870-01-12T00:03:58Z,Our New Possessions--The Chances of Acquistion.,https://query.nytimes.com/gst/abstract.html?res=9B00E6DA153BE63BBC4A52DFB766838B669FDE,0
1870-01-12T00:03:58Z,THE WHISKY FRAUDS.; Several Millions of Dollars Involved. Seizure of Books and Papers---Over Twenty Search Warrants Issued---Singular Efforts to Hoodwink the Officers.,https://query.nytimes.com/gst/abstract.html?res=9B0CE6DA153BE63BBC4A52DFB766838B669FDE,0
1870-01-12T00:03:58Z,"ALBANY.; Announcement of the Committees in Both Houses. Influence of the Tammany Ring Supreme in All. Disappointment of Ambitious Democrats. A Fierce Fight for the Spoils Between Tweed and Hoffman.. The ""Honest Legislature"" at its Congenial Work. Announcement of Standing Committees-The Governor's Appointments--The Late Board of Audit and the Comptroller-An Abortive Attempt to Make Political Capital-Contested Seats, &c. THE STATE LEGISLATURE.",https://query.nytimes.com/gst/abstract.html?res=9403E6DA153BE63BBC4A52DFB766838B669FDE,0
1870-01-12T00:03:58Z,The Telegraph Troubles.,https://query.nytimes.com/gst/abstract.html?res=9404E5DA153BE63BBC4A52DFB766838B669FDE,0
1870-01-12T00:03:58Z,Article 1 -- No Title,https://query.nytimes.com/gst/abstract.html?res=9A00E6DA153BE63BBC4A52DFB766838B669FDE,0
1870-01-12T00:03:58Z,STEAMBOATS.,https://query.nytimes.com/gst/abstract.html?res=950DE6DA153BE63BBC4A52DFB766838B669FDE,0
1870-01-12T00:03:58Z,THE NEW-JERSEY LEGISLATURE.; Opening of the Session Yesterday-Election of Officers-Address of the Speaker of the House-The Governor's Message.,https://query.nytimes.com/gst/abstract.html?res=9503E6DA153BE63BBC4A52DFB766838B669FDE,0
1870-01-12T00:03:58Z,TELEGRAMS.; EUROPE. Mr. Bright on Ireland -- The Reforms Needed--The Three Hundred Thousand Policemen and Soldiers to be Withdrawn. The Imperial Homicide in Paris--Prince Bonaparte's Account of the Tragedy--The Matter in the Corps Legislatif--A Menace from the Government.,https://query.nytimes.com/gst/abstract.html?res=9D05E5DA153BE63BBC4A52DFB766838B669FDE,0
1870-01-12T00:03:58Z,Another Murder--Death of a Man from Wounds.,https://query.nytimes.com/gst/abstract.html?res=9501E6DA153BE63BBC4A52DFB766838B669FDE,0
1870-01-12T00:03:58Z,Thirteenth Assembly District Union Republican Association.,https://query.nytimes.com/gst/abstract.html?res=9E06E5DA153BE63BBC4A52DFB766838B669FDE,0
1870-01-12T00:03:58Z,The Contest for the Control of the Ninth National Bank--Election of Officers.,https://query.nytimes.com/gst/abstract.html?res=9905E5DA153BE63BBC4A52DFB766838B669FDE,0
1870-01-12T00:03:58Z,FINANCIAL.,https://query.nytimes.com/gst/abstract.html?res=990DE6DA153BE63BBC4A52DFB766838B669FDE,0
1870-01-12T00:03:58Z,WASHINGTON.; The Virginia Question in Both Branches of Congress. New Bill Introduced by the Reconstruction Committee. An Important Financial Bill Reported by Senator Sherman. PRESIDENT GRANT'S FIRST VETO. The Virginia Question in Both Branches of Congress. The Gold Investigation-Early Debate on the Alabama Claim Question-Opinions of Leading Members-Speech of Mr. Kelley Against Commissioner Wells-Mrs. Grant's Opening Reception-Miscellancous.,https://query.nytimes.com/gst/abstract.html?res=9507E5DA153BE63BBC4A52DFB766838B669FDE,0
1870-01-12T00:03:58Z,HANDCUFFED BY HIS WIFE.; A Hint for the Sorosis--The Latest Thing in Conjugal Discipline.,https://query.nytimes.com/gst/abstract.html?res=9B07E5DA153BE63BBC4A52DFB766838B669FDE,0
1870-01-12T00:03:58Z,MINIATURE ALMANAC--THIS DAY.,https://query.nytimes.com/gst/abstract.html?res=9D0DE6DA153BE63BBC4A52DFB766838B669FDE,0
1870-01-12T00:03:58Z,NEWS PACKAGES FOR THE PRESS.,https://query.nytimes.com/gst/abstract.html?res=9C0DE6DA153BE63BBC4A52DFB766838B669FDE,0
1870-01-13T00:03:58Z,Cleaning Out Hell Gate.,https://query.nytimes.com/gst/abstract.html?res=9F02E0DB153DE63BBC4B52DFB766838B669FDE,0
1870-01-13T00:03:58Z,Retailers of Liquid Death.,https://query.nytimes.com/gst/abstract.html?res=9403E1DB153DE63BBC4B52DFB766838B669FDE,0
1870-01-13T00:03:58Z,MARRIED.,https://query.nytimes.com/gst/abstract.html?res=9C06E0DB153DE63BBC4B52DFB766838B669FDE,0
1870-01-13T00:03:58Z,A SINGULAR SUIT.; Contracts in Aid of the Rebellion--How the Confederate Soldiers were Supplied with Uniforms.,https://query.nytimes.com/gst/abstract.html?res=9C0DE0DB153DE63BBC4B52DFB766838B669FDE,0
1870-01-13T00:03:58Z,Closing of Domestic Mails.,https://query.nytimes.com/gst/abstract.html?res=9D0DE1DB153DE63BBC4B52DFB766838B669FDE,0
1870-01-13T00:03:58Z,"THE LOGAN MURDER; Additional Testimony Obtained--""Hawkshaw"" Fully Identified as the Murderer.",https://query.nytimes.com/gst/abstract.html?res=9B0DE0DB153DE63BBC4B52DFB766838B669FDE,0
1870-01-13T00:03:58Z,The New Era in France.,https://query.nytimes.com/gst/abstract.html?res=9900E0DB153DE63BBC4B52DFB766838B669FDE,0
1870-01-13T00:03:58Z,The Telegraphers' Strike.,https://query.nytimes.com/gst/abstract.html?res=9A03E0DB153DE63BBC4B52DFB766838B669FDE,0
1870-01-13T00:03:58Z,Supposed Suicide at Melrose.,https://query.nytimes.com/gst/abstract.html?res=9F03E1DB153DE63BBC4B52DFB766838B669FDE,0
1870-01-13T00:03:58Z,Passengers Sailed.,https://query.nytimes.com/gst/abstract.html?res=9F0DE1DB153DE63BBC4B52DFB766838B669FDE,0
1870-01-13T00:03:58Z,STEAMBOATS.,https://query.nytimes.com/gst/abstract.html?res=9A0CE1DB153DE63BBC4B52DFB766838B669FDE,0
1870-01-13T00:03:58Z,"DOMESTIC TELEGRAMS.; POLITICAL, Nomination of a Temperance State Ticket in New-Hampshire--The Tennessee Constitutional Convention--The Texas Election. Proceedings of State Legislatures-The Election for State Treasurer in Pennsylvania. The Georgia Legislature--Orders by General Terry. The Louisiana Legislature. Message of the Governor of Kansas--The Fiftecnth Amendment.",https://query.nytimes.com/gst/abstract.html?res=9E02E0DB153DE63BBC4B52DFB766838B669FDE,0
1870-01-13T00:03:58Z,Premature Explosion of a Blast--Two men Injured.,https://query.nytimes.com/gst/abstract.html?res=9400E1DB153DE63BBC4B52DFB766838B669FDE,0
1870-01-13T00:03:58Z,The Late Don Gregorio Dominguez and the Chilian and Peruvian Bonds.,https://query.nytimes.com/gst/abstract.html?res=9505EFDB153DE63BBC4B52DFB766838B669FDE,0
1870-01-13T00:03:58Z,Bricklayers' National Convention at Chicago.,https://query.nytimes.com/gst/abstract.html?res=9B04E0DB153DE63BBC4B52DFB766838B669FDE,0
1870-01-13T00:03:58Z,ALBANY.; Free Liquor in New-York--Legislating Republicans Out of Office--Democratic Retrenchment--An Executive Session--The Governor's Nominations Still in Abeyance--Auditor Bell to be Ousted.,https://query.nytimes.com/gst/abstract.html?res=9C04E0DB153DE63BBC4B52DFB766838B669FDE,0
1870-01-13T00:03:58Z,OUR SHIPPING INTERESTS.; Meeting of the Shipowners' Association--Important Opinion of the Conunsel on Quarantine Extortions--Debate on the Decline of American Commerce--Decision on the Sale of Petroleum.,https://query.nytimes.com/gst/abstract.html?res=9D07EFDB153DE63BBC4B52DFB766838B669FDE,0
1870-01-13T00:03:58Z,"COMMUNICATIONS.; The Bar and the Defence of Dishonesty. The Income Tnx. The Post Office and the Ocean Mails. The Ocean Mails--Letter from ""Another Merchant."" The Collector of the Port and the Cartage Business.",https://query.nytimes.com/gst/abstract.html?res=9504EFDB153DE63BBC4B52DFB766838B669FDE,0
1870-01-13T00:03:58Z,Article 1 -- No Title,https://query.nytimes.com/gst/abstract.html?res=9C03E0DB153DE63BBC4B52DFB766838B669FDE,0
1870-01-13T00:03:58Z,BANKRUPT NOTICES.,https://query.nytimes.com/gst/abstract.html?res=9B05E0DB153DE63BBC4B52DFB766838B669FDE,0
1870-01-13T00:03:58Z,ARCTIC EXPLORATIONS.; Some Account of the German Expedition--Its Plans and Purposes--Letter to Captain Hall From M. Lindeman.,https://query.nytimes.com/gst/abstract.html?res=9E03E0DB153DE63BBC4B52DFB766838B669FDE,0
1870-01-13T00:03:58Z,AMUSEMENTS; Theatrical.. Musical Notes.,https://query.nytimes.com/gst/abstract.html?res=9E07E0DB153DE63BBC4B52DFB766838B669FDE,0
1870-01-13T00:03:58Z,MINIATURE ALMANAC--THIS DAY.,https://query.nytimes.com/gst/abstract.html?res=9C00E1DB153DE63BBC4B52DFB766838B669FDE,0
1870-01-13T00:03:58Z,A Wife Brutally Beaten.,https://query.nytimes.com/gst/abstract.html?res=9D04EFDB153DE63BBC4B52DFB766838B669FDE,0
1870-01-13T00:03:58Z,LABOR MOVEMENTS.; Important Meeting of Cigar Manufacturers--The Present Depression and Its Remedy. Meetings Last Night. Newark Workingmen's Building and Loan Association.,https://query.nytimes.com/gst/abstract.html?res=9F04E0DB153DE63BBC4B52DFB766838B669FDE,0
1870-01-13T00:03:58Z,Ball of the Brennan Coterie.,https://query.nytimes.com/gst/abstract.html?res=9E03E1DB153DE63BBC4B52DFB766838B669FDE,0
