pub_date,main_headline,article_url,classification
1872-01-29T00:03:58Z,"SCIENCE AND RELIGION.; Lecture, by Bishop Coxe Harmony of Science with Revelation.",https://query.nytimes.com/gst/abstract.html?res=9902E5DC1739EF34BC4151DFB7668389669FDE,0
1872-01-29T00:03:58Z,"The Wife of Ex-Gov. Reynolds, of Missouri, Fatally Burned by Her ClothingTaking Fire at an Open Grate.",https://query.nytimes.com/gst/abstract.html?res=9403E6DC1739EF34BC4151DFB7668389669FDE,0
1872-01-29T00:03:58Z,FOREIGN NOTES.,https://query.nytimes.com/gst/abstract.html?res=9802E6DC1739EF34BC4151DFB7668389669FDE,0
1872-01-29T00:03:58Z,Rev. Dr. Bradley's Antecedents.,https://query.nytimes.com/gst/abstract.html?res=9502E5DC1739EF34BC4151DFB7668389669FDE,0
1872-01-29T00:03:58Z,GEN. R.S. EWELL.; Interesting Particulars of the Last Illness and Death of this Confederate Leader Almost Simultaneous Death of His Wife His Dying Wishes Respecting the Inscription Upon HisTombstone.,https://query.nytimes.com/gst/abstract.html?res=9906E5DC1739EF34BC4151DFB7668389669FDE,0
1872-01-29T00:03:58Z,"THE LATEST NEWS.; Gov. Woods, of Utah, Vetoes the State Convention Bill. He Advises the Discontinuance of Polygamy. The ""Apostles"" in a Rage Denounce the Message as an Insult. English Attitude on the French Treaty of Commerce. The Czar and the Pope Coming to an Understanding. Catholic Bishops to be Reinstated in Polish Dioceses. UTAH. Veto of the Act to Hold a State Convention Rage of the ""Apostles"" andSaints in the Legislature.",https://query.nytimes.com/gst/abstract.html?res=9B02E6DC1739EF34BC4151DFB7668389669FDE,0
1872-01-29T00:03:58Z,A Strange Mistake.,https://query.nytimes.com/gst/abstract.html?res=9F01E5DC1739EF34BC4151DFB7668389669FDE,0
1872-01-29T00:03:58Z,American and Foreign Christian Union.,https://query.nytimes.com/gst/abstract.html?res=9B02E5DC1739EF34BC4151DFB7668389669FDE,0
1872-01-29T00:03:58Z,The Internationalists.,https://query.nytimes.com/gst/abstract.html?res=9E0DE5DC1739EF34BC4151DFB7668389669FDE,0
1872-01-29T00:03:58Z,LIBERAL REPUBLICANISM.; The Real Condition of Political Affairs in Missouri Reunion of the Party.,https://query.nytimes.com/gst/abstract.html?res=9B06E5DC1739EF34BC4151DFB7668389669FDE,0
1872-01-29T00:03:58Z,The Erie Petitions.,https://query.nytimes.com/gst/abstract.html?res=980CE6DC1739EF34BC4151DFB7668389669FDE,0
1872-01-29T00:03:58Z,Fair Dealing Or Cheating?,https://query.nytimes.com/gst/abstract.html?res=9B04E5DC1739EF34BC4151DFB7668389669FDE,0
1872-01-29T00:03:58Z,REV. DR. HEPWORTH.; The Companionship and Example of Christ.,https://query.nytimes.com/gst/abstract.html?res=9D02E5DC1739EF34BC4151DFB7668389669FDE,0
1872-01-29T00:03:58Z,Young Ladies' Christian Association.,https://query.nytimes.com/gst/abstract.html?res=9A02E5DC1739EF34BC4151DFB7668389669FDE,0
1872-01-29T00:03:58Z,GREAT BRITAIN.; The Prince of Wales Going to the Mediteranean The Commercial Treaty with France.,https://query.nytimes.com/gst/abstract.html?res=9402E6DC1739EF34BC4151DFB7668389669FDE,0
1872-01-29T00:03:58Z,Article 2 -- No Title,https://query.nytimes.com/gst/abstract.html?res=9F04E5DC1739EF34BC4151DFB7668389669FDE,0
1872-01-29T00:03:58Z,Notice.,https://query.nytimes.com/gst/abstract.html?res=9C04E5DC1739EF34BC4151DFB7668389669FDE,0
1872-01-29T00:03:58Z,Last Week's Storm in Nebraska.,https://query.nytimes.com/gst/abstract.html?res=9D03E6DC1739EF34BC4151DFB7668389669FDE,0
1872-01-29T00:03:58Z,The Department of Public Works.,https://query.nytimes.com/gst/abstract.html?res=9F02E5DC1739EF34BC4151DFB7668389669FDE,0
1872-01-29T00:03:58Z,MARKETS BY TELEGRAPH.,https://query.nytimes.com/gst/abstract.html?res=9D05E5DC1739EF34BC4151DFB7668389669FDE,0
1872-01-29T00:03:58Z,POLITICAL NOTES.,https://query.nytimes.com/gst/abstract.html?res=9F06E5DC1739EF34BC4151DFB7668389669FDE,0
1872-01-29T00:03:58Z,Verdict of Justifiable Homicide.,https://query.nytimes.com/gst/abstract.html?res=9C0DE6DC1739EF34BC4151DFB7668389669FDE,0
1872-01-29T00:03:58Z,COLLEGE OF THE CITY OF NEWYORK.; Programme of the Examinations This Week Rules for Marking and Rating the Students.,https://query.nytimes.com/gst/abstract.html?res=9F0DE6DC1739EF34BC4151DFB7668389669FDE,0
1872-01-29T00:03:58Z,"How to Keep House and Live Well on Less than $1,200 a Year.",https://query.nytimes.com/gst/abstract.html?res=9D00E5DC1739EF34BC4151DFB7668389669FDE,0
1872-01-29T00:03:58Z,The Wrecks in Charleston Harbor.,https://query.nytimes.com/gst/abstract.html?res=9D01E5DC1739EF34BC4151DFB7668389669FDE,0
1872-01-29T00:03:58Z,AFFAIRS IN FRANCE.; The Paris Election Preliminaries of the Struggle Attitude of the Press Significance of the Result An Exampleof Party Feeling Decadence of Princes The Late Commune.,https://query.nytimes.com/gst/abstract.html?res=9E0DE6DC1739EF34BC4151DFB7668389669FDE,0
1872-01-29T00:03:58Z,SAVINGS BANKS.; Their Inherent Defects and the Way to Remedy Them The Subject Illustrated by Remarks Upon the Failure of the Market Savings Bank.,https://query.nytimes.com/gst/abstract.html?res=950DE6DC1739EF34BC4151DFB7668389669FDE,0
1872-01-29T00:03:58Z,A UNITARIAN SERMON.; Rev. James Freeman Clarke on the Religion of the Future Unitarianism'sClaims.,https://query.nytimes.com/gst/abstract.html?res=9D0CE6DC1739EF34BC4151DFB7668389669FDE,0
1872-01-29T00:03:58Z,"FIRES YESTERDAY.; Serious Disaster in Bethune-street Property worth $50,000 Destroyed.",https://query.nytimes.com/gst/abstract.html?res=9C0DE5DC1739EF34BC4151DFB7668389669FDE,0
1872-01-29T00:03:58Z,The Committee of Seventy.,https://query.nytimes.com/gst/abstract.html?res=9904E5DC1739EF34BC4151DFB7668389669FDE,0
1872-01-29T00:03:58Z,The Grand Duke Alexis Cincinnati Redeeming its Character for Courtesy.,https://query.nytimes.com/gst/abstract.html?res=9F03E6DC1739EF34BC4151DFB7668389669FDE,0
1872-01-29T00:03:58Z,REAL ESTATE TRANSACTIONS.,https://query.nytimes.com/gst/abstract.html?res=9F00E5DC1739EF34BC4151DFB7668389669FDE,0
1872-01-29T00:03:58Z,Savings Banks Old and New.,https://query.nytimes.com/gst/abstract.html?res=9C0CE6DC1739EF34BC4151DFB7668389669FDE,0
1872-01-29T00:03:58Z,"THE UNION REPUBLICAN PARTY.; Official Call for the Convention to Meet in Philadelphia, June 5, to Nominate Candidates for President and VicePresident.",https://query.nytimes.com/gst/abstract.html?res=9507E5DC1739EF34BC4151DFB7668389669FDE,0
1872-01-29T00:03:58Z,The Building Interest.,https://query.nytimes.com/gst/abstract.html?res=9C02E5DC1739EF34BC4151DFB7668389669FDE,0
1872-01-29T00:03:58Z,Destructive Fire in St. Louis.,https://query.nytimes.com/gst/abstract.html?res=9D0DE6DC1739EF34BC4151DFB7668389669FDE,0
1872-01-29T00:03:58Z,Another Murderous Assault in Capt. Power's Precinct.,https://query.nytimes.com/gst/abstract.html?res=9B07E5DC1739EF34BC4151DFB7668389669FDE,0
1872-01-29T00:03:58Z,THE COAL REGIONS.; Fatal Railroad Accident A Wilful Man Instantly Killed Reduction of Wages Amount of Coal Mined Since Navigation.,https://query.nytimes.com/gst/abstract.html?res=9400E6DC1739EF34BC4151DFB7668389669FDE,0
1872-01-29T00:03:58Z,DIED.,https://query.nytimes.com/gst/abstract.html?res=9A01E5DC1739EF34BC4151DFB7668389669FDE,0
1872-01-29T00:03:58Z,NEW-JERSEY.,https://query.nytimes.com/gst/abstract.html?res=9B0DE5DC1739EF34BC4151DFB7668389669FDE,0
1872-01-29T00:03:58Z,THE COOLIE TRADE.; Importations into Cuba Pertinent Questions Atrocities of the System not Lessthan those of Slavery.,https://query.nytimes.com/gst/abstract.html?res=9500E6DC1739EF34BC4151DFB7668389669FDE,0
1872-01-29T00:03:58Z,"Tweed, Hall and Connolly.",https://query.nytimes.com/gst/abstract.html?res=990DE5DC1739EF34BC4151DFB7668389669FDE,0
1872-01-29T00:03:58Z,The Watson Shooting Affray.,https://query.nytimes.com/gst/abstract.html?res=9407E5DC1739EF34BC4151DFB7668389669FDE,0
1872-01-29T00:03:58Z,PAYING THE PIPER.; How a Buffalo Democrat was Surprised by a Serenade and How He Refused to Pay the Bill for the Band.,https://query.nytimes.com/gst/abstract.html?res=9E01E5DC1739EF34BC4151DFB7668389669FDE,0
1872-01-29T00:03:58Z,Article 1 -- No Title,https://query.nytimes.com/gst/abstract.html?res=9E04E5DC1739EF34BC4151DFB7668389669FDE,0
1872-01-29T00:03:58Z,GEN. SCHENCK.; Text of His Letter of Resignation from the Emma Mining Committee.,https://query.nytimes.com/gst/abstract.html?res=9C02E6DC1739EF34BC4151DFB7668389669FDE,0
1872-01-29T00:03:58Z,Convention of Amateur Editors.,https://query.nytimes.com/gst/abstract.html?res=980DE6DC1739EF34BC4151DFB7668389669FDE,0
1872-01-29T00:03:58Z,TELEGRAPHIC BREVITIES.,https://query.nytimes.com/gst/abstract.html?res=9903E6DC1739EF34BC4151DFB7668389669FDE,0
1872-01-29T00:03:58Z,"Daniel Webster and the ""One Term"" Principle.",https://query.nytimes.com/gst/abstract.html?res=9C06E5DC1739EF34BC4151DFB7668389669FDE,0
1872-01-29T00:03:58Z,Reception of Philadelphia Yale Alumni.,https://query.nytimes.com/gst/abstract.html?res=9B03E6DC1739EF34BC4151DFB7668389669FDE,0
1872-01-29T00:03:58Z,COMMERCIAL AFFAIRS.,https://query.nytimes.com/gst/abstract.html?res=9C05E5DC1739EF34BC4151DFB7668389669FDE,0
1872-01-29T00:03:58Z,The Cost of Living.,https://query.nytimes.com/gst/abstract.html?res=9E00E5DC1739EF34BC4151DFB7668389669FDE,0
1872-01-29T00:03:58Z,Is it Grand Larceny?,https://query.nytimes.com/gst/abstract.html?res=980DE5DC1739EF34BC4151DFB7668389669FDE,0
1872-01-29T00:03:58Z,Charter-Making in New-Jersey.,https://query.nytimes.com/gst/abstract.html?res=9A02E6DC1739EF34BC4151DFB7668389669FDE,0
1872-01-29T00:03:58Z,"MARINE INTELLIGENCE.; Arrived. By Telegraph. Spoken, &c.",https://query.nytimes.com/gst/abstract.html?res=950DE5DC1739EF34BC4151DFB7668389669FDE,0
1872-01-29T00:03:58Z,The Right of Authors to Their Own Property.,https://query.nytimes.com/gst/abstract.html?res=9404E5DC1739EF34BC4151DFB7668389669FDE,0
1872-01-29T00:03:58Z,MACGREGOR'S OFFICE.; The Outrageous Frauds in the Department of Buildings. Sworn Statements of Builders and Property Owners.Charges of Blackmail Affidavits of the Victims A Specimen Pay-Roll Extracts froma Forthcoming Pamphlet.,https://query.nytimes.com/gst/abstract.html?res=9503E5DC1739EF34BC4151DFB7668389669FDE,0
1872-01-29T00:03:58Z,Reception of the New-England Society.,https://query.nytimes.com/gst/abstract.html?res=9806E5DC1739EF34BC4151DFB7668389669FDE,0
1872-01-29T00:03:58Z,The Whipping-Post in Virginia Bill for its Abolition.,https://query.nytimes.com/gst/abstract.html?res=9C01E5DC1739EF34BC4151DFB7668389669FDE,0
1872-01-29T00:03:58Z,Attempts to Commit Suicide.,https://query.nytimes.com/gst/abstract.html?res=9802E5DC1739EF34BC4151DFB7668389669FDE,0
1872-01-29T00:03:58Z,THE ALABAMA CLAIMS.; English Press Views on the American Case.,https://query.nytimes.com/gst/abstract.html?res=9503E6DC1739EF34BC4151DFB7668389669FDE,0
1872-01-29T00:03:58Z,Minor Crimes and Casualties.,https://query.nytimes.com/gst/abstract.html?res=9B0DE6DC1739EF34BC4151DFB7668389669FDE,0
1872-01-30T00:03:58Z,Department of Public Works.,https://query.nytimes.com/gst/abstract.html?res=9804E3DC1739EF34BC4850DFB7668389669FDE,0
1872-01-30T00:03:58Z,The Japanese Ambassadors Start for the East.,https://query.nytimes.com/gst/abstract.html?res=9B05E4DC1739EF34BC4850DFB7668389669FDE,0
1872-01-30T00:03:58Z,Sports on the Ice.,https://query.nytimes.com/gst/abstract.html?res=9C04E3DC1739EF34BC4850DFB7668389669FDE,0
1872-01-30T00:03:58Z,"ANNIVERSARY SERVICES.; Anniversary of the Young Men's Christian Association Addresses by Revs.Hepworth, Tyng, Scudder, &c.",https://query.nytimes.com/gst/abstract.html?res=9B05E3DC1739EF34BC4850DFB7668389669FDE,0
1872-01-30T00:03:58Z,AMUSEMENTS.; Musical. GERMAN OPERA AT THE STADT.,https://query.nytimes.com/gst/abstract.html?res=9900E4DC1739EF34BC4850DFB7668389669FDE,0
1872-01-30T00:03:58Z,Board of Assistant Aldermen.,https://query.nytimes.com/gst/abstract.html?res=9A05E3DC1739EF34BC4850DFB7668389669FDE,0
1872-01-30T00:03:58Z,GENERAL BROOKLYN NEWS.; Proposal to Increase the Police Force.,https://query.nytimes.com/gst/abstract.html?res=950CE4DC1739EF34BC4850DFB7668389669FDE,0
1872-01-30T00:03:58Z,DIED,https://query.nytimes.com/gst/abstract.html?res=9A02E4DC1739EF34BC4850DFB7668389669FDE,0
1872-01-30T00:03:58Z,FOREIGN MARKETS.,https://query.nytimes.com/gst/abstract.html?res=9B06E4DC1739EF34BC4850DFB7668389669FDE,0
1872-01-30T00:03:58Z,Carl Schurz in Missouri.,https://query.nytimes.com/gst/abstract.html?res=9400E4DC1739EF34BC4850DFB7668389669FDE,0
1872-01-30T00:03:58Z,The Grand Jury's Investigations.,https://query.nytimes.com/gst/abstract.html?res=9500E4DC1739EF34BC4850DFB7668389669FDE,0
1872-01-30T00:03:58Z,THE STATE LEGISLATURE.; ASSEMBLY.,https://query.nytimes.com/gst/abstract.html?res=9505E4DC1739EF34BC4850DFB7668389669FDE,0
1872-01-30T00:03:58Z,The Grand Duke Alexis.,https://query.nytimes.com/gst/abstract.html?res=9A04E4DC1739EF34BC4850DFB7668389669FDE,0
1872-01-30T00:03:58Z,Article 1 -- No Title,https://query.nytimes.com/gst/abstract.html?res=9B01E4DC1739EF34BC4850DFB7668389669FDE,0
1872-01-30T00:03:58Z,"Tweed, Hall and Connolly.",https://query.nytimes.com/gst/abstract.html?res=9B03E4DC1739EF34BC4850DFB7668389669FDE,0
1872-01-30T00:03:58Z,An Unfortunate Clergyman.,https://query.nytimes.com/gst/abstract.html?res=9E00E4DC1739EF34BC4850DFB7668389669FDE,0
1872-01-30T00:03:58Z,EDWARD S. STOKES.; A Motion Made Before Judge Ingra- ham to Quash the Indictment. Affidavits of Stokes and Arguments of Counsel in Support of the Motion The Legality of the Indictment Question Decision Reserved.,https://query.nytimes.com/gst/abstract.html?res=9A00E4DC1739EF34BC4850DFB7668389669FDE,0
1872-01-30T00:03:58Z,Serious Accident and Fire on the Pennsylvania Central Railroad.,https://query.nytimes.com/gst/abstract.html?res=9B04E4DC1739EF34BC4850DFB7668389669FDE,0
1872-01-30T00:03:58Z,"JAIL DELIVERIES.; An Arkansas Jail Forced Open Escape of Two Men Under Sentence of Death, and Three Other Desperadoes. Escape of Prisoners from a Kentucky Jail. Escape of Convicts at Princeton, Ind.",https://query.nytimes.com/gst/abstract.html?res=9805E4DC1739EF34BC4850DFB7668389669FDE,0
1872-01-30T00:03:58Z,NEW-JERSEY LEGISLATURE.; The Pennsylvania Central Executive Appointments The Bergen Tunnel and Erie New Bills.,https://query.nytimes.com/gst/abstract.html?res=9803E4DC1739EF34BC4850DFB7668389669FDE,0
1872-01-30T00:03:58Z,What Becomes of the License Money?,https://query.nytimes.com/gst/abstract.html?res=9F05E3DC1739EF34BC4850DFB7668389669FDE,0
1872-01-30T00:03:58Z,NEW-YORK CATTLE MARKET.,https://query.nytimes.com/gst/abstract.html?res=9906E4DC1739EF34BC4850DFB7668389669FDE,0
1872-01-30T00:03:58Z,Movements of Ocean Steamers.,https://query.nytimes.com/gst/abstract.html?res=9E07E3DC1739EF34BC4850DFB7668389669FDE,0
1872-01-30T00:03:58Z,The Ohio Legislature on Redistricting the State.,https://query.nytimes.com/gst/abstract.html?res=9904E4DC1739EF34BC4850DFB7668389669FDE,0
1872-01-30T00:03:58Z,The New-York College Examination First Day.,https://query.nytimes.com/gst/abstract.html?res=9E04E3DC1739EF34BC4850DFB7668389669FDE,0
1872-01-30T00:03:58Z,The Old Firemen's Ball.,https://query.nytimes.com/gst/abstract.html?res=9E03E4DC1739EF34BC4850DFB7668389669FDE,0
1872-01-30T00:03:58Z,The Gas Swindle.,https://query.nytimes.com/gst/abstract.html?res=9B00E4DC1739EF34BC4850DFB7668389669FDE,0
1872-01-30T00:03:58Z,MARINE INTELLIGENCE.; Cleared. Arrived. By Telegraph. Foreign Ports. Spoken. European Marine News.,https://query.nytimes.com/gst/abstract.html?res=9A07E3DC1739EF34BC4850DFB7668389669FDE,0
1872-01-30T00:03:58Z,NEBRASKA.; The Recent Political Trouble at the State Capital.,https://query.nytimes.com/gst/abstract.html?res=9506E4DC1739EF34BC4850DFB7668389669FDE,0
1872-01-30T00:03:58Z,FRANCE.; Address of the Count of Chamberd to the People Paying off the Indemnity.,https://query.nytimes.com/gst/abstract.html?res=9E05E4DC1739EF34BC4850DFB7668389669FDE,0
1872-01-30T00:03:58Z,The Contest for Frear's Seat Additional Testimony.,https://query.nytimes.com/gst/abstract.html?res=9D04E3DC1739EF34BC4850DFB7668389669FDE,0
1872-01-30T00:03:58Z,Inside View of the Department of Public Works.,https://query.nytimes.com/gst/abstract.html?res=9907E4DC1739EF34BC4850DFB7668389669FDE,0
1872-01-30T00:03:58Z,ERIE AND ITS FEEDERS.; Boads Leased by the Company The Wallkill Valley Refuses to be Leased.,https://query.nytimes.com/gst/abstract.html?res=9D02E4DC1739EF34BC4850DFB7668389669FDE,0
1872-01-30T00:03:58Z,BROOKLYN CRIMES.; More Acts of Ruffianism in the City of Churches. Continuation of the Panormo Inquest Attempted Murder in Prospect Street Another Highway Robbery Murderous Assault by a Father Upon His Family Attempted Suicide The Watson Murder.THE PANORMO MURDER.The Latest Particulars of the Case Continuation of the Inquest.,https://query.nytimes.com/gst/abstract.html?res=9B0CE4DC1739EF34BC4850DFB7668389669FDE,0
1872-01-30T00:03:58Z,TELEGRAPHIC BREVITIES.,https://query.nytimes.com/gst/abstract.html?res=9C07E4DC1739EF34BC4850DFB7668389669FDE,0
1872-01-30T00:03:58Z,MINOR TOPICS.,https://query.nytimes.com/gst/abstract.html?res=9F00E4DC1739EF34BC4850DFB7668389669FDE,0
1872-01-30T00:03:58Z,Sale of the Metropolitan Hotel.,https://query.nytimes.com/gst/abstract.html?res=9F04E3DC1739EF34BC4850DFB7668389669FDE,0
1872-01-30T00:03:58Z,Atlantic Mail Service.,https://query.nytimes.com/gst/abstract.html?res=9903E4DC1739EF34BC4850DFB7668389669FDE,0
1872-01-30T00:03:58Z,LOCAL NEWS IN BRIEF.; NEW-YORK.,https://query.nytimes.com/gst/abstract.html?res=9A04E3DC1739EF34BC4850DFB7668389669FDE,0
1872-01-30T00:03:58Z,Great Cry and Little Wool.,https://query.nytimes.com/gst/abstract.html?res=9401E4DC1739EF34BC4850DFB7668389669FDE,0
1872-01-30T00:03:58Z,HOUSE OF REPRESENTATIVES.,https://query.nytimes.com/gst/abstract.html?res=9D03E4DC1739EF34BC4850DFB7668389669FDE,0
1872-01-30T00:03:58Z,OTHER OUTRAGES.; Attempted Murder in Prospect-Street. Two More Highway Robberies. A Murderous Assault by a Father Upon His Family. The Shooting of Mr. Watson in the Eastern District. An Important Arrest The Detectives at Work at Last. Attempt at Suicide.,https://query.nytimes.com/gst/abstract.html?res=940CE4DC1739EF34BC4850DFB7668389669FDE,0
1872-01-30T00:03:58Z,The Condition of Jack Glass.,https://query.nytimes.com/gst/abstract.html?res=9F02E4DC1739EF34BC4850DFB7668389669FDE,0
1872-01-30T00:03:58Z,The Fulton Ferry-House Squabbles.,https://query.nytimes.com/gst/abstract.html?res=9C05E3DC1739EF34BC4850DFB7668389669FDE,0
1872-01-30T00:03:58Z,More Tammany Swindling.,https://query.nytimes.com/gst/abstract.html?res=9C02E4DC1739EF34BC4850DFB7668389669FDE,0
1872-01-30T00:03:58Z,LABOR IN CHICAGO.; No Work for Outsiders Manifesto from the Employment Committee.,https://query.nytimes.com/gst/abstract.html?res=9F04E4DC1739EF34BC4850DFB7668389669FDE,0
1872-01-30T00:03:58Z,FORTY-SECOND CONGRESS.; SECOND SESSION.,https://query.nytimes.com/gst/abstract.html?res=9C03E4DC1739EF34BC4850DFB7668389669FDE,0
1872-01-30T00:03:58Z,ALBANY.; The Evening Session of the Legislature Prospects for the Seventy's Charter Tweed's Seat Still Vacant.,https://query.nytimes.com/gst/abstract.html?res=9405E4DC1739EF34BC4850DFB7668389669FDE,0
1872-01-30T00:03:58Z,THE CITY ACCOUNTS.; A Startling Array of Fraud and Corruption. How Tweed Managed the Department of Public Works. Evasion of the Law Governing Contracts for Repairs and Supplies. Repetition of Items and Utter Con- fusion of Dates. Millions Stolen from the Treasury on Fraudalent Bills. Overcharges Found Everywhere in the Records.,https://query.nytimes.com/gst/abstract.html?res=9D07E4DC1739EF34BC4850DFB7668389669FDE,0
1872-01-30T00:03:58Z,MARKETS BY TELEGRAPH.,https://query.nytimes.com/gst/abstract.html?res=9A06E4DC1739EF34BC4850DFB7668389669FDE,0
1872-01-30T00:03:58Z,LONG ISLAND.,https://query.nytimes.com/gst/abstract.html?res=9B04E3DC1739EF34BC4850DFB7668389669FDE,0
1872-01-30T00:03:58Z,Gleanings from the Department of Public Works.,https://query.nytimes.com/gst/abstract.html?res=9501E4DC1739EF34BC4850DFB7668389669FDE,0
1872-01-30T00:03:58Z,UNITED STATES SUPREME COURT; The Decisions Rendered Yesterday The Captured Property Claims An Important Constitutional Principle LaidDown.,https://query.nytimes.com/gst/abstract.html?res=9C04E4DC1739EF34BC4850DFB7668389669FDE,0
1872-01-30T00:03:58Z,"TELEGRAPHIC NEWS.; Action of the House on the Final Adjournment. A ""Liberal"" Republican Senator Lobbying Against It. Democrats Shedding Crocodile Tears Over Cuba. Another Fight with the Revolted Looshais in India. Destruction of an Asiatic Town by an Earthquake. Count of Chambord Reasserting the Divine Right of Kings. WASHINGTON NEWS. Final Adjournment?Curious Scene in the House?Democratic Hypocrisy?Seneca Sand-Stone?The Ocean Cables?Mr.Trumbull and the Speaker?Miscellaneous.",https://query.nytimes.com/gst/abstract.html?res=950CE5DC1739EF34BC4850DFB7668389669FDE,0
1872-01-30T00:03:58Z,UNITED STATES SUPREME COURT.,https://query.nytimes.com/gst/abstract.html?res=9D06E4DC1739EF34BC4850DFB7668389669FDE,0
1872-01-30T00:03:58Z,Proposed Changes at Yale.,https://query.nytimes.com/gst/abstract.html?res=9E02E4DC1739EF34BC4850DFB7668389669FDE,0
1872-01-30T00:03:58Z,WESTCHESTER COUNTY.,https://query.nytimes.com/gst/abstract.html?res=9504E3DC1739EF34BC4850DFB7668389669FDE,0
1872-01-30T00:03:58Z,NEW-ORLEANS.; Proceedings of the Congressional Committee.,https://query.nytimes.com/gst/abstract.html?res=9404E4DC1739EF34BC4850DFB7668389669FDE,0
1872-01-30T00:03:58Z,Daniel Sheehan and the Tribune.,https://query.nytimes.com/gst/abstract.html?res=9C00E4DC1739EF34BC4850DFB7668389669FDE,0
1872-01-30T00:03:58Z,"Fire at Bound Brook, N.J.",https://query.nytimes.com/gst/abstract.html?res=9F03E4DC1739EF34BC4850DFB7668389669FDE,0
1872-01-30T00:03:58Z,REAL ESTATE TRANSACTIONS.,https://query.nytimes.com/gst/abstract.html?res=9402E4DC1739EF34BC4850DFB7668389669FDE,0
1872-01-30T00:03:58Z,The Jumel Ejectment Suit.,https://query.nytimes.com/gst/abstract.html?res=9E06E4DC1739EF34BC4850DFB7668389669FDE,0
1872-01-30T00:03:58Z,GREAT BRITAIN.; The English Press on the Alabama Claims Expressions of Uneasiness about the American Demands. John Bright on Public Affairs Colliery Strike.,https://query.nytimes.com/gst/abstract.html?res=9F05E4DC1739EF34BC4850DFB7668389669FDE,0
1872-01-30T00:03:58Z,Minor Crimes and Casualties.,https://query.nytimes.com/gst/abstract.html?res=9C01E4DC1739EF34BC4850DFB7668389669FDE,0
1872-01-30T00:03:58Z,DECISIONS.,https://query.nytimes.com/gst/abstract.html?res=9C06E4DC1739EF34BC4850DFB7668389669FDE,0
1872-01-30T00:03:58Z,A Slight Breeze in the Common Council Chamber.,https://query.nytimes.com/gst/abstract.html?res=9D05E3DC1739EF34BC4850DFB7668389669FDE,0
1872-01-30T00:03:58Z,The Collector of the Port of Troy.,https://query.nytimes.com/gst/abstract.html?res=9A05E4DC1739EF34BC4850DFB7668389669FDE,0
1872-01-30T00:03:58Z,ASIA.; The Revolt of the Looshias in British India Destruction of a Town by an Earthquake.,https://query.nytimes.com/gst/abstract.html?res=9D05E4DC1739EF34BC4850DFB7668389669FDE,0
1872-01-30T00:03:58Z,LAW REPORTS.; COURT CALENDARS THIS DAY. COURT OF APPEALS.,https://query.nytimes.com/gst/abstract.html?res=9507E4DC1739EF34BC4850DFB7668389669FDE,0
1872-01-30T00:03:58Z,The Cincinnati Convention.,https://query.nytimes.com/gst/abstract.html?res=9D00E4DC1739EF34BC4850DFB7668389669FDE,0
1872-01-30T00:03:58Z,MARRIED.,https://query.nytimes.com/gst/abstract.html?res=9902E4DC1739EF34BC4850DFB7668389669FDE,0
1872-01-30T00:03:58Z,Finances of the Commissioners of Emigration.,https://query.nytimes.com/gst/abstract.html?res=9505E3DC1739EF34BC4850DFB7668389669FDE,0
1872-01-30T00:03:58Z,Amusements This Evening.,https://query.nytimes.com/gst/abstract.html?res=9A01E4DC1739EF34BC4850DFB7668389669FDE,0
1872-01-30T00:03:58Z,UTAH.; The Admission Bill Vetoed A Scene of Excitement in the House.,https://query.nytimes.com/gst/abstract.html?res=9504E4DC1739EF34BC4850DFB7668389669FDE,0
1872-01-30T00:03:58Z,ALDERMANIC LEGISLATION.; Yesterday's Proceedings in Both Boards Appointment of Standing Committees Gas and Its Relation to the Pub-lic The Collector of Assessments and His Income A Busy Day for the Assistant Aldermen.,https://query.nytimes.com/gst/abstract.html?res=9905E3DC1739EF34BC4850DFB7668389669FDE,0
1872-01-30T00:03:58Z,The Coopers' Strike.,https://query.nytimes.com/gst/abstract.html?res=9403E4DC1739EF34BC4850DFB7668389669FDE,0
1872-01-30T00:03:58Z,Closing of Domestic Mails.,https://query.nytimes.com/gst/abstract.html?res=9907E3DC1739EF34BC4850DFB7668389669FDE,0
1872-01-30T00:03:58Z,Handsome Bequests to Wesleyan Institutions.,https://query.nytimes.com/gst/abstract.html?res=9804E4DC1739EF34BC4850DFB7668389669FDE,0
1872-01-30T00:03:58Z,A Legal Decision in Favor of the Government.,https://query.nytimes.com/gst/abstract.html?res=9C05E4DC1739EF34BC4850DFB7668389669FDE,0
1872-01-30T00:03:58Z,STATEN ISLAND.,https://query.nytimes.com/gst/abstract.html?res=9404E3DC1739EF34BC4850DFB7668389669FDE,0
1872-01-30T00:03:58Z,Explanatory.,https://query.nytimes.com/gst/abstract.html?res=9904E3DC1739EF34BC4850DFB7668389669FDE,0
1872-01-30T00:03:58Z,Actual Value of the Furniture in the City Hall.,https://query.nytimes.com/gst/abstract.html?res=9807E4DC1739EF34BC4850DFB7668389669FDE,0
1872-01-30T00:03:58Z,Repeal of the Erie Classification Act.,https://query.nytimes.com/gst/abstract.html?res=9805E3DC1739EF34BC4850DFB7668389669FDE,0
1872-01-30T00:03:58Z,A Brutal Husband.,https://query.nytimes.com/gst/abstract.html?res=9D07E3DC1739EF34BC4850DFB7668389669FDE,0
1872-01-30T00:03:58Z,Closing of Foreign Mails at Post-Office. TUESDAY.,https://query.nytimes.com/gst/abstract.html?res=9F07E3DC1739EF34BC4850DFB7668389669FDE,0
1872-01-30T00:03:58Z,NEW-JERSEY.,https://query.nytimes.com/gst/abstract.html?res=9C07E3DC1739EF34BC4850DFB7668389669FDE,0
1872-01-30T00:03:58Z,Brief Notes.,https://query.nytimes.com/gst/abstract.html?res=9E05E3DC1739EF34BC4850DFB7668389669FDE,0
1872-01-30T00:03:58Z,"Destruction of a Barn, with Fifty Head of Choice Cattle and Six Horses.",https://query.nytimes.com/gst/abstract.html?res=9A03E4DC1739EF34BC4850DFB7668389669FDE,0
