pub_date,main_headline,article_url,classification
1874-01-07T00:03:58Z,GOV. DIX'S MESSAGE.,https://query.nytimes.com/gst/abstract.html?res=9F07E7DD173BEF34BC4F53DFB766838F669FDE,0
1874-01-07T00:03:58Z,SINGULAR RAILROAD ACCIDENT.,https://query.nytimes.com/gst/abstract.html?res=9D02EEDE173BEF34BC4F53DFB766838F669FDE,0
1874-01-07T00:03:58Z,THE OLD GUARD.,https://query.nytimes.com/gst/abstract.html?res=9C04E7DD173BEF34BC4F53DFB766838F669FDE,0
1874-01-07T00:03:58Z,"CARNIVAL AT ATLANTA, GA.",https://query.nytimes.com/gst/abstract.html?res=9D06E7DD173BEF34BC4F53DFB766838F669FDE,0
1874-01-07T00:03:58Z,THE BANKRUPT LAW.,https://query.nytimes.com/gst/abstract.html?res=950DE7DD173BEF34BC4F53DFB766838F669FDE,0
1874-01-07T00:03:58Z,PASSENGERS ARRIVED.,https://query.nytimes.com/gst/abstract.html?res=9B05E6DD173BEF34BC4F53DFB766838F669FDE,0
1874-01-07T00:03:58Z,THE MEMORIAL BUILDING.,https://query.nytimes.com/gst/abstract.html?res=9E06E7DD173BEF34BC4F53DFB766838F669FDE,0
1874-01-07T00:03:58Z,THE BOSTON AND ALBANY RAILROAD.,https://query.nytimes.com/gst/abstract.html?res=9507E7DD173BEF34BC4F53DFB766838F669FDE,0
1874-01-07T00:03:58Z,DESTRUCTIVE FIRE IN LEONARD STREET.,https://query.nytimes.com/gst/abstract.html?res=9C00E7DD173BEF34BC4F53DFB766838F669FDE,0
1874-01-07T00:03:58Z,LETTERS FROM THE PEOPLE.,https://query.nytimes.com/gst/abstract.html?res=9C02E7DD173BEF34BC4F53DFB766838F669FDE,0
1874-01-07T00:03:58Z,AMUSEMENTS.; WIENIAWSKI-MAUREL CONCERTS.,https://query.nytimes.com/gst/abstract.html?res=9C06E7DD173BEF34BC4F53DFB766838F669FDE,0
1874-01-07T00:03:58Z,THE SCHUETZENCORPS.,https://query.nytimes.com/gst/abstract.html?res=9501E7DD173BEF34BC4F53DFB766838F669FDE,0
1874-01-07T00:03:58Z,THE NEW POLICE JUSTICES AND THE COLLECTION OF FINES.,https://query.nytimes.com/gst/abstract.html?res=9B01E7DD173BEF34BC4F53DFB766838F669FDE,0
1874-01-07T00:03:58Z,STATEN ISLAND; NEW-JERSEY. THE STATE OF TRADE.,https://query.nytimes.com/gst/abstract.html?res=9A05E6DD173BEF34BC4F53DFB766838F669FDE,0
1874-01-07T00:03:58Z,THE EMIGRATION COMMISSIONERS.,https://query.nytimes.com/gst/abstract.html?res=980CEEDE173BEF34BC4F53DFB766838F669FDE,0
1874-01-07T00:03:58Z,GREAT BRITAIN.; ELECTION OF ANOTHER CONSERVATIVE TO PARLIAMENT.,https://query.nytimes.com/gst/abstract.html?res=9A0DEEDE173BEF34BC4F53DFB766838F669FDE,0
1874-01-07T00:03:58Z,THE RING LAWYERS.,https://query.nytimes.com/gst/abstract.html?res=9400E7DD173BEF34BC4F53DFB766838F669FDE,0
1874-01-07T00:03:58Z,AID FOR THE NEEDY IN CHICAGO.,https://query.nytimes.com/gst/abstract.html?res=9B03E7DD173BEF34BC4F53DFB766838F669FDE,0
1874-01-07T00:03:58Z,MARINE INTELLIGENCE.; CLEARED. ARRIVED. BY TELEGRAPH.,https://query.nytimes.com/gst/abstract.html?res=9505E6DD173BEF34BC4F53DFB766838F669FDE,0
1874-01-07T00:03:58Z,A MOVEMENT FOR PROTECTION ON STATEN ISLAND.,https://query.nytimes.com/gst/abstract.html?res=9A0CE7DD173BEF34BC4F53DFB766838F669FDE,0
1874-01-07T00:03:58Z,BY MAIL AND TELEGRAPH.,https://query.nytimes.com/gst/abstract.html?res=9D0DEEDE173BEF34BC4F53DFB766838F669FDE,0
1874-01-07T00:03:58Z,MISTAKEN ZEAL.,https://query.nytimes.com/gst/abstract.html?res=9503E7DD173BEF34BC4F53DFB766838F669FDE,0
1874-01-07T00:03:58Z,THE BAR ASSOCIATION.; DISCUSSION ON THE NOMINEE FOR CHIEF JUSTICE. CONDEMNATION OF THE NOMINATION OF ATTORNEY GENERAL WILLIAMS IMPORTANT REPORT ON THE BANKRUPT LAW.,https://query.nytimes.com/gst/abstract.html?res=940DE7DD173BEF34BC4F53DFB766838F669FDE,0
1874-01-07T00:03:58Z,LABOR MOVEMENT IN LOUISVILLE.,https://query.nytimes.com/gst/abstract.html?res=9A02EEDE173BEF34BC4F53DFB766838F669FDE,0
1874-01-07T00:03:58Z,Article 2 -- No Title,https://query.nytimes.com/gst/abstract.html?res=9504E6DD173BEF34BC4F53DFB766838F669FDE,0
1874-01-07T00:03:58Z,THE GOVERNOR'S MESSAGE.; OFFICIAL HISTORY OF THE STATE FOR THE LAST YEAR. RECEIPTS AND EXPENDITURES. REDEMPTION OF THE STATE DEBT. TAXES. SALT SPRINGS. STATE PRISONS. STATE LIBRARY MILITIA. TRUST COMPANIES. BANKS. SAVINGS BANKS. INSURANCE DEPARTMENT. QUARANTINE. EMIGRATION. INSANE. STATE PARKS. SINKING FUNDS. PAYMENT OF STATE TAXES. RAILROAD COMPANIES. LEGISLATION. EMINENT DOMAIN. THE CURRENCY. PUBLIC BUILDINGS. CERTIFICATES FOR SERVICE IN THE WAR OF 1812. CENTENNIAL EXHIBITION. AMENDMENTS TO THE CONSTITUTION.,https://query.nytimes.com/gst/abstract.html?res=9F0CEEDE173BEF34BC4F53DFB766838F669FDE,0
1874-01-07T00:03:58Z,THE NEW PENNSYLVANIA CONSTITUTION.,https://query.nytimes.com/gst/abstract.html?res=9B02EEDE173BEF34BC4F53DFB766838F669FDE,0
1874-01-07T00:03:58Z,A MISSING JERSEYMAN.,https://query.nytimes.com/gst/abstract.html?res=9E0CE7DD173BEF34BC4F53DFB766838F669FDE,0
1874-01-07T00:03:58Z,FEAST OF THE EPIPHANY.,https://query.nytimes.com/gst/abstract.html?res=9D00E7DD173BEF34BC4F53DFB766838F669FDE,0
1874-01-07T00:03:58Z,OFFICES OF CORPORATION COUNSEL.,https://query.nytimes.com/gst/abstract.html?res=9D05E6DD173BEF34BC4F53DFB766838F669FDE,0
1874-01-07T00:03:58Z,CROPS OF 1873.; THE CORN AND WHEAT PRODUCTION OF THE MISSISSIPPI BASIN.,https://query.nytimes.com/gst/abstract.html?res=9A03E7DD173BEF34BC4F53DFB766838F669FDE,0
1874-01-07T00:03:58Z,THE REFORMED EPISCOPAL CHURCH.,https://query.nytimes.com/gst/abstract.html?res=9B06E7DD173BEF34BC4F53DFB766838F669FDE,0
1874-01-07T00:03:58Z,THE BALL.; THE PROGRAMME. THE COMMITTEES. RECEPTION COMMITTEE.,https://query.nytimes.com/gst/abstract.html?res=9C01E7DD173BEF34BC4F53DFB766838F669FDE,0
1874-01-07T00:03:58Z,THE VESSEL-OWNERS' AND CAPTAINS' ASSOCIATION.,https://query.nytimes.com/gst/abstract.html?res=9904E6DD173BEF34BC4F53DFB766838F669FDE,0
1874-01-07T00:03:58Z,CONGRESS.; THE CIVIL RIGHTS DEBATE MR. ELLIOTT'S SPEECH. AN ELOQUENT PLEA IN BEHALF OF HIS RACE ABLE REVIEW OF THE DEMOCRATIC ARGUMENTS. RELIEF OF THE TREASURY MR. KELLEY'S SCHEMES. THE MORMON PROBLEM. APPROPRIATIONS FOR PUBLIC BULDINGS. ONE OF MR. SUMNER'S PROJECTS. THE SALARY DEBATE IN THE SENATE.,https://query.nytimes.com/gst/abstract.html?res=9A03EEDE173BEF34BC4F53DFB766838F669FDE,0
1874-01-07T00:03:58Z,THE MICHAEL CREGAN ASSOCIATION.,https://query.nytimes.com/gst/abstract.html?res=9D04E7DD173BEF34BC4F53DFB766838F669FDE,0
1874-01-07T00:03:58Z,WASHINGTON NOTES.; NO SUCCESSOR TO THE LATE GEN. SWEET TO BE APPOINTED. FIRST DEPUTY COMMISSIONER OF INTERNAL REVENUE. PERSONAL. NAVAL ORDERS. THE NAVY EXPENDITURES. THE NAVY APPROPRIATIONS REDUCED. NOMINATIONS MADE AND WITHDRAWN. CONFIRMATIONS BY THE SENATE. ARREST OF REVENUE OFFICERS. REVENUE RECEIPTS AND TREASURY BALANCES THE VACANCY IN THE REVENUE BUREAU. CAPITAL. THE PROPOSED REDUCTION OF THE ARMY. BILL TO PENSION MODOC COMMISSIONER THOMAS WIDOW.,https://query.nytimes.com/gst/abstract.html?res=9F02EEDE173BEF34BC4F53DFB766838F669FDE,0
1874-01-07T00:03:58Z,BURGLARIES IN JERSEY CITY.,https://query.nytimes.com/gst/abstract.html?res=990CE7DD173BEF34BC4F53DFB766838F669FDE,0
1874-01-07T00:03:58Z,FROM KEY WEST.; ARRIVAL OF SAILORS FOR THE FLEET REMAINS OF MIDSHIPMAN STEVENS.,https://query.nytimes.com/gst/abstract.html?res=9A00E7DD173BEF34BC4F53DFB766838F669FDE,0
1874-01-07T00:03:58Z,CITY AND SUBURBAN NEWS.; NEW-YORK. BROOKLYN. WESTCHESTER COUNTY.,https://query.nytimes.com/gst/abstract.html?res=9805E6DD173BEF34BC4F53DFB766838F669FDE,0
1874-01-07T00:03:58Z,LONG ISLAND.,https://query.nytimes.com/gst/abstract.html?res=9905E6DD173BEF34BC4F53DFB766838F669FDE,0
1874-01-07T00:03:58Z,THE BOARD OF HEALTH.,https://query.nytimes.com/gst/abstract.html?res=9800E7DD173BEF34BC4F53DFB766838F669FDE,0
1874-01-07T00:03:58Z,THE CHARITY BALL.; POLICE SURGICAL STATISTICS.,https://query.nytimes.com/gst/abstract.html?res=9D01E7DD173BEF34BC4F53DFB766838F669FDE,0
1874-01-07T00:03:58Z,DIED.,https://query.nytimes.com/gst/abstract.html?res=9F03E7DD173BEF34BC4F53DFB766838F669FDE,0
1874-01-07T00:03:58Z,ONE HUNDRED THOUSAND TO BE ADDED TO THE RESERVE.,https://query.nytimes.com/gst/abstract.html?res=990DEEDE173BEF34BC4F53DFB766838F669FDE,0
1874-01-07T00:03:58Z,THE MONTAUK IN HAMPTON ROADS A FOG COMING UP.,https://query.nytimes.com/gst/abstract.html?res=9C02EEDE173BEF34BC4F53DFB766838F669FDE,0
1874-01-07T00:03:58Z,THE CHRISTMAS FESTIVAL IN THE GREEK CHURCH.,https://query.nytimes.com/gst/abstract.html?res=9D0CE7DD173BEF34BC4F53DFB766838F669FDE,0
1874-01-07T00:03:58Z,A FOOLISH EXPERIMENT.,https://query.nytimes.com/gst/abstract.html?res=9B07E7DD173BEF34BC4F53DFB766838F669FDE,0
1874-01-07T00:03:58Z,HOW THE TETUAN WAS DESTROYED.,https://query.nytimes.com/gst/abstract.html?res=980DEEDE173BEF34BC4F53DFB766838F669FDE,0
1874-01-07T00:03:58Z,THE REORGANIZATION OF THE ASSIST ANT ALDERMEN.,https://query.nytimes.com/gst/abstract.html?res=9B0CEEDE173BEF34BC4F53DFB766838F669FDE,0
1874-01-07T00:03:58Z,PLYMOUTH CHURCH.; SALE OF PEWS LAST EVENING A SMALL INCREASE OVER LAST YEAR.,https://query.nytimes.com/gst/abstract.html?res=9801E7DD173BEF34BC4F53DFB766838F669FDE,0
1874-01-07T00:03:58Z,POLICE COURT FINES.,https://query.nytimes.com/gst/abstract.html?res=9F05E7DD173BEF34BC4F53DFB766838F669FDE,0
1874-01-07T00:03:58Z,Front Page 1 -- No Title,https://query.nytimes.com/gst/abstract.html?res=9502EEDE173BEF34BC4F53DFB766838F669FDE,0
1874-01-07T00:03:58Z,AMUSEMENTS THIS EVENING.,https://query.nytimes.com/gst/abstract.html?res=9A04E7DD173BEF34BC4F53DFB766838F669FDE,0
1874-01-07T00:03:58Z,GERMANY.; BISHOP LEDOCHOWSKI'S IMPRISONMENT THREATENED.,https://query.nytimes.com/gst/abstract.html?res=940DEEDE173BEF34BC4F53DFB766838F669FDE,0
1874-01-07T00:03:58Z,THE SEIGE OF CARTAGENA VIGOROUS DEFENSE.,https://query.nytimes.com/gst/abstract.html?res=9F0DEEDE173BEF34BC4F53DFB766838F669FDE,0
1874-01-07T00:03:58Z,MARRIED.,https://query.nytimes.com/gst/abstract.html?res=9E03E7DD173BEF34BC4F53DFB766838F669FDE,0
1874-01-07T00:03:58Z,MASONIC AFFAIRS.,https://query.nytimes.com/gst/abstract.html?res=9F00E7DD173BEF34BC4F53DFB766838F669FDE,0
1874-01-07T00:03:58Z,THE RECENT TEXAS ELECTION DECLARED TO BE ILLEGAL.,https://query.nytimes.com/gst/abstract.html?res=9A06E7DD173BEF34BC4F53DFB766838F669FDE,0
1874-01-07T00:03:58Z,Editorial Article 1 -- No Title,https://query.nytimes.com/gst/abstract.html?res=9B04E7DD173BEF34BC4F53DFB766838F669FDE,0
1874-01-07T00:03:58Z,MORE ASSESSMENTS VACATED.,https://query.nytimes.com/gst/abstract.html?res=9B05E7DD173BEF34BC4F53DFB766838F669FDE,0
1874-01-07T00:03:58Z,THE EASTERN DISPENSARY.,https://query.nytimes.com/gst/abstract.html?res=9905E7DD173BEF34BC4F53DFB766838F669FDE,0
1874-01-07T00:03:58Z,CITY AND COUNTY TREASURY.,https://query.nytimes.com/gst/abstract.html?res=9E05E6DD173BEF34BC4F53DFB766838F669FDE,0
1874-01-07T00:03:58Z,THE STATE LEGISLATURE.; SENATE. BILLS INTRODUCED. ASSEMBLY. A BILL TO PROVIDE WORK ASKED FOR.,https://query.nytimes.com/gst/abstract.html?res=9A05E7DD173BEF34BC4F53DFB766838F669FDE,0
1874-01-07T00:03:58Z,THE HUDSON AGAIN OPEN.,https://query.nytimes.com/gst/abstract.html?res=9C0CEEDE173BEF34BC4F53DFB766838F669FDE,0
1874-01-07T00:03:58Z,THE BRINCKLEY DIVORCE CASE.,https://query.nytimes.com/gst/abstract.html?res=9F01E7DD173BEF34BC4F53DFB766838F669FDE,0
1874-01-07T00:03:58Z,THE NEW CARDINALS.,https://query.nytimes.com/gst/abstract.html?res=9807E7DD173BEF34BC4F53DFB766838F669FDE,0
1874-01-07T00:03:58Z,THE WOOL TRADE.,https://query.nytimes.com/gst/abstract.html?res=9D05E7DD173BEF34BC4F53DFB766838F669FDE,0
1874-01-07T00:03:58Z,Editorial Article 4 -- No Title,https://query.nytimes.com/gst/abstract.html?res=9C07E7DD173BEF34BC4F53DFB766838F669FDE,0
1874-01-07T00:03:58Z,STATE OF TRADE.,https://query.nytimes.com/gst/abstract.html?res=9D02E7DD173BEF34BC4F53DFB766838F669FDE,0
1874-01-07T00:03:58Z,THE TEMPERATURE FALLING IN LOUISIANA.,https://query.nytimes.com/gst/abstract.html?res=9D0CEEDE173BEF34BC4F53DFB766838F669FDE,0
1874-01-07T00:03:58Z,MYSTERIOUS DEATH IN BROOKLYN.,https://query.nytimes.com/gst/abstract.html?res=9401E7DD173BEF34BC4F53DFB766838F669FDE,0
1874-01-07T00:03:58Z,Editorial Article 3 -- No Title,https://query.nytimes.com/gst/abstract.html?res=9504E7DD173BEF34BC4F53DFB766838F669FDE,0
1874-01-07T00:03:58Z,DEMOCRATS AND WORKING MEN.,https://query.nytimes.com/gst/abstract.html?res=9907E7DD173BEF34BC4F53DFB766838F669FDE,0
1874-01-07T00:03:58Z,Editorial Article 6 -- No Title,https://query.nytimes.com/gst/abstract.html?res=9E07E7DD173BEF34BC4F53DFB766838F669FDE,0
1874-01-07T00:03:58Z,ALBANY.; ORGANIZATION OF THE TWO HOUSES.,https://query.nytimes.com/gst/abstract.html?res=9E02EEDE173BEF34BC4F53DFB766838F669FDE,0
1874-01-07T00:03:58Z,EX-SENATOR POMEROY'S POSITION.,https://query.nytimes.com/gst/abstract.html?res=9503EEDE173BEF34BC4F53DFB766838F669FDE,0
1874-01-07T00:03:58Z,THE SEVENTH'S BALL.; SCENE AT THE ACADEMY OF MUSIC LAST EVENING. THE FIRST OF THE GREAT BALLS OF THE SEASON THE REGIMENT AND ITS STORY NOTABLE PEOPLE WHO WERE PRESENT.,https://query.nytimes.com/gst/abstract.html?res=9406E7DD173BEF34BC4F53DFB766838F669FDE,0
1874-01-07T00:03:58Z,SNOW-STORM IN TEXAS.; STORM IN OHIO. IN THIS CITY.,https://query.nytimes.com/gst/abstract.html?res=9E0CEEDE173BEF34BC4F53DFB766838F669FDE,0
1874-01-07T00:03:58Z,NEW PUBLICATIONS.,https://query.nytimes.com/gst/abstract.html?res=9903E7DD173BEF34BC4F53DFB766838F669FDE,0
1874-01-07T00:03:58Z,ANOTHER ROBBERY ON LONG ISLAND.,https://query.nytimes.com/gst/abstract.html?res=980CE7DD173BEF34BC4F53DFB766838F669FDE,0
1874-01-07T00:03:58Z,"LATEST NEWS BY CABLE.; SPAIN. RESIGNATION OF SPANISH MINISTERS AT PARIS, BRUSSELS, AND LISBON GEN. CONCHA PROBABLY TO GO TO CUBA.",https://query.nytimes.com/gst/abstract.html?res=9E0DEEDE173BEF34BC4F53DFB766838F669FDE,0
1874-01-07T00:03:58Z,"COMPULSORY EDUCATION.; ITS NECESSITY MAGNITUDE OF THE SCHOOL INTEREST. UNIVERSAL EDUCATION ESSENTIAL TO FREE GOVERNMENT. THREE CARDINAL PRINCIPLES OF AMERICAN LIBERTY. WHAT THE NATIONAL GOVERNMENT IS DOING FOR EDUCATION. MAGNITUDE OF THE SCHOOL INTEREST. (1.) In the Nation. (2.) In the State of New-York. (3.) In the City of New-York. THE PROPERTY SHOULD EDUCATE THE CHILDREN. CRIME THE CONSEQUENCE OF IGNORANCE. THE SCHOOL THE PREVENTIVE OF CRIME. THE SCHOOL THE PREVENTIVE OF PAUPERISM. EDUCATION, THEN, SHOULD BE COMPULSORY. OUR GOVERNMENT CANNOT AND SHOULD NOT TEACH RELIGION. BUT ONE SECT OPPOSED TO FREE SCHOOLS. THE PAROCHIAL SYSTEM PRODUCES MORE ILLITERATES, PAUPERS, AND CRIMINALS THAN OURS.",https://query.nytimes.com/gst/abstract.html?res=9E04E6DD173BEF34BC4F53DFB766838F669FDE,0
1874-01-07T00:03:58Z,THE STATEN ISLAND FERRY.,https://query.nytimes.com/gst/abstract.html?res=9405E7DD173BEF34BC4F53DFB766838F669FDE,0
1874-01-07T00:03:58Z,KINGS COUNTY REPUBLICAN GENERAL COMMITTEE.,https://query.nytimes.com/gst/abstract.html?res=9E01E7DD173BEF34BC4F53DFB766838F669FDE,0
1874-01-07T00:03:58Z,VERIFICATION OF DEATH.,https://query.nytimes.com/gst/abstract.html?res=9403E7DD173BEF34BC4F53DFB766838F669FDE,0
1874-01-07T00:03:58Z,THE REVENUE LAWS.,https://query.nytimes.com/gst/abstract.html?res=9A0CEEDE173BEF34BC4F53DFB766838F669FDE,0
1874-01-07T00:03:58Z,THE MASSACHUSETTS LEGISLATURE.; THE OPENING SESSION CANDIDATES FOR OFFICERS THE DEMOCRATS.,https://query.nytimes.com/gst/abstract.html?res=9806E7DD173BEF34BC4F53DFB766838F669FDE,0
1874-01-07T00:03:58Z,CUBAN AFFAIRS.; EFFECT OF THE RECENT EVENTS IN SPAIN. JOVELLAR AND SERRANO CLOSING OF THE REPUBLICAN CLUB CONCHA.,https://query.nytimes.com/gst/abstract.html?res=9402EEDE173BEF34BC4F53DFB766838F669FDE,0
1874-01-07T00:03:58Z,CHEAP TRANSPORTATION ASSOCIATION.,https://query.nytimes.com/gst/abstract.html?res=9F04E7DD173BEF34BC4F53DFB766838F669FDE,0
1874-01-07T00:03:58Z,"JORDAN, MARSH & CO.",https://query.nytimes.com/gst/abstract.html?res=9902EEDE173BEF34BC4F53DFB766838F669FDE,0
1874-01-07T00:03:58Z,OUTRAGES BY MEXICAN MARAUDERS COLD WEATHER.,https://query.nytimes.com/gst/abstract.html?res=9403EEDE173BEF34BC4F53DFB766838F669FDE,0
1874-01-07T00:03:58Z,THE OCEAN NATIONAL BANK.; MEETING OF DEPOSITORS REPORT OF INVESTIGATING COMITTEE FINANCIALSTATEMENT.,https://query.nytimes.com/gst/abstract.html?res=9C0CE7DD173BEF34BC4F53DFB766838F669FDE,0
1874-01-07T00:03:58Z,FORTY-THIRD CONGRESS.; FIRST SESSION Jan. 6. SENATE. FREE BANKING. BUREAU. MR. EDWARD YOUNG'S PRESENT. REDUCTION OF BANK CAPITAL. THE SALARY BILL. BILLS INTRODUCED REGENTS OF THE SMITHSONIAN INSTITUTE. STARVATION IN LOUISIANA. CIVIL RIGHTS. THE NAVAL APPROPRIATIONS. THE BOSTON POST OFFICE SITE.,https://query.nytimes.com/gst/abstract.html?res=9C05E7DD173BEF34BC4F53DFB766838F669FDE,0
1874-01-07T00:03:58Z,THE MAINE LEGISLATURE.; PREPARATIONS FOR THE OPENING OF THE SESSION TO-DAY.,https://query.nytimes.com/gst/abstract.html?res=9F06E7DD173BEF34BC4F53DFB766838F669FDE,0
1874-01-07T00:03:58Z,THE COTTON MARKETS.,https://query.nytimes.com/gst/abstract.html?res=9E02E7DD173BEF34BC4F53DFB766838F669FDE,0
1874-01-07T00:03:58Z,THE FRENCH GOVERNMENT AND MUNICIPAL FRANCHISES.,https://query.nytimes.com/gst/abstract.html?res=9A07E7DD173BEF34BC4F53DFB766838F669FDE,0
1874-01-07T00:03:58Z,LAW REPORTS.; COURT CALENDARS--THIS DAY.,https://query.nytimes.com/gst/abstract.html?res=9F04E6DD173BEF34BC4F53DFB766838F669FDE,0
1874-01-07T00:03:58Z,THE PENNSYLVANIA RAILROADS; CONVENTION OF FREIGHT OFFICERS AT BETHLEHEM EFFECT OF THE NEW CONSTITUTION.,https://query.nytimes.com/gst/abstract.html?res=9B03EEDE173BEF34BC4F53DFB766838F669FDE,0
1874-01-07T00:03:58Z,UNITED STATES CIRCUIT COURT.,https://query.nytimes.com/gst/abstract.html?res=950CEEDE173BEF34BC4F53DFB766838F669FDE,0
1874-01-07T00:03:58Z,A SAN FRANCISCO SHIP ASHORE.,https://query.nytimes.com/gst/abstract.html?res=9B0DEEDE173BEF34BC4F53DFB766838F669FDE,0
1874-01-07T00:03:58Z,VALUE OF FOREIGN COINS.,https://query.nytimes.com/gst/abstract.html?res=9E05E7DD173BEF34BC4F53DFB766838F669FDE,0
1874-01-07T00:03:58Z,SUPREME COURT CIRCUIT PART II.,https://query.nytimes.com/gst/abstract.html?res=9804E6DD173BEF34BC4F53DFB766838F669FDE,0
1874-01-07T00:03:58Z,UNION LEAGUE CLUB.; THE APPROACHING ANNUAL RECEPTION.,https://query.nytimes.com/gst/abstract.html?res=950CE7DD173BEF34BC4F53DFB766838F669FDE,0
1874-01-07T00:03:58Z,THE MASKED BURGLARS.; ARRESTS ON MONDAY FURTHER DEPREDATIONS.,https://query.nytimes.com/gst/abstract.html?res=9F0CE7DD173BEF34BC4F53DFB766838F669FDE,0
1874-01-07T00:03:58Z,A NEW-YORK SHIP ASHORE,https://query.nytimes.com/gst/abstract.html?res=9E00E7DD173BEF34BC4F53DFB766838F669FDE,0
1874-01-08T00:03:58Z,Editorial Article 1 -- No Title,https://query.nytimes.com/gst/abstract.html?res=9A02E6DD173BEF34BC4053DFB766838F669FDE,0
1874-01-08T00:03:58Z,CITY AND COUNTY TREASURY.,https://query.nytimes.com/gst/abstract.html?res=9F01E5DD173BEF34BC4053DFB766838F669FDE,0
1874-01-08T00:03:58Z,A BRIDEGROOM'S DESPERATION.,https://query.nytimes.com/gst/abstract.html?res=9D07E5DD173BEF34BC4053DFB766838F669FDE,0
1874-01-08T00:03:58Z,THE DRY GOODS TRADE.,https://query.nytimes.com/gst/abstract.html?res=9A06E5DD173BEF34BC4053DFB766838F669FDE,0
1874-01-08T00:03:58Z,"FRANCE.; BALANCING THE BUDGET THE MINOR PRESS. TAXING THE MINOR PRESS. OLD MEASURES AND NEW. PRESS POLICY. A FRENCH ""CHRONIQUE.""",https://query.nytimes.com/gst/abstract.html?res=9B03E6DD173BEF34BC4053DFB766838F669FDE,0
1874-01-08T00:03:58Z,THE CANAL DEPARTMENT.; SYNOPSIS OF THE REPORT OF THE AUDITOR.,https://query.nytimes.com/gst/abstract.html?res=9F00E6DD173BEF34BC4053DFB766838F669FDE,1
1874-01-08T00:03:58Z,MASONIC.,https://query.nytimes.com/gst/abstract.html?res=9B06E5DD173BEF34BC4053DFB766838F669FDE,0
1874-01-08T00:03:58Z,SALE OF A ST. LOUIS NEWSPAPER.,https://query.nytimes.com/gst/abstract.html?res=990CE6DD173BEF34BC4053DFB766838F669FDE,0
1874-01-08T00:03:58Z,THE ORPHANS' BALL.; SEVENTEENTH ANNUAL ENTERTAINMENT.SCENE AT THE ACADEMY OF MUSIC LAST EVENING--A BRILLIANT SUCCESS. THE COMMITTEES. FLOOR COMMITTEE. RECEPTION CONMITTEE. SUITS AGAINST THE CITY.,https://query.nytimes.com/gst/abstract.html?res=9806E5DD173BEF34BC4053DFB766838F669FDE,0
1874-01-08T00:03:58Z,THE COLLEGES ROWING ASSOCIATION.,https://query.nytimes.com/gst/abstract.html?res=9F00E5DD173BEF34BC4053DFB766838F669FDE,0
1874-01-08T00:03:58Z,MARRIED.,https://query.nytimes.com/gst/abstract.html?res=9B05E5DD173BEF34BC4053DFB766838F669FDE,0
1874-01-08T00:03:58Z,A POLICE BURGLAR.,https://query.nytimes.com/gst/abstract.html?res=9401E6DD173BEF34BC4053DFB766838F669FDE,0
1874-01-08T00:03:58Z,AMUSEMENTS THIS EVENING.,https://query.nytimes.com/gst/abstract.html?res=9802E6DD173BEF34BC4053DFB766838F669FDE,0
1874-01-08T00:03:58Z,ANOTHER NOTORIOUS BURGLAR SENT TO SING SING.,https://query.nytimes.com/gst/abstract.html?res=9400E6DD173BEF34BC4053DFB766838F669FDE,0
1874-01-08T00:03:58Z,"THE CHIEF JUSTICESHIP.; THE QUESTION OF WITHDRAWAL OF MR. WILLIAMS' NAME, AND THE RESULTS GROWING THEREFROM. A LETTER FROM MR. WILLIAMS.",https://query.nytimes.com/gst/abstract.html?res=9906E6DD173BEF34BC4053DFB766838F669FDE,0
1874-01-08T00:03:58Z,Editorial Article 8 -- No Title,https://query.nytimes.com/gst/abstract.html?res=9F0DE6DD173BEF34BC4053DFB766838F669FDE,0
1874-01-08T00:03:58Z,BUSINESS IN THE UNITED STATES DISTRICT COURT.,https://query.nytimes.com/gst/abstract.html?res=9C03E6DD173BEF34BC4053DFB766838F669FDE,0
1874-01-08T00:03:58Z,THE FREEDMEN'S BUREAU FRAUDS.; ADDITIONAL INFORMATION IN RELATION TO THEM FROM THE SECRETARY OF WAR. THE MARYLAND LEGISLATURE. THE ROMAN CATHOLIC CONTROVERSY IN PENNSYLVANIA.,https://query.nytimes.com/gst/abstract.html?res=9C01E6DD173BEF34BC4053DFB766838F669FDE,0
1874-01-08T00:03:58Z,LETTER FROM SENATOR WRIGHT.,https://query.nytimes.com/gst/abstract.html?res=9C02E6DD173BEF34BC4053DFB766838F669FDE,0
1874-01-08T00:03:58Z,THE NEW-HAMPSHIRE DEMOCRATS.; PREPARING FOR TO-DAY'S CONVENTION THE REPUBLICAN TACTICS PRODUCE CONFUSION.,https://query.nytimes.com/gst/abstract.html?res=9D05E5DD173BEF34BC4053DFB766838F669FDE,0
1874-01-08T00:03:58Z,SWITZERLAND.; A PROTEST AGAINST THE EXPULSION OF THE PAPAL NUNCIO.,https://query.nytimes.com/gst/abstract.html?res=9801E6DD173BEF34BC4053DFB766838F669FDE,0
1874-01-08T00:03:58Z,COAL-COMBINATIONS.; PROSPECT OF CONSOLIDATION OF THE NEW-YORK AND PENNSYLVANIA COMBINATIONS--THE MINERS AND THE BOSSES. MEETING OF COAL TRADERS.,https://query.nytimes.com/gst/abstract.html?res=9901E5DD173BEF34BC4053DFB766838F669FDE,0
1874-01-08T00:03:58Z,THE MASSACHUSETTS LEGISLATURE.; PROCEEDINGS OF THE DAY THE ORGANIZATION EFFECTED THE CUSTOMARY ELECTION SERMON.,https://query.nytimes.com/gst/abstract.html?res=9E0CE6DD173BEF34BC4053DFB766838F669FDE,0
1874-01-08T00:03:58Z,PATENT CONVENTION.,https://query.nytimes.com/gst/abstract.html?res=9506E5DD173BEF34BC4053DFB766838F669FDE,0
1874-01-08T00:03:58Z,MINIATURE ALMANAC THIS DAY.,https://query.nytimes.com/gst/abstract.html?res=9B00E5DD173BEF34BC4053DFB766838F669FDE,0
1874-01-08T00:03:58Z,REDUCING THE ESTIMATES.; VIEWS OF THE SEVERAL HEADS OF DEPARTMENTS ON THE SUBJECT. THE POST OFFICE DEPARTMENT. THE STATE DEPARTMENT. THE INTERIOR DEPARTMENT. DEPARTMENT OF JUSTICE.,https://query.nytimes.com/gst/abstract.html?res=9B0CE6DD173BEF34BC4053DFB766838F669FDE,0
1874-01-08T00:03:58Z,PASSENGERS ARRIVED.,https://query.nytimes.com/gst/abstract.html?res=9A00E5DD173BEF34BC4053DFB766838F669FDE,0
1874-01-08T00:03:58Z,GERMANY.; THE EMPEROR'S HEALTH.,https://query.nytimes.com/gst/abstract.html?res=9F01E6DD173BEF34BC4053DFB766838F669FDE,0
1874-01-08T00:03:58Z,THE MASKED BURGLARS.,https://query.nytimes.com/gst/abstract.html?res=9906E5DD173BEF34BC4053DFB766838F669FDE,0
1874-01-08T00:03:58Z,GEN. QUESADA.; INTERVIEW WITH THE CUBAN GENERAL.,https://query.nytimes.com/gst/abstract.html?res=9F05E5DD173BEF34BC4053DFB766838F669FDE,0
1874-01-08T00:03:58Z,THE ROBBERY OF MR. CRAFT.,https://query.nytimes.com/gst/abstract.html?res=9900E6DD173BEF34BC4053DFB766838F669FDE,0
1874-01-08T00:03:58Z,CONGRESS.; CLOSE OF THE CIVIL RIGHTS DEBATE.SPEECH OF GEN. BUTLER THE BILL RECOMMITTED TO THE JUDICIARY COMMITTEE. THE EDUCATION QUESTION. BANKING AND CURRENCY. NATIONAL BOARD OF TRADE. THE PROPOSED ARMY REDUCTION. UTAH AND MORMONISM. THE SALARY REPEAL BILL. MR. KELLEY'S CONVERTIBLE LOAN SCHEME. THE APPROPRIATIONS. CUBAN BELLIGERENCY. NO SUBSIDY FOR AN INTER-STATE RAILROAD.,https://query.nytimes.com/gst/abstract.html?res=9806E6DD173BEF34BC4053DFB766838F669FDE,1
1874-01-08T00:03:58Z,"THE CIVIL SERVICE RULES.; GEN. BUTLER'S TEST CASE. CORRESPONDENCE BETWEEN MR. BUTLER AND MR. SAWYER, ASSISTANT SECRETARY OF THE TREASURY.",https://query.nytimes.com/gst/abstract.html?res=9506E6DD173BEF34BC4053DFB766838F669FDE,0
1874-01-08T00:03:58Z,"THE STORM.; RAIN AND FOG ON THE HUDSON. A LAND-SLIDE ACCIDENT TO A NEW-YORK TRAIN. THE SNOW, RAIN STORM, AND SLEET IN OHIO. DAMAGE TO TELEGRAPH LINES BY THE STORM. HEAVY RAIN IN NEW-HAMPSHIRE. THE RAIN-STORM IN THE SOUTH.",https://query.nytimes.com/gst/abstract.html?res=9406E6DD173BEF34BC4053DFB766838F669FDE,0
1874-01-08T00:03:58Z,ACHEEN.; DISEASE PREVALENT IN THE DUTCH CAMP.,https://query.nytimes.com/gst/abstract.html?res=9901E6DD173BEF34BC4053DFB766838F669FDE,0
1874-01-08T00:03:58Z,SPAIN.; OBJECTS OF THE NEW GOVERNMENT CASTELAR REFUSES TO ACT WITH IT.,https://query.nytimes.com/gst/abstract.html?res=9E01E6DD173BEF34BC4053DFB766838F669FDE,0
1874-01-08T00:03:58Z,SUFFERING IN PARIS.,https://query.nytimes.com/gst/abstract.html?res=9D02E6DD173BEF34BC4053DFB766838F669FDE,0
1874-01-08T00:03:58Z,LETTERS TO THE EDITOR.,https://query.nytimes.com/gst/abstract.html?res=9403E6DD173BEF34BC4053DFB766838F669FDE,0
1874-01-08T00:03:58Z,IMPORTANT TO THEATRICAL MANAGERS.,https://query.nytimes.com/gst/abstract.html?res=9A0CE6DD173BEF34BC4053DFB766838F669FDE,0
1874-01-08T00:03:58Z,Editorial Article 2 -- No Title,https://query.nytimes.com/gst/abstract.html?res=9B02E6DD173BEF34BC4053DFB766838F669FDE,0
1874-01-08T00:03:58Z,NEW PUBLICATIONS.; MRS. SOMERVILLE'S RECOLLECTIONS.,https://query.nytimes.com/gst/abstract.html?res=9903E6DD173BEF34BC4053DFB766838F669FDE,1
1874-01-08T00:03:58Z,SUPREME COURT CALENDAR.,https://query.nytimes.com/gst/abstract.html?res=9E00E5DD173BEF34BC4053DFB766838F669FDE,0
1874-01-08T00:03:58Z,BY MAIL AND TELEGRAPH.,https://query.nytimes.com/gst/abstract.html?res=940CE6DD173BEF34BC4053DFB766838F669FDE,0
1874-01-08T00:03:58Z,PENNSYLVANIA.; GOV. HARTRANFT'S MESSAGE TO THE LEGISLATURE.,https://query.nytimes.com/gst/abstract.html?res=9A01E5DD173BEF34BC4053DFB766838F669FDE,0
