pub_date,main_headline,article_url,classification
1874-01-15T00:03:58Z,TRIAL OF BENONI HOWARD.,https://query.nytimes.com/gst/abstract.html?res=9D06E4DC173BEF34BC4D52DFB766838F669FDE,0
1874-01-15T00:03:58Z,THE SUNDAY-SCHOOL UNION.,https://query.nytimes.com/gst/abstract.html?res=9B05E4DC173BEF34BC4D52DFB766838F669FDE,0
1874-01-15T00:03:58Z,WHY THE TOMPKINS SQUARE MEETING WAS DISPERSED.,https://query.nytimes.com/gst/abstract.html?res=9B04E4DC173BEF34BC4D52DFB766838F669FDE,0
1874-01-15T00:03:58Z,BAZAINE IN PRISON.,https://query.nytimes.com/gst/abstract.html?res=9B01E4DC173BEF34BC4D52DFB766838F669FDE,0
1874-01-15T00:03:58Z,THE CAPTAIN OF THE TRIMOUNTAIN.,https://query.nytimes.com/gst/abstract.html?res=9807E4DC173BEF34BC4D52DFB766838F669FDE,0
1874-01-15T00:03:58Z,CONGRESS.; THE NAVAL APPROPRIATIONS. BUCHANAN'S ADMINISTRATION AND THE DEMOCRATS?NEW-YORK HARBOR AND FOREIGN IRON-CLADS. THE REVISED CODE. SPECIE PAYMENTS. POST ROUTES. THE PACIFIC MAIL SUBSIDY. THE AGRICULTURAL COLLEGES. THE CIVIL SERVICE REFORM. FREE BANKING AND INFLATION. SAVINGS BANK TAXATION.,https://query.nytimes.com/gst/abstract.html?res=9502E5DC173BEF34BC4D52DFB766838F669FDE,1
1874-01-15T00:03:58Z,"LETTER OF THE LATE GOV. ANDREW, OF MASSACHUSETTS, TO CALEB CUSHING.",https://query.nytimes.com/gst/abstract.html?res=9B02E5DC173BEF34BC4D52DFB766838F669FDE,0
1874-01-15T00:03:58Z,ARREST OF A POSTAL CLERK.,https://query.nytimes.com/gst/abstract.html?res=9F03E4DC173BEF34BC4D52DFB766838F669FDE,0
1874-01-15T00:03:58Z,CRITICISING PUBLIC MEN.,https://query.nytimes.com/gst/abstract.html?res=9E01E4DC173BEF34BC4D52DFB766838F669FDE,0
1874-01-15T00:03:58Z,DIED.,https://query.nytimes.com/gst/abstract.html?res=9C02E4DC173BEF34BC4D52DFB766838F669FDE,0
1874-01-15T00:03:58Z,THE STATE LEGISLATURE.; SENATE. THE AMENDMENTS TO THE CONSTITUTION. ANNUAL REPORTS PRESENTED. CONFIRMATIONS BY THE SENATE. ASSEMBLY. THE NEW CAPITOL BUILDING. WORK FOR THE UNEMPLOYED. THE HOUSE COMMITTEES ANNOUNCED.,https://query.nytimes.com/gst/abstract.html?res=9C07E4DC173BEF34BC4D52DFB766838F669FDE,0
1874-01-15T00:03:58Z,CUBA.; REINFORCEMENTS OF TROOPS?THE EXPENSES OF THE SAN DOMINGO AND MEXICO EXPEDITIONS.,https://query.nytimes.com/gst/abstract.html?res=9F0CE5DC173BEF34BC4D52DFB766838F669FDE,0
1874-01-15T00:03:58Z,THE BANKRUPT LAW.,https://query.nytimes.com/gst/abstract.html?res=9B05E3DC173BEF34BC4D52DFB766838F669FDE,0
1874-01-15T00:03:58Z,BRICKLAYERS' NATIONAL UNION.; THE NEW RITUAL ELECTION OF OFFICERS ARCHITECT MULLETT.,https://query.nytimes.com/gst/abstract.html?res=9F00E4DC173BEF34BC4D52DFB766838F669FDE,0
1874-01-15T00:03:58Z,NATIONAL BOARD OF TRADE.; SUBJECTS OF DISCUSSION YESTERDAY.THE TRACKS OF OCEAN STEAM-SHIPS THEREVENUE LAWS AND THE FINANCIALQUESTION.,https://query.nytimes.com/gst/abstract.html?res=9903E4DC173BEF34BC4D52DFB766838F669FDE,0
1874-01-15T00:03:58Z,TEST CASE ON THE INCOME TAX.,https://query.nytimes.com/gst/abstract.html?res=9C00E4DC173BEF34BC4D52DFB766838F669FDE,0
1874-01-15T00:03:58Z,SMAL-LPOX ON BOARD THE STEAMER HIBERNIAN.,https://query.nytimes.com/gst/abstract.html?res=990DE5DC173BEF34BC4D52DFB766838F669FDE,0
1874-01-15T00:03:58Z,THE MISSISSIPPI STATE ELECTION QUESTION.,https://query.nytimes.com/gst/abstract.html?res=9E05E4DC173BEF34BC4D52DFB766838F669FDE,0
1874-01-15T00:03:58Z,Editorial Article 4 -- No Title,https://query.nytimes.com/gst/abstract.html?res=9506E4DC173BEF34BC4D52DFB766838F669FDE,0
1874-01-15T00:03:58Z,SHIP-BUILDING ON LONG ISLAND.,https://query.nytimes.com/gst/abstract.html?res=9A05E4DC173BEF34BC4D52DFB766838F669FDE,0
1874-01-15T00:03:58Z,THE ATALANTA BOAT CLUB.,https://query.nytimes.com/gst/abstract.html?res=9505E4DC173BEF34BC4D52DFB766838F669FDE,0
1874-01-15T00:03:58Z,EX-CITY TREASURER GAGE'S TRIAL POSTPONED.,https://query.nytimes.com/gst/abstract.html?res=9D03E4DC173BEF34BC4D52DFB766838F669FDE,0
1874-01-15T00:03:58Z,LETTERS FROM THE PEOPLE POPULAR VIEW ON VARIOUS TOPICS.,https://query.nytimes.com/gst/abstract.html?res=9405E4DC173BEF34BC4D52DFB766838F669FDE,1
1874-01-15T00:03:58Z,BENJAMIN FRANKLIN'S BIRTHDAY.,https://query.nytimes.com/gst/abstract.html?res=9C06E4DC173BEF34BC4D52DFB766838F669FDE,0
1874-01-15T00:03:58Z,THE KANSAS SENATORSHIP.; OSBORN SAID TO HAVE THE BEST CHANCE OF ELECTION.,https://query.nytimes.com/gst/abstract.html?res=9B0DE5DC173BEF34BC4D52DFB766838F669FDE,0
1874-01-15T00:03:58Z,CURIOUS WILLS.; THE BROOKLYN BOARD OF AUDIT.,https://query.nytimes.com/gst/abstract.html?res=9D07E4DC173BEF34BC4D52DFB766838F669FDE,1
1874-01-15T00:03:58Z,THE MARYLAND LEGISLATURE.; IMPORTANT RAILROAD LEGISLATION THE CONTEST FOR SENATORSHIP.,https://query.nytimes.com/gst/abstract.html?res=9C0DE5DC173BEF34BC4D52DFB766838F669FDE,0
1874-01-15T00:03:58Z,ELECTION OF A UNITED STATES SENATOR.,https://query.nytimes.com/gst/abstract.html?res=9803E4DC173BEF34BC4D52DFB766838F669FDE,0
1874-01-15T00:03:58Z,THE NEW JERSEY LEGISLATURE.,https://query.nytimes.com/gst/abstract.html?res=9E0DE5DC173BEF34BC4D52DFB766838F669FDE,0
1874-01-15T00:03:58Z,THE BOARD OF EDUCATION.; ITS FIRST MEETING THIS YEAR. HON. W.H. NEILSON RE-ELECTED PRESIDENT HIS ADDRESS PROPOSAL TO ELECT A NEW CLERK NEGATIVED. PROPOSED ELECTION OF CLERK. GENERAL BUSINESS.,https://query.nytimes.com/gst/abstract.html?res=9407E4DC173BEF34BC4D52DFB766838F669FDE,0
1874-01-15T00:03:58Z,Editorial Article 1 -- No Title,https://query.nytimes.com/gst/abstract.html?res=9A06E4DC173BEF34BC4D52DFB766838F669FDE,0
1874-01-15T00:03:58Z,BUSINESS INTERESTS.; STOCK AND PRODUCE EXCHANGES. THE PROPOSED STOCK EXCHANGE BANK AND CLEARING-HOUSE?SHIP-OWNERS' ASSOCIATION?MISCELLANEOUS TOPICS. THE MARKET SAVINGS BANK. THE HOBOKEN SAVINGS BANK. MISCELLANEOUS TOPICS.,https://query.nytimes.com/gst/abstract.html?res=980CE4DC173BEF34BC4D52DFB766838F669FDE,0
1874-01-15T00:03:58Z,Editorial Article 3 -- No Title,https://query.nytimes.com/gst/abstract.html?res=9406E4DC173BEF34BC4D52DFB766838F669FDE,0
1874-01-15T00:03:58Z,MARINE DISASTER A SCHOONER ASHORE.,https://query.nytimes.com/gst/abstract.html?res=9402E5DC173BEF34BC4D52DFB766838F669FDE,0
1874-01-15T00:03:58Z,DESTITUTION IN PHILADELPHIA.; POVERTY AND DISEASE AMONG THE WORKING CLASSES TYPHOID FEVER FROM THE USE OF SWILL-MILK A DISTRESSING PICTURE.,https://query.nytimes.com/gst/abstract.html?res=9B00E4DC173BEF34BC4D52DFB766838F669FDE,0
1874-01-15T00:03:58Z,A CELESTIAL MONARCH.,https://query.nytimes.com/gst/abstract.html?res=9A02E4DC173BEF34BC4D52DFB766838F669FDE,0
1874-01-15T00:03:58Z,THE ROLLWAGEN WILL CASE.,https://query.nytimes.com/gst/abstract.html?res=9804E4DC173BEF34BC4D52DFB766838F669FDE,0
1874-01-15T00:03:58Z,THE LUCCA DIVORCE SUIT.,https://query.nytimes.com/gst/abstract.html?res=9905E4DC173BEF34BC4D52DFB766838F669FDE,0
1874-01-15T00:03:58Z,FORTY-THIRD CONGRESS.; FIRST SESSION Jan. 14. SENATE. POST ROUTES. THE FINANCIAL SITUATION. HOUSE OF REPRESENTATIVES.,https://query.nytimes.com/gst/abstract.html?res=9F05E4DC173BEF34BC4D52DFB766838F669FDE,1
1874-01-15T00:03:58Z,POLICE AND THE THIEVES.,https://query.nytimes.com/gst/abstract.html?res=9801E4DC173BEF34BC4D52DFB766838F669FDE,0
1874-01-15T00:03:58Z,THE LETTER TO JEFF. DAVIS.; FULL TEXT OF THE DOCUMENT FROM THE REBEL ARCHIVES.,https://query.nytimes.com/gst/abstract.html?res=9902E5DC173BEF34BC4D52DFB766838F669FDE,0
1874-01-15T00:03:58Z,Editorial Article 5 -- No Title,https://query.nytimes.com/gst/abstract.html?res=9C01E4DC173BEF34BC4D52DFB766838F669FDE,0
1874-01-15T00:03:58Z,YELLOW FEVER.; THE DISEASE ON BOARD THE SPHYNX SEVERAL DEATHS ON BOARD THE ABOUKIR.,https://query.nytimes.com/gst/abstract.html?res=940DE5DC173BEF34BC4D52DFB766838F669FDE,0
1874-01-15T00:03:58Z,SPAIN.; THE NUMANCIA AT ORAN ACTION OF THE FRENCH AUTHORITIES THE VESSEL DETAINED AND HER CREW MADE PRISONERS. ARRIVAL OF THE FRIGATE CARMEN THE NUMANCIA DEMANDED THE DEMAND REFUSED DISEMBARKATION OF PRISONERS. THE FUGITIVES FROM CARTAGENA CAPTURE OF A STEAMER LOADED WITH THEM. ADDITIONAL FORCES MARCHING AGAINST THE CARLISTS. THE CAPTURE OF CARTAGENA MOVEMENTS OF THE SPANISH MEN-OF-WAR.,https://query.nytimes.com/gst/abstract.html?res=9B0CE5DC173BEF34BC4D52DFB766838F669FDE,0
1874-01-15T00:03:58Z,OUR CARS.,https://query.nytimes.com/gst/abstract.html?res=9A01E4DC173BEF34BC4D52DFB766838F669FDE,0
1874-01-15T00:03:58Z,THE VIRGINIUS SURVIVORS.,https://query.nytimes.com/gst/abstract.html?res=9F04E4DC173BEF34BC4D52DFB766838F669FDE,0
1874-01-15T00:03:58Z,THE MILLERS.; MEETING OF THE NATIONAL ASSOCIATION AT CHICAGO. WESTERN NEW-YORK POULTRY SOCIETY.,https://query.nytimes.com/gst/abstract.html?res=9900E4DC173BEF34BC4D52DFB766838F669FDE,0
1874-01-15T00:03:58Z,Editorial Article 2 -- No Title,https://query.nytimes.com/gst/abstract.html?res=9B06E4DC173BEF34BC4D52DFB766838F669FDE,0
1874-01-15T00:03:58Z,GREAT BRITAIN.; CLOSE OF THE DEFENSE IN THE TICHBORNE CASE. PROF. GSLDWIN SMITH AT SHIEFFIELD.,https://query.nytimes.com/gst/abstract.html?res=940CE5DC173BEF34BC4D52DFB766838F669FDE,0
1874-01-15T00:03:58Z,THE RYAN TRAGEDY.,https://query.nytimes.com/gst/abstract.html?res=9907E4DC173BEF34BC4D52DFB766838F669FDE,0
1874-01-15T00:03:58Z,CUBA.; THE CHANGE IN THE HOME GOVERNMENT.,https://query.nytimes.com/gst/abstract.html?res=9F02E4DC173BEF34BC4D52DFB766838F669FDE,0
1874-01-15T00:03:58Z,WRECK OF A COAL-TOW ON THE OHIO RIVER.,https://query.nytimes.com/gst/abstract.html?res=9C03E4DC173BEF34BC4D52DFB766838F669FDE,0
1874-01-15T00:03:58Z,ALBANY.; THE APPOINTMENT OF THE HOUSE COMMITTEE. GOV. DIX AND LOCAL LEGISLATION. THE UNEMPLOYED WORKING MEN. BUSINESS IN THE SENATE. THE CITY REVENUE BONDS. THE PROPOSED CUSHING RESOLUTIONS. THE CONSTITUTIONAL AMENDMENTS.,https://query.nytimes.com/gst/abstract.html?res=9A0DE5DC173BEF34BC4D52DFB766838F669FDE,0
1874-01-15T00:03:58Z,LAW REPORTS.; COURT CALENDARS THIS DAY. DECISIONS. SUPREME COURT CHAMBERS. UNITED STATES SUPREME COURT. SUPREME COURT GENERAL TERM. MARINE COURT.,https://query.nytimes.com/gst/abstract.html?res=9505E3DC173BEF34BC4D52DFB766838F669FDE,1
1874-01-15T00:03:58Z,THE CANAL BOARD.; PROPOSED REDUCTION IN THE NUMBER AND SALARIES OF CANAL OFFICERS.,https://query.nytimes.com/gst/abstract.html?res=9400E4DC173BEF34BC4D52DFB766838F669FDE,0
1874-01-15T00:03:58Z,THE GEORGIA LEGISLATURE.,https://query.nytimes.com/gst/abstract.html?res=9F0DE5DC173BEF34BC4D52DFB766838F669FDE,0
1874-01-15T00:03:58Z,A HINDOO SCANDAL.,https://query.nytimes.com/gst/abstract.html?res=9F07E4DC173BEF34BC4D52DFB766838F669FDE,0
1874-01-15T00:03:58Z,"A DROVER SWINDLED AT ""THREE-CARD MONTE.""",https://query.nytimes.com/gst/abstract.html?res=950DE5DC173BEF34BC4D52DFB766838F669FDE,0
1874-01-15T00:03:58Z,MEXICO.; CONGRESSIONAL NOTES OPPOSITION TO PRESIDENT LERDO THE REVOLUTION IN YUCATAN.,https://query.nytimes.com/gst/abstract.html?res=9E0CE5DC173BEF34BC4D52DFB766838F669FDE,0
1874-01-15T00:03:58Z,WASHINGTON NOTES.; THE CHEAP TRANSPORTATION QUESTION.,https://query.nytimes.com/gst/abstract.html?res=9A00E4DC173BEF34BC4D52DFB766838F669FDE,1
1874-01-15T00:03:58Z,THE STATE BANKS.; ANNUAL REPORT OF THE SUPERIN- TENDENT.,https://query.nytimes.com/gst/abstract.html?res=9A0CE4DC173BEF34BC4D52DFB766838F669FDE,1
1874-01-15T00:03:58Z,COURT OF GENERAL SESSIONS.,https://query.nytimes.com/gst/abstract.html?res=9507E4DC173BEF34BC4D52DFB766838F669FDE,0
1874-01-15T00:03:58Z,NATIVE WINES.; CHARACTER AND VALUE OF THOSE MADE IN NORTHERN OHIO. BUSINESS OF THE NEW-YORK POST OFFICE FOR 1873.,https://query.nytimes.com/gst/abstract.html?res=9405E3DC173BEF34BC4D52DFB766838F669FDE,0
1874-01-15T00:03:58Z,THE WHITE STAR LINE.,https://query.nytimes.com/gst/abstract.html?res=9C04E4DC173BEF34BC4D52DFB766838F669FDE,0
1874-01-15T00:03:58Z,"NOTES FROM FRANCE.; HOLIDAY OBSERVANCES BOULEVARD SCENES LOCAL GOSSIP. SOCIAL IMPOSITIONS. BOULEVARD SCENES. PAST AND PRESENT, THE SOURCE OF TOYS. LOCAL GOSSIP. DRUGGISTS ARRESTED. ROBBERY BY A WAITER.",https://query.nytimes.com/gst/abstract.html?res=9504E4DC173BEF34BC4D52DFB766838F669FDE,0
1874-01-15T00:03:58Z,NEW-MEXICO.; DESPERATE OUTRAGES BY TEXAN DESPERADOES EIGHT MEN KILLED.,https://query.nytimes.com/gst/abstract.html?res=9D0CE5DC173BEF34BC4D52DFB766838F669FDE,0
1874-01-15T00:03:58Z,IOWA.; MEETING OF THE LEGISLATURE CONTEST FOR THE SPEAKERSHIP.,https://query.nytimes.com/gst/abstract.html?res=9D0DE5DC173BEF34BC4D52DFB766838F669FDE,0
1874-01-15T00:03:58Z,THE CUSHING LETTERS.; HE WRITES A LETTER OF DEFENSE AND REQUESTS WITHDRAWAL OF HIS NAME TO THE PRESIDENT. WHEN THE LETTER WAS FOUND. MR. CUSHING'S DEFENSE AND REQUEST TO BE WITHDRAWN. THE MESSAGE WITHDRAWING THE NOMINATION. MR. CUSHING'S LETTER OF DEFENCE.,https://query.nytimes.com/gst/abstract.html?res=9A02E5DC173BEF34BC4D52DFB766838F669FDE,0
1874-01-15T00:03:58Z,A BROOKLYN TRAGEDY.; A SAILOR KILLED BY A SHIPMATE FATAL TERMINATION OF A GAME OF CARDS ARREST OF THE MURDERER HIS STATEMENT.,https://query.nytimes.com/gst/abstract.html?res=9904E4DC173BEF34BC4D52DFB766838F669FDE,0
1874-01-15T00:03:58Z,THE RIOTERS.; SOME OF THE PRISONERS COMMITTED FOR TRIAL COMMUNICATION FROM THE POLICE DEPARTMENT.,https://query.nytimes.com/gst/abstract.html?res=9A04E4DC173BEF34BC4D52DFB766838F669FDE,0
1874-01-15T00:03:58Z,RAILROAD COLLISION.,https://query.nytimes.com/gst/abstract.html?res=9E03E4DC173BEF34BC4D52DFB766838F669FDE,0
1874-01-15T00:03:58Z,MARRIED.,https://query.nytimes.com/gst/abstract.html?res=9503E4DC173BEF34BC4D52DFB766838F669FDE,0
1874-01-15T00:03:58Z,FARMING ON A LARGE SCALE.,https://query.nytimes.com/gst/abstract.html?res=9902E4DC173BEF34BC4D52DFB766838F669FDE,0
1874-01-15T00:03:58Z,HON. CHARLES FRANCIS ADAMS' EULOGY ON ABRAHAM LINCOLN.,https://query.nytimes.com/gst/abstract.html?res=9401E4DC173BEF34BC4D52DFB766838F669FDE,0
1874-01-15T00:03:58Z,COMPULSORY EDUCATION.,https://query.nytimes.com/gst/abstract.html?res=9F01E4DC173BEF34BC4D52DFB766838F669FDE,0
1874-01-15T00:03:58Z,THE WISCONSIN LEGISLATURE.,https://query.nytimes.com/gst/abstract.html?res=980DE5DC173BEF34BC4D52DFB766838F669FDE,0
1874-01-15T00:03:58Z,AMUSEMENTS THIS EVENING.,https://query.nytimes.com/gst/abstract.html?res=9D00E4DC173BEF34BC4D52DFB766838F669FDE,0
1874-01-15T00:03:58Z,THE LATE M. MERIMEE.,https://query.nytimes.com/gst/abstract.html?res=9501E4DC173BEF34BC4D52DFB766838F669FDE,0
1874-01-15T00:03:58Z,ITALY.; PARLIAMENT THE CONSISTORY THE NATIONAL PRESS.,https://query.nytimes.com/gst/abstract.html?res=9B02E4DC173BEF34BC4D52DFB766838F669FDE,0
1874-01-15T00:03:58Z,GERMANY.; POLITICAL COMPLEXION OF THE REICHSTAG.,https://query.nytimes.com/gst/abstract.html?res=9C05E4DC173BEF34BC4D52DFB766838F669FDE,0
1874-01-15T00:03:58Z,JANUARY DIVIDENDS.; PAYMENT OF INTEREST ON STOCK OF CORPORATIONS AND COMPANIES.,https://query.nytimes.com/gst/abstract.html?res=9E07E4DC173BEF34BC4D52DFB766838F669FDE,0
1874-01-15T00:03:58Z,CALIFORNIA.; THE STEAMSHIP CHINA THE CHINESE PRAYING FOR HER SAFE ARRIVAL.,https://query.nytimes.com/gst/abstract.html?res=9500E4DC173BEF34BC4D52DFB766838F669FDE,0
1874-01-15T00:03:58Z,THE DAIRYMEN'S CONVENTION.,https://query.nytimes.com/gst/abstract.html?res=9C0CE5DC173BEF34BC4D52DFB766838F669FDE,0
1874-01-15T00:03:58Z,"MATRICIDE.; JOSEPH W. FREEMAN, OF BERGEN CITY, N.J., SHOOTS HIS MOTHER THE MURDERER ARRESTED. MASKED BURGLARS. CONVENTION OF VETERANS OF THE MEXICAN WAR. REPUBLICAN ORGANIZATIONS. LABOR AND CAPITAL. A MAIL ROBBERY.",https://query.nytimes.com/gst/abstract.html?res=9B0CE4DC173BEF34BC4D52DFB766838F669FDE,0
1874-01-15T00:03:58Z,"DEATH OF A GREAT SHEEP-OWNER; SUICIDE OF PEDRO C. ARMLIO, OF NEW-MEXICO. THE VILLE DU HARVE.",https://query.nytimes.com/gst/abstract.html?res=9802E4DC173BEF34BC4D52DFB766838F669FDE,0
1874-01-15T00:03:58Z,FASHIONS FOR JANUARY.,https://query.nytimes.com/gst/abstract.html?res=9D04E4DC173BEF34BC4D52DFB766838F669FDE,0
1874-01-15T00:03:58Z,THE MINING REGIONS.; ATTITUDE OF THE MINERS AND COAL-OWNERS. NO COMPROMISE BETWEEN THE MINERS AND OPERATORS EXPECTED PROBABLE ADVANCE IN THE PRICE OF COAL. PRESIDENT GOWEN DISCHARGING HIS MEN THE PROSPECTS FOR THE FUTURE. SUSPENSION OF WORK IN THE WILKESBARRE MINES FOR REPAIR STRIKETHREATENED A BURNING SLOPE.,https://query.nytimes.com/gst/abstract.html?res=9E00E4DC173BEF34BC4D52DFB766838F669FDE,0
1874-01-15T00:03:58Z,THE NEW-JERSEY SOUTHERN.; FURTHER PARTICULARS OF THE DESTRUCTION OF PROPERTY BY THE STRIKERS.,https://query.nytimes.com/gst/abstract.html?res=9A03E4DC173BEF34BC4D52DFB766838F669FDE,0
1874-01-15T00:03:58Z,THE CHIEF JUSTICESHIP.,https://query.nytimes.com/gst/abstract.html?res=9D01E4DC173BEF34BC4D52DFB766838F669FDE,0
1874-01-15T00:03:58Z,THE CAUSE OF LONDON FOGS.,https://query.nytimes.com/gst/abstract.html?res=9402E4DC173BEF34BC4D52DFB766838F669FDE,0
1874-01-15T00:03:58Z,ANOTHER NEW OCEAN STEAMER.,https://query.nytimes.com/gst/abstract.html?res=9E04E4DC173BEF34BC4D52DFB766838F669FDE,0
1874-01-15T00:03:58Z,TAMMANY'S PRIMARY FRAUDS.; ARRIVALS AT THE HOTELS. Giesler & Co.,https://query.nytimes.com/gst/abstract.html?res=9B03E4DC173BEF34BC4D52DFB766838F669FDE,0
1874-01-15T00:03:58Z,FRANCE.; DEBATE ON THE BILL AUTHORIZING THE NOMINATION OF MAYORS.,https://query.nytimes.com/gst/abstract.html?res=950CE5DC173BEF34BC4D52DFB766838F669FDE,0
1874-01-15T00:03:58Z,CITY AND COUNTY TREASURY.,https://query.nytimes.com/gst/abstract.html?res=9A07E4DC173BEF34BC4D52DFB766838F669FDE,0
1874-01-15T00:03:58Z,THE GEOGRAPHICAL SOCIETY.,https://query.nytimes.com/gst/abstract.html?res=9404E4DC173BEF34BC4D52DFB766838F669FDE,0
1874-01-15T00:03:58Z,ANNEXATION AND ITS FRUITS.,https://query.nytimes.com/gst/abstract.html?res=9901E4DC173BEF34BC4D52DFB766838F669FDE,0
1874-01-15T00:03:58Z,ESCAPE OF THE SWINDLER LAGRAVE.; JUDSON JARVIS AND EX-WARDEN TRACY ALLOW HIM TO LEAVE LUDLOW STREETJAIL HIS FLIGHT TO EUROPE. TESTIMONIAL TO MR. SHEPHERD KNAPP. THE STATE OF TRADE. PASSENGERS SAILED. PASSENGERS ARRIVED. MINIATURE ALMANAC THIS DAY.,https://query.nytimes.com/gst/abstract.html?res=950CE4DC173BEF34BC4D52DFB766838F669FDE,0
1874-01-16T00:03:58Z,Editorial Article 8 -- No Title,https://query.nytimes.com/gst/abstract.html?res=9C05E2DC173BEF34BC4E52DFB766838F669FDE,0
1874-01-16T00:03:58Z,THE ALBION SOCIETY.,https://query.nytimes.com/gst/abstract.html?res=9C03E2DC173BEF34BC4E52DFB766838F669FDE,0
1874-01-16T00:03:58Z,THE STATE OF TRADE.,https://query.nytimes.com/gst/abstract.html?res=990DE3DC173BEF34BC4E52DFB766838F669FDE,0
1874-01-16T00:03:58Z,THE SEMI-WEEKLY TIMES.,https://query.nytimes.com/gst/abstract.html?res=9E06E2DC173BEF34BC4E52DFB766838F669FDE,0
1874-01-16T00:03:58Z,TRIAL TRIP OF 4 NEW STEAM-SHIP.,https://query.nytimes.com/gst/abstract.html?res=9C04E2DC173BEF34BC4E52DFB766838F669FDE,0
1874-01-16T00:03:58Z,THE VILLE DU HAVRE. INDEMNITY REFUSED TO SUFFERERS BY THE DISASTER.,https://query.nytimes.com/gst/abstract.html?res=9A02E2DC173BEF34BC4E52DFB766838F669FDE,0
1874-01-16T00:03:58Z,THE BRADLEY BANKRUPTCY.,https://query.nytimes.com/gst/abstract.html?res=9D03E2DC173BEF34BC4E52DFB766838F669FDE,0
1874-01-16T00:03:58Z,SUICIDE IN A CHICAGO HOTEL.,https://query.nytimes.com/gst/abstract.html?res=9800E3DC173BEF34BC4E52DFB766838F669FDE,0
1874-01-16T00:03:58Z,CITY AND SUBURBAN NEWS.; NEW-YORK.,https://query.nytimes.com/gst/abstract.html?res=9C0DE2DC173BEF34BC4E52DFB766838F669FDE,0
1874-01-16T00:03:58Z,SAVINGS-BANK LEGISLATION IN MAINE.,https://query.nytimes.com/gst/abstract.html?res=9E07E2DC173BEF34BC4E52DFB766838F669FDE,0
1874-01-16T00:03:58Z,THE SUNDAY LAW TO BE ENFORCED.,https://query.nytimes.com/gst/abstract.html?res=9507E2DC173BEF34BC4E52DFB766838F669FDE,0
1874-01-16T00:03:58Z,BY TELEGRAPH.,https://query.nytimes.com/gst/abstract.html?res=940DE2DC173BEF34BC4E52DFB766838F669FDE,0
1874-01-16T00:03:58Z,NATIONAL BOARD OF TRADE.; DEBATE ON THE FINANCES OF THE COUNTRY.,https://query.nytimes.com/gst/abstract.html?res=9907E2DC173BEF34BC4E52DFB766838F669FDE,1
1874-01-16T00:03:58Z,THE RECEIVER'S POSITION STATEMENT OF GEN. STOCKTON.,https://query.nytimes.com/gst/abstract.html?res=9B04E2DC173BEF34BC4E52DFB766838F669FDE,0
1874-01-16T00:03:58Z,THE LATE CHARLES ASTOR BRISTED.,https://query.nytimes.com/gst/abstract.html?res=9505E2DC173BEF34BC4E52DFB766838F669FDE,0
1874-01-16T00:03:58Z,Editorial Article 4 -- No Title,https://query.nytimes.com/gst/abstract.html?res=9A0CE3DC173BEF34BC4E52DFB766838F669FDE,0
1874-01-16T00:03:58Z,THE CHEAP TRANSPORTATION CONVENTION.; A GREAT WATER ROUTE ADVOCATED.,https://query.nytimes.com/gst/abstract.html?res=9F00E3DC173BEF34BC4E52DFB766838F669FDE,0
1874-01-16T00:03:58Z,THE DAILY TORTURE.,https://query.nytimes.com/gst/abstract.html?res=9F05E2DC173BEF34BC4E52DFB766838F669FDE,0
1874-01-16T00:03:58Z,MINIATURE ALMANAC THIS DAY.,https://query.nytimes.com/gst/abstract.html?res=9A0DE2DC173BEF34BC4E52DFB766838F669FDE,0
1874-01-16T00:03:58Z,THE BERGEN MATRICIDE.; PARTICULARS OF THE TRAGEDY THE INQUEST VERDICT OF THE JURY.,https://query.nytimes.com/gst/abstract.html?res=9F07E2DC173BEF34BC4E52DFB766838F669FDE,0
1874-01-16T00:03:58Z,A PAPAL JOURNAL ON FRANCE.,https://query.nytimes.com/gst/abstract.html?res=9502E3DC173BEF34BC4E52DFB766838F669FDE,0
1874-01-16T00:03:58Z,TRIAL OF HYNES FOR SHOOTING MILNE.,https://query.nytimes.com/gst/abstract.html?res=940DE3DC173BEF34BC4E52DFB766838F669FDE,0
1874-01-16T00:03:58Z,WIFE-MURDER IN MAINE.,https://query.nytimes.com/gst/abstract.html?res=9801E3DC173BEF34BC4E52DFB766838F669FDE,0
1874-01-16T00:03:58Z,RUSSIA.,https://query.nytimes.com/gst/abstract.html?res=9402E2DC173BEF34BC4E52DFB766838F669FDE,0
1874-01-16T00:03:58Z,CAPTURE OF A COUNTERFEITER.,https://query.nytimes.com/gst/abstract.html?res=9A02E3DC173BEF34BC4E52DFB766838F669FDE,0
1874-01-16T00:03:58Z,WOMAN SUFFRAGE.; MEETING OF THE NATIONAL CONVENTION IN WASHINGTON.,https://query.nytimes.com/gst/abstract.html?res=9B06E3DC173BEF34BC4E52DFB766838F669FDE,0
1874-01-16T00:03:58Z,SUPREME COURT CALENDAR.,https://query.nytimes.com/gst/abstract.html?res=9400E3DC173BEF34BC4E52DFB766838F669FDE,0
1874-01-16T00:03:58Z,MARINE INTELLIGENCE.; CLEARED. ARRIVED. SAILED.,https://query.nytimes.com/gst/abstract.html?res=9B0DE2DC173BEF34BC4E52DFB766838F669FDE,0
1874-01-16T00:03:58Z,ARRIVALS AT THE HOTELS.,https://query.nytimes.com/gst/abstract.html?res=9903E2DC173BEF34BC4E52DFB766838F669FDE,0
1874-01-16T00:03:58Z,AMUSEMENTS THIS EVENING.,https://query.nytimes.com/gst/abstract.html?res=9D0CE3DC173BEF34BC4E52DFB766838F669FDE,0
1874-01-16T00:03:58Z,"PATENT RIGHTS; CONVENTION OF PATENTEES, AGENTS, AND INVENTORS IN WASHINGTON.",https://query.nytimes.com/gst/abstract.html?res=9F04E2DC173BEF34BC4E52DFB766838F669FDE,0
1874-01-16T00:03:58Z,CUBA.; DEFEAT OF A SPANISH FORCE OF 650 MEN NEAR MELONES.,https://query.nytimes.com/gst/abstract.html?res=9E00E3DC173BEF34BC4E52DFB766838F669FDE,0
1874-01-16T00:03:58Z,MARRIED.,https://query.nytimes.com/gst/abstract.html?res=9806E2DC173BEF34BC4E52DFB766838F669FDE,0
1874-01-16T00:03:58Z,FAILURE OF AN EXTENSIVE CONTRACTOR.,https://query.nytimes.com/gst/abstract.html?res=9D02E2DC173BEF34BC4E52DFB766838F669FDE,0
1874-01-16T00:03:58Z,THE BOARD OF APPORTIONMENT.,https://query.nytimes.com/gst/abstract.html?res=9503E3DC173BEF34BC4E52DFB766838F669FDE,0
1874-01-16T00:03:58Z,BROOKLYN.,https://query.nytimes.com/gst/abstract.html?res=9C0CE2DC173BEF34BC4E52DFB766838F669FDE,0
1874-01-16T00:03:58Z,PASSENGERS SAILED,https://query.nytimes.com/gst/abstract.html?res=990DE2DC173BEF34BC4E52DFB766838F669FDE,0
1874-01-16T00:03:58Z,THE RYAN MURDER.; CONCLUSIVE EVIDENCE AS TO THE CHARACTER OF THE CRIME MORE WORK FOR THE DETECTIVES.,https://query.nytimes.com/gst/abstract.html?res=9E03E2DC173BEF34BC4E52DFB766838F669FDE,0
1874-01-16T00:03:58Z,CARDINALS' HATS.,https://query.nytimes.com/gst/abstract.html?res=9802E2DC173BEF34BC4E52DFB766838F669FDE,0
1874-01-16T00:03:58Z,JAPAN.; DIPLOMATIC AFFAIRS THE COOLIE TRAFFIC IN PERU A DISAGREEMENT WITH FOREIGN MINISTERS.,https://query.nytimes.com/gst/abstract.html?res=9E01E3DC173BEF34BC4E52DFB766838F669FDE,0
1874-01-16T00:03:58Z,SPAIN.; CAUSES OF THE CARTAGENA SURRENDER THE FUGITIVES TO BE GIVEN UP.,https://query.nytimes.com/gst/abstract.html?res=9B02E2DC173BEF34BC4E52DFB766838F669FDE,0
1874-01-16T00:03:58Z,RAILROAD EXACTIONS.,https://query.nytimes.com/gst/abstract.html?res=9903E3DC173BEF34BC4E52DFB766838F669FDE,0
1874-01-16T00:03:58Z,THE MASSACHUSETTS FISHERIES.,https://query.nytimes.com/gst/abstract.html?res=9A05E2DC173BEF34BC4E52DFB766838F669FDE,0
1874-01-16T00:03:58Z,THE PRODUCE EXCHANGE.,https://query.nytimes.com/gst/abstract.html?res=9C02E2DC173BEF34BC4E52DFB766838F669FDE,0
1874-01-16T00:03:58Z,HOUSE OF REPRESENTATIVES.; THE WEST VIRGINIA ELECTION. CASES OF HABEAS CORPUS IN THE SUPREME COURT. THE OFFICIAL REPORTERS PETITIONS. PRINTING OF PRIVATE BILLS. THE NAVAL APPROPRIATIONS.,https://query.nytimes.com/gst/abstract.html?res=9C03E3DC173BEF34BC4E52DFB766838F669FDE,0
1874-01-16T00:03:58Z,NAVAL WARFARE.,https://query.nytimes.com/gst/abstract.html?res=9A00E2DC173BEF34BC4E52DFB766838F669FDE,0
1874-01-16T00:03:58Z,THE STATE OF TRADE.,https://query.nytimes.com/gst/abstract.html?res=980DE2DC173BEF34BC4E52DFB766838F669FDE,0
1874-01-16T00:03:58Z,LATEST SHIPPING NEWS BY CABLE.,https://query.nytimes.com/gst/abstract.html?res=9D0CE2DC173BEF34BC4E52DFB766838F669FDE,0
1874-01-16T00:03:58Z,CARDINAL ANTONELLI.,https://query.nytimes.com/gst/abstract.html?res=9E05E2DC173BEF34BC4E52DFB766838F669FDE,0
1874-01-16T00:03:58Z,THE SUN'S FAMILY OF PLANETS.; LECTURE BY PROF. PROCTOR AT ASSOCIATION HALL THE SECOND OF THE SERIES ON ASTRONOMY.,https://query.nytimes.com/gst/abstract.html?res=9B07E2DC173BEF34BC4E52DFB766838F669FDE,0
1874-01-16T00:03:58Z,THE BOARD OF ALDERMEN.,https://query.nytimes.com/gst/abstract.html?res=9403E3DC173BEF34BC4E52DFB766838F669FDE,0
1874-01-16T00:03:58Z,ESCAPE OF PRISONERS FROM THE WISCONSIN STATE PRISON.,https://query.nytimes.com/gst/abstract.html?res=9506E3DC173BEF34BC4E52DFB766838F669FDE,0
1874-01-16T00:03:58Z,GREAT BRITAIN.; FIRE IN THE PORTSMOUTH DOCKYARD ELECTION OF A RADICAL TO PARLIAMENT.,https://query.nytimes.com/gst/abstract.html?res=9501E3DC173BEF34BC4E52DFB766838F669FDE,0
1874-01-16T00:03:58Z,"RESTRAINING AN ELECTION.; THE RIVAL SEWING-MACHINE COMPANIES $150,000 STOCK INVOLVED AN INJUNCTION GRANTED.",https://query.nytimes.com/gst/abstract.html?res=9803E3DC173BEF34BC4E52DFB766838F669FDE,0
