pub_date,main_headline,article_url,classification
1876-01-07T00:03:58Z,THE CIVIL JUSTICES' COURTS.; PROPOSED REFORMS IN THE NEW-YORK COURTS--RESULTS OF THE SENATE INVESTIGATING COMMITTEE'S RESEARCHES.,https://query.nytimes.com/gst/abstract.html?res=9D05EED91639E13BBC4F53DFB766838D669FDE,0
1876-01-07T00:03:58Z,CONGRESS AND THE CENTENNIAL.; THE HOUSE SELECT COMMITTEE IN FAVOR OF FURNISHING THE COMMISSIONERS THE AID ASKED FOR--AN APPROPRIATION RECOMMENDED.,https://query.nytimes.com/gst/abstract.html?res=9F0CEFD91639E13BBC4F53DFB766838D669FDE,0
1876-01-07T00:03:58Z,ALBANY.; THE ASSEMBLY COMMITTEES. BRIEF SESSIONS IN BOTH HOUSES YESTERDAY AND ADJOURNMENT TILL TUESDAY --SENATORS M'CARTHY AND WOODIN ONQUESTIONS OF PRIVILEGE--THE DRIFT OF THE BILLS IN THE HOUSE. BUSINESS IN THE ASSEMBLY. THE ASSEMBLY COMMITTEES.,https://query.nytimes.com/gst/abstract.html?res=950CEFD91639E13BBC4F53DFB766838D669FDE,0
1876-01-07T00:03:58Z,MARINE INTELLIGENCE.; CLEARED. ARRIVED. SAILED. NOTICE TO MARINERS. FOREIGN PORTS. LATEST SHIPPING NEWS BY CABLE.,https://query.nytimes.com/gst/abstract.html?res=9D0CE7D81639E13BBC4F53DFB766838D669FDE,0
1876-01-07T00:03:58Z,PASSENGERS ARRIVED.,https://query.nytimes.com/gst/abstract.html?res=940DE7D81639E13BBC4F53DFB766838D669FDE,0
1876-01-07T00:03:58Z,RAILWAY GRANTS IN CANADA.,https://query.nytimes.com/gst/abstract.html?res=9505EED91639E13BBC4F53DFB766838D669FDE,0
1876-01-07T00:03:58Z,"THE KINGS COUNTY ASYLUM; A MISMANAGED INSTITUTION. DR. ORDRONAUX MAKES HIS REPORT TO THE LEGISLATURE--THE CHARITY COMMISSIONERS CHARGED WITH GENERAL INCOMPETENCY, HABITUAL NEGLIGENCE, AND OFFICIAL MALFEASANCE.",https://query.nytimes.com/gst/abstract.html?res=9F04E7D81639E13BBC4F53DFB766838D669FDE,0
1876-01-07T00:03:58Z,THE PENNSYLVANIA LEGISLATURE.; THE ORDER OF BUSINESS AGREED UPON BY A JOINT COMMITTEE--A VICTORY FOR THE REPUBLICAN MEMBERS.,https://query.nytimes.com/gst/abstract.html?res=9902EED91639E13BBC4F53DFB766838D669FDE,0
1876-01-07T00:03:58Z,Article 5 -- No Title,https://query.nytimes.com/gst/abstract.html?res=9E03EED91639E13BBC4F53DFB766838D669FDE,0
1876-01-07T00:03:58Z,MASTER BLANCHARD.,https://query.nytimes.com/gst/abstract.html?res=9802EED91639E13BBC4F53DFB766838D669FDE,0
1876-01-07T00:03:58Z,RAILROAD REPORTS.; CONDITION OF THE CHESAPEAKE AND OHIO LINE--THE EARNINGS AND EXPENSES FOR LAST YEAR.,https://query.nytimes.com/gst/abstract.html?res=9D03E7D81639E13BBC4F53DFB766838D669FDE,0
1876-01-07T00:03:58Z,FORTY-FOURTH CONGRESS.; FIRST SESSION--Jan. 6. SENATE. BANK CHECK STAMP TAX. THE PRESIDENT PRO TEM. THE LATE VICE PRESIDENT. ALASKA. THE PRESIDENT'S SALARY. PURCHASE OF PRODUCTS OF REBEL STATES. JUDICIAL DISTRICTS OF MINNESOTA. REDEMPTION OF LEGAL TENDERS. INDEMNITY FOR THE PACIFIC RAILROAD INDEBTEDNESS. COURTS IN THE INDIAN TERRITORY.,https://query.nytimes.com/gst/abstract.html?res=9404EED91639E13BBC4F53DFB766838D669FDE,0
1876-01-07T00:03:58Z,Article 3 -- No Title,https://query.nytimes.com/gst/abstract.html?res=9500EED91639E13BBC4F53DFB766838D669FDE,0
1876-01-07T00:03:58Z,LATEST NEWS BY CABLE.; THE TURKISH QUESTION. THE ANNOUNCEMENT OF FRENCH ASSENT TO THE REFORM SCHEME PREMATURE. THE AUSTRIAN NOTE NOT TO BE PUBLISHED TILL ALL THE POWERS AGREE TO IT. THE HERZEGOVINIANS REPULSED AT NICSIO BY THE TURKS. ADHERENCE OF FRANCE TO THE REFORM SCHEME REASSERTED--THE MONTENEGRIN LOAN.,https://query.nytimes.com/gst/abstract.html?res=980DEED91639E13BBC4F53DFB766838D669FDE,0
1876-01-07T00:03:58Z,HOUSE OF REPRESENTATIVES.; REDUCTION OF ARMY EXPENSES. THE CENTENNIAL--PEACE AND HARMONY. TAXATION OF STOCKS AND BONDS. INFLATION. AN EX-REBEL POSTMASTER GENERAL ON ECONOMY. THE TEXAS BORDER. AMNESTY.,https://query.nytimes.com/gst/abstract.html?res=9504EED91639E13BBC4F53DFB766838D669FDE,0
1876-01-07T00:03:58Z,IRISH POLITICS.,https://query.nytimes.com/gst/abstract.html?res=9D02EED91639E13BBC4F53DFB766838D669FDE,0
1876-01-07T00:03:58Z,A Want Supplied.,https://query.nytimes.com/gst/abstract.html?res=9A04E7D81639E13BBC4F53DFB766838D669FDE,0
1876-01-07T00:03:58Z,NAVAL INTELLIGENCE.; REAR ADMIRAL REYNOLDS' REPORT--TRANSFERS AND APPOINTMENTS.,https://query.nytimes.com/gst/abstract.html?res=980CEFD91639E13BBC4F53DFB766838D669FDE,0
1876-01-07T00:03:58Z,THE BROOKLYN RING SUITS.; COMMISSIONER FOWLER PRESSING FOR A CHANGE OF VENUE IN HIS OWN CASE-- MAYOR SCHROEDER'S COURSE. COMMISSIONER FOWLER'S AFFIDAVIT. THE BRITTON CASE--PAVEMENT FRAUDS. POST OFFICE ROBBERS CAUGHT. THE ANTI-TAMMANY PRIMARIES. WHITE WASHING DONE CHEAPLY. DETERMINED POLICE JUSTICES.,https://query.nytimes.com/gst/abstract.html?res=9402E7D81639E13BBC4F53DFB766838D669FDE,0
1876-01-07T00:03:58Z,THE UNITED STATES AND CANADA.,https://query.nytimes.com/gst/abstract.html?res=9B04EED91639E13BBC4F53DFB766838D669FDE,0
1876-01-07T00:03:58Z,A RELIGIOUS REVIVAL.,https://query.nytimes.com/gst/abstract.html?res=9E07EED91639E13BBC4F53DFB766838D669FDE,0
1876-01-07T00:03:58Z,INDICTMENT OF FORMER BANK OFFICERS.,https://query.nytimes.com/gst/abstract.html?res=9B05EED91639E13BBC4F53DFB766838D669FDE,0
1876-01-07T00:03:58Z,DECISIONS.; SUPREME COURT--CHAMBERS. SUPREME COURT--SPECIAL TERM. COMMON PLEAS--SPECIAL TERM.,https://query.nytimes.com/gst/abstract.html?res=9906EED91639E13BBC4F53DFB766838D669FDE,0
1876-01-07T00:03:58Z,COURT NOTES.,https://query.nytimes.com/gst/abstract.html?res=9D06EED91639E13BBC4F53DFB766838D669FDE,0
1876-01-07T00:03:58Z,"THE ""DOLLY VARDEN STORE.""; AN INTERESTING BANKRUPTCY CASE-- STATEMENT OF THE ASSIGNEE.",https://query.nytimes.com/gst/abstract.html?res=9C06EED91639E13BBC4F53DFB766838D669FDE,0
1876-01-07T00:03:58Z,"ROBBERY IN HARTFORD.; HOW A PRIVATE BANK LOST HEAVILY, AND RECOVERED A PORTION OF ITS FUNDS.",https://query.nytimes.com/gst/abstract.html?res=9C04E7D81639E13BBC4F53DFB766838D669FDE,0
1876-01-07T00:03:58Z,Article 2 -- No Title,https://query.nytimes.com/gst/abstract.html?res=9400EED91639E13BBC4F53DFB766838D669FDE,0
1876-01-07T00:03:58Z,LOUISIANA CONSERVATIVES.; RESOLUTIONS ADOPTCD BY A DEMOCRATIC CONVENTION.,https://query.nytimes.com/gst/abstract.html?res=9F05EED91639E13BBC4F53DFB766838D669FDE,0
1876-01-07T00:03:58Z,OBITUARY.; RIGHT HON. THOMAS SUTTON SOTHERON ESTCOURT: PROF. WILHELM BOECK. OBITUARY NOTES.,https://query.nytimes.com/gst/abstract.html?res=9F05E7D81639E13BBC4F53DFB766838D669FDE,0
1876-01-07T00:03:58Z,A GOOD WORK COMMENCED.; TRINITY PARISH ORGANIZING A WORKINGMEN'S CLUB AND A DAY NURSERY FOR CHILDREN.,https://query.nytimes.com/gst/abstract.html?res=9802E7D81639E13BBC4F53DFB766838D669FDE,0
1876-01-07T00:03:58Z,LETTERS TO THE EDITOR.; THE CHILDREN ON RANDALL'S ISLAND. TAXATION IN BROOKLYN. BANK SHARE HOLDERS. MORE CARELESSNESS.,https://query.nytimes.com/gst/abstract.html?res=9904EED91639E13BBC4F53DFB766838D669FDE,1
1876-01-07T00:03:58Z,RAILWAY WAR IN NEW-JERSEY.; THE STRUGGLE BETWEEN THE PENNSYLVANIA AND BOUND BROOK LINES--CHARGED BY A LOCOMOTIVE.,https://query.nytimes.com/gst/abstract.html?res=9A0CEFD91639E13BBC4F53DFB766838D669FDE,0
1876-01-07T00:03:58Z,WASHINGTON.; THE PRESIDENCY OF THE SENATE. A MAJORITY AND MINORITY REPORT FROM THE SENATE COMMITTEE ON PRIVILEGES AND ELECTION--A DIFFERENCE OF OPINION AS TO THE RIGHT TO RE-ELECT.,https://query.nytimes.com/gst/abstract.html?res=990DEFD91639E13BBC4F53DFB766838D669FDE,0
1876-01-07T00:03:58Z,THE CHICAGO WHISKY FRAUDS.; TESTIMONY OF A DISTILLER BEFORE THE GRAND JURY.,https://query.nytimes.com/gst/abstract.html?res=9A02EED91639E13BBC4F53DFB766838D669FDE,0
1876-01-07T00:03:58Z,THE MOULTON-BEECHER CASE.; MR. BEECHER EXPECTED TO DEMUR--POSSIBLE POSTPONEMENT OF THE INVESTIGATION AS TO THE FACTS.,https://query.nytimes.com/gst/abstract.html?res=9C05E7D81639E13BBC4F53DFB766838D669FDE,0
1876-01-07T00:03:58Z,GERMANY.; THE OPPOSITION OF THE ULTRAMONTANE PARTY UNABATED.,https://query.nytimes.com/gst/abstract.html?res=940DEED91639E13BBC4F53DFB766838D669FDE,0
1876-01-07T00:03:58Z,THE MASKED BALL LAW.,https://query.nytimes.com/gst/abstract.html?res=9F03E7D81639E13BBC4F53DFB766838D669FDE,0
1876-01-07T00:03:58Z,THE BRAZILIAN CABLE.; REPAIR OF THE BREAK NEAR THE MADEIRA ISLANDS.,https://query.nytimes.com/gst/abstract.html?res=9F0CEED91639E13BBC4F53DFB766838D669FDE,0
1876-01-07T00:03:58Z,Article 1 -- No Title,https://query.nytimes.com/gst/abstract.html?res=9B00EED91639E13BBC4F53DFB766838D669FDE,0
1876-01-07T00:03:58Z,Article 4 -- No Title,https://query.nytimes.com/gst/abstract.html?res=9C03EED91639E13BBC4F53DFB766838D669FDE,0
1876-01-07T00:03:58Z,THE TWEED STRUCK JURY.; A MOTION TO AMEND THE ARRAY OF JURORS ARGUED--THE DEFENDANT'S RIGHTS STATED--DECISION RESERVED.,https://query.nytimes.com/gst/abstract.html?res=9807EED91639E13BBC4F53DFB766838D669FDE,0
1876-01-07T00:03:58Z,A JERSEY CITY JUSTICE ARRESTED.,https://query.nytimes.com/gst/abstract.html?res=9403E7D81639E13BBC4F53DFB766838D669FDE,0
1876-01-07T00:03:58Z,COMMERCIAL INTERESTS.; THE CHAMBER OF COMMERCE. MEMORIAL RESPECTING THE MANAGEMENT OF THE STATE CANALS--OUR TRANSPORTATION SYSTEM--THE NAUTICAL SCHOOL --THE JAPAN INDEMNITY. OUR RELATIONS WITH JAPAN.,https://query.nytimes.com/gst/abstract.html?res=9C03E7D81639E13BBC4F53DFB766838D669FDE,0
1876-01-07T00:03:58Z,COURT CALENDARS--THIS DAY.; SUPREME COURT--CHAMBERS.,https://query.nytimes.com/gst/abstract.html?res=9B06EED91639E13BBC4F53DFB766838D669FDE,0
1876-01-07T00:03:58Z,BY MAIL AND TELEGRAPH.,https://query.nytimes.com/gst/abstract.html?res=940CEFD91639E13BBC4F53DFB766838D669FDE,0
1876-01-07T00:03:58Z,A DETECTIVE'S ALLEGED DISHONESTY.,https://query.nytimes.com/gst/abstract.html?res=9A03E7D81639E13BBC4F53DFB766838D669FDE,0
1876-01-07T00:03:58Z,THE CITY FINANCES.; THE MUNICIPAL DEBT AND EXPENDITURES DURING THE YEAR 1875.,https://query.nytimes.com/gst/abstract.html?res=9F02E7D81639E13BBC4F53DFB766838D669FDE,0
1876-01-07T00:03:58Z,MOB VIOLENCE IN OHIO.,https://query.nytimes.com/gst/abstract.html?res=980CEED91639E13BBC4F53DFB766838D669FDE,0
1876-01-07T00:03:58Z,THE LA PAGE TRIAL.,https://query.nytimes.com/gst/abstract.html?res=9B0CEFD91639E13BBC4F53DFB766838D669FDE,0
1876-01-07T00:03:58Z,VERDICTS AGAINST THE CITY.; TWO CURIOUS CASES--ANOTHER COACH-HIRE QUESTION--AN INTERPRETER'S TALENTS.,https://query.nytimes.com/gst/abstract.html?res=9A07EED91639E13BBC4F53DFB766838D669FDE,0
1876-01-07T00:03:58Z,Article 7 -- No Title,https://query.nytimes.com/gst/abstract.html?res=9903EED91639E13BBC4F53DFB766838D669FDE,0
1876-01-07T00:03:58Z,STATEN ISLAND.,https://query.nytimes.com/gst/abstract.html?res=9F0DE7D81639E13BBC4F53DFB766838D669FDE,0
1876-01-07T00:03:58Z,"UNITED STATES SUPREME COURT.; REPORT OF CASES ARGUED YESTERDAY. WASHINGTON, Jan. 6.--In the United States",https://query.nytimes.com/gst/abstract.html?res=9806EED91639E13BBC4F53DFB766838D669FDE,0
1876-01-07T00:03:58Z,"GEORGE D. LORD'S TRIAL.; THE SECOND DAY IN COURT. TESTIMONY OF EX-CANAL COMMISSIONER BARKLEY--THE EVIDENCE GIVEN 'BY WILLIAM H. BOWMAN FREDERICK A. ALBERGER, AND OTHERS.",https://query.nytimes.com/gst/abstract.html?res=9405E7D81639E13BBC4F53DFB766838D669FDE,0
1876-01-07T00:03:58Z,THE NATIONAL CONVENTION.; THE TIME AND PLACE OE HOLDING THE NATIONAL REPUBLICAN CONVENTION-- THE QUESTION OF LOCALITY AN OPEN ONE--SEVERAL CITIES ANXIOU TO SECURE THE HONOR.,https://query.nytimes.com/gst/abstract.html?res=9D0CEFD91639E13BBC4F53DFB766838D669FDE,0
1876-01-07T00:03:58Z,THE NEW CANAL BOARD.; QUESTIONS TO COME UP AT THE FIRST MEETING ON THURSDAY NEXT.,https://query.nytimes.com/gst/abstract.html?res=9E05EED91639E13BBC4F53DFB766838D669FDE,0
1876-01-07T00:03:58Z,Marriage Announcement 1 -- No Title,https://query.nytimes.com/gst/abstract.html?res=9E07E7D81639E13BBC4F53DFB766838D669FDE,0
1876-01-07T00:03:58Z,DORA FRIEDMAN'S WILL.,https://query.nytimes.com/gst/abstract.html?res=9F06EED91639E13BBC4F53DFB766838D669FDE,0
1876-01-07T00:03:58Z,THE PRODUCE EXCHANGE.,https://query.nytimes.com/gst/abstract.html?res=9E03E7D81639E13BBC4F53DFB766838D669FDE,0
1876-01-07T00:03:58Z,THE EXPEDITION OF COL. LONG.; OCCUPATION OF THE TOWNS OF JUBA AND KISMAYA--HOISTING THE EGYPTIAN CRESCENT AND STAR OVER THE TOWNS.,https://query.nytimes.com/gst/abstract.html?res=9E0DEED91639E13BBC4F53DFB766838D669FDE,0
1876-01-07T00:03:58Z,UNION LEAGUE OF AMERICA.,https://query.nytimes.com/gst/abstract.html?res=9405EED91639E13BBC4F53DFB766838D669FDE,0
1876-01-07T00:03:58Z,AMUSEMENTS THIS EVENING.,https://query.nytimes.com/gst/abstract.html?res=9800EED91639E13BBC4F53DFB766838D669FDE,0
1876-01-07T00:03:58Z,STATE DOCUMENTS.; GOV. RICE'S MESSAGE. THE CONDITION OF AFFAIRS IN MASSACHUSETTS--THE MAIN POINTS OF THE GOVERNOR'S ANNUAL ADDRESS.,https://query.nytimes.com/gst/abstract.html?res=9A0CEED91639E13BBC4F53DFB766838D669FDE,0
1876-01-07T00:03:58Z,A LADIES' QUARREL.,https://query.nytimes.com/gst/abstract.html?res=9407EED91639E13BBC4F53DFB766838D669FDE,0
1876-01-07T00:03:58Z,Obituary 1 -- No Title,https://query.nytimes.com/gst/abstract.html?res=9807E7D81639E13BBC4F53DFB766838D669FDE,0
1876-01-07T00:03:58Z,A DOUBLE EXECUTION.; TWO MURDERERS HANGED IN PENNSYLVANIA--THE STORY OF THE CRIME FOR WHICH THEY WERE PUNISHED.,https://query.nytimes.com/gst/abstract.html?res=9805EED91639E13BBC4F53DFB766838D669FDE,0
1876-01-07T00:03:58Z,TAMMANY'S NEW COMMITTEE.,https://query.nytimes.com/gst/abstract.html?res=9D05E7D81639E13BBC4F53DFB766838D669FDE,0
1876-01-07T00:03:58Z,FIVE COFFINS FOUND IN A BASEMENT.,https://query.nytimes.com/gst/abstract.html?res=9903E7D81639E13BBC4F53DFB766838D669FDE,0
1876-01-07T00:03:58Z,CONGRESS IN SESSION.; A SUBSTITUTE FOR MR. RANDALL'S AMNESTY BILL--THE INFLATIONISTS OF THE HOUSE DEFEATED--DILATORY MOVEMENTS OF THE DEMOCRATS--THE TROUBLES ALONG THE TEXAN BORDER.,https://query.nytimes.com/gst/abstract.html?res=9C0CEFD91639E13BBC4F53DFB766838D669FDE,0
1876-01-07T00:03:58Z,THE WHITECHAPEL TRAGEDY.; THE LAST SCENE OF ALL--THE EXECUTION OF HENRY WAINWRIGHT--HOW THE CRIMINAL'S BODY WAS DISPOSED OF. GEN. SLOCUM AT WORK.,https://query.nytimes.com/gst/abstract.html?res=9804E7D81639E13BBC4F53DFB766838D669FDE,0
1876-01-07T00:03:58Z,FRANCE.; STRINGENT INTERPRETATION OF THE PRESS LAW--MARSHAL CANROBERT AND THE SENATE--THE CENTENNIAL. THE REPUBLICAN TICKET FOR PARIS. PRESIDENT MACMAHON AND MARSHAL CANROBERT.,https://query.nytimes.com/gst/abstract.html?res=990DEED91639E13BBC4F53DFB766838D669FDE,0
1876-01-07T00:03:58Z,BALL OF L'AMITIE SOCIETY.,https://query.nytimes.com/gst/abstract.html?res=9D02E7D81639E13BBC4F53DFB766838D669FDE,0
1876-01-07T00:03:58Z,A QUESTION OF PATERNITY.,https://query.nytimes.com/gst/abstract.html?res=9E06EED91639E13BBC4F53DFB766838D669FDE,0
1876-01-07T00:03:58Z,THE GREEK CHRISTMAS.,https://query.nytimes.com/gst/abstract.html?res=9E02EED91639E13BBC4F53DFB766838D669FDE,0
1876-01-07T00:03:58Z,MARYLAND LEGISLATURE.; THE STATE SENATE ORGANIZED--GOV. GROOME'S ANNUAL MESSAGE.,https://query.nytimes.com/gst/abstract.html?res=950CEED91639E13BBC4F53DFB766838D669FDE,0
1876-01-07T00:03:58Z,PASSENGERS SAILED.,https://query.nytimes.com/gst/abstract.html?res=9B0DE7D81639E13BBC4F53DFB766838D669FDE,0
1876-01-07T00:03:58Z,GREAT BRITAIN; DEATH OF A FORMER HOME SECRETARY--A DESTRUCTIVE FIRE IN LONDON--DAMAGED IN A GALE.,https://query.nytimes.com/gst/abstract.html?res=9B0DEED91639E13BBC4F53DFB766838D669FDE,0
1876-01-07T00:03:58Z,AUSTRIA AND HUNGARY.; THE NEGOTIATIONS BETWEEN THE RESPECTIVE MINISTRIES.,https://query.nytimes.com/gst/abstract.html?res=9C0CEED91639E13BBC4F53DFB766838D669FDE,0
1876-01-07T00:03:58Z,ANOTHER FOX-HUNT.,https://query.nytimes.com/gst/abstract.html?res=9D07EED91639E13BBC4F53DFB766838D669FDE,0
1876-01-08T00:03:58Z,FRANCE.; THE GOVERNMENT CANDIDATES FOR THE SENATE.,https://query.nytimes.com/gst/abstract.html?res=9500E4DD113FE73BBC4053DFB766838D669FDE,0
1876-01-08T00:03:58Z,"CHEATING ""MISSUS.""",https://query.nytimes.com/gst/abstract.html?res=9F01E3DD113FE73BBC4053DFB766838D669FDE,0
1876-01-08T00:03:58Z,THE SMALL BOY'S APT REMARK.,https://query.nytimes.com/gst/abstract.html?res=9B06E3DD113FE73BBC4053DFB766838D669FDE,0
1876-01-08T00:03:58Z,Obituary 1 -- No Title,https://query.nytimes.com/gst/abstract.html?res=9C00E3DD113FE73BBC4053DFB766838D669FDE,0
1876-01-08T00:03:58Z,THE BAIE VERTE CANAL.,https://query.nytimes.com/gst/abstract.html?res=9806E4DD113FE73BBC4053DFB766838D669FDE,0
1876-01-08T00:03:58Z,FORTUNATE CONVICTS.,https://query.nytimes.com/gst/abstract.html?res=9905E3DD113FE73BBC4053DFB766838D669FDE,0
1876-01-08T00:03:58Z,"EFFECTS OF RING RULE.; INDIGNANT PROPERTY-OWNERS. NUMEROUS PROTESTS AGAINST ASSESSMENTS, ESPECIALLY AGAINST THOSE ON ST. NICHOLAS AVENUE.",https://query.nytimes.com/gst/abstract.html?res=950CE3DD113FE73BBC4053DFB766838D669FDE,0
1876-01-08T00:03:58Z,THE MANUFACTURERS' AND BUILDERS' BANK.,https://query.nytimes.com/gst/abstract.html?res=9C05E2DD113FE73BBC4053DFB766838D669FDE,0
1876-01-08T00:03:58Z,THE LIQUOR QUESTION IN CANADA.,https://query.nytimes.com/gst/abstract.html?res=9A07E4DD113FE73BBC4053DFB766838D669FDE,0
1876-01-08T00:03:58Z,THE INFANT ASYLUM BALL.,https://query.nytimes.com/gst/abstract.html?res=9E02E4DD113FE73BBC4053DFB766838D669FDE,0
1876-01-08T00:03:58Z,SEA-WOLVES AND CHINAMEN.,https://query.nytimes.com/gst/abstract.html?res=9F05E3DD113FE73BBC4053DFB766838D669FDE,0
1876-01-08T00:03:58Z,THE GERMAN-AMERICAN BANK.,https://query.nytimes.com/gst/abstract.html?res=9C0DE4DD113FE73BBC4053DFB766838D669FDE,0
1876-01-08T00:03:58Z,COLLEGE DISCIPLINE.; THE NEW-YORK ALUMNI ASSOCIATION OF PRINCETON ON SECRET SOCIETIES.,https://query.nytimes.com/gst/abstract.html?res=9B02E4DD113FE73BBC4053DFB766838D669FDE,0
1876-01-08T00:03:58Z,SPAIN.; VESSELS WARNED AGAINST CARLIST BATTERIES ON THE COAST--THE AMBASSADOR TO ROME.,https://query.nytimes.com/gst/abstract.html?res=9E00E4DD113FE73BBC4053DFB766838D669FDE,0
1876-01-08T00:03:58Z,"MORE, OLD PEOPLE.; OLD PHILADELPHIANS WHO DIED LAST YEAR. OLD PEOPLE AT DINNER.",https://query.nytimes.com/gst/abstract.html?res=9507E3DD113FE73BBC4053DFB766838D669FDE,0
1876-01-08T00:03:58Z,GEN. SHERMAN'S MEMOIRS.; MISSIONARY RIDGE. A QUESTION OF VERACITY--GEN. SHERMA VINDICATED--THE STORY OF THE BATTLE FROM THE HOUR OF HOOKER'S ASSAULT ON LOOKOUT MOUNTAIN TO THOMAS' VICTORY IN THE CENTRE.,https://query.nytimes.com/gst/abstract.html?res=9804E3DD113FE73BBC4053DFB766838D669FDE,0
1876-01-08T00:03:58Z,THE CHICAGO MAYORALTY.,https://query.nytimes.com/gst/abstract.html?res=9906E4DD113FE73BBC4053DFB766838D669FDE,0
1876-01-08T00:03:58Z,THE FRENCH ACADEMY.,https://query.nytimes.com/gst/abstract.html?res=9D06E3DD113FE73BBC4053DFB766838D669FDE,0
1876-01-08T00:03:58Z,CITY AND SUBURBAN NEWS.; NEW-YORK. BROOKLYN. NEW-JERSEY. ARRIVALS AT THE HOTELS. A LETTER FROM MR. ROSS. SEEKING A TEACHER FOR LINDA. SPEECH RESTORED AFTER TWENTY YEARS. AN ABSCONDING DEBTOR. CALIFORNIA STOCKS. MECHANICS AND OTHERS PRINTING CLOTHS MARKET.,https://query.nytimes.com/gst/abstract.html?res=9505E2DD113FE73BBC4053DFB766838D669FDE,0
1876-01-08T00:03:58Z,GEORGE D. LORD'S TRIAL.; THE THIRD DAY'S SESSION. CROSS-EXAMINATION OF LEWIS J. BENNETT --TESTIMONY OF JOHN HAND AND CANAL APPRAISER DAVIS--THE ARGUMENTS FOR THE DEFENSE. AFTERNOON SESSION.,https://query.nytimes.com/gst/abstract.html?res=9F07E3DD113FE73BBC4053DFB766838D669FDE,0
1876-01-08T00:03:58Z,FORTY-FOURTH CONGRESS--FIRST SESSION.; SENATE....JAN. 7. THE PRESIDENCY OF THE SENATE. ADVERSE REPORT ON A CLAIM. POLITICAL DISABILITIES. MEMORIALS. CLAIM FOR VIOLATION OF CONTRACT.,https://query.nytimes.com/gst/abstract.html?res=9D03E4DD113FE73BBC4053DFB766838D669FDE,0
1876-01-08T00:03:58Z,RELIGIOUS INTELLIGENCE.; THE REVIVAL IN NEWBURG--THE CANADIAN EVANGELICAL ALLIANCE.,https://query.nytimes.com/gst/abstract.html?res=9907E4DD113FE73BBC4053DFB766838D669FDE,0
1876-01-08T00:03:58Z,WASHINGTON.; CONGRESSIONAL TOPICS. AMNESTY AND JEFF DAVIS--MR. RANDALL'S SHAM ECONOMY--A SHALLOW DEVICE EXPOSED--THE APPROPRIATION BILLS. THE PRESIDENCY OF THE SENATE. FURTHER POSTPONEMENT OF THE CONSIDERATION OF THE REPORT OF THECOMMITTEE ON PRIVILEGES AND ELECTIONS. EXTRACTS FROM THE COMMITTEE'S REPORT. TROUBLESOME DEMOCRATS. THE MAJORITY SIDE OF THE HOUSE GREATLY DISTURBED BY THE LOUISIANA CONSERVATIVES--THE OPPOSITION TO THEWHEELER COMPROMISE. NOTES FROM THE CAPITAL. MONEY CONCEALED BY A THIEF RECOVERED IN A DAMAGED CONDITION--THEREPORTS OF CHANGES IN THE INTERIORDEPARTMENT. NAVY AND ARMY REGISTER. NOMINATIONS CONFIRMED.,https://query.nytimes.com/gst/abstract.html?res=9E07E4DD113FE73BBC4053DFB766838D669FDE,0
1876-01-08T00:03:58Z,GERMANY.; VICE CONSUL AT NEW-YORK. THE CASE OF COUNT VON ARNIM.,https://query.nytimes.com/gst/abstract.html?res=9A00E4DD113FE73BBC4053DFB766838D669FDE,0
1876-01-08T00:03:58Z,Marriage Announcement 1 -- No Title,https://query.nytimes.com/gst/abstract.html?res=9501E3DD113FE73BBC4053DFB766838D669FDE,0
1876-01-08T00:03:58Z,THE COST OF STEALING A VESSEl.,https://query.nytimes.com/gst/abstract.html?res=9502E4DD113FE73BBC4053DFB766838D669FDE,0
1876-01-08T00:03:58Z,THE LATEST NOVELTY IN THIEVING.,https://query.nytimes.com/gst/abstract.html?res=9F02E4DD113FE73BBC4053DFB766838D669FDE,0
1876-01-08T00:03:58Z,AROUND THE WORLD.,https://query.nytimes.com/gst/abstract.html?res=9407E3DD113FE73BBC4053DFB766838D669FDE,0
1876-01-08T00:03:58Z,PRIVATE LETTERS OF PRINCE BISMARCK.,https://query.nytimes.com/gst/abstract.html?res=9D04E3DD113FE73BBC4053DFB766838D669FDE,0
1876-01-08T00:03:58Z,Article 2 -- No Title,https://query.nytimes.com/gst/abstract.html?res=990CE4DD113FE73BBC4053DFB766838D669FDE,0
1876-01-08T00:03:58Z,Article 1 -- No Title,https://query.nytimes.com/gst/abstract.html?res=980CE4DD113FE73BBC4053DFB766838D669FDE,0
1876-01-08T00:03:58Z,Article 3 -- No Title,https://query.nytimes.com/gst/abstract.html?res=9A0CE4DD113FE73BBC4053DFB766838D669FDE,0
1876-01-08T00:03:58Z,INVESTIGATION CHALLENGED!,https://query.nytimes.com/gst/abstract.html?res=9B01E3DD113FE73BBC4053DFB766838D669FDE,0
1876-01-08T00:03:58Z,OBITUARY.; MR. JAMES F. PENNIMAN. PETER GANSEVOORT. OBITUARY NOTE.,https://query.nytimes.com/gst/abstract.html?res=9D07E3DD113FE73BBC4053DFB766838D669FDE,0
1876-01-08T00:03:58Z,TEXAS DEMOCRATIC CONVENTION.,https://query.nytimes.com/gst/abstract.html?res=9A06E4DD113FE73BBC4053DFB766838D669FDE,0
1876-01-08T00:03:58Z,MARINE INTELLIGENCE.; CLEARED. ARRIVED. SAILED. NOTICE TO MARINERS. MISCELLANEOUS. FOREIGN PORTS. LATEST SHIPPING NEWS BY CABLE,https://query.nytimes.com/gst/abstract.html?res=9E04E2DD113FE73BBC4053DFB766838D669FDE,0
1876-01-08T00:03:58Z,KINGS COUNTY CHARITY COMMISSION.,https://query.nytimes.com/gst/abstract.html?res=9E05E2DD113FE73BBC4053DFB766838D669FDE,0
1876-01-08T00:03:58Z,AMUSEMENTS.; ANNOUNCEMENTS AND NOTES. HOME GOSSIP. FOREIGN AFFAIRS.,https://query.nytimes.com/gst/abstract.html?res=9A05E3DD113FE73BBC4053DFB766838D669FDE,0
1876-01-08T00:03:58Z,ARMS FOR TURKEY.,https://query.nytimes.com/gst/abstract.html?res=9E01E3DD113FE73BBC4053DFB766838D669FDE,0
1876-01-08T00:03:58Z,ALBANY.; REVIEW OF THE WEEK'S LEGISLATION-- THE NUMBER OF BILLS THUS FAR INTRODUCED--AN EPITOME OF THEIR CONTENTS.,https://query.nytimes.com/gst/abstract.html?res=9F07E4DD113FE73BBC4053DFB766838D669FDE,0
1876-01-08T00:03:58Z,AMUSEMENTS THIS EVENING.,https://query.nytimes.com/gst/abstract.html?res=9C07E3DD113FE73BBC4053DFB766838D669FDE,0
1876-01-08T00:03:58Z,LAW REPORTS.; THE FIELDS CASE. THE RIGHT OF THE STATE TO SUE FOR FRAUDS AGAINST THE CITY MAINTAINED --INTERESTING DECISION BY JUDGE WESTBROOK. CHOOSING THE PLACE OF LITIGATION. CHARLES. L. LAWRENCE AGAIN INDICTED. A MERCHANT CHARGED WITH FALSE PRETENSES. THE SEVENTH REGIMENT ARMORY. VERDICTS AGAINST THE CITY. TWEED'S FRIENDS TO THE RESCUE. ONE OF HIS BODNSMEN SUES THE CITY--HE IS INDIGNANT AT THE CONDUCT OF THE CITY AUTHORITIES IN NOT HAVING RECOVERED THE PLUNDER LONG AGO--HE ASKS FOR THE APPOINTMENT OF A RECEIVER TO PROSECUTE THE SUITS. THOMAS C. FIELDS' PROPERTY. UNITED STATES SUPREME COURT. ADMITTED TO PRACTICE--REPORT OF CASES ARGUED YESTERDAY. DECISIONS. COURT NOTES.,https://query.nytimes.com/gst/abstract.html?res=9E0DE4DD113FE73BBC4053DFB766838D669FDE,0
1876-01-08T00:03:58Z,A GENTLEMAN WHO WANTS HIS DAILY SUPPLY OF LATIN.,https://query.nytimes.com/gst/abstract.html?res=9C04E3DD113FE73BBC4053DFB766838D669FDE,0
1876-01-08T00:03:58Z,THE PENNSYLVANIA COAL TRADE.,https://query.nytimes.com/gst/abstract.html?res=9D0DE4DD113FE73BBC4053DFB766838D669FDE,0
1876-01-08T00:03:58Z,INCREASED TERMINAL FACILITIES.; SUGAR TO BE SHIPPED FROM THIS PORT BY THE ERIE ROAD INSTEAD OF BY SOUTHERN AND EASTERN PORTS.,https://query.nytimes.com/gst/abstract.html?res=9D02E4DD113FE73BBC4053DFB766838D669FDE,0
1876-01-08T00:03:58Z,PASSENGERS ARRIVED.,https://query.nytimes.com/gst/abstract.html?res=9C04E2DD113FE73BBC4053DFB766838D669FDE,0
1876-01-08T00:03:58Z,THE WHISKY FRAUDS.; MORE STARTLING DEVELOPMENTS IN CHICAGO EXPECTED. THE INTERNAL REVENUE SUPERVISOR OF PHILADELPHIA TO SUPERINTEND THE TRIALS IN CHICAGO--DISCOVERIES IN PHILADELPHIA.,https://query.nytimes.com/gst/abstract.html?res=9D06E4DD113FE73BBC4053DFB766838D669FDE,0
1876-01-08T00:03:58Z,Article 4 -- No Title,https://query.nytimes.com/gst/abstract.html?res=9B0CE4DD113FE73BBC4053DFB766838D669FDE,0
1876-01-08T00:03:58Z,TURKEY.; ATTITUDE OF FRANCE TOWARD THE SCHEME OF REFORM--TURKISH INDISPOSITION TO PERMIT MEDIATION--PROVINCIAL GOVERNORS. ITALY AND ENGLAND ON THE AUSTRIAN NOTE. ACTIVITY OF THE PROVINCES IN PROCURING ARMS. MILITARY OPERATIONS IN GOVINA.,https://query.nytimes.com/gst/abstract.html?res=9C00E4DD113FE73BBC4053DFB766838D669FDE,0
1876-01-08T00:03:58Z,A HORSE CENSUS.,https://query.nytimes.com/gst/abstract.html?res=9F06E3DD113FE73BBC4053DFB766838D669FDE,0
1876-01-08T00:03:58Z,FAILURES AND SUSPENSIONS.; THE BOSTON COMMERCIAL BULLETIN'S WEEKLY BUSINESS REPORT. BUSINESS DIFFICULTIES IN NEW-YORK. THE NEW-YORK AND HARLEM RAILROAD.,https://query.nytimes.com/gst/abstract.html?res=9405E2DD113FE73BBC4053DFB766838D669FDE,1
1876-01-08T00:03:58Z,AN ENJOYABLE DINNER.; HOW THE GREAT FRENCH SOCIETIES CELEBRATE THEIR ANNIVERSARIES--TOASTS AND SPEECHES.,https://query.nytimes.com/gst/abstract.html?res=9807E3DD113FE73BBC4053DFB766838D669FDE,0
1876-01-08T00:03:58Z,PITTSBURG'S SUBTERRANEAN FIRE.,https://query.nytimes.com/gst/abstract.html?res=9907E3DD113FE73BBC4053DFB766838D669FDE,0
