pub_date,main_headline,article_url,classification
1876-01-21T00:03:58Z,ASSEMBLY BUSINESS.,https://query.nytimes.com/gst/abstract.html?res=9401E0D81639E13BBC4951DFB766838D669FDE,0
1876-01-21T00:03:58Z,A RELIC OF THE LATE WAR.,https://query.nytimes.com/gst/abstract.html?res=9F01EED81639E13BBC4951DFB766838D669FDE,0
1876-01-21T00:03:58Z,GREAT BRITAIN.; THE LONDON TIMES ON SENATOR SHERMAN'S MONEY UNIT SCHEME--FAILURES.,https://query.nytimes.com/gst/abstract.html?res=9801EFD81639E13BBC4951DFB766838D669FDE,0
1876-01-21T00:03:58Z,"LAW REPORTS.; THE TWEED SUITS. SWEARING THE JURY IN THE $900,000 SUIT --THE ELISORS SELECTING A NEW ARRAY OF JURORS IN THE $6,000,000 SUIT. SUITS AGAINST THE CITY. AN ACTION BROUGHT FOR SALARY--TWO MANDAMUSES AGAINST THE CONTROLLER. EDWARD S. STOKES. HIS PETITION FOR A WRIT OF HABEAS CORPUS DENIED BY JUDGE BARRETT.",https://query.nytimes.com/gst/abstract.html?res=9D02E0D81639E13BBC4951DFB766838D669FDE,0
1876-01-21T00:03:58Z,HOUSE OF REPRESENTATIVES.; LETTER POSTAGE. THE CENTENNIAL APPROPRIATION.,https://query.nytimes.com/gst/abstract.html?res=9503E0D81639E13BBC4951DFB766838D669FDE,0
1876-01-21T00:03:58Z,THE MORMON WOMEN OF UTAH.; MOST OF THE SIGNATURES TO THE MAMMOTH PETITION OBTAINED BY FRAUDULENT REPRESENTATIONS--AN EXAMINATION OF THE DOCUMENT.,https://query.nytimes.com/gst/abstract.html?res=9406E0D81639E13BBC4951DFB766838D669FDE,0
1876-01-21T00:03:58Z,SUIT AGAINST THE ST. LOUIS BRIDGE.,https://query.nytimes.com/gst/abstract.html?res=9E0DE0D81639E13BBC4951DFB766838D669FDE,0
1876-01-21T00:03:58Z,COMMERCIAL AFFAIRS.,https://query.nytimes.com/gst/abstract.html?res=940DEFD81639E13BBC4951DFB766838D669FDE,0
1876-01-21T00:03:58Z,COURT NOTES.,https://query.nytimes.com/gst/abstract.html?res=9502E0D81639E13BBC4951DFB766838D669FDE,0
1876-01-21T00:03:58Z,THE STATE OF TRADE.,https://query.nytimes.com/gst/abstract.html?res=9C0CEFD81639E13BBC4951DFB766838D669FDE,0
1876-01-21T00:03:58Z,DEBATE ON THE GRAY NUNS BILL.; MR. WOODIN EXHIBITS GOV. TILDEN'S ACTION IN THIS MATTER IN A NEW LIGHT-STARBUCK'S LAMENTABLE FAILURE IN REPLYING TO MR. WOODIN BEFORE HE SPEAKS.,https://query.nytimes.com/gst/abstract.html?res=9A01E0D81639E13BBC4951DFB766838D669FDE,1
1876-01-21T00:03:58Z,"THE CENTENNIAL APPOPRIATION.; FURTHER CONSIDERATION OF THE BILL IN THE HOUSE--AN ARGUMENT IN ITS FAVOR BY MR. TOWNSEND, OF NEWYORK.",https://query.nytimes.com/gst/abstract.html?res=9A06E0D81639E13BBC4951DFB766838D669FDE,0
1876-01-21T00:03:58Z,NO DISCHARGE FOR ROBBERS.,https://query.nytimes.com/gst/abstract.html?res=9806EED81639E13BBC4951DFB766838D669FDE,0
1876-01-21T00:03:58Z,THE CUBAN QUESTION.; A BERLIN DISPATCH ON THE AMERICAN NOTE --A SEMI-OFFICIALY VIEW IN MADRID.,https://query.nytimes.com/gst/abstract.html?res=9900EFD81639E13BBC4951DFB766838D669FDE,0
1876-01-21T00:03:58Z,THE ELOQUENCE OF CHRYSOSTOM.; REV. DR. LORD'S FOURTH LECTURE AT ASSOCIATION HALL.,https://query.nytimes.com/gst/abstract.html?res=9406EED81639E13BBC4951DFB766838D669FDE,0
1876-01-21T00:03:58Z,Editorial Article 1 -- No Title,https://query.nytimes.com/gst/abstract.html?res=9804EFD81639E13BBC4951DFB766838D669FDE,0
1876-01-21T00:03:58Z,Editorial Article 7 -- No Title,https://query.nytimes.com/gst/abstract.html?res=9907EFD81639E13BBC4951DFB766838D669FDE,0
1876-01-21T00:03:58Z,AMUSEMENTS THIS EVENING.,https://query.nytimes.com/gst/abstract.html?res=9D04EFD81639E13BBC4951DFB766838D669FDE,0
1876-01-21T00:03:58Z,SWINDLING FREIGHT AGENTS.,https://query.nytimes.com/gst/abstract.html?res=9900EED81639E13BBC4951DFB766838D669FDE,0
1876-01-21T00:03:58Z,THE AUSTRIAN LEADERS OF THE INSURGENTS--AUSTRIA PREPARING TO MOVETROOPS.,https://query.nytimes.com/gst/abstract.html?res=9E00EFD81639E13BBC4951DFB766838D669FDE,0
1876-01-21T00:03:58Z,THE WHISKY TRIALS.; THE FIRST DAY'S PROCEEDINGS IN THE CASE OF WILLIAM M'KEE AT ST.LOUIS.,https://query.nytimes.com/gst/abstract.html?res=9501E0D81639E13BBC4951DFB766838D669FDE,0
1876-01-21T00:03:58Z,SCARLET FEVER IN BALTIMORE.,https://query.nytimes.com/gst/abstract.html?res=9B0CE0D81639E13BBC4951DFB766838D669FDE,0
1876-01-21T00:03:58Z,CUBA'S FINANCES.; THE BURDEN OF HEAVY TAXES. HOW MONEY IS RAISED--CAPRICIOUS METHODS OF ASSESSMENT--WHAT BECOMES OF THE REVENUE--THE LIFE-COST OFTHE WAR--LATE MILITARY OPERATIONS. COMMISSIONER RUBI. JOVELLAR'S WORK--WAR TAXES. THE RULE OF ASSESSMENT. THE MODE OF COLLECTION. THE REVENUE. THE LIFE-COST OF THE WAR. MILITARY OPERTIONS. THE WEATHER.,https://query.nytimes.com/gst/abstract.html?res=9500E0D81639E13BBC4951DFB766838D669FDE,0
1876-01-21T00:03:58Z,Editorial Article 6 -- No Title,https://query.nytimes.com/gst/abstract.html?res=9F07EFD81639E13BBC4951DFB766838D669FDE,0
1876-01-21T00:03:58Z,THE LATE DR. HOWE.,https://query.nytimes.com/gst/abstract.html?res=980CE0D81639E13BBC4951DFB766838D669FDE,0
1876-01-21T00:03:58Z,THE KINGS COUNTY SUPERVISORS.,https://query.nytimes.com/gst/abstract.html?res=9F00EED81639E13BBC4951DFB766838D669FDE,0
1876-01-21T00:03:58Z,PRESENTATION TO A BRAVE OFFICER.,https://query.nytimes.com/gst/abstract.html?res=9F03EFD81639E13BBC4951DFB766838D669FDE,0
1876-01-21T00:03:58Z,MOODY AND SANKEY CHOIR REHEARSAL.,https://query.nytimes.com/gst/abstract.html?res=9B00EED81639E13BBC4951DFB766838D669FDE,0
1876-01-21T00:03:58Z,THEY OBJECT TO A NEGRO POSTMAN.,https://query.nytimes.com/gst/abstract.html?res=9F02EFD81639E13BBC4951DFB766838D669FDE,0
1876-01-21T00:03:58Z,THE USURY LAW VIOLATED.,https://query.nytimes.com/gst/abstract.html?res=9F02E0D81639E13BBC4951DFB766838D669FDE,0
1876-01-21T00:03:58Z,THE ANTI-SLAVERY SOCIETY AND CUBA.,https://query.nytimes.com/gst/abstract.html?res=9400EFD81639E13BBC4951DFB766838D669FDE,0
1876-01-21T00:03:58Z,THE POLICE AND THE BALL.; ARRIVAL OF SENATOR BAADEN FROM ALBANY WITH A CERTIFIED COPY OF THE AMENDMENT ALLOWING PERSONS TO APPEAR IN MASKS-PERMISSION FINALLY GRANTED TO THE SOCIETY.,https://query.nytimes.com/gst/abstract.html?res=9C0DEFD81639E13BBC4951DFB766838D669FDE,0
1876-01-21T00:03:58Z,Editorial Article 5 -- No Title,https://query.nytimes.com/gst/abstract.html?res=9C07EFD81639E13BBC4951DFB766838D669FDE,0
1876-01-21T00:03:58Z,AMATEUR OARSMEN.; CONVENTION OF THE NATIONAL ASSOCIATION-AMENDMENTS TO THE RULES--THE CENTENNIAL REGATIA.,https://query.nytimes.com/gst/abstract.html?res=9F06EED81639E13BBC4951DFB766838D669FDE,0
1876-01-21T00:03:58Z,Marriage Announcement 1 -- No Title,https://query.nytimes.com/gst/abstract.html?res=9F0DEFD81639E13BBC4951DFB766838D669FDE,0
1876-01-21T00:03:58Z,MEMBERS OF CONGRESS.,https://query.nytimes.com/gst/abstract.html?res=9D06EFD81639E13BBC4951DFB766838D669FDE,0
1876-01-21T00:03:58Z,MR. BOWEN AND HIS ACCUSERS.,https://query.nytimes.com/gst/abstract.html?res=9507EED81639E13BBC4951DFB766838D669FDE,0
1876-01-21T00:03:58Z,THE GERMAN UP-TOWN SAVINGS BANK.,https://query.nytimes.com/gst/abstract.html?res=9801EED81639E13BBC4951DFB766838D669FDE,0
1876-01-21T00:03:58Z,CALIFORNIA MINING STOCKS.,https://query.nytimes.com/gst/abstract.html?res=9802EFD81639E13BBC4951DFB766838D669FDE,0
1876-01-21T00:03:58Z,MRS. MOULTON'S GOOD NAME; OPINION OF JUDGE VAN COTT. CORRESPONDENCE BETWEEN MRS. MOULTON AND HER COUNSEL--HE SAYS THAT SHE DOES NOT NEED FURTHER VINDICATION --THE POLICY OF MR. BEECHER AND HIS CHURCH. MRS. MOULTON'S LETTER. JUDGE VAN COTT'S REPLY.,https://query.nytimes.com/gst/abstract.html?res=9B00E0D81639E13BBC4951DFB766838D669FDE,0
1876-01-21T00:03:58Z,"NEW PUBLICATIONS.; REMINISCENSES OF FORTS SUMTER AND MOULTRIE IN 1860-61. By ABNER DOUBLEDAY, Brevet Major General United States Army. New-York : HARPER & BROTHERS. 1876.",https://query.nytimes.com/gst/abstract.html?res=9803E0D81639E13BBC4951DFB766838D669FDE,0
1876-01-21T00:03:58Z,THE TURKISH PROVINCES.; MONTENEGRO AND TURKISH TROOPS ON HER FRONTIER-A PROTEST.,https://query.nytimes.com/gst/abstract.html?res=9D00EFD81639E13BBC4951DFB766838D669FDE,0
1876-01-21T00:03:58Z,A VESSEL'S QUESTIONABLE SALE.,https://query.nytimes.com/gst/abstract.html?res=9B0DE0D81639E13BBC4951DFB766838D669FDE,0
1876-01-21T00:03:58Z,COURT OF APPEALS.,https://query.nytimes.com/gst/abstract.html?res=980DE0D81639E13BBC4951DFB766838D669FDE,0
1876-01-21T00:03:58Z,TERRORISM IN NEW-MEXICO.; A MOB OF POLITICAL RUFFIANS IN CIMARRON-A NEWSPAPER OFFICE DESTROYED.,https://query.nytimes.com/gst/abstract.html?res=9C01E0D81639E13BBC4951DFB766838D669FDE,0
1876-01-21T00:03:58Z,GAMBETTA'S COMPLAINT AGAINST THE GOVERNMENT.,https://query.nytimes.com/gst/abstract.html?res=9B01EFD81639E13BBC4951DFB766838D669FDE,0
1876-01-21T00:03:58Z,FOREIGN PORTS.,https://query.nytimes.com/gst/abstract.html?res=9903EED81639E13BBC4951DFB766838D669FDE,0
1876-01-21T00:03:58Z,"COURT CALANDARS--THIS DAY.; MARINE COURT-TRIAL TERM-PART I. Held by Shea, C.J. SUPREME COURT--ALBANY DISTRICT.",https://query.nytimes.com/gst/abstract.html?res=9C0CE0D81639E13BBC4951DFB766838D669FDE,0
1876-01-21T00:03:58Z,BARNUM CENTENNIAL SHOW.,https://query.nytimes.com/gst/abstract.html?res=9506EED81639E13BBC4951DFB766838D669FDE,0
1876-01-21T00:03:58Z,THE NEW APPORTIONMENT IN SENATE DISTRICTS.; GEN. BOYNTON CORRECTED.,https://query.nytimes.com/gst/abstract.html?res=9806EFD81639E13BBC4951DFB766838D669FDE,1
1876-01-21T00:03:58Z,NEW-JERSEY.,https://query.nytimes.com/gst/abstract.html?res=9D00EED81639E13BBC4951DFB766838D669FDE,0
1876-01-21T00:03:58Z,DAMAGES FOR SLANDER.,https://query.nytimes.com/gst/abstract.html?res=9402E0D81639E13BBC4951DFB766838D669FDE,0
1876-01-21T00:03:58Z,"BUSINESS TROUBLES.; STATEMENT OF THE AFFAIRS OF B.&P. LAWRENCE, STATIONERS. LIABILITIES. ASSETS. LOSSES. NOTES.",https://query.nytimes.com/gst/abstract.html?res=9D06EED81639E13BBC4951DFB766838D669FDE,0
1876-01-21T00:03:58Z,THE VINELAND TRAGEDY.; FURTHER PROCEEDING IN THE LANDIS MURDER TRIAL--SOME IMPORTANT EVIDENCE.,https://query.nytimes.com/gst/abstract.html?res=9800E0D81639E13BBC4951DFB766838D669FDE,0
1876-01-21T00:03:58Z,HILL AND YANCEY.,https://query.nytimes.com/gst/abstract.html?res=990CE0D81639E13BBC4951DFB766838D669FDE,0
1876-01-21T00:03:58Z,FORTY-FOURTH CONGRESS.; FIRST SESSION--Jan. 20. SENATE. THE FIVE PER CENT. OF RAILROAD EARNINGS. JURORS IN TRIALS FOR POLYGAMY. THE PACIFIC RAILROADS. THE MISSISSIPPI ELECTION. CONTINUATION OF MR. MORTON'S SPEECH. THE JOINT RULES.,https://query.nytimes.com/gst/abstract.html?res=9403E0D81639E13BBC4951DFB766838D669FDE,0
1876-01-21T00:03:58Z,Obituary 1 -- No Title,https://query.nytimes.com/gst/abstract.html?res=980DEFD81639E13BBC4951DFB766838D669FDE,0
1876-01-21T00:03:58Z,WASHINGTON.; CONGRESSIONAL PROCEEDINGS. BILLS OF IMPORTANCE INTRODUCED IN THE SENATE--CONTINUATION OF SENATOR MORTON'S SPEECH-MILITARY AFFAIRS IN THE HOUSE--THE PROPOSED REPEAL OF THE RESUMPTION ACT.,https://query.nytimes.com/gst/abstract.html?res=9806E0D81639E13BBC4951DFB766838D669FDE,0
1876-01-21T00:03:58Z,THE DOLAN BILL OF EXCEPTIONS.,https://query.nytimes.com/gst/abstract.html?res=9C0DE0D81639E13BBC4951DFB766838D669FDE,0
1876-01-21T00:03:58Z,Editorial Article 3 -- No Title,https://query.nytimes.com/gst/abstract.html?res=9404EFD81639E13BBC4951DFB766838D669FDE,0
1876-01-21T00:03:58Z,BREWERS AT THE CENTENNIAL.; THE AMERICAN ASSOCIATION ARRANGING FOR REPRESENTATION AT PHILADELPHIA.,https://query.nytimes.com/gst/abstract.html?res=9D00E0D81639E13BBC4951DFB766838D669FDE,0
1876-01-21T00:03:58Z,THE ALASKA SEAL FISHERIES.; DOCUMENTS SUBMITTED BY THE TREASURY DEPARTMENT ON THE SUBJECT OF AFFAIRS IN ALASKA.,https://query.nytimes.com/gst/abstract.html?res=9D01EFD81639E13BBC4951DFB766838D669FDE,0
1876-01-21T00:03:58Z,"A BOY'S REMARKABLE DEPRAVITY.; A YOUNG BAR-TENDER, AIDED BY AN ACCOMPLICE, ROBS HIS EMPLOYER AND ATTEMPTS TO POISON HIM AND BURN HIS STORE.",https://query.nytimes.com/gst/abstract.html?res=9A02E0D81639E13BBC4951DFB766838D669FDE,0
1876-01-21T00:03:58Z,A BRILLIANT EVENING ASSENBLY.; THE LADIES' ANNUAL RECEPTION--THE FLORAL DECORATIONS IN CLUB-HOUSE AND THEATRE-THE GUESTS IN ATTENDANCE.,https://query.nytimes.com/gst/abstract.html?res=9903EFD81639E13BBC4951DFB766838D669FDE,0
1876-01-21T00:03:58Z,Editorial Article 2 -- No Title,https://query.nytimes.com/gst/abstract.html?res=9904EFD81639E13BBC4951DFB766838D669FDE,0
1876-01-21T00:03:58Z,STATEN ISLAND.,https://query.nytimes.com/gst/abstract.html?res=9C00EED81639E13BBC4951DFB766838D669FDE,0
1876-01-21T00:03:58Z,A PRESENT TO THE PRODUCE EXCHANGE.,https://query.nytimes.com/gst/abstract.html?res=9C01EED81639E13BBC4951DFB766838D669FDE,0
1876-01-21T00:03:58Z,GOLSEN AND ROYD.; FURTHER ACCUSATIONS AGAINST A NEW YORK FIRM OF COMPLICITY IN THE WHISKY FRAUDS.,https://query.nytimes.com/gst/abstract.html?res=9A03E0D81639E13BBC4951DFB766838D669FDE,0
1876-01-21T00:03:58Z,LAST HOURS OF THE CONFEDERACY.; LECTURE BY GEN. GEORGE H. SHARPE AT THE HARLEM CONGREGATIONAL CHURCH.,https://query.nytimes.com/gst/abstract.html?res=9D03EFD81639E13BBC4951DFB766838D669FDE,0
1876-01-22T00:03:58Z,SHOCKING AND FATAL OUTRAGE.,https://query.nytimes.com/gst/abstract.html?res=9C04EFDD143FE23BBC4A51DFB766838D669FDE,0
1876-01-22T00:03:58Z,THE ORGAN AT CHICKERING HALL.,https://query.nytimes.com/gst/abstract.html?res=9903EFDD143FE23BBC4A51DFB766838D669FDE,0
1876-01-22T00:03:58Z,THE BURKE-GARDNER CASE.,https://query.nytimes.com/gst/abstract.html?res=9906EFDD143FE23BBC4A51DFB766838D669FDE,0
1876-01-22T00:03:58Z,THE MERCER WILL CASE.,https://query.nytimes.com/gst/abstract.html?res=9A04EFDD143FE23BBC4A51DFB766838D669FDE,0
1876-01-22T00:03:58Z,POLITICAL ITEMS.,https://query.nytimes.com/gst/abstract.html?res=9405EFDD143FE23BBC4A51DFB766838D669FDE,0
1876-01-22T00:03:58Z,CONGRESSIONAL TOPICS.; THE WILSON EULOGIES--THE CORRESPONDENCE WITH SPAIN--COURTESIES TO THE INDIANA EDITORS--MR. MORTON'S RESOLUTIONS IN THE SENATE ELECTION COMMITTEE--THE CENTENNIAL BILL.,https://query.nytimes.com/gst/abstract.html?res=9B0CE0DD143FE23BBC4A51DFB766838D669FDE,0
1876-01-22T00:03:58Z,LOCAL MISCELLANY.; ALCOHOLIC EBRIETY. INTERESTING DISCUSSION BEFORE THE NATIONAL TEMPERANCE SOCIETY.,https://query.nytimes.com/gst/abstract.html?res=9404EEDD143FE23BBC4A51DFB766838D669FDE,0
1876-01-22T00:03:58Z,FORTY-FOURTH CONGRESS.; FIRST SESSION--Jan. 21. SENATE. THE ALCOHOLIC TRAFFIC. THE LATE VICE PRESIDENT. HOUSE OF REPRESENTATIVES. THE THREE-SIXTY-FIVE DISTRICT BONDS. THE LATE HENRY WILSON.,https://query.nytimes.com/gst/abstract.html?res=9A07EFDD143FE23BBC4A51DFB766838D669FDE,0
1876-01-22T00:03:58Z,THE SPANISH QUESTION.,https://query.nytimes.com/gst/abstract.html?res=9500EFDD143FE23BBC4A51DFB766838D669FDE,0
1876-01-22T00:03:58Z,SALE OF A TROTTING HORSE.,https://query.nytimes.com/gst/abstract.html?res=9F05EFDD143FE23BBC4A51DFB766838D669FDE,0
1876-01-22T00:03:58Z,IMPORTANT TO MASTERS OF VESSELS.,https://query.nytimes.com/gst/abstract.html?res=9507EEDD143FE23BBC4A51DFB766838D669FDE,0
1876-01-22T00:03:58Z,A PARTIAL STKIKE OF THE CRISPINS.,https://query.nytimes.com/gst/abstract.html?res=9A07EEDD143FE23BBC4A51DFB766838D669FDE,0
1876-01-22T00:03:58Z,A REPLY TO GEN. KILPATRICK.,https://query.nytimes.com/gst/abstract.html?res=9E03EFDD143FE23BBC4A51DFB766838D669FDE,0
1876-01-22T00:03:58Z,Obituary 1 -- No Title,https://query.nytimes.com/gst/abstract.html?res=9C0DEFDD143FE23BBC4A51DFB766838D669FDE,0
1876-01-22T00:03:58Z,COURT NOTES.; SUPREME COURT--ALBANY DISTRICT.,https://query.nytimes.com/gst/abstract.html?res=9D01EFDD143FE23BBC4A51DFB766838D669FDE,0
1876-01-22T00:03:58Z,HIGHWAY ROBBERY.,https://query.nytimes.com/gst/abstract.html?res=9D04EFDD143FE23BBC4A51DFB766838D669FDE,0
1876-01-22T00:03:58Z,THE ROAD TO RESUMPTION.,https://query.nytimes.com/gst/abstract.html?res=9400EFDD143FE23BBC4A51DFB766838D669FDE,0
1876-01-22T00:03:58Z,LEE AS A SOLDIER.,https://query.nytimes.com/gst/abstract.html?res=9802EFDD143FE23BBC4A51DFB766838D669FDE,0
1876-01-22T00:03:58Z,DECISIONS.; SUPREME COURT--CHAMBERS. By Judge Barrett. COURT OF APPEALS.,https://query.nytimes.com/gst/abstract.html?res=9C01EFDD143FE23BBC4A51DFB766838D669FDE,0
1876-01-22T00:03:58Z,STARVING THE DIPLOMATISTS.,https://query.nytimes.com/gst/abstract.html?res=9C03EFDD143FE23BBC4A51DFB766838D669FDE,0
1876-01-22T00:03:58Z,THIRD-TERM OPPOSITION IN THE O.A.U.,https://query.nytimes.com/gst/abstract.html?res=9B02EFDD143FE23BBC4A51DFB766838D669FDE,0
1876-01-22T00:03:58Z,LATEST NEWS BY CABLE.; GREAT BRITAIN. A BANKER COMMITTED WITHOUT BAIL FOR FRAUD--THE SHERMAN PLAN FOR A UNIT OF MONEY. WEEKLY FINANCIAL AND COMMERCIAL REVIEW. THE PROPOSED RIFLE AND BOATING MATCHES IN THE UNITED STATES. MARINE DISASTERS. FRANCE. THE VATICAN. SPAIN. SPAIN AND CUBA. CUBA. NEW SOUTH WALES.,https://query.nytimes.com/gst/abstract.html?res=9B05EFDD143FE23BBC4A51DFB766838D669FDE,0
1876-01-22T00:03:58Z,HIGHWAY ROBBERY ON BROADWAY.,https://query.nytimes.com/gst/abstract.html?res=9F01EFDD143FE23BBC4A51DFB766838D669FDE,0
1876-01-22T00:03:58Z,DISPOSING OF BURGLARS.,https://query.nytimes.com/gst/abstract.html?res=9806EFDD143FE23BBC4A51DFB766838D669FDE,0
1876-01-22T00:03:58Z,"THE CUBAN QUESTION.; DIPLOMATIC CORRESPONDENCE SECRETARY FISH'S NOTE OF NOV. 5, 1875-- A SUCCINCT STATEMENT ON THE GRIEVANCES OF THE UNITED STATES--SPAIN'SNEGLECT TO REDRESS THE WRONGS OFAMERICAN CITIZENS IN CUBA--COPIESOF THE NOTE SENT TO AMERICAN MINISTERS IN EUROPE. ARBITRARY SEIZURE AND CONFISTICATION. SPECIAL CASES MENTIONED. NO ADJUSTMENT OF THE QUESTION YET REACHED. TRIAL OF AMERICAN CITIZENS BY COURT MARTIAL. THE GENERAL CONDITION OF CUBAN AFFAIRS. NO ABATEMENT OF THE HORRORS OF WAR HOW LONG CAN THIS CONDITION OF THINGS BE TOLERATED? OUR INTERESTS DEMAND THAT THE STRIFE SHALL END. THE INJURIES THE WAR CAUSES US. THE OFFER OF INTERVENTION. DELICACY OF OUR RELATIONS WITH SPAIN. POSSIBILITY OF THE SUBJECT BEING SUBMITTED TO CONGRESS. INSTRUCTIONS TO OUR FOREIGN MINISTERS. MR. CUSHING'S REPLY.",https://query.nytimes.com/gst/abstract.html?res=9504EFDD143FE23BBC4A51DFB766838D669FDE,0
1876-01-22T00:03:58Z,"WASHINGTON.; THE DEMOCRATIC PROGRAMME. A SCHEME FOR INVESTIGATING THE NAVY, NAVY-YARDS, AND BUREAUS--EAGER PURSUIT OF CORRUPTION IN THE STATE DEPARTMENT EXPENSES.",https://query.nytimes.com/gst/abstract.html?res=9A0CE0DD143FE23BBC4A51DFB766838D669FDE,0
1876-01-22T00:03:58Z,MARINE INTELLIGENCE.; CLEARED. ARRIVED. SAILED. FOREIGN PORTS. LATEST FOREIGN SHIPPING NEWS.,https://query.nytimes.com/gst/abstract.html?res=9C01EEDD143FE23BBC4A51DFB766838D669FDE,0
1876-01-22T00:03:58Z,OBSTRUCTING THE STREETS.,https://query.nytimes.com/gst/abstract.html?res=9406EFDD143FE23BBC4A51DFB766838D669FDE,0
1876-01-22T00:03:58Z,THE TENTH DISTRICT REPUBLICANS.,https://query.nytimes.com/gst/abstract.html?res=9807EEDD143FE23BBC4A51DFB766838D669FDE,0
1876-01-22T00:03:58Z,THE MONEY ORDER DIVISION.; THE IMPORTANCE AND DIFFICULT NATURE OF THE BUSINESS--THE TRANSACTIONS OF LAST YEAR COMPARED WITH THE PREVIOUS ONE.,https://query.nytimes.com/gst/abstract.html?res=9F07EEDD143FE23BBC4A51DFB766838D669FDE,0
1876-01-22T00:03:58Z,CHILDREN FATALLY BURNED.,https://query.nytimes.com/gst/abstract.html?res=9C06EFDD143FE23BBC4A51DFB766838D669FDE,0
1876-01-22T00:03:58Z,UNDERGROUND CLASSICS.,https://query.nytimes.com/gst/abstract.html?res=9D03EFDD143FE23BBC4A51DFB766838D669FDE,0
1876-01-22T00:03:58Z,THE CIVIL RIGHTS BILL.,https://query.nytimes.com/gst/abstract.html?res=9404EFDD143FE23BBC4A51DFB766838D669FDE,0
1876-01-22T00:03:58Z,FOREIGN MARKETS.,https://query.nytimes.com/gst/abstract.html?res=9F00EFDD143FE23BBC4A51DFB766838D669FDE,0
1876-01-22T00:03:58Z,AMUSEMENTS.; GENERAL MENTION.,https://query.nytimes.com/gst/abstract.html?res=9803EFDD143FE23BBC4A51DFB766838D669FDE,0
1876-01-22T00:03:58Z,GUILTY OF MAYHEM.,https://query.nytimes.com/gst/abstract.html?res=9E06EEDD143FE23BBC4A51DFB766838D669FDE,0
1876-01-22T00:03:58Z,THE CHARLESTON RACES.,https://query.nytimes.com/gst/abstract.html?res=9C05EFDD143FE23BBC4A51DFB766838D669FDE,0
1876-01-22T00:03:58Z,SNOWED IN.,https://query.nytimes.com/gst/abstract.html?res=9904EFDD143FE23BBC4A51DFB766838D669FDE,0
1876-01-22T00:03:58Z,HOME GOSSIP.,https://query.nytimes.com/gst/abstract.html?res=9A03EFDD143FE23BBC4A51DFB766838D669FDE,0
1876-01-22T00:03:58Z,THE VINELAND TRAGEDY.; CONTINUATION OF THE LANDIS MURDER TRIAL--THE EVIDENCE FOR THE DEFENSE.,https://query.nytimes.com/gst/abstract.html?res=9503EFDD143FE23BBC4A51DFB766838D669FDE,0
1876-01-22T00:03:58Z,PASSENGERS SAILED.,https://query.nytimes.com/gst/abstract.html?res=9506EEDD143FE23BBC4A51DFB766838D669FDE,0
1876-01-22T00:03:58Z,A MISSING MAN.,https://query.nytimes.com/gst/abstract.html?res=9407EEDD143FE23BBC4A51DFB766838D669FDE,0
1876-01-22T00:03:58Z,CITY AND SUBURBAN NEWS.; NEW-YORK. BROOKLYN. LONG ISLAND. WESTCHESTER COUNTY. NEW-JERSEY.,https://query.nytimes.com/gst/abstract.html?res=9D06EEDD143FE23BBC4A51DFB766838D669FDE,0
1876-01-22T00:03:58Z,JUDGMENT AGAINST A RAILROAD.,https://query.nytimes.com/gst/abstract.html?res=9F06EFDD143FE23BBC4A51DFB766838D669FDE,0
1876-01-22T00:03:58Z,THE COTTON MARKETS.,https://query.nytimes.com/gst/abstract.html?res=9B0CEFDD143FE23BBC4A51DFB766838D669FDE,0
1876-01-22T00:03:58Z,THE BROOKLYN RING FRAUDS.; ARGUMENT ON THE MOTION FOR A CHANGE OF VENUE--DECISION RESERVED.,https://query.nytimes.com/gst/abstract.html?res=9506EFDD143FE23BBC4A51DFB766838D669FDE,0
1876-01-22T00:03:58Z,ADMIRAL LEROY'S MOVEMENTS.,https://query.nytimes.com/gst/abstract.html?res=9A05EFDD143FE23BBC4A51DFB766838D669FDE,0
1876-01-22T00:03:58Z,THE OHIO REPUBLICANS.,https://query.nytimes.com/gst/abstract.html?res=9905EFDD143FE23BBC4A51DFB766838D669FDE,0
1876-01-22T00:03:58Z,THE ALABAMA CLAIMS.; YESTERDAY'S PROCEEDINGS IN THE COURT OF COMMISSIONERS.,https://query.nytimes.com/gst/abstract.html?res=9F02EFDD143FE23BBC4A51DFB766838D669FDE,0
1876-01-22T00:03:58Z,Editorial Article 4 -- No Title,https://query.nytimes.com/gst/abstract.html?res=9A00EFDD143FE23BBC4A51DFB766838D669FDE,0
1876-01-22T00:03:58Z,ARRIVALS AT THE HOTELS.,https://query.nytimes.com/gst/abstract.html?res=9A04EEDD143FE23BBC4A51DFB766838D669FDE,0
1876-01-22T00:03:58Z,"PLYMOUTH CHURCH.; MR. BEECHER DEFENDS ITS ACTION. HE MAKES A BITTER ATTACK ON MRS. MOULTON AND HER COUNSEL, JUDGE VAN COTT--HE SAYS THAT HE HAS DEALT LENIENTLY AND KINDLY WITH HER--REV. DR. PATTON CHARATERIZED AS THE EVANGELIST OF MISCHIEF. THE ADVISORY COUNCIL.",https://query.nytimes.com/gst/abstract.html?res=9C04EEDD143FE23BBC4A51DFB766838D669FDE,0
1876-01-22T00:03:58Z,LAW REPORTS.; THE LAW OF INTERPLEADER. AN INTERESTING DECISION BY JUDGE SEDGWICK IN THE CASE OF NITCHSKI AGAINST O'NEILL.,https://query.nytimes.com/gst/abstract.html?res=9D06EFDD143FE23BBC4A51DFB766838D669FDE,0
1876-01-22T00:03:58Z,THE WEEK'S FAILURES.; RECENT BUSINESS CHANGES AS REPORTED BY THE BOSTON COMMERCIAL BULLETIN. DIFFICULTIES IN NEW-YORK.,https://query.nytimes.com/gst/abstract.html?res=9F04EEDD143FE23BBC4A51DFB766838D669FDE,0
1876-01-22T00:03:58Z,A LADY HUGGED BY A BEAR.,https://query.nytimes.com/gst/abstract.html?res=9507EFDD143FE23BBC4A51DFB766838D669FDE,0
1876-01-22T00:03:58Z,PROTECTIVE FREIGHT ASSOCIATION.,https://query.nytimes.com/gst/abstract.html?res=9E05EFDD143FE23BBC4A51DFB766838D669FDE,0
1876-01-22T00:03:58Z,MR. WAREHAM GRISWOLD'S WILL.,https://query.nytimes.com/gst/abstract.html?res=9907EFDD143FE23BBC4A51DFB766838D669FDE,0
1876-01-22T00:03:58Z,ALBANY.; PROCEEDINGS IN THE LEGISLATURE.THE UNITED STATES DEPOSIT FUND--A RESOLUTION TO INVESTIGATE THE STATE PRISONS--A BILL AFFECTING THE COURTOF GENERAL SESSIONS--THE STORINGAND HANDLING OF DANGEROUS EXPLOSIVES. BUSINESS IN THE SENATE.,https://query.nytimes.com/gst/abstract.html?res=9403EFDD143FE23BBC4A51DFB766838D669FDE,0
1876-01-22T00:03:58Z,BEWARE OF POLITE STRANGERS.,https://query.nytimes.com/gst/abstract.html?res=9C07EEDD143FE23BBC4A51DFB766838D669FDE,0
1876-01-22T00:03:58Z,KENTUCKY PROGNOSTICATIONS; THE GOOSE BONE AND THE WEATHER.,https://query.nytimes.com/gst/abstract.html?res=9C07EFDD143FE23BBC4A51DFB766838D669FDE,0
1876-01-22T00:03:58Z,THE NEW-YORK YACHT CLUB.,https://query.nytimes.com/gst/abstract.html?res=9902EFDD143FE23BBC4A51DFB766838D669FDE,0
1876-01-22T00:03:58Z,TERRY O'BRIEN'S FORTUNE.,https://query.nytimes.com/gst/abstract.html?res=9F07EFDD143FE23BBC4A51DFB766838D669FDE,0
1876-01-22T00:03:58Z,Editorial Article 1 -- No Title,https://query.nytimes.com/gst/abstract.html?res=9E00EFDD143FE23BBC4A51DFB766838D669FDE,0
1876-01-22T00:03:58Z,COLUMBIA COLLEGE BOAT-HOUSE FUND.,https://query.nytimes.com/gst/abstract.html?res=9A06EEDD143FE23BBC4A51DFB766838D669FDE,0
1876-01-22T00:03:58Z,Editorial Article 3 -- No Title,https://query.nytimes.com/gst/abstract.html?res=9900EFDD143FE23BBC4A51DFB766838D669FDE,0
1876-01-22T00:03:58Z,A CALIFORNIA CRIMINAL.,https://query.nytimes.com/gst/abstract.html?res=9D05EFDD143FE23BBC4A51DFB766838D669FDE,0
1876-01-22T00:03:58Z,THE COMMISSIONER OF PUBLIC WORKS,https://query.nytimes.com/gst/abstract.html?res=9904EEDD143FE23BBC4A51DFB766838D669FDE,0
1876-01-22T00:03:58Z,LADIES' UNION AID SOCIETY.,https://query.nytimes.com/gst/abstract.html?res=9804EEDD143FE23BBC4A51DFB766838D669FDE,0
1876-01-22T00:03:58Z,"THE WHISKY CONSPIRATORS; ST. LOUIS AND INDIANAPOLIS CASES. OPENING OF THE M'KEE PROSECUTION-- STATEMENT OF WHAT IS TO BE PROVED BY DISTRICT ATTORNEY DYER--THE BROWNLEE CASE, IN INDIANA, CONCLUDED.",https://query.nytimes.com/gst/abstract.html?res=9E04EFDD143FE23BBC4A51DFB766838D669FDE,0
1876-01-22T00:03:58Z,JOHN MORRISSEY ON THE CHARTER.,https://query.nytimes.com/gst/abstract.html?res=9807EFDD143FE23BBC4A51DFB766838D669FDE,0
1876-01-22T00:03:58Z,A STRANGE WOUND.; A BLUNT WOODEN SPLINTER DRIVEN INTO A MAN'S NECK--HE DIES FROM THE EFFECTS.,https://query.nytimes.com/gst/abstract.html?res=9B07EFDD143FE23BBC4A51DFB766838D669FDE,0
1876-01-22T00:03:58Z,HATS AND BONNETS.,https://query.nytimes.com/gst/abstract.html?res=9407EFDD143FE23BBC4A51DFB766838D669FDE,0
1876-01-22T00:03:58Z,NOTES FROM THE CAPITAL.; THE FINENESS AND WEIGHT OF COINS-- NAVY AND ARMY NOTES--FRAUDULENT POST OFFICE STAMPS.,https://query.nytimes.com/gst/abstract.html?res=940CE0DD143FE23BBC4A51DFB766838D669FDE,0
1876-01-22T00:03:58Z,Editorial Article 2 -- No Title,https://query.nytimes.com/gst/abstract.html?res=9800EFDD143FE23BBC4A51DFB766838D669FDE,0
1876-01-22T00:03:58Z,THE PRESERVATION OF FISH.,https://query.nytimes.com/gst/abstract.html?res=9B04EFDD143FE23BBC4A51DFB766838D669FDE,0
