pub_date,main_headline,article_url,classification
1876-01-01T00:03:58Z,A HEAVY ROBBERY.,https://query.nytimes.com/gst/abstract.html?res=9906E6DD163EEF3BBC4953DFB766838D669FDE,0
1876-01-01T00:03:58Z,DECISIONS.; SUPREME COURT--CHAMBERS.,https://query.nytimes.com/gst/abstract.html?res=9C0CEFDE163EEF3BBC4953DFB766838D669FDE,0
1876-01-01T00:03:58Z,WASHINGTON.; THE UNITED STATES AND SPAIN. EFFORTS OF OUR GOVERNMENT TO RESTORE. PEACE TO CUBA--HOW THE RESULT MAY BE REACHED--A DECISIVE MILITARY CAMPAIGN BY SPAIN PROBABLE--WHAT MAY FOLLOW ITS FAILURE.,https://query.nytimes.com/gst/abstract.html?res=9C03E1DE163EEF3BBC4953DFB766838D669FDE,0
1876-01-01T00:03:58Z,ARRIVED.,https://query.nytimes.com/gst/abstract.html?res=9904E3DD163EEF3BBC4953DFB766838D669FDE,0
1876-01-01T00:03:58Z,A STEAMER ON JAMES LEDGE.,https://query.nytimes.com/gst/abstract.html?res=9F0DE1DE163EEF3BBC4953DFB766838D669FDE,0
1876-01-01T00:03:58Z,THE TEXAS LAND COMPANY.; AN INJUNCTION ASKED TO PREVENT A LAND PURCHASE--DECISION RESERVED.,https://query.nytimes.com/gst/abstract.html?res=9502EFDE163EEF3BBC4953DFB766838D669FDE,0
1876-01-01T00:03:58Z,AMUSEMENTS THIS EVENING.,https://query.nytimes.com/gst/abstract.html?res=9E0DEEDE163EEF3BBC4953DFB766838D669FDE,0
1876-01-01T00:03:58Z,THE CITY CHARITIES.; LARGE REDUCTION IN THE APPROPRIATION FOR THE DEPARTMENT OF CHARITIES AND CORRECTION--THE SCHOOL-SHIP MERCURY GIVEN UP.,https://query.nytimes.com/gst/abstract.html?res=9B01E4DD163EEF3BBC4953DFB766838D669FDE,0
1876-01-01T00:03:58Z,THE BUSINESS OUTLOOK FOR 1876.,https://query.nytimes.com/gst/abstract.html?res=9B0CEEDE163EEF3BBC4953DFB766838D669FDE,0
1876-01-01T00:03:58Z,ACTION OF PLYMOUTH CHURCH.; MRS. MOULTON'S REQUEST DENIED--THE BRETHREN REFUSE TO HOLD THE COUNCIL OUTSIDE OF PLYMOUTH.,https://query.nytimes.com/gst/abstract.html?res=950DE6DD163EEF3BBC4953DFB766838D669FDE,0
1876-01-01T00:03:58Z,Editorial Article 2 -- No Title,https://query.nytimes.com/gst/abstract.html?res=9F02E7DD163EEF3BBC4953DFB766838D669FDE,0
1876-01-01T00:03:58Z,THE CHICAGO MAYORALTY.,https://query.nytimes.com/gst/abstract.html?res=950DE1DE163EEF3BBC4953DFB766838D669FDE,0
1876-01-01T00:03:58Z,DEPARTMENT OF CHARITIES AND CORRECTION.,https://query.nytimes.com/gst/abstract.html?res=9C07EEDE163EEF3BBC4953DFB766838D669FDE,0
1876-01-01T00:03:58Z,GRACE CHURCH BELLS.; THE THRONGS THAT LISTENED TO THEIR CHIMES LAST NIGHT--SCENES IN AND AROUND THE EDIFICE.,https://query.nytimes.com/gst/abstract.html?res=940DE7DD163EEF3BBC4953DFB766838D669FDE,0
1876-01-01T00:03:58Z,"POLICE BOARD CHANGES.; REMOVAL OF COMMISSIONERS MATSELL AND DISBECKER.MESSRS. DEWITT C. WHEELER AND JOEL B.ERHARDT APPOINTED IN THE PLACES--THE FIRST MEETING OF THEIR NEWBOARD. As was predicted in the columns of THE TIMES on Tuesday last, Mayor Wickham yesterday removed Police Commissioners Matsell and Disbecker and appointed in their places Messrs. Dewitt C. Wheeler and Joel B. Erhardt. Messrs. Matsell and Disbecker were officially notified of their removal at 6:30 P. M., and an hour later a meeting of the new board was held. Mr. Wheeler acted as President pro tem. Subsequently the board was regularly organized by the election of Gen. Smith as permanent President. After this action an adjournment was had. THE OFFICIAL CORRESPONDENCE.",https://query.nytimes.com/gst/abstract.html?res=9803E0DE163EEF3BBC4953DFB766838D669FDE,0
1876-01-01T00:03:58Z,OFFICIAL RESPONSIBILITY.,https://query.nytimes.com/gst/abstract.html?res=9801EFDE163EEF3BBC4953DFB766838D669FDE,0
1876-01-01T00:03:58Z,CRIME IN TENNESSEE.; PARTICULARS OF A DEADLY AFFRAY ON THE MISSISSIPPI RIVER--THE SUPPOSED MURDERER KILLED BY THE VICTIM'S NEPHEW.,https://query.nytimes.com/gst/abstract.html?res=9B07E0DE163EEF3BBC4953DFB766838D669FDE,0
1876-01-01T00:03:58Z,Editorial Article 4 -- No Title,https://query.nytimes.com/gst/abstract.html?res=9D0DE7DD163EEF3BBC4953DFB766838D669FDE,0
1876-01-01T00:03:58Z,"THE SUPPRESSION OF VICE.; THE GOOD A SOCIETY HAS ACCOMPLISHED DURING THE PAST YEAR--A DANGEROUS OCCUPATION FOR ITS AGENT. On March 3, 1873, an act passed by Congress for the suppression of the exhibition or circulation of improper articles was approved by the President, On May 16 of the same year the Legislature of this State passed an act incorporating the Society for the Supression of Vice, and on the 14th of the following June another act was passed increasing andextending the powers of the society, which was...",https://query.nytimes.com/gst/abstract.html?res=9E07EFDE163EEF3BBC4953DFB766838D669FDE,0
1876-01-01T00:03:58Z,TROUBLES OF A NEWLY-WEDDED PAIR,https://query.nytimes.com/gst/abstract.html?res=9A04EFDE163EEF3BBC4953DFB766838D669FDE,0
1876-01-01T00:03:58Z,HEAVY AWARD OF DAMAGES.; THE CLAIM OF A NEW-YORK FIRM AGAINST THE MEXICAN GOVERNMENT--DECISION IN FAVOR OF THE CLAIMANTS BY THE BRITISH MINISTER--BRIEF HISTORY OF THE CASE.,https://query.nytimes.com/gst/abstract.html?res=9F07E0DE163EEF3BBC4953DFB766838D669FDE,0
1876-01-01T00:03:58Z,THE LEE MURDERERS AND THE LYNCHERS.,https://query.nytimes.com/gst/abstract.html?res=9D01E6DD163EEF3BBC4953DFB766838D669FDE,0
1876-01-01T00:03:58Z,GAS EXPLOSION IN BOSTON.,https://query.nytimes.com/gst/abstract.html?res=9F03E0DE163EEF3BBC4953DFB766838D669FDE,0
1876-01-01T00:03:58Z,DIVIDENDS IN HARTFORD.,https://query.nytimes.com/gst/abstract.html?res=9F00E7DD163EEF3BBC4953DFB766838D669FDE,0
1876-01-01T00:03:58Z,THE BROOKLYN GAS TROUBLES.,https://query.nytimes.com/gst/abstract.html?res=9C07E6DD163EEF3BBC4953DFB766838D669FDE,0
1876-01-01T00:03:58Z,THE MISSING TWEED.,https://query.nytimes.com/gst/abstract.html?res=9D03E7DD163EEF3BBC4953DFB766838D669FDE,0
1876-01-01T00:03:58Z,"THE WHISKY CONSPIRACY.; ANOTHER SEIZURE IN CHICAGO AND ARREST OF A. C. HESING, JACOB REHM, H.B. MILLER, AND J. MINTY IMPLICATED IN WHISKY FRAUDS.",https://query.nytimes.com/gst/abstract.html?res=9A00E0DE163EEF3BBC4953DFB766838D669FDE,0
1876-01-01T00:03:58Z,GERMANY; ARREST AND IMPRISONMENT OF THE BISHOP OF GNESEN AND POSEN--SALE OF DIPLOMAS PRETENDING TO BE AMERICAN.,https://query.nytimes.com/gst/abstract.html?res=9805E0DE163EEF3BBC4953DFB766838D669FDE,0
1876-01-01T00:03:58Z,AN INSANE ATTACK.; A PROMINENT CITIZEN SHOT IN THE WESTMINSTER HOTEL--PROBABLY A FATAL WOUND.,https://query.nytimes.com/gst/abstract.html?res=9F04E6DD163EEF3BBC4953DFB766838D669FDE,0
1876-01-01T00:03:58Z,ATTEMPTED BURGLARY.,https://query.nytimes.com/gst/abstract.html?res=9A07E4DD163EEF3BBC4953DFB766838D669FDE,0
1876-01-01T00:03:58Z,THE CURRENCY.; STATEMENT OF THE AMOUNT OUTSTANDING UP TO DATE.,https://query.nytimes.com/gst/abstract.html?res=9502E1DE163EEF3BBC4953DFB766838D669FDE,0
1876-01-01T00:03:58Z,THE SMALL BOY OF ST. ALBANS.,https://query.nytimes.com/gst/abstract.html?res=9D04E7DD163EEF3BBC4953DFB766838D669FDE,0
1876-01-01T00:03:58Z,DEMOCRATIC INTENTIONS.; HOW THEY WILL TREAT THE FINANCIAL QUESTION--SPEECH OF AN INDIANA CONGRESSMAN.,https://query.nytimes.com/gst/abstract.html?res=9D01E7DD163EEF3BBC4953DFB766838D669FDE,0
1876-01-01T00:03:58Z,PROHIBITING SUNDAY AMUSEMENTS; THE DECISION OF THE COURT OF COMMON PLEAS ON THE SUNDAY LAW--THE OPINIONS BY JUDGES LOEW AND J.F. DALY.,https://query.nytimes.com/gst/abstract.html?res=9A00EFDE163EEF3BBC4953DFB766838D669FDE,0
1876-01-01T00:03:58Z,GOODS FOR THE NEW YEAR.; E.D. BASSFORD. ALBERT SMITH. F.A.O. SCHWARZ. EVERDELL. CRANDALL & CO PRATT & CO. C.T. HOOPER.,https://query.nytimes.com/gst/abstract.html?res=9805EFDE163EEF3BBC4953DFB766838D669FDE,0
1876-01-01T00:03:58Z,RESIGNATION OF A PASTOR.,https://query.nytimes.com/gst/abstract.html?res=9507E6DD163EEF3BBC4953DFB766838D669FDE,0
1876-01-01T00:03:58Z,FATHER BOEHM'S FUNERAL.; INTERESTING SERVICES--ADDRESS OF BISHOP JANES.,https://query.nytimes.com/gst/abstract.html?res=9F00E4DD163EEF3BBC4953DFB766838D669FDE,0
1876-01-01T00:03:58Z,COST OF THE CUBAN WAR.,https://query.nytimes.com/gst/abstract.html?res=9E04EFDE163EEF3BBC4953DFB766838D669FDE,0
1876-01-01T00:03:58Z,WESTCHESTER COUNTY.,https://query.nytimes.com/gst/abstract.html?res=9402E4DD163EEF3BBC4953DFB766838D669FDE,0
1876-01-01T00:03:58Z,COURTS OF GENERAL SESSIONS.,https://query.nytimes.com/gst/abstract.html?res=9E03EFDE163EEF3BBC4953DFB766838D669FDE,0
1876-01-01T00:03:58Z,THE NEW YEAR IN OTHER PLACES.; RINGING OF BELLS AND FIRING OF A SALUTE IN THE NATIONAL CAPITAL. BRILLIANT DISPLAY AND GREAT ENTHUSIASM IN POUGHKEEPSIE. AT CLEVELAND. CENTENNIAL REJOICINGS IN NEWARK. ELSEWHERE.,https://query.nytimes.com/gst/abstract.html?res=940CE7DD163EEF3BBC4953DFB766838D669FDE,0
1876-01-01T00:03:58Z,THE CENTENNIAL YEAR.; WELCOMING THE ADVENT OF 1876. THE STREETS THRONGED WITH REJOICING CROWDS--SCENES AROUND OLD TRINITY --RINGING THE CHIMES--OTHER DEMONSTRATIONS.,https://query.nytimes.com/gst/abstract.html?res=990DE7DD163EEF3BBC4953DFB766838D669FDE,0
1876-01-01T00:03:58Z,THE NEW-YORK COUNTY DEMOCRACY.,https://query.nytimes.com/gst/abstract.html?res=9E07E4DD163EEF3BBC4953DFB766838D669FDE,0
1876-01-01T00:03:58Z,SIAM AND THE CENTENNIAL.,https://query.nytimes.com/gst/abstract.html?res=9405E7DD163EEF3BBC4953DFB766838D669FDE,0
1876-01-01T00:03:58Z,SCHEDULES FILED IN THE COURT OF COMMON PLEAS.,https://query.nytimes.com/gst/abstract.html?res=9D01EEDE163EEF3BBC4953DFB766838D669FDE,0
1876-01-01T00:03:58Z,Editorial Article 3 -- No Title,https://query.nytimes.com/gst/abstract.html?res=9A02E7DD163EEF3BBC4953DFB766838D669FDE,0
1876-01-01T00:03:58Z,A WONDERFUL WORKSHOP.; THE NEW-YORK POST OFFICE. THE AMERICAN AND ENGLISH POSTAL SYSTEMS COMPARED--THE MODE OF CITY DELIVERY IN NEW-YORK--MAILS BY RAPID TRANSIT--REMARKABLE PERFECTION OF THE MONEY-ORDER SYSTEM. PLANS FOR IMPROVING THE SYSTEM. THE MONEY ORDER DIVISION. DOMESTIC. INTERNATIONAL. THE CASHIER'S REPORT. MAILING AND DISTRIBUTION.,https://query.nytimes.com/gst/abstract.html?res=950DE0DE163EEF3BBC4953DFB766838D669FDE,0
1876-01-01T00:03:58Z,THE FIRE-WORK TRADE.,https://query.nytimes.com/gst/abstract.html?res=9E0CE4DD163EEF3BBC4953DFB766838D669FDE,0
1876-01-01T00:03:58Z,WATCH-NIGHT AT BRENTANO'S.,https://query.nytimes.com/gst/abstract.html?res=9B01E6DD163EEF3BBC4953DFB766838D669FDE,0
1876-01-01T00:03:58Z,CITY AND SUBURBAN NEWS.; NEW-YORK.,https://query.nytimes.com/gst/abstract.html?res=9A03E4DD163EEF3BBC4953DFB766838D669FDE,0
1876-01-01T00:03:58Z,DIVIDENDS IN BOSTON.,https://query.nytimes.com/gst/abstract.html?res=9900E7DD163EEF3BBC4953DFB766838D669FDE,0
1876-01-01T00:03:58Z,TURKEY.; PROJECTED DIRECT RAILWAY FROM CONSTANTINOPLE TO VIENNA.,https://query.nytimes.com/gst/abstract.html?res=9D04E0DE163EEF3BBC4953DFB766838D669FDE,0
1876-01-01T00:03:58Z,PRISONERS SENTENCED IN NEW-JERSEY.,https://query.nytimes.com/gst/abstract.html?res=990CE4DD163EEF3BBC4953DFB766838D669FDE,0
1876-01-01T00:03:58Z,"THE VACANCIES IN THE TREASURY.; APPOINTMENT OF SUCCESSORS TO BRODHEAD, RUTHERFORD, AND CURTIS--GOV.CARPENTER, OF IOWA, TO BE SECONDCONTROLLER.",https://query.nytimes.com/gst/abstract.html?res=9503E1DE163EEF3BBC4953DFB766838D669FDE,0
1876-01-01T00:03:58Z,NEW BRUNSWICK SHIPPING.,https://query.nytimes.com/gst/abstract.html?res=9F00E0DE163EEF3BBC4953DFB766838D669FDE,0
1876-01-01T00:03:58Z,ARRIVALS AT THE HOTELS.,https://query.nytimes.com/gst/abstract.html?res=9E03E4DD163EEF3BBC4953DFB766838D669FDE,0
1876-01-01T00:03:58Z,"LOCAL MISCELLANY.; A MYSTERIOUS ROBBERY. BENEDICT'S JEWELRY STORE ENTERED BY THIEVES--GOODS WORTH $3,000 CARRIED OFF.",https://query.nytimes.com/gst/abstract.html?res=9505E4DD163EEF3BBC4953DFB766838D669FDE,0
1876-01-01T00:03:58Z,SPENCER OF ALABAMA.; DENIAL OF THE CHARGES IN THE REPORT OF THE ALABAMA LEGISLATIVE COMMITTEE.,https://query.nytimes.com/gst/abstract.html?res=9904E6DD163EEF3BBC4953DFB766838D669FDE,0
1876-01-01T00:03:58Z,"THE FIRE DEPARTMENT.; THE LOSS LARGELY EXCEEDS THAT OF THE PREVIOUS YEAR--THE CAUSES AND ORIGIN OF THE FIRES. The Fire Department is the only public of fice in the City which refused to give information to THE TIMES reporter assigned to collect and tabulate the statistics for the year. A person named Jessup, who is in temporary charge of the office of Secretary, positively declined yesterday to give theslightest information concerning the number offires which had occurred during the year, or the losses which were sustained on account thereof.",https://query.nytimes.com/gst/abstract.html?res=9807EEDE163EEF3BBC4953DFB766838D669FDE,0
1876-01-01T00:03:58Z,FOREIGN AFFAIRS.,https://query.nytimes.com/gst/abstract.html?res=9E06E7DD163EEF3BBC4953DFB766838D669FDE,0
1876-01-01T00:03:58Z,NEW STEPS IN THE TWEED CASES.; THE ISSUES NARROWING DOWN BEFORE TRIAL--PAPERS AND VOUCHERS ASKED FOR.,https://query.nytimes.com/gst/abstract.html?res=9403EFDE163EEF3BBC4953DFB766838D669FDE,0
1876-01-01T00:03:58Z,MASKED BALLS.,https://query.nytimes.com/gst/abstract.html?res=9C06E4DD163EEF3BBC4953DFB766838D669FDE,0
1876-01-01T00:03:58Z,MORE THAN 30 YEARS AGO,https://query.nytimes.com/gst/abstract.html?res=9D05E3DD163EEF3BBC4953DFB766838D669FDE,0
1876-01-01T00:03:58Z,SPAIN.; JOVELLAR TO PUT AN END TO ABUSES IN CUBA.,https://query.nytimes.com/gst/abstract.html?res=9F05E0DE163EEF3BBC4953DFB766838D669FDE,0
1876-01-01T00:03:58Z,PIUTE ANTIPATHY TO TWINS.,https://query.nytimes.com/gst/abstract.html?res=9A0CE6DD163EEF3BBC4953DFB766838D669FDE,0
1876-01-01T00:03:58Z,M. THIER AND THE CHAMBER--MARSHALL CANROBERT.,https://query.nytimes.com/gst/abstract.html?res=950CE1DE163EEF3BBC4953DFB766838D669FDE,0
1876-01-01T00:03:58Z,THE NEW BOARD OF ALDERMEN.; SCENE EXPECTED IN THE CITY HALL ON MONDAY.,https://query.nytimes.com/gst/abstract.html?res=9B04E4DD163EEF3BBC4953DFB766838D669FDE,0
1876-01-01T00:03:58Z,THE INDIANA MYSTERY.,https://query.nytimes.com/gst/abstract.html?res=9802E0DE163EEF3BBC4953DFB766838D669FDE,0
1876-01-01T00:03:58Z,REDUCING EXPENSES.,https://query.nytimes.com/gst/abstract.html?res=9400E4DD163EEF3BBC4953DFB766838D669FDE,0
1876-01-01T00:03:58Z,"FRANCE.; FINAL ADJOURNMENT OF THE ASSEMBLY TILL MARCH 8, WHEN THE NEW CHAMBERS MEET--SPEECH OF THE PRESIDENT OF THE ASSEMBLY.",https://query.nytimes.com/gst/abstract.html?res=990CE1DE163EEF3BBC4953DFB766838D669FDE,0
1876-01-01T00:03:58Z,MR. JEWETT'S STEWARDSHIP.; STATEMENTS OF THE ACCOUNTS OF THE ERIE RAILWAY FOR THE LAST THREE MONTHS--THE REFEREE RECOMMENDS THAT THEY BE CONFIRMED.,https://query.nytimes.com/gst/abstract.html?res=9906E4DD163EEF3BBC4953DFB766838D669FDE,0
1876-01-01T00:03:58Z,MARINE DISASTERS.; THE BRITISH STEAMER DANTE SUNK AND TWENTY-THREE LIVES LOST--OTHER WRECKS.,https://query.nytimes.com/gst/abstract.html?res=9404E0DE163EEF3BBC4953DFB766838D669FDE,0
1876-01-01T00:03:58Z,THE BUILDING DEPARTMENT.; STATISTICS FOR THE YEAT--NEW BUILDINGS IN EACH OF THE WARDS.,https://query.nytimes.com/gst/abstract.html?res=9B05EEDE163EEF3BBC4953DFB766838D669FDE,0
1876-01-01T00:03:58Z,AN EXTINCT CORPORATION.; RECEIVER'S REPORT OF THE INTERNATIONAL INSURANCE COMPANY--REFERRED TO A REFEREE BY JUDGE LAWRENCE.,https://query.nytimes.com/gst/abstract.html?res=9F02EFDE163EEF3BBC4953DFB766838D669FDE,0
1876-01-01T00:03:58Z,THE MINSTER MURDER.,https://query.nytimes.com/gst/abstract.html?res=9B07E6DD163EEF3BBC4953DFB766838D669FDE,0
1876-01-01T00:03:58Z,AN ACCEPTABLE PRESENT.,https://query.nytimes.com/gst/abstract.html?res=9E00E6DD163EEF3BBC4953DFB766838D669FDE,0
1876-01-01T00:03:58Z,BUSINESS FAILURES.; SUSPENSION OF NUMEROUS NEW-ENGLAND FIRMS REPORTED FROM BOSTON.,https://query.nytimes.com/gst/abstract.html?res=9D01E0DE163EEF3BBC4953DFB766838D669FDE,0
1876-01-01T00:03:58Z,"LATEST NEWS BY CABLE.; THE BREMERHAVEN CRIME. DETECTIVES ENDEAVORING TO TRACE THOMASSEN'S MOVEMENTS WITH A VIEW TO DISCOVERING ACCOMPLICES--THE GERMAN PRESS COMMENTS ON AMERICANS. LONDON, Dec.31.--The London Times lias the following: "" A detective from Bremen has arrived in Liverpool to investigate tho operations of Thomassen, alias Thomas, with the view to discovering whether the man had anyaccomplices. It has been ascertained that Thomassen had made several trips betweenLiverpool and New-York, and he onceattempted to obtain heavy insurances on goods which he wished to ship.",https://query.nytimes.com/gst/abstract.html?res=9C0CE1DE163EEF3BBC4953DFB766838D669FDE,0
1876-01-01T00:03:58Z,Editorial Article 1 -- No Title,https://query.nytimes.com/gst/abstract.html?res=9403E7DD163EEF3BBC4953DFB766838D669FDE,0
1876-01-01T00:03:58Z,"LAST YEAR'S RECORD.; MORTALITY AND OTHER STATISTICS. THE BIRTHS, DEATHS, AND MARRIAGES FOR THE PAST YEAR--THE PREVALENCE OF SMALL-POX AND DIPHTHERIA--WORK OF THE SANITARY BUREAU--NEW BUILDINGS ERECTED--THE POLICE AND OTHERDEPARTMENTS. BIRTHS AND MARRIAGES. THE SANITARY BUREAU.",https://query.nytimes.com/gst/abstract.html?res=950CEFDE163EEF3BBC4953DFB766838D669FDE,0
1876-01-01T00:03:58Z,LATEST SHIPPING NEWS BY CABLE.,https://query.nytimes.com/gst/abstract.html?res=9807E3DD163EEF3BBC4953DFB766838D669FDE,0
1876-01-01T00:03:58Z,BUSINESS IN THE UNITED STATES COURTS.,https://query.nytimes.com/gst/abstract.html?res=9506EEDE163EEF3BBC4953DFB766838D669FDE,0
1876-01-01T00:03:58Z,UNSAFE BUILDINGS.,https://query.nytimes.com/gst/abstract.html?res=9803E7DD163EEF3BBC4953DFB766838D669FDE,0
1876-01-01T00:03:58Z,THE POISONED CAKE.,https://query.nytimes.com/gst/abstract.html?res=9507EFDE163EEF3BBC4953DFB766838D669FDE,0
1876-01-01T00:03:58Z,DOES CRIME INCREASE?,https://query.nytimes.com/gst/abstract.html?res=9E05E7DD163EEF3BBC4953DFB766838D669FDE,0
1876-01-01T00:03:58Z,THE REPORTED DISASTER NEAR FIRE ISLAND.,https://query.nytimes.com/gst/abstract.html?res=9401E0DE163EEF3BBC4953DFB766838D669FDE,0
1876-01-01T00:03:58Z,THE MUTUAL COUNCIL.; MEETING OF PLYMOUTH'S COMMITTEE.THE LETTER MISSIVE DISCUSSED--THE COMPOSITION OF THE COUNCIL--STATEMENTS OF JUDGE VAN COTT.,https://query.nytimes.com/gst/abstract.html?res=9E0DE6DD163EEF3BBC4953DFB766838D669FDE,0
1876-01-01T00:03:58Z,CALIFORNIA MINING STOCKS.,https://query.nytimes.com/gst/abstract.html?res=9806E0DE163EEF3BBC4953DFB766838D669FDE,0
1876-01-01T00:03:58Z,SHOULD CHURCH PROPERTY BE TAXED?,https://query.nytimes.com/gst/abstract.html?res=9506E7DD163EEF3BBC4953DFB766838D669FDE,0
1876-01-01T00:03:58Z,PASSENGERS SAILED.,https://query.nytimes.com/gst/abstract.html?res=9905E3DD163EEF3BBC4953DFB766838D669FDE,0
1876-01-01T00:03:58Z,ASSIGNMENTS OF JUDGES IN THE SUPERIOR COURT.,https://query.nytimes.com/gst/abstract.html?res=980CEFDE163EEF3BBC4953DFB766838D669FDE,0
1876-01-01T00:03:58Z,A QUESTION ANSWERED.,https://query.nytimes.com/gst/abstract.html?res=9F06EFDE163EEF3BBC4953DFB766838D669FDE,0
1876-01-01T00:03:58Z,Marriage Announcement 1 -- No Title,https://query.nytimes.com/gst/abstract.html?res=9803E6DD163EEF3BBC4953DFB766838D669FDE,0
1876-01-01T00:03:58Z,A COLD SEEMS A SMALL AFFAIR.,https://query.nytimes.com/gst/abstract.html?res=9500E6DD163EEF3BBC4953DFB766838D669FDE,0
1876-01-01T00:03:58Z,A CALL ON THE DOCTOR.,https://query.nytimes.com/gst/abstract.html?res=940CE4DD163EEF3BBC4953DFB766838D669FDE,0
1876-01-01T00:03:58Z,THE WORK OF THE SUPERIOR COURT.,https://query.nytimes.com/gst/abstract.html?res=9F06EEDE163EEF3BBC4953DFB766838D669FDE,0
1876-01-01T00:03:58Z,THE BOARD OF EXCISE.,https://query.nytimes.com/gst/abstract.html?res=9407EEDE163EEF3BBC4953DFB766838D669FDE,0
1876-01-01T00:03:58Z,THE TIMES BY THE FAST MAIL TRAINS.,https://query.nytimes.com/gst/abstract.html?res=980CEEDE163EEF3BBC4953DFB766838D669FDE,0
1876-01-01T00:03:58Z,AMUSEMENTS.; THE VON BULOW CONCERTS.,https://query.nytimes.com/gst/abstract.html?res=9B04E7DD163EEF3BBC4953DFB766838D669FDE,0
1876-01-01T00:03:58Z,BY MAIL AND TELEGRAPH.; It is officially announced that the Dominion Parliament will be called together to dispatch business on the 19th of February.,https://query.nytimes.com/gst/abstract.html?res=9B05E6DD163EEF3BBC4953DFB766838D669FDE,0
1876-01-01T00:03:58Z,A TRAMP KILLED IN VERMONT.,https://query.nytimes.com/gst/abstract.html?res=9506E6DD163EEF3BBC4953DFB766838D669FDE,0
1876-01-01T00:03:58Z,THE TAX UPON RAILROAD EARNINGS.; THE TREASURY DEPARTMENT PREPARING TO EXAMINE ALL COMPANIES' BOOKS--A DEMAND TO BE MADE FOR THE PAYMENT OF BACK TAXES.,https://query.nytimes.com/gst/abstract.html?res=9803E1DE163EEF3BBC4953DFB766838D669FDE,0
1876-01-01T00:03:58Z,Obituary 1 -- No Title,https://query.nytimes.com/gst/abstract.html?res=9403E6DD163EEF3BBC4953DFB766838D669FDE,0
1876-01-01T00:03:58Z,SALE OF OLD NAVAL VESSELS.,https://query.nytimes.com/gst/abstract.html?res=9E06E0DE163EEF3BBC4953DFB766838D669FDE,0
1876-01-01T00:03:58Z,BROOKLYN.,https://query.nytimes.com/gst/abstract.html?res=9E02E4DD163EEF3BBC4953DFB766838D669FDE,0
1876-01-01T00:03:58Z,COURT NOTES.,https://query.nytimes.com/gst/abstract.html?res=980DEFDE163EEF3BBC4953DFB766838D669FDE,0
1876-01-01T00:03:58Z,THE ATTACK ON QUEBEC.,https://query.nytimes.com/gst/abstract.html?res=9B0DE0DE163EEF3BBC4953DFB766838D669FDE,0
1876-01-01T00:03:58Z,THE REPUBLICAN GAINS.,https://query.nytimes.com/gst/abstract.html?res=9501E7DD163EEF3BBC4953DFB766838D669FDE,0
1876-01-01T00:03:58Z,DEPARTMENT OF PUBLIC WORKS.,https://query.nytimes.com/gst/abstract.html?res=9904EEDE163EEF3BBC4953DFB766838D669FDE,0
1876-01-01T00:03:58Z,SUICIDE IN THE ST. CHARLES HOTEL.,https://query.nytimes.com/gst/abstract.html?res=9406EFDE163EEF3BBC4953DFB766838D669FDE,0
1876-01-01T00:03:58Z,MOODY AND SANKEY.,https://query.nytimes.com/gst/abstract.html?res=980DE1DE163EEF3BBC4953DFB766838D669FDE,0
1876-01-01T00:03:58Z,"ALBANY.; GOSSIP FROM THE STATE CAPITAL. THE SPEAKERSHIP AND PRESIDENCY ""PROTEM""--THE CANAL INVESTIGATION COMMISSION --OTHER DEPARTMENTS OF THE STATE TO BE LOOKED AFTER.",https://query.nytimes.com/gst/abstract.html?res=9406E0DE163EEF3BBC4953DFB766838D669FDE,0
1876-01-01T00:03:58Z,GREAT BRITAIN.; THE NEW ADMIRALTY CIRCULAR STILL UNSATISFACTORY.,https://query.nytimes.com/gst/abstract.html?res=9904E0DE163EEF3BBC4953DFB766838D669FDE,0
1876-01-01T00:03:58Z,REJOICING IN PHILADELPHIA.; CELEBRATING THE ADVENT OF THE NEW YEAR AT INDEPENDENCE HALL--THE STREETS CROWDED WITH ENTHUSIASTIC CITIZENS--AN ELOQUENT MIDNIGHT ADDRESS--HISTORICAL REMINISCENCESCONCERNING THE OLD STATE-HOUSE.,https://query.nytimes.com/gst/abstract.html?res=980CE7DD163EEF3BBC4953DFB766838D669FDE,0
1876-01-01T00:03:58Z,FOREIGN PORTS.,https://query.nytimes.com/gst/abstract.html?res=9C07E3DD163EEF3BBC4953DFB766838D669FDE,0
1876-01-01T00:03:58Z,MANDAMUS AGAINST THE CITY.; COMPELLING THE AUTHORITIES TO ENTER INTO A GRADING AND REGULATING CONTRACT.,https://query.nytimes.com/gst/abstract.html?res=9D00EFDE163EEF3BBC4953DFB766838D669FDE,0
1876-01-01T00:03:58Z,NEW-JERSEY.,https://query.nytimes.com/gst/abstract.html?res=9F0DE4DD163EEF3BBC4953DFB766838D669FDE,0
1876-01-01T00:03:58Z,NOTES FROM THE CAPITAL.; UNEXPECTED ACQUITTAL OF THE INDICTED BONDSMAN--CHANGES IN THE UNITED STATES TREASURER'S OFFICE--NAVAL ORDERS.,https://query.nytimes.com/gst/abstract.html?res=9902E1DE163EEF3BBC4953DFB766838D669FDE,0
1876-01-01T00:03:58Z,THE RECORD OF ROBBERIES.,https://query.nytimes.com/gst/abstract.html?res=9D01E4DD163EEF3BBC4953DFB766838D669FDE,0
1876-01-01T00:03:58Z,THE POLICE DEPARTMENT.,https://query.nytimes.com/gst/abstract.html?res=9C04EEDE163EEF3BBC4953DFB766838D669FDE,0
1876-01-01T00:03:58Z,FATAL SHOOTING AFFRAY.,https://query.nytimes.com/gst/abstract.html?res=9503E0DE163EEF3BBC4953DFB766838D669FDE,0
1876-01-01T00:03:58Z,MARINE INTELLIGENCE.; CLEARED.,https://query.nytimes.com/gst/abstract.html?res=9D04E3DD163EEF3BBC4953DFB766838D669FDE,0
1876-01-01T00:03:58Z,PRESENTATION TO MR. LESTER WALLACK.,https://query.nytimes.com/gst/abstract.html?res=9C07E7DD163EEF3BBC4953DFB766838D669FDE,0
1876-01-01T00:03:58Z,ARIZONA AND SONORA.,https://query.nytimes.com/gst/abstract.html?res=9D0DE0DE163EEF3BBC4953DFB766838D669FDE,0
1876-01-02T00:03:58Z,AMUSEMENTS.; THE VON BULOW CONCERTS.,https://query.nytimes.com/gst/abstract.html?res=9D00EEDD143FE63BBC4A53DFB766838D669FDE,0
1876-01-02T00:03:58Z,NEW YEAR'S BRAWLS.,https://query.nytimes.com/gst/abstract.html?res=9807E7DC143FE63BBC4A53DFB766838D669FDE,0
1876-01-02T00:03:58Z,CITY AND SUBURBAN NEWS.; NEW-YORK.,https://query.nytimes.com/gst/abstract.html?res=9507E7DC143FE63BBC4A53DFB766838D669FDE,0
1876-01-02T00:03:58Z,THE BOSTON LANCERS' CHILDREN'S PARTY.,https://query.nytimes.com/gst/abstract.html?res=9C0DEEDD143FE63BBC4A53DFB766838D669FDE,0
1876-01-02T00:03:58Z,THE BOY CHARLEY ROSS.,https://query.nytimes.com/gst/abstract.html?res=9F0DEFDD143FE63BBC4A53DFB766838D669FDE,0
1876-01-02T00:03:58Z,THE STRANGE HORSE OF LOCH SUAINABHAL.,https://query.nytimes.com/gst/abstract.html?res=9A07EEDD143FE63BBC4A53DFB766838D669FDE,0
1876-01-02T00:03:58Z,A WAIL OVER OXFORD.,https://query.nytimes.com/gst/abstract.html?res=9906EEDD143FE63BBC4A53DFB766838D669FDE,0
1876-01-02T00:03:58Z,SHOT FROM A CHUTE.,https://query.nytimes.com/gst/abstract.html?res=9F04EEDD143FE63BBC4A53DFB766838D669FDE,0
1876-01-02T00:03:58Z,HEAVY STORM IN THE WEST.,https://query.nytimes.com/gst/abstract.html?res=9A0DEFDD143FE63BBC4A53DFB766838D669FDE,0
1876-01-02T00:03:58Z,LABOUR TROUBLES IN LYNN.,https://query.nytimes.com/gst/abstract.html?res=9A02EEDD143FE63BBC4A53DFB766838D669FDE,0
1876-01-02T00:03:58Z,RECKLESS USE OF FIREARMS.,https://query.nytimes.com/gst/abstract.html?res=9F07E7DC143FE63BBC4A53DFB766838D669FDE,0
1876-01-02T00:03:58Z,A CHAPLAIN TO BE PROUD OF.,https://query.nytimes.com/gst/abstract.html?res=9E03EEDD143FE63BBC4A53DFB766838D669FDE,0
1876-01-02T00:03:58Z,MR. MOODY.; HIS OPPOSITION TO DEBT-BEARING CHURCHES,https://query.nytimes.com/gst/abstract.html?res=9D07E7DC143FE63BBC4A53DFB766838D669FDE,0
1876-01-02T00:03:58Z,FRENCH FINANCES DURING THE REGEN,https://query.nytimes.com/gst/abstract.html?res=9D07EEDD143FE63BBC4A53DFB766838D669FDE,0
1876-01-02T00:03:58Z,GOV. HENDRICKS.; ABSTRACT OF AN ADDRESS DELIVERED AT INDIANAPOLIS YESTERDAY FREE SCHOOLS THE FOUNDATION OF AMERICAN STABILITY.,https://query.nytimes.com/gst/abstract.html?res=9E0CEFDD143FE63BBC4A53DFB766838D669FDE,0
1876-01-02T00:03:58Z,MADAME SONTAG.,https://query.nytimes.com/gst/abstract.html?res=9907EEDD143FE63BBC4A53DFB766838D669FDE,0
1876-01-02T00:03:58Z,NEW PUBLICATIONS.,https://query.nytimes.com/gst/abstract.html?res=9D0DEEDD143FE63BBC4A53DFB766838D669FDE,0
