pub_date,main_headline,article_url,classification
1884-01-09T00:00:00Z,Article 1 -- No Title,https://query.nytimes.com/gst/abstract.html?res=9F03EEDA113EEF33A2575AC0A9679C94659FD7CF,0
1884-01-09T00:00:00Z,FUTURE OF AMERICAN DRAMA.; JUDGE BARRETT ADDRESSING THE NINETEENTH CENTURY CLUB.,https://query.nytimes.com/gst/abstract.html?res=9903EEDA113EEF33A2575AC0A9679C94659FD7CF,0
1884-01-09T00:00:00Z,THE ST. LOUIS CHIEF OF POLICE.,https://query.nytimes.com/gst/abstract.html?res=9B0CEFDA113EEF33A2575AC0A9679C94659FD7CF,0
1884-01-09T00:00:00Z,A STOCKHOLDERS' STORMY MEETING.,https://query.nytimes.com/gst/abstract.html?res=9C00EEDA113EEF33A2575AC0A9679C94659FD7CF,0
1884-01-09T00:00:00Z,SNOW VANISHING INTO RAIN.,https://query.nytimes.com/gst/abstract.html?res=9806EEDA113EEF33A2575AC0A9679C94659FD7CF,0
1884-01-09T00:00:00Z,A HOTEL'S DEMENTED GUEST.,https://query.nytimes.com/gst/abstract.html?res=9A01EEDA113EEF33A2575AC0A9679C94659FD7CF,0
1884-01-09T00:00:00Z,AN UNSUCCESSFUL COMPLAINT.,https://query.nytimes.com/gst/abstract.html?res=9802EEDA113EEF33A2575AC0A9679C94659FD7CF,0
1884-01-10T00:00:00Z,A CRICKET TEAM TO VISIT ENGLAND.,https://query.nytimes.com/gst/abstract.html?res=9B0CE5D91538E033A25753C1A9679C94659FD7CF,0
1884-01-10T00:00:00Z,HOW THE NEW TARIFF WORKS.,https://query.nytimes.com/gst/abstract.html?res=9D02E6D91538E033A25753C1A9679C94659FD7CF,0
1884-01-10T00:00:00Z,LOST IN THE SNOW.,https://query.nytimes.com/gst/abstract.html?res=9A00E5D91538E033A25753C1A9679C94659FD7CF,0
1884-01-10T00:00:00Z,Obituary 1 -- No Title,https://query.nytimes.com/gst/abstract.html?res=9407E4D91538E033A25753C1A9679C94659FD7CF,0
1884-01-10T00:00:00Z,""" BRITISH INTERESTS"" IN THE SOUDAN.",https://query.nytimes.com/gst/abstract.html?res=9E02E5D91538E033A25753C1A9679C94659FD7CF,0
1884-01-10T00:00:00Z,THE POOL-PLAYERS.,https://query.nytimes.com/gst/abstract.html?res=990CE5D91538E033A25753C1A9679C94659FD7CF,0
1884-01-10T00:00:00Z,SECURITIES SOLD AT AUCTION,https://query.nytimes.com/gst/abstract.html?res=9906E5D91538E033A25753C1A9679C94659FD7CF,0
1884-01-10T00:00:00Z,AN EVANGELIST WHO SWEARS.,https://query.nytimes.com/gst/abstract.html?res=9500E4D91538E033A25753C1A9679C94659FD7CF,0
1884-01-10T00:00:00Z,THE DRAMATIC FESTIVAL.,https://query.nytimes.com/gst/abstract.html?res=9C0DE6D91538E033A25753C1A9679C94659FD7CF,0
1884-01-10T00:00:00Z,EVENTS IN IRELAND.; MR. DALY'S RESIGNATION--BOYCOTTING IN COUNTY MAYO.,https://query.nytimes.com/gst/abstract.html?res=9D04E5D91538E033A25753C1A9679C94659FD7CF,0
1884-01-10T00:00:00Z,THE ELMIRA MYSTERY.,https://query.nytimes.com/gst/abstract.html?res=9C05E4D91538E033A25753C1A9679C94659FD7CF,0
1884-01-10T00:00:00Z,FROM NIGHT SCHOOL TO COURT.,https://query.nytimes.com/gst/abstract.html?res=9F01E5D91538E033A25753C1A9679C94659FD7CF,0
1884-01-10T00:00:00Z,""" THE BEGGAR STUDENT.""; MR. M'CAULL SEEKS TO PREVENT ITS PRODUCTION BY THE FORDS.",https://query.nytimes.com/gst/abstract.html?res=950DE6D91538E033A25753C1A9679C94659FD7CF,0
1884-01-10T00:00:00Z,"AMUSEMENTS FOR LONDON POOR.; London is notoriously the hardest city in Europe for a poor man to amuse himself in, and there is no doubt that a great deal of the prevailing discontent among the lower classes arises from the fact that they are utterly without any ...",https://query.nytimes.com/gst/abstract.html?res=9904E5D91538E033A25753C1A9679C94659FD7CF,0
1884-01-10T00:00:00Z,IN AND ABOUT THE CITY; TALKING OF COMMERCIAL NEEDS. THE BOARD OF TRADE ON THE CANAL AND THE REVIVAL OF AMERICAN SHIPPING.,https://query.nytimes.com/gst/abstract.html?res=9D06E5D91538E033A25753C1A9679C94659FD7CF,0
1884-01-10T00:00:00Z,THE PRIZES AT THE EISTEDDFOD.,https://query.nytimes.com/gst/abstract.html?res=9F03E4D91538E033A25753C1A9679C94659FD7CF,0
1884-01-10T00:00:00Z,COPYRIGHTS FOR FOREIGN BOOKS.; A STEP TOWARD THE SETTLEMENT OF THE QUESTION OF AUTHORS' RIGHTS.,https://query.nytimes.com/gst/abstract.html?res=9F04E4D91538E033A25753C1A9679C94659FD7CF,0
1884-01-10T00:00:00Z,NEW SECURITIES LISTED.,https://query.nytimes.com/gst/abstract.html?res=9404E5D91538E033A25753C1A9679C94659FD7CF,0
1884-01-10T00:00:00Z,NEW-YORK AND NEW-HAVEN.; ANNUAL MEETING AND ELECTION YESTERDAY--MR. GOODWIN'S OLD FIGHT.,https://query.nytimes.com/gst/abstract.html?res=9C07E5D91538E033A25753C1A9679C94659FD7CF,0
1884-01-10T00:00:00Z,SUED FOR ASSAULTING A WOMAN.,https://query.nytimes.com/gst/abstract.html?res=9E0CE5D91538E033A25753C1A9679C94659FD7CF,0
1884-01-10T00:00:00Z,Article 3 -- No Title,https://query.nytimes.com/gst/abstract.html?res=9A02E5D91538E033A25753C1A9679C94659FD7CF,0
1884-01-10T00:00:00Z,THE ATALANTA AT CHARLESTON.,https://query.nytimes.com/gst/abstract.html?res=9C07E4D91538E033A25753C1A9679C94659FD7CF,0
1884-01-10T00:00:00Z,CHICAGO LIVE STOCK PRICES.,https://query.nytimes.com/gst/abstract.html?res=9907E5D91538E033A25753C1A9679C94659FD7CF,0
1884-01-10T00:00:00Z,DECLARED TO BE A DEFAULTER.,https://query.nytimes.com/gst/abstract.html?res=9E02E4D91538E033A25753C1A9679C94659FD7CF,0
1884-01-10T00:00:00Z,CONFESSION OF A MURDERER.,https://query.nytimes.com/gst/abstract.html?res=9E0DE6D91538E033A25753C1A9679C94659FD7CF,0
1884-01-10T00:00:00Z,THE FIGHTING IN TONQUIN; REPORTS OF CONFLICTS AROUND SONTAY. VARIOUS SKIRMISHES IN WHICH THE FRENCH WERE VICTORIOUS--DISSENSIONS WHICH CAUSED THE SURRENDER OF SONTAY.,https://query.nytimes.com/gst/abstract.html?res=9505E5D91538E033A25753C1A9679C94659FD7CF,0
1884-01-10T00:00:00Z,THE OLD GUARD BALL TO-NIGHT.,https://query.nytimes.com/gst/abstract.html?res=9C03E4D91538E033A25753C1A9679C94659FD7CF,0
1884-01-10T00:00:00Z,SUSPICIOUS DEATH OF A WOMAN.,https://query.nytimes.com/gst/abstract.html?res=9E0CE6D91538E033A25753C1A9679C94659FD7CF,0
1884-01-10T00:00:00Z,ANOTHER VICTIM OF THE WEATHER.,https://query.nytimes.com/gst/abstract.html?res=9404E4D91538E033A25753C1A9679C94659FD7CF,0
1884-01-10T00:00:00Z,CLAIMING FIRST RIGHT TO A NAME.,https://query.nytimes.com/gst/abstract.html?res=9801E5D91538E033A25753C1A9679C94659FD7CF,0
1884-01-10T00:00:00Z,ECONOMY IN THE DOCK BOARD.,https://query.nytimes.com/gst/abstract.html?res=9803E4D91538E033A25753C1A9679C94659FD7CF,0
1884-01-10T00:00:00Z,"MME. GERSTER IN ""L'ELISIR.""",https://query.nytimes.com/gst/abstract.html?res=9402E5D91538E033A25753C1A9679C94659FD7CF,0
1884-01-10T00:00:00Z,THE LOSS OF THE SOUDAN.; GEN. GORDON THINKS THE NEW POLICY UNWISE--NUBAR PASHA IN OFFICE.,https://query.nytimes.com/gst/abstract.html?res=9405E5D91538E033A25753C1A9679C94659FD7CF,0
1884-01-10T00:00:00Z,THE ANNUAL DARTMOUTH DINNER.,https://query.nytimes.com/gst/abstract.html?res=9A05E4D91538E033A25753C1A9679C94659FD7CF,0
1884-01-10T00:00:00Z,WORK OF THE COMMITTEES.,https://query.nytimes.com/gst/abstract.html?res=980DE5D91538E033A25753C1A9679C94659FD7CF,0
1884-01-10T00:00:00Z,Front Page 4 -- No Title,https://query.nytimes.com/gst/abstract.html?res=9C05E5D91538E033A25753C1A9679C94659FD7CF,0
1884-01-10T00:00:00Z,MONEY FOR THE MISSISSIPPI.; REFUSING TO TAKE THE SUBJECT FROM THE RIVER AND HARBOR COMMITTEE.,https://query.nytimes.com/gst/abstract.html?res=9802E6D91538E033A25753C1A9679C94659FD7CF,0
1884-01-10T00:00:00Z,IOWA'S AGRICULTURAL SOCIETY.,https://query.nytimes.com/gst/abstract.html?res=950DE5D91538E033A25753C1A9679C94659FD7CF,0
1884-01-10T00:00:00Z,NEW CANADIAN SENATORS.,https://query.nytimes.com/gst/abstract.html?res=9401E5D91538E033A25753C1A9679C94659FD7CF,0
1884-01-10T00:00:00Z,THE ROMAN CATHOLIC CLERGY.,https://query.nytimes.com/gst/abstract.html?res=9805E4D91538E033A25753C1A9679C94659FD7CF,0
1884-01-10T00:00:00Z,FRANK JAMES REPORTED DYING.,https://query.nytimes.com/gst/abstract.html?res=9F07E4D91538E033A25753C1A9679C94659FD7CF,0
1884-01-10T00:00:00Z,PROPERTY OF MR. JEROME TO BE SOLD.,https://query.nytimes.com/gst/abstract.html?res=9E01E5D91538E033A25753C1A9679C94659FD7CF,0
1884-01-10T00:00:00Z,CURRENT FOREIGN TOPICS.,https://query.nytimes.com/gst/abstract.html?res=9C04E5D91538E033A25753C1A9679C94659FD7CF,0
1884-01-10T00:00:00Z,DEATH OF A QUEER CHARACTER.,https://query.nytimes.com/gst/abstract.html?res=9A0CE5D91538E033A25753C1A9679C94659FD7CF,0
1884-01-10T00:00:00Z,TWO WEDDINGS IN THE CITY.,https://query.nytimes.com/gst/abstract.html?res=9F00E4D91538E033A25753C1A9679C94659FD7CF,0
1884-01-10T00:00:00Z,"THE HOSPITAL COLLECTIONS.; CONTRIBUTIONS WHICH SWELL THE TOTAL TO $22,532 85.",https://query.nytimes.com/gst/abstract.html?res=9806E5D91538E033A25753C1A9679C94659FD7CF,1
1884-01-10T00:00:00Z,NORTHERN PACIFIC PRESIDENCY.,https://query.nytimes.com/gst/abstract.html?res=9A04E5D91538E033A25753C1A9679C94659FD7CF,0
1884-01-10T00:00:00Z,AN EIGHT-OARED CHALLENGE.; THE BOAT CLUB OF THE PENNSYLVANIA UNIVERSITY READY TO ROW.,https://query.nytimes.com/gst/abstract.html?res=9D05E4D91538E033A25753C1A9679C94659FD7CF,0
1884-01-10T00:00:00Z,THE STATE BAR ASSOCIATION.,https://query.nytimes.com/gst/abstract.html?res=9B05E4D91538E033A25753C1A9679C94659FD7CF,0
1884-01-10T00:00:00Z,HARVARD COLLEGE.; THE PRESIDENT ON FINANCES AND IN REFERENCE TO ATHLETIC CONTESTS.,https://query.nytimes.com/gst/abstract.html?res=9C02E4D91538E033A25753C1A9679C94659FD7CF,0
1884-01-10T00:00:00Z,DRINKING ON THE INCREASE IN BELGIUM.,https://query.nytimes.com/gst/abstract.html?res=9807E5D91538E033A25753C1A9679C94659FD7CF,0
1884-01-10T00:00:00Z,A FASHIONABLE MARRIAGE.; MISS MAMIE SAUNDERS MARRIED TO RUSSELL B. HARRISON.,https://query.nytimes.com/gst/abstract.html?res=9B0DE6D91538E033A25753C1A9679C94659FD7CF,0
1884-01-10T00:00:00Z,NOT YET ORGANIZED.; THE DEMOCRATIC ALDERMEN STILL QUARRELING ABOUT OFFICES.,https://query.nytimes.com/gst/abstract.html?res=9E06E5D91538E033A25753C1A9679C94659FD7CF,0
1884-01-10T00:00:00Z,THE NEW-JERSEY LEGISLATURE.,https://query.nytimes.com/gst/abstract.html?res=9A04E4D91538E033A25753C1A9679C94659FD7CF,0
1884-01-10T00:00:00Z,THE WORK OF THE PUBLIC SCHOOLS.,https://query.nytimes.com/gst/abstract.html?res=9F06E5D91538E033A25753C1A9679C94659FD7CF,0
1884-01-10T00:00:00Z,TEACHERS MATCHING STORIES.,https://query.nytimes.com/gst/abstract.html?res=9E00E4D91538E033A25753C1A9679C94659FD7CF,0
1884-01-10T00:00:00Z,CONGRATULATING MR. PAYNE.,https://query.nytimes.com/gst/abstract.html?res=9A03E4D91538E033A25753C1A9679C94659FD7CF,0
1884-01-10T00:00:00Z,INFECTIOUS DISEASES AMONG CATTLE.,https://query.nytimes.com/gst/abstract.html?res=9E03E4D91538E033A25753C1A9679C94659FD7CF,0
1884-01-10T00:00:00Z,MR. RIDDLE'S REAPPEARANCE.,https://query.nytimes.com/gst/abstract.html?res=9C0DE5D91538E033A25753C1A9679C94659FD7CF,0
1884-01-10T00:00:00Z,WAS IT A VALID MARRIAGE?; SARAH D. MATHEWSON'S RIGHT TO DOWER IN CERTAIN REAL ESTATE.,https://query.nytimes.com/gst/abstract.html?res=940CE6D91538E033A25753C1A9679C94659FD7CF,0
1884-01-10T00:00:00Z,TALKING ABOUT THE RULES; SENATORS DISPUTING ABOUT THE APPROPRIATION BILLS. THE DISTRICT APPROPRIATION PROPOSITION DEFEATED--SHARP TALK ABOUT THE WORK OF COMMITTEES.,https://query.nytimes.com/gst/abstract.html?res=9503E6D91538E033A25753C1A9679C94659FD7CF,0
1884-01-10T00:00:00Z,IT WAS AN IRISH PACK.; HOW BROTHER SHINBONES SMITH HELD A ROYAL POKER HAND.,https://query.nytimes.com/gst/abstract.html?res=9400E4D91538E033A25753C1A9679C94659FD7CF,0
1884-01-10T00:00:00Z,CHARGED WITH EMBEZZLEMENT.,https://query.nytimes.com/gst/abstract.html?res=9B01E5D91538E033A25753C1A9679C94659FD7CF,0
1884-01-10T00:00:00Z,THE CITY NOT LIABLE.,https://query.nytimes.com/gst/abstract.html?res=9B06E5D91538E033A25753C1A9679C94659FD7CF,0
1884-01-10T00:00:00Z,"BEATEN BY HEAVY SURF; DESTRUCTION BY THE STORM ALONG THE COAST, THE WAVES AND WIND CAUSING DAMAGE AT CONEY ISLAND, LONG BRANCH, AND ATLANTIC CITY ESTIMATED AT OVER$300,000.",https://query.nytimes.com/gst/abstract.html?res=9905E5D91538E033A25753C1A9679C94659FD7CF,1
1884-01-10T00:00:00Z,Editorial Article 6 -- No Title,https://query.nytimes.com/gst/abstract.html?res=9403E5D91538E033A25753C1A9679C94659FD7CF,0
1884-01-10T00:00:00Z,A CYCLONE IN NEW-ENGLAND.; MUCH DAMAGE IN VERMONT AND ALONG THE COAST.,https://query.nytimes.com/gst/abstract.html?res=9F05E5D91538E033A25753C1A9679C94659FD7CF,1
1884-01-10T00:00:00Z,HEAVY RAIN IN THE CITY.,https://query.nytimes.com/gst/abstract.html?res=9A05E5D91538E033A25753C1A9679C94659FD7CF,0
1884-01-10T00:00:00Z,Editorial Article 3 -- No Title,https://query.nytimes.com/gst/abstract.html?res=9903E5D91538E033A25753C1A9679C94659FD7CF,0
1884-01-10T00:00:00Z,HEAVY SNOW AND WIND.; A FALL UNEQUALED IN MANY YEARS-- TRAINS EVERYWHERE DELAYED.,https://query.nytimes.com/gst/abstract.html?res=9805E5D91538E033A25753C1A9679C94659FD7CF,0
1884-01-10T00:00:00Z,NOMINATED FOR CONGRESS.,https://query.nytimes.com/gst/abstract.html?res=9D07E4D91538E033A25753C1A9679C94659FD7CF,0
1884-01-10T00:00:00Z,NOTES OF VARIOUS INTERESTS.,https://query.nytimes.com/gst/abstract.html?res=9F07E5D91538E033A25753C1A9679C94659FD7CF,0
1884-01-10T00:00:00Z,TO ATTEND DR. LASKER'S FUNERAL.,https://query.nytimes.com/gst/abstract.html?res=9504E4D91538E033A25753C1A9679C94659FD7CF,0
1884-01-10T00:00:00Z,Editorial Article 2 -- No Title,https://query.nytimes.com/gst/abstract.html?res=9803E5D91538E033A25753C1A9679C94659FD7CF,0
1884-01-10T00:00:00Z,Front Page 3 -- No Title,https://query.nytimes.com/gst/abstract.html?res=990CE6D91538E033A25753C1A9679C94659FD7CF,0
1884-01-10T00:00:00Z,BUSINESS EMBARRASSMENTS.,https://query.nytimes.com/gst/abstract.html?res=9904E4D91538E033A25753C1A9679C94659FD7CF,0
1884-01-10T00:00:00Z,CLAIMING HER DOWER RIGHT.,https://query.nytimes.com/gst/abstract.html?res=9900E5D91538E033A25753C1A9679C94659FD7CF,0
1884-01-10T00:00:00Z,PERSONAL INTELLIGENCE.,https://query.nytimes.com/gst/abstract.html?res=980CE5D91538E033A25753C1A9679C94659FD7CF,0
1884-01-10T00:00:00Z,A YOUTH'S MANIA FOR CRIME.,https://query.nytimes.com/gst/abstract.html?res=9B02E6D91538E033A25753C1A9679C94659FD7CF,0
1884-01-10T00:00:00Z,SUICIDE OF J.W. DENT.,https://query.nytimes.com/gst/abstract.html?res=9E07E4D91538E033A25753C1A9679C94659FD7CF,0
1884-01-10T00:00:00Z,"WILL OF JULIUS HALLGARTEN.; BEQUESTS TO RELATIVES, FRIENDS, AND MANY CHARITABLE INSTITUTIONS.",https://query.nytimes.com/gst/abstract.html?res=9A06E5D91538E033A25753C1A9679C94659FD7CF,1
1884-01-10T00:00:00Z,THE BURDENS OF SHIPPING; ONE OF MR. DINGLEY'S BILLS FAVORABLY REPORTED. FIRST WORK OF THE NEW SHIPPING COMMITTEE--WHY SOME OF THE PRESENT EXACTIONS SHOULD BE ABOLISHED.,https://query.nytimes.com/gst/abstract.html?res=9A07E5D91538E033A25753C1A9679C94659FD7CF,0
1884-01-10T00:00:00Z,""" OUR HOUSE OF LORDS.""",https://query.nytimes.com/gst/abstract.html?res=9C04E4D91538E033A25753C1A9679C94659FD7CF,0
1884-01-10T00:00:00Z,THREE DEATHS FROM DIPHTHERIA.,https://query.nytimes.com/gst/abstract.html?res=9E04E4D91538E033A25753C1A9679C94659FD7CF,0
1884-01-10T00:00:00Z,THE LACKAWANNA'S POSITION.,https://query.nytimes.com/gst/abstract.html?res=9E07E5D91538E033A25753C1A9679C94659FD7CF,0
1884-01-10T00:00:00Z,SAVED BY A LIVELY PHOTOGRAPHER.,https://query.nytimes.com/gst/abstract.html?res=9A00E4D91538E033A25753C1A9679C94659FD7CF,0
1884-01-10T00:00:00Z,HOW DR. FULTON AIDED GEN. CONWAY.,https://query.nytimes.com/gst/abstract.html?res=9D01E5D91538E033A25753C1A9679C94659FD7CF,0
1884-01-10T00:00:00Z,NOTES FROM WASHINGTON.,https://query.nytimes.com/gst/abstract.html?res=9407E5D91538E033A25753C1A9679C94659FD7CF,0
1884-01-10T00:00:00Z,THE COURT OF APPEALS.,https://query.nytimes.com/gst/abstract.html?res=9905E4D91538E033A25753C1A9679C94659FD7CF,0
1884-01-10T00:00:00Z,SPEAKER CARLISLE'S PROMINENCE; HIS FRIENDS UNDECIDED WHETHER TO MAKE HIM A SENATOR OR PRESIDENT.,https://query.nytimes.com/gst/abstract.html?res=9D0DE5D91538E033A25753C1A9679C94659FD7CF,0
1884-01-10T00:00:00Z,EIGHT PERSONS BURNED TO DEATH.,https://query.nytimes.com/gst/abstract.html?res=9D0CE6D91538E033A25753C1A9679C94659FD7CF,0
1884-01-10T00:00:00Z,PROPOSING RETALIATORY LAWS.,https://query.nytimes.com/gst/abstract.html?res=9902E6D91538E033A25753C1A9679C94659FD7CF,0
1884-01-10T00:00:00Z,PROBABLE END OF THE CARPET STRIKE.,https://query.nytimes.com/gst/abstract.html?res=9C0CE5D91538E033A25753C1A9679C94659FD7CF,0
1884-01-10T00:00:00Z,AMUSEMENTS.; OPERA AT THE METROPOLITAN.,https://query.nytimes.com/gst/abstract.html?res=9502E5D91538E033A25753C1A9679C94659FD7CF,0
1884-01-10T00:00:00Z,ARMY AND NAVY NOTES.,https://query.nytimes.com/gst/abstract.html?res=9F04E5D91538E033A25753C1A9679C94659FD7CF,0
1884-01-10T00:00:00Z,THE JOHNSON ESTATE.; A TRUSTEE APPOINTED IN PLACE OF THE LATE A.B. JOHNSON.,https://query.nytimes.com/gst/abstract.html?res=9E05E4D91538E033A25753C1A9679C94659FD7CF,0
1884-01-10T00:00:00Z,MARINE INTELLIGENCE.; CLEARED. ARRIVED. SAILED. SPOKEN. BY CABLE.,https://query.nytimes.com/gst/abstract.html?res=9A02E4D91538E033A25753C1A9679C94659FD7CF,0
1884-01-10T00:00:00Z,CITY AND SUBURBAN NEWS; NEW-YORK. BROOKLYN. STATEN ISLAND. NEW-JERSEY.,https://query.nytimes.com/gst/abstract.html?res=9B03E4D91538E033A25753C1A9679C94659FD7CF,0
1884-01-10T00:00:00Z,AMUSEMENTS THIS EVENING.,https://query.nytimes.com/gst/abstract.html?res=9D03E5D91538E033A25753C1A9679C94659FD7CF,0
1884-01-10T00:00:00Z,GHASTLY ORGIE ON STATEN ISLAND.,https://query.nytimes.com/gst/abstract.html?res=9F0CE6D91538E033A25753C1A9679C94659FD7CF,0
1884-01-10T00:00:00Z,AN OLD MAN BURNED TO DEATH.,https://query.nytimes.com/gst/abstract.html?res=9D02E4D91538E033A25753C1A9679C94659FD7CF,0
1884-01-10T00:00:00Z,MANAGING THE RAILWAYS; THE PAYING OF COMMISSIONS TO MIDDLEMEN. THE ATTITUDE OF THE TRUNK LINES AS TO THE CUTS ON PASSENGER BUSINESS FROM MISSOURI POINTS.,https://query.nytimes.com/gst/abstract.html?res=9B04E5D91538E033A25753C1A9679C94659FD7CF,0
1884-01-10T00:00:00Z,THE SPRAGUE SUITS.,https://query.nytimes.com/gst/abstract.html?res=940CE5D91538E033A25753C1A9679C94659FD7CF,0
1884-01-10T00:00:00Z,GARFIELD NATIONAL BANK OFFICERS.,https://query.nytimes.com/gst/abstract.html?res=980CE6D91538E033A25753C1A9679C94659FD7CF,0
1884-01-10T00:00:00Z,GOV. WALLER'S VIEWS.; HIS ANNUAL MESSAGE TO THE CONNECTICUT GENERAL ASSEMBLY.,https://query.nytimes.com/gst/abstract.html?res=9901E5D91538E033A25753C1A9679C94659FD7CF,1
1884-01-10T00:00:00Z,CIVIL SERVICE REFORM.; WHAT JUDGE THOMAN SAYS ON THE SUBJECT.,https://query.nytimes.com/gst/abstract.html?res=9F0DE5D91538E033A25753C1A9679C94659FD7CF,0
1884-01-10T00:00:00Z,A DINNER TO GOV. ABBETT.,https://query.nytimes.com/gst/abstract.html?res=9D04E4D91538E033A25753C1A9679C94659FD7CF,0
1884-01-10T00:00:00Z,"SEEKING A TERRITORIAL OFFICE.; WASHINGTON, Jan. 9.--In a few days the president will appoint a Surveyor-General for New-Mexico, and one of the candidates for the place, who is regarded as having the brightest chances of success, is Mr. Clarence Pullen. He is an engineer, is and has been a resident of the Territory for six years, and during that time ...",https://query.nytimes.com/gst/abstract.html?res=9E02E6D91538E033A25753C1A9679C94659FD7CF,0
1884-01-10T00:00:00Z,ARE CUSTOMS DECISIONS SOLD?; DAMAGING REPORTS WHICH WILL PROBABLY BE INVESTIGATED.,https://query.nytimes.com/gst/abstract.html?res=9F02E6D91538E033A25753C1A9679C94659FD7CF,0
1884-01-10T00:00:00Z,DISCUSSING THE AQUEDUCT.,https://query.nytimes.com/gst/abstract.html?res=9900E4D91538E033A25753C1A9679C94659FD7CF,0
1884-01-10T00:00:00Z,Article 4 -- No Title,https://query.nytimes.com/gst/abstract.html?res=9405E4D91538E033A25753C1A9679C94659FD7CF,0
1884-01-10T00:00:00Z,FUNDS FOR THE BARTHOLDI STATUE.,https://query.nytimes.com/gst/abstract.html?res=9C00E4D91538E033A25753C1A9679C94659FD7CF,0
1884-01-10T00:00:00Z,ARRANGING A CHARITABLE BENEFIT.,https://query.nytimes.com/gst/abstract.html?res=9D03E4D91538E033A25753C1A9679C94659FD7CF,0
1884-01-10T00:00:00Z,SUFFOCATED BY GAS.,https://query.nytimes.com/gst/abstract.html?res=9B0DE5D91538E033A25753C1A9679C94659FD7CF,0
1884-01-10T00:00:00Z,"THE DI CESNOLA LIBEL SUIT.; THE TESTIMONY OF MR. BALLIARD AND MR. WARD, THE SCULPTOR.",https://query.nytimes.com/gst/abstract.html?res=9B00E4D91538E033A25753C1A9679C94659FD7CF,0
1884-01-10T00:00:00Z,OFFICIAL RECEPTIONS.,https://query.nytimes.com/gst/abstract.html?res=9C02E6D91538E033A25753C1A9679C94659FD7CF,0
1884-01-10T00:00:00Z,A WANTON MURDER.,https://query.nytimes.com/gst/abstract.html?res=9503E4D91538E033A25753C1A9679C94659FD7CF,0
1884-01-10T00:00:00Z,PENDLETON'S BETRAYAL; BEWAILING THE SUCCESS OF THE SYNDICATE IN OHIO. STAGGERED BY THE REVELATIONS OF THE EXISTING PUTREFACTION WITHIN THE DEMOCRATIC PARTY.,https://query.nytimes.com/gst/abstract.html?res=940DE6D91538E033A25753C1A9679C94659FD7CF,1
1884-01-10T00:00:00Z,THE MEDICO-LEGAL SOCIETY.; A BILL TO HAVE MEDICAL EXAMINERS APPOINTED BY THE COURTS.,https://query.nytimes.com/gst/abstract.html?res=9804E4D91538E033A25753C1A9679C94659FD7CF,0
1884-01-10T00:00:00Z,Article 1 -- No Title,https://query.nytimes.com/gst/abstract.html?res=9507E5D91538E033A25753C1A9679C94659FD7CF,0
1884-01-10T00:00:00Z,Editorial Article 1 -- No Title,https://query.nytimes.com/gst/abstract.html?res=9F03E5D91538E033A25753C1A9679C94659FD7CF,0
1884-01-10T00:00:00Z,Article 2 -- No Title,https://query.nytimes.com/gst/abstract.html?res=9902E5D91538E033A25753C1A9679C94659FD7CF,0
1884-01-10T00:00:00Z,Editorial Article 5 -- No Title,https://query.nytimes.com/gst/abstract.html?res=9B03E5D91538E033A25753C1A9679C94659FD7CF,0
1884-01-10T00:00:00Z,GENERAL NOTES.,https://query.nytimes.com/gst/abstract.html?res=9B02E5D91538E033A25753C1A9679C94659FD7CF,0
1884-01-10T00:00:00Z,THE SAD DEATH OF LIEUT. AUGUR.; ESCAPING FROM BLOOMINGDALE ASYLUM AND PERISHING IN THE STORM.,https://query.nytimes.com/gst/abstract.html?res=9800E4D91538E033A25753C1A9679C94659FD7CF,1
1884-01-10T00:00:00Z,FLORIDA FRUIT TREES INJURED.,https://query.nytimes.com/gst/abstract.html?res=9402E6D91538E033A25753C1A9679C94659FD7CF,0
1884-01-10T00:00:00Z,Editorial Article 4 -- No Title,https://query.nytimes.com/gst/abstract.html?res=9A03E5D91538E033A25753C1A9679C94659FD7CF,0
1884-01-10T00:00:00Z,THE MENHADEN FISHERIES.; CONDITION of THE BUSINESS--WANTING NO CONCESSIONS TO ITS OPPONENTS.,https://query.nytimes.com/gst/abstract.html?res=9C01E5D91538E033A25753C1A9679C94659FD7CF,0
1884-01-10T00:00:00Z,"WILD TALK OF LYNCHING; EXCITEMENT CAUSED BY THE TRAGEDY AT OYSTER BAY. MR. TOWNSEND IMPROVING, BUT HIS WIFE LIKELY TO DIE--THE EVIDENCE OBTAINED AGAINST RAPPALEE.",https://query.nytimes.com/gst/abstract.html?res=9B0CE6D91538E033A25753C1A9679C94659FD7CF,0
1884-01-10T00:00:00Z,ROLLER-SKATING AT THE INSTITUTE.,https://query.nytimes.com/gst/abstract.html?res=9D0CE5D91538E033A25753C1A9679C94659FD7CF,0
1884-01-10T00:00:00Z,SOME VERY PERSISTENT THIEVES.,https://query.nytimes.com/gst/abstract.html?res=9506E5D91538E033A25753C1A9679C94659FD7CF,0
1884-01-10T00:00:00Z,HANGED BY A MOB.,https://query.nytimes.com/gst/abstract.html?res=9403E4D91538E033A25753C1A9679C94659FD7CF,0
1884-01-10T00:00:00Z,Marriage Announcement 1 -- No Title,https://query.nytimes.com/gst/abstract.html?res=9A07E4D91538E033A25753C1A9679C94659FD7CF,0
1884-01-10T00:00:00Z,COURT CALENDARS--THIS DAY.,https://query.nytimes.com/gst/abstract.html?res=9501E5D91538E033A25753C1A9679C94659FD7CF,0
1884-01-10T00:00:00Z,AN ELEVATED ROAD FOR NEW-ORLEANS,https://query.nytimes.com/gst/abstract.html?res=9A02E6D91538E033A25753C1A9679C94659FD7CF,0
1884-01-10T00:00:00Z,BUD RENAUD ADMITTED TO BAIL.,https://query.nytimes.com/gst/abstract.html?res=950CE6D91538E033A25753C1A9679C94659FD7CF,0
1884-01-10T00:00:00Z,THE CHAUTAUQUA ASSOCIATION.,https://query.nytimes.com/gst/abstract.html?res=9B04E4D91538E033A25753C1A9679C94659FD7CF,0
1884-01-10T00:00:00Z,FATHER M'CARTHY AS A WITNESS.; HE DENIES THE STORY OF MISS CRONIN AS TO THE ALLEGED ASSAULT.,https://query.nytimes.com/gst/abstract.html?res=9406E5D91538E033A25753C1A9679C94659FD7CF,0
1884-01-10T00:00:00Z,RELIEF OF SHIPPING.,https://query.nytimes.com/gst/abstract.html?res=9C02E5D91538E033A25753C1A9679C94659FD7CF,0
1884-01-10T00:00:00Z,CANADIAN IMMIGRATION.,https://query.nytimes.com/gst/abstract.html?res=9A0DE6D91538E033A25753C1A9679C94659FD7CF,0
1884-01-10T00:00:00Z,THE TRANSCONTINENTAL LINES.,https://query.nytimes.com/gst/abstract.html?res=9D07E5D91538E033A25753C1A9679C94659FD7CF,0
1884-01-10T00:00:00Z,Front Page 1 -- No Title,https://query.nytimes.com/gst/abstract.html?res=9502E6D91538E033A25753C1A9679C94659FD7CF,0
1884-01-10T00:00:00Z,MARYLAND'S NEW GOVERNOR.,https://query.nytimes.com/gst/abstract.html?res=9A01E5D91538E033A25753C1A9679C94659FD7CF,0
1884-01-10T00:00:00Z,MR. HARRELL'S WHIPPING.; THE CASTIGATION WHICH A LAWYER RECEIVED FOR INSULTING A LADY.,https://query.nytimes.com/gst/abstract.html?res=940DE5D91538E033A25753C1A9679C94659FD7CF,0
1884-01-10T00:00:00Z,POLLED CATTLE AT AUCTION.,https://query.nytimes.com/gst/abstract.html?res=9F0DE6D91538E033A25753C1A9679C94659FD7CF,0
1884-01-10T00:00:00Z,JUDGE LOCHRANE'S LARGE FEE.,https://query.nytimes.com/gst/abstract.html?res=9804E5D91538E033A25753C1A9679C94659FD7CF,0
1884-01-10T00:00:00Z,INDIAN BANDS FIGHTING.,https://query.nytimes.com/gst/abstract.html?res=990DE6D91538E033A25753C1A9679C94659FD7CF,0
1884-01-10T00:00:00Z,"MR. PAYNE, SENATOR.",https://query.nytimes.com/gst/abstract.html?res=9503E5D91538E033A25753C1A9679C94659FD7CF,0
1884-01-10T00:00:00Z,THE DEPARTMENT COMMANDER.,https://query.nytimes.com/gst/abstract.html?res=9C0CE6D91538E033A25753C1A9679C94659FD7CF,0
1884-01-10T00:00:00Z,A TRAIN DELAYED BY ANTELOPES.,https://query.nytimes.com/gst/abstract.html?res=9E0DE5D91538E033A25753C1A9679C94659FD7CF,0
1884-01-10T00:00:00Z,THE COLORED CHURCH ROW.,https://query.nytimes.com/gst/abstract.html?res=9D05E5D91538E033A25753C1A9679C94659FD7CF,0
1884-01-10T00:00:00Z,CARS WRECKED AND PERSONS INJURED.,https://query.nytimes.com/gst/abstract.html?res=9F05E4D91538E033A25753C1A9679C94659FD7CF,0
1884-01-10T00:00:00Z,A GHOSTLY DIRECTORY.,https://query.nytimes.com/gst/abstract.html?res=9F02E5D91538E033A25753C1A9679C94659FD7CF,0
1884-01-10T00:00:00Z,AFFAIRS OF CANADIAN LINES.,https://query.nytimes.com/gst/abstract.html?res=9504E5D91538E033A25753C1A9679C94659FD7CF,0
1884-01-10T00:00:00Z,POLICY-DEALERS ARRESTED.,https://query.nytimes.com/gst/abstract.html?res=9F0CE5D91538E033A25753C1A9679C94659FD7CF,0
