pub_date,main_headline,article_url,classification
1884-01-04T00:00:00Z,BUTLER NO LONGER GOVERNOR.; THE INAUGURATION OF MR. ROBINSON AS GOVERNOR OF MASSACHUSETTS.,https://query.nytimes.com/gst/abstract.html?res=9F06E5DA1538E033A25757C0A9679C94659FD7CF,0
1884-01-04T00:00:00Z,A CLERGYMAN'S WEDDING.,https://query.nytimes.com/gst/abstract.html?res=9C0DE5DA1538E033A25757C0A9679C94659FD7CF,0
1884-01-04T00:00:00Z,THE AQUEDUCT'S DIAMETER; THE NECESSITY OF ONE OF LARGE SIZE SHOWN FORTH. MR. DARRAGH'S ARGUMENT THAT THE DIAMETER SHOULD BE AT LEAST 18 FEET--OPPOSITION TO THE BIG DAM.,https://query.nytimes.com/gst/abstract.html?res=9D03E6DA1538E033A25757C0A9679C94659FD7CF,0
1884-01-04T00:00:00Z,DAMAGES CLAIMED FOR AN ASSAULT.,https://query.nytimes.com/gst/abstract.html?res=9A06E6DA1538E033A25757C0A9679C94659FD7CF,0
1884-01-04T00:00:00Z,HORACE K. THURBER'S FORTUNE.; TO RETIRE FROM THE GROCERY HOUSE WHICH HE FOUNDED.,https://query.nytimes.com/gst/abstract.html?res=9C02E5DA1538E033A25757C0A9679C94659FD7CF,0
1884-01-04T00:00:00Z,PHILADELPHIA'S DRINKING WATER.,https://query.nytimes.com/gst/abstract.html?res=9D01E6DA1538E033A25757C0A9679C94659FD7CF,0
1884-01-04T00:00:00Z,AMUSEMENTS.; FRENCH OPERA BOUFFE.,https://query.nytimes.com/gst/abstract.html?res=9F07E5DA1538E033A25757C0A9679C94659FD7CF,0
1884-01-04T00:00:00Z,MRS. THORNE'S INHERITANCE.,https://query.nytimes.com/gst/abstract.html?res=9407E5DA1538E033A25757C0A9679C94659FD7CF,0
1884-01-05T00:00:00Z,A MARRIED MAN ELOPES.,https://query.nytimes.com/gst/abstract.html?res=9E01E4DA1538E033A25756C0A9679C94659FD7CF,0
1884-01-05T00:00:00Z,Marriage Announcement 1 -- No Title,https://query.nytimes.com/gst/abstract.html?res=940CE3DA1538E033A25756C0A9679C94659FD7CF,0
1884-01-05T00:00:00Z,AMUSEMENTS THIS EVENING.,https://query.nytimes.com/gst/abstract.html?res=9C00E3DA1538E033A25756C0A9679C94659FD7CF,0
1884-01-05T00:00:00Z,BUSINESS EMBARRASSMENTS,https://query.nytimes.com/gst/abstract.html?res=9E0CE4DA1538E033A25756C0A9679C94659FD7CF,0
1884-01-05T00:00:00Z,THE QUESTION OF TAXATION.,https://query.nytimes.com/gst/abstract.html?res=9400E3DA1538E033A25756C0A9679C94659FD7CF,0
1884-01-05T00:00:00Z,TWO MURDERS IN MACON.; A MAN SHOT IN THE FOREHEAD AND ANOTHER KILLED BY A BRICK.,https://query.nytimes.com/gst/abstract.html?res=9401E4DA1538E033A25756C0A9679C94659FD7CF,0
1884-01-05T00:00:00Z,ROBBED AT THE BRIDGE ENTRANCE.,https://query.nytimes.com/gst/abstract.html?res=990CE4DA1538E033A25756C0A9679C94659FD7CF,0
1884-01-05T00:00:00Z,"TRUSTED CLERK KOBBE; THE WAY HE DEFRAUDED HIS EMPLOYERS. GETTING FRAUDULENT BILLS OF EXCHANGE FOR 13,465 CASHED AND PLANNING TO EFFECT A COMPROMISE.",https://query.nytimes.com/gst/abstract.html?res=9F02E3DA1538E033A25756C0A9679C94659FD7CF,1
1884-01-05T00:00:00Z,A DISEASE BEYOND THE PHYSICIANS.,https://query.nytimes.com/gst/abstract.html?res=9A07E3DA1538E033A25756C0A9679C94659FD7CF,0
1884-01-05T00:00:00Z,UNCEREMONIOUSLY ENDED.,https://query.nytimes.com/gst/abstract.html?res=9F06E4DA1538E033A25756C0A9679C94659FD7CF,0
1884-01-05T00:00:00Z,DEATH OF DR. D.G. CORLIN.,https://query.nytimes.com/gst/abstract.html?res=9C02E3DA1538E033A25756C0A9679C94659FD7CF,0
1884-01-05T00:00:00Z,Article 1 -- No Title,https://query.nytimes.com/gst/abstract.html?res=9403E3DA1538E033A25756C0A9679C94659FD7CF,0
1884-01-05T00:00:00Z,DEATH OF A NOTED BLOCKADE RUNNER.,https://query.nytimes.com/gst/abstract.html?res=9800E4DA1538E033A25756C0A9679C94659FD7CF,0
1884-01-05T00:00:00Z,A BOY GUILTY OF MANSLAUGHTER.,https://query.nytimes.com/gst/abstract.html?res=9D06E4DA1538E033A25756C0A9679C94659FD7CF,0
1884-01-05T00:00:00Z,TRYING TO ROB SAILORS.,https://query.nytimes.com/gst/abstract.html?res=9F0CE4DA1538E033A25756C0A9679C94659FD7CF,0
1884-01-05T00:00:00Z,SYMPHONY SOCIETY OF NEW-YORK.,https://query.nytimes.com/gst/abstract.html?res=9A03E3DA1538E033A25756C0A9679C94659FD7CF,0
1884-01-05T00:00:00Z,NOT HANGED BY THE MATE.,https://query.nytimes.com/gst/abstract.html?res=9C07E3DA1538E033A25756C0A9679C94659FD7CF,0
1884-01-05T00:00:00Z,NOTES OF VARIOUS INTERESTS,https://query.nytimes.com/gst/abstract.html?res=9D0DE4DA1538E033A25756C0A9679C94659FD7CF,0
1884-01-05T00:00:00Z,SORGHUM SUGAR EXPERIMENTS.,https://query.nytimes.com/gst/abstract.html?res=9D07E4DA1538E033A25756C0A9679C94659FD7CF,0
1884-01-05T00:00:00Z,A NEGRO LYNCHED IN ALTA.; SWIFT PUNISHMENT METED OUT FOR SHOOTING A WHITE MAN.,https://query.nytimes.com/gst/abstract.html?res=9807E4DA1538E033A25756C0A9679C94659FD7CF,0
1884-01-05T00:00:00Z,"INTENSELY COLD WEATHER; SEVERE WIND AND HEAVY SNOW IN MANY SECTIONS. RAILWAY TRAVEL INTERRUPTED, HIGHWAYS BLOCKED, AND GREAT SUFFERING ON LAND AND WATER.",https://query.nytimes.com/gst/abstract.html?res=9B06E4DA1538E033A25756C0A9679C94659FD7CF,1
1884-01-05T00:00:00Z,NOMINATING MR. M'LAUGHLIN'S MEN.,https://query.nytimes.com/gst/abstract.html?res=9E02E3DA1538E033A25756C0A9679C94659FD7CF,0
1884-01-05T00:00:00Z,AMUSEMENTS.; ITALIAN OPERA AT THE ACADEMY,https://query.nytimes.com/gst/abstract.html?res=9903E3DA1538E033A25756C0A9679C94659FD7CF,0
1884-01-05T00:00:00Z,KILLED WITH A BALL CLUB.,https://query.nytimes.com/gst/abstract.html?res=9C06E4DA1538E033A25756C0A9679C94659FD7CF,0
1884-01-05T00:00:00Z,FIVE THOUSAND SKATERS ON THE ICE.,https://query.nytimes.com/gst/abstract.html?res=9F06E2DA1538E033A25756C0A9679C94659FD7CF,0
1884-01-05T00:00:00Z,SHOT DEAD BY HIS BROTHER.,https://query.nytimes.com/gst/abstract.html?res=9500E4DA1538E033A25756C0A9679C94659FD7CF,0
1884-01-05T00:00:00Z,"MANAGING THE RAILWAYS; REFUSING TO ACCEPT THE WESTERN POOL'S TERMS. A SUGGESTION TO THE CHICAGO, BURLINGTON AND QUINCY TO FORM A SEPARATE POOL WITH THE UNION PACIFIC.",https://query.nytimes.com/gst/abstract.html?res=9B02E4DA1538E033A25756C0A9679C94659FD7CF,0
1884-01-05T00:00:00Z,OFFICER PRICE'S SMALL SENSATION.,https://query.nytimes.com/gst/abstract.html?res=9504E3DA1538E033A25756C0A9679C94659FD7CF,0
1884-01-05T00:00:00Z,THE CHICAGO LATHE COMPANY.,https://query.nytimes.com/gst/abstract.html?res=9B02E3DA1538E033A25756C0A9679C94659FD7CF,0
1884-01-05T00:00:00Z,THE OREGON COMPANIES.,https://query.nytimes.com/gst/abstract.html?res=9901E4DA1538E033A25756C0A9679C94659FD7CF,0
1884-01-05T00:00:00Z,CONTESTING A SISTER'S WILL.,https://query.nytimes.com/gst/abstract.html?res=9E06E4DA1538E033A25756C0A9679C94659FD7CF,0
1884-01-05T00:00:00Z,A CELEBRATED INDIANA SUIT.,https://query.nytimes.com/gst/abstract.html?res=9D00E4DA1538E033A25756C0A9679C94659FD7CF,0
1884-01-05T00:00:00Z,JAY-EYE-SEE'S OWNER.; AN APPEAL TAKEN FROM THE DECISION OF A LAW SUIT IN HIS FAVOR.,https://query.nytimes.com/gst/abstract.html?res=9A02E3DA1538E033A25756C0A9679C94659FD7CF,1
1884-01-05T00:00:00Z,A GIFT TO ROANOKE COLLEGE.,https://query.nytimes.com/gst/abstract.html?res=9902E4DA1538E033A25756C0A9679C94659FD7CF,0
1884-01-05T00:00:00Z,A BURGLAR PARDONED.,https://query.nytimes.com/gst/abstract.html?res=9F02E4DA1538E033A25756C0A9679C94659FD7CF,0
1884-01-05T00:00:00Z,"SEEKING JUDGE M'CRARY'S PLACE.; DES MOINES, Iowa, Jan. 4.--While the friends, respectively, of Judge C.C. Nourse and the Hon. Galusha Parsons, of Des Moines; Judge Rodgers, of Davenport, and Judge Shiras, of Dubuque, will probably ask for them the appointment to the McCrary vacancy in the United States Circuit Court, shrewd politicians say they expect the appointment will fall to Senator McMillan, of Minnesota. It is thought that Judge Love, being a Democrat, will hardly be recognized.",https://query.nytimes.com/gst/abstract.html?res=9507E4DA1538E033A25756C0A9679C94659FD7CF,0
1884-01-05T00:00:00Z,AMERICAN AND GERMAN DEER.; AN EFFORT TO BE MADE TO CROSS THE TWO BREEDS BY MR. PICKHARDT.,https://query.nytimes.com/gst/abstract.html?res=9F0CE3DA1538E033A25756C0A9679C94659FD7CF,0
1884-01-05T00:00:00Z,Editorial Article 4 -- No Title,https://query.nytimes.com/gst/abstract.html?res=9F00E3DA1538E033A25756C0A9679C94659FD7CF,0
1884-01-05T00:00:00Z,TWO ACTORS FIGHTING IN A HOTEL.,https://query.nytimes.com/gst/abstract.html?res=9907E4DA1538E033A25756C0A9679C94659FD7CF,0
1884-01-05T00:00:00Z,"SENATORIAL ASPIRANTS; THE KENTUCKY CANVASS AROUSING MUCH INTEREST.OPPOSITION TO THE RE-ELECTION OF SENATOR WILLIAMS--CARLISLE, BLACKBURN,AND M'KENZIE AS CANDIDATES.",https://query.nytimes.com/gst/abstract.html?res=9407E3DA1538E033A25756C0A9679C94659FD7CF,0
1884-01-05T00:00:00Z,UNITED STATES SUPREME COURT.,https://query.nytimes.com/gst/abstract.html?res=9905E3DA1538E033A25756C0A9679C94659FD7CF,0
1884-01-05T00:00:00Z,Editorial Article 1 -- No Title,https://query.nytimes.com/gst/abstract.html?res=9401E3DA1538E033A25756C0A9679C94659FD7CF,0
1884-01-05T00:00:00Z,IN HONOR OF THE PRESIDENT.,https://query.nytimes.com/gst/abstract.html?res=9C07E4DA1538E033A25756C0A9679C94659FD7CF,0
1884-01-05T00:00:00Z,""" THE IRISH JEANNIE DEANS.""",https://query.nytimes.com/gst/abstract.html?res=9C03E3DA1538E033A25756C0A9679C94659FD7CF,0
1884-01-05T00:00:00Z,Editorial Article 2 -- No Title,https://query.nytimes.com/gst/abstract.html?res=9501E3DA1538E033A25756C0A9679C94659FD7CF,0
1884-01-05T00:00:00Z,FIRE FOUGHT WITH HOOKS AND BROOMS.,https://query.nytimes.com/gst/abstract.html?res=9A06E2DA1538E033A25756C0A9679C94659FD7CF,0
1884-01-05T00:00:00Z,EGYPT MAKING DEMANDS.,https://query.nytimes.com/gst/abstract.html?res=9803E4DA1538E033A25756C0A9679C94659FD7CF,0
1884-01-05T00:00:00Z,"A BARGAIN WHICH COST HIM $2,377.",https://query.nytimes.com/gst/abstract.html?res=9B04E3DA1538E033A25756C0A9679C94659FD7CF,0
1884-01-05T00:00:00Z,A SENATOR'S NARROW ESCAPE.,https://query.nytimes.com/gst/abstract.html?res=9B03E4DA1538E033A25756C0A9679C94659FD7CF,0
1884-01-05T00:00:00Z,FAILURE OF DIAMOND MERCHANTS.,https://query.nytimes.com/gst/abstract.html?res=9806E2DA1538E033A25756C0A9679C94659FD7CF,0
1884-01-05T00:00:00Z,"EVENTS IN THE METROPOLIS; CLUBBED ON THE ELEVATED ROAD, A DRUNKEN MAN SEVERELY BEATEN BY A TICKET-SELLER.",https://query.nytimes.com/gst/abstract.html?res=940DE3DA1538E033A25756C0A9679C94659FD7CF,1
1884-01-05T00:00:00Z,THE THREATS OF FENIANS.; POPE LEO WARNED TO CHANGE HIS POLICY BY AMERICAN AGITATORS.,https://query.nytimes.com/gst/abstract.html?res=9D03E4DA1538E033A25756C0A9679C94659FD7CF,0
1884-01-05T00:00:00Z,GENERAL NOTES.,https://query.nytimes.com/gst/abstract.html?res=9803E3DA1538E033A25756C0A9679C94659FD7CF,0
1884-01-05T00:00:00Z,FAILURES DURING A WEEK.,https://query.nytimes.com/gst/abstract.html?res=9807E3DA1538E033A25756C0A9679C94659FD7CF,0
1884-01-05T00:00:00Z,KILLED BY A CARTRIDGE EXPLODING.,https://query.nytimes.com/gst/abstract.html?res=9A0DE3DA1538E033A25756C0A9679C94659FD7CF,0
1884-01-05T00:00:00Z,THE ALDERMANIC OFFICES.; DEMOCRATIC FACTIONS HARMONIOUS AND THE REPUBLICANS WATCHING THEM.,https://query.nytimes.com/gst/abstract.html?res=9B0DE3DA1538E033A25756C0A9679C94659FD7CF,0
1884-01-05T00:00:00Z,DR. T. STERRY HUNT INJURED.,https://query.nytimes.com/gst/abstract.html?res=9907E3DA1538E033A25756C0A9679C94659FD7CF,0
1884-01-05T00:00:00Z,MR. BERGH AND MR. SHARP TO SETTLE IT.,https://query.nytimes.com/gst/abstract.html?res=9E06E2DA1538E033A25756C0A9679C94659FD7CF,0
1884-01-05T00:00:00Z,"A MYSTERY OF THE SEA.; The Fate Which Overtook the ""City of Boston""--Capt. Murray's Ideas and Experiences.",https://query.nytimes.com/gst/abstract.html?res=9901E2DA1538E033A25756C0A9679C94659FD7CF,0
1884-01-05T00:00:00Z,"SHOOTING AT ALEXANDER; A NEW VERSION OF THE ""ACCIDENT"" TO THE CZAR.ATTACKED BY SIX MEN WHILE ON THE ROADWITH A HUNTING PARTY, AND WOUNDED IN THE SHOULDER.",https://query.nytimes.com/gst/abstract.html?res=9E03E4DA1538E033A25756C0A9679C94659FD7CF,0
1884-01-05T00:00:00Z,ANOTHER GIFT FOR YALE.,https://query.nytimes.com/gst/abstract.html?res=9E00E4DA1538E033A25756C0A9679C94659FD7CF,0
1884-01-05T00:00:00Z,THE COMING TARIFF FIGHT; LEADING DEMOCRATS AT WAR ON THE SUBJECT. MR. RANDALL SAID TO BE PREPARING A FLANK MOVEMENT ON THE FRIENDS OF TARIFF REFORM.,https://query.nytimes.com/gst/abstract.html?res=9404E4DA1538E033A25756C0A9679C94659FD7CF,1
1884-01-05T00:00:00Z,MONTREAL'S WINTER CARNIVAL.,https://query.nytimes.com/gst/abstract.html?res=9506E4DA1538E033A25756C0A9679C94659FD7CF,0
1884-01-05T00:00:00Z,HOW HE WON HIS BRIDE.; AN UNFILIAL DAUGHTER JOINS IN A SCHEME AGAINST HER FATHER.,https://query.nytimes.com/gst/abstract.html?res=9802E3DA1538E033A25756C0A9679C94659FD7CF,1
1884-01-05T00:00:00Z,OFFICER SMITH TO BLAME; THE SHOOTING OF THOMAS FITZPATRICK UNJUSTIFIABLE. THE DECEASED AND HIS FRIENDS CLUBBED BY THE TWO POLICEMEN--SMITH'S PLEA OF SELF-DEFENSE.,https://query.nytimes.com/gst/abstract.html?res=9F07E2DA1538E033A25756C0A9679C94659FD7CF,0
1884-01-05T00:00:00Z,FIRE IN THE TABOR OPERA-HOUSE.,https://query.nytimes.com/gst/abstract.html?res=9A0DE4DA1538E033A25756C0A9679C94659FD7CF,0
1884-01-05T00:00:00Z,CABLE ROAD PLANS.; EXPLAINING THE PROPOSED LEXINGTONAVENUE RAPID TRANSIT SCHEME.,https://query.nytimes.com/gst/abstract.html?res=9407E2DA1538E033A25756C0A9679C94659FD7CF,0
1884-01-05T00:00:00Z,MORE RIOTING IN NEWFOUNDLAND.,https://query.nytimes.com/gst/abstract.html?res=9906E4DA1538E033A25756C0A9679C94659FD7CF,0
1884-01-05T00:00:00Z,Article 2 -- No Title,https://query.nytimes.com/gst/abstract.html?res=9503E3DA1538E033A25756C0A9679C94659FD7CF,0
1884-01-05T00:00:00Z,A USELESS EXPENSE.,https://query.nytimes.com/gst/abstract.html?res=9D03E3DA1538E033A25756C0A9679C94659FD7CF,0
1884-01-05T00:00:00Z,MR. O'BRIEN GOT THERE AS USUAL.,https://query.nytimes.com/gst/abstract.html?res=990CE3DA1538E033A25756C0A9679C94659FD7CF,0
1884-01-05T00:00:00Z,A FIGHT ON THE GALLOWS.; THE MURDERER MAKES A DESPERATE EFFORT FOR LIFE.,https://query.nytimes.com/gst/abstract.html?res=9B0DE4DA1538E033A25756C0A9679C94659FD7CF,0
1884-01-05T00:00:00Z,DROWNING OUT A FIRE.,https://query.nytimes.com/gst/abstract.html?res=9D04E3DA1538E033A25756C0A9679C94659FD7CF,0
1884-01-05T00:00:00Z,THE MURDER OF PATRICK CARTLIN.,https://query.nytimes.com/gst/abstract.html?res=9507E3DA1538E033A25756C0A9679C94659FD7CF,0
1884-01-05T00:00:00Z,A BOSTON BROKER ABSCONDS.,https://query.nytimes.com/gst/abstract.html?res=9A07E4DA1538E033A25756C0A9679C94659FD7CF,0
1884-01-05T00:00:00Z,HALF-TIME AT THE COAL MINES.; THE ORDER OF THE COMPANIES RECEIVED WITH GREAT DISSATISFACTION.,https://query.nytimes.com/gst/abstract.html?res=9E0DE3DA1538E033A25756C0A9679C94659FD7CF,1
1884-01-05T00:00:00Z,CITY AND SUBURBAN NEWS; NEW-YORK. BROOKLYN. WESTCHESTER COUNTY. LONG ISLAND. STATEN ISLAND. NEW-JERSEY.,https://query.nytimes.com/gst/abstract.html?res=9B06E2DA1538E033A25756C0A9679C94659FD7CF,1
1884-01-05T00:00:00Z,CHEAP KNIGHTHOOD.,https://query.nytimes.com/gst/abstract.html?res=9E03E3DA1538E033A25756C0A9679C94659FD7CF,0
1884-01-05T00:00:00Z,ACCIDENTS ON THE GRAND TRUNK.; A COLLISION AT STEVENSVILLE AND A TRAIN THROWN FROM THE TRACK.,https://query.nytimes.com/gst/abstract.html?res=9C00E4DA1538E033A25756C0A9679C94659FD7CF,0
1884-01-05T00:00:00Z,THE WILKINSON MURDER TRIAL.,https://query.nytimes.com/gst/abstract.html?res=9902E3DA1538E033A25756C0A9679C94659FD7CF,0
1884-01-05T00:00:00Z,A MURDERER SURRENDERS.,https://query.nytimes.com/gst/abstract.html?res=9501E4DA1538E033A25756C0A9679C94659FD7CF,0
1884-01-05T00:00:00Z,NEW-YORK AND NEW-ENGLAND.,https://query.nytimes.com/gst/abstract.html?res=9402E4DA1538E033A25756C0A9679C94659FD7CF,0
1884-01-05T00:00:00Z,COLLISION IN A RAILWAY TUNNEL.,https://query.nytimes.com/gst/abstract.html?res=990DE3DA1538E033A25756C0A9679C94659FD7CF,0
1884-01-05T00:00:00Z,TWO TRAINS IN COLLISION.,https://query.nytimes.com/gst/abstract.html?res=9A03E4DA1538E033A25756C0A9679C94659FD7CF,0
1884-01-05T00:00:00Z,Editorial Article 7 -- No Title,https://query.nytimes.com/gst/abstract.html?res=9A00E3DA1538E033A25756C0A9679C94659FD7CF,0
1884-01-05T00:00:00Z,THIRTY LOTTERY-DEALERS ARRESTED.,https://query.nytimes.com/gst/abstract.html?res=9E0CE3DA1538E033A25756C0A9679C94659FD7CF,0
1884-01-05T00:00:00Z,THE SPANISH POLITICAL CRISIS.,https://query.nytimes.com/gst/abstract.html?res=9903E4DA1538E033A25756C0A9679C94659FD7CF,0
1884-01-05T00:00:00Z,TO WATCH LEGISLATIVE WORK.,https://query.nytimes.com/gst/abstract.html?res=9B07E3DA1538E033A25756C0A9679C94659FD7CF,0
1884-01-05T00:00:00Z,ARRESTING HIS OWN WIFE.,https://query.nytimes.com/gst/abstract.html?res=9E07E2DA1538E033A25756C0A9679C94659FD7CF,0
1884-01-05T00:00:00Z,PAYNE LOSING STRENGTH.; PENDLETON STILL SANGUINE OF BEING THE NEXT SENATOR FROM OHIO.,https://query.nytimes.com/gst/abstract.html?res=9A01E4DA1538E033A25756C0A9679C94659FD7CF,1
1884-01-05T00:00:00Z,SAILORS FROZEN TO DEATH.,https://query.nytimes.com/gst/abstract.html?res=9A07E2DA1538E033A25756C0A9679C94659FD7CF,0
1884-01-05T00:00:00Z,NOTES FROM WASHINGTON.,https://query.nytimes.com/gst/abstract.html?res=9E05E3DA1538E033A25756C0A9679C94659FD7CF,0
1884-01-05T00:00:00Z,AN UNCONSTITUTIONAL GAMBLING ACT.,https://query.nytimes.com/gst/abstract.html?res=9B0CE4DA1538E033A25756C0A9679C94659FD7CF,0
1884-01-05T00:00:00Z,REVIVING THE BRUFF ROAD.; MAKING AN ATTEMPT TO RAISE MONEY TO COMPLETE IT TO BEDFORD-AVENUE.,https://query.nytimes.com/gst/abstract.html?res=9807E2DA1538E033A25756C0A9679C94659FD7CF,1
1884-01-05T00:00:00Z,Obituary 1 -- No Title,https://query.nytimes.com/gst/abstract.html?res=9C0CE4DA1538E033A25756C0A9679C94659FD7CF,0
1884-01-05T00:00:00Z,"ACCEPTING HIS RESIGNATION.; NORTHERN PACIFIC DIRECTORS VOTE HIM $10,000 A YEAR--NO SUCCESSOR CHOSEN.",https://query.nytimes.com/gst/abstract.html?res=9B01E4DA1538E033A25756C0A9679C94659FD7CF,0
1884-01-05T00:00:00Z,TO BE EXTENDED TO CROTON DAM.; THE COMMISSIONERS FIX THE AQUEDUCT'S TERMINUS AND ITS DIAMETER,https://query.nytimes.com/gst/abstract.html?res=9405E3DA1538E033A25756C0A9679C94659FD7CF,0
1884-01-05T00:00:00Z,THE YAZOO CITY TRAGEDY; CAUSES WHICH LED TO THE CHRISTMAS EVE TROUBLE. THE RELATIONS OF THE RACES AND THE DETERMINATION OF THE WHITE MINORITYTO RULE THE BLACK MAJORITY.,https://query.nytimes.com/gst/abstract.html?res=9F0DE3DA1538E033A25756C0A9679C94659FD7CF,1
1884-01-05T00:00:00Z,MARINE INTELLIGENCE.; CLEARED. ARRIVED. BELOW. SAILED. SPOKEN. BY CABLE.,https://query.nytimes.com/gst/abstract.html?res=9C01E2DA1538E033A25756C0A9679C94659FD7CF,1
1884-01-05T00:00:00Z,A DINNER TO GEN. M'COOK.,https://query.nytimes.com/gst/abstract.html?res=9804E3DA1538E033A25756C0A9679C94659FD7CF,0
1884-01-05T00:00:00Z,PRESIDENT GOWEN'S FUTURE.,https://query.nytimes.com/gst/abstract.html?res=9C0DE4DA1538E033A25756C0A9679C94659FD7CF,0
1884-01-05T00:00:00Z,Editorial Article 3 -- No Title,https://query.nytimes.com/gst/abstract.html?res=9D00E3DA1538E033A25756C0A9679C94659FD7CF,0
1884-01-05T00:00:00Z,ARMY AND NAVY NEWS.,https://query.nytimes.com/gst/abstract.html?res=9805E3DA1538E033A25756C0A9679C94659FD7CF,0
1884-01-05T00:00:00Z,A BRIDGE ENGINE JUMPS THE TRACK.,https://query.nytimes.com/gst/abstract.html?res=9906E2DA1538E033A25756C0A9679C94659FD7CF,0
1884-01-05T00:00:00Z,FREE FIGHT AMONG SAILORS.,https://query.nytimes.com/gst/abstract.html?res=9505E3DA1538E033A25756C0A9679C94659FD7CF,0
1884-01-05T00:00:00Z,IN REMEMBRANCE OF DEAD CATHOLICS.,https://query.nytimes.com/gst/abstract.html?res=9D06E2DA1538E033A25756C0A9679C94659FD7CF,0
1884-01-05T00:00:00Z,A NEW TREATY WITH SPAIN; ABOLISHING DISCRIMINATING DUTIES. AN AGREEMENT SIGNED BY MINISTER FOSTER--OFFICIAL STATEMENT OF THE CAUSES LEADING TO ITS NEGOTIATION.,https://query.nytimes.com/gst/abstract.html?res=950CE4DA1538E033A25756C0A9679C94659FD7CF,0
1884-01-05T00:00:00Z,NAVY-YARDS AND THEIR USES.,https://query.nytimes.com/gst/abstract.html?res=9B00E3DA1538E033A25756C0A9679C94659FD7CF,0
1884-01-05T00:00:00Z,END OF AN ILLUSTRATED PAPER.,https://query.nytimes.com/gst/abstract.html?res=9F03E3DA1538E033A25756C0A9679C94659FD7CF,0
1884-01-05T00:00:00Z,POOL-PLAYERS CONTESTING.,https://query.nytimes.com/gst/abstract.html?res=9D02E3DA1538E033A25756C0A9679C94659FD7CF,0
1884-01-05T00:00:00Z,RIVER AND HARBOR LOBBYING.; MISSISSIPPI VALLEY MEN TO HOLD A CONVENTION IN WASHINGTON.,https://query.nytimes.com/gst/abstract.html?res=9504E4DA1538E033A25756C0A9679C94659FD7CF,0
1884-01-05T00:00:00Z,WHAT INGERSOLL IS TO AN IRISHMAN.,https://query.nytimes.com/gst/abstract.html?res=9806E3DA1538E033A25756C0A9679C94659FD7CF,0
1884-01-05T00:00:00Z,Obituary 2 -- No Title,https://query.nytimes.com/gst/abstract.html?res=950CE3DA1538E033A25756C0A9679C94659FD7CF,0
1884-01-05T00:00:00Z,SHOT BY A RECREANT LOVER.; ATTACKED WITH AN AXE BY THE GIRL'S BROTHERS HE SHOOTS THEM BOTH.,https://query.nytimes.com/gst/abstract.html?res=9406E4DA1538E033A25756C0A9679C94659FD7CF,0
1884-01-05T00:00:00Z,DYING OF HIS INJURIES.,https://query.nytimes.com/gst/abstract.html?res=9C06E3DA1538E033A25756C0A9679C94659FD7CF,0
1884-01-05T00:00:00Z,TWO PHYSICIANS IN TROUBLE.; THE SERIOUS CHARGE A YOUNG WOMAN OF PROVIDENCE MAKES.,https://query.nytimes.com/gst/abstract.html?res=9D0CE4DA1538E033A25756C0A9679C94659FD7CF,1
1884-01-05T00:00:00Z,AN OLD SEA CAPTAIN DEAD.,https://query.nytimes.com/gst/abstract.html?res=9E04E3DA1538E033A25756C0A9679C94659FD7CF,0
1884-01-05T00:00:00Z,THE POOR IN THE LOWER WARDS.,https://query.nytimes.com/gst/abstract.html?res=9D07E2DA1538E033A25756C0A9679C94659FD7CF,0
1884-01-05T00:00:00Z,NEW-ORLEANS TOW-BOAT MONOPOLY.,https://query.nytimes.com/gst/abstract.html?res=9502E3DA1538E033A25756C0A9679C94659FD7CF,0
1884-01-05T00:00:00Z,SEVERE ON THE COLLEGE BOYS.,https://query.nytimes.com/gst/abstract.html?res=9F06E3DA1538E033A25756C0A9679C94659FD7CF,0
1884-01-05T00:00:00Z,"M'DONALD'S CHIEF ""BOOMER.""",https://query.nytimes.com/gst/abstract.html?res=9D01E4DA1538E033A25756C0A9679C94659FD7CF,0
1884-01-05T00:00:00Z,Editorial Article 6 -- No Title,https://query.nytimes.com/gst/abstract.html?res=9900E3DA1538E033A25756C0A9679C94659FD7CF,0
1884-01-05T00:00:00Z,O'DONNELL'S STORY OF HIS CRIME.,https://query.nytimes.com/gst/abstract.html?res=9F03E4DA1538E033A25756C0A9679C94659FD7CF,0
1884-01-05T00:00:00Z,A WORLD'S FAIR AT SAN FRANCISCO,https://query.nytimes.com/gst/abstract.html?res=9A0CE4DA1538E033A25756C0A9679C94659FD7CF,0
1884-01-05T00:00:00Z,NOTES FROM SPORTING CIRCLES.,https://query.nytimes.com/gst/abstract.html?res=9C0CE3DA1538E033A25756C0A9679C94659FD7CF,0
1884-01-05T00:00:00Z,BUSINESS OF THE READING.,https://query.nytimes.com/gst/abstract.html?res=9502E4DA1538E033A25756C0A9679C94659FD7CF,0
1884-01-05T00:00:00Z,TO BREED FINE CATTLE.,https://query.nytimes.com/gst/abstract.html?res=9E02E4DA1538E033A25756C0A9679C94659FD7CF,0
1884-01-05T00:00:00Z,GRAND ARMY MEN INDIGNANT.; DR. CHAMBERLAIN'S REFUSAL TO OPEN HIS CHURCH FOR A FUNERAL.,https://query.nytimes.com/gst/abstract.html?res=9F0DE4DA1538E033A25756C0A9679C94659FD7CF,1
1884-01-05T00:00:00Z,THE IRON OUTLOOK ENCOURAGING,https://query.nytimes.com/gst/abstract.html?res=9B03E3DA1538E033A25756C0A9679C94659FD7CF,0
1884-01-05T00:00:00Z,PERSONAL INTELLIGENCE.,https://query.nytimes.com/gst/abstract.html?res=950DE3DA1538E033A25756C0A9679C94659FD7CF,0
1884-01-05T00:00:00Z,Editorial Article 5 -- No Title,https://query.nytimes.com/gst/abstract.html?res=9800E3DA1538E033A25756C0A9679C94659FD7CF,0
1884-01-05T00:00:00Z,THE ALASKA VOLCANOES.; A MORE DETAILED ACCOUNT OF THE ERUPTIONS IN OCTOBER.,https://query.nytimes.com/gst/abstract.html?res=9D06E3DA1538E033A25756C0A9679C94659FD7CF,1
1884-01-05T00:00:00Z,"HENRY VILLARD'S WORK; TRANSFERRING HIS BIG UP-TOWN BLOCK. THE PROPERTY PLACED IN OTHER HANDS TO PAY A DEBT OF $300,000 TO THE OREGON RAILWAY AND NAVIGATION.",https://query.nytimes.com/gst/abstract.html?res=9801E4DA1538E033A25756C0A9679C94659FD7CF,0
1884-01-05T00:00:00Z,THE MONTREAL FLOOD SUBSIDING.,https://query.nytimes.com/gst/abstract.html?res=9402E3DA1538E033A25756C0A9679C94659FD7CF,0
1884-01-05T00:00:00Z,AN ANCIENT MASONIC HALL.; THE CRADLE OF MASONRY IN THE CONNECTICUT COLONY.,https://query.nytimes.com/gst/abstract.html?res=980DE3DA1538E033A25756C0A9679C94659FD7CF,1
1884-01-05T00:00:00Z,"A PHYSICIAN'S FLIGHT; ARRESTED IN NEW-YORK FOR FORGERY IN SYRACUSE. DR. GEORGE H. GREELEY'S UNFAITHFULNESS, FORGERY OF FRIENDS' NAMES,AND FLIGHT WITH MISS MABEL RICE.",https://query.nytimes.com/gst/abstract.html?res=9900E4DA1538E033A25756C0A9679C94659FD7CF,1
1884-01-05T00:00:00Z,RELIGIOUS FEELINGS DISREGARDED.,https://query.nytimes.com/gst/abstract.html?res=9C01E4DA1538E033A25756C0A9679C94659FD7CF,0
1884-01-05T00:00:00Z,FOUND HANGING IN HIS CELL.,https://query.nytimes.com/gst/abstract.html?res=9B00E4DA1538E033A25756C0A9679C94659FD7CF,0
1884-01-05T00:00:00Z,A PROPELLER SEIZED.; ANOTHER MOVE IN THE ENSIGN LITIGATION IN CHICAGO.,https://query.nytimes.com/gst/abstract.html?res=9D02E4DA1538E033A25756C0A9679C94659FD7CF,0
1884-01-05T00:00:00Z,THE CINCINNATI TOBACCO TRADE.,https://query.nytimes.com/gst/abstract.html?res=9C0DE3DA1538E033A25756C0A9679C94659FD7CF,0
1884-01-05T00:00:00Z,THE GREELY PARTY'S PERIL; PRACTICAL SUGGESTIONS FOR THEIR RESCUE. DR. EMIL BESSELS AND LIEUT. COLWELL GIVE RESULTS OF THEIR EXPERIENCE-- MR. KENNAN URGES A REWARD.,https://query.nytimes.com/gst/abstract.html?res=9C05E3DA1538E033A25756C0A9679C94659FD7CF,0
1884-01-05T00:00:00Z,NEW DEVICE FOR LIGHTING GAS.,https://query.nytimes.com/gst/abstract.html?res=9907E2DA1538E033A25756C0A9679C94659FD7CF,0
1884-01-05T00:00:00Z,"THE ""GRAPHIC"" SUITS DISMISSED.",https://query.nytimes.com/gst/abstract.html?res=980CE3DA1538E033A25756C0A9679C94659FD7CF,0
1884-01-05T00:00:00Z,INSURING THE THEATRES.; DETERMINING ADDITIONAL CHARGES AND THE FULL RATES.,https://query.nytimes.com/gst/abstract.html?res=9B07E2DA1538E033A25756C0A9679C94659FD7CF,1
1884-01-05T00:00:00Z,MR. CONKLING'S SHORT LECTURE.; THE MARIE-GARRISON SUIT A SATIRE ON A TRIAL IN A COURT OF RECORD.,https://query.nytimes.com/gst/abstract.html?res=9A04E3DA1538E033A25756C0A9679C94659FD7CF,0
1884-01-05T00:00:00Z,A NEW BASE-BALL LEAGUE.; THE UNION CLUBS CHANGE THEIR NAME TO THE EASTERN LEAGUE.,https://query.nytimes.com/gst/abstract.html?res=9F07E4DA1538E033A25756C0A9679C94659FD7CF,0
1884-01-05T00:00:00Z,HOW THEY LOST THEIR EYESIGHT.,https://query.nytimes.com/gst/abstract.html?res=9F01E4DA1538E033A25756C0A9679C94659FD7CF,0
1884-01-05T00:00:00Z,MORTALITY OF MONTREAL.,https://query.nytimes.com/gst/abstract.html?res=9D0DE3DA1538E033A25756C0A9679C94659FD7CF,0
