pub_date,main_headline,article_url,classification
1884-01-01T00:00:00Z,RAILROADS OBJECTING TO TAXATION.,https://query.nytimes.com/gst/abstract.html?res=9A00E1DB1538E033A25752C0A9679C94659FD7CF,0
1884-01-01T00:00:00Z,SALE OF A FAMOUS CLIPPER SHIP.,https://query.nytimes.com/gst/abstract.html?res=9906E2DB1538E033A25752C0A9679C94659FD7CF,0
1884-01-01T00:00:00Z,MR. MACKAY ELECTED PRESIDENT.,https://query.nytimes.com/gst/abstract.html?res=9B00E1DB1538E033A25752C0A9679C94659FD7CF,0
1884-01-01T00:00:00Z,A NEWLY DISCOVERED GOLD MINE.,https://query.nytimes.com/gst/abstract.html?res=9D04E1DB1538E033A25752C0A9679C94659FD7CF,0
1884-01-01T00:00:00Z,Editorial Article 7 -- No Title,https://query.nytimes.com/gst/abstract.html?res=9E0DE2DB1538E033A25752C0A9679C94659FD7CF,0
1884-01-01T00:00:00Z,SOPHIA M. FUNK THE LAWFUL WIDOW.,https://query.nytimes.com/gst/abstract.html?res=9A06E2DB1538E033A25752C0A9679C94659FD7CF,0
1884-01-01T00:00:00Z,JOHN F. DELAPLAINE SERIOUSLY ILL.,https://query.nytimes.com/gst/abstract.html?res=9405E1DB1538E033A25752C0A9679C94659FD7CF,0
1884-01-01T00:00:00Z,CROWDS AT THE SAVINGS BANKS.; WORKING PEOPLE DEPOSITING THEIR MONEY BEFORE THE FIRST OF THE YEAR.,https://query.nytimes.com/gst/abstract.html?res=9A01E2DB1538E033A25752C0A9679C94659FD7CF,0
1884-01-01T00:00:00Z,NOMINATED AND REJECTED.; THE UNDERSTANDING UNDER WHICH JUSTICE GARDNER WAS NOMINATED.,https://query.nytimes.com/gst/abstract.html?res=9A03E1DB1538E033A25752C0A9679C94659FD7CF,0
1884-01-01T00:00:00Z,"WOMAN SUFFRAGE IN WYOMING.; THE ""TIMES'S"" LETTERS STIRRING UP THE SUBJECT IN THE TERRITORY.",https://query.nytimes.com/gst/abstract.html?res=9C07E1DB1538E033A25752C0A9679C94659FD7CF,0
1884-01-01T00:00:00Z,ANXIOUS TO AVOID WAR; CHINA WILLING TO MAKE CONCESSIONS IN TONQUIN.A CONCILIATORY SPIRIT EVINCED BY THEPEKIN GOVERNMENT--THE DUTY OF THE UNITED STATES.,https://query.nytimes.com/gst/abstract.html?res=9B03E3DB1538E033A25752C0A9679C94659FD7CF,0
1884-01-01T00:00:00Z,THE RIOTING IN NEWFOUNDLAND.; COWARDLY CONDUCT OF SOME OF THE ORANGEMEN--DANGER TO LIFE.,https://query.nytimes.com/gst/abstract.html?res=9A05E1DB1538E033A25752C0A9679C94659FD7CF,0
1884-01-01T00:00:00Z,STABBED BY AN INSANE PATIENT.,https://query.nytimes.com/gst/abstract.html?res=9407E1DB1538E033A25752C0A9679C94659FD7CF,0
1884-01-01T00:00:00Z,CURRENT FOREIGN TOPICS.,https://query.nytimes.com/gst/abstract.html?res=9F02E3DB1538E033A25752C0A9679C94659FD7CF,0
1884-01-01T00:00:00Z,Editorial Article 4 -- No Title,https://query.nytimes.com/gst/abstract.html?res=9F02E2DB1538E033A25752C0A9679C94659FD7CF,0
1884-01-01T00:00:00Z,Article 2 -- No Title,https://query.nytimes.com/gst/abstract.html?res=9B0DE2DB1538E033A25752C0A9679C94659FD7CF,0
1884-01-01T00:00:00Z,AN OUTLAW ARRESTED.,https://query.nytimes.com/gst/abstract.html?res=9C07E2DB1538E033A25752C0A9679C94659FD7CF,0
1884-01-01T00:00:00Z,HEAVY FAILURES IN ENGLAND.,https://query.nytimes.com/gst/abstract.html?res=9D02E3DB1538E033A25752C0A9679C94659FD7CF,0
1884-01-01T00:00:00Z,VIOLENT GALES AT SEA.; INCOMING VESSELS REPORT LIFE-BOATS SMASHED AND SAILS BLOWN AWAY.,https://query.nytimes.com/gst/abstract.html?res=9E01E2DB1538E033A25752C0A9679C94659FD7CF,0
1884-01-01T00:00:00Z,FALLING IN THE RIVER WITH A CHILD.,https://query.nytimes.com/gst/abstract.html?res=9C04E2DB1538E033A25752C0A9679C94659FD7CF,0
1884-01-01T00:00:00Z,THE FREETHINKERS' CONVENTION.,https://query.nytimes.com/gst/abstract.html?res=9905E2DB1538E033A25752C0A9679C94659FD7CF,0
1884-01-01T00:00:00Z,THE MINSTREL FESTIVAL.; THE HALL LESS THAN HALF FULL ON THE OPENING NIGHT.,https://query.nytimes.com/gst/abstract.html?res=990DE3DB1538E033A25752C0A9679C94659FD7CF,0
1884-01-01T00:00:00Z,Article 1 -- No Title,https://query.nytimes.com/gst/abstract.html?res=980DE2DB1538E033A25752C0A9679C94659FD7CF,0
1884-01-01T00:00:00Z,MARINE INTELLIGENCE.; CLEARED. ARRIVED. SAILED. SPOKEN. BY CABLE.,https://query.nytimes.com/gst/abstract.html?res=9403E1DB1538E033A25752C0A9679C94659FD7CF,0
1884-01-01T00:00:00Z,A COMET WITH TWO TAILS.,https://query.nytimes.com/gst/abstract.html?res=9C0CE2DB1538E033A25752C0A9679C94659FD7CF,0
1884-01-01T00:00:00Z,ATTACHED BY THE SHERIFF.,https://query.nytimes.com/gst/abstract.html?res=9F05E2DB1538E033A25752C0A9679C94659FD7CF,0
1884-01-01T00:00:00Z,FATALLY SHOT BY HIS BROTHER.,https://query.nytimes.com/gst/abstract.html?res=940DE3DB1538E033A25752C0A9679C94659FD7CF,0
1884-01-01T00:00:00Z,"BUTCHER-CARTTHIEVES AT WORK.; AN EMPLOYE OF DWIGHT & CO. ROBBED OF $2,300 IN HARLEM IN BROAD DAYLIGHT.",https://query.nytimes.com/gst/abstract.html?res=9E06E2DB1538E033A25752C0A9679C94659FD7CF,0
1884-01-01T00:00:00Z,HINTS TO CALLERS.,https://query.nytimes.com/gst/abstract.html?res=9D0DE2DB1538E033A25752C0A9679C94659FD7CF,0
1884-01-01T00:00:00Z,MARIE COLOMBIER'S BOOK.,https://query.nytimes.com/gst/abstract.html?res=9F04E2DB1538E033A25752C0A9679C94659FD7CF,0
1884-01-01T00:00:00Z,THE RAPID TRANSIT QUESTION.; OFFERING ELEVATED ROAD PLANS AND ASKING FOR MORE STREET CARS.,https://query.nytimes.com/gst/abstract.html?res=9C06E1DB1538E033A25752C0A9679C94659FD7CF,0
1884-01-01T00:00:00Z,GENERAL TELEGRAPH NEWS; LAWYERS AT LOGGERHEADS. A PROMINENT LAWYER CALLED A LIAR BY THE OPPOSING COUNSEL.,https://query.nytimes.com/gst/abstract.html?res=980CE2DB1538E033A25752C0A9679C94659FD7CF,0
1884-01-01T00:00:00Z,Marriage Announcement 1 -- No Title,https://query.nytimes.com/gst/abstract.html?res=9806E1DB1538E033A25752C0A9679C94659FD7CF,0
1884-01-01T00:00:00Z,DECREASED REVENUES.,https://query.nytimes.com/gst/abstract.html?res=9E0DE3DB1538E033A25752C0A9679C94659FD7CF,0
1884-01-01T00:00:00Z,TO BUY THE CONNOTTON VALLEY.,https://query.nytimes.com/gst/abstract.html?res=9E0CE3DB1538E033A25752C0A9679C94659FD7CF,0
1884-01-01T00:00:00Z,STILL SEEKING A PARDON; FITZ JOHN PORTER'S CASE AGAIN REVIVED. THE HOUSE COMMITTEE ON MILITARY AFFAIRS VOTES TO REPORT THE OLD RELIEF BILL--ITS PROSPECTS OF SUCCESS.,https://query.nytimes.com/gst/abstract.html?res=9C0DE3DB1538E033A25752C0A9679C94659FD7CF,0
1884-01-01T00:00:00Z,AMUSEMENT NOTES.,https://query.nytimes.com/gst/abstract.html?res=9404E1DB1538E033A25752C0A9679C94659FD7CF,0
1884-01-01T00:00:00Z,THE MAN WHO MARRIED HIS NIECE.; HE CONSENTS TO GIVE UP HIS BRIDE AND SHE RETURNS HOME.,https://query.nytimes.com/gst/abstract.html?res=940CE2DB1538E033A25752C0A9679C94659FD7CF,0
1884-01-01T00:00:00Z,EXTENDED AT REDUCED INTEREST.,https://query.nytimes.com/gst/abstract.html?res=9F05E1DB1538E033A25752C0A9679C94659FD7CF,0
1884-01-01T00:00:00Z,SPEAKER SHEARD.,https://query.nytimes.com/gst/abstract.html?res=9B02E2DB1538E033A25752C0A9679C94659FD7CF,0
1884-01-01T00:00:00Z,WORK OF THE BUREAU OF PERMITS.,https://query.nytimes.com/gst/abstract.html?res=9501E2DB1538E033A25752C0A9679C94659FD7CF,0
1884-01-01T00:00:00Z,A RECEIVER FOR GILLIES & CO.,https://query.nytimes.com/gst/abstract.html?res=9900E2DB1538E033A25752C0A9679C94659FD7CF,0
1884-01-01T00:00:00Z,THE LATE GEORGE W. LANE.,https://query.nytimes.com/gst/abstract.html?res=9C03E1DB1538E033A25752C0A9679C94659FD7CF,0
1884-01-01T00:00:00Z,CATTLE IN CHICAGO.,https://query.nytimes.com/gst/abstract.html?res=9500E2DB1538E033A25752C0A9679C94659FD7CF,0
1884-01-01T00:00:00Z,DEATH OF AN ORANG-OUTANG.,https://query.nytimes.com/gst/abstract.html?res=9B0CE2DB1538E033A25752C0A9679C94659FD7CF,0
1884-01-01T00:00:00Z,STREAMS SWOLLEN BY RAINS.,https://query.nytimes.com/gst/abstract.html?res=9804E2DB1538E033A25752C0A9679C94659FD7CF,0
1884-01-01T00:00:00Z,THE WIFE'S CONFESSIONS NOT ENOUGH.,https://query.nytimes.com/gst/abstract.html?res=9F04E1DB1538E033A25752C0A9679C94659FD7CF,0
1884-01-01T00:00:00Z,SEDATE STOCK-BROKERS.,https://query.nytimes.com/gst/abstract.html?res=9E03E1DB1538E033A25752C0A9679C94659FD7CF,0
1884-01-01T00:00:00Z,THE INTER-COLONIAL LINES.,https://query.nytimes.com/gst/abstract.html?res=9F0CE3DB1538E033A25752C0A9679C94659FD7CF,0
1884-01-01T00:00:00Z,Editorial Article 1 -- No Title,https://query.nytimes.com/gst/abstract.html?res=9C02E2DB1538E033A25752C0A9679C94659FD7CF,0
1884-01-01T00:00:00Z,THE YEAR PAST.,https://query.nytimes.com/gst/abstract.html?res=9C0DE2DB1538E033A25752C0A9679C94659FD7CF,0
1884-01-01T00:00:00Z,CATHOLIC BISHOPS' MEETING.,https://query.nytimes.com/gst/abstract.html?res=9E02E3DB1538E033A25752C0A9679C94659FD7CF,0
1884-01-01T00:00:00Z,EATING POISONED EGGS.,https://query.nytimes.com/gst/abstract.html?res=9C05E1DB1538E033A25752C0A9679C94659FD7CF,0
1884-01-01T00:00:00Z,PERSONAL INTELLIGENCE.,https://query.nytimes.com/gst/abstract.html?res=9D01E2DB1538E033A25752C0A9679C94659FD7CF,0
1884-01-01T00:00:00Z,CHANGES IN WALL-STREET FIRMS.,https://query.nytimes.com/gst/abstract.html?res=9D03E1DB1538E033A25752C0A9679C94659FD7CF,0
1884-01-01T00:00:00Z,THE WILL OF CHARLES A. COE.,https://query.nytimes.com/gst/abstract.html?res=9401E2DB1538E033A25752C0A9679C94659FD7CF,0
1884-01-01T00:00:00Z,IN THE INSURANCE WORLD; FIRE COMPANIES STRUGGLING WITH UNPLEASANT PROBLEMS. THE RESULTS OF THE PAST YEAR NOT ENCOURAGING--THE LIFE COMPANIES GENERALLY VERY PROSPEROUS.,https://query.nytimes.com/gst/abstract.html?res=950CE3DB1538E033A25752C0A9679C94659FD7CF,0
1884-01-01T00:00:00Z,EXAMINING INSURANCE COMPANIES.,https://query.nytimes.com/gst/abstract.html?res=9E04E1DB1538E033A25752C0A9679C94659FD7CF,0
1884-01-01T00:00:00Z,BROOKLYN ALDERMEN'S ACTS.; ELECTRIC LIGHT COMPANIES AND A LOBBYIST'S ALLEGED OFFER.,https://query.nytimes.com/gst/abstract.html?res=9D00E2DB1538E033A25752C0A9679C94659FD7CF,0
1884-01-01T00:00:00Z,NOTES OF VARIOUS INTERESTS.,https://query.nytimes.com/gst/abstract.html?res=980CE3DB1538E033A25752C0A9679C94659FD7CF,0
1884-01-01T00:00:00Z,CHINAMEN AND A DEFAULTER PARDONED.,https://query.nytimes.com/gst/abstract.html?res=9805E1DB1538E033A25752C0A9679C94659FD7CF,0
1884-01-01T00:00:00Z,SAVING TWO OF THE THREE BOYS.,https://query.nytimes.com/gst/abstract.html?res=9D04E2DB1538E033A25752C0A9679C94659FD7CF,0
1884-01-01T00:00:00Z,NOTES FROM WASHINGTON.,https://query.nytimes.com/gst/abstract.html?res=980DE3DB1538E033A25752C0A9679C94659FD7CF,0
1884-01-01T00:00:00Z,VILLARD'S GREAT SCHEMES; THE REPORT ON OREGON AND TRANSCONTINENTAL. THE SHOW OF ASSETS AND LIABILITIES-- TALK ABOUT THE STATE OF MR. VILLARD'S ENTERPRISES AND HIS RESIGNATION FROM NORTHERN PACIFIC.,https://query.nytimes.com/gst/abstract.html?res=9C0CE3DB1538E033A25752C0A9679C94659FD7CF,0
1884-01-01T00:00:00Z,ARRESTED FOR THE MURDER OF A NEGRO.,https://query.nytimes.com/gst/abstract.html?res=9B07E2DB1538E033A25752C0A9679C94659FD7CF,0
1884-01-01T00:00:00Z,TROUBLE IN THE COAL-FIELDS.,https://query.nytimes.com/gst/abstract.html?res=9B02E3DB1538E033A25752C0A9679C94659FD7CF,0
1884-01-01T00:00:00Z,ENGULFED BY AN AVALANCHE.,https://query.nytimes.com/gst/abstract.html?res=9B05E2DB1538E033A25752C0A9679C94659FD7CF,0
1884-01-01T00:00:00Z,ARREST OF THREE SWINDLERS.,https://query.nytimes.com/gst/abstract.html?res=9800E2DB1538E033A25752C0A9679C94659FD7CF,0
1884-01-01T00:00:00Z,TWO NOTORIOUS CHARACTERS SHOT.,https://query.nytimes.com/gst/abstract.html?res=9D07E2DB1538E033A25752C0A9679C94659FD7CF,0
1884-01-01T00:00:00Z,SINKING OF A STEAMER.,https://query.nytimes.com/gst/abstract.html?res=950CE2DB1538E033A25752C0A9679C94659FD7CF,0
1884-01-01T00:00:00Z,A MURDERER RESPITED.,https://query.nytimes.com/gst/abstract.html?res=9807E1DB1538E033A25752C0A9679C94659FD7CF,0
1884-01-01T00:00:00Z,JAMES BUDD STILL ALIVE.,https://query.nytimes.com/gst/abstract.html?res=9A05E2DB1538E033A25752C0A9679C94659FD7CF,0
1884-01-01T00:00:00Z,Obituary 1 -- No Title,https://query.nytimes.com/gst/abstract.html?res=9807E2DB1538E033A25752C0A9679C94659FD7CF,0
1884-01-01T00:00:00Z,MR. PANIZZA STILL IN A DUNGEON CELL.,https://query.nytimes.com/gst/abstract.html?res=9C01E2DB1538E033A25752C0A9679C94659FD7CF,0
1884-01-01T00:00:00Z,POLITICS IN OREGON.,https://query.nytimes.com/gst/abstract.html?res=9E05E2DB1538E033A25752C0A9679C94659FD7CF,0
1884-01-01T00:00:00Z,A DOCTOR SEEKING DAMAGES.,https://query.nytimes.com/gst/abstract.html?res=9402E3DB1538E033A25752C0A9679C94659FD7CF,0
1884-01-01T00:00:00Z,A THEATRICAL COMPANY STRANDED.,https://query.nytimes.com/gst/abstract.html?res=9903E3DB1538E033A25752C0A9679C94659FD7CF,0
1884-01-01T00:00:00Z,"THE NEW YEAR ON HAND.; COMING IN PROMPTLY, BUT IN THE MIDST OF A HIDEOUS DIN.",https://query.nytimes.com/gst/abstract.html?res=9405E2DB1538E033A25752C0A9679C94659FD7CF,0
1884-01-01T00:00:00Z,PANIC ON THE STEAM-SHIP EDAM.; THE SERIOUS CONSEQUENCES OF YOUNG ESTLIN'S BAD DREAM.,https://query.nytimes.com/gst/abstract.html?res=9B01E2DB1538E033A25752C0A9679C94659FD7CF,0
1884-01-01T00:00:00Z,"TAKING DIAMONDS WORTH $35,000.; THE TRAVELING MAN OF GOLDSMITH & KUHN DISAPPEARS.",https://query.nytimes.com/gst/abstract.html?res=9A04E2DB1538E033A25752C0A9679C94659FD7CF,0
1884-01-01T00:00:00Z,AMUSEMENTS.; ITALIAN OPERA AT THE ACADEMY.,https://query.nytimes.com/gst/abstract.html?res=9904E1DB1538E033A25752C0A9679C94659FD7CF,0
1884-01-01T00:00:00Z,Editorial Article 2 -- No Title,https://query.nytimes.com/gst/abstract.html?res=9D02E2DB1538E033A25752C0A9679C94659FD7CF,0
1884-01-01T00:00:00Z,POLITICAL DISCUSSION IN CANADA.; SOME OF THE GENTLE TERMS USED BY OUR PEACEFUL FRIENDS OVER THE BORDER.,https://query.nytimes.com/gst/abstract.html?res=9D05E2DB1538E033A25752C0A9679C94659FD7CF,0
1884-01-01T00:00:00Z,A FALLING OFF IN THE IMMIGRATION.,https://query.nytimes.com/gst/abstract.html?res=9801E2DB1538E033A25752C0A9679C94659FD7CF,0
1884-01-01T00:00:00Z,OBSCENE PICTORIAL PAPERS.,https://query.nytimes.com/gst/abstract.html?res=9A0DE3DB1538E033A25752C0A9679C94659FD7CF,0
1884-01-01T00:00:00Z,Obituary 2 -- No Title,https://query.nytimes.com/gst/abstract.html?res=9906E1DB1538E033A25752C0A9679C94659FD7CF,0
1884-01-01T00:00:00Z,RESIGNING TO BECOME REGISTER.,https://query.nytimes.com/gst/abstract.html?res=9F06E2DB1538E033A25752C0A9679C94659FD7CF,0
1884-01-01T00:00:00Z,MR. HIBBARD ON THE WRONG SIDE.,https://query.nytimes.com/gst/abstract.html?res=9F01E2DB1538E033A25752C0A9679C94659FD7CF,0
1884-01-01T00:00:00Z,"OBJECTING TO PAY TAXES.; PHILADELPHIA, Dec. 31.--Upon application of a number of insurance, trust, and safe deposit companies of this city, the Court of Common Pleas to-day granted special injunctions restraining the Board of Revision of Taxes from making any assessment of the personal assets, ...",https://query.nytimes.com/gst/abstract.html?res=9A0CE2DB1538E033A25752C0A9679C94659FD7CF,0
1884-01-01T00:00:00Z,OUR BRIGANDS.,https://query.nytimes.com/gst/abstract.html?res=9F0DE2DB1538E033A25752C0A9679C94659FD7CF,0
1884-01-01T00:00:00Z,EMORY SPEER'S ENEMIES.; WHY THE SOUTH CAROLINA SENATORS ARE WORKING AGAINST HIS CONFIRMATION.,https://query.nytimes.com/gst/abstract.html?res=9F0DE3DB1538E033A25752C0A9679C94659FD7CF,0
1884-01-01T00:00:00Z,HEALTH DEPARTMENT CHANGES.,https://query.nytimes.com/gst/abstract.html?res=9E00E2DB1538E033A25752C0A9679C94659FD7CF,0
1884-01-01T00:00:00Z,SONS OF THE REVOLUTION.; FORMING A NEW SOCIETY AT THE OLD FRAUNCES'S TAVERN.,https://query.nytimes.com/gst/abstract.html?res=9E06E1DB1538E033A25752C0A9679C94659FD7CF,0
1884-01-01T00:00:00Z,FOR MRS. AND MISS HOYT.,https://query.nytimes.com/gst/abstract.html?res=9507E1DB1538E033A25752C0A9679C94659FD7CF,0
1884-01-01T00:00:00Z,THE ROW AMONG QUEBEC CATHOLICS.,https://query.nytimes.com/gst/abstract.html?res=9803E3DB1538E033A25752C0A9679C94659FD7CF,0
1884-01-01T00:00:00Z,UNABLE TO DEPOSIT THEIR MAIL.,https://query.nytimes.com/gst/abstract.html?res=9D06E2DB1538E033A25752C0A9679C94659FD7CF,0
1884-01-01T00:00:00Z,GRAVES AND MARTIN DOOMED.; THE COURT OF PARDONS DECLINES TO INTERFERE IN THEIR CASE.,https://query.nytimes.com/gst/abstract.html?res=9B04E2DB1538E033A25752C0A9679C94659FD7CF,0
1884-01-01T00:00:00Z,THE ST. LOUIS GAMBLING RING.; CHIEF CAMPBELL'S FIGHT WITH THE POLICE BOARD--THE RING STILL ACTIVE.,https://query.nytimes.com/gst/abstract.html?res=9B05E1DB1538E033A25752C0A9679C94659FD7CF,0
1884-01-01T00:00:00Z,DEFENDING ORANGE COUNTY MILK; WHAT A DAIRYMAN SAYS OF THE ARTICLE SUPPLIED TO THE CITY.,https://query.nytimes.com/gst/abstract.html?res=9500E1DB1538E033A25752C0A9679C94659FD7CF,0
1884-01-01T00:00:00Z,AMUSEMENTS THIS EVENING.,https://query.nytimes.com/gst/abstract.html?res=9503E2DB1538E033A25752C0A9679C94659FD7CF,0
1884-01-01T00:00:00Z,ROBBING ALL HIS BENEFACTORS.,https://query.nytimes.com/gst/abstract.html?res=9F00E2DB1538E033A25752C0A9679C94659FD7CF,0
1884-01-01T00:00:00Z,ATHLETICS OF EVERY KIND.; THE WILLIAMSBURG CLUB MEMBERS ENTERTAINING THEIR FRIENDS.,https://query.nytimes.com/gst/abstract.html?res=9907E2DB1538E033A25752C0A9679C94659FD7CF,0
1884-01-01T00:00:00Z,CITY AND SUBURBAN NEWS; NEW-YORK. BROOKLYN. WESTCHESTER COUNTY. NEW-JERSEY.,https://query.nytimes.com/gst/abstract.html?res=9400E2DB1538E033A25752C0A9679C94659FD7CF,0
1884-01-01T00:00:00Z,REPUBLICANISM IN SPAIN.; SENOR SAGASTA'S INCREASED STRENGTH-- GEN. DOMINGUEZ'S POLICY.,https://query.nytimes.com/gst/abstract.html?res=9503E3DB1538E033A25752C0A9679C94659FD7CF,0
1884-01-01T00:00:00Z,HIGH OPINION OF THE STATE SENATE.,https://query.nytimes.com/gst/abstract.html?res=9805E2DB1538E033A25752C0A9679C94659FD7CF,0
1884-01-01T00:00:00Z,THE CHICAGO PRODUCE MARKET.,https://query.nytimes.com/gst/abstract.html?res=9B00E2DB1538E033A25752C0A9679C94659FD7CF,0
1884-01-01T00:00:00Z,THE WOOL-GROWERS' INTERESTS.,https://query.nytimes.com/gst/abstract.html?res=9505E1DB1538E033A25752C0A9679C94659FD7CF,0
1884-01-01T00:00:00Z,DEATH FROM A DOG'S BITE.,https://query.nytimes.com/gst/abstract.html?res=9803E1DB1538E033A25752C0A9679C94659FD7CF,0
1884-01-01T00:00:00Z,THE CHURCHES IN 1883.,https://query.nytimes.com/gst/abstract.html?res=9E0CE2DB1538E033A25752C0A9679C94659FD7CF,0
1884-01-01T00:00:00Z,EXECUTORS' FEES REDUCED.,https://query.nytimes.com/gst/abstract.html?res=9504E2DB1538E033A25752C0A9679C94659FD7CF,0
1884-01-01T00:00:00Z,THE LEGAL TENDER CASE.,https://query.nytimes.com/gst/abstract.html?res=9D0DE3DB1538E033A25752C0A9679C94659FD7CF,0
1884-01-01T00:00:00Z,THE IRISH FOR IRELAND.,https://query.nytimes.com/gst/abstract.html?res=9502E2DB1538E033A25752C0A9679C94659FD7CF,0
1884-01-01T00:00:00Z,CONJECTURES AS TO THE CELTIC.,https://query.nytimes.com/gst/abstract.html?res=9806E2DB1538E033A25752C0A9679C94659FD7CF,0
1884-01-01T00:00:00Z,A CHILD BURNED TO DEATH.,https://query.nytimes.com/gst/abstract.html?res=9905E1DB1538E033A25752C0A9679C94659FD7CF,0
1884-01-01T00:00:00Z,THE ORANGE WAR IN IRELAND.,https://query.nytimes.com/gst/abstract.html?res=9C02E3DB1538E033A25752C0A9679C94659FD7CF,0
1884-01-01T00:00:00Z,PRINCE HENRY OF GERMANY.,https://query.nytimes.com/gst/abstract.html?res=9D05E1DB1538E033A25752C0A9679C94659FD7CF,0
1884-01-01T00:00:00Z,THE BIDDEFORD MYSTERY.,https://query.nytimes.com/gst/abstract.html?res=9504E1DB1538E033A25752C0A9679C94659FD7CF,0
1884-01-01T00:00:00Z,A WOMAN'S SUSPICIOUS DEATH.,https://query.nytimes.com/gst/abstract.html?res=9505E2DB1538E033A25752C0A9679C94659FD7CF,0
1884-01-01T00:00:00Z,A CHANGE IN AN OLD FIRM.,https://query.nytimes.com/gst/abstract.html?res=9907E1DB1538E033A25752C0A9679C94659FD7CF,0
1884-01-01T00:00:00Z,APPOINTED BISHOP OF MOBILE.,https://query.nytimes.com/gst/abstract.html?res=9D0CE2DB1538E033A25752C0A9679C94659FD7CF,0
1884-01-01T00:00:00Z,CAPT. GASTLIN APPRECIATED.; A HANDSOME GOLD SHIELD PRESENTED BY TRANSPORTATION AND OTHER LINES.,https://query.nytimes.com/gst/abstract.html?res=9506E2DB1538E033A25752C0A9679C94659FD7CF,0
1884-01-01T00:00:00Z,CORRY CITY BONDS ILLEGAL.,https://query.nytimes.com/gst/abstract.html?res=9B0CE3DB1538E033A25752C0A9679C94659FD7CF,0
1884-01-01T00:00:00Z,JUDGE BARRETT'S PLAY.,https://query.nytimes.com/gst/abstract.html?res=9804E1DB1538E033A25752C0A9679C94659FD7CF,0
1884-01-01T00:00:00Z,FRENCH OPERA-BOUFFE.,https://query.nytimes.com/gst/abstract.html?res=9A04E1DB1538E033A25752C0A9679C94659FD7CF,0
1884-01-01T00:00:00Z,SUICIDE OF A HARVARD STUDENT.; CONWAY R. BROWN PUTS A BULLET THROUGH HIS HEART.,https://query.nytimes.com/gst/abstract.html?res=9A02E3DB1538E033A25752C0A9679C94659FD7CF,0
1884-01-01T00:00:00Z,THE GRAIN TRADE IN ENGLAND.,https://query.nytimes.com/gst/abstract.html?res=9507E2DB1538E033A25752C0A9679C94659FD7CF,0
1884-01-01T00:00:00Z,DRAGGED FROM THE PULPIT.; A MINISTER WHO HAD TO MAKE A HASTY RETREAT FROM THE CHURCH.,https://query.nytimes.com/gst/abstract.html?res=9902E3DB1538E033A25752C0A9679C94659FD7CF,0
1884-01-01T00:00:00Z,MR. PROVOST TO BE HEARD.; JUSTICE DUFFY ON SUNDAY EXHIBITIONS AT THE ACADEMY OF DESIGN.,https://query.nytimes.com/gst/abstract.html?res=9400E1DB1538E033A25752C0A9679C94659FD7CF,0
1884-01-01T00:00:00Z,A FALSE WHISKY TAX STORY.; A CHARGE OF CORRUPTION DENIED BY COMMISSIONER EVANS.,https://query.nytimes.com/gst/abstract.html?res=9502E3DB1538E033A25752C0A9679C94659FD7CF,0
1884-01-01T00:00:00Z,Editorial Article 5 -- No Title,https://query.nytimes.com/gst/abstract.html?res=9802E2DB1538E033A25752C0A9679C94659FD7CF,0
1884-01-01T00:00:00Z,THE CITY APPROPRIATIONS.,https://query.nytimes.com/gst/abstract.html?res=9A02E2DB1538E033A25752C0A9679C94659FD7CF,0
1884-01-01T00:00:00Z,THE ADIRONDACK FORESTS.; THE VISIT OF THE CHAMBER OF COMMERCE COMMITTEE TO ALBANY.,https://query.nytimes.com/gst/abstract.html?res=9B06E2DB1538E033A25752C0A9679C94659FD7CF,0
1884-01-01T00:00:00Z,A PROMISING MINING FIELD.,https://query.nytimes.com/gst/abstract.html?res=9A0CE3DB1538E033A25752C0A9679C94659FD7CF,0
1884-01-01T00:00:00Z,BUSINESS AT THE SUB-TREASURY.,https://query.nytimes.com/gst/abstract.html?res=9A07E2DB1538E033A25752C0A9679C94659FD7CF,0
1884-01-01T00:00:00Z,A NEW-YORK PILOT MISSING.,https://query.nytimes.com/gst/abstract.html?res=9B06E1DB1538E033A25752C0A9679C94659FD7CF,0
1884-01-01T00:00:00Z,A CLERGYMAN ASSASSINATED.,https://query.nytimes.com/gst/abstract.html?res=9F07E1DB1538E033A25752C0A9679C94659FD7CF,0
1884-01-01T00:00:00Z,FAILURES IN CANADA.,https://query.nytimes.com/gst/abstract.html?res=9C04E1DB1538E033A25752C0A9679C94659FD7CF,0
1884-01-01T00:00:00Z,"MR. SHREARD TO BE SPEAKER; CHOSEN BY THE REPUBLICANS ON THE FIRST BALLOT. MR. ROOSEVELT SUPPORTED BY MR. ERWIN, BUT DESERTED BY MEN WHO HAD PROMISED HIM AID.",https://query.nytimes.com/gst/abstract.html?res=9A03E3DB1538E033A25752C0A9679C94659FD7CF,0
1884-01-01T00:00:00Z,THE PARK BOARD PROTESTING.; COMPLAINING OF MISREPRESENTATIONS AND ASKING AN EXAMINATION.,https://query.nytimes.com/gst/abstract.html?res=9A00E2DB1538E033A25752C0A9679C94659FD7CF,0
1884-01-01T00:00:00Z,TRACKS DANGEROUS TO HORSES.; MR. BERGH'S COMPLAINT AGAINST TWO STREET RAILROAD COMPANIES.,https://query.nytimes.com/gst/abstract.html?res=9C00E2DB1538E033A25752C0A9679C94659FD7CF,0
1884-01-01T00:00:00Z,A MORAL WAX-WORK SHOW; TO OCCUPY THE NEW BUILDING IN TWENTY-THIRD-STREET. MORE AMUSEMENT FOR NEW-YORKERS-- BAD BUSINESS IN SOME BROADWAY THEATRES--A FALSE RUMOR.,https://query.nytimes.com/gst/abstract.html?res=9406E2DB1538E033A25752C0A9679C94659FD7CF,0
1884-01-01T00:00:00Z,BUSINESS EMBARRASSMENTS.,https://query.nytimes.com/gst/abstract.html?res=9404E2DB1538E033A25752C0A9679C94659FD7CF,0
1884-01-01T00:00:00Z,MR. BOOTH AS MACBETH.,https://query.nytimes.com/gst/abstract.html?res=9B04E1DB1538E033A25752C0A9679C94659FD7CF,0
1884-01-01T00:00:00Z,LIFE INSURANCE.,https://query.nytimes.com/gst/abstract.html?res=940CE3DB1538E033A25752C0A9679C94659FD7CF,0
1884-01-01T00:00:00Z,FAILURE OF A LACE-DEALER.,https://query.nytimes.com/gst/abstract.html?res=9B07E1DB1538E033A25752C0A9679C94659FD7CF,0
1884-01-01T00:00:00Z,THE LEGISLATIVE SEASON.,https://query.nytimes.com/gst/abstract.html?res=9A0DE2DB1538E033A25752C0A9679C94659FD7CF,0
1884-01-01T00:00:00Z,"THE CITY BUDGET SIGNED; THE BOARD OBLIGED TO YIELD TO MR. ASTEN'S FIRMNESS. FIGHT OVER THE COMMISSIONERS OF ACCOUNTS--AN INCREASE OF $3,369,379.81OVER APPROPRIATIONS OF LAST YEAR.",https://query.nytimes.com/gst/abstract.html?res=9900E1DB1538E033A25752C0A9679C94659FD7CF,0
1884-01-01T00:00:00Z,Editorial Article 6 -- No Title,https://query.nytimes.com/gst/abstract.html?res=9902E2DB1538E033A25752C0A9679C94659FD7CF,0
1884-01-01T00:00:00Z,WINDING UP SEVERAL POOLS.; THE MEETING OF THE MANAGERS OF IOWA POOL LINES IN CHICAGO.,https://query.nytimes.com/gst/abstract.html?res=9D0CE3DB1538E033A25752C0A9679C94659FD7CF,0
1884-01-01T00:00:00Z,ELDRIDGE F. JOHNSON'S MURDER.,https://query.nytimes.com/gst/abstract.html?res=9C05E2DB1538E033A25752C0A9679C94659FD7CF,0
1884-01-01T00:00:00Z,LACKAWANNA AND WEST SHORE.,https://query.nytimes.com/gst/abstract.html?res=950DE3DB1538E033A25752C0A9679C94659FD7CF,0
1884-01-01T00:00:00Z,POOL AND BILLIARD GAMES.; A MATCH IN PARIS BETWEEN VIGNAUX AND RUDOLPHE ENDS IN A SQUABBLE.,https://query.nytimes.com/gst/abstract.html?res=9C06E2DB1538E033A25752C0A9679C94659FD7CF,0
1884-01-01T00:00:00Z,CAPTURE OF AN EXPRESS ROBBER.,https://query.nytimes.com/gst/abstract.html?res=9E07E2DB1538E033A25752C0A9679C94659FD7CF,0
1884-01-01T00:00:00Z,SERVICES IN CATHOLIC CHURCHES.,https://query.nytimes.com/gst/abstract.html?res=9800E1DB1538E033A25752C0A9679C94659FD7CF,0
1884-01-01T00:00:00Z,BUSINESS MEN SWINDLED.,https://query.nytimes.com/gst/abstract.html?res=9D07E1DB1538E033A25752C0A9679C94659FD7CF,0
1884-01-01T00:00:00Z,FOOT-RACES AT PASTIME PARK.,https://query.nytimes.com/gst/abstract.html?res=9F03E3DB1538E033A25752C0A9679C94659FD7CF,0
1884-01-01T00:00:00Z,A HANDSOME GIFT DECLINED.,https://query.nytimes.com/gst/abstract.html?res=940DE2DB1538E033A25752C0A9679C94659FD7CF,0
1884-01-01T00:00:00Z,MOCK OBSEQUIES OF O'DONNELL.,https://query.nytimes.com/gst/abstract.html?res=9E07E1DB1538E033A25752C0A9679C94659FD7CF,0
1884-01-01T00:00:00Z,JOHNSON'S FAMILY TROUBLES.; A COMPROMISE EFFECTED AND LITIGATION TO BE STOPPED.,https://query.nytimes.com/gst/abstract.html?res=9802E3DB1538E033A25752C0A9679C94659FD7CF,0
1884-01-01T00:00:00Z,Editorial Article 3 -- No Title,https://query.nytimes.com/gst/abstract.html?res=9E02E2DB1538E033A25752C0A9679C94659FD7CF,0
1884-01-01T00:00:00Z,A WILL SET ASIDE.,https://query.nytimes.com/gst/abstract.html?res=990CE2DB1538E033A25752C0A9679C94659FD7CF,0
