pub_date,main_headline,article_url,classification
1888-01-10T00:00:00Z,GERMANY AND HER AFFAIRS.; THE ROYAL INVALIDS--THE NEW SOCIALIST MOVEMENT.,https://query.nytimes.com/gst/abstract.html?res=9B02EFD7163AE033A25753C1A9679C94699FD7CF,0
1888-01-10T00:00:00Z,A BULL FIGHT IN MEXICO; TWENTY THOUSAND SPECTATORS AROUND THE RING.MAZZANTINI'S FEATS OF PROWESS DELIGHT THE SWELL SOCIETY OF THECITY OF MEXICO.,https://query.nytimes.com/gst/abstract.html?res=9905EED7163AE033A25753C1A9679C94699FD7CF,0
1888-01-10T00:00:00Z,NO CIGARS ON THE BRIDGE.; NOT EVEN AT UNLIGHTED ONE MAY BE CARRIED INTO THE STATIONS.,https://query.nytimes.com/gst/abstract.html?res=9900E7D6163AE033A25753C1A9679C94699FD7CF,0
1888-01-10T00:00:00Z,THE CHEROKEE WRANGLE ENDED.,https://query.nytimes.com/gst/abstract.html?res=9C05EED7163AE033A25753C1A9679C94699FD7CF,0
1888-01-10T00:00:00Z,INSURANCE AGENTS ACCUSED.,https://query.nytimes.com/gst/abstract.html?res=9805EED7163AE033A25753C1A9679C94699FD7CF,0
1888-01-10T00:00:00Z,THE DANGERS OF COASTING.,https://query.nytimes.com/gst/abstract.html?res=9A0CEFD7163AE033A25753C1A9679C94699FD7CF,0
1888-01-10T00:00:00Z,SEATS IN A BOSTON EXCHANGE.,https://query.nytimes.com/gst/abstract.html?res=9504EED7163AE033A25753C1A9679C94699FD7CF,0
1888-01-10T00:00:00Z,Editorial Article 1 -- No Title,https://query.nytimes.com/gst/abstract.html?res=9402EED7163AE033A25753C1A9679C94699FD7CF,0
1888-01-10T00:00:00Z,AN OLD-TIMER TO THE FRONT.,https://query.nytimes.com/gst/abstract.html?res=9B03E7D6163AE033A25753C1A9679C94699FD7CF,0
1888-01-10T00:00:00Z,Editorial Article 5 -- No Title,https://query.nytimes.com/gst/abstract.html?res=9E0DEED7163AE033A25753C1A9679C94699FD7CF,0
1888-01-10T00:00:00Z,THE BARD AND EURUS ENTERED.,https://query.nytimes.com/gst/abstract.html?res=9806EED7163AE033A25753C1A9679C94699FD7CF,0
1888-01-10T00:00:00Z,AN OLD SOLDIER'S DEATH.,https://query.nytimes.com/gst/abstract.html?res=9B04EED7163AE033A25753C1A9679C94699FD7CF,0
1888-01-10T00:00:00Z,GEN. TERRY NOT SERIOUSLY ILL.,https://query.nytimes.com/gst/abstract.html?res=9D0CEFD7163AE033A25753C1A9679C94699FD7CF,0
1888-01-10T00:00:00Z,ENGLISH AND IRISH INTERESTS.; THE TORY LOCAL GOVERNMENT BILL-- MR. HARRINGTON SENTENCED.,https://query.nytimes.com/gst/abstract.html?res=9902EFD7163AE033A25753C1A9679C94699FD7CF,0
1888-01-10T00:00:00Z,PLATTS PLEA FOR DELAY.; A DAY SPENT IN ARGUING A TECHNICAL OBJECTION.,https://query.nytimes.com/gst/abstract.html?res=9E0CEED7163AE033A25753C1A9679C94699FD7CF,0
1888-01-10T00:00:00Z,A BOOKSELLER ABSCONDS.,https://query.nytimes.com/gst/abstract.html?res=9C04E7D6163AE033A25753C1A9679C94699FD7CF,0
1888-01-10T00:00:00Z,THERE WAS NO TROUBLE.,https://query.nytimes.com/gst/abstract.html?res=9406EED7163AE033A25753C1A9679C94699FD7CF,0
1888-01-10T00:00:00Z,INCOMING STEAMSHIPS.,https://query.nytimes.com/gst/abstract.html?res=9D02EED7163AE033A25753C1A9679C94699FD7CF,0
1888-01-10T00:00:00Z,HIS FUNERAL TO-DAY.,https://query.nytimes.com/gst/abstract.html?res=9501E7D6163AE033A25753C1A9679C94699FD7CF,0
1888-01-10T00:00:00Z,NEWS OF THE DAY ABROAD; A MORE PEACEFUL OUTLOOK IN THE EAST. THE PRESENT CONFIDENCE NOT ENTIRELY WARRANTED--THE BONAPARTE FUNERAL--THE IRISH WAR.,https://query.nytimes.com/gst/abstract.html?res=9A02EFD7163AE033A25753C1A9679C94699FD7CF,0
1888-01-10T00:00:00Z,READING'S LARGE PROFITS; THE ANNUAL REPORT READ YESTERDAY. A MARKED INCREASE SHOWN IN EVERY DEPARTMENT--NOTHING DONE IN REGARD TO THE STRIKE.,https://query.nytimes.com/gst/abstract.html?res=9804EED7163AE033A25753C1A9679C94699FD7CF,0
1888-01-10T00:00:00Z,LAMAR SURE OF SUCCESS; DESPITE THE PETTY POLICY OF THE REPUBLICANS. MR. EVARTS TALKS AGAINST HIM--AN ADVERSE REPORT FROM THE JUDICIARY COMMITTEE MAJORITY.,https://query.nytimes.com/gst/abstract.html?res=9C0CEFD7163AE033A25753C1A9679C94699FD7CF,0
1888-01-10T00:00:00Z,Editorial Article 7 -- No Title,https://query.nytimes.com/gst/abstract.html?res=940DEED7163AE033A25753C1A9679C94699FD7CF,0
1888-01-10T00:00:00Z,COMPLAINING OF THE FOOD.,https://query.nytimes.com/gst/abstract.html?res=9B00E7D6163AE033A25753C1A9679C94699FD7CF,0
1888-01-10T00:00:00Z,A COLLEGE PRESIDENT'S REPRIMAND.,https://query.nytimes.com/gst/abstract.html?res=980CEED7163AE033A25753C1A9679C94699FD7CF,0
1888-01-10T00:00:00Z,ARMY AND NAVY NEWS.,https://query.nytimes.com/gst/abstract.html?res=9B00EED7163AE033A25753C1A9679C94699FD7CF,0
1888-01-10T00:00:00Z,THE TARIFF QUESTION.,https://query.nytimes.com/gst/abstract.html?res=9500EED7163AE033A25753C1A9679C94699FD7CF,0
1888-01-10T00:00:00Z,"""YOUNG HUTCH"" WINS.; THE NEW PRESIDENT OF THE CHICAGO BOARD OF TRADE.",https://query.nytimes.com/gst/abstract.html?res=940DEFD7163AE033A25753C1A9679C94699FD7CF,0
1888-01-11T00:00:00Z,"A ""UNION"" SWINDLER CAUGHT.",https://query.nytimes.com/gst/abstract.html?res=9403E6D6163AE033A25752C1A9679C94699FD7CF,0
1888-01-11T00:00:00Z,Editorial Article 6 -- No Title,https://query.nytimes.com/gst/abstract.html?res=9E00E5D6163AE033A25752C1A9679C94699FD7CF,0
1888-01-11T00:00:00Z,THE PURIM RECEPTION.,https://query.nytimes.com/gst/abstract.html?res=9C03E5D6163AE033A25752C1A9679C94699FD7CF,0
1888-01-11T00:00:00Z,INHALED GAS TO KILL HERSELF.,https://query.nytimes.com/gst/abstract.html?res=9E0DE6D6163AE033A25752C1A9679C94699FD7CF,0
1888-01-11T00:00:00Z,A REPUBLICAN REAPPOINTED.,https://query.nytimes.com/gst/abstract.html?res=9A02E6D6163AE033A25752C1A9679C94699FD7CF,0
1888-01-11T00:00:00Z,STEEL RAIL MILLS IDLE.; WHICH CAUSES A BIG REDUCTION IN THE DEMAND FOR COKE.,https://query.nytimes.com/gst/abstract.html?res=9B00E5D6163AE033A25752C1A9679C94699FD7CF,0
1888-01-11T00:00:00Z,A CIRCUS IN BROADWAY.; IN WHICH THE CAMEL WAS PERFORMER AND RINGMASTER.,https://query.nytimes.com/gst/abstract.html?res=990DE6D6163AE033A25752C1A9679C94699FD7CF,0
1888-01-11T00:00:00Z,SOME COMING TRIALS.,https://query.nytimes.com/gst/abstract.html?res=9C04E4D6163AE033A25752C1A9679C94699FD7CF,0
1888-01-11T00:00:00Z,BAR ASSOCIATION OFFICERS.,https://query.nytimes.com/gst/abstract.html?res=9802E5D6163AE033A25752C1A9679C94699FD7CF,0
1888-01-11T00:00:00Z,HE CLINGS TO HIS STORY.; THE MAN WHO FELL OFF A FERRYBOAT SAYS MR. HASKIN REARED HIM.,https://query.nytimes.com/gst/abstract.html?res=940CE6D6163AE033A25752C1A9679C94699FD7CF,0
1888-01-11T00:00:00Z,THE GAS HOUSE EXPLOSION.,https://query.nytimes.com/gst/abstract.html?res=9F04E4D6163AE033A25752C1A9679C94699FD7CF,0
1888-01-11T00:00:00Z,WITH A HALF MINUTE TO SPARE.,https://query.nytimes.com/gst/abstract.html?res=9400E6D6163AE033A25752C1A9679C94699FD7CF,0
1888-01-11T00:00:00Z,Marriage Announcement 1 -- No Title,https://query.nytimes.com/gst/abstract.html?res=9C0DE5D6163AE033A25752C1A9679C94699FD7CF,0
1888-01-11T00:00:00Z,MET A HORRIBLE DEATH.,https://query.nytimes.com/gst/abstract.html?res=9B02E5D6163AE033A25752C1A9679C94699FD7CF,0
1888-01-11T00:00:00Z,CHANGE OF BANK MANAGEMENT.,https://query.nytimes.com/gst/abstract.html?res=9903E6D6163AE033A25752C1A9679C94699FD7CF,0
1888-01-11T00:00:00Z,DISSATISFIED SPINNERS.; THEY DEMAND AN INCREASE IN THEIR WAGES.,https://query.nytimes.com/gst/abstract.html?res=9900E6D6163AE033A25752C1A9679C94699FD7CF,0
1888-01-11T00:00:00Z,THE WAR SCARE RENEWED; RUSSIA PUSHING FORWARD TROOPS NIGHT AND DAY. TRAFFIC ON THE RAILWAYS SERIOUSLY IMPEDED--ITALY'S BIG JOB IN ABYSSINIA--THE STARVING CROFTERS.,https://query.nytimes.com/gst/abstract.html?res=9D00E6D6163AE033A25752C1A9679C94699FD7CF,0
1888-01-11T00:00:00Z,THEY ALWAYS PAID THEIR BETS.,https://query.nytimes.com/gst/abstract.html?res=9D02E5D6163AE033A25752C1A9679C94699FD7CF,0
1888-01-11T00:00:00Z,THE MAYOR'S SUGGESTIONS; A MESSAGE DISCUSSING CITY FINANCES. THEIR PRESENT CONDITION SET FORTH AND VARIOUS DEFECTS AND THE REMEDIES THERE FOR PRESENTED.,https://query.nytimes.com/gst/abstract.html?res=9A05E4D6163AE033A25752C1A9679C94699FD7CF,0
1888-01-11T00:00:00Z,AMUSEMENTS THIS EVENING.,https://query.nytimes.com/gst/abstract.html?res=9F01E5D6163AE033A25752C1A9679C94699FD7CF,0
1888-01-11T00:00:00Z,MASSACHUSETTS CIVIL SERVICE.,https://query.nytimes.com/gst/abstract.html?res=980DE6D6163AE033A25752C1A9679C94699FD7CF,0
1888-01-11T00:00:00Z,SENATOR BECK'S SEAT SAFE.,https://query.nytimes.com/gst/abstract.html?res=9D03E5D6163AE033A25752C1A9679C94699FD7CF,0
1888-01-11T00:00:00Z,THE VANDALIA ANNUAL MEETING.,https://query.nytimes.com/gst/abstract.html?res=9A05E5D6163AE033A25752C1A9679C94699FD7CF,0
1888-01-11T00:00:00Z,KILLED BY APACHES.,https://query.nytimes.com/gst/abstract.html?res=9902E6D6163AE033A25752C1A9679C94699FD7CF,0
1888-01-11T00:00:00Z,LIVE STOCK AT CHICAGO.,https://query.nytimes.com/gst/abstract.html?res=9407E5D6163AE033A25752C1A9679C94699FD7CF,0
1888-01-11T00:00:00Z,SEEKING FEURETS PARDON.,https://query.nytimes.com/gst/abstract.html?res=9E02E5D6163AE033A25752C1A9679C94699FD7CF,0
1888-01-11T00:00:00Z,THE TRIAL POSTPONED.,https://query.nytimes.com/gst/abstract.html?res=9B04E5D6163AE033A25752C1A9679C94699FD7CF,0
1888-01-11T00:00:00Z,ELECTING THE BANK'S OFFICERS.,https://query.nytimes.com/gst/abstract.html?res=9504E4D6163AE033A25752C1A9679C94699FD7CF,0
1888-01-11T00:00:00Z,COURT CALENDARS--THIS DAY.; SUPREME COURT--CHAMBERS.,https://query.nytimes.com/gst/abstract.html?res=9906E5D6163AE033A25752C1A9679C94699FD7CF,0
1888-01-11T00:00:00Z,THEATRICAL GOSSIP.,https://query.nytimes.com/gst/abstract.html?res=9902E5D6163AE033A25752C1A9679C94699FD7CF,0
1888-01-11T00:00:00Z,WHAT LONDON TALKS ABOUT.,https://query.nytimes.com/gst/abstract.html?res=9F00E6D6163AE033A25752C1A9679C94699FD7CF,0
1888-01-11T00:00:00Z,MARTHA FITZGERALD FOUND.,https://query.nytimes.com/gst/abstract.html?res=9A07E4D6163AE033A25752C1A9679C94699FD7CF,0
1888-01-11T00:00:00Z,HER FATHER WANTED HER.,https://query.nytimes.com/gst/abstract.html?res=9B07E4D6163AE033A25752C1A9679C94699FD7CF,0
1888-01-11T00:00:00Z,CRUSHED UNDER THE WHEELS; MISS SHEEHAN MEETS A HORRIBLE DEATH ON THE ELEVATED.,https://query.nytimes.com/gst/abstract.html?res=9803E6D6163AE033A25752C1A9679C94699FD7CF,0
1888-01-11T00:00:00Z,A DESERTED WIFE'S SUICIDE.,https://query.nytimes.com/gst/abstract.html?res=9F0CE6D6163AE033A25752C1A9679C94699FD7CF,0
1888-01-11T00:00:00Z,HOCKING VALLEY'S AFFAIRS.,https://query.nytimes.com/gst/abstract.html?res=9905E5D6163AE033A25752C1A9679C94699FD7CF,0
1888-01-11T00:00:00Z,SAVED FROM A SINKING BARGE.,https://query.nytimes.com/gst/abstract.html?res=9B07E5D6163AE033A25752C1A9679C94699FD7CF,0
1888-01-11T00:00:00Z,NEW JERSEY LEGISLATURE.; ORGANIZATION EFFECTED YESTERDAY-- GOV. GREEN'S MESSAGE.,https://query.nytimes.com/gst/abstract.html?res=9C07E5D6163AE033A25752C1A9679C94699FD7CF,0
1888-01-11T00:00:00Z,CREEDMOOR NEEDING RELIEF.,https://query.nytimes.com/gst/abstract.html?res=9505E5D6163AE033A25752C1A9679C94699FD7CF,0
1888-01-11T00:00:00Z,Editorial Article 3 -- No Title,https://query.nytimes.com/gst/abstract.html?res=9A01E5D6163AE033A25752C1A9679C94699FD7CF,0
1888-01-11T00:00:00Z,MUSICAL NOTES.,https://query.nytimes.com/gst/abstract.html?res=9403E5D6163AE033A25752C1A9679C94699FD7CF,0
1888-01-11T00:00:00Z,CONFIDENCE IN BALDWIN.; HE IS RE-ELECTED A DIRECTOR OF THE FOURTH NATIONAL BANK.,https://query.nytimes.com/gst/abstract.html?res=9D07E4D6163AE033A25752C1A9679C94699FD7CF,0
1888-01-11T00:00:00Z,LAST OF THE JANISSARIES.,https://query.nytimes.com/gst/abstract.html?res=9B03E5D6163AE033A25752C1A9679C94699FD7CF,0
1888-01-11T00:00:00Z,BASEBALL MEN TO MEET.,https://query.nytimes.com/gst/abstract.html?res=9500E6D6163AE033A25752C1A9679C94699FD7CF,0
1888-01-11T00:00:00Z,SCOTT'S MINERS STRIKE,https://query.nytimes.com/gst/abstract.html?res=980CE6D6163AE033A25752C1A9679C94699FD7CF,0
1888-01-11T00:00:00Z,A STEAMSHIP OVERDUE.,https://query.nytimes.com/gst/abstract.html?res=9A00E6D6163AE033A25752C1A9679C94699FD7CF,0
1888-01-11T00:00:00Z,TO RECOVER MONEY ADVANCED.,https://query.nytimes.com/gst/abstract.html?res=9F05E4D6163AE033A25752C1A9679C94699FD7CF,0
1888-01-11T00:00:00Z,GOING INTO LIQUIDATION.,https://query.nytimes.com/gst/abstract.html?res=9500E5D6163AE033A25752C1A9679C94699FD7CF,0
1888-01-11T00:00:00Z,Obituary 1 -- No Title,https://query.nytimes.com/gst/abstract.html?res=9A03E5D6163AE033A25752C1A9679C94699FD7CF,0
1888-01-11T00:00:00Z,THE DE FOREST FAILURE.,https://query.nytimes.com/gst/abstract.html?res=9E05E4D6163AE033A25752C1A9679C94699FD7CF,0
1888-01-11T00:00:00Z,ASTONISHED HIS AUDITORS.; MR. HINRICHS TALKS ABOUT FREE TRADE AT A RELIGIOUS MEETING.,https://query.nytimes.com/gst/abstract.html?res=9502E6D6163AE033A25752C1A9679C94699FD7CF,0
1888-01-11T00:00:00Z,WALL-STREET TALK.,https://query.nytimes.com/gst/abstract.html?res=9A02E5D6163AE033A25752C1A9679C94699FD7CF,0
1888-01-11T00:00:00Z,THE SAN FRANCISCO EXCHANGE.,https://query.nytimes.com/gst/abstract.html?res=9A07E5D6163AE033A25752C1A9679C94699FD7CF,0
1888-01-11T00:00:00Z,MARINE INTELLIGENCE.; ARRIVED. SAILED. BY CABLE.,https://query.nytimes.com/gst/abstract.html?res=9506E5D6163AE033A25752C1A9679C94699FD7CF,0
1888-01-11T00:00:00Z,A COURT HOUSE BURNED.,https://query.nytimes.com/gst/abstract.html?res=950DE6D6163AE033A25752C1A9679C94699FD7CF,0
1888-01-11T00:00:00Z,A PLOT TO KILL THE CZAR.; ONE OF UNUSUAL MAGNITUDE DISCOVERED--MANY ARRESTS MADE.,https://query.nytimes.com/gst/abstract.html?res=9C00E6D6163AE033A25752C1A9679C94699FD7CF,0
1888-01-11T00:00:00Z,ROBBED A DEAD MAN'S HOUSE.,https://query.nytimes.com/gst/abstract.html?res=9C02E6D6163AE033A25752C1A9679C94699FD7CF,0
1888-01-11T00:00:00Z,THE LAST DOLLAR PAID.; AND MR. ABBEY CAN NOW FORGET HIS BIG OPERA SEASON.,https://query.nytimes.com/gst/abstract.html?res=9E03E5D6163AE033A25752C1A9679C94699FD7CF,0
1888-01-11T00:00:00Z,DRESSED BEEF RATES.,https://query.nytimes.com/gst/abstract.html?res=9C00E5D6163AE033A25752C1A9679C94699FD7CF,0
1888-01-11T00:00:00Z,CURRENT FOREIGN TOPICS.,https://query.nytimes.com/gst/abstract.html?res=9800E6D6163AE033A25752C1A9679C94699FD7CF,0
1888-01-11T00:00:00Z,THE HAMILTON INQUEST BEGUN.,https://query.nytimes.com/gst/abstract.html?res=9C0CE6D6163AE033A25752C1A9679C94699FD7CF,0
1888-01-11T00:00:00Z,STEEL RAIL PRODUCTION.,https://query.nytimes.com/gst/abstract.html?res=9907E5D6163AE033A25752C1A9679C94699FD7CF,0
1888-01-11T00:00:00Z,Editorial Article 2 -- No Title,https://query.nytimes.com/gst/abstract.html?res=9901E5D6163AE033A25752C1A9679C94699FD7CF,0
1888-01-11T00:00:00Z,NOTES OF VARIOUS INTERESTS.,https://query.nytimes.com/gst/abstract.html?res=9405E5D6163AE033A25752C1A9679C94699FD7CF,0
1888-01-11T00:00:00Z,HE WILL NEVER TRAMP AGAIN.,https://query.nytimes.com/gst/abstract.html?res=9D07E5D6163AE033A25752C1A9679C94699FD7CF,0
1888-01-11T00:00:00Z,GENERAL TELEGRAPH NEWS; THE BIG LICK TELESCOPE. FIRST OBSERVATIONS THROUGH THE THIRTY-SIX-INCH LENS.,https://query.nytimes.com/gst/abstract.html?res=9E0CE6D6163AE033A25752C1A9679C94699FD7CF,0
1888-01-11T00:00:00Z,FAILURES IN BUSINESS.,https://query.nytimes.com/gst/abstract.html?res=9B0DE6D6163AE033A25752C1A9679C94699FD7CF,0
1888-01-11T00:00:00Z,MR. BALDWIN MADE CHAIRMAN.; OF THE KINGS COUNTY REPUBLICAN GENERAL COMMITTEE.,https://query.nytimes.com/gst/abstract.html?res=9F02E5D6163AE033A25752C1A9679C94699FD7CF,0
1888-01-11T00:00:00Z,A QUIET WEDDING.,https://query.nytimes.com/gst/abstract.html?res=9503E6D6163AE033A25752C1A9679C94699FD7CF,0
1888-01-11T00:00:00Z,PERSONAL INTELLIGENCE.,https://query.nytimes.com/gst/abstract.html?res=9D04E5D6163AE033A25752C1A9679C94699FD7CF,0
1888-01-11T00:00:00Z,TO IMPROVE RAILROAD MEN.,https://query.nytimes.com/gst/abstract.html?res=9505E4D6163AE033A25752C1A9679C94699FD7CF,0
1888-01-11T00:00:00Z,INDIANA DEMOCRATS TO CONFER.,https://query.nytimes.com/gst/abstract.html?res=9B03E6D6163AE033A25752C1A9679C94699FD7CF,0
1888-01-11T00:00:00Z,GONE AFTER THE DIAMONDS.,https://query.nytimes.com/gst/abstract.html?res=9407E4D6163AE033A25752C1A9679C94699FD7CF,0
1888-01-11T00:00:00Z,THE ELECTRIC LIGHT IN BERLIN.,https://query.nytimes.com/gst/abstract.html?res=9C05E5D6163AE033A25752C1A9679C94699FD7CF,0
1888-01-11T00:00:00Z,THE TWENTY-SECOND'S BALL.,https://query.nytimes.com/gst/abstract.html?res=950CE6D6163AE033A25752C1A9679C94699FD7CF,0
1888-01-11T00:00:00Z,THE WORLD'S CHESS CHAMPION.,https://query.nytimes.com/gst/abstract.html?res=9E02E6D6163AE033A25752C1A9679C94699FD7CF,0
1888-01-11T00:00:00Z,"HE MAY GET A NEW TRIAL; SOMETHING CONCERNING A STORY TOLD ABOUT ""DAN"" DRISCOLL.",https://query.nytimes.com/gst/abstract.html?res=9907E4D6163AE033A25752C1A9679C94699FD7CF,0
1888-01-11T00:00:00Z,SURPLUS OF SAVINGS BANKS.; MUST NOT BE DRAWN ON TO INCREASE REGULAR DIVIDENDS.,https://query.nytimes.com/gst/abstract.html?res=9504E5D6163AE033A25752C1A9679C94699FD7CF,0
1888-01-11T00:00:00Z,YOUNG TALMAGE'S HASTY CRIME.,https://query.nytimes.com/gst/abstract.html?res=9C0DE6D6163AE033A25752C1A9679C94699FD7CF,0
1888-01-11T00:00:00Z,CAMPBELL VS. ARBUCKLE.,https://query.nytimes.com/gst/abstract.html?res=9800E5D6163AE033A25752C1A9679C94699FD7CF,0
1888-01-11T00:00:00Z,THE CALIFORNIA MINING STOCKS.,https://query.nytimes.com/gst/abstract.html?res=9D06E5D6163AE033A25752C1A9679C94699FD7CF,0
1888-01-11T00:00:00Z,A BITTER FIGHT PREDICTED.; MAYOR CHAPIN'S DELAY APPOINTMENTS PROVOKE COMMENT.,https://query.nytimes.com/gst/abstract.html?res=9B05E4D6163AE033A25752C1A9679C94699FD7CF,0
1888-01-11T00:00:00Z,Editorial Article 1 -- No Title,https://query.nytimes.com/gst/abstract.html?res=9801E5D6163AE033A25752C1A9679C94699FD7CF,0
1888-01-11T00:00:00Z,THE MAYOR'S MESSAGE.,https://query.nytimes.com/gst/abstract.html?res=9D00E5D6163AE033A25752C1A9679C94699FD7CF,0
1888-01-11T00:00:00Z,THE BEE IN HILL'S BONNET.; THE GOVERNOR AND HIS FRIENDS WORKING INSIDIOUSLY AGAINST THE PRESIDENT.,https://query.nytimes.com/gst/abstract.html?res=9A00E5D6163AE033A25752C1A9679C94699FD7CF,0
1888-01-11T00:00:00Z,Editorial Article 5 -- No Title,https://query.nytimes.com/gst/abstract.html?res=9401E5D6163AE033A25752C1A9679C94699FD7CF,0
1888-01-11T00:00:00Z,NEW RATES TO GO INTO EFFECT.,https://query.nytimes.com/gst/abstract.html?res=9B05E5D6163AE033A25752C1A9679C94699FD7CF,0
1888-01-11T00:00:00Z,BOSTON CLOSING PRICES.,https://query.nytimes.com/gst/abstract.html?res=9E06E5D6163AE033A25752C1A9679C94699FD7CF,0
1888-01-11T00:00:00Z,GRADUATED AS NURSES.,https://query.nytimes.com/gst/abstract.html?res=9E04E5D6163AE033A25752C1A9679C94699FD7CF,0
1888-01-11T00:00:00Z,DIED OF A BROKEN HEART.,https://query.nytimes.com/gst/abstract.html?res=9904E5D6163AE033A25752C1A9679C94699FD7CF,0
1888-01-11T00:00:00Z,"THE PROUD HOLLANDERS; THEIR GUESTS PRAISE THEM AND EACH OTHER. AFTER-DINNER ADDRESSES BY CHAUNCEY M. DEPEW, GEORGE WILLIAM CURTIS, AND OTHERS.",https://query.nytimes.com/gst/abstract.html?res=9803E5D6163AE033A25752C1A9679C94699FD7CF,0
1888-01-11T00:00:00Z,PACIFIC MAIL AHEAD AGAIN.,https://query.nytimes.com/gst/abstract.html?res=9802E6D6163AE033A25752C1A9679C94699FD7CF,0
1888-01-11T00:00:00Z,CHICAGO BUILDING TRADES.,https://query.nytimes.com/gst/abstract.html?res=9D0CE6D6163AE033A25752C1A9679C94699FD7CF,0
1888-01-11T00:00:00Z,BOSTON'S NATIONAL BANKS.,https://query.nytimes.com/gst/abstract.html?res=9D03E6D6163AE033A25752C1A9679C94699FD7CF,0
1888-01-11T00:00:00Z,THE EASTERN SITUATION.,https://query.nytimes.com/gst/abstract.html?res=9E00E6D6163AE033A25752C1A9679C94699FD7CF,0
1888-01-11T00:00:00Z,IS THIS REPUBLICANISM?,https://query.nytimes.com/gst/abstract.html?res=9501E5D6163AE033A25752C1A9679C94699FD7CF,0
1888-01-11T00:00:00Z,A BAD RAILROAD ACCIDENT; TEN PERSONS KILLED AND SEVERAL BADLY INJURED. TWO CARS OF THE PORTLAND EXPRESS LEAVE THE RAILS AND CRASH AGAINST THE WATER TANK HOUSE.,https://query.nytimes.com/gst/abstract.html?res=9F02E6D6163AE033A25752C1A9679C94699FD7CF,0
1888-01-11T00:00:00Z,FOR THE ACTORS' FUND.; THE COMING BENEFIT PERFORMANCE IN ALBANY.,https://query.nytimes.com/gst/abstract.html?res=9405E4D6163AE033A25752C1A9679C94699FD7CF,0
1888-01-11T00:00:00Z,WANTED TO BE INDEPENDENT.,https://query.nytimes.com/gst/abstract.html?res=9804E4D6163AE033A25752C1A9679C94699FD7CF,0
1888-01-11T00:00:00Z,THE TONAWANDA IN PORT.,https://query.nytimes.com/gst/abstract.html?res=9904E4D6163AE033A25752C1A9679C94699FD7CF,0
1888-01-11T00:00:00Z,EX-JUDGE DALY'S LECTURE.,https://query.nytimes.com/gst/abstract.html?res=9F0DE6D6163AE033A25752C1A9679C94699FD7CF,0
1888-01-11T00:00:00Z,THE ALBANY STATESMEN.; PROBABLE CHAIRMEN OF SOME OF THE COMMITTEES.,https://query.nytimes.com/gst/abstract.html?res=9C04E5D6163AE033A25752C1A9679C94699FD7CF,0
1888-01-11T00:00:00Z,THE BROOKLYN RACES.; ENTRIES FOR THE THREE GREAT RACES OF THE SPRING MEETING.,https://query.nytimes.com/gst/abstract.html?res=9402E6D6163AE033A25752C1A9679C94699FD7CF,0
1888-01-11T00:00:00Z,SHE CREATED A SCENE.,https://query.nytimes.com/gst/abstract.html?res=9E05E5D6163AE033A25752C1A9679C94699FD7CF,0
1888-01-11T00:00:00Z,COTTER GETS OFF EASILY.,https://query.nytimes.com/gst/abstract.html?res=9C07E4D6163AE033A25752C1A9679C94699FD7CF,0
1888-01-11T00:00:00Z,Editorial Article 7 -- No Title,https://query.nytimes.com/gst/abstract.html?res=9F00E5D6163AE033A25752C1A9679C94699FD7CF,0
1888-01-11T00:00:00Z,RAILWAY MANAGEMENT.; THE MEXICAN NATIONAL ROAD.,https://query.nytimes.com/gst/abstract.html?res=9F05E5D6163AE033A25752C1A9679C94699FD7CF,0
1888-01-11T00:00:00Z,REDUCED EXPORT RATES.,https://query.nytimes.com/gst/abstract.html?res=9805E5D6163AE033A25752C1A9679C94699FD7CF,0
1888-01-11T00:00:00Z,BEFORE A JURY AT LENGTH; PLATT'S PLEAS FOR DELAY SWEPT AWAY. STRONG EVIDENCE THAT HE IS NOT A LEGAL RESIDENT OF THIS CITY OFFERED BY THE PROSECUTION.,https://query.nytimes.com/gst/abstract.html?res=9A03E6D6163AE033A25752C1A9679C94699FD7CF,0
1888-01-11T00:00:00Z,CITY AND SUBURBAN NEWS; NEW-YORK. BROOKLYN. WESTCHESTER COUNTY.,https://query.nytimes.com/gst/abstract.html?res=9807E5D6163AE033A25752C1A9679C94699FD7CF,0
1888-01-11T00:00:00Z,Editorial Article 4 -- No Title,https://query.nytimes.com/gst/abstract.html?res=9B01E5D6163AE033A25752C1A9679C94699FD7CF,0
1888-01-11T00:00:00Z,THREE PERSONS BURNED TO DEATH.,https://query.nytimes.com/gst/abstract.html?res=9F07E5D6163AE033A25752C1A9679C94699FD7CF,0
1888-01-11T00:00:00Z,TO SUSTAIN THE STRIKE; UNOFFICIAL ACTION OF THE EXECUTIVE BOARD. POTTSVILLE BUSINESS MEN TO WAIT UPON MR. CORBIN-LATEST FEATURES OF THE DIFFICULTY.,https://query.nytimes.com/gst/abstract.html?res=9D0DE6D6163AE033A25752C1A9679C94699FD7CF,0
1888-01-11T00:00:00Z,THE ST. LOUIS GAS TRUST.; THE INNER WORKING OF THE SCHEME COMING TO LIGHT.,https://query.nytimes.com/gst/abstract.html?res=9400E5D6163AE033A25752C1A9679C94699FD7CF,0
1888-01-11T00:00:00Z,ARMY AND NAVY NEWS.,https://query.nytimes.com/gst/abstract.html?res=9E07E5D6163AE033A25752C1A9679C94699FD7CF,0
1888-01-11T00:00:00Z,OBITUARY.; ADOLPHUS F. WARBURTON.,https://query.nytimes.com/gst/abstract.html?res=9F03E5D6163AE033A25752C1A9679C94699FD7CF,0
1888-01-11T00:00:00Z,NICHOLS MEN IN COMMAND.; THE BATON ROUGE CONVENTION ORGANIZED PEACEABLY.,https://query.nytimes.com/gst/abstract.html?res=9900E5D6163AE033A25752C1A9679C94699FD7CF,0
1888-01-11T00:00:00Z,ANNIE SUMMERVILLE'S DIVORCE SUIT.,https://query.nytimes.com/gst/abstract.html?res=990CE6D6163AE033A25752C1A9679C94699FD7CF,0
1888-01-11T00:00:00Z,BACHELORS MADE BENEDICTS.; TWO WEDDINGS IN THIS CITY AND ONE IN TRENTON.,https://query.nytimes.com/gst/abstract.html?res=9C02E5D6163AE033A25752C1A9679C94699FD7CF,0
1888-01-11T00:00:00Z,LABOR NOTES.,https://query.nytimes.com/gst/abstract.html?res=9D05E5D6163AE033A25752C1A9679C94699FD7CF,0
1888-01-11T00:00:00Z,OFT-RECURRING DELAYS.; TWO MORE ACCIDENTS ON THE ELEVATED YESTERDAY.,https://query.nytimes.com/gst/abstract.html?res=9503E5D6163AE033A25752C1A9679C94699FD7CF,0
1888-01-11T00:00:00Z,"BUNNIE AWARDED $45,000.; WHAT MR. ARBUCKLE IS TO PAY FOR BLIGHTING AFFECTION.",https://query.nytimes.com/gst/abstract.html?res=9905E4D6163AE033A25752C1A9679C94699FD7CF,0
1888-01-11T00:00:00Z,THREADMAKERS STRIKE.,https://query.nytimes.com/gst/abstract.html?res=9805E4D6163AE033A25752C1A9679C94699FD7CF,0
1888-01-11T00:00:00Z,FINDING MUCH TO CONDEMN; RESULTS OF A VISIT TO THE CITY'S CHARITABLE INSTITUTIONS.,https://query.nytimes.com/gst/abstract.html?res=9507E5D6163AE033A25752C1A9679C94699FD7CF,0
1888-01-11T00:00:00Z,HOFMANN IN BALTIMORE.,https://query.nytimes.com/gst/abstract.html?res=9B00E6D6163AE033A25752C1A9679C94699FD7CF,0
1888-01-11T00:00:00Z,INCOMING STEAMSHIPS.,https://query.nytimes.com/gst/abstract.html?res=9B06E5D6163AE033A25752C1A9679C94699FD7CF,0
1888-01-11T00:00:00Z,UNITED AFTER MANY YEARS.,https://query.nytimes.com/gst/abstract.html?res=9404E5D6163AE033A25752C1A9679C94699FD7CF,0
1888-01-11T00:00:00Z,OUTGOING STEAMSHIPS.,https://query.nytimes.com/gst/abstract.html?res=9A06E5D6163AE033A25752C1A9679C94699FD7CF,0
1888-01-11T00:00:00Z,THE SENATE'S NEW BOSS; MR. CHANDLER INVADES MR. HOAR'S BAILIWICK. HE INTRODUCES A BLOODY SHIRT RESOLUTION--THE CABINET NOMINATIONS--POSTMASTERS' SALARIES.,https://query.nytimes.com/gst/abstract.html?res=9F03E6D6163AE033A25752C1A9679C94699FD7CF,0
1888-01-11T00:00:00Z,BROKERS CUTTING RATES; EVADING THE RULE OF THE CHICAGO BOARD OF TRADE. CAST-IRON COMMISSION LAW WHICH IS NOTORIOUSLY BROKEN BY THOSE WHOM IT SHOULD BIND.,https://query.nytimes.com/gst/abstract.html?res=9A04E5D6163AE033A25752C1A9679C94699FD7CF,0
1888-01-11T00:00:00Z,DR. CARPENTER'S FUNERAL.,https://query.nytimes.com/gst/abstract.html?res=9D04E4D6163AE033A25752C1A9679C94699FD7CF,0
1888-01-11T00:00:00Z,HIGH LICENSE IN PLAINFIELD.,https://query.nytimes.com/gst/abstract.html?res=9A0CE6D6163AE033A25752C1A9679C94699FD7CF,0
1888-01-11T00:00:00Z,Obituary 2 -- No Title,https://query.nytimes.com/gst/abstract.html?res=980DE5D6163AE033A25752C1A9679C94699FD7CF,0
1888-01-11T00:00:00Z,AN UNCIVILIZED TRIBE.; A MISSIONARY MUCH NEEDED IN ULSTER COUNTRY.,https://query.nytimes.com/gst/abstract.html?res=9B0CE6D6163AE033A25752C1A9679C94699FD7CF,0
1888-01-11T00:00:00Z,NEW CROP OF LITIGATION; THE MANHATTAN RUNNING AGAINST A SNAG. NEW-YORK COMPANY STOCKHOLDERS PROTESTING AGAINST BEING SADDLED WITH A BIG MORTGAGE.,https://query.nytimes.com/gst/abstract.html?res=9E04E4D6163AE033A25752C1A9679C94699FD7CF,0
1888-01-11T00:00:00Z,STRICKEN WITH PARALYSIS.,https://query.nytimes.com/gst/abstract.html?res=9C03E6D6163AE033A25752C1A9679C94699FD7CF,0
