pub_date,main_headline,article_url,classification
1888-01-15T00:00:00Z,BETTER WAIT.,https://query.nytimes.com/gst/abstract.html?res=9401E6DF173AE033A25756C1A9679C94699FD7CF,0
1888-01-15T00:00:00Z,WHAT A MORTAR MAY PROVE.,https://query.nytimes.com/gst/abstract.html?res=9905E6DF173AE033A25756C1A9679C94699FD7CF,0
1888-01-15T00:00:00Z,A PANIC IN OIL.,https://query.nytimes.com/gst/abstract.html?res=9E00EED6163AE033A25756C1A9679C94699FD7CF,0
1888-01-15T00:00:00Z,THE HOMELESS POOR IN TWO GREAT CITIES.,https://query.nytimes.com/gst/abstract.html?res=9B0CE7DF173AE033A25756C1A9679C94699FD7CF,0
1888-01-15T00:00:00Z,SOME LEADING RUSSIANS; A LADY IN ENGLAND TALKS OF HER COUNTRYMEN. WRITERS AND STATESMEN SHE HAS KNOWN--THE CHARACTERS OF THREE CZARS--EMINENT SOLDIERS.,https://query.nytimes.com/gst/abstract.html?res=9805E6DF173AE033A25756C1A9679C94699FD7CF,0
1888-01-15T00:00:00Z,ROD AND REEL MEN.,https://query.nytimes.com/gst/abstract.html?res=940CE7DF173AE033A25756C1A9679C94699FD7CF,0
1888-01-15T00:00:00Z,Obituary 2 -- No Title,https://query.nytimes.com/gst/abstract.html?res=9E06E7DF173AE033A25756C1A9679C94699FD7CF,0
1888-01-15T00:00:00Z,ORGANIZED FOR WORK.; OFFICERS OF THE NEW CHURCH STUDENTS' MISSIONARY ASSOCIATION.,https://query.nytimes.com/gst/abstract.html?res=9B07EED6163AE033A25756C1A9679C94699FD7CF,0
1888-01-15T00:00:00Z,PROGRAMME OF THE AMERICAN PARTY.,https://query.nytimes.com/gst/abstract.html?res=9502E6DF173AE033A25756C1A9679C94699FD7CF,0
1888-01-15T00:00:00Z,THE EARLIEST EIGHT-OARED RACE.,https://query.nytimes.com/gst/abstract.html?res=9506E6DF173AE033A25756C1A9679C94699FD7CF,0
1888-01-15T00:00:00Z,MOSAICS.,https://query.nytimes.com/gst/abstract.html?res=9E00E6DF173AE033A25756C1A9679C94699FD7CF,0
1888-01-15T00:00:00Z,GETTING OUT OF OFFICE.,https://query.nytimes.com/gst/abstract.html?res=9507E7DF173AE033A25756C1A9679C94699FD7CF,0
1888-01-15T00:00:00Z,WANTING SOME RECOMPENSE.,https://query.nytimes.com/gst/abstract.html?res=9406E7DF173AE033A25756C1A9679C94699FD7CF,0
1888-01-15T00:00:00Z,THE ALBANY BANK ROBBERY.,https://query.nytimes.com/gst/abstract.html?res=9505E7DF173AE033A25756C1A9679C94699FD7CF,0
1888-01-15T00:00:00Z,REAL ESTATE IN DEMAND; BUYERS AND SELLERS ALIKE ON THE ALERT. THE YEAR'S BUSINESS OPENING TO THE SATISFACTION OF ALL--MR. DE FOREST'S POSITION IN THE MARKET.,https://query.nytimes.com/gst/abstract.html?res=9903E6DF173AE033A25756C1A9679C94699FD7CF,0
1888-01-15T00:00:00Z,Marriage Announcement 1 -- No Title,https://query.nytimes.com/gst/abstract.html?res=9C06E7DF173AE033A25756C1A9679C94699FD7CF,0
1888-01-15T00:00:00Z,Obituary 1 -- No Title,https://query.nytimes.com/gst/abstract.html?res=9F01EED6163AE033A25756C1A9679C94699FD7CF,0
1888-01-15T00:00:00Z,FUNERAL OF DR. WEISSE.,https://query.nytimes.com/gst/abstract.html?res=9E0CE7DF173AE033A25756C1A9679C94699FD7CF,0
1888-01-15T00:00:00Z,MR. ROBERT GARRETT IN JAPAN.,https://query.nytimes.com/gst/abstract.html?res=980DE6DF173AE033A25756C1A9679C94699FD7CF,0
1888-01-15T00:00:00Z,AN ICE BRIDGE AT NIAGARA.,https://query.nytimes.com/gst/abstract.html?res=9B0DE6DF173AE033A25756C1A9679C94699FD7CF,0
1888-01-15T00:00:00Z,LIVES LOST IN THE STORM; FEARFUL RESULTS OF THE NORTHWEST BLIZZARD. THE KILLED AND MISSING IN DAKOTA AND OTHER STATES LARGER THAN AT FIRST REPORTED.,https://query.nytimes.com/gst/abstract.html?res=9D04EED6163AE033A25756C1A9679C94699FD7CF,0
1888-01-15T00:00:00Z,NATIONAL CAPITAL TOPICS; MR. LAMAR'S STRENGTH NOT TESTED ON FRIDAY. THE NEW LAW REGARDING PERMISSIBLE MARKS ON MAIL MATTER--THE WOOL CONFERENCE ADJOURNS.,https://query.nytimes.com/gst/abstract.html?res=9C07EED6163AE033A25756C1A9679C94699FD7CF,0
1888-01-15T00:00:00Z,THE COLLEGIATE ALUMNAE.; ELECTING OFFICERS AND LISTENING TO INSTRUCTIVE PAPERS.,https://query.nytimes.com/gst/abstract.html?res=990DE6DF173AE033A25756C1A9679C94699FD7CF,0
1888-01-15T00:00:00Z,AMATEUR BOXING HEROES; CLEVER SPARRING FOR FISTIC HONORS. CLEARING THE WAY FOR THE FINAL CONTESTS FOR CHAMPIONSHIPS--AN EXHIBITION IN BROOKLYN.,https://query.nytimes.com/gst/abstract.html?res=9801EED6163AE033A25756C1A9679C94699FD7CF,0
1888-01-15T00:00:00Z,"""BUNNIE"" IS SATISFIED.",https://query.nytimes.com/gst/abstract.html?res=9F00EED6163AE033A25756C1A9679C94699FD7CF,0
1888-01-15T00:00:00Z,"THE WAR SCARE SPREADING; GERMANY PREPARING FOR THE CZAR'S ATTACK. THE UNFAVORABLE REPORTS FROM THE CROWN PRINCE EXAGGERATED, BUT LITTLE HOPE OF HIS RECOVERY.",https://query.nytimes.com/gst/abstract.html?res=9905E7DF173AE033A25756C1A9679C94699FD7CF,0
1888-01-15T00:00:00Z,CITY AND SUBURBAN NEWS; NEW-YORK. BROKLYN. LONG ISLAND. NEW-JERSEY.,https://query.nytimes.com/gst/abstract.html?res=9402EED6163AE033A25756C1A9679C94699FD7CF,0
1888-01-15T00:00:00Z,"BRIDGE CERTIFICATES.; THE TREASURER REFUSING TO SIGN THEM, DOUBTING THEIR VALIDITY.",https://query.nytimes.com/gst/abstract.html?res=9503EED6163AE033A25756C1A9679C94699FD7CF,0
1888-01-16T00:00:00Z,"NONE BETTER THAN ""THE TIMES.""",https://query.nytimes.com/gst/abstract.html?res=9F04E4DF173AE033A25755C1A9679C94699FD7CF,0
1888-01-16T00:00:00Z,MARINE INTELLIGENCE.; ARRIVED. SAILED. SPOKEN. BY CABLE. NOTICE TO MARINERS.,https://query.nytimes.com/gst/abstract.html?res=9503E5DF173AE033A25755C1A9679C94699FD7CF,0
1888-01-16T00:00:00Z,ENDED THE SUIT BY HIS SUICIDE.,https://query.nytimes.com/gst/abstract.html?res=940CE5DF173AE033A25755C1A9679C94699FD7CF,0
1888-01-16T00:00:00Z,CURRENT FOREIGN TOPICS.,https://query.nytimes.com/gst/abstract.html?res=9807E5DF173AE033A25755C1A9679C94699FD7CF,0
1888-01-16T00:00:00Z,SOCIAL FUNCTION OF WEALTH.; THE TOPIC DISCUSSED YESTERDAY BY THE REV. R. HEBER NEWTON.,https://query.nytimes.com/gst/abstract.html?res=9501E5DF173AE033A25755C1A9679C94699FD7CF,0
1888-01-16T00:00:00Z,"A BIG BUILDING DESTROYED.; A LOSS OF ABOUT $200,000 BY FIRE IN WARREN-STREET.",https://query.nytimes.com/gst/abstract.html?res=9A01E4DF173AE033A25755C1A9679C94699FD7CF,0
1888-01-16T00:00:00Z,AIDED IN HONEST LIVES.,https://query.nytimes.com/gst/abstract.html?res=9401E4DF173AE033A25755C1A9679C94699FD7CF,0
1888-01-16T00:00:00Z,INCOMING STEAMSHIPS,https://query.nytimes.com/gst/abstract.html?res=9B03E5DF173AE033A25755C1A9679C94699FD7CF,0
1888-01-16T00:00:00Z,THE PENNSYLVANIA DEMOCRATS.,https://query.nytimes.com/gst/abstract.html?res=9905E5DF173AE033A25755C1A9679C94699FD7CF,0
1888-01-16T00:00:00Z,THE CHICAGO PLAYHOUSES.; FAIR HOUSES IN SPITE OF DISAGREEABLE WEATHER.,https://query.nytimes.com/gst/abstract.html?res=950DE5DF173AE033A25755C1A9679C94699FD7CF,0
1888-01-16T00:00:00Z,THE LASTERS' STRIKE DOOMED.,https://query.nytimes.com/gst/abstract.html?res=940CE6DF173AE033A25755C1A9679C94699FD7CF,0
1888-01-16T00:00:00Z,A BURLESQUE TROOP STRANDED.,https://query.nytimes.com/gst/abstract.html?res=9B07E5DF173AE033A25755C1A9679C94699FD7CF,0
1888-01-16T00:00:00Z,LITERARY NOTES.,https://query.nytimes.com/gst/abstract.html?res=9800E5DF173AE033A25755C1A9679C94699FD7CF,0
1888-01-16T00:00:00Z,BEGINNING A WAR ON WHISKY.,https://query.nytimes.com/gst/abstract.html?res=9A07E5DF173AE033A25755C1A9679C94699FD7CF,0
1888-01-16T00:00:00Z,FOR THE CHILDREN'S SAKE.; WORK OF THE SOCIETY FOR THE PREVENTION OF CRUELTY.,https://query.nytimes.com/gst/abstract.html?res=9405E4DF173AE033A25755C1A9679C94699FD7CF,0
1888-01-16T00:00:00Z,DIED BY HER LOVER'S SIDE.; THE TRAGEDY CAUSED BY CARRIE BROCKWAY'S LOVE.,https://query.nytimes.com/gst/abstract.html?res=9C01E5DF173AE033A25755C1A9679C94699FD7CF,0
1888-01-16T00:00:00Z,TENEMENT HOUSE IN DANGER.,https://query.nytimes.com/gst/abstract.html?res=9C03E4DF173AE033A25755C1A9679C94699FD7CF,0
1888-01-16T00:00:00Z,PROF. WILEY'S EXPERIMENTS.; THE SUGAR-MAKING WORK ON GOV. WARMOTH'S PLANTATION.,https://query.nytimes.com/gst/abstract.html?res=9A0CE6DF173AE033A25755C1A9679C94699FD7CF,0
1888-01-16T00:00:00Z,NO PAPAL SUPREMACY HERE.,https://query.nytimes.com/gst/abstract.html?res=9400E5DF173AE033A25755C1A9679C94699FD7CF,0
1888-01-16T00:00:00Z,FOR MISS MUNIER'S BENEFIT.,https://query.nytimes.com/gst/abstract.html?res=9A05E4DF173AE033A25755C1A9679C94699FD7CF,0
1888-01-16T00:00:00Z,Editorial Article 7 -- No Title,https://query.nytimes.com/gst/abstract.html?res=9E0DE5DF173AE033A25755C1A9679C94699FD7CF,0
1888-01-16T00:00:00Z,THE ISSUE OF THE SESSION; WHAT THE TARIFF REFORMERS PROPOSE TO DO.THE MISTAKES OF FORMER SESSIONS TOBE A VOIDED--CHAIRMAN MILLS'S UNFORTUNATE TEMPERAMENT.,https://query.nytimes.com/gst/abstract.html?res=980CE6DF173AE033A25755C1A9679C94699FD7CF,0
1888-01-16T00:00:00Z,MISS DE LUSSAN IN NEW-YORK.,https://query.nytimes.com/gst/abstract.html?res=9E0CE5DF173AE033A25755C1A9679C94699FD7CF,0
1888-01-16T00:00:00Z,TWENTY YEARS OF CHURCH LIFE.,https://query.nytimes.com/gst/abstract.html?res=9E00E5DF173AE033A25755C1A9679C94699FD7CF,0
1888-01-16T00:00:00Z,A GAMBLING HOUSE SURPRISED.,https://query.nytimes.com/gst/abstract.html?res=9906E5DF173AE033A25755C1A9679C94699FD7CF,0
1888-01-16T00:00:00Z,MUSIC HELPING A HOSPITAL.,https://query.nytimes.com/gst/abstract.html?res=9406E5DF173AE033A25755C1A9679C94699FD7CF,0
1888-01-16T00:00:00Z,WIFE AND CHILDREN SUFFER.; STARVING WHILE HUSBAND AND FATHER IS IN JAIL AS A WITNESS.,https://query.nytimes.com/gst/abstract.html?res=9D04E4DF173AE033A25755C1A9679C94699FD7CF,0
1888-01-16T00:00:00Z,DEATH OF STEPHEN HELLER.,https://query.nytimes.com/gst/abstract.html?res=950CE5DF173AE033A25755C1A9679C94699FD7CF,0
1888-01-16T00:00:00Z,STAGNANT WALTER IN THE PARK.,https://query.nytimes.com/gst/abstract.html?res=9806E5DF173AE033A25755C1A9679C94699FD7CF,0
1888-01-16T00:00:00Z,A NEW BANK PRESIDENT.,https://query.nytimes.com/gst/abstract.html?res=9C04E5DF173AE033A25755C1A9679C94699FD7CF,0
1888-01-16T00:00:00Z,MISTAKEN FOR A BURGLAR.,https://query.nytimes.com/gst/abstract.html?res=9C05E4DF173AE033A25755C1A9679C94699FD7CF,0
1888-01-16T00:00:00Z,THE STRIKERS DEFIANT; YESTERDAY'S CONVENTION OF THE RAILROAD MEN. THEIR LEADERS URGE THEM TO REMAIN FIRM--A BREAK IN THE RANKS OF THE MINERS EXPECTED.,https://query.nytimes.com/gst/abstract.html?res=9804E5DF173AE033A25755C1A9679C94699FD7CF,0
1888-01-16T00:00:00Z,ITALIANS IN A GENERAL FIGHT.,https://query.nytimes.com/gst/abstract.html?res=9C04E4DF173AE033A25755C1A9679C94699FD7CF,0
1888-01-16T00:00:00Z,A BRIDAL COUPLE DELAYS A TRAIN.,https://query.nytimes.com/gst/abstract.html?res=9F0CE5DF173AE033A25755C1A9679C94699FD7CF,0
1888-01-16T00:00:00Z,STRUCK BY A CANNON BALL AND LIVES.,https://query.nytimes.com/gst/abstract.html?res=990CE5DF173AE033A25755C1A9679C94699FD7CF,0
1888-01-16T00:00:00Z,TRACING THE DRIFTING LOGS.,https://query.nytimes.com/gst/abstract.html?res=9900E4DF173AE033A25755C1A9679C94699FD7CF,0
1888-01-16T00:00:00Z,BLEW THE TOP OF HIS HEAD OFF.,https://query.nytimes.com/gst/abstract.html?res=9E06E5DF173AE033A25755C1A9679C94699FD7CF,0
1888-01-16T00:00:00Z,THE INTER-STATE ENCAMPMENT.,https://query.nytimes.com/gst/abstract.html?res=9A04E4DF173AE033A25755C1A9679C94699FD7CF,0
1888-01-16T00:00:00Z,A BRILLIANT METEOR.,https://query.nytimes.com/gst/abstract.html?res=9506E5DF173AE033A25755C1A9679C94699FD7CF,0
1888-01-16T00:00:00Z,MRS. GARFIELD'S ILLNESS.,https://query.nytimes.com/gst/abstract.html?res=9D07E4DF173AE033A25755C1A9679C94699FD7CF,0
1888-01-16T00:00:00Z,A LAWYER ABSCONDS.,https://query.nytimes.com/gst/abstract.html?res=9C05E5DF173AE033A25755C1A9679C94699FD7CF,0
1888-01-16T00:00:00Z,ULSTER COUNTY'S INSANE.; THE AGITATION FOR A NEW ASYLUM BUILDING.,https://query.nytimes.com/gst/abstract.html?res=9F06E5DF173AE033A25755C1A9679C94699FD7CF,0
1888-01-16T00:00:00Z,KANSAS CITY'S CHANCE.,https://query.nytimes.com/gst/abstract.html?res=9505E5DF173AE033A25755C1A9679C94699FD7CF,0
1888-01-16T00:00:00Z,AN ALL-NIGHT CONVENTION.,https://query.nytimes.com/gst/abstract.html?res=9B0CE6DF173AE033A25755C1A9679C94699FD7CF,0
1888-01-16T00:00:00Z,THE GENTEEL VILLAINS.; DR. TALMAGE'S SECOND SERMON TO THE WOMEN OF AMERICA.,https://query.nytimes.com/gst/abstract.html?res=9D00E5DF173AE033A25755C1A9679C94699FD7CF,0
1888-01-16T00:00:00Z,WONDERS OF INVENTION.,https://query.nytimes.com/gst/abstract.html?res=9401E5DF173AE033A25755C1A9679C94699FD7CF,0
1888-01-16T00:00:00Z,A CRAZY BELLMAN.,https://query.nytimes.com/gst/abstract.html?res=9407E5DF173AE033A25755C1A9679C94699FD7CF,0
1888-01-16T00:00:00Z,TWO SUNDAY WEDDINGS.; PHILIP SIMON AND MIS LEWIN--BERNHARD ALTMAN AND MISS HARLAN.,https://query.nytimes.com/gst/abstract.html?res=9B05E4DF173AE033A25755C1A9679C94699FD7CF,0
1888-01-16T00:00:00Z,RUNNING LONDON CLOSE.; NEW-YORK STRIVING HARD FOR A WEATHER REPUTATION.,https://query.nytimes.com/gst/abstract.html?res=9501E4DF173AE033A25755C1A9679C94699FD7CF,0
1888-01-16T00:00:00Z,NEW PUBLICATIONS; LITERARY REMINISCENCES.,https://query.nytimes.com/gst/abstract.html?res=9900E5DF173AE033A25755C1A9679C94699FD7CF,0
1888-01-16T00:00:00Z,MONSTER PETITION.; KNIGHTS OF LABOR MOVING FOR A GOVERNMENT TELEGRAPH.,https://query.nytimes.com/gst/abstract.html?res=9D06E5DF173AE033A25755C1A9679C94699FD7CF,0
1888-01-16T00:00:00Z,Editorial Article 4 -- No Title,https://query.nytimes.com/gst/abstract.html?res=9502E5DF173AE033A25755C1A9679C94699FD7CF,0
1888-01-16T00:00:00Z,PLENTY OF DESCENDANTS.,https://query.nytimes.com/gst/abstract.html?res=9504E5DF173AE033A25755C1A9679C94699FD7CF,0
1888-01-16T00:00:00Z,A COWARDLY LIFE-SAVER.,https://query.nytimes.com/gst/abstract.html?res=9907E5DF173AE033A25755C1A9679C94699FD7CF,0
1888-01-16T00:00:00Z,"THE TRUST ""COMBINES.""",https://query.nytimes.com/gst/abstract.html?res=990DE5DF173AE033A25755C1A9679C94699FD7CF,0
1888-01-16T00:00:00Z,NOT RIPE FOR TOLSTOY'S FAITH.,https://query.nytimes.com/gst/abstract.html?res=9C0CE5DF173AE033A25755C1A9679C94699FD7CF,0
1888-01-16T00:00:00Z,LEGAL COERCION PROPOSED.; THE STRIKERS PREPARING CHARGES AGAINST TIME READING COMPANY.,https://query.nytimes.com/gst/abstract.html?res=9E04E5DF173AE033A25755C1A9679C94699FD7CF,0
1888-01-16T00:00:00Z,THE LOUISIANA DEMOCRATIC SLATE.,https://query.nytimes.com/gst/abstract.html?res=9B04E5DF173AE033A25755C1A9679C94699FD7CF,0
1888-01-16T00:00:00Z,SILENT SINCE HE SAILED AWAY.,https://query.nytimes.com/gst/abstract.html?res=9901E5DF173AE033A25755C1A9679C94699FD7CF,0
1888-01-16T00:00:00Z,FRIGHTFUL CONDITION OF OUR STREETS.,https://query.nytimes.com/gst/abstract.html?res=9E05E4DF173AE033A25755C1A9679C94699FD7CF,0
1888-01-16T00:00:00Z,Editorial Article 6 -- No Title,https://query.nytimes.com/gst/abstract.html?res=9D0DE5DF173AE033A25755C1A9679C94699FD7CF,0
1888-01-16T00:00:00Z,RAISING RETAIL COAL PRICES.; AN ADVANCE FOR WHICH EVEN THE DEALERS CAN GIVE NO EXCUSE.,https://query.nytimes.com/gst/abstract.html?res=9F00E4DF173AE033A25755C1A9679C94699FD7CF,0
1888-01-16T00:00:00Z,Obituary 2 -- No Title,https://query.nytimes.com/gst/abstract.html?res=9807E4DF173AE033A25755C1A9679C94699FD7CF,0
1888-01-16T00:00:00Z,THE GOSSIP OF PARIS.,https://query.nytimes.com/gst/abstract.html?res=9E07E5DF173AE033A25755C1A9679C94699FD7CF,0
1888-01-16T00:00:00Z,MISS KELLOGG APPEARS AGAIN.,https://query.nytimes.com/gst/abstract.html?res=9405E5DF173AE033A25755C1A9679C94699FD7CF,0
1888-01-16T00:00:00Z,Obituary 1 -- No Title,https://query.nytimes.com/gst/abstract.html?res=9D05E4DF173AE033A25755C1A9679C94699FD7CF,0
1888-01-16T00:00:00Z,THE OLDEST MAN IN WISCONSIN.,https://query.nytimes.com/gst/abstract.html?res=9D01E5DF173AE033A25755C1A9679C94699FD7CF,0
1888-01-16T00:00:00Z,TO PROTECT THE FAMILY.,https://query.nytimes.com/gst/abstract.html?res=9B0DE5DF173AE033A25755C1A9679C94699FD7CF,0
1888-01-16T00:00:00Z,THEY TALKED TOO MUCH.; CLEVER CAPTURE OF THREE PHILADELPHIA BURGLARS.,https://query.nytimes.com/gst/abstract.html?res=9400E4DF173AE033A25755C1A9679C94699FD7CF,0
1888-01-16T00:00:00Z,MUST SHOW ALL THEY ADVERTISE.,https://query.nytimes.com/gst/abstract.html?res=980CE5DF173AE033A25755C1A9679C94699FD7CF,0
1888-01-16T00:00:00Z,HILL'S QUARANTINE DEAL; HOW HIS VICTORY OVER PLATT IS TO BE USED. SIX REPUBLICAN SENATORS SAID TO HAVE BEEN INDUCED TO AID THE GOVERNOR IN HIS SCHEME.,https://query.nytimes.com/gst/abstract.html?res=9B0CE5DF173AE033A25755C1A9679C94699FD7CF,0
1888-01-16T00:00:00Z,SUNDAY SCHOOLS ABROAD.,https://query.nytimes.com/gst/abstract.html?res=9505E4DF173AE033A25755C1A9679C94699FD7CF,0
1888-01-16T00:00:00Z,AN UNFULFILLED PROPHECY.,https://query.nytimes.com/gst/abstract.html?res=9A0DE5DF173AE033A25755C1A9679C94699FD7CF,0
1888-01-16T00:00:00Z,AMUSEMENTS THIS EVENING.,https://query.nytimes.com/gst/abstract.html?res=9A02E5DF173AE033A25755C1A9679C94699FD7CF,0
1888-01-16T00:00:00Z,Editorial Article 5 -- No Title,https://query.nytimes.com/gst/abstract.html?res=9C0DE5DF173AE033A25755C1A9679C94699FD7CF,0
1888-01-16T00:00:00Z,DETERMINED TO DIE.,https://query.nytimes.com/gst/abstract.html?res=9F00E5DF173AE033A25755C1A9679C94699FD7CF,0
1888-01-16T00:00:00Z,NORTHERN VERSUS SOUTHERN CORN.,https://query.nytimes.com/gst/abstract.html?res=9B00E5DF173AE033A25755C1A9679C94699FD7CF,0
1888-01-16T00:00:00Z,NOT IN BLAINE'S INTEREST.; THE NEW PLAN FOR CHOOSING DELEGATES IN WISCONSIN.,https://query.nytimes.com/gst/abstract.html?res=9F04E5DF173AE033A25755C1A9679C94699FD7CF,0
1888-01-16T00:00:00Z,BALFOUR'S CRUEL THREAT; TO IMPRISON THE FEEBLEST OF IRISH LEADERS. THE CHARGE MADE BY WILFRID BLUNT AGAINST THE CHIEF SECRETARY--AN ORANGE ROW.,https://query.nytimes.com/gst/abstract.html?res=9F07E5DF173AE033A25755C1A9679C94699FD7CF,0
1888-01-16T00:00:00Z,GOOD FOR THE ICEMEN.,https://query.nytimes.com/gst/abstract.html?res=9B05E5DF173AE033A25755C1A9679C94699FD7CF,0
1888-01-16T00:00:00Z,WITH THE LABOR MEN.; CENTRAL LABOR UNION'S BUSINESS--A DEFEAT FOR HOME CLUB MEN.,https://query.nytimes.com/gst/abstract.html?res=9B06E5DF173AE033A25755C1A9679C94699FD7CF,0
1888-01-16T00:00:00Z,EXAMINING THE RECORDS.,https://query.nytimes.com/gst/abstract.html?res=9C06E5DF173AE033A25755C1A9679C94699FD7CF,0
1888-01-16T00:00:00Z,THE TEMPERANCE WORKERS.; MEETINGS OF THE VARIOUS LOCAL ASSOCIATOINS YESTERDAY.,https://query.nytimes.com/gst/abstract.html?res=9500E5DF173AE033A25755C1A9679C94699FD7CF,0
1888-01-16T00:00:00Z,WILL IT DRIFT UP TOWN?; TALK OF SHIFTING THE MANHATTAN CLUB'S QUARTERS.,https://query.nytimes.com/gst/abstract.html?res=9801E5DF173AE033A25755C1A9679C94699FD7CF,0
1888-01-16T00:00:00Z,BOOKS RECEIVED.,https://query.nytimes.com/gst/abstract.html?res=9A00E5DF173AE033A25755C1A9679C94699FD7CF,0
1888-01-16T00:00:00Z,LATEST FOREIGN SHIPPING.,https://query.nytimes.com/gst/abstract.html?res=9C07E4DF173AE033A25755C1A9679C94699FD7CF,0
1888-01-16T00:00:00Z,WHY NOT OPEN SESSIONS?,https://query.nytimes.com/gst/abstract.html?res=9F0DE5DF173AE033A25755C1A9679C94699FD7CF,0
1888-01-16T00:00:00Z,EX-GOV. CORNELL'S FLYING TRIP.,https://query.nytimes.com/gst/abstract.html?res=9C07E5DF173AE033A25755C1A9679C94699FD7CF,0
1888-01-16T00:00:00Z,THE EARLY ABOLITIONISTS; MEMORIES OF THE CONFLICTS IN ALTON. ELISHA DOTY'S ASSOCIATION WITH JOHN BROWN--JUDGE DAVIS AND THE CHAVIS CASE.,https://query.nytimes.com/gst/abstract.html?res=9B04E4DF173AE033A25755C1A9679C94699FD7CF,0
1888-01-16T00:00:00Z,RESIGNED THEIR PULPITS.,https://query.nytimes.com/gst/abstract.html?res=950CE6DF173AE033A25755C1A9679C94699FD7CF,0
1888-01-16T00:00:00Z,FOUGHT THE FLAMES ALL DAY.,https://query.nytimes.com/gst/abstract.html?res=9404E5DF173AE033A25755C1A9679C94699FD7CF,0
1888-01-16T00:00:00Z,AN ALL-DAY MEETING.,https://query.nytimes.com/gst/abstract.html?res=9C00E4DF173AE033A25755C1A9679C94699FD7CF,0
1888-01-16T00:00:00Z,OFF TO JOIN THE PACIFIC SQUADRON.,https://query.nytimes.com/gst/abstract.html?res=9E03E4DF173AE033A25755C1A9679C94699FD7CF,0
1888-01-16T00:00:00Z,A POLICEMAN KILLED.,https://query.nytimes.com/gst/abstract.html?res=9E01E5DF173AE033A25755C1A9679C94699FD7CF,0
1888-01-16T00:00:00Z,THE REFORM CLUB'S DINNER.,https://query.nytimes.com/gst/abstract.html?res=9B00E4DF173AE033A25755C1A9679C94699FD7CF,0
1888-01-16T00:00:00Z,"IN AND ABOUT THE CITY; A MALTHOUSE IN FLAMES. LOSS OF ABOUT $50,000 AT THE AURORA PARK BREWERY.",https://query.nytimes.com/gst/abstract.html?res=9500E4DF173AE033A25755C1A9679C94699FD7CF,0
1888-01-16T00:00:00Z,YALE IS WELL RID OF THEM.,https://query.nytimes.com/gst/abstract.html?res=9904E4DF173AE033A25755C1A9679C94699FD7CF,0
1888-01-16T00:00:00Z,A CRISIS IN MANITOBA.; THE CABINET OUSTED AND HARRISON'S LEADERSHIP ENDED.,https://query.nytimes.com/gst/abstract.html?res=9E05E5DF173AE033A25755C1A9679C94699FD7CF,0
1888-01-16T00:00:00Z,ROCK ISLAND IN TEXAS.,https://query.nytimes.com/gst/abstract.html?res=9A04E5DF173AE033A25755C1A9679C94699FD7CF,0
1888-01-16T00:00:00Z,CITY AND SUBURBAN NEWS; NEW-YORK. BROOKLYN. NEW JERSEY.,https://query.nytimes.com/gst/abstract.html?res=9B01E5DF173AE033A25755C1A9679C94699FD7CF,0
1888-01-16T00:00:00Z,RETALIATION CALLED FOR.,https://query.nytimes.com/gst/abstract.html?res=9F05E5DF173AE033A25755C1A9679C94699FD7CF,0
1888-01-16T00:00:00Z,ABOVE ALL OTHERS,https://query.nytimes.com/gst/abstract.html?res=9905E4DF173AE033A25755C1A9679C94699FD7CF,0
1888-01-16T00:00:00Z,"KEPT OUT BY THE TARIFF; COAL FOR WHICH NEW-ENGLAND CRIES IN VAIN.THE FIELDS OF THE CANADIAN, MARITIME PROVINCES CLOSED TO US BY PROHIBITIVE DUTIES.",https://query.nytimes.com/gst/abstract.html?res=9507E5DF173AE033A25755C1A9679C94699FD7CF,0
1888-01-16T00:00:00Z,BAD FOR MANITOBA FARMERS.,https://query.nytimes.com/gst/abstract.html?res=9A05E5DF173AE033A25755C1A9679C94699FD7CF,0
1888-01-16T00:00:00Z,"ALBION IS AROUSED.; DETERMINED TO PUT AN END TO THE ""TRAMP BUSINESS.""",https://query.nytimes.com/gst/abstract.html?res=9804E4DF173AE033A25755C1A9679C94699FD7CF,0
1888-01-16T00:00:00Z,MR. FLOWER'S AMBITION; WHICH GOV. HILL MEANS TO GRATIFY IF HE CAN.,https://query.nytimes.com/gst/abstract.html?res=990CE6DF173AE033A25755C1A9679C94699FD7CF,0
1888-01-16T00:00:00Z,THEATRICAL GOSSIP.,https://query.nytimes.com/gst/abstract.html?res=9803E4DF173AE033A25755C1A9679C94699FD7CF,0
1888-01-16T00:00:00Z,CORRECTING MINOR DETAILS.,https://query.nytimes.com/gst/abstract.html?res=9805E4DF173AE033A25755C1A9679C94699FD7CF,0
1888-01-16T00:00:00Z,PETER AND POLITICS.,https://query.nytimes.com/gst/abstract.html?res=9907E4DF173AE033A25755C1A9679C94699FD7CF,0
1888-01-16T00:00:00Z,LATEST ARRIVALS.,https://query.nytimes.com/gst/abstract.html?res=9404E4DF173AE033A25755C1A9679C94699FD7CF,0
1888-01-16T00:00:00Z,Editorial Article 2 -- No Title,https://query.nytimes.com/gst/abstract.html?res=9B02E5DF173AE033A25755C1A9679C94699FD7CF,0
1888-01-16T00:00:00Z,RAKED THE FIRES JUST IN TIME.,https://query.nytimes.com/gst/abstract.html?res=9D03E4DF173AE033A25755C1A9679C94699FD7CF,0
1888-01-16T00:00:00Z,THE EUROPEAN BOURSES.; AMERICAN SECURITIES NEGLECTED-- EFFECT ON THE WAR SCARE.,https://query.nytimes.com/gst/abstract.html?res=9D03E5DF173AE033A25755C1A9679C94699FD7CF,0
1888-01-16T00:00:00Z,NABBED FOR AN OLD CRIME.; GALLAGHER COMES FROM ONE PRISON TO GO TO ANOTHER.,https://query.nytimes.com/gst/abstract.html?res=9F05E4DF173AE033A25755C1A9679C94699FD7CF,0
1888-01-16T00:00:00Z,Editorial Article 3 -- No Title,https://query.nytimes.com/gst/abstract.html?res=9402E5DF173AE033A25755C1A9679C94699FD7CF,0
1888-01-16T00:00:00Z,INDIAN SERVICE BREVETS.,https://query.nytimes.com/gst/abstract.html?res=980DE5DF173AE033A25755C1A9679C94699FD7CF,0
1888-01-16T00:00:00Z,THE NORTHWEST BLIZZARD; A DEATH LIST OF SIXTY-THREE ALREADY RECORDED. THE STORM MORE DESTRUCTIVE OF LIFE THAN THE GREAT ONE OF 1873-- RAILROAD TRAINS SNOWED IN.,https://query.nytimes.com/gst/abstract.html?res=9805E5DF173AE033A25755C1A9679C94699FD7CF,0
1888-01-16T00:00:00Z,Editorial Article 1 -- No Title,https://query.nytimes.com/gst/abstract.html?res=9902E5DF173AE033A25755C1A9679C94699FD7CF,0
1888-01-16T00:00:00Z,THE GAELIC SOCIETY'S LIBRARY.,https://query.nytimes.com/gst/abstract.html?res=9A01E5DF173AE033A25755C1A9679C94699FD7CF,0
1888-01-16T00:00:00Z,"LOOK FOR THE ""UNKNOWNS.""; A STORY OF TWO SPRINTERS WHO GULL THE PUBLIC.",https://query.nytimes.com/gst/abstract.html?res=9A06E5DF173AE033A25755C1A9679C94699FD7CF,0
1888-01-16T00:00:00Z,PERSONAL INTELLIGENCE.,https://query.nytimes.com/gst/abstract.html?res=9E04E4DF173AE033A25755C1A9679C94699FD7CF,0
1888-01-16T00:00:00Z,A NEW CATHOLIC CHURCH.,https://query.nytimes.com/gst/abstract.html?res=9C00E5DF173AE033A25755C1A9679C94699FD7CF,0
1888-01-16T00:00:00Z,THE STUDENTS' MEETING.,https://query.nytimes.com/gst/abstract.html?res=9D0CE5DF173AE033A25755C1A9679C94699FD7CF,0
1888-01-16T00:00:00Z,OUTGOING STEAMSHIPS.,https://query.nytimes.com/gst/abstract.html?res=9903E5DF173AE033A25755C1A9679C94699FD7CF,0
1888-01-16T00:00:00Z,THERE WAS NO TROUBLE.; DR. MAURY ALLOWED TO OCCUPY HIS PULPIT YESTERDAY.,https://query.nytimes.com/gst/abstract.html?res=9904E5DF173AE033A25755C1A9679C94699FD7CF,0
1888-01-16T00:00:00Z,OUTWITTED BY HIS WIFE.; STARTLING SURPRISE FOR A RUNAWAY HUSBAND.,https://query.nytimes.com/gst/abstract.html?res=9800E4DF173AE033A25755C1A9679C94699FD7CF,0
1888-01-16T00:00:00Z,WAR PRICES STILL IN VOGUE; DIVIDENDS THAT SMACK OF A PROHIBITORY TARIFF. ASSOCIATIONS THAT DICTATE PRICES AND LIMIT PRODUCTION--THE WORKINGMAN AWAKENING.,https://query.nytimes.com/gst/abstract.html?res=9901E4DF173AE033A25755C1A9679C94699FD7CF,0
1888-01-16T00:00:00Z,WHY DETROIT COMPLAINS; UNJUST DISCRIMINATION BY RAILROADS. AN APPEAL TO THE COMMISSION FOR RELIEF FROM TRUNK LINE ASSOCIATION RATES.,https://query.nytimes.com/gst/abstract.html?res=9D00E4DF173AE033A25755C1A9679C94699FD7CF,0
1888-01-16T00:00:00Z,"A STAKE WORTH WINNING; A PRIZE OF $50,000 TO BE WON AT SHEEPSHEDAD BAY. ENTRIES FOR THE BIG BROOKLYN RACES --MR. BELMONT'S FAT COLTS--A BAD NAP FOR A PLUNGER.",https://query.nytimes.com/gst/abstract.html?res=9F01E5DF173AE033A25755C1A9679C94699FD7CF,0
1888-01-16T00:00:00Z,COURT CALENDARS--THIS DAY.,https://query.nytimes.com/gst/abstract.html?res=9A03E5DF173AE033A25755C1A9679C94699FD7CF,0
1888-01-16T00:00:00Z,DIED AT THE AGE OF 106.,https://query.nytimes.com/gst/abstract.html?res=9D07E5DF173AE033A25755C1A9679C94699FD7CF,0
1888-01-17T00:00:00Z,Article 2 -- No Title,https://query.nytimes.com/gst/abstract.html?res=9D03E6DC153FE432A25754C1A9679C94699FD7CF,0
1888-01-17T00:00:00Z,FRANK SIDDALL RETIRES.,https://query.nytimes.com/gst/abstract.html?res=9B02E6DC153FE432A25754C1A9679C94699FD7CF,0
