pub_date,main_headline,article_url,classification
1890-01-01T00:00:00Z,HIS RESIGNATION ACCEPTED.; COMMISSIONER COLEMAN'S SUCCESSOR WILL BE NAMED SOON.,https://query.nytimes.com/gst/abstract.html?res=9D03E5DD143BE533A25752C0A9679C94619ED7CF,0
1890-01-01T00:00:00Z,Front Page 10 -- No Title,https://query.nytimes.com/gst/abstract.html?res=980DE6DD143BE533A25752C0A9679C94619ED7CF,0
1890-01-01T00:00:00Z,LIQUOR IN SOLDIERS' HOMES.,https://query.nytimes.com/gst/abstract.html?res=9B00E5DD143BE533A25752C0A9679C94619ED7CF,0
1890-01-01T00:00:00Z,FREEDOM THE WATCH WORD; SETTING FORTH THE NEEDS OF THIS COUNTRY. REPRESENTATIVE MILLS AND OTHERS SPEAK BEFORE THE MASSACHUSETTS TARIFF REFORM LEAGUE.,https://query.nytimes.com/gst/abstract.html?res=950DE6DD143BE533A25752C0A9679C94619ED7CF,0
1890-01-01T00:00:00Z,MRS. HICKOK BEATEN.; JUDGE WALLACE'S DECISION IN FAVOR OF FERNANDO WOOD'S SON.,https://query.nytimes.com/gst/abstract.html?res=940DE6DD143BE533A25752C0A9679C94619ED7CF,0
1890-01-01T00:00:00Z,WALL-STREET TALK.,https://query.nytimes.com/gst/abstract.html?res=9E03E5DD143BE533A25752C0A9679C94619ED7CF,0
1890-01-01T00:00:00Z,JOHN GUY VASSAR'S WILL.; THE CASE CONCLUDED AND NOW IN THE HANDS OF THE JUDGE.,https://query.nytimes.com/gst/abstract.html?res=9502E6DD143BE533A25752C0A9679C94619ED7CF,0
1890-01-01T00:00:00Z,THE PENALTY OF THE LAW.,https://query.nytimes.com/gst/abstract.html?res=9E07E5DD143BE533A25752C0A9679C94619ED7CF,0
1890-01-01T00:00:00Z,THEATRICAL GOSSIP.,https://query.nytimes.com/gst/abstract.html?res=9500E5DD143BE533A25752C0A9679C94619ED7CF,0
1890-01-01T00:00:00Z,A STEAM TROMBONE.; THE PROPRIETOR ENJOINED FROM GIVING HIS WILD CONCERTS.,https://query.nytimes.com/gst/abstract.html?res=9D00E6DD143BE533A25752C0A9679C94619ED7CF,0
1890-01-01T00:00:00Z,FIRE IN A TENEMENT.; A BAKER'S CARELESSNESS JEOPARDIZES THE LIVES OF MANY TENANTS.,https://query.nytimes.com/gst/abstract.html?res=9C03E5DD143BE533A25752C0A9679C94619ED7CF,0
1890-01-01T00:00:00Z,RINGING IN THE NEW YEAR.; THOUSANDS OF PEOPLE LISTEN TO TRINITY'S CHIMES AT MIDNIGHT.,https://query.nytimes.com/gst/abstract.html?res=9906E5DD143BE533A25752C0A9679C94619ED7CF,0
1890-01-01T00:00:00Z,FALL RIVER MILLS PRODUCTION.,https://query.nytimes.com/gst/abstract.html?res=9400E6DD143BE533A25752C0A9679C94619ED7CF,0
1890-01-01T00:00:00Z,GLASS MAKERS' DEMANDS; ONE WHO PLEADS FOR FREE RAW MATERIALS. BOTHERING THE REPUBLICAN COMMITTEEMEN WITH HIS FACTS AND FIGURES -- PLEAS OF PROTECTION MEN.,https://query.nytimes.com/gst/abstract.html?res=9A02E6DD143BE533A25752C0A9679C94619ED7CF,0
1890-01-01T00:00:00Z,AN OFFICIAL WARNING.; AN OFFICIAL WARNING. THE INCREASED DEATH RATE SHOULD MAKE ALL CAREFUL.,https://query.nytimes.com/gst/abstract.html?res=9B02E6DD143BE533A25752C0A9679C94619ED7CF,0
1890-01-01T00:00:00Z,Editorial Article 1 -- No Title,https://query.nytimes.com/gst/abstract.html?res=9904E5DD143BE533A25752C0A9679C94619ED7CF,0
1890-01-01T00:00:00Z,HE'S MISSED LOTS OF FUN.,https://query.nytimes.com/gst/abstract.html?res=9B07E5DD143BE533A25752C0A9679C94619ED7CF,0
1890-01-01T00:00:00Z,Obituary 1 -- No Title,https://query.nytimes.com/gst/abstract.html?res=9C00E5DD143BE533A25752C0A9679C94619ED7CF,0
1890-01-01T00:00:00Z,FOR SENATOR FROM MONTANA.,https://query.nytimes.com/gst/abstract.html?res=9A06E5DD143BE533A25752C0A9679C94619ED7CF,0
1890-01-01T00:00:00Z,A BOSTON PAPER REDUCES ITS PRICE.,https://query.nytimes.com/gst/abstract.html?res=9900E6DD143BE533A25752C0A9679C94619ED7CF,0
1890-01-01T00:00:00Z,FRANK JONES ELECTED PRESIDENT.,https://query.nytimes.com/gst/abstract.html?res=9A0CE6DD143BE533A25752C0A9679C94619ED7CF,0
1890-01-01T00:00:00Z,A CHILDREN'S MASKED BALL.; BRILLIANT FESTIVAL GIVEN IN WASHINGTON BY JOHN M'LEAN.,https://query.nytimes.com/gst/abstract.html?res=9C0DE6DD143BE533A25752C0A9679C94619ED7CF,0
1890-01-01T00:00:00Z,THE NEW-ORLEANS CARNIVAL.,https://query.nytimes.com/gst/abstract.html?res=9E00E6DD143BE533A25752C0A9679C94619ED7CF,0
1890-01-01T00:00:00Z,MR. COLEMAN'S MISTAKES.,https://query.nytimes.com/gst/abstract.html?res=9C07E5DD143BE533A25752C0A9679C94619ED7CF,0
1890-01-01T00:00:00Z,MARY ANDERSON RETIRES.; RUMORED ENGAGEMENT TO MR. DE NAVARRO -- AMERICANS ABROAD.,https://query.nytimes.com/gst/abstract.html?res=9C01E5DD143BE533A25752C0A9679C94619ED7CF,0
1890-01-01T00:00:00Z,Marriage Announcement 1 -- No Title,https://query.nytimes.com/gst/abstract.html?res=9501E5DD143BE533A25752C0A9679C94619ED7CF,0
1890-01-01T00:00:00Z,SOFT COAL IS SCARCE.; A DEALER AT FALL RIVER CAUSES SOMETHING OF A SCARE.,https://query.nytimes.com/gst/abstract.html?res=9A00E6DD143BE533A25752C0A9679C94619ED7CF,0
1890-01-01T00:00:00Z,Article 2 -- No Title,https://query.nytimes.com/gst/abstract.html?res=9506E5DD143BE533A25752C0A9679C94619ED7CF,0
1890-01-01T00:00:00Z,A NEW SEAL SKIN COMPANY.,https://query.nytimes.com/gst/abstract.html?res=9E0CE6DD143BE533A25752C0A9679C94619ED7CF,0
1890-01-01T00:00:00Z,DISMISSED FROM PUBLIC OFFICE.,https://query.nytimes.com/gst/abstract.html?res=9500E6DD143BE533A25752C0A9679C94619ED7CF,0
1890-01-01T00:00:00Z,MR. EDISON'S INVENTIONS.,https://query.nytimes.com/gst/abstract.html?res=9F00E6DD143BE533A25752C0A9679C94619ED7CF,0
1890-01-01T00:00:00Z,Front Page 2 -- No Title,https://query.nytimes.com/gst/abstract.html?res=9B03E6DD143BE533A25752C0A9679C94619ED7CF,0
1890-01-01T00:00:00Z,TRICKY SENATOR ALLISON.; HOW HE DUPED HIS CONSTITUENTS AND SERVED HIS EASTERN FRIENDS.,https://query.nytimes.com/gst/abstract.html?res=9E01E5DD143BE533A25752C0A9679C94619ED7CF,0
1890-01-01T00:00:00Z,A WEALTHY MAN'S SUICIDE.,https://query.nytimes.com/gst/abstract.html?res=9D06E5DD143BE533A25752C0A9679C94619ED7CF,0
1890-01-01T00:00:00Z,MORE VIEWS ON CANADA; VARIOUS INTERESTS BEFORE THE SENATORS. HOW NEW-YORK FARMERS LOOK UPON THE COMMERCIAL-UNION PROJECT -- LUMBER AND THE FISHERIES.,https://query.nytimes.com/gst/abstract.html?res=9407E5DD143BE533A25752C0A9679C94619ED7CF,0
1890-01-01T00:00:00Z,DROWNED IN A TUB.,https://query.nytimes.com/gst/abstract.html?res=9D03E6DD143BE533A25752C0A9679C94619ED7CF,0
1890-01-01T00:00:00Z,A SHIP ABANDONED AT SEA.; AND NO TRACE OF THE SHAKSPERE'S CREW CAN BE FOUND.,https://query.nytimes.com/gst/abstract.html?res=9C06E5DD143BE533A25752C0A9679C94619ED7CF,0
1890-01-01T00:00:00Z,CHICAGO LIVE STOCK.,https://query.nytimes.com/gst/abstract.html?res=9C05E5DD143BE533A25752C0A9679C94619ED7CF,0
1890-01-01T00:00:00Z,Editorial Article 5 -- No Title,https://query.nytimes.com/gst/abstract.html?res=9504E5DD143BE533A25752C0A9679C94619ED7CF,0
1890-01-01T00:00:00Z,Editorial Article 6 -- No Title,https://query.nytimes.com/gst/abstract.html?res=9807E5DD143BE533A25752C0A9679C94619ED7CF,0
1890-01-01T00:00:00Z,THEY COVERED THE POSTERS.,https://query.nytimes.com/gst/abstract.html?res=9D0DE6DD143BE533A25752C0A9679C94619ED7CF,0
1890-01-01T00:00:00Z,MILK PUNCH RULED OUT.; JUDGE BREWER'S FRIENDS FORCED TO CONTENT THEMSELVES WITH TEA.,https://query.nytimes.com/gst/abstract.html?res=9C00E6DD143BE533A25752C0A9679C94619ED7CF,0
1890-01-01T00:00:00Z,Article 1 -- No Title,https://query.nytimes.com/gst/abstract.html?res=9B0DE6DD143BE533A25752C0A9679C94619ED7CF,0
1890-01-01T00:00:00Z,GETTING AT THE FACTS.,https://query.nytimes.com/gst/abstract.html?res=9D07E5DD143BE533A25752C0A9679C94619ED7CF,0
1890-01-01T00:00:00Z,THE DEATH CURRENT TEST; WORK OF THE DYNAMO AT AUBURN PRISON. A HORSE AND A CALF SUBJECTED TO EXPERIMENTS WHICH PROVE THAT ELECTRICITY WILL KILL INSTANTLY.,https://query.nytimes.com/gst/abstract.html?res=9F06E5DD143BE533A25752C0A9679C94619ED7CF,0
1890-01-01T00:00:00Z,"THE CITY'S NEW BUDGET; THE ALLOWANCES AWARDED EACH DEPARTMENT. IT WILL COST A LITTLE OVER $35,000,000 TO RUN THE CITY GOVERNMENT DURING THE YEAR.",https://query.nytimes.com/gst/abstract.html?res=990CE6DD143BE533A25752C0A9679C94619ED7CF,0
1890-01-01T00:00:00Z,"THE GOVERNOR'S ""POLITICS.""",https://query.nytimes.com/gst/abstract.html?res=9F07E5DD143BE533A25752C0A9679C94619ED7CF,0
1890-01-01T00:00:00Z,Editorial Article 2 -- No Title,https://query.nytimes.com/gst/abstract.html?res=9A04E5DD143BE533A25752C0A9679C94619ED7CF,0
1890-01-01T00:00:00Z,FAILURE OF RETAIL CLOTHIERS.,https://query.nytimes.com/gst/abstract.html?res=9F0DE6DD143BE533A25752C0A9679C94619ED7CF,0
1890-01-01T00:00:00Z,Front Page 1 -- No Title,https://query.nytimes.com/gst/abstract.html?res=9F03E6DD143BE533A25752C0A9679C94619ED7CF,0
1890-01-01T00:00:00Z,OFFICIAL CHANGES.,https://query.nytimes.com/gst/abstract.html?res=940CE6DD143BE533A25752C0A9679C94619ED7CF,0
1890-01-01T00:00:00Z,A PLACE FOR HARRISON'S COUSIN.,https://query.nytimes.com/gst/abstract.html?res=9B0CE6DD143BE533A25752C0A9679C94619ED7CF,0
1890-01-01T00:00:00Z,GARRISON AND HIS FATHER-IN-LAW.,https://query.nytimes.com/gst/abstract.html?res=9400E5DD143BE533A25752C0A9679C94619ED7CF,0
1890-01-01T00:00:00Z,THE SAN SALVADOR REVOLUTION.,https://query.nytimes.com/gst/abstract.html?res=9E03E6DD143BE533A25752C0A9679C94619ED7CF,0
1890-01-01T00:00:00Z,Editorial Article 4 -- No Title,https://query.nytimes.com/gst/abstract.html?res=9404E5DD143BE533A25752C0A9679C94619ED7CF,0
1890-01-01T00:00:00Z,RUN DOWN IN THE WOODS.; A PENNSYLVANIA DESPERADO CAPTURED AFTER A LONG CHASE.,https://query.nytimes.com/gst/abstract.html?res=9507E5DD143BE533A25752C0A9679C94619ED7CF,0
1890-01-01T00:00:00Z,"WHAT IS EUSTACE'S ""PULL?""; THE MAN WHOM GOV. HILL HAS MADE A CIVIL SERVICE COMMISSIONER.",https://query.nytimes.com/gst/abstract.html?res=9B00E6DD143BE533A25752C0A9679C94619ED7CF,0
1890-01-01T00:00:00Z,RAILWAY MANAGEMENT.; FIGHTING FOR THE MILK TRADE.,https://query.nytimes.com/gst/abstract.html?res=9F0CE6DD143BE533A25752C0A9679C94619ED7CF,0
1890-01-01T00:00:00Z,SENATOR GORMAN'S BREAK; HIS COVERT ATTACK ON BALLOT REFORM. AN EXPOSURE THAT MAKES MARYLAND POLITICIANS LAUGH -- THE LEGISLATURE MEETS TO-DAY.,https://query.nytimes.com/gst/abstract.html?res=9A07E5DD143BE533A25752C0A9679C94619ED7CF,0
1890-01-01T00:00:00Z,IRON FROM THE ORE.; A DAY COMING WHEN BLAST FURNACES WILL BE USELESS.,https://query.nytimes.com/gst/abstract.html?res=9402E6DD143BE533A25752C0A9679C94619ED7CF,0
1890-01-01T00:00:00Z,AMERICAN HISTORIANS.; PAPERS OF THE LAST DAY -- NEW OFFICERS ELECTED.,https://query.nytimes.com/gst/abstract.html?res=990DE6DD143BE533A25752C0A9679C94619ED7CF,0
1890-01-01T00:00:00Z,BRICE'S LIEUTENANTS LAUGH.,https://query.nytimes.com/gst/abstract.html?res=9903E6DD143BE533A25752C0A9679C94619ED7CF,0
1890-01-01T00:00:00Z,CITY AND SUBURBAN NEWS,https://query.nytimes.com/gst/abstract.html?res=9E05E5DD143BE533A25752C0A9679C94619ED7CF,0
1890-01-01T00:00:00Z,Front Page 8 -- No Title,https://query.nytimes.com/gst/abstract.html?res=9902E6DD143BE533A25752C0A9679C94619ED7CF,0
1890-01-01T00:00:00Z,LAID IN POET'S CORNER; BROWNING BURIED IN WESTMINSTER ABBEY. THE FUNERAL SERVICES ATTENDED BY MANY FRIENDS -- PLACED IN FRONT OF COWLEY'S MONUMENT.,https://query.nytimes.com/gst/abstract.html?res=9501E6DD143BE533A25752C0A9679C94619ED7CF,0
1890-01-01T00:00:00Z,Front Page 3 -- No Title,https://query.nytimes.com/gst/abstract.html?res=9503E6DD143BE533A25752C0A9679C94619ED7CF,0
1890-01-01T00:00:00Z,A COMPLETE SURPRISE.; AN ELEGANT WATCH PRESENTED TO SECRETARY OF STATE COOK.,https://query.nytimes.com/gst/abstract.html?res=9C03E6DD143BE533A25752C0A9679C94619ED7CF,0
1890-01-01T00:00:00Z,"WRECK ON THE PAN HANDLE.; TWO PERSONS KILLED, ENGINES DEMOLISHED, AND COACHES BURNED.",https://query.nytimes.com/gst/abstract.html?res=9D0CE6DD143BE533A25752C0A9679C94619ED7CF,0
1890-01-01T00:00:00Z,A SECOND AUTOPSY MADE; THOMAS HART MAY YET BE TRIED FOR MURDER. INVESTIGATING THE DEATH OF JOHN RUSK -- WHAT WESTCHESTER HIBERNIANS WILL HAVE TO EXPLAIN.,https://query.nytimes.com/gst/abstract.html?res=9A0DE6DD143BE533A25752C0A9679C94619ED7CF,0
1890-01-01T00:00:00Z,Front Page 5 -- No Title,https://query.nytimes.com/gst/abstract.html?res=9D02E6DD143BE533A25752C0A9679C94619ED7CF,0
1890-01-01T00:00:00Z,NO RESPECTER OF RANK; LORD SALISBURY SICK WITH THE INFLUENZA. FEARS OF PNEUMONIA -- THE DISEASE IN THE SOUTH OF EUROPE -- MORE VIRULENT AT ITS HEIGHT.,https://query.nytimes.com/gst/abstract.html?res=9403E6DD143BE533A25752C0A9679C94619ED7CF,0
1890-01-01T00:00:00Z,AFRAID OF THE DISEASE.; CHAIRMAN BRICE A VICTIM -- SUICIDE OF A FRIGHTENED SUFFERER.,https://query.nytimes.com/gst/abstract.html?res=9E02E6DD143BE533A25752C0A9679C94619ED7CF,0
1890-01-01T00:00:00Z,THE POPE'S LAMENT.; STILL CLINGING TO TEMPORAL POWER AND COMPLAINING OF INSULTS.,https://query.nytimes.com/gst/abstract.html?res=9803E6DD143BE533A25752C0A9679C94619ED7CF,0
1890-01-01T00:00:00Z,CHICAGO PRODUCE MARKETS.,https://query.nytimes.com/gst/abstract.html?res=950CE6DD143BE533A25752C0A9679C94619ED7CF,0
1890-01-01T00:00:00Z,Front Page 4 -- No Title,https://query.nytimes.com/gst/abstract.html?res=9C02E6DD143BE533A25752C0A9679C94619ED7CF,0
1890-01-01T00:00:00Z,TOLD IN REPORTS.,https://query.nytimes.com/gst/abstract.html?res=980CE6DD143BE533A25752C0A9679C94619ED7CF,0
1890-01-01T00:00:00Z,OBITUARY.,https://query.nytimes.com/gst/abstract.html?res=9901E5DD143BE533A25752C0A9679C94619ED7CF,0
1890-01-01T00:00:00Z,ACCUSED OF CONSPIRACY.; TRYING TO OBTAIN MONEY FOR ALLEGED DAMAGES IN PHILADELPHIA.,https://query.nytimes.com/gst/abstract.html?res=9E0DE6DD143BE533A25752C0A9679C94619ED7CF,0
1890-01-01T00:00:00Z,Front Page 6 -- No Title,https://query.nytimes.com/gst/abstract.html?res=9F02E6DD143BE533A25752C0A9679C94619ED7CF,0
1890-01-01T00:00:00Z,FUNERAL OF THE REV. JAMES A. O'HARA.,https://query.nytimes.com/gst/abstract.html?res=9800E6DD143BE533A25752C0A9679C94619ED7CF,0
1890-01-01T00:00:00Z,Front Page 7 -- No Title,https://query.nytimes.com/gst/abstract.html?res=9802E6DD143BE533A25752C0A9679C94619ED7CF,0
1890-01-01T00:00:00Z,HANDSOME GIFTS FOR TWO SISTERS.,https://query.nytimes.com/gst/abstract.html?res=9A03E6DD143BE533A25752C0A9679C94619ED7CF,0
1890-01-01T00:00:00Z,Editorial Article 3 -- No Title,https://query.nytimes.com/gst/abstract.html?res=9B04E5DD143BE533A25752C0A9679C94619ED7CF,0
1890-01-02T00:00:00Z,AT GUTTENBERG.; NEARLY ALL THE FAVORITES WIN IN THE SIX RACES RUN.,https://query.nytimes.com/gst/abstract.html?res=990DE7D81539E033A25751C0A9679C94619ED7CF,0
1890-01-02T00:00:00Z,PRIZE FIGHTS PROHIBITED.; MAYOR SHAKESPEARE WILL HAVE NO MORE IN NEW-ORLEANS.,https://query.nytimes.com/gst/abstract.html?res=9E06E7D81539E033A25751C0A9679C94619ED7CF,0
1890-01-02T00:00:00Z,OVER THE NEW BRIDGE.; A TRAIN RUNS FROM STATEN ISLAND TO NEW-JERSEY.,https://query.nytimes.com/gst/abstract.html?res=9506E6D81539E033A25751C0A9679C94619ED7CF,1
1890-01-02T00:00:00Z,SHUT DOWN BY A STRIKE.,https://query.nytimes.com/gst/abstract.html?res=9B07E7D81539E033A25751C0A9679C94619ED7CF,0
1890-01-02T00:00:00Z,WAITING FOR REFORM LAWS; JERSEY CITY ANXIOUS ABOUT THE LEGISLATURE. PROBABLE INVESTIGATION BY A SENATE COMMITTEE -- GOV. ABBETT'S APPOINTMENTS.,https://query.nytimes.com/gst/abstract.html?res=9406E6D81539E033A25751C0A9679C94619ED7CF,0
1890-01-02T00:00:00Z,MAYOR NOONAN'S NEW YEAR'S GIFT.,https://query.nytimes.com/gst/abstract.html?res=9504E7D81539E033A25751C0A9679C94619ED7CF,0
1890-01-02T00:00:00Z,POLITICS AND FISTS.; A STREET FIGHT BETWEEN TWO ALLEGHENY CITY COUNCILMEN.,https://query.nytimes.com/gst/abstract.html?res=9C0DE7D81539E033A25751C0A9679C94619ED7CF,0
1890-01-02T00:00:00Z,MEXICO'S BEST CUSTOMER.; THE UNITED STATES TAKES THE GREATER PART OF HER EXPORTS.,https://query.nytimes.com/gst/abstract.html?res=9B02E7D81539E033A25751C0A9679C94619ED7CF,0
1890-01-02T00:00:00Z,THE YEAR THAT HAS GONE; IT WAS REMARKABLE IN VARIOUS WAYS. UNUSUALLY WARM AND WET -- CITY STATISTICS -- IN THE BUSY EXCHANGES -- IMMIGRATION.,https://query.nytimes.com/gst/abstract.html?res=9D01E6D81539E033A25751C0A9679C94619ED7CF,0
1890-01-02T00:00:00Z,CITY AND SUBURBAN NEWS; NEW-YORK.,https://query.nytimes.com/gst/abstract.html?res=9A02E7D81539E033A25751C0A9679C94619ED7CF,0
1890-01-02T00:00:00Z,"BALLOT REFORM NEEDED.; MR. POWDERLY'S, ABLE PLEA FOR THE AUSTRALIAN SYSTEM.",https://query.nytimes.com/gst/abstract.html?res=9E07E7D81539E033A25751C0A9679C94619ED7CF,0
1890-01-02T00:00:00Z,HILL AND CALLICOT.,https://query.nytimes.com/gst/abstract.html?res=9905E6D81539E033A25751C0A9679C94619ED7CF,0
1890-01-02T00:00:00Z,Front Page 5 -- No Title,https://query.nytimes.com/gst/abstract.html?res=9506E7D81539E033A25751C0A9679C94619ED7CF,0
1890-01-02T00:00:00Z,THE ARGENTINE NAVY.; ITS STRENGTH TO BE INCREASED BY A NUMBER OF NEW WAR SHIPS.,https://query.nytimes.com/gst/abstract.html?res=9D07E6D81539E033A25751C0A9679C94619ED7CF,0
1890-01-02T00:00:00Z,Front Page 1 -- No Title,https://query.nytimes.com/gst/abstract.html?res=9B04E7D81539E033A25751C0A9679C94619ED7CF,0
1890-01-02T00:00:00Z,Article 8 -- No Title,https://query.nytimes.com/gst/abstract.html?res=9503E7D81539E033A25751C0A9679C94619ED7CF,0
1890-01-02T00:00:00Z,FOR THE HOME FOR THE BLIND.,https://query.nytimes.com/gst/abstract.html?res=9C01E6D81539E033A25751C0A9679C94619ED7CF,0
1890-01-02T00:00:00Z,CAUSED BY POLLUTED WATER.,https://query.nytimes.com/gst/abstract.html?res=9F02E7D81539E033A25751C0A9679C94619ED7CF,0
1890-01-02T00:00:00Z,Article 2 -- No Title,https://query.nytimes.com/gst/abstract.html?res=9A00E7D81539E033A25751C0A9679C94619ED7CF,0
1890-01-02T00:00:00Z,THE MASSACHUSETTS LEGISLATURE.,https://query.nytimes.com/gst/abstract.html?res=9907E7D81539E033A25751C0A9679C94619ED7CF,0
1890-01-02T00:00:00Z,Front Page 3 -- No Title,https://query.nytimes.com/gst/abstract.html?res=9407E7D81539E033A25751C0A9679C94619ED7CF,0
1890-01-02T00:00:00Z,Editorial Article 2 -- No Title,https://query.nytimes.com/gst/abstract.html?res=950CE7D81539E033A25751C0A9679C94619ED7CF,0
1890-01-02T00:00:00Z,SOMEWHAT SAUCY.,https://query.nytimes.com/gst/abstract.html?res=9A04E6D81539E033A25751C0A9679C94619ED7CF,0
1890-01-02T00:00:00Z,Editorial Article 3 -- No Title,https://query.nytimes.com/gst/abstract.html?res=9C05E6D81539E033A25751C0A9679C94619ED7CF,0
1890-01-02T00:00:00Z,Editorial Article 4 -- No Title,https://query.nytimes.com/gst/abstract.html?res=9D05E6D81539E033A25751C0A9679C94619ED7CF,0
1890-01-02T00:00:00Z,MR. WINDOM'S PROSPECT.,https://query.nytimes.com/gst/abstract.html?res=9805E6D81539E033A25751C0A9679C94619ED7CF,0
1890-01-02T00:00:00Z,SHORT IN HIS ACCOUNTS.,https://query.nytimes.com/gst/abstract.html?res=9C0CE7D81539E033A25751C0A9679C94619ED7CF,0
1890-01-02T00:00:00Z,NEW YEAR'S IN ALBANY.; GOV. HILL RECEIVES AND THE NEW OFFICERS TAKE THEIR SEATS.,https://query.nytimes.com/gst/abstract.html?res=9F07E7D81539E033A25751C0A9679C94619ED7CF,0
1890-01-02T00:00:00Z,MARRIED AMONG EVERGREENS.,https://query.nytimes.com/gst/abstract.html?res=9901E7D81539E033A25751C0A9679C94619ED7CF,0
1890-01-02T00:00:00Z,THE KANSAS SUGAR INDUSTRY.,https://query.nytimes.com/gst/abstract.html?res=9B01E7D81539E033A25751C0A9679C94619ED7CF,0
1890-01-02T00:00:00Z,Front Page 9 -- No Title,https://query.nytimes.com/gst/abstract.html?res=9F01E7D81539E033A25751C0A9679C94619ED7CF,0
1890-01-02T00:00:00Z,"GOOD CHEER EVERYWHERE; AN ENJOYABLE NEW YEAR'S DAY IN THIS CITY. THE CALLING CUSTOM REVIVED -- ELABORATE FREE LUNCHES AT THE HOTELS -- RECEPTIONS, &C.",https://query.nytimes.com/gst/abstract.html?res=9B06E6D81539E033A25751C0A9679C94619ED7CF,0
1890-01-02T00:00:00Z,RECEIVING MANY GUESTS; A GALA DAY IN WASHINGTON SOCIETY. THE PRESIDENT AND MEMBERS OF HIS CABINET KEEPING OPEN HOUSE FOR ALL IN OFFICIAL AND OTHER CIRCLES.,https://query.nytimes.com/gst/abstract.html?res=9F06E7D81539E033A25751C0A9679C94619ED7CF,0
1890-01-02T00:00:00Z,SAVAGELY CUT BY ITALIANS.,https://query.nytimes.com/gst/abstract.html?res=9A07E6D81539E033A25751C0A9679C94619ED7CF,0
1890-01-02T00:00:00Z,RULES FOR OCEAN TRAVEL; THE GOOD WORK OF THE MARINE CONFERENCE. EFFECT OF THE LONG AND HARMONIOUS DELIBERATIONS -- A REPUBLICAN FROM MONTANA AS HE IS KNOWN.,https://query.nytimes.com/gst/abstract.html?res=9E03E7D81539E033A25751C0A9679C94619ED7CF,0
1890-01-02T00:00:00Z,LOOK OUT FOR IMPOSTORS.,https://query.nytimes.com/gst/abstract.html?res=950DE7D81539E033A25751C0A9679C94619ED7CF,0
1890-01-02T00:00:00Z,A WATER COMPANY'S FAILURE.,https://query.nytimes.com/gst/abstract.html?res=9F03E7D81539E033A25751C0A9679C94619ED7CF,0
1890-01-02T00:00:00Z,Editorial Article 6 -- No Title,https://query.nytimes.com/gst/abstract.html?res=9405E6D81539E033A25751C0A9679C94619ED7CF,0
1890-01-02T00:00:00Z,THE STREAM TROMBONE.,https://query.nytimes.com/gst/abstract.html?res=9B05E6D81539E033A25751C0A9679C94619ED7CF,0
1890-01-02T00:00:00Z,Front Page 8 -- No Title,https://query.nytimes.com/gst/abstract.html?res=9E01E7D81539E033A25751C0A9679C94619ED7CF,0
1890-01-02T00:00:00Z,"CLEANED, BUT NOT CLEAN.",https://query.nytimes.com/gst/abstract.html?res=9404E6D81539E033A25751C0A9679C94619ED7CF,0
1890-01-02T00:00:00Z,THE UPPER HUDSON STILL OPEN.,https://query.nytimes.com/gst/abstract.html?res=9C07E7D81539E033A25751C0A9679C94619ED7CF,0
1890-01-02T00:00:00Z,THE CENSUS OF URUGUAY.; MONTEVIDEO ONE OF THE LARGEST CITIES IN SOUTH AMERICAN.,https://query.nytimes.com/gst/abstract.html?res=9807E7D81539E033A25751C0A9679C94619ED7CF,0
1890-01-02T00:00:00Z,UNSEASONABLE TRAILING ARBUTUS.,https://query.nytimes.com/gst/abstract.html?res=9404E7D81539E033A25751C0A9679C94619ED7CF,0
1890-01-02T00:00:00Z,A TEMPESTUOUS VOYAGE.; THE STORMY PASSAGE OF THE STEAMSHIP BOSTON CITY.,https://query.nytimes.com/gst/abstract.html?res=9E0DE7D81539E033A25751C0A9679C94619ED7CF,0
1890-01-02T00:00:00Z,THE WESTERN RATE WAR.,https://query.nytimes.com/gst/abstract.html?res=9C02E7D81539E033A25751C0A9679C94619ED7CF,0
1890-01-02T00:00:00Z,THE REV. DR. PATTON'S ALMA MATER.,https://query.nytimes.com/gst/abstract.html?res=9904E6D81539E033A25751C0A9679C94619ED7CF,0
1890-01-02T00:00:00Z,Front Page 11 -- No Title,https://query.nytimes.com/gst/abstract.html?res=9401E7D81539E033A25751C0A9679C94619ED7CF,0
1890-01-02T00:00:00Z,RELIEF FOR KANSAS SUFFERERS.,https://query.nytimes.com/gst/abstract.html?res=9A07E7D81539E033A25751C0A9679C94619ED7CF,0
1890-01-02T00:00:00Z,A REVOLUTION QUICKLY SUPPRESSED.,https://query.nytimes.com/gst/abstract.html?res=9903E7D81539E033A25751C0A9679C94619ED7CF,0
1890-01-02T00:00:00Z,CURRENT FOREIGN TOPICS.,https://query.nytimes.com/gst/abstract.html?res=9F00E7D81539E033A25751C0A9679C94619ED7CF,0
1890-01-02T00:00:00Z,CATTLEMAN AROUSED.; TO TAKE MEASURES TO PROTECT THEIR INTERESTS IN FUTURE.,https://query.nytimes.com/gst/abstract.html?res=9802E7D81539E033A25751C0A9679C94619ED7CF,0
1890-01-02T00:00:00Z,A NEW SENATORIAL DEAL.,https://query.nytimes.com/gst/abstract.html?res=9803E7D81539E033A25751C0A9679C94619ED7CF,0
1890-01-02T00:00:00Z,MONTANA'S SENATORS.,https://query.nytimes.com/gst/abstract.html?res=9804E6D81539E033A25751C0A9679C94619ED7CF,0
1890-01-02T00:00:00Z,"SHE CARED NOT TO LIVE.; A YOUNG WOMAN, JILTED BY HER LOVER, COMMITS SUICIDE.",https://query.nytimes.com/gst/abstract.html?res=9D03E7D81539E033A25751C0A9679C94619ED7CF,0
1890-01-02T00:00:00Z,Front Page 2 -- No Title,https://query.nytimes.com/gst/abstract.html?res=9D07E7D81539E033A25751C0A9679C94619ED7CF,0
1890-01-02T00:00:00Z,THE TARIFF IN THE WEST.,https://query.nytimes.com/gst/abstract.html?res=9A05E6D81539E033A25751C0A9679C94619ED7CF,0
1890-01-02T00:00:00Z,SIMPLY MILITARY RULE; NO REAL REPUBLIC YET FORMED IN BRAZIL. THE LEADERS OF THE REVOLUTION STRENGTHENING THEIR POSITION AS MEMBERS OF THE PROVISIONAL GOVERNMENT.,https://query.nytimes.com/gst/abstract.html?res=9900E7D81539E033A25751C0A9679C94619ED7CF,0
1890-01-02T00:00:00Z,Article 4 -- No Title,https://query.nytimes.com/gst/abstract.html?res=9400E7D81539E033A25751C0A9679C94619ED7CF,0
1890-01-02T00:00:00Z,RIOTOUS NEWSBOYS.; THEY MAKE THINGS LIVELY IN THE STREETS OF PITTSBURG.,https://query.nytimes.com/gst/abstract.html?res=9D0DE7D81539E033A25751C0A9679C94619ED7CF,0
1890-01-02T00:00:00Z,Obituary 1 -- No Title,https://query.nytimes.com/gst/abstract.html?res=9E06E6D81539E033A25751C0A9679C94619ED7CF,0
1890-01-02T00:00:00Z,A CRUSADE AGAINST SATAN.,https://query.nytimes.com/gst/abstract.html?res=9A06E7D81539E033A25751C0A9679C94619ED7CF,0
1890-01-02T00:00:00Z,AMUSEMENTS.; METROPOLITAN OPERA HOUSE.,https://query.nytimes.com/gst/abstract.html?res=9F04E6D81539E033A25751C0A9679C94619ED7CF,0
1890-01-02T00:00:00Z,THE WINDOW-GLASS TRADE.,https://query.nytimes.com/gst/abstract.html?res=940DE7D81539E033A25751C0A9679C94619ED7CF,0
1890-01-02T00:00:00Z,RAILWAY MANAGEMENT.; ANNUAL MEETINGS.,https://query.nytimes.com/gst/abstract.html?res=9B03E7D81539E033A25751C0A9679C94619ED7CF,0
1890-01-02T00:00:00Z,FOR DEMOCRATS ALONE; THE RECORD OF HILL'S LATEST FAVORITE. BOLTING AND KNIFING DEMOCRACY'S CANDIDATES CONDONED -- TREACHERY INDORSED -- PRISON STRIPES APPROVED.,https://query.nytimes.com/gst/abstract.html?res=9807E6D81539E033A25751C0A9679C94619ED7CF,0
1890-01-02T00:00:00Z,Editorial Article 1 -- No Title,https://query.nytimes.com/gst/abstract.html?res=940CE7D81539E033A25751C0A9679C94619ED7CF,0
1890-01-02T00:00:00Z,Article 3 -- No Title,https://query.nytimes.com/gst/abstract.html?res=9B00E7D81539E033A25751C0A9679C94619ED7CF,0
1890-01-02T00:00:00Z,Marriage Announcement 1 -- No Title,https://query.nytimes.com/gst/abstract.html?res=9C06E6D81539E033A25751C0A9679C94619ED7CF,0
1890-01-02T00:00:00Z,Front Page 4 -- No Title,https://query.nytimes.com/gst/abstract.html?res=9906E7D81539E033A25751C0A9679C94619ED7CF,0
1890-01-02T00:00:00Z,KENTUCKY HORSE NOTES.,https://query.nytimes.com/gst/abstract.html?res=9A0DE7D81539E033A25751C0A9679C94619ED7CF,0
1890-01-02T00:00:00Z,Front Page 7 -- No Title,https://query.nytimes.com/gst/abstract.html?res=9D01E7D81539E033A25751C0A9679C94619ED7CF,0
1890-01-02T00:00:00Z,ON JERSEY'S RACE TRACKS; RACING AT CLIFTON AND GUTTENBERG. ILMA B. WINS THE ALPHA HANDICAP AT GUTTENBERG AND SHE THE WASSAIL AT CLIFTON.,https://query.nytimes.com/gst/abstract.html?res=980DE7D81539E033A25751C0A9679C94619ED7CF,0
1890-01-02T00:00:00Z,ANXIOUS FOR THE ILLITERATE.,https://query.nytimes.com/gst/abstract.html?res=9F05E6D81539E033A25751C0A9679C94619ED7CF,0
1890-01-02T00:00:00Z,Editorial Article 5 -- No Title,https://query.nytimes.com/gst/abstract.html?res=9E05E6D81539E033A25751C0A9679C94619ED7CF,0
