pub_date,main_headline,article_url,classification
1890-01-19T00:00:00Z,NATIONAL GUARD GOSSIP.,https://query.nytimes.com/gst/abstract.html?res=9901E2D81539E033A2575AC1A9679C94619ED7CF,1
1890-01-19T00:00:00Z,""" AL"" DAGGETT'S ""STATEMENT.""; HIS POLITICAL FRIENDS TRYING TO PREVENT HIM FROM MAKING IT.",https://query.nytimes.com/gst/abstract.html?res=9F01E3D81539E033A2575AC1A9679C94619ED7CF,0
1890-01-19T00:00:00Z,EDISON HELPS THE BOYS.; HE TELLS THEM HOW THEY CAN IMPROVE THEIR ELECTRIC LAUNCH.,https://query.nytimes.com/gst/abstract.html?res=9805E2D81539E033A2575AC1A9679C94619ED7CF,0
1890-01-19T00:00:00Z,THE ONTARIO BANK TROUBLE.,https://query.nytimes.com/gst/abstract.html?res=9903E4D81539E033A2575AC1A9679C94619ED7CF,0
1890-01-19T00:00:00Z,Front Page 3 -- No Title,https://query.nytimes.com/gst/abstract.html?res=9405E4D81539E033A2575AC1A9679C94619ED7CF,0
1890-01-19T00:00:00Z,PROMOTION IN THE ARMY.; THE HOPELESS CONDITION OF LIEUTENANTS OF ARTILLERY.,https://query.nytimes.com/gst/abstract.html?res=9406E2D81539E033A2575AC1A9679C94619ED7CF,0
1890-01-19T00:00:00Z,ITALIANS WANT DUTIES REDUCED.,https://query.nytimes.com/gst/abstract.html?res=9D03E3D81539E033A2575AC1A9679C94619ED7CF,0
1890-01-19T00:00:00Z,AN OLD SWINDLER CAUGHT.; ARRESTED FOR TAKING STOLEN GOODS INTO CANADA.,https://query.nytimes.com/gst/abstract.html?res=9505E4D81539E033A2575AC1A9679C94619ED7CF,0
1890-01-19T00:00:00Z,A VENERABLE VIRGINIAN.,https://query.nytimes.com/gst/abstract.html?res=950DE3D81539E033A2575AC1A9679C94619ED7CF,0
1890-01-19T00:00:00Z,Article 4 -- No Title,https://query.nytimes.com/gst/abstract.html?res=9B00E4D81539E033A2575AC1A9679C94619ED7CF,0
1890-01-19T00:00:00Z,Editorial Article 3 -- No Title,https://query.nytimes.com/gst/abstract.html?res=9E0CE4D81539E033A2575AC1A9679C94619ED7CF,0
1890-01-19T00:00:00Z,Marriage Announcement 1 -- No Title,https://query.nytimes.com/gst/abstract.html?res=9E07E3D81539E033A2575AC1A9679C94619ED7CF,0
1890-01-19T00:00:00Z,ACCUSED OF BLACKMAIL.; AN AGENT OF THE ASSOCIATED PRESS IN A MEXICAN PRISON.,https://query.nytimes.com/gst/abstract.html?res=9803E4D81539E033A2575AC1A9679C94619ED7CF,0
1890-01-19T00:00:00Z,DIAMOND CUTTERS OUT OF WORK.,https://query.nytimes.com/gst/abstract.html?res=9E06E2D81539E033A2575AC1A9679C94619ED7CF,0
1890-01-19T00:00:00Z,"WANTED, A GAS MONOPOLY.; A PLAN TO FIX THE PRICE AND PERPETUATE A CORPORATION.",https://query.nytimes.com/gst/abstract.html?res=9401E3D81539E033A2575AC1A9679C94619ED7CF,0
1890-01-19T00:00:00Z,EARLY SPRING FASHIONS; SOME OF THE NOVELTIES SEEN IN THE SHOPS. BARGAINS ARE PLENTY -- THE SCOTCH PLAID RAGE -- EIFFEL TOWER NOVELTIES -- LATEST PARISIAN DECREES.,https://query.nytimes.com/gst/abstract.html?res=9800E3D81539E033A2575AC1A9679C94619ED7CF,0
1890-01-19T00:00:00Z,"A FIGHT FOR A CHILD.; TURNED OVER TO THE FATHER, WHO TRIED TO KIDNAP IT.",https://query.nytimes.com/gst/abstract.html?res=9406E4D81539E033A2575AC1A9679C94619ED7CF,0
1890-01-19T00:00:00Z,TIMELY ROMAN TOPICS; MANY WEALTHY RELIGIOUS HOUSES SECULARIZED. NEED THE GOVERNMENT HAS FOR MONEY -- A REPUBLIC NOT VERY FAR OFF -- A BEATIFICATION.,https://query.nytimes.com/gst/abstract.html?res=9D01E2D81539E033A2575AC1A9679C94619ED7CF,0
1890-01-19T00:00:00Z,A SOUTHERN VIEW OF IT.,https://query.nytimes.com/gst/abstract.html?res=9907E3D81539E033A2575AC1A9679C94619ED7CF,0
1890-01-19T00:00:00Z,THE HARBOR OF TAMPICO.,https://query.nytimes.com/gst/abstract.html?res=9400E4D81539E033A2575AC1A9679C94619ED7CF,0
1890-01-19T00:00:00Z,TO SUE FOR A SEPARATION.; THE DOMESTIC DIFFICULTIES OF A BROOKLYN DENTIST.,https://query.nytimes.com/gst/abstract.html?res=9806E3D81539E033A2575AC1A9679C94619ED7CF,0
1890-01-19T00:00:00Z,TESTED IN A BUILDING.; HEERDEGEN'S WATER FINDER IS PARTIALLY SUCCESSFUL.,https://query.nytimes.com/gst/abstract.html?res=9A07E2D81539E033A2575AC1A9679C94619ED7CF,0
1890-01-19T00:00:00Z,GOFF WANTS TO ARGUE.,https://query.nytimes.com/gst/abstract.html?res=9806E4D81539E033A2575AC1A9679C94619ED7CF,0
1890-01-19T00:00:00Z,"A CHAMPION INVALID.; DEATH OF MISS CHLOE LANKTON, WHO SUFFERED FOR 62 YEARS.",https://query.nytimes.com/gst/abstract.html?res=9A0DE3D81539E033A2575AC1A9679C94619ED7CF,0
1890-01-19T00:00:00Z,SAVING BY A DEAD-LOCK.,https://query.nytimes.com/gst/abstract.html?res=990CE3D81539E033A2575AC1A9679C94619ED7CF,0
1890-01-19T00:00:00Z,PORTUGAL'S ANGRY MOOD; TALK OF A REPUBLIC COMING TO THE SURFACE. TRADE RETALIATION -- TALBOT'S DEATH AND LORD NAPIER'S FUNERAL - READING'S AFFAIRS.,https://query.nytimes.com/gst/abstract.html?res=940CE5D81539E033A2575AC1A9679C94619ED7CF,0
1890-01-19T00:00:00Z,Front Page 15 -- No Title,https://query.nytimes.com/gst/abstract.html?res=9F06E4D81539E033A2575AC1A9679C94619ED7CF,0
1890-01-19T00:00:00Z,THE GIDDY ROUND OF PLEASURE.,https://query.nytimes.com/gst/abstract.html?res=9804E3D81539E033A2575AC1A9679C94619ED7CF,0
1890-01-19T00:00:00Z,Front Page 4 -- No Title,https://query.nytimes.com/gst/abstract.html?res=9E04E4D81539E033A2575AC1A9679C94619ED7CF,0
1890-01-19T00:00:00Z,STEAD AND HIS CAREER; POINTS IN IT SUGGESTED BY HIS RETIREMENT. EVERYBODY VERY TIRED OF HIS AGITATIONS -- HELP HE WAS TO JOURNALISM -- PERSECUTION OF DILKE.,https://query.nytimes.com/gst/abstract.html?res=9F00E3D81539E033A2575AC1A9679C94619ED7CF,0
1890-01-19T00:00:00Z,LOOKING OVER THE BILL.; CITY OFFICIALS CONSIDER THE WORLD'S FAIR PROJECT.,https://query.nytimes.com/gst/abstract.html?res=9901E3D81539E033A2575AC1A9679C94619ED7CF,0
1890-01-19T00:00:00Z,ALL AROUND THE WORLD.; MISS BISLAND NOW ON HER OCEAN VOYAGE TO NEW-YORK.,https://query.nytimes.com/gst/abstract.html?res=9F07E4D81539E033A2575AC1A9679C94619ED7CF,0
1890-01-19T00:00:00Z,OHIO BALLOT-REFORM BILL.,https://query.nytimes.com/gst/abstract.html?res=9506E4D81539E033A2575AC1A9679C94619ED7CF,0
1890-01-19T00:00:00Z,A GOOD DEED MISUNDERSTOOD.,https://query.nytimes.com/gst/abstract.html?res=9E06E3D81539E033A2575AC1A9679C94619ED7CF,0
1890-01-19T00:00:00Z,"SISTEREN AND BRETHEREN.""",https://query.nytimes.com/gst/abstract.html?res=9900E3D81539E033A2575AC1A9679C94619ED7CF,0
1890-01-19T00:00:00Z,CHARGED WITH FALSEHOOD.; SERIOUS ACCUSATIONS AGAINST A BUFFALO PREACHER.,https://query.nytimes.com/gst/abstract.html?res=9E01E4D81539E033A2575AC1A9679C94619ED7CF,0
1890-01-19T00:00:00Z,TEMPORARILY UNMUZZLED.,https://query.nytimes.com/gst/abstract.html?res=9B0CE4D81539E033A2575AC1A9679C94619ED7CF,0
1890-01-19T00:00:00Z,CITY AND SUBURBAN NEWS,https://query.nytimes.com/gst/abstract.html?res=9E0DE4D81539E033A2575AC1A9679C94619ED7CF,0
1890-01-19T00:00:00Z,Front Page 10 -- No Title,https://query.nytimes.com/gst/abstract.html?res=9807E4D81539E033A2575AC1A9679C94619ED7CF,0
1890-01-19T00:00:00Z,DEMOCRATIC FEELING TOWARD HILL.,https://query.nytimes.com/gst/abstract.html?res=9801E4D81539E033A2575AC1A9679C94619ED7CF,0
1890-01-19T00:00:00Z,CORNELIUS N. BLISS RESIGNS.; HE OBJECTS TO JOHN J. O'BRIEN JOINING A REPUBLICAN CLUB.,https://query.nytimes.com/gst/abstract.html?res=9A00E4D81539E033A2575AC1A9679C94619ED7CF,0
1890-01-19T00:00:00Z,INFATUATED BY A COLORED COOK.,https://query.nytimes.com/gst/abstract.html?res=9D06E4D81539E033A2575AC1A9679C94619ED7CF,0
1890-01-19T00:00:00Z,Article 3 -- No Title,https://query.nytimes.com/gst/abstract.html?res=9900E4D81539E033A2575AC1A9679C94619ED7CF,0
1890-01-19T00:00:00Z,"RACING AT GUTTENBERG; A LARGE CROWD HAVE A GOOD DAY'S SPORT. POMMERY SEC, KOSCIUSKO KAY, CRISPIN, LAFITTE, BATTERSBY, AND LANDSEER WIN THE SIX RACES RUN.",https://query.nytimes.com/gst/abstract.html?res=9A04E2D81539E033A2575AC1A9679C94619ED7CF,0
1890-01-19T00:00:00Z,Article 1 -- No Title,https://query.nytimes.com/gst/abstract.html?res=9B01E4D81539E033A2575AC1A9679C94619ED7CF,0
1890-01-19T00:00:00Z,LADY MANDEVILLE ILL.,https://query.nytimes.com/gst/abstract.html?res=9904E3D81539E033A2575AC1A9679C94619ED7CF,0
1890-01-19T00:00:00Z,DEIMEL BROTHERS' AFFAIRS.,https://query.nytimes.com/gst/abstract.html?res=9404E4D81539E033A2575AC1A9679C94619ED7CF,0
1890-01-19T00:00:00Z,THE YOSEMITE'S GLORIES; CALIFORNIA'S WONDROUS GARDEN. A NATURAL ROOM THOUSANDS OF FEET HIGH AND MILES IN LENGTH -BEAUTIES OF THE LOWLANDS.,https://query.nytimes.com/gst/abstract.html?res=9C00E3D81539E033A2575AC1A9679C94619ED7CF,0
1890-01-19T00:00:00Z,CLEVELAND BREWERIES SOLD.,https://query.nytimes.com/gst/abstract.html?res=9906E4D81539E033A2575AC1A9679C94619ED7CF,0
1890-01-19T00:00:00Z,A JUDGE'S RASH ADVICE.,https://query.nytimes.com/gst/abstract.html?res=9D04E3D81539E033A2575AC1A9679C94619ED7CF,0
1890-01-19T00:00:00Z,RAILWAY MANAGEMENT.; HOW POOL BECAME PRESIDENT.,https://query.nytimes.com/gst/abstract.html?res=9D03E4D81539E033A2575AC1A9679C94619ED7CF,0
1890-01-19T00:00:00Z,PRESIDENT HOWARD B. GROSE.,https://query.nytimes.com/gst/abstract.html?res=9E0DE3D81539E033A2575AC1A9679C94619ED7CF,0
1890-01-19T00:00:00Z,ENTERTAINED BY BOXERS; A TOURNAMENT AT THE NEW-YORK ATHLETIC CLUB. SOME BOUTS THAT WERE LIVELY AND SOME THAT WERE TAME -- THE WINNERS OF THE EVENTS.,https://query.nytimes.com/gst/abstract.html?res=9B06E4D81539E033A2575AC1A9679C94619ED7CF,0
1890-01-19T00:00:00Z,THE CHICAGO STANDARD.; THE WESTERN CONCEPTION OF GERMAN OPERA.,https://query.nytimes.com/gst/abstract.html?res=9A0CE3D81539E033A2575AC1A9679C94619ED7CF,0
1890-01-19T00:00:00Z,SUBWAY EXPLOSIONS.,https://query.nytimes.com/gst/abstract.html?res=9A0CE4D81539E033A2575AC1A9679C94619ED7CF,0
1890-01-19T00:00:00Z,"TRIALS OF A MISSIONARY.; IN INDIA HE IS BOTHERED BY SNAKES, TIGERS, SCORPIONS, AND THIEVES.",https://query.nytimes.com/gst/abstract.html?res=950CE3D81539E033A2575AC1A9679C94619ED7CF,0
1890-01-19T00:00:00Z,LONDON'S MARRIAGE MARKET.,https://query.nytimes.com/gst/abstract.html?res=9D06E3D81539E033A2575AC1A9679C94619ED7CF,0
1890-01-19T00:00:00Z,Editorial Article 1 -- No Title,https://query.nytimes.com/gst/abstract.html?res=950DE4D81539E033A2575AC1A9679C94619ED7CF,0
1890-01-19T00:00:00Z,THE WRECKED STEAMER WIDE WEST,https://query.nytimes.com/gst/abstract.html?res=9F07E2D81539E033A2575AC1A9679C94619ED7CF,0
1890-01-19T00:00:00Z,COL. ROEBLING'S SILVER WEDDING.,https://query.nytimes.com/gst/abstract.html?res=9E00E4D81539E033A2575AC1A9679C94619ED7CF,0
1890-01-19T00:00:00Z,TREASURER BURKE'S CRIME.; AN ALLEGED ACCOMPLICE TO BE TRIED IN NEW-ORLEANS.,https://query.nytimes.com/gst/abstract.html?res=9D01E4D81539E033A2575AC1A9679C94619ED7CF,0
1890-01-19T00:00:00Z,BOSTON'S BOASTED CHURCHES.,https://query.nytimes.com/gst/abstract.html?res=9902E3D81539E033A2575AC1A9679C94619ED7CF,0
1890-01-19T00:00:00Z,ASKING FOR INTERVENTION.,https://query.nytimes.com/gst/abstract.html?res=9800E4D81539E033A2575AC1A9679C94619ED7CF,0
1890-01-19T00:00:00Z,BISMARCK WILL BE THERE; THE CHANCELLOR GOING TO BERLIN. IN SPITE OF HIS PHYSICIANS HE IS DETERMINED TO URGE THE PASSAGE OF THE SOCIALIST BILL IN PERSON.,https://query.nytimes.com/gst/abstract.html?res=9C07E4D81539E033A2575AC1A9679C94619ED7CF,0
1890-01-19T00:00:00Z,ALL THAT FORAKER ASKED; GOOD ENOUGH TO LAST UNTIL AFTER ELECTION. THE EX-GOVERNOR ENDS HIS EXCUSES AND HIS TOOL MAKES SOME VERY POSITIVE ASSERTIONS.,https://query.nytimes.com/gst/abstract.html?res=9C01E4D81539E033A2575AC1A9679C94619ED7CF,0
1890-01-19T00:00:00Z,Front Page 5 -- No Title,https://query.nytimes.com/gst/abstract.html?res=9F04E4D81539E033A2575AC1A9679C94619ED7CF,0
1890-01-19T00:00:00Z,WHERE THEY LIVE TO A GOOD OLD AGE,https://query.nytimes.com/gst/abstract.html?res=9503E3D81539E033A2575AC1A9679C94619ED7CF,0
1890-01-19T00:00:00Z,WOMEN'S TEMPERANCE UNION.,https://query.nytimes.com/gst/abstract.html?res=9B04E2D81539E033A2575AC1A9679C94619ED7CF,0
1890-01-19T00:00:00Z,BADLY OUT BY HIS DRIVER.,https://query.nytimes.com/gst/abstract.html?res=9D05E4D81539E033A2575AC1A9679C94619ED7CF,0
1890-01-19T00:00:00Z,NOT GENUINE JOHANNISBERG.,https://query.nytimes.com/gst/abstract.html?res=9A02E4D81539E033A2575AC1A9679C94619ED7CF,0
1890-01-19T00:00:00Z,DEATH OF F.A. DONALDSON.,https://query.nytimes.com/gst/abstract.html?res=9C04E3D81539E033A2575AC1A9679C94619ED7CF,0
1890-01-19T00:00:00Z,"NEW PUBLICATIONS; EARLY RELIGIOUS SYSTEMS. THE UNKNOWN GOD; OR INSPIRATION AMONG PRE-CHRISTIAN RACES. By O. LORING BRACZ, author of ""Gesta Christi,"" ""Races of the Old World"" &c. New-York: A.C. ARMSTRONG & SON. 1890.",https://query.nytimes.com/gst/abstract.html?res=9A06E2D81539E033A2575AC1A9679C94619ED7CF,0
1890-01-19T00:00:00Z,A DENTAL REMINISCENCE.,https://query.nytimes.com/gst/abstract.html?res=9D02E3D81539E033A2575AC1A9679C94619ED7CF,0
1890-01-19T00:00:00Z,FOURTH-CLASS POSTMASTERS.,https://query.nytimes.com/gst/abstract.html?res=9E06E4D81539E033A2575AC1A9679C94619ED7CF,0
1890-01-19T00:00:00Z,THE BATTLE OF THE CUSHION.; CONTEST OF TWO CLASSES IN A FEMALE MEDICAL SCHOOL.,https://query.nytimes.com/gst/abstract.html?res=9F01E4D81539E033A2575AC1A9679C94619ED7CF,0
1890-01-19T00:00:00Z,MR. VANDERBILT'S FORESTS.,https://query.nytimes.com/gst/abstract.html?res=990DE3D81539E033A2575AC1A9679C94619ED7CF,0
1890-01-19T00:00:00Z,TWO DEMOCRATS SPEAK OUT.; OHIO AND WEST VIRGINIA'S GOVERNORS ARE FOR BALLOT REFORM.,https://query.nytimes.com/gst/abstract.html?res=9905E3D81539E033A2575AC1A9679C94619ED7CF,0
1890-01-19T00:00:00Z,TELEPHONES DESTROYED.,https://query.nytimes.com/gst/abstract.html?res=940CE3D81539E033A2575AC1A9679C94619ED7CF,0
1890-01-19T00:00:00Z,A VISIT TO THE TOMBS.; WHAT THREE BRIGHT FACES DID FOR THAT GLOOMY OLD PLACE.,https://query.nytimes.com/gst/abstract.html?res=9E04E2D81539E033A2575AC1A9679C94619ED7CF,0
1890-01-19T00:00:00Z,Front Page 13 -- No Title,https://query.nytimes.com/gst/abstract.html?res=9407E4D81539E033A2575AC1A9679C94619ED7CF,0
1890-01-19T00:00:00Z,AMUSEMENTS.; THE THEATRICAL WEEK.,https://query.nytimes.com/gst/abstract.html?res=9803E3D81539E033A2575AC1A9679C94619ED7CF,1
1890-01-19T00:00:00Z,SHOCKING GUILLOTINE STORY.,https://query.nytimes.com/gst/abstract.html?res=9D0DE3D81539E033A2575AC1A9679C94619ED7CF,0
1890-01-19T00:00:00Z,SIX ENEMIES OF BALLOT REFORM.,https://query.nytimes.com/gst/abstract.html?res=9F05E3D81539E033A2575AC1A9679C94619ED7CF,0
1890-01-19T00:00:00Z,FIGHTING IN MANY LANDS; THE STORY OF ROBERT VON PUTTKAMER. ADVENTURES IN EUROPE AND THE TWO AMERICAS OF A PRUSSIAN STATESMAN'S SON -- NOW IN A HOSPITAL.,https://query.nytimes.com/gst/abstract.html?res=9E03E3D81539E033A2575AC1A9679C94619ED7CF,0
1890-01-19T00:00:00Z,"SAFE ELECTRIC LIGHT BY THE CONVERTER SYSTEM.; A Card to the Public by the United Electric Light and Power Company and the United States Illuminating Company. OFFICE OF THE UNITED ELECTRIC LIGHT AND POWER COMPANY, 59 LIBERTY-ST., NEW-YORK.",https://query.nytimes.com/gst/abstract.html?res=9D02E4D81539E033A2575AC1A9679C94619ED7CF,0
1890-01-19T00:00:00Z,EATON HALL AS A SHOW PLACE.,https://query.nytimes.com/gst/abstract.html?res=9402E4D81539E033A2575AC1A9679C94619ED7CF,0
1890-01-19T00:00:00Z,Front Page 2 -- No Title,https://query.nytimes.com/gst/abstract.html?res=9E05E4D81539E033A2575AC1A9679C94619ED7CF,0
1890-01-19T00:00:00Z,A VETERAN PIONEER.; COL. J.D. STEVENSON CELEBRATES HIS NINETIETH BIRTHDAY.,https://query.nytimes.com/gst/abstract.html?res=9B01E3D81539E033A2575AC1A9679C94619ED7CF,0
1890-01-19T00:00:00Z,A STEAMSHIP SAVED.,https://query.nytimes.com/gst/abstract.html?res=9A03E4D81539E033A2575AC1A9679C94619ED7CF,0
1890-01-19T00:00:00Z,THE DEATH OF HUGH FERRIGAN.,https://query.nytimes.com/gst/abstract.html?res=9C03E3D81539E033A2575AC1A9679C94619ED7CF,0
1890-01-19T00:00:00Z,WORCESTER'S MUSIC FESTIVAL.,https://query.nytimes.com/gst/abstract.html?res=9C05E4D81539E033A2575AC1A9679C94619ED7CF,0
1890-01-19T00:00:00Z,SOME OF ALLISON'S DEALS; PROMISES MADE FOR VOTES IN THE CAUCUS. THE FARMERS OF IOWA FURIOUS OVER THE NOMINATION -- ALLISON MAY YET FAIL OF ELECTION.,https://query.nytimes.com/gst/abstract.html?res=9F05E4D81539E033A2575AC1A9679C94619ED7CF,0
1890-01-19T00:00:00Z,Front Page 8 -- No Title,https://query.nytimes.com/gst/abstract.html?res=9A04E4D81539E033A2575AC1A9679C94619ED7CF,0
1890-01-19T00:00:00Z,A GOOD TRAIT IN JEFF DAVIS.; GRATEFUL LETTERS TO AN EX-SLAVE WHO REMEMBERED HIM.,https://query.nytimes.com/gst/abstract.html?res=9F05E2D81539E033A2575AC1A9679C94619ED7CF,0
1890-01-19T00:00:00Z,Front Page 7 -- No Title,https://query.nytimes.com/gst/abstract.html?res=9904E4D81539E033A2575AC1A9679C94619ED7CF,0
1890-01-19T00:00:00Z,YALE JUNIOR APPOINTMENTS.; THE CLASS AVERAGES UNUSUALLY HIGH FOR THE UNIVERSITY.,https://query.nytimes.com/gst/abstract.html?res=9902E4D81539E033A2575AC1A9679C94619ED7CF,0
1890-01-19T00:00:00Z,TRUFFLE HUNTERS IN EPPING FOREST.,https://query.nytimes.com/gst/abstract.html?res=9B07E3D81539E033A2575AC1A9679C94619ED7CF,0
1890-01-19T00:00:00Z,STRICKEN ON THE STAGE.,https://query.nytimes.com/gst/abstract.html?res=9801E3D81539E033A2575AC1A9679C94619ED7CF,0
1890-01-19T00:00:00Z,THE TRAVELERS' OF HARTFORD.,https://query.nytimes.com/gst/abstract.html?res=9502E4D81539E033A2575AC1A9679C94619ED7CF,0
1890-01-19T00:00:00Z,Front Page 14 -- No Title,https://query.nytimes.com/gst/abstract.html?res=9507E4D81539E033A2575AC1A9679C94619ED7CF,0
1890-01-19T00:00:00Z,THE ARCHBISHOP SAILS.; HIS TRIP TO ROME BEGUN YESTERDAY IN LA BOURGOGNE.,https://query.nytimes.com/gst/abstract.html?res=9E07E2D81539E033A2575AC1A9679C94619ED7CF,0
1890-01-19T00:00:00Z,AN ESCAPING CONVICT KILLED.,https://query.nytimes.com/gst/abstract.html?res=9C03E4D81539E033A2575AC1A9679C94619ED7CF,0
1890-01-19T00:00:00Z,TIPPOO TIB'S INDICTMENT; HIS CONNECTION WITH THE CONGO FREE STATE. THE KIND OF MAN HE IS TO SEE -- HIS POWER TO DO HARM -- IVORY AND THE SLAVE TRADE.,https://query.nytimes.com/gst/abstract.html?res=9E05E2D81539E033A2575AC1A9679C94619ED7CF,0
1890-01-19T00:00:00Z,NEW-YORK CORPORATIONS.; ANNUAL REPORTS FILED WITH THE SECRETARY OF STATE.,https://query.nytimes.com/gst/abstract.html?res=9F02E4D81539E033A2575AC1A9679C94619ED7CF,0
1890-01-19T00:00:00Z,THE VETERANS' SIDE OF IT; THEY DO NOT THINK SOCIABILITY IS DANGEROUS. THE SEVENTH REGIMENT'S OFFICERS' CHARGES OF DISCOURTESY DENIED -- THE VETERANS' ORGANIZATION.,https://query.nytimes.com/gst/abstract.html?res=9B03E4D81539E033A2575AC1A9679C94619ED7CF,0
1890-01-19T00:00:00Z,WINTER IN THE ADIRONDACKS.,https://query.nytimes.com/gst/abstract.html?res=9B04E4D81539E033A2575AC1A9679C94619ED7CF,0
1890-01-19T00:00:00Z,POVERTY AFTER A VICTORIA CROSS.,https://query.nytimes.com/gst/abstract.html?res=9F0CE3D81539E033A2575AC1A9679C94619ED7CF,0
1890-01-19T00:00:00Z,Front Page 9 -- No Title,https://query.nytimes.com/gst/abstract.html?res=9504E4D81539E033A2575AC1A9679C94619ED7CF,0
1890-01-19T00:00:00Z,THE CONGRESS WILL FAIL.; A PAN-AMERICAN DELEGATE TALKS OF OUR TARIFF AND SHORT CREDITS.,https://query.nytimes.com/gst/abstract.html?res=9C06E2D81539E033A2575AC1A9679C94619ED7CF,0
1890-01-19T00:00:00Z,THE DRY DOCK RAILROAD.,https://query.nytimes.com/gst/abstract.html?res=9D0DE4D81539E033A2575AC1A9679C94619ED7CF,0
1890-01-19T00:00:00Z,THE MASSACHUSETTS CIVIL SERVICE.,https://query.nytimes.com/gst/abstract.html?res=9402E3D81539E033A2575AC1A9679C94619ED7CF,0
1890-01-19T00:00:00Z,A STAB AT REFORM.,https://query.nytimes.com/gst/abstract.html?res=9D05E3D81539E033A2575AC1A9679C94619ED7CF,0
1890-01-19T00:00:00Z,Obituary 1 -- No Title,https://query.nytimes.com/gst/abstract.html?res=9807E3D81539E033A2575AC1A9679C94619ED7CF,0
1890-01-19T00:00:00Z,BOOKS A YEAR HAS PRODUCED.,https://query.nytimes.com/gst/abstract.html?res=9E0CE3D81539E033A2575AC1A9679C94619ED7CF,0
1890-01-19T00:00:00Z,DOM PEDRO'S GREAT LOSS; HIS MARRIAGE AND HOW SUCCESSFUL IT WAS. GOOD INFLUENCES THE EMPRESS HAD OVER HIM -- HER PLAIN FACE AND HER DEVOTION.,https://query.nytimes.com/gst/abstract.html?res=9A00E3D81539E033A2575AC1A9679C94619ED7CF,0
1890-01-19T00:00:00Z,VICTIMS OF THE GRIP.; DELIRIUM A FEATURE OF THE DISEASE IN MANY CASES.,https://query.nytimes.com/gst/abstract.html?res=9907E4D81539E033A2575AC1A9679C94619ED7CF,0
1890-01-19T00:00:00Z,A CHURCH YEAR BOOK.; THE CONDITION AND PROGRESS OF GRACE PARISH SET FORTH.,https://query.nytimes.com/gst/abstract.html?res=9906E3D81539E033A2575AC1A9679C94619ED7CF,0
1890-01-19T00:00:00Z,THE BIG COAL DEAL ABANDONED.,https://query.nytimes.com/gst/abstract.html?res=9A05E4D81539E033A2575AC1A9679C94619ED7CF,0
1890-01-19T00:00:00Z,THE MESSENGER'S WARNING.,https://query.nytimes.com/gst/abstract.html?res=940CE4D81539E033A2575AC1A9679C94619ED7CF,0
1890-01-19T00:00:00Z,SEVENTY-FIVE YEARS ON THE STAGE.,https://query.nytimes.com/gst/abstract.html?res=9B06E2D81539E033A2575AC1A9679C94619ED7CF,0
1890-01-19T00:00:00Z,MORE QUIET THAN USUAL; CONDITIONS THAT AFFECT REAL ESTATE. PRICES REMAIN UP BUT CAPITAL IS NOT SO ABUNDANT AS FORMERLY -WHY THE SUBURBS ARE ATTRACTIVE.,https://query.nytimes.com/gst/abstract.html?res=9E01E2D81539E033A2575AC1A9679C94619ED7CF,0
1890-01-19T00:00:00Z,Front Page 1 -- No Title,https://query.nytimes.com/gst/abstract.html?res=950CE5D81539E033A2575AC1A9679C94619ED7CF,0
1890-01-19T00:00:00Z,CURRENT LITERATURE,https://query.nytimes.com/gst/abstract.html?res=9C01E2D81539E033A2575AC1A9679C94619ED7CF,0
1890-01-19T00:00:00Z,COLD WEATHER FOR FLORIDA.,https://query.nytimes.com/gst/abstract.html?res=9F03E3D81539E033A2575AC1A9679C94619ED7CF,0
1890-01-19T00:00:00Z,MISSION WORK IN ALASKA; PROGRESS MADE IN CIVILIZING THE NATIVES.: HOW THE MONEY GRANTED BY THE UNITED STATES FOR GOVERNMENT SCHOOLS IS EXPENDED.,https://query.nytimes.com/gst/abstract.html?res=9407E3D81539E033A2575AC1A9679C94619ED7CF,0
1890-01-19T00:00:00Z,CORRUPTION IN KANSAS.; AN EFFORT TO INVESTIGATE LEGISLATIVE BRIBERY.,https://query.nytimes.com/gst/abstract.html?res=9805E4D81539E033A2575AC1A9679C94619ED7CF,0
1890-01-19T00:00:00Z,NEW SUNDAY WORK FOR PASTORS.,https://query.nytimes.com/gst/abstract.html?res=9504E2D81539E033A2575AC1A9679C94619ED7CF,0
1890-01-19T00:00:00Z,Article 2 -- No Title,https://query.nytimes.com/gst/abstract.html?res=9401E4D81539E033A2575AC1A9679C94619ED7CF,0
1890-01-19T00:00:00Z,THEY DON'T BELIEVE IN IT.; NEW-YORK MERCHANTS SKEPTICAL ABOUT A TANNING INVENTION.,https://query.nytimes.com/gst/abstract.html?res=9506E2D81539E033A2575AC1A9679C94619ED7CF,0
1890-01-19T00:00:00Z,"RELIGION IN ART.; THE POWER OF MILLET'S ""ANGELUS,"" AND ITS MEANING.",https://query.nytimes.com/gst/abstract.html?res=9807E2D81539E033A2575AC1A9679C94619ED7CF,0
1890-01-19T00:00:00Z,SAN FRANCISCO EXCHANGE.,https://query.nytimes.com/gst/abstract.html?res=9A06E4D81539E033A2575AC1A9679C94619ED7CF,0
1890-01-19T00:00:00Z,KUNZE RELEASED ON BAIL.,https://query.nytimes.com/gst/abstract.html?res=9503E4D81539E033A2575AC1A9679C94619ED7CF,0
1890-01-19T00:00:00Z,FROM A BUSINESS POINT OF VIEW.; THE REVOLUTION OCCURRED AT A LUCKY TIME FOR THE NATION'S FINANCES -- A CRYING NEED FOR A STRONG CONSTITUTIONAL GOVERNMENT.,https://query.nytimes.com/gst/abstract.html?res=9407E2D81539E033A2575AC1A9679C94619ED7CF,0
1890-01-19T00:00:00Z,BOND OFFERINGS ACCEPTED.,https://query.nytimes.com/gst/abstract.html?res=9C07E2D81539E033A2575AC1A9679C94619ED7CF,0
1890-01-19T00:00:00Z,THE SOBERING MACHINE.; AN OLD-FASHIONED REMEDY LIKELY TO BE REVIVED.,https://query.nytimes.com/gst/abstract.html?res=9905E4D81539E033A2575AC1A9679C94619ED7CF,0
1890-01-19T00:00:00Z,Editorial Article 4 -- No Title,https://query.nytimes.com/gst/abstract.html?res=9F0CE4D81539E033A2575AC1A9679C94619ED7CF,0
1890-01-19T00:00:00Z,OBITUARY.; HENRY COHN.,https://query.nytimes.com/gst/abstract.html?res=9B05E3D81539E033A2575AC1A9679C94619ED7CF,0
1890-01-19T00:00:00Z,TICKERS START AGAIN.; HEREAFTER THEY WILL BE OPERATED BY THE QUOTATION COMPANY.,https://query.nytimes.com/gst/abstract.html?res=9F04E2D81539E033A2575AC1A9679C94619ED7CF,0
1890-01-19T00:00:00Z,PRINCE ALEXANDER'S FUTURE.,https://query.nytimes.com/gst/abstract.html?res=9F02E3D81539E033A2575AC1A9679C94619ED7CF,0
1890-01-19T00:00:00Z,A VICTIM OF THE DANITES.,https://query.nytimes.com/gst/abstract.html?res=9B05E4D81539E033A2575AC1A9679C94619ED7CF,0
1890-01-19T00:00:00Z,A GOOD INSTITUTION.; EFFECTIVE WORK AMONG JUVENILE DELINQUENTS -- RELIGIOUS OPPOSITION.,https://query.nytimes.com/gst/abstract.html?res=9E02E3D81539E033A2575AC1A9679C94619ED7CF,0
1890-01-19T00:00:00Z,WEAK RULERS IN BRAZIL; UNIVERSAL CORRUPTION IN THE WAY OF A REPUBLIC. THE LEADERS AFRAID TO TRUST THE PEOPLE IN FORMING A GOVERNMENT -- OFFICIAL BRIBERY UNDER DOM PEDRO -- A CORRUPT JUDICIARY -- IGNORANCE WITH REGARD TO GOVERNMENTAL NECESSITIES.,https://query.nytimes.com/gst/abstract.html?res=9507E2D81539E033A2575AC1A9679C94619ED7CF,0
1890-01-19T00:00:00Z,THE WESTCHESTER HERMIT; PECULIARITIES OF OLD REUBEN SORREL. A RECLUSE WITH OCCASIONAL SOCIABLE TENDENCIES -- HIS MODE OF KEEPING HOUSE.,https://query.nytimes.com/gst/abstract.html?res=9C00E4D81539E033A2575AC1A9679C94619ED7CF,0
1890-01-19T00:00:00Z,AFRICAN EXPLORATION.,https://query.nytimes.com/gst/abstract.html?res=9A01E4D81539E033A2575AC1A9679C94619ED7CF,0
1890-01-19T00:00:00Z,A USEFUL INSTITUTION.; RECORD OF THE PRATT LIBRARY IN BALTIMORE.,https://query.nytimes.com/gst/abstract.html?res=9D01E3D81539E033A2575AC1A9679C94619ED7CF,0
1890-01-19T00:00:00Z,CHINA'S ROYAL QUARREL; EMPEROR AND EMPRESS DOWAGER IN OPEN WAR. SECRET SOCIETIES THAT SEEK TO OVERTHROW THE GOVERNMENT -- OUTBREAKS AT TREATY PORTS.,https://query.nytimes.com/gst/abstract.html?res=9F0DE3D81539E033A2575AC1A9679C94619ED7CF,0
1890-01-19T00:00:00Z,ASKED BY THE DEFENDANT.,https://query.nytimes.com/gst/abstract.html?res=9E03E4D81539E033A2575AC1A9679C94619ED7CF,0
1890-01-19T00:00:00Z,A SCRAP OF PAPER PROBATED AS A WILL.,https://query.nytimes.com/gst/abstract.html?res=9D05E2D81539E033A2575AC1A9679C94619ED7CF,0
1890-01-19T00:00:00Z,RANDOM FLORIDA NOTES; BRIEF STOPS IN JACKSONVILLE AND SAVANAH. HOW NEW-YORK SUPPLIES FLORIDA WITH FOOD -- A JACKSONVILLE EPISODE -- THE HOMEWARD VOYAGE.,https://query.nytimes.com/gst/abstract.html?res=9F01E2D81539E033A2575AC1A9679C94619ED7CF,0
1890-01-19T00:00:00Z,Editorial Article 2 -- No Title,https://query.nytimes.com/gst/abstract.html?res=9D0CE4D81539E033A2575AC1A9679C94619ED7CF,0
1890-01-20T00:00:00Z,SERIOUS TROUBLE FEARED.; DIFFICULTY IN A GERMAN SOCIETY OF ELIZABETH.,https://query.nytimes.com/gst/abstract.html?res=9402E0DB143BE533A25753C2A9679C94619ED7CF,0
