pub_date,main_headline,article_url,classification
1896-01-12T00:00:00Z,SPAIN SENDING CAVALRY; Rebels Burning Houses and Villages and Derailing Trains. GOMEZ DEFEATED AGAIN AT BIGONA Railway Communication Between Guines and San Felipe Inter- rupted -- One Hundred and Fifty Rebels Buried.,https://query.nytimes.com/gst/abstract.html?res=950DE6D81231E033A25751C1A9679C94679ED7CF,0
1896-01-12T00:00:00Z,ENGLAND AND VENEZUELA.,https://query.nytimes.com/gst/abstract.html?res=9F02E6D81231E033A25751C1A9679C94679ED7CF,0
1896-01-12T00:00:00Z,SEEMINGLY BORN TO ENDURE ACCIDENT; Painful Experiences of an East Boston Fireman.,https://query.nytimes.com/gst/abstract.html?res=9D02E5D81231E033A25751C1A9679C94679ED7CF,0
1896-01-12T00:00:00Z,Essex Bicycle Club Affairs.,https://query.nytimes.com/gst/abstract.html?res=9804E5D81231E033A25751C1A9679C94679ED7CF,0
1896-01-12T00:00:00Z,THE MAYOR'S HASTE.,https://query.nytimes.com/gst/abstract.html?res=9802E6D81231E033A25751C1A9679C94679ED7CF,0
1896-01-12T00:00:00Z,NEW FENCING CLUB IN BERLIN; Americans and Englishmen Among the Berliner Fecht Klub's Officers.,https://query.nytimes.com/gst/abstract.html?res=9A0CE4D81231E033A25751C1A9679C94679ED7CF,0
1896-01-12T00:00:00Z,OLD SHACKAMAXON IS DOOMED; Secretary Carlisle Orders Her Replaced in the Immigrant Service and a Scow Nearly Wrecks Her.,https://query.nytimes.com/gst/abstract.html?res=9F06E6D81231E033A25751C1A9679C94679ED7CF,0
1896-01-12T00:00:00Z,VILLAGE CHARTER CHANGES; NEW-ROCHELLE TAXPAYERS DIS- CUSS NEEDED IMPROVEMENTS. Increased Police and Fire Boards Sug- gested -- Committee Will Submit a Revised Charter.,https://query.nytimes.com/gst/abstract.html?res=9C06E5D81231E033A25751C1A9679C94679ED7CF,0
1896-01-12T00:00:00Z,"AN AUSTRALIAN PRIMA DONNA; Miss Nellie Stewart, Actress and Singer of Rare Versatility.",https://query.nytimes.com/gst/abstract.html?res=990CE5D81231E033A25751C1A9679C94679ED7CF,0
1896-01-12T00:00:00Z,"JAMAICA'S SOLDIER MONUMENT; FIGURE OF ""VICTORY"" TO BE UNVEILED MEMORIAL DAY. The Work of F.W. Ruckstubl of This City -- The Gift of Many Citizens -- To be Placed on a High Mound.",https://query.nytimes.com/gst/abstract.html?res=990CE4D81231E033A25751C1A9679C94679ED7CF,0
1896-01-12T00:00:00Z,PARAGRAPHS FOR CHILDREN.,https://query.nytimes.com/gst/abstract.html?res=9E00E3D81231E033A25751C1A9679C94679ED7CF,0
1896-01-12T00:00:00Z,MR. NORMAN MADE A HIT; The London Journalist Opened the Eyes of Two Peoples. PRESIDENT AND CABINET RESERVED The Niggardliness of Congress Causes Painful Crushes at Receptions Given in the White House.,https://query.nytimes.com/gst/abstract.html?res=9A05E4D81231E033A25751C1A9679C94679ED7CF,0
1896-01-12T00:00:00Z,"COQUARD'S LA JACQUERIE; Poor Lalo's Work with a Feeble Poem for the Opera Comique. CONTINUED BY A GOOD MUSICIAN Longfellow's ""Evangeline"" Translated by Three Poets and Set to Music by Xavier Leroux at Brussels.",https://query.nytimes.com/gst/abstract.html?res=9B0CE4D81231E033A25751C1A9679C94679ED7CF,0
1896-01-12T00:00:00Z,HER POINT OF VIEW.,https://query.nytimes.com/gst/abstract.html?res=9401E3D81231E033A25751C1A9679C94679ED7CF,0
1896-01-12T00:00:00Z,MORE POWER TO MR. REED; The New Rules Make the Speaker Almost a Dictator. NEWSPAPER REPORTERS ARE BARRED The Method of Determining the Pres- ence of a Quorum Not Yet Decid- ed -- No Notice Necessary to Change the Rules.,https://query.nytimes.com/gst/abstract.html?res=9806E4D81231E033A25751C1A9679C94679ED7CF,0
1896-01-12T00:00:00Z,THE TEXAS TO BE REPAIRED; Not to be Kept in Commission and Placed on the Reserve List.,https://query.nytimes.com/gst/abstract.html?res=9F06E4D81231E033A25751C1A9679C94679ED7CF,0
1896-01-12T00:00:00Z,THE THEATRES,https://query.nytimes.com/gst/abstract.html?res=9502E5D81231E033A25751C1A9679C94679ED7CF,0
1896-01-12T00:00:00Z,EDWARD GROSSE ACCUSED; Discharged Deputy Tells of Fraud in the Collector's Office. ALLEGED BRIBERY BY SALOON MEN Col. Keller to Make Specific Charges in Washington -- Mr. Grosse De- nies All the Accusations -- His Story of Keller.,https://query.nytimes.com/gst/abstract.html?res=9800E4D81231E033A25751C1A9679C94679ED7CF,0
1896-01-12T00:00:00Z,GEN. GRANT AND THE WAR WITH MEXICO; John Russell Young Reports that He Always Greatly Deplored It.,https://query.nytimes.com/gst/abstract.html?res=9D05E3D81231E033A25751C1A9679C94679ED7CF,0
1896-01-12T00:00:00Z,VETERAN WHEELMEN BOWL.; A Lone-Standing Tie Game Decided in Favor of Jerseymen.,https://query.nytimes.com/gst/abstract.html?res=9904E5D81231E033A25751C1A9679C94679ED7CF,0
1896-01-12T00:00:00Z,ATTACK ON THE LINSEED OIL TRUST; The Attorney General of Illinois Asks that the Charter Be Revoked -- A Victory for the Grain Elevators.,https://query.nytimes.com/gst/abstract.html?res=980CE5D81231E033A25751C1A9679C94679ED7CF,0
1896-01-12T00:00:00Z,"YALE TO HAVE A NEW CAMPUS; UNIVERSITY BUYING PROPERTY FOR THE PURPOSE. It Is to the North of the Present Campus, and Already Contains Several College Buildings.",https://query.nytimes.com/gst/abstract.html?res=9F00E3D81231E033A25751C1A9679C94679ED7CF,0
1896-01-12T00:00:00Z,AGAINST OVERCROWDING TENEMENTS; The Russian-American Democratic As- sociation's Proposed Law.,https://query.nytimes.com/gst/abstract.html?res=9507E5D81231E033A25751C1A9679C94679ED7CF,0
1896-01-12T00:00:00Z,AT MONTE SAN GIULIANO; Explorations Within and Without Sicily's Most Ancient Town. THE TEMPLE OF VENUS ERYCINA Inexpugnable Acropolis of Eryx's Walls and Gates -- Portico and Vestibule of the Old Catkedral.,https://query.nytimes.com/gst/abstract.html?res=9C03E3D81231E033A25751C1A9679C94679ED7CF,0
1896-01-12T00:00:00Z,THE CANVASS FOR GOV. MORTON; Efforts to Secure His Nomination for President to be Conducted Under His Supervision.,https://query.nytimes.com/gst/abstract.html?res=9D00E6D81231E033A25751C1A9679C94679ED7CF,0
1896-01-12T00:00:00Z,GOSSIP OF THE CYCLERS; Free Passage for Wheel Riders Desired on the Brooklyn Bridge. TOURISTS' TEMPTING FAIR PRIZES Loug Island Wheelmen get a Good Example for Other Clubs to Follow -- The Kings County's Bowling.,https://query.nytimes.com/gst/abstract.html?res=9D0DE4D81231E033A25751C1A9679C94679ED7CF,0
1896-01-12T00:00:00Z,"M'DONALD IN THE TOMBS; Ex-Clerk of Special Sessions Unable to Secure Bail. HE APPROPRIATED AT LEAST $4,800 Chauncey M. Depew, Gen. Horace Porter, Supreme Court Justices, and Others Gave Him Recommendations.",https://query.nytimes.com/gst/abstract.html?res=9F00E5D81231E033A25751C1A9679C94679ED7CF,0
1896-01-12T00:00:00Z,"MEETINGS OF COLLEGE WOMEN; DR. D.K. PEARSONS OFFERS $50,000 TO MOUNT HOLYOKE. Rutgers Alumnae Lunch at the Waldorf and Listen to Addresses -- Vassar Students' Aid Society.",https://query.nytimes.com/gst/abstract.html?res=9E02E5D81231E033A25751C1A9679C94679ED7CF,0
1896-01-12T00:00:00Z,ROBERT MILLER TO BE APPOINTED; Will Be Made Deputy Tax Commissioner -- Inerease in Valuations.,https://query.nytimes.com/gst/abstract.html?res=9A00E5D81231E033A25751C1A9679C94679ED7CF,0
1896-01-12T00:00:00Z,"IN AND ABOUT SUMIT, N.J.; Movements of Society Leaders Daring the Past Week.",https://query.nytimes.com/gst/abstract.html?res=9E03E5D81231E033A25751C1A9679C94679ED7CF,0
1896-01-12T00:00:00Z,THE UNITED SERVICE.,https://query.nytimes.com/gst/abstract.html?res=9502E4D81231E033A25751C1A9679C94679ED7CF,0
1896-01-12T00:00:00Z,"A SATURDAY NIGHT DINNER; The Third of Its Kind at the Executive Mansion, Albany. A LEAP YEAR DANCE BEING ARRANGED Social Events of the Week Just Passed in Albany, with Those that Are to Come in the Near Future.",https://query.nytimes.com/gst/abstract.html?res=9B02E5D81231E033A25751C1A9679C94679ED7CF,0
1896-01-12T00:00:00Z,TALK OF RECOGNIZING CUBA.; House Committee on Foreign Affairs Secks Information.,https://query.nytimes.com/gst/abstract.html?res=9F05E5D81231E033A25751C1A9679C94679ED7CF,0
1896-01-12T00:00:00Z,An Artistic Cycle Catalogue.,https://query.nytimes.com/gst/abstract.html?res=990DE4D81231E033A25751C1A9679C94679ED7CF,0
1896-01-12T00:00:00Z,NOTES OF THE STAGE.,https://query.nytimes.com/gst/abstract.html?res=9E0DE5D81231E033A25751C1A9679C94679ED7CF,0
1896-01-12T00:00:00Z,THE STATE CAPITOL.,https://query.nytimes.com/gst/abstract.html?res=9B02E6D81231E033A25751C1A9679C94679ED7CF,0
1896-01-12T00:00:00Z,LOSSES BY FIRE.,https://query.nytimes.com/gst/abstract.html?res=940CE6D81231E033A25751C1A9679C94679ED7CF,0
1896-01-12T00:00:00Z,"""THE ANACHRONISM OF WAR""; Establishment by United States and England of a System of Arbitration Is Urged by the Century Magazine.",https://query.nytimes.com/gst/abstract.html?res=9D03E6D81231E033A25751C1A9679C94679ED7CF,0
1896-01-12T00:00:00Z,"DEATH OF GEN, BARLOW; The Gallant Soldier a Victim of the Effects of Grip. HIS MILITARY AND CIVIL CAREER Rose from Private to Major General in the Army, and Held Sev- eral Important Polit- ical Offices.",https://query.nytimes.com/gst/abstract.html?res=9B00E4D81231E033A25751C1A9679C94679ED7CF,0
1896-01-12T00:00:00Z,"WHAT A MINISTER SAW; REV. E.P. WOODWARD'S VISIT TO NORTH CONWAY, N.H. "" Alcoholism,"" Its Victims and How They Should Be Regarded. Definite Conclusions Studiously Arrived at and Pointedly Stated.",https://query.nytimes.com/gst/abstract.html?res=9B0DE5D81231E033A25751C1A9679C94679ED7CF,0
1896-01-12T00:00:00Z,HOW IT FEELS TO DROP FROM A BALLOON; A Canadian Aeronaut Describes the Sensations of His First Effort.,https://query.nytimes.com/gst/abstract.html?res=9802E3D81231E033A25751C1A9679C94679ED7CF,0
1896-01-12T00:00:00Z,The Ways of the Fijians.,https://query.nytimes.com/gst/abstract.html?res=9C02E3D81231E033A25751C1A9679C94679ED7CF,0
1896-01-12T00:00:00Z,"FINANCES OF THE NATION.; Condition of the Treasury, with Receipts and Expenditures.",https://query.nytimes.com/gst/abstract.html?res=9C02E4D81231E033A25751C1A9679C94679ED7CF,0
1896-01-12T00:00:00Z,More Unjust English Justice.,https://query.nytimes.com/gst/abstract.html?res=9C0DE3D81231E033A25751C1A9679C94679ED7CF,0
1896-01-12T00:00:00Z,SOCIETY IN THE ORANGES.; Some of the More Important Entertainment of the Week.,https://query.nytimes.com/gst/abstract.html?res=9C03E5D81231E033A25751C1A9679C94679ED7CF,0
1896-01-12T00:00:00Z,MANHATTAN CRICKET RECORDS.; What the Players Did at Batting and Bowling Last Year.,https://query.nytimes.com/gst/abstract.html?res=9A02E4D81231E033A25751C1A9679C94679ED7CF,0
1896-01-12T00:00:00Z,THE KENTUCKY SENATORSHIP; Congressman Hunter Nominated by the Re- publicans -- Death of a Democratic Representative.,https://query.nytimes.com/gst/abstract.html?res=9D05E5D81231E033A25751C1A9679C94679ED7CF,0
1896-01-12T00:00:00Z,HEAD-DRESS BALLS IN PARIS.; The Latest Caprice of French Society Hostesses.,https://query.nytimes.com/gst/abstract.html?res=9501E3D81231E033A25751C1A9679C94679ED7CF,0
1896-01-12T00:00:00Z,ATHLETES AT COLUMBIA; Marked Revival of Interest in Field and Track Sports. GOOD TIMBER FOR MOTT HAVES GAMES Four Veterans as a Basis for the Varsity Crew -- A Fine Bicycle Team -- S.A.W. Baltazzi First in the Jumps.,https://query.nytimes.com/gst/abstract.html?res=9902E4D81231E033A25751C1A9679C94679ED7CF,0
1896-01-12T00:00:00Z,LUNATIC'S FUNDS MISMANAGED; Justice Truax Removes John McLellan as Committee of the Person and Estate of Edward Crawford.,https://query.nytimes.com/gst/abstract.html?res=9E01E4D81231E033A25751C1A9679C94679ED7CF,0
1896-01-12T00:00:00Z,EVERYTHING IN THE BLUE BOOK.; Great Britain's Venezuelan Claim Fully State in That Publication.,https://query.nytimes.com/gst/abstract.html?res=9C05E5D81231E033A25751C1A9679C94679ED7CF,0
1896-01-12T00:00:00Z,"THE BOSTON NEWS LETTER; It Was the First Newspaper Ever Published in This Country. APRIL 17, 1704, THE DATE OF ITS BIRTH Valuable Possession of the New-York Historical Society -- Best Collection in the World of This paper.",https://query.nytimes.com/gst/abstract.html?res=9F03E3D81231E033A25751C1A9679C94679ED7CF,0
1896-01-12T00:00:00Z,"GOLD FOR THE NEW BONDS; Gains from Europe Amount to Almost $3,000,000. INDICATIONS OF BANK STATEMENT Predicted that the Issue Will Be Greatly Oversubscribed -- Outlook Good for an Active Stock Market.",https://query.nytimes.com/gst/abstract.html?res=9406E5D81231E033A25751C1A9679C94679ED7CF,0
1896-01-12T00:00:00Z,MUCH WRECKAGE COMING ASHORE; Evidence That Seems to Indicate a Great Disaster on the Ocean off the Shores of Nantucket.,https://query.nytimes.com/gst/abstract.html?res=9A00E6D81231E033A25751C1A9679C94679ED7CF,0
1896-01-12T00:00:00Z,THE VICTORIES OF ANTITOXINE.,https://query.nytimes.com/gst/abstract.html?res=9A02E6D81231E033A25751C1A9679C94679ED7CF,0
1896-01-12T00:00:00Z,ADVICE BY MR. CARNEGIE; Delivers an Address on Founder's Day at Cornell University. BELIEVES IN A BUSINESS CAREER Professional Men Said to be Narrow -- Failures of Others Should Not Discourage Ambitious Beginners.,https://query.nytimes.com/gst/abstract.html?res=9B06E4D81231E033A25751C1A9679C94679ED7CF,0
1896-01-12T00:00:00Z,"EX-PRESIDENT HARRISON IN TOWN; He Declines to Talk About His Reported Engagement to Mrs. Dimmock -- Here on Legal Business, He Says.",https://query.nytimes.com/gst/abstract.html?res=9E00E6D81231E033A25751C1A9679C94679ED7CF,0
1896-01-12T00:00:00Z,Handbook of the Cotton Trade.,https://query.nytimes.com/gst/abstract.html?res=9B04E3D81231E033A25751C1A9679C94679ED7CF,0
1896-01-12T00:00:00Z,OBITUARY RECORD.,https://query.nytimes.com/gst/abstract.html?res=9B00E6D81231E033A25751C1A9679C94679ED7CF,0
1896-01-12T00:00:00Z,NEW PUBLICATIONS; RACE THEORIES AND NATIONAL CHARACTER,https://query.nytimes.com/gst/abstract.html?res=9D02E3D81231E033A25751C1A9679C94679ED7CF,1
1896-01-12T00:00:00Z,His Subterfuge.,https://query.nytimes.com/gst/abstract.html?res=9A05E3D81231E033A25751C1A9679C94679ED7CF,0
1896-01-12T00:00:00Z,THE BROOKLYN SYMPHONY SOCIETY.,https://query.nytimes.com/gst/abstract.html?res=9502E6D81231E033A25751C1A9679C94679ED7CF,0
1896-01-12T00:00:00Z,ST. LOUIS BOOMERS LEAVE HOME.; Part of the Committee That Is After the Democratic Convention.,https://query.nytimes.com/gst/abstract.html?res=9C00E6D81231E033A25751C1A9679C94679ED7CF,0
1896-01-12T00:00:00Z,MR. HALL CAINE'S IMPRESSIONS.; Mrs. Cleveland Charming and All American Women Attractive.,https://query.nytimes.com/gst/abstract.html?res=9D00E3D81231E033A25751C1A9679C94679ED7CF,0
1896-01-12T00:00:00Z,Editorial Article 1 -- No Title,https://query.nytimes.com/gst/abstract.html?res=9E0DE6D81231E033A25751C1A9679C94679ED7CF,0
1896-01-12T00:00:00Z,WHO WILL BE CHAIRMAN; St. Louis Speculating on the Convention Organization. AGENTS OF CANDIDATES PLENTIFUL Filley and Kerens Fighting for Control of the Republican Party in Missouri -- Thurston for McKinley.,https://query.nytimes.com/gst/abstract.html?res=9501E6D81231E033A25751C1A9679C94679ED7CF,0
1896-01-12T00:00:00Z,A WEEK'S EVENTS IN PLAINFIELD.; Numerous Receptions -- Doings of Clubs and Societies.,https://query.nytimes.com/gst/abstract.html?res=9F03E5D81231E033A25751C1A9679C94679ED7CF,0
1896-01-12T00:00:00Z,"HE SIGNED THE DECLARATION; The Signature of Francis Lewis Found in a St. George's Church Record in Flushing, L.I.",https://query.nytimes.com/gst/abstract.html?res=940CE4D81231E033A25751C1A9679C94679ED7CF,0
1896-01-12T00:00:00Z,EQUIPMENT OF THE NATIONAL GUARD.,https://query.nytimes.com/gst/abstract.html?res=9F02E3D81231E033A25751C1A9679C94679ED7CF,0
1896-01-12T00:00:00Z,Steamship Turpie Overdue.,https://query.nytimes.com/gst/abstract.html?res=9C04E5D81231E033A25751C1A9679C94679ED7CF,0
1896-01-12T00:00:00Z,Morey Won the Converse Cup.,https://query.nytimes.com/gst/abstract.html?res=9807E5D81231E033A25751C1A9679C94679ED7CF,0
1896-01-12T00:00:00Z,Preacher Convicted of Murder.,https://query.nytimes.com/gst/abstract.html?res=9406E4D81231E033A25751C1A9679C94679ED7CF,0
1896-01-12T00:00:00Z,"A WOMAN SHOOTS HER ASSAILANT; Mrs. Angelier of Baltimore Kills Charles M Parker of Athol, Mass., and Sets Up a Claim of Self-defense.",https://query.nytimes.com/gst/abstract.html?res=9A00E4D81231E033A25751C1A9679C94679ED7CF,0
1896-01-12T00:00:00Z,PERSONS AND PLACES.,https://query.nytimes.com/gst/abstract.html?res=9B01E3D81231E033A25751C1A9679C94679ED7CF,0
1896-01-12T00:00:00Z,MURPHY'S LARCHMONT CUP.; Killed 92 Birds and Tied with Macal- ester -- Won the Shoot-off.,https://query.nytimes.com/gst/abstract.html?res=9504E5D81231E033A25751C1A9679C94679ED7CF,0
1896-01-12T00:00:00Z,IN HONOR OF EX-JUDGE FINCH; Members of the Psi Upsilon Fraternity Have Tendered Him a Dinner.,https://query.nytimes.com/gst/abstract.html?res=940DE5D81231E033A25751C1A9679C94679ED7CF,0
1896-01-12T00:00:00Z,SAYS HE WAS IN JOKING MOOD; What Francis Wilson Writes of His Remarks Respecting Mr. Rosenfeld.,https://query.nytimes.com/gst/abstract.html?res=9F0DE5D81231E033A25751C1A9679C94679ED7CF,0
1896-01-12T00:00:00Z,To Name Springfled's Four Hundred.,https://query.nytimes.com/gst/abstract.html?res=9D01E3D81231E033A25751C1A9679C94679ED7CF,0
1896-01-12T00:00:00Z,Heart Burials.,https://query.nytimes.com/gst/abstract.html?res=9402E4D81231E033A25751C1A9679C94679ED7CF,0
1896-01-12T00:00:00Z,"THE ESSEQUIBO THE BOUNDARY; Old Maps, an Authority in England, Show This the True Line Between Guiana and Venezuela.",https://query.nytimes.com/gst/abstract.html?res=9D04E4D81231E033A25751C1A9679C94679ED7CF,0
1896-01-12T00:00:00Z,Matters According to the Pentateuch.,https://query.nytimes.com/gst/abstract.html?res=9902E3D81231E033A25751C1A9679C94679ED7CF,0
1896-01-12T00:00:00Z,WAR AGAINST SUNDAY SELLING; MAYOR WURSTER HAS NOT OUT- LINED HIS EXCISE POLICY. Eastern District Clergymen Plan a Crusade -- Saloon Keepers Will Be Careful.,https://query.nytimes.com/gst/abstract.html?res=9A06E4D81231E033A25751C1A9679C94679ED7CF,0
1896-01-12T00:00:00Z,A Day of Post Office Work.,https://query.nytimes.com/gst/abstract.html?res=9E04E3D81231E033A25751C1A9679C94679ED7CF,0
1896-01-12T00:00:00Z,"KAISER WORRIES BRITONS; Their Sedate and Serious Minds Revert Always to Him. SOME HINTS OF HIS EARNESTNESS Kruger Must Have Plans in Which Germany Can Serve Him, and They Have Been Divined. ENGLAND'S EASILY EXECUTED ORDERS Russia Suspected of Inciting Continental Opposition -- Cecil Rhodes's Scheme -- Chamberlain's Favor.",https://query.nytimes.com/gst/abstract.html?res=9B07E6D81231E033A25751C1A9679C94679ED7CF,0
1896-01-12T00:00:00Z,Front Page 2 -- No Title,https://query.nytimes.com/gst/abstract.html?res=9C06E6D81231E033A25751C1A9679C94679ED7CF,0
1896-01-12T00:00:00Z,SPALDING ABANDONS RACING.; He Will Not Employ a Racing Team During the Coming Season.,https://query.nytimes.com/gst/abstract.html?res=9E04E5D81231E033A25751C1A9679C94679ED7CF,0
1896-01-12T00:00:00Z,BROOKLYN REALTY MATTERS.,https://query.nytimes.com/gst/abstract.html?res=9D07E4D81231E033A25751C1A9679C94679ED7CF,0
1896-01-12T00:00:00Z,"MAY SUCCEED MR. COLLYER; The Rev. Minor J. Savage, Who Has Been Called to This City. HIS LONG PASTORATE IN BOSTON For Twenty-one Years He Has Had Charge of Unity Church. There -- As a Preacher and Writer.",https://query.nytimes.com/gst/abstract.html?res=9806E5D81231E033A25751C1A9679C94679ED7CF,0
1896-01-12T00:00:00Z,FIRE PATROLMAN ARRESTED; Accused of Robbing a Building in Wooster Street Which He Was Supposed to be Guarding.,https://query.nytimes.com/gst/abstract.html?res=9B01E6D81231E033A25751C1A9679C94679ED7CF,0
1896-01-12T00:00:00Z,"BRITAIN'S BLIND POLICY; Conquest by False Pretense and Terrorizing of the Feeble. FRANCE MUST STAND BY AMERICA Venezuela, the Monroe Doctrine, and President Cleveland's Valiant Message in Opposition to Injustice.",https://query.nytimes.com/gst/abstract.html?res=9C05E3D81231E033A25751C1A9679C94679ED7CF,0
1896-01-12T00:00:00Z,Tobacco and Teetotalers.,https://query.nytimes.com/gst/abstract.html?res=9F04E3D81231E033A25751C1A9679C94679ED7CF,0
1896-01-12T00:00:00Z,"NIAGARA'S ENGLISH CUPS; Trophies Won by Howard Gould's Twenty-Rater Cutter. ON SHOW IN TIFFANY & CO.'S WINDOW The Lot Includes a Cup Presented by the Earl of Dunraven, and Another by His Friend Mr. Kersey.",https://query.nytimes.com/gst/abstract.html?res=9D0CE5D81231E033A25751C1A9679C94679ED7CF,0
1896-01-12T00:00:00Z,OLD CAP'N RUBE'S FINGERS.,https://query.nytimes.com/gst/abstract.html?res=9B02E3D81231E033A25751C1A9679C94679ED7CF,0
1896-01-12T00:00:00Z,NEW GUNS ATESQUIMAULT; England Will Not Be Caught Napping on the Pacific. NOW FORTIFYING A NECESSARY PORT Ordnance Being Received and Can- non Mounted to Increase the Defenses of Her Dock and Naval Depot.,https://query.nytimes.com/gst/abstract.html?res=9A07E3D81231E033A25751C1A9679C94679ED7CF,0
1896-01-12T00:00:00Z,SOCIETY,https://query.nytimes.com/gst/abstract.html?res=9B03E5D81231E033A25751C1A9679C94679ED7CF,0
1896-01-12T00:00:00Z,FIFTY YEARS OF PERSEVERANCE; What the New-York Life Shows in Its Annual Report.,https://query.nytimes.com/gst/abstract.html?res=9F00E6D81231E033A25751C1A9679C94679ED7CF,0
1896-01-12T00:00:00Z,Mr. Briscoe Is Permanent Secretary.,https://query.nytimes.com/gst/abstract.html?res=9E0CE5D81231E033A25751C1A9679C94679ED7CF,0
1896-01-12T00:00:00Z,"A FIGHT OVER A PIPE LINE; Railroad and Pipe Line Men Come Together in Washington, N.J., and Indulge in Violence.",https://query.nytimes.com/gst/abstract.html?res=9B06E6D81231E033A25751C1A9679C94679ED7CF,0
1896-01-12T00:00:00Z,Obituary 1 -- No Title,https://query.nytimes.com/gst/abstract.html?res=9D0CE6D81231E033A25751C1A9679C94679ED7CF,0
1896-01-12T00:00:00Z,Bequests for Education.,https://query.nytimes.com/gst/abstract.html?res=9802E4D81231E033A25751C1A9679C94679ED7CF,0
1896-01-12T00:00:00Z,CHALLENGE FROM LONDON; British Athletes Want to Meet New-York Experts Once More. POSITION OF NEW-YORK ATHLETIC CLUB Competitors Would Have to be Vouched For by the Amateur Athletic Union -- Defeat of Americans Probable.,https://query.nytimes.com/gst/abstract.html?res=9D07E5D81231E033A25751C1A9679C94679ED7CF,0
1896-01-12T00:00:00Z,To Pay Police Expenses Promptly.,https://query.nytimes.com/gst/abstract.html?res=9C00E4D81231E033A25751C1A9679C94679ED7CF,0
1896-01-12T00:00:00Z,FINE ROADS OF QUEENS COUNTY; Said to be the Best in the State -- Favorite Racing Tracks for Wheelmen -- Easily Cleared After Snowstorms.,https://query.nytimes.com/gst/abstract.html?res=9F00E4D81231E033A25751C1A9679C94679ED7CF,0
1896-01-12T00:00:00Z,YACHT BUILDERS BUSY.; Several Orders for New-Yorkers Placed in Boston Yards.,https://query.nytimes.com/gst/abstract.html?res=9A04E5D81231E033A25751C1A9679C94679ED7CF,0
1896-01-12T00:00:00Z,STOOD LIKE A STONEWALL AT MANASSAS; Personal Appearance of the Great Confederate General.,https://query.nytimes.com/gst/abstract.html?res=9E06E3D81231E033A25751C1A9679C94679ED7CF,0
1896-01-12T00:00:00Z,BRITONS IN THE TRANSVAAL.; Statistics Being Secured by the English Government.,https://query.nytimes.com/gst/abstract.html?res=9401E4D81231E033A25751C1A9679C94679ED7CF,0
1896-01-12T00:00:00Z,Psi Upsilon in Washington,https://query.nytimes.com/gst/abstract.html?res=9502E3D81231E033A25751C1A9679C94679ED7CF,0
1896-01-12T00:00:00Z,"MEMORIAL TO POPE LEO; Beautiful Church in Rome Is Soon to be Dedicated. GIFT OF CATHOLICS OF ALL NATIONS It Will Contain a Magnificent Collection of Painting's and Statuary, the Gifts of Many Rulers of Europe.",https://query.nytimes.com/gst/abstract.html?res=9C06E3D81231E033A25751C1A9679C94679ED7CF,0
1896-01-12T00:00:00Z,ONLY THE STARS,https://query.nytimes.com/gst/abstract.html?res=9E0DE3D81231E033A25751C1A9679C94679ED7CF,0
1896-01-12T00:00:00Z,A COMIC OPERA PAY NIGHT; BEHIND THE SCENES WITH THE MAN WHO HANDLES THE MONEY. Terrible Denunciation of the Stage Manager by Chorus Girls -- Some Scenes and Incidents.,https://query.nytimes.com/gst/abstract.html?res=9D0DE5D81231E033A25751C1A9679C94679ED7CF,0
1896-01-12T00:00:00Z,"NOT LEAP YEAR, BUT SHE HELPED HIM OUT; Jack Was Somewhat Obtuse, and Then, Too, He Was Going Away.",https://query.nytimes.com/gst/abstract.html?res=9C01E3D81231E033A25751C1A9679C94679ED7CF,0
1896-01-12T00:00:00Z,IT IS MOSTLY EMPIRICISM; So Says an English Doctor About the Practice of His Profession.,https://query.nytimes.com/gst/abstract.html?res=9F06E3D81231E033A25751C1A9679C94679ED7CF,0
1896-01-12T00:00:00Z,ART IN WAXFLOWER WORK; A Woman Who Has Devoted Her Life to Its Perfection. INTERESTED THE QUEEN AS A CHILD Mrs. Mogridge Has Been Employed by the Museum of Natural History and United States Government.,https://query.nytimes.com/gst/abstract.html?res=9400E3D81231E033A25751C1A9679C94679ED7CF,0
1896-01-12T00:00:00Z,Duck Shooting on Great South Bay.,https://query.nytimes.com/gst/abstract.html?res=9501E5D81231E033A25751C1A9679C94679ED7CF,0
1896-01-12T00:00:00Z,Joyfully Met.,https://query.nytimes.com/gst/abstract.html?res=9506E5D81231E033A25751C1A9679C94679ED7CF,0
1896-01-12T00:00:00Z,THE CHICAGO MARKET.,https://query.nytimes.com/gst/abstract.html?res=9403E4D81231E033A25751C1A9679C94679ED7CF,0
1896-01-12T00:00:00Z,WHAT GOMEZ IS PLANNING.; A Probability that He Is Seeking Strongholds on the Coast.,https://query.nytimes.com/gst/abstract.html?res=9C0CE6D81231E033A25751C1A9679C94679ED7CF,0
1896-01-12T00:00:00Z,"APPEAL TO GOVERNOR WITHHELD; Company G, Twenty-second Regiment, Sends a Protest Against Lieut. Dayton Direct to Albany.",https://query.nytimes.com/gst/abstract.html?res=9404E3D81231E033A25751C1A9679C94679ED7CF,0
1896-01-12T00:00:00Z,SHEA MAY GET A NEW TRIAL; Prosecution Must Show Why This Should Not be Granjted -- Prisoner's Attorney Hopeful.,https://query.nytimes.com/gst/abstract.html?res=9A06E6D81231E033A25751C1A9679C94679ED7CF,0
1896-01-12T00:00:00Z,"IN HONOR OF HAMILTON; Brooklyn Praises the First Secre- tary of the Treasury. SPEECH BY BOOKER T. WASHINGTON The Negro Professor on the Race Problem -- Eulogies by Robert B. Roosevelt, Dr. Friesel, and Prof. Wilson.",https://query.nytimes.com/gst/abstract.html?res=9F03E6D81231E033A25751C1A9679C94679ED7CF,0
1896-01-12T00:00:00Z,NEW CORPORATIONS.,https://query.nytimes.com/gst/abstract.html?res=9C0DE4D81231E033A25751C1A9679C94679ED7CF,0
