pub_date,main_headline,article_url,classification
1896-01-05T00:00:00Z,Money Needed for Use at Pompeii.,https://query.nytimes.com/gst/abstract.html?res=9A01E2D8153EE333A25756C0A9679C94679ED7CF,0
1896-01-05T00:00:00Z,SOME NEW MEMBERS OF THE LEGISLATURE.,https://query.nytimes.com/gst/abstract.html?res=9F06E0D8153EE333A25756C0A9679C94679ED7CF,0
1896-01-05T00:00:00Z,May Defeat Blackburn.,https://query.nytimes.com/gst/abstract.html?res=9507E3D8153EE333A25756C0A9679C94679ED7CF,0
1896-01-05T00:00:00Z,United States Government Grant Making Homes Happier.,https://query.nytimes.com/gst/abstract.html?res=9D05E3D8153EE333A25756C0A9679C94679ED7CF,0
1896-01-05T00:00:00Z,JAMESON HAD STRONG SUPPORT.; Little Doubt that British Officials Caused the Invasion.,https://query.nytimes.com/gst/abstract.html?res=9B0DE2D8153EE333A25756C0A9679C94679ED7CF,0
1896-01-05T00:00:00Z,"FREEDOM FOR HARRY WEEKS; His Charges of Cruelty in the Westchester Temporary Home Will, However, Be Investigated.",https://query.nytimes.com/gst/abstract.html?res=9A0CE2D8153EE333A25756C0A9679C94679ED7CF,0
1896-01-05T00:00:00Z,Where Washington Took the Oath.,https://query.nytimes.com/gst/abstract.html?res=9F04E1D8153EE333A25756C0A9679C94679ED7CF,0
1896-01-05T00:00:00Z,THAT SECRETED TREATY.; A Claim that the Foreign Office Has Had No Time for Examination.,https://query.nytimes.com/gst/abstract.html?res=940DE4D8153EE333A25756C0A9679C94679ED7CF,0
1896-01-05T00:00:00Z,TROUBLE OVER AN UNUSED CHURCH; An Effort to Prevent Its Sale by Order of the Court.,https://query.nytimes.com/gst/abstract.html?res=9B06E1D8153EE333A25756C0A9679C94679ED7CF,0
1896-01-05T00:00:00Z,THE CHICAGO MARKET.,https://query.nytimes.com/gst/abstract.html?res=9F05E1D8153EE333A25756C0A9679C94679ED7CF,0
1896-01-05T00:00:00Z,The New Victor.,https://query.nytimes.com/gst/abstract.html?res=9B0CE1D8153EE333A25756C0A9679C94679ED7CF,0
1896-01-05T00:00:00Z,Migration of Birds.,https://query.nytimes.com/gst/abstract.html?res=9804E0D8153EE333A25756C0A9679C94679ED7CF,0
1896-01-05T00:00:00Z,"APPROPRIATIONS FOR PENSIONS; Estimates of the Commissioner Reduced by $2,000,000.",https://query.nytimes.com/gst/abstract.html?res=9A04E2D8153EE333A25756C0A9679C94679ED7CF,0
1896-01-05T00:00:00Z,"PURVEYORS OF SLANDERS; Anti-Administration Canards About the Bond Issue. A CAMPAIGN OF MISREPRESENTATION Absolutely No Basis for Sensational Stories Which Assail the President and Others. TALKS OF ""STEALS"" MANIFESTLY ABSURD The Interests of the People Will Be Guarded Safely in Any Treasury Transaction. PURVEYORS OF SLANDERS",https://query.nytimes.com/gst/abstract.html?res=9F02E4D8153EE333A25756C0A9679C94679ED7CF,0
1896-01-05T00:00:00Z,Transportation of Treasure in China.,https://query.nytimes.com/gst/abstract.html?res=9F01E1D8153EE333A25756C0A9679C94679ED7CF,0
1896-01-05T00:00:00Z,CABINET CRISIS IN CANADA; Six Members of the Ministry Reported to Have Resigned -- Premier Bowell Controls the Situation.,https://query.nytimes.com/gst/abstract.html?res=9F06E3D8153EE333A25756C0A9679C94679ED7CF,0
1896-01-05T00:00:00Z,The Katahdin Accepted.,https://query.nytimes.com/gst/abstract.html?res=9E0DE2D8153EE333A25756C0A9679C94679ED7CF,0
1896-01-05T00:00:00Z,Article 11 -- No Title,https://query.nytimes.com/gst/abstract.html?res=9B0DE3D8153EE333A25756C0A9679C94679ED7CF,0
1896-01-05T00:00:00Z,CROKER TALKS A LITTLE.; The Man out of Politics Thinks New-York Is Tired of Reform.,https://query.nytimes.com/gst/abstract.html?res=9E04E3D8153EE333A25756C0A9679C94679ED7CF,0
1896-01-05T00:00:00Z,GERMANY RETURNING TO REASON; Prospects Good for a Settlement of the Insurance Troubles -- German Importers Said to be Suffering.,https://query.nytimes.com/gst/abstract.html?res=9902E4D8153EE333A25756C0A9679C94679ED7CF,0
1896-01-05T00:00:00Z,"RAILWAY MEN LOSE THEIR LIVES; Killed by the Explosion, of an Engine near Zanesville.",https://query.nytimes.com/gst/abstract.html?res=9E03E2D8153EE333A25756C0A9679C94679ED7CF,0
1896-01-05T00:00:00Z,Five Thousand Men to Resume Work.,https://query.nytimes.com/gst/abstract.html?res=9807E2D8153EE333A25756C0A9679C94679ED7CF,0
1896-01-05T00:00:00Z,The Crusades and Poetry.,https://query.nytimes.com/gst/abstract.html?res=950CE4D8153EE333A25756C0A9679C94679ED7CF,0
1896-01-05T00:00:00Z,Injured by a Runaway.; Why Croton Water Is Muddy.,https://query.nytimes.com/gst/abstract.html?res=9502E4D8153EE333A25756C0A9679C94679ED7CF,0
1896-01-05T00:00:00Z,"TRAMPS COSTLY IN QUEENS COUNTY; Sheriff Doht Sent in a Bill of 830,000 for Boarding Them Last Year.",https://query.nytimes.com/gst/abstract.html?res=9C0CE2D8153EE333A25756C0A9679C94679ED7CF,0
1896-01-05T00:00:00Z,"COMMISSION IN SESSION; Men to Investigate Venezuela's Boundary Hold a Meeting. JUSTICE BREWER CHOSEN PRESIDENT Credentials Read that the Report Is to be Made Direct to President Cleveland. CONSULTATION HAD WITH MR. OLNEY The Secretary of State Will Not Take Part in the Inquiry, However -- To Meet Again Jan. 11.",https://query.nytimes.com/gst/abstract.html?res=980DE4D8153EE333A25756C0A9679C94679ED7CF,0
1896-01-05T00:00:00Z,ENGLAND HAS NO FRIENDS; Hostile Feeling on the Continent Against the Islanders. GERMANY WILL OPENLY AID BOERS Emperor's Message to Kruger Heartily Approved by His Subjects -- Warlike Feeling Stirred Up.,https://query.nytimes.com/gst/abstract.html?res=9502E2D8153EE333A25756C0A9679C94679ED7CF,0
1896-01-05T00:00:00Z,Article 12 -- No Title,https://query.nytimes.com/gst/abstract.html?res=9407E2D8153EE333A25756C0A9679C94679ED7CF,0
1896-01-05T00:00:00Z,"EX-JUDGE HENRY A. MOORE DEAD; He Was a County Judge in 1852, and in 1871 Became Judge of the Court of General Sessions.",https://query.nytimes.com/gst/abstract.html?res=9E04E2D8153EE333A25756C0A9679C94679ED7CF,0
1896-01-05T00:00:00Z,Prof. Totten's Perpetual Calendar.,https://query.nytimes.com/gst/abstract.html?res=9D00E1D8153EE333A25756C0A9679C94679ED7CF,0
1896-01-05T00:00:00Z,THE REAL ESTATE FIELD; A General Feeling that the Year Will Be Favorable. CONDITIONS WHICH INDICATE IT Statistics of Dealings -- Rise in William Street Property Values -- Some Recent Sales -- Legal Misdescriptions.,https://query.nytimes.com/gst/abstract.html?res=9F02E2D8153EE333A25756C0A9679C94679ED7CF,0
1896-01-05T00:00:00Z,A FAMOUS EPITAPH IN POUGHKEEPSIE; It Marks the Grave of a Self-Exiled Englishman.,https://query.nytimes.com/gst/abstract.html?res=9A00E2D8153EE333A25756C0A9679C94679ED7CF,0
1896-01-05T00:00:00Z,WON BY GIVE HOLE.; South Orange Defeats Montclair at Golf.,https://query.nytimes.com/gst/abstract.html?res=940DE3D8153EE333A25756C0A9679C94679ED7CF,0
1896-01-05T00:00:00Z,Article 2 -- No Title,https://query.nytimes.com/gst/abstract.html?res=9C00E3D8153EE333A25756C0A9679C94679ED7CF,0
1896-01-05T00:00:00Z,"THE INFLUENCE OF CLUBS; Advancement of the Interests of Riders the First Consideration. A THIRD MORE MEMBERS IN A YEAR The Social Life, Especially in Winter, an Important Factor -- Question of Race Meets -- Clubs Hereabout.",https://query.nytimes.com/gst/abstract.html?res=990CE1D8153EE333A25756C0A9679C94679ED7CF,0
1896-01-05T00:00:00Z,Teaching and the Church.,https://query.nytimes.com/gst/abstract.html?res=9907E0D8153EE333A25756C0A9679C94679ED7CF,0
1896-01-05T00:00:00Z,"THE FINANCIAL MARKETS; Fair Volume of Business, but at the Expense of Values. TREASURY SITUATION DISTURBING A Firm Opening Followed by a General Decline -- Granger and Coal Stocks Lower -- Sharp Break in Tobacco -- The Bank Statement.",https://query.nytimes.com/gst/abstract.html?res=940CE2D8153EE333A25756C0A9679C94679ED7CF,0
1896-01-05T00:00:00Z,"THE OLD MILL OF THE RECLUSE MILLER; He Allows Nobody to Enter It, and Makes All Repairs Himself.",https://query.nytimes.com/gst/abstract.html?res=9C01E0D8153EE333A25756C0A9679C94679ED7CF,0
1896-01-05T00:00:00Z,RED CROSS SOCIETY AT WORK.; A Battleship to Replace the Reina Regente Building in Spain.,https://query.nytimes.com/gst/abstract.html?res=9D03E3D8153EE333A25756C0A9679C94679ED7CF,0
1896-01-05T00:00:00Z,Turning the Tables.,https://query.nytimes.com/gst/abstract.html?res=9E0CE4D8153EE333A25756C0A9679C94679ED7CF,0
1896-01-05T00:00:00Z,QUESTION OF CREDIT IN TRADE,https://query.nytimes.com/gst/abstract.html?res=950CE1D8153EE333A25756C0A9679C94679ED7CF,0
1896-01-05T00:00:00Z,OBITUARY NOTES.,https://query.nytimes.com/gst/abstract.html?res=9802E3D8153EE333A25756C0A9679C94679ED7CF,0
1896-01-05T00:00:00Z,Hurt by a Fall from His Wheel.,https://query.nytimes.com/gst/abstract.html?res=9504E3D8153EE333A25756C0A9679C94679ED7CF,0
1896-01-05T00:00:00Z,IMPORTS OF THE WEEK.,https://query.nytimes.com/gst/abstract.html?res=9A05E1D8153EE333A25756C0A9679C94679ED7CF,0
1896-01-05T00:00:00Z,How a Pin Did It.,https://query.nytimes.com/gst/abstract.html?res=9406E1D8153EE333A25756C0A9679C94679ED7CF,0
1896-01-05T00:00:00Z,LEGISLATION IN THE SENATE.; A Free-Coinage Bill to be Reported from the Finance Committee Tuesday.,https://query.nytimes.com/gst/abstract.html?res=9A0CE4D8153EE333A25756C0A9679C94679ED7CF,0
1896-01-05T00:00:00Z,"A PLAY OF NEW THEATRE LIBRE; IBSENIAN IDEAS OF ADAM AND PICARD EXPRESSED IN ""CUIVRE."" Difficulties of Continuing the World Begun by Antoine, and Larochelle's Efforts to Overcome Them.",https://query.nytimes.com/gst/abstract.html?res=9801E0D8153EE333A25756C0A9679C94679ED7CF,0
1896-01-05T00:00:00Z,Election Row in the Sixty-ninth.,https://query.nytimes.com/gst/abstract.html?res=9C03E1D8153EE333A25756C0A9679C94679ED7CF,0
1896-01-05T00:00:00Z,"WHITE PLAINS GROWING AGAIN; IN MODERN ADVANCES ARE MANY REMINDERS OF OLD DAYS. The Town in the Days of ""Red Bird"" Stages from the Bowery -- The Village Store and Court House.",https://query.nytimes.com/gst/abstract.html?res=9C04E1D8153EE333A25756C0A9679C94679ED7CF,0
1896-01-05T00:00:00Z,Removal of Bangs & Co.,https://query.nytimes.com/gst/abstract.html?res=9806E0D8153EE333A25756C0A9679C94679ED7CF,0
1896-01-05T00:00:00Z,Sunshine and Life.,https://query.nytimes.com/gst/abstract.html?res=9807E0D8153EE333A25756C0A9679C94679ED7CF,0
1896-01-05T00:00:00Z,Golf and Hunting at Lakewood.,https://query.nytimes.com/gst/abstract.html?res=9D0CE3D8153EE333A25756C0A9679C94679ED7CF,0
1896-01-05T00:00:00Z,LITTLE WORK ON APPROPRIATIONS; Republicans Waiting to Learn the Fate of the Tariff Bill Before Taking Action on the Treasury Estimates.,https://query.nytimes.com/gst/abstract.html?res=9906E1D8153EE333A25756C0A9679C94679ED7CF,0
1896-01-05T00:00:00Z,"CRUIKSHANKS IN PARIS; Dick Wildfire, Squire Jenkins, Captain O'Shaffloton, and Past Heroes. HOW TO ENHANCE A BOOK'S WORTH Life in Paris -- Thackeray's Criticisms on Hogarth's Method -- Who Coached the Artist? -- Pierce Egan -- David Carey.",https://query.nytimes.com/gst/abstract.html?res=9801E2D8153EE333A25756C0A9679C94679ED7CF,0
1896-01-05T00:00:00Z,ST. LOUIS HAS ENOUGH; The Mound City Not Seeking the Democratic Convention. WHITE ELEPHANT ON ITS HANDS Protests Against the Manner in Which the Funds Have Been Expended -- Money for Farther Use Not Forthcoming.,https://query.nytimes.com/gst/abstract.html?res=9A05E3D8153EE333A25756C0A9679C94679ED7CF,0
1896-01-05T00:00:00Z,Front Page 5 -- No Title,https://query.nytimes.com/gst/abstract.html?res=9F0DE4D8153EE333A25756C0A9679C94679ED7CF,0
1896-01-05T00:00:00Z,Article 13 -- No Title,https://query.nytimes.com/gst/abstract.html?res=9800E2D8153EE333A25756C0A9679C94679ED7CF,0
1896-01-05T00:00:00Z,CHICAGO IS DISCOURAGED.; New-York's Big Subscription for the Convention Dampens Western Ardor.,https://query.nytimes.com/gst/abstract.html?res=9F04E3D8153EE333A25756C0A9679C94679ED7CF,0
1896-01-05T00:00:00Z,"THE SECRETS OF ""TRICK"" RIDING; A Great Deal of Hard Practice and a Large Amount of Patience the Chief Requirements, W.S. Maltby Says.",https://query.nytimes.com/gst/abstract.html?res=9F02E1D8153EE333A25756C0A9679C94679ED7CF,0
1896-01-05T00:00:00Z,A Reminder of Christ Church.,https://query.nytimes.com/gst/abstract.html?res=9E06E0D8153EE333A25756C0A9679C94679ED7CF,0
1896-01-05T00:00:00Z,Held for Stealing from Prof. Moore.,https://query.nytimes.com/gst/abstract.html?res=9905E3D8153EE333A25756C0A9679C94679ED7CF,0
1896-01-05T00:00:00Z,Article 5 -- No Title,https://query.nytimes.com/gst/abstract.html?res=9800E3D8153EE333A25756C0A9679C94679ED7CF,0
1896-01-05T00:00:00Z,Tom Paine They Know.,https://query.nytimes.com/gst/abstract.html?res=9E04E1D8153EE333A25756C0A9679C94679ED7CF,0
1896-01-05T00:00:00Z,Front Page 2 -- No Title,https://query.nytimes.com/gst/abstract.html?res=9E02E4D8153EE333A25756C0A9679C94679ED7CF,0
1896-01-05T00:00:00Z,CHARGES OF BRIBERY FREELY MADE; A Lively Campaign for the Chicago Board of Trade Election.,https://query.nytimes.com/gst/abstract.html?res=9402E4D8153EE333A25756C0A9679C94679ED7CF,0
1896-01-05T00:00:00Z,SOCIETY DOINGS IN ALBAY.; A Very Pleasant Dinner Given in the Executive Mansion.,https://query.nytimes.com/gst/abstract.html?res=9906E2D8153EE333A25756C0A9679C94679ED7CF,0
1896-01-05T00:00:00Z,CENSORSHIP ON ALL DISPATCHES.; Private Information that Kruger Is Willing to Make Concessions.,https://query.nytimes.com/gst/abstract.html?res=9401E3D8153EE333A25756C0A9679C94679ED7CF,0
1896-01-05T00:00:00Z,Dance for the Knights of Pythins.,https://query.nytimes.com/gst/abstract.html?res=9407E3D8153EE333A25756C0A9679C94679ED7CF,0
1896-01-05T00:00:00Z,COMMANDER KINGSLEY DEAD; The Chief Officer of the United States Training Ship Expires While on His Vessel.,https://query.nytimes.com/gst/abstract.html?res=9B02E4D8153EE333A25756C0A9679C94679ED7CF,0
1896-01-05T00:00:00Z,"SHAW'S OPINION OF HARE; The Eccentric English Critic on John Hare's Acting, with an Incidental Tribute to Constant Coquelin.",https://query.nytimes.com/gst/abstract.html?res=9E01E2D8153EE333A25756C0A9679C94679ED7CF,0
1896-01-05T00:00:00Z,SOCIETY IN THE ORANGES.; Pleasures of the Holidays -- Some Weddings to Take Place.,https://query.nytimes.com/gst/abstract.html?res=9507E2D8153EE333A25756C0A9679C94679ED7CF,0
1896-01-05T00:00:00Z,HOLIDAY PARTIES AT LENNOX.; Mrs. Stokes and Mrs. John Sloane Entertain Their Friends.,https://query.nytimes.com/gst/abstract.html?res=9907E2D8153EE333A25756C0A9679C94679ED7CF,0
1896-01-05T00:00:00Z,TIME NOW FOR ULSTERS; The Cold Wave Comes to Town Ready for Business. MERCURY GOES DOWN NEAR ZERO And Still Colder Weather is Promised -- Making Its Way Slowly -- Not Expected to Leave Before Tuesday.,https://query.nytimes.com/gst/abstract.html?res=9F05E3D8153EE333A25756C0A9679C94679ED7CF,0
1896-01-05T00:00:00Z,EFFECT OF HELLENISM ON JUDAISM; A Lecture by Claude Montefiore on the Alexandrine Jaws and the Changes in National Ideals Produced by Enviornment.,https://query.nytimes.com/gst/abstract.html?res=9A02E2D8153EE333A25756C0A9679C94679ED7CF,0
1896-01-05T00:00:00Z,IN THE WORLD OF ART; The Exhibitions of the Week and General Art Gossip. WILLIAM M. CHASE'S STUDIO SALE Architectural League Dinner -- Japanese Pictures -- Lectures by Prof. E. F. Fenollosa -- Andrew Carnegie's Gift to Pittsburg.,https://query.nytimes.com/gst/abstract.html?res=9C06E1D8153EE333A25756C0A9679C94679ED7CF,0
1896-01-05T00:00:00Z,"M'CARTHY'S NARROW ESCAPE; Found Floating Unconscious in Flushing Bay, His Coat Frozen to a Log.",https://query.nytimes.com/gst/abstract.html?res=9F05E2D8153EE333A25756C0A9679C94679ED7CF,0
1896-01-05T00:00:00Z,"THE GROWTH OF CYCLING; Riders Not Long Ago Were Ridiculed and Harassed by Absurd Laws. NOW MILLIONS ENJOY THE SPORT Its Fascination and Healthfulness and the Participation of Women, Among the Causes of Success.",https://query.nytimes.com/gst/abstract.html?res=9803E1D8153EE333A25756C0A9679C94679ED7CF,0
1896-01-05T00:00:00Z,BROOKLYN REALTY MATTERS.,https://query.nytimes.com/gst/abstract.html?res=9B02E2D8153EE333A25756C0A9679C94679ED7CF,0
1896-01-05T00:00:00Z,Strenli -- Barker.,https://query.nytimes.com/gst/abstract.html?res=9902E3D8153EE333A25756C0A9679C94679ED7CF,0
1896-01-05T00:00:00Z,Certain Immense Fiddles.,https://query.nytimes.com/gst/abstract.html?res=9B07E0D8153EE333A25756C0A9679C94679ED7CF,0
1896-01-05T00:00:00Z,A Populist Legislator in Kentucky.,https://query.nytimes.com/gst/abstract.html?res=9F06E1D8153EE333A25756C0A9679C94679ED7CF,0
1896-01-05T00:00:00Z,LONDON BECAME ANXIOUS; How an American Was Treated When War Talk Began. NO SIGNS OF HOSTILITY SHOWN The English Novelists Were Especially Disturbed -- Stepniak's Death and the Hints of Suicide.,https://query.nytimes.com/gst/abstract.html?res=9A07E1D8153EE333A25756C0A9679C94679ED7CF,0
1896-01-05T00:00:00Z,Transportation of Wheels in Canada.,https://query.nytimes.com/gst/abstract.html?res=980CE1D8153EE333A25756C0A9679C94679ED7CF,0
1896-01-05T00:00:00Z,"NEW PARK ON ORANGE MOUNTAIN; Plans for the Pretty Pleasure Ground Which the Essex County, (N.J.) Commissioners Have Designed.",https://query.nytimes.com/gst/abstract.html?res=990DE2D8153EE333A25756C0A9679C94679ED7CF,0
1896-01-05T00:00:00Z,"CRIMES NOT ""UNSOLVED""; Errors in the List Given Out at Police Headquarters. PROPERTY RECOVERED IN MANY CASES Commissioner Parker Says There Was No Intention of Reflecting on Ex-Chief Byrnes -- Facts from the Records.",https://query.nytimes.com/gst/abstract.html?res=9804E3D8153EE333A25756C0A9679C94679ED7CF,0
1896-01-05T00:00:00Z,"ATTRACTIVE NEW ENTRANCE WAY; For the Galleries of the American Art Association -- Designed by McKim, Mead & White.",https://query.nytimes.com/gst/abstract.html?res=9F0CE2D8153EE333A25756C0A9679C94679ED7CF,0
1896-01-05T00:00:00Z,ST. ANDREW CLUBHOUSE; It Welcomes the Young Men of Port Chester. AN INNOVATION IN THIS ORDER The Plan of the Rev. Mr. Brugler -- features and Attractions of the House -- Counteracting Saloon Influence.,https://query.nytimes.com/gst/abstract.html?res=9F01E0D8153EE333A25756C0A9679C94679ED7CF,0
1896-01-05T00:00:00Z,"CYCLING TRADE HISTORY; From Velocipedes in the Sixties to the Safeties of To-day. TRIALS OF THE PIONEER MAKERS emarkable Evolution in Designs Weights, Process of Construction and Fittings -- Prices Have Fluctuated.",https://query.nytimes.com/gst/abstract.html?res=9D0DE1D8153EE333A25756C0A9679C94679ED7CF,0
1896-01-05T00:00:00Z,Editorial Article 1 -- No Title,https://query.nytimes.com/gst/abstract.html?res=9D06E3D8153EE333A25756C0A9679C94679ED7CF,0
1896-01-05T00:00:00Z,GOSSIP OF THE CYCLISTS; Willison and Elliott Alone in the Race for the League Presidency. RECORDS FOR WHEELMEN BOWLERS How the Management of the Famous Irvington-Millburn Road Race May Change-Louisville's Attractions.,https://query.nytimes.com/gst/abstract.html?res=9903E1D8153EE333A25756C0A9679C94679ED7CF,0
1896-01-05T00:00:00Z,Acts of the State Board.,https://query.nytimes.com/gst/abstract.html?res=990CE3D8153EE333A25756C0A9679C94679ED7CF,0
1896-01-05T00:00:00Z,RACING AND PROFESSIONALISM; Efforts That Have Been Made to Maintain Purely Amateur Sport -- The Class B Controversy.,https://query.nytimes.com/gst/abstract.html?res=9E02E1D8153EE333A25756C0A9679C94679ED7CF,0
1896-01-05T00:00:00Z,ANOTHER CHURCH FOR NEWPORT.; Summer Residents to Build a New Structure -- Society News.,https://query.nytimes.com/gst/abstract.html?res=9F06E2D8153EE333A25756C0A9679C94679ED7CF,0
1896-01-05T00:00:00Z,IN AND ABOUT MONTCLAIR.; Very Many New Year's Day Entertainments -- Guests of City Hosts.,https://query.nytimes.com/gst/abstract.html?res=9C06E2D8153EE333A25756C0A9679C94679ED7CF,0
1896-01-05T00:00:00Z,"TO ROW ON THE HUDSON.; Harvard Will Enter the Regatta -- Poughkeepsie Wants Amateurs, Too.",https://query.nytimes.com/gst/abstract.html?res=9C0CE3D8153EE333A25756C0A9679C94679ED7CF,0
1896-01-05T00:00:00Z,The Balloon Rising Falling.,https://query.nytimes.com/gst/abstract.html?res=9C07E0D8153EE333A25756C0A9679C94679ED7CF,0
1896-01-05T00:00:00Z,"MISS KINGSLEY TO LECTURE ON ART; Daughter of the Famous English Author of ""Westward, Ho.""",https://query.nytimes.com/gst/abstract.html?res=9B00E1D8153EE333A25756C0A9679C94679ED7CF,0
1896-01-05T00:00:00Z,PHILADELPHIA PRICES.,https://query.nytimes.com/gst/abstract.html?res=9E05E1D8153EE333A25756C0A9679C94679ED7CF,0
1896-01-05T00:00:00Z,"ANOTHER ARMENIAN HECATOMB; Nine Hundred Persons Killed at Biridjik, Near Aintab -- Massacre at Orfah -- Turkish Forces Increased.",https://query.nytimes.com/gst/abstract.html?res=9802E4D8153EE333A25756C0A9679C94679ED7CF,0
1896-01-05T00:00:00Z,"THE MEXICAN BOUNDARY; Work of the International Commission Nearly Finished. RESURVEYING BEGUN IN JULY, 1892 Many Changes Made in the Lines, but few of Importance -- More than 300 Monuments Placed.",https://query.nytimes.com/gst/abstract.html?res=9506E0D8153EE333A25756C0A9679C94679ED7CF,0
1896-01-05T00:00:00Z,Modem Dancing.,https://query.nytimes.com/gst/abstract.html?res=9504E0D8153EE333A25756C0A9679C94679ED7CF,0
1896-01-05T00:00:00Z,NATIONAL GUARD NOTES,https://query.nytimes.com/gst/abstract.html?res=9501E1D8153EE333A25756C0A9679C94679ED7CF,0
1896-01-05T00:00:00Z,HARD AT WORK ON HIS MESSAGE; Mayor Strong Shuts Himself up with His Private Secretary and Receives No Callers.,https://query.nytimes.com/gst/abstract.html?res=9400E2D8153EE333A25756C0A9679C94679ED7CF,0
1896-01-05T00:00:00Z,DEFIANCE FOR MAYOR GLEASON; Capt. Woods Declines to Take Orders from Him -- Gleason Police Commission Named.,https://query.nytimes.com/gst/abstract.html?res=9805E2D8153EE333A25756C0A9679C94679ED7CF,0
1896-01-05T00:00:00Z,"TRUSTEES ARE ACCUSED; Suit is New-Rochelle over the Awarding of a Trolley Contract. OBJECTION TO A ""HUCKLEBERRY"" ROAD The Allegation Made that Vetes Were Secured by ""the Payment of Money for a Consideration."" Summonses Serued.",https://query.nytimes.com/gst/abstract.html?res=9E07E3D8153EE333A25756C0A9679C94679ED7CF,0
1896-01-05T00:00:00Z,NO LUCK IN ODD NUMBERS; Sulky Records for 1894 Were Not Lowered Last Year. YOUNG FLYER FURNISHED SENSATIONS Trotters and Pacers Make an Equa Adrance with the Safety Wheel -- Azote and Benzetta the Prospective Champions.,https://query.nytimes.com/gst/abstract.html?res=9802E2D8153EE333A25756C0A9679C94679ED7CF,0
1896-01-05T00:00:00Z,FATIGUING WEEK IN WASHINGTON.; A Long and Exhausting Round of Social Entertainments.,https://query.nytimes.com/gst/abstract.html?res=9806E2D8153EE333A25756C0A9679C94679ED7CF,0
1896-01-05T00:00:00Z,Hamlet and Hysteria.,https://query.nytimes.com/gst/abstract.html?res=9404E0D8153EE333A25756C0A9679C94679ED7CF,0
1896-01-05T00:00:00Z,Down on Her.,https://query.nytimes.com/gst/abstract.html?res=9904E0D8153EE333A25756C0A9679C94679ED7CF,0
1896-01-05T00:00:00Z,Guests of the Brazilian Minister.,https://query.nytimes.com/gst/abstract.html?res=9E07E2D8153EE333A25756C0A9679C94679ED7CF,0
1896-01-05T00:00:00Z,Front Page 1 -- No Title,https://query.nytimes.com/gst/abstract.html?res=9503E4D8153EE333A25756C0A9679C94679ED7CF,0
1896-01-05T00:00:00Z,GAY DAYS AT LAKEWOOD; The Holiday Season Never So Brilliant As This Year. HOTELS CROWDED WITH GUESTS Some of the More Important Festivities -- Dinner-Giving Popular -- Golf and Hunting as Attractive as Ever.,https://query.nytimes.com/gst/abstract.html?res=9B07E2D8153EE333A25756C0A9679C94679ED7CF,0
1896-01-05T00:00:00Z,IRRIGATION NEEDED IN NEW-ENGLAND; Its Profits Set Before the Connecticut Board of Agriculture.,https://query.nytimes.com/gst/abstract.html?res=9501E2D8153EE333A25756C0A9679C94679ED7CF,0
1896-01-05T00:00:00Z,"LOVELY QUEEN STELLA; The New Royal Personage to Whom Society Will Bow. NOT UNCONNECTED WITH A NEW FAD The Chief of the Gonzales Tribe of Gypsies, Who Will Be Mrs. Guernsey's Guest of Honor at a Coining Reception.",https://query.nytimes.com/gst/abstract.html?res=9506E2D8153EE333A25756C0A9679C94679ED7CF,0
1896-01-05T00:00:00Z,CONSERVATOR OF CYCLING; What The New-York Times Has Done to Promote Pure Sport. FINE MEDALS OFFERED TO AMATEURS Races for Times Trophies Have Been Among the Most Exciting of the Year -- Some of the Notable Contests.,https://query.nytimes.com/gst/abstract.html?res=9A02E1D8153EE333A25756C0A9679C94679ED7CF,0
1896-01-05T00:00:00Z,LIVES LOST IN PHILADELPHIA; Two Persons Burned to Death and Four Seriously Injured -- Heroic Action of a Young Girl.,https://query.nytimes.com/gst/abstract.html?res=9B0CE3D8153EE333A25756C0A9679C94679ED7CF,0
1896-01-05T00:00:00Z,BICYCLE TAX FOR BICYCLE PATHS; An Interesting Plan That May Be Adopted in Oneida County.,https://query.nytimes.com/gst/abstract.html?res=9E03E1D8153EE333A25756C0A9679C94679ED7CF,0
1896-01-05T00:00:00Z,Front Page 3 -- No Title,https://query.nytimes.com/gst/abstract.html?res=9C0DE4D8153EE333A25756C0A9679C94679ED7CF,0
1896-01-05T00:00:00Z,A New Schoolhouse Dedicated.,https://query.nytimes.com/gst/abstract.html?res=9F07E2D8153EE333A25756C0A9679C94679ED7CF,0
1896-01-05T00:00:00Z,"TRADE'S BRIGHT OUTLOOK; Nearly 1,000,000 Bicycles Will Be Made and Sold This Season. MORE THAN $60,000,000 INVESTED Points Wherein the Wheels of 1896 Differ from Last Year's Models -- The Question of Retail Prices.",https://query.nytimes.com/gst/abstract.html?res=9C0DE1D8153EE333A25756C0A9679C94679ED7CF,0
1896-01-05T00:00:00Z,Chartered South African Shares Rise.,https://query.nytimes.com/gst/abstract.html?res=9501E3D8153EE333A25756C0A9679C94679ED7CF,0
1896-01-05T00:00:00Z,THE HANDBOOK OF PERU; An Important Volume Issued by the Government Printing Office.,https://query.nytimes.com/gst/abstract.html?res=9C03E2D8153EE333A25756C0A9679C94679ED7CF,0
1896-01-05T00:00:00Z,Real Rapid Transit.,https://query.nytimes.com/gst/abstract.html?res=9907E3D8153EE333A25756C0A9679C94679ED7CF,0
1896-01-05T00:00:00Z,A Millionaire's Hard Fate.,https://query.nytimes.com/gst/abstract.html?res=9806E1D8153EE333A25756C0A9679C94679ED7CF,0
1896-01-05T00:00:00Z,"RECOMMENDED BY DR. HAMMOND; Bicycling, He Says, When Not Practiced to Excess, Is a Most Beneficial Form of Exercise.",https://query.nytimes.com/gst/abstract.html?res=9F0CE1D8153EE333A25756C0A9679C94679ED7CF,0
1896-01-05T00:00:00Z,STILL ONLY ONE LALOR SUSPECT; Wife of the Murdered Man Has Not Had a Hearing -- Mother Freed and Rearrested.,https://query.nytimes.com/gst/abstract.html?res=9D07E2D8153EE333A25756C0A9679C94679ED7CF,0
