pub_date,main_headline,article_url,classification
1897-01-06T00:00:00Z,A Theatrical Hostess Dead.,https://query.nytimes.com/gst/abstract.html?res=9801E0DF1230E333A25755C0A9679C94669ED7CF,0
1897-01-06T00:00:00Z,THE TARIFF ON SUGAR.,https://query.nytimes.com/gst/abstract.html?res=9F0DE0DF1230E333A25755C0A9679C94669ED7CF,0
1897-01-06T00:00:00Z,Police Frightened by the Plague.,https://query.nytimes.com/gst/abstract.html?res=9E06EFDF1230E333A25755C0A9679C94669ED7CF,0
1897-01-06T00:00:00Z,A New Secretary of Legation.,https://query.nytimes.com/gst/abstract.html?res=9D07EEDF1230E333A25755C0A9679C94669ED7CF,0
1897-01-06T00:00:00Z,Article 21 -- No Title,https://query.nytimes.com/gst/abstract.html?res=9A02EFDF1230E333A25755C0A9679C94669ED7CF,0
1897-01-06T00:00:00Z,COST OF ARMOR PLATE.; Secretary Herbert Thinks the Government Should Pay $400 Per Ton.,https://query.nytimes.com/gst/abstract.html?res=9506E0DF1230E333A25755C0A9679C94669ED7CF,0
1897-01-06T00:00:00Z,Minnesota Farmers Indignant.,https://query.nytimes.com/gst/abstract.html?res=9F04E0DF1230E333A25755C0A9679C94669ED7CF,0
1897-01-06T00:00:00Z,Article 9 -- No Title,https://query.nytimes.com/gst/abstract.html?res=9506EFDF1230E333A25755C0A9679C94669ED7CF,0
1897-01-06T00:00:00Z,The Teutonic Could Not Land.,https://query.nytimes.com/gst/abstract.html?res=9906EFDF1230E333A25755C0A9679C94669ED7CF,0
1897-01-06T00:00:00Z,Shooting Match at Monte Carlo.,https://query.nytimes.com/gst/abstract.html?res=9F07EFDF1230E333A25755C0A9679C94669ED7CF,0
1897-01-06T00:00:00Z,NEW JERSEY BALLOT LAW.; A Decision as to Constitutionality Which May Admit Fraud.,https://query.nytimes.com/gst/abstract.html?res=9D06EEDF1230E333A25755C0A9679C94669ED7CF,0
1897-01-06T00:00:00Z,DR. POTTER IS BESIEGED; A SELF-MADE CAPTIVE IN HIS CHURCH RESIDENCE. The New Owners of the Tabernacle Baptist Church Have Watchmen to Try to Get Him Out and Keep Him Out.,https://query.nytimes.com/gst/abstract.html?res=9D0CEFDF1230E333A25755C0A9679C94669ED7CF,0
1897-01-06T00:00:00Z,SUPT. PIERCE IS SATISFIED.; He Believes in the Report Made by His Examiners Last Month.,https://query.nytimes.com/gst/abstract.html?res=9D01EEDF1230E333A25755C0A9679C94669ED7CF,0
1897-01-06T00:00:00Z,FRIGHTENED OUT OF SUICIDE.; A Policeman's Revolver Took the Nerve Out of a Chicago Man.,https://query.nytimes.com/gst/abstract.html?res=9807EEDF1230E333A25755C0A9679C94669ED7CF,0
1897-01-06T00:00:00Z,TRIAL OF SANTA FE MEN.; Charges of Rate-Cutting Made Against Hanley and Rinehart.,https://query.nytimes.com/gst/abstract.html?res=9904EFDF1230E333A25755C0A9679C94669ED7CF,0
1897-01-06T00:00:00Z,NEW YORK GRAIN CHARGES; A Rumor Which Raised Hopes but Proved Incorrect.,https://query.nytimes.com/gst/abstract.html?res=9903EFDF1230E333A25755C0A9679C94669ED7CF,0
1897-01-06T00:00:00Z,TEACHERS WERE PROMOTED; SUPERINTENDENT JASPER TELLS OF THE TRANSFERS. Out of 800 Changes Only Three Were to a Less Salary -- All Had Been Invited to be Examined -- Working of the New Plan.,https://query.nytimes.com/gst/abstract.html?res=9D0DEFDF1230E333A25755C0A9679C94669ED7CF,0
1897-01-06T00:00:00Z,THE TORREY BANKRUPTCY BILL.,https://query.nytimes.com/gst/abstract.html?res=990DE0DF1230E333A25755C0A9679C94669ED7CF,0
1897-01-06T00:00:00Z,Editorial Article 6 -- No Title,https://query.nytimes.com/gst/abstract.html?res=9F0CE0DF1230E333A25755C0A9679C94669ED7CF,0
1897-01-06T00:00:00Z,"REVIVAL WORK IN BOSTON.; Moody, Murphy, and Jones Speak from the Same Platform.",https://query.nytimes.com/gst/abstract.html?res=9E06EEDF1230E333A25755C0A9679C94669ED7CF,0
1897-01-06T00:00:00Z,MR. EDMUNDS'S ILLNESS.; He Is Too Weak to be Heard Beyond a Few Feet.,https://query.nytimes.com/gst/abstract.html?res=9906EEDF1230E333A25755C0A9679C94669ED7CF,0
1897-01-06T00:00:00Z,ALLISON IN THE CABINET; HE IS SAID TO BE SLATED FOR THE TREASURY. President-elect McKinley Will Meet the Iowa Senator by Appointment in Canton To-day -- Hanna Objects to Dingley.,https://query.nytimes.com/gst/abstract.html?res=9C01E0DF1230E333A25755C0A9679C94669ED7CF,0
1897-01-06T00:00:00Z,THE EDUCATIONAL CHAPTER; SCHOOL BOARDS ARE GETTING THEIR SUGGESTIONS READY. Meeting of the Board of Education Today and of the Board of Superintendents To-morrow -- The Port Chapter.,https://query.nytimes.com/gst/abstract.html?res=950DEFDF1230E333A25755C0A9679C94669ED7CF,0
1897-01-06T00:00:00Z,A PRINCESS ON THE STAGE.; Rigo and the Woman Who Eloped with Him Engaged by a Music Hall.,https://query.nytimes.com/gst/abstract.html?res=9F05EFDF1230E333A25755C0A9679C94669ED7CF,0
1897-01-06T00:00:00Z,SEVENTY DOLLARS WELL SPENT; A Portland Man Buys a Schooner Which Comes to Port.,https://query.nytimes.com/gst/abstract.html?res=9E04E0DF1230E333A25755C0A9679C94669ED7CF,0
1897-01-06T00:00:00Z,"""RUMP"" HOUSE IN DELAWARE.; Addicks Men Set Up for Themselves -- Democrats in Control.",https://query.nytimes.com/gst/abstract.html?res=9A04EFDF1230E333A25755C0A9679C94669ED7CF,0
1897-01-06T00:00:00Z,ONE ELECTOR IN DOUBT.; Kentucky Presidential Electors Must Decide Between Two Republicans.,https://query.nytimes.com/gst/abstract.html?res=9C03E0DF1230E333A25755C0A9679C94669ED7CF,0
1897-01-06T00:00:00Z,Article 18 -- No Title,https://query.nytimes.com/gst/abstract.html?res=9F02EFDF1230E333A25755C0A9679C94669ED7CF,0
1897-01-06T00:00:00Z,Sued by a Deserted Husband.,https://query.nytimes.com/gst/abstract.html?res=9904E0DF1230E333A25755C0A9679C94669ED7CF,0
1897-01-06T00:00:00Z,LOTTERY TRAFFIC SECURE.; It Cannot Be Stopped Under the Inter-State Commerce Act.,https://query.nytimes.com/gst/abstract.html?res=9A05EEDF1230E333A25755C0A9679C94669ED7CF,0
1897-01-06T00:00:00Z,"""HIGH KEYS"" IN KANSAS.",https://query.nytimes.com/gst/abstract.html?res=9A0DE0DF1230E333A25755C0A9679C94669ED7CF,0
1897-01-06T00:00:00Z,Hopkins -- Guy.,https://query.nytimes.com/gst/abstract.html?res=9B01EFDF1230E333A25755C0A9679C94669ED7CF,0
1897-01-06T00:00:00Z,Cornell Preachers This Winter.,https://query.nytimes.com/gst/abstract.html?res=9806EEDF1230E333A25755C0A9679C94669ED7CF,0
1897-01-06T00:00:00Z,THE DEATH OF CHARLES GOVIN.; Spanish Officials Say He Died from Wounds Received in Battle.,https://query.nytimes.com/gst/abstract.html?res=9B03E0DF1230E333A25755C0A9679C94669ED7CF,0
1897-01-06T00:00:00Z,ST. JOHN'S GUILD MEETING.; Trustees Elected and Reports Made -- Slum Life Illustrated.,https://query.nytimes.com/gst/abstract.html?res=9800EFDF1230E333A25755C0A9679C94669ED7CF,0
1897-01-06T00:00:00Z,SECURITIES AT AUCTION.,https://query.nytimes.com/gst/abstract.html?res=980CEFDF1230E333A25755C0A9679C94669ED7CF,0
1897-01-06T00:00:00Z,WHAT THE PAPERS SAY.; No Comparison.,https://query.nytimes.com/gst/abstract.html?res=980CE0DF1230E333A25755C0A9679C94669ED7CF,0
1897-01-06T00:00:00Z,A Sky-Scraper Out of Plumb.,https://query.nytimes.com/gst/abstract.html?res=9804E0DF1230E333A25755C0A9679C94669ED7CF,0
1897-01-06T00:00:00Z,COACHING CLUB RUFFLED; AN INVASION FEARED OF A SOCIETY WARFARE. Comment Caused by Recent Changes and the Blackballing of T. Suffern Tailer -- Some Talk of Another Club.,https://query.nytimes.com/gst/abstract.html?res=9E07EFDF1230E333A25755C0A9679C94669ED7CF,0
1897-01-06T00:00:00Z,Article 20 -- No Title,https://query.nytimes.com/gst/abstract.html?res=9902EFDF1230E333A25755C0A9679C94669ED7CF,0
1897-01-06T00:00:00Z,Marriage Announcement 1 -- No Title,https://query.nytimes.com/gst/abstract.html?res=9404EFDF1230E333A25755C0A9679C94669ED7CF,0
1897-01-06T00:00:00Z,THE ST. PAUL PANIC OVER.; No Further Trouble Expected Among the Financial Institutions.,https://query.nytimes.com/gst/abstract.html?res=9C04EFDF1230E333A25755C0A9679C94669ED7CF,0
1897-01-06T00:00:00Z,Phillipine Insurgents Beaten.,https://query.nytimes.com/gst/abstract.html?res=9A06EFDF1230E333A25755C0A9679C94669ED7CF,0
1897-01-06T00:00:00Z,FISH COMMISSION WORK; REPORT OF COMMISSIONER BRICE TO THE PRESIDENT. A Great Collection of Eggs Made During the Past Year -- How They Have Been Disposed of by the Government.,https://query.nytimes.com/gst/abstract.html?res=9A06EEDF1230E333A25755C0A9679C94669ED7CF,0
1897-01-06T00:00:00Z,FINANCIAL ANNOUNCEMENTS.,https://query.nytimes.com/gst/abstract.html?res=940CEFDF1230E333A25755C0A9679C94669ED7CF,0
1897-01-06T00:00:00Z,WAS A QUIET DIPSOMANIAC.; A Lawyer Who Misappropriated Funds Belonging to His Clients.,https://query.nytimes.com/gst/abstract.html?res=9B06EEDF1230E333A25755C0A9679C94669ED7CF,0
1897-01-06T00:00:00Z,AFTER FEDERAL OFFICES.; Einstein Wants to be Minister to Italy -- Davidson's Ambition.,https://query.nytimes.com/gst/abstract.html?res=9B07E0DF1230E333A25755C0A9679C94669ED7CF,0
1897-01-06T00:00:00Z,AFFAIRS OF CHICAGO BANKS.; A Dividend to the Creditors of the National Bank of Illinois.,https://query.nytimes.com/gst/abstract.html?res=9E04EFDF1230E333A25755C0A9679C94669ED7CF,0
1897-01-06T00:00:00Z,BEYROOT CITIZENS AROUSED.; Arrest of a Young Man May Cause the Sultan More Trouble.,https://query.nytimes.com/gst/abstract.html?res=9C01EEDF1230E333A25755C0A9679C94669ED7CF,0
1897-01-06T00:00:00Z,"CABLE CARS IN A CRASH; SIX PERSONS INJURED IN A LEXINGTON AVENUE ACCIDENT. Grip of Car 291 Was Caught in a Broken Strand and the Car Ran Wild from Eighty-first to Ninety-sixth Street, Crashing into Two Other Cars Loaded with Passengers.",https://query.nytimes.com/gst/abstract.html?res=9F05E0DF1230E333A25755C0A9679C94669ED7CF,0
1897-01-06T00:00:00Z,MAY EXEMPT CANAL BONDS.; The Governor Will Urge the Legislature to Act at Once.,https://query.nytimes.com/gst/abstract.html?res=9407E0DF1230E333A25755C0A9679C94669ED7CF,0
1897-01-06T00:00:00Z,VICTORY FOR GEORGE WORK.; He Beat Julian Davies by a Score of 82 to 78 in a Bird Match.,https://query.nytimes.com/gst/abstract.html?res=9D06EFDF1230E333A25755C0A9679C94669ED7CF,0
1897-01-06T00:00:00Z,Military and Bicycle Show.,https://query.nytimes.com/gst/abstract.html?res=9B02E0DF1230E333A25755C0A9679C94669ED7CF,0
1897-01-06T00:00:00Z,FORAKER MAKES A DENIAL.; Says There Was No Conference in the Interest of Kurtz for Senator.,https://query.nytimes.com/gst/abstract.html?res=9F06EEDF1230E333A25755C0A9679C94669ED7CF,0
1897-01-06T00:00:00Z,Church Evangelical Workers Meet.,https://query.nytimes.com/gst/abstract.html?res=9902E0DF1230E333A25755C0A9679C94669ED7CF,0
1897-01-06T00:00:00Z,A VICTORY FOR PENROSE; WANAMAKER BEATEN BY PENNSYLVANIA REPUBLICANS. Quay's Man Gets 133 Votes to 75 for the Former Postmaster General -- Contests for Senator in Other States.,https://query.nytimes.com/gst/abstract.html?res=9A04E0DF1230E333A25755C0A9679C94669ED7CF,0
1897-01-06T00:00:00Z,TARIFF AND THE FARMERS; HEARINGS ON THE AGRICULTURAL SCHEDULE. The Ways and Means Committee Listens to Arguments For and Against a Duty on Cattle -- Demands of Salt and Seed Producers.,https://query.nytimes.com/gst/abstract.html?res=9B07EEDF1230E333A25755C0A9679C94669ED7CF,0
1897-01-06T00:00:00Z,A Bit of the Frozen Truth.,https://query.nytimes.com/gst/abstract.html?res=990CE0DF1230E333A25755C0A9679C94669ED7CF,0
1897-01-06T00:00:00Z,TELEGRAPHIC BREVITIES.,https://query.nytimes.com/gst/abstract.html?res=9A03EFDF1230E333A25755C0A9679C94669ED7CF,0
1897-01-06T00:00:00Z,SCHOOLBOYS ARRESTED.; Fourteen Truant Pupils in Brooklyn Caught Near Theatres.,https://query.nytimes.com/gst/abstract.html?res=940DEFDF1230E333A25755C0A9679C94669ED7CF,0
1897-01-06T00:00:00Z,TAX TITLES MUST STAND.; An Important Decision by the Michigan Supreme Court.,https://query.nytimes.com/gst/abstract.html?res=9907E0DF1230E333A25755C0A9679C94669ED7CF,0
1897-01-06T00:00:00Z,Foreign Notes of Interest.,https://query.nytimes.com/gst/abstract.html?res=9B06EFDF1230E333A25755C0A9679C94669ED7CF,0
1897-01-06T00:00:00Z,RAIDERS TO BE ARRESTED.; Gov. Bradley Sends Troops to Stop Tollgate Wrecking in Kentucky.,https://query.nytimes.com/gst/abstract.html?res=9C04E0DF1230E333A25755C0A9679C94669ED7CF,0
1897-01-06T00:00:00Z,MADDEN IN THE LEAD.; The Election of the Chicago Alderman as Senator Foreshadowed.,https://query.nytimes.com/gst/abstract.html?res=9404E0DF1230E333A25755C0A9679C94669ED7CF,0
1897-01-06T00:00:00Z,BANQUET TO MR. BLISS.; Republican Club Upheld His Claims to a Cabinet Office.,https://query.nytimes.com/gst/abstract.html?res=9D00E0DF1230E333A25755C0A9679C94669ED7CF,0
1897-01-06T00:00:00Z,"JAMESON SAYS ITS FALSE; CONTRADICTS THE REPORT ON THE GLOBE FIRE FINANCES. Regards the Action of Superintendent Matthews as an Imposition and Refuses to Pay a Bill of $781, Which the Report Cost.",https://query.nytimes.com/gst/abstract.html?res=9506EEDF1230E333A25755C0A9679C94669ED7CF,0
1897-01-06T00:00:00Z,DICKERING IN NORTH DAKOTA.; An Attempt to Form a Combination Against Hansbrough.,https://query.nytimes.com/gst/abstract.html?res=9B04E0DF1230E333A25755C0A9679C94669ED7CF,0
1897-01-06T00:00:00Z,New Jersey Forestry Association.,https://query.nytimes.com/gst/abstract.html?res=9401EFDF1230E333A25755C0A9679C94669ED7CF,0
1897-01-06T00:00:00Z,A DAY'S WEDDINGS.; Watson--Watson.,https://query.nytimes.com/gst/abstract.html?res=9901EFDF1230E333A25755C0A9679C94669ED7CF,0
1897-01-06T00:00:00Z,DEATH LIST OF A DAY.,https://query.nytimes.com/gst/abstract.html?res=9504EFDF1230E333A25755C0A9679C94669ED7CF,0
1897-01-06T00:00:00Z,SULZER WOULD WARN SPAIN.; Introduces a Resolution Demanding a Change in Methods of Warfare.,https://query.nytimes.com/gst/abstract.html?res=9E02E0DF1230E333A25755C0A9679C94669ED7CF,0
1897-01-06T00:00:00Z,"""SHAMUS O'BRIEN"" GOOD.; Production of a Charming Opera Comique at the Broadway Theatre.",https://query.nytimes.com/gst/abstract.html?res=9905EFDF1230E333A25755C0A9679C94669ED7CF,0
1897-01-06T00:00:00Z,Shot His Playmate in the Eye.,https://query.nytimes.com/gst/abstract.html?res=9900EFDF1230E333A25755C0A9679C94669ED7CF,0
1897-01-06T00:00:00Z,Ivory Advised to Plead Guilty.,https://query.nytimes.com/gst/abstract.html?res=9806EFDF1230E333A25755C0A9679C94669ED7CF,0
1897-01-06T00:00:00Z,THE COMTE DE MAS-LATRIE.; The French Paleographist Died in Paris Yesterday.,https://query.nytimes.com/gst/abstract.html?res=9E00EFDF1230E333A25755C0A9679C94669ED7CF,0
1897-01-06T00:00:00Z,GEN. FRANCIS WALKER DEAD; STRICKEN BY APOPLEXY AND DIED BEFORE HELP ARRIVED. He Had Enjoyed Good Health Prior to the Fatal Attack -- His Funeral Will Be Held on Friday.,https://query.nytimes.com/gst/abstract.html?res=980DEFDF1230E333A25755C0A9679C94669ED7CF,0
1897-01-06T00:00:00Z,THE MONETARY CONVENTION.; A Body of Nearly Five Hundred Delegates Expected to Organize.,https://query.nytimes.com/gst/abstract.html?res=9B01E0DF1230E333A25755C0A9679C94669ED7CF,0
1897-01-06T00:00:00Z,Article 3 -- No Title,https://query.nytimes.com/gst/abstract.html?res=9E00E0DF1230E333A25755C0A9679C94669ED7CF,0
1897-01-06T00:00:00Z,Death of Andrew J. Odell.,https://query.nytimes.com/gst/abstract.html?res=9805EFDF1230E333A25755C0A9679C94669ED7CF,0
1897-01-06T00:00:00Z,AN ATTACK ON HILL.; Protest Against Giving to Him the Democratic Vote for Senator.,https://query.nytimes.com/gst/abstract.html?res=9906E0DF1230E333A25755C0A9679C94669ED7CF,0
1897-01-06T00:00:00Z,Lord Beresford Not Progressing.,https://query.nytimes.com/gst/abstract.html?res=9F06EFDF1230E333A25755C0A9679C94669ED7CF,0
1897-01-06T00:00:00Z,Editorial Article 1 -- No Title,https://query.nytimes.com/gst/abstract.html?res=9B0DE0DF1230E333A25755C0A9679C94669ED7CF,0
1897-01-06T00:00:00Z,X RAYS LOCATE A BULLET.; Walter Scribner Has a Photograph of One in His Skull.,https://query.nytimes.com/gst/abstract.html?res=9907EEDF1230E333A25755C0A9679C94669ED7CF,0
1897-01-06T00:00:00Z,ROBBERS FLEE FROM A TOWEL.; Driven Off by a Chicago Bartender's Novel Weapon of Defense.,https://query.nytimes.com/gst/abstract.html?res=9505E0DF1230E333A25755C0A9679C94669ED7CF,0
1897-01-06T00:00:00Z,CHURCH RIOT IN BAY CITY; ONE MAN SHOT AND THREE OTHERS SEVERELY BEATEN. Father Bogacki Besieged in the Parsonage by a Mob of Infuriated Poles -- Attempts at Incendiarism Feared.,https://query.nytimes.com/gst/abstract.html?res=9505EFDF1230E333A25755C0A9679C94669ED7CF,0
1897-01-06T00:00:00Z,New High Building Bill.,https://query.nytimes.com/gst/abstract.html?res=9C06E0DF1230E333A25755C0A9679C94669ED7CF,0
1897-01-06T00:00:00Z,The Best Party Men.,https://query.nytimes.com/gst/abstract.html?res=950CE0DF1230E333A25755C0A9679C94669ED7CF,0
1897-01-06T00:00:00Z,A WATER-SUPPLY PROBLEM.,https://query.nytimes.com/gst/abstract.html?res=950DE0DF1230E333A25755C0A9679C94669ED7CF,0
1897-01-06T00:00:00Z,NEWS OF THE RAILROADS.; Meeting to Hear an Appeal Relative to Rates to the West.,https://query.nytimes.com/gst/abstract.html?res=9501EFDF1230E333A25755C0A9679C94669ED7CF,0
1897-01-06T00:00:00Z,Pacific Railroad Papers Missing.,https://query.nytimes.com/gst/abstract.html?res=9D03E0DF1230E333A25755C0A9679C94669ED7CF,0
1897-01-06T00:00:00Z,NOT FOR THE WALDORF.; The Electric Plant Ordered by John Jacob Astor Is for His New Hotel.,https://query.nytimes.com/gst/abstract.html?res=9A0DEFDF1230E333A25755C0A9679C94669ED7CF,0
1897-01-06T00:00:00Z,TOPICS OF THE TIMES.,https://query.nytimes.com/gst/abstract.html?res=9D05EFDF1230E333A25755C0A9679C94669ED7CF,0
1897-01-06T00:00:00Z,Keefe for Railroad Commissioner.,https://query.nytimes.com/gst/abstract.html?res=9507E0DF1230E333A25755C0A9679C94669ED7CF,0
1897-01-06T00:00:00Z,Editorial Article 2 -- No Title,https://query.nytimes.com/gst/abstract.html?res=940DE0DF1230E333A25755C0A9679C94669ED7CF,0
1897-01-06T00:00:00Z,Article 2 -- No Title,https://query.nytimes.com/gst/abstract.html?res=9C00E0DF1230E333A25755C0A9679C94669ED7CF,0
1897-01-06T00:00:00Z,Civil Service Commission's Needs.,https://query.nytimes.com/gst/abstract.html?res=9D06E0DF1230E333A25755C0A9679C94669ED7CF,0
1897-01-06T00:00:00Z,LIVES LOST IN THE BLIZZARD.; The Greatest Snow and Wind Storm Ever Known in South Dakota.,https://query.nytimes.com/gst/abstract.html?res=9A06E0DF1230E333A25755C0A9679C94669ED7CF,0
1897-01-06T00:00:00Z,ARREST OF A SWINDLER.; Chicago Police Are Holding a Man Who Is Wanted in Brooklyn.,https://query.nytimes.com/gst/abstract.html?res=9F07E0DF1230E333A25755C0A9679C94669ED7CF,0
1897-01-06T00:00:00Z,McKINLEY'S RETURN HOME.; He Will Be at Canton To-day to Meet Senator Allison.,https://query.nytimes.com/gst/abstract.html?res=9F01E0DF1230E333A25755C0A9679C94669ED7CF,0
1897-01-06T00:00:00Z,NEW BRITISH CONSUL HERE.; Andrew Percy Bennett Gazetted for the Post Last Evening.,https://query.nytimes.com/gst/abstract.html?res=9507EFDF1230E333A25755C0A9679C94669ED7CF,0
1897-01-06T00:00:00Z,WAITING FOR A MURDERER.; A Man Who Has Killed Many Prospectors in New South Wales.,https://query.nytimes.com/gst/abstract.html?res=9507EEDF1230E333A25755C0A9679C94669ED7CF,0
1897-01-06T00:00:00Z,Article 7 -- No Title,https://query.nytimes.com/gst/abstract.html?res=9F04EFDF1230E333A25755C0A9679C94669ED7CF,0
1897-01-06T00:00:00Z,One Secret of Longevity.,https://query.nytimes.com/gst/abstract.html?res=9F02E0DF1230E333A25755C0A9679C94669ED7CF,0
1897-01-06T00:00:00Z,THE RICHMOND GAS QUESTION.; Propositions to Sell and Lease the Works Discussed in Council.,https://query.nytimes.com/gst/abstract.html?res=9C06EEDF1230E333A25755C0A9679C94669ED7CF,0
1897-01-06T00:00:00Z,"MINING EXCHANGE OPENED; NEW INSTITUTION STARTED WITH NINETY-SEVEN MEMBERS. Colorado Springs List of Stocks Called Yesterday -- Chairman John Gray, ""Deacon"" White, and Others Speak -- Stock Exchange Mentioned.",https://query.nytimes.com/gst/abstract.html?res=9B0DEFDF1230E333A25755C0A9679C94669ED7CF,0
1897-01-06T00:00:00Z,SENATOR HALE ON CUBA.,https://query.nytimes.com/gst/abstract.html?res=9C0DE0DF1230E333A25755C0A9679C94669ED7CF,0
1897-01-06T00:00:00Z,STABBED BY A YOUNG BOY.; Accidentally Killed by the Lover of His Sister.,https://query.nytimes.com/gst/abstract.html?res=9E07E0DF1230E333A25755C0A9679C94669ED7CF,0
1897-01-06T00:00:00Z,Mrs. Pfister's Will.,https://query.nytimes.com/gst/abstract.html?res=9807E0DF1230E333A25755C0A9679C94669ED7CF,0
1897-01-06T00:00:00Z,SIX HURT IN AN IOWA WRECK.; A Passenger Coach Rolls Down an Embankment.,https://query.nytimes.com/gst/abstract.html?res=9B06E0DF1230E333A25755C0A9679C94669ED7CF,0
1897-01-06T00:00:00Z,CIVIL SERVICE RETIREMENTS.; Mr. Brosius Has a Bill Providing for a Pension Fund.,https://query.nytimes.com/gst/abstract.html?res=9500E0DF1230E333A25755C0A9679C94669ED7CF,0
1897-01-06T00:00:00Z,Richard Croker Returns to Town.,https://query.nytimes.com/gst/abstract.html?res=9B02EFDF1230E333A25755C0A9679C94669ED7CF,0
1897-01-06T00:00:00Z,Article 12 -- No Title,https://query.nytimes.com/gst/abstract.html?res=9E01EFDF1230E333A25755C0A9679C94669ED7CF,0
1897-01-06T00:00:00Z,THE COMMODORE'S LOST MEN.; Fruitless Search by the Three Friends and the Newark.,https://query.nytimes.com/gst/abstract.html?res=9C02E0DF1230E333A25755C0A9679C94669ED7CF,0
1897-01-07T00:00:00Z,Article 1 -- No Title,https://query.nytimes.com/gst/abstract.html?res=9C0DEEDF1230E333A25754C0A9679C94669ED7CF,0
1897-01-07T00:00:00Z,Omaha Savings Bank Will Pay.,https://query.nytimes.com/gst/abstract.html?res=9D05E7DE1230E333A25754C0A9679C94669ED7CF,0
1897-01-07T00:00:00Z,PACIFIC CABLE COMMISSION.; A Report Will Be Signed and Submitted to the Colonies.,https://query.nytimes.com/gst/abstract.html?res=9C01E7DE1230E333A25754C0A9679C94669ED7CF,0
1897-01-07T00:00:00Z,"PROCEEDINGS IN CONGRESS; CUBAN COMPLICATION'S RECEIVE ATTENTION IN THE SENATE. Passage by the House of Loud's Bill Amending the Postal Laws with Respect to ""Sample Copy"" Privileges. SENATE.",https://query.nytimes.com/gst/abstract.html?res=9E06E6DE1230E333A25754C0A9679C94669ED7CF,0
1897-01-07T00:00:00Z,"MISCELLANEOUS MEASURES.; Reclassification of the Civil Service -- The ""Sky-Scraper"" Bill.",https://query.nytimes.com/gst/abstract.html?res=9D02E6DE1230E333A25754C0A9679C94669ED7CF,0
1897-01-07T00:00:00Z,TO ENJOIN LIQUOR DEALERS.; Three Saloon Keepers Selling Without Paying Their Taxes.,https://query.nytimes.com/gst/abstract.html?res=9F01E6DE1230E333A25754C0A9679C94669ED7CF,0
1897-01-07T00:00:00Z,Gladstone on the Great Assassin.,https://query.nytimes.com/gst/abstract.html?res=9D01E7DE1230E333A25754C0A9679C94669ED7CF,0
1897-01-07T00:00:00Z,PERKINS TO SUCCEED HIMSELF.; The California Senatorial Fight Settled in Caucus.,https://query.nytimes.com/gst/abstract.html?res=9B0DEEDF1230E333A25754C0A9679C94669ED7CF,0
1897-01-07T00:00:00Z,GEN. WEYLER'S LATEST EDICT.; Owners and Managers of Estates Must Secure Certificates.,https://query.nytimes.com/gst/abstract.html?res=9E05E6DE1230E333A25754C0A9679C94669ED7CF,0
1897-01-07T00:00:00Z,Editorial Article 3 -- No Title,https://query.nytimes.com/gst/abstract.html?res=9B07E7DE1230E333A25754C0A9679C94669ED7CF,0
1897-01-07T00:00:00Z,HE SENT A CHALLENGE.; For This Offense the Judge Fined Him Two Dollars and a Half.,https://query.nytimes.com/gst/abstract.html?res=9A02E6DE1230E333A25754C0A9679C94669ED7CF,0
1897-01-07T00:00:00Z,ACTORS WILL GO TO CHURCH.; Stars to Serve on Dr. Rusk's Reception Committee in Chicago.,https://query.nytimes.com/gst/abstract.html?res=9B0CE7DE1230E333A25754C0A9679C94669ED7CF,0
1897-01-07T00:00:00Z,Article 10 -- No Title,https://query.nytimes.com/gst/abstract.html?res=980DE7DE1230E333A25754C0A9679C94669ED7CF,0
1897-01-07T00:00:00Z,ASSEMBLY PLAN ATTACKED; CHARTER PROVISION FOR MUNICIPAL BODY CRITICISED. Henry De Forest Baldwin Would Have All Reference to the Board of Aldermen Stricken Out -- Dorman B. Eaton and Others Heard.,https://query.nytimes.com/gst/abstract.html?res=9B02EEDF1230E333A25754C0A9679C94669ED7CF,0
1897-01-07T00:00:00Z,THE NEW IRISH QUESTION.,https://query.nytimes.com/gst/abstract.html?res=9E07E7DE1230E333A25754C0A9679C94669ED7CF,0
1897-01-07T00:00:00Z,Rebel Forces Defeated.,https://query.nytimes.com/gst/abstract.html?res=9A05E6DE1230E333A25754C0A9679C94669ED7CF,0
1897-01-07T00:00:00Z,Article 11 -- No Title,https://query.nytimes.com/gst/abstract.html?res=990DE7DE1230E333A25754C0A9679C94669ED7CF,0
1897-01-07T00:00:00Z,THE CENTRAL OF INDIANA.; Dinner in Indianapolis to Further the Scheme for an Exposition.,https://query.nytimes.com/gst/abstract.html?res=9900E7DE1230E333A25754C0A9679C94669ED7CF,0
1897-01-07T00:00:00Z,CHICAGO'S HIGH HAT LAW.; The Ordinance Sneered at by Lawyers as Invalid.,https://query.nytimes.com/gst/abstract.html?res=9400EEDF1230E333A25754C0A9679C94669ED7CF,0
1897-01-07T00:00:00Z,MR. DEPEW'S ORATION; The History of This State Reviewed in an Address at the Capital Centennial. NEW YORK FOREMOST IN THE MARCH OF PROGRESS. Citizens of the Commonwealth Who Have Left Their Impress Upon National Institutions and Character.,https://query.nytimes.com/gst/abstract.html?res=9506E6DE1230E333A25754C0A9679C94669ED7CF,0
1897-01-07T00:00:00Z,AT DINNER WITH MR. WOODRUFF; The Lieutenant Governor Entertains Several Republicans.,https://query.nytimes.com/gst/abstract.html?res=9800E7DE1230E333A25754C0A9679C94669ED7CF,0
1897-01-07T00:00:00Z,BANK BURGLARS AT RARITAN.; They Blow Open a Safe but Score Only Fifty Cents.,https://query.nytimes.com/gst/abstract.html?res=9B06E6DE1230E333A25754C0A9679C94669ED7CF,0
1897-01-07T00:00:00Z,WILL NOT KISS THE BIBLE.; Kansas Populists Think It May Spread Disease.,https://query.nytimes.com/gst/abstract.html?res=9901E6DE1230E333A25754C0A9679C94669ED7CF,0
1897-01-07T00:00:00Z,GROSVENOR MISSED FIRE.; Futile Attempt to Throw Hot Shot at the Administration.,https://query.nytimes.com/gst/abstract.html?res=9C00E7DE1230E333A25754C0A9679C94669ED7CF,0
1897-01-07T00:00:00Z,Article 8 -- No Title,https://query.nytimes.com/gst/abstract.html?res=9E0DE7DE1230E333A25754C0A9679C94669ED7CF,0
1897-01-07T00:00:00Z,ALTGELD PARDONS CRIMINALS.; The Notorious John McGrath Liberated by the Illinois Governor.,https://query.nytimes.com/gst/abstract.html?res=9A02E7DE1230E333A25754C0A9679C94669ED7CF,0
1897-01-07T00:00:00Z,REINHART GOES CLEAR.; Failure of the Government in the Santa Fe Rebate Case.,https://query.nytimes.com/gst/abstract.html?res=9F02EEDF1230E333A25754C0A9679C94669ED7CF,0
1897-01-07T00:00:00Z,Editorial Article 2 -- No Title,https://query.nytimes.com/gst/abstract.html?res=9A07E7DE1230E333A25754C0A9679C94669ED7CF,0
1897-01-07T00:00:00Z,Editorial Article 5 -- No Title,https://query.nytimes.com/gst/abstract.html?res=9507E7DE1230E333A25754C0A9679C94669ED7CF,0
