pub_date,main_headline,article_url,classification
1897-01-15T00:00:00Z,A Model Newspaper.,https://query.nytimes.com/gst/abstract.html?res=9E0DE0DA1F31E132A25756C1A9679C94669ED7CF,0
1897-01-15T00:00:00Z,J.M. DEUEL'S EXCISE PLAN; WHAT SORT OF LEGISLATION THE MAGISTRATE FAVORS. Sunday Selling in Hotels and Restaurants -- Also by Saloon Men Holding Seven-Day Licenses -- Liquor to be Drunk Elsewhere.,https://query.nytimes.com/gst/abstract.html?res=9A0DE1DA1F31E132A25756C1A9679C94669ED7CF,0
1897-01-16T00:00:00Z,"TERRIER AIDED POLICEMAN.; A Supposed Burglar Dropped from a Window, but Was Finally Caught.",https://query.nytimes.com/gst/abstract.html?res=9406E7D91F31E132A25755C1A9679C94669ED7CF,0
1897-01-16T00:00:00Z,LAKE FISHERMEN PERISH.; Fatal Result of the Ice Breaking at Marinette. Wis.,https://query.nytimes.com/gst/abstract.html?res=9D0DEFDA1F31E132A25755C1A9679C94669ED7CF,0
1897-01-16T00:00:00Z,To Provide Work for Convicts.,https://query.nytimes.com/gst/abstract.html?res=9C06EEDA1F31E132A25755C1A9679C94669ED7CF,0
1897-01-16T00:00:00Z,GREATER CITY'S TAXATION; THE CHARTER COMMISSION HEARS SUGGESTIONS ABOUT IT. William E. Rogers Favors a Borough Plan -- Thomas G. Shearman and Wheeler H. Peckham Oppose Taxes on Personal Property -- Suggestions on Charities and Buildings.,https://query.nytimes.com/gst/abstract.html?res=9906E7D91F31E132A25755C1A9679C94669ED7CF,0
1897-01-16T00:00:00Z,DANCED AT THE WALDORF; UP-TOWN CLASS ENJOYED ITS THIRD PARTY THERE. Guests Received by Mrs. D. Phoenix Ingraham and Others -- Mrs. B.S. Church's Party at Sherry's -- A Dance at the Fencers Club.,https://query.nytimes.com/gst/abstract.html?res=9901EEDA1F31E132A25755C1A9679C94669ED7CF,0
1897-01-16T00:00:00Z,Extension of a Southern Road.,https://query.nytimes.com/gst/abstract.html?res=9A04EEDA1F31E132A25755C1A9679C94669ED7CF,0
1897-01-16T00:00:00Z,SANTA FE ROAD BRANCHING OUT.; Reported It Is to Control the Atlantic and Pacific.,https://query.nytimes.com/gst/abstract.html?res=9C04EEDA1F31E132A25755C1A9679C94669ED7CF,0
1897-01-16T00:00:00Z,HAWAIIAN CABLE PROJECT.; Gen. Swayne at Washington in the lnterests of His Company.,https://query.nytimes.com/gst/abstract.html?res=9B01EEDA1F31E132A25755C1A9679C94669ED7CF,0
1897-01-16T00:00:00Z,RACING AT NEW ORLEANS.; Three Favorites Winners -- Joseph F. Morris Suspended.,https://query.nytimes.com/gst/abstract.html?res=9806EEDA1F31E132A25755C1A9679C94669ED7CF,0
1897-01-16T00:00:00Z,Front Page 2 -- No Title,https://query.nytimes.com/gst/abstract.html?res=9903EFDA1F31E132A25755C1A9679C94669ED7CF,0
1897-01-16T00:00:00Z,NEW CHARTER PROSPECTS; THE COMMISSION MAY SECURE AN EXTENSION OF TIME. Legislative Leaders Discuss the Situation -- Proposed Extra Session to Consider Greater New York Matters.,https://query.nytimes.com/gst/abstract.html?res=9A06EEDA1F31E132A25755C1A9679C94669ED7CF,0
1897-01-16T00:00:00Z,Article 8 -- No Title,https://query.nytimes.com/gst/abstract.html?res=9F04EEDA1F31E132A25755C1A9679C94669ED7CF,0
1897-01-16T00:00:00Z,Ginger Bread Puppets.,https://query.nytimes.com/gst/abstract.html?res=9B01E7D91F31E132A25755C1A9679C94669ED7CF,0
1897-01-16T00:00:00Z,Editorial Article 2 -- No Title,https://query.nytimes.com/gst/abstract.html?res=9C02EEDA1F31E132A25755C1A9679C94669ED7CF,0
1897-01-16T00:00:00Z,Extraordinary Sentence by a Judge.,https://query.nytimes.com/gst/abstract.html?res=9805E7D91F31E132A25755C1A9679C94669ED7CF,0
1897-01-16T00:00:00Z,TAMSEN'S LOST PRISONERS; THE THREE WHO LEFT LUDLOW STREET JAIL NOT CAUGHT. Story Told by the Recaptured Man Masso -- United States Officers Make Sharp Comments.,https://query.nytimes.com/gst/abstract.html?res=9F05E7D91F31E132A25755C1A9679C94669ED7CF,0
1897-01-16T00:00:00Z,St. Nicholas Day in Holland.,https://query.nytimes.com/gst/abstract.html?res=9E02E7D91F31E132A25755C1A9679C94669ED7CF,0
1897-01-16T00:00:00Z,"MOLTKE.; Letters to His English Wife and Others, Extending Over Fifty Years.",https://query.nytimes.com/gst/abstract.html?res=9901E7D91F31E132A25755C1A9679C94669ED7CF,0
1897-01-16T00:00:00Z,Charlotte Bronte at the Confessional.,https://query.nytimes.com/gst/abstract.html?res=9F02E7D91F31E132A25755C1A9679C94669ED7CF,0
1897-01-16T00:00:00Z,CHAIRMAN HACKETT ILL.; Confined to His Room in an Albany Hotel.,https://query.nytimes.com/gst/abstract.html?res=9502EFDA1F31E132A25755C1A9679C94669ED7CF,0
1897-01-16T00:00:00Z,"A DIVORCE FOR MR. NEAME; THE DECREE GRANTED BY AN ENGLISH COURT. Frank Ellison, the Co-Respondent, Accused of Having Sold to the Plaintiff Incriminating Letters from the Defendant.",https://query.nytimes.com/gst/abstract.html?res=9A0CEEDA1F31E132A25755C1A9679C94669ED7CF,0
1897-01-16T00:00:00Z,TRADE RELATIONS WITH CANADA; Concessions Which the Dominion ls Willing to Make.,https://query.nytimes.com/gst/abstract.html?res=9C00EEDA1F31E132A25755C1A9679C94669ED7CF,0
1897-01-16T00:00:00Z,A BIG BALANCE.,https://query.nytimes.com/gst/abstract.html?res=9D03EEDA1F31E132A25755C1A9679C94669ED7CF,0
1897-01-16T00:00:00Z,The Treasury Deficit.,https://query.nytimes.com/gst/abstract.html?res=950CEEDA1F31E132A25755C1A9679C94669ED7CF,0
1897-01-16T00:00:00Z,Popular Appreciation of Art.,https://query.nytimes.com/gst/abstract.html?res=9E03E7D91F31E132A25755C1A9679C94669ED7CF,0
1897-01-16T00:00:00Z,Boston Merchants' Association Banquet,https://query.nytimes.com/gst/abstract.html?res=9B00EFDA1F31E132A25755C1A9679C94669ED7CF,0
1897-01-16T00:00:00Z,SOCIETY OF HOLLAND DAMES.; New York City Women Incorporate a New Organization.,https://query.nytimes.com/gst/abstract.html?res=940DEFDA1F31E132A25755C1A9679C94669ED7CF,0
1897-01-16T00:00:00Z,MAJOR M'KINLEY'S PLANS.; Will Leave Canton for Washington March 1.,https://query.nytimes.com/gst/abstract.html?res=9803EFDA1F31E132A25755C1A9679C94669ED7CF,0
1897-01-16T00:00:00Z,H.O. Havemeyer in Toledo.,https://query.nytimes.com/gst/abstract.html?res=980DEFDA1F31E132A25755C1A9679C94669ED7CF,0
1897-01-16T00:00:00Z,Receiver for the St. Louis Belt Road.,https://query.nytimes.com/gst/abstract.html?res=9B04EEDA1F31E132A25755C1A9679C94669ED7CF,0
1897-01-16T00:00:00Z,CURLING AT TORONTO.; New Yorkers Beaten by Toronto Players -- 137 to 97.,https://query.nytimes.com/gst/abstract.html?res=9A0DEFDA1F31E132A25755C1A9679C94669ED7CF,0
1897-01-16T00:00:00Z,Article 12 -- No Title,https://query.nytimes.com/gst/abstract.html?res=9B0DEEDA1F31E132A25755C1A9679C94669ED7CF,0
1897-01-16T00:00:00Z,Found Frozen to Death.,https://query.nytimes.com/gst/abstract.html?res=9D01EEDA1F31E132A25755C1A9679C94669ED7CF,0
1897-01-16T00:00:00Z,PROCEEDINGS IN CONGRESS; ME. PAYNE DELAYS THE PAYMENT OF A CLAIM. A Wrangle over the Measure to Pension the Widow of Gen. John Gibbon -- Various Belief Bills Passed. HOUSE.,https://query.nytimes.com/gst/abstract.html?res=9F01EEDA1F31E132A25755C1A9679C94669ED7CF,0
1897-01-16T00:00:00Z,FIJI'S GOVERNOR IS ILL.; Great Britain Likely to Lose One of Its Ablest Representatives.,https://query.nytimes.com/gst/abstract.html?res=9402EFDA1F31E132A25755C1A9679C94669ED7CF,0
1897-01-16T00:00:00Z,Charles Kingsley.,https://query.nytimes.com/gst/abstract.html?res=9900E7D91F31E132A25755C1A9679C94669ED7CF,0
1897-01-16T00:00:00Z,Mitchell's Fight in Oregon.,https://query.nytimes.com/gst/abstract.html?res=9C02EFDA1F31E132A25755C1A9679C94669ED7CF,0
1897-01-16T00:00:00Z,Article 14 -- No Title,https://query.nytimes.com/gst/abstract.html?res=950DEEDA1F31E132A25755C1A9679C94669ED7CF,0
1897-01-16T00:00:00Z,Article 6 -- No Title,https://query.nytimes.com/gst/abstract.html?res=9C05EEDA1F31E132A25755C1A9679C94669ED7CF,0
1897-01-16T00:00:00Z,Article 15 -- No Title,https://query.nytimes.com/gst/abstract.html?res=9D0CEEDA1F31E132A25755C1A9679C94669ED7CF,0
1897-01-16T00:00:00Z,New Yorkers Win at Hockey.,https://query.nytimes.com/gst/abstract.html?res=9906EEDA1F31E132A25755C1A9679C94669ED7CF,0
1897-01-16T00:00:00Z,TELEGRAPHIC BREVITIES.,https://query.nytimes.com/gst/abstract.html?res=9F0CEFDA1F31E132A25755C1A9679C94669ED7CF,0
1897-01-16T00:00:00Z,THE FINANCIAL MARKETS,https://query.nytimes.com/gst/abstract.html?res=9D04E7D91F31E132A25755C1A9679C94669ED7CF,0
1897-01-16T00:00:00Z,Froude's Early Life.,https://query.nytimes.com/gst/abstract.html?res=9F00E7D91F31E132A25755C1A9679C94669ED7CF,0
1897-01-16T00:00:00Z,Mendelssohn and Malibran.,https://query.nytimes.com/gst/abstract.html?res=9403E7D91F31E132A25755C1A9679C94669ED7CF,0
1897-01-16T00:00:00Z,Article 11 -- No Title,https://query.nytimes.com/gst/abstract.html?res=9F07EEDA1F31E132A25755C1A9679C94669ED7CF,0
1897-01-16T00:00:00Z,BOISRAGON AND LOCKE SAFE.; Two Members of the Niger Force Reach New Benin.,https://query.nytimes.com/gst/abstract.html?res=940CEEDA1F31E132A25755C1A9679C94669ED7CF,0
1897-01-16T00:00:00Z,Col. Mosby's Mother Dead.,https://query.nytimes.com/gst/abstract.html?res=9400EFDA1F31E132A25755C1A9679C94669ED7CF,0
1897-01-16T00:00:00Z,Article 10 -- No Title,https://query.nytimes.com/gst/abstract.html?res=9E07EEDA1F31E132A25755C1A9679C94669ED7CF,0
1897-01-16T00:00:00Z,A FIFTY PER CENT. DIVIDEND.; Depositors in the National Bank of Illinois Receiving Their Money.,https://query.nytimes.com/gst/abstract.html?res=9900EFDA1F31E132A25755C1A9679C94669ED7CF,0
1897-01-16T00:00:00Z,FAVORING THE GEAR BILL.; The Senate Committee on Pacific Railroads Wants a Commission.,https://query.nytimes.com/gst/abstract.html?res=9C03EFDA1F31E132A25755C1A9679C94669ED7CF,0
1897-01-16T00:00:00Z,Nebraska Bank Fails.,https://query.nytimes.com/gst/abstract.html?res=9E0CEFDA1F31E132A25755C1A9679C94669ED7CF,0
1897-01-16T00:00:00Z,Tools of the Lake Dwellers.,https://query.nytimes.com/gst/abstract.html?res=9B03E7D91F31E132A25755C1A9679C94669ED7CF,0
1897-01-16T00:00:00Z,Verestchagin and the French.,https://query.nytimes.com/gst/abstract.html?res=9B00E7D91F31E132A25755C1A9679C94669ED7CF,0
1897-01-16T00:00:00Z,BOOKS AND AUTHORS.,https://query.nytimes.com/gst/abstract.html?res=9D0DE7D91F31E132A25755C1A9679C94669ED7CF,0
1897-01-16T00:00:00Z,Article 4 -- No Title,https://query.nytimes.com/gst/abstract.html?res=940CEFDA1F31E132A25755C1A9679C94669ED7CF,0
1897-01-16T00:00:00Z,INTERNATIONAL BIMETALLISM.; The Resolution for a Conference That Is to Go to the Senate.,https://query.nytimes.com/gst/abstract.html?res=9801EEDA1F31E132A25755C1A9679C94669ED7CF,0
1897-01-16T00:00:00Z,AN EMPTY STATE TREASURY.; Embarrassment at the Capital of Illinois from a Lack of Funds.,https://query.nytimes.com/gst/abstract.html?res=9A03EFDA1F31E132A25755C1A9679C94669ED7CF,0
1897-01-16T00:00:00Z,PURIFYING THE MILK SUPPLY.,https://query.nytimes.com/gst/abstract.html?res=9B03EEDA1F31E132A25755C1A9679C94669ED7CF,0
1897-01-16T00:00:00Z,GUARDING AGAINST DISEASE.; An International Conference to Save Europe from the Plague.,https://query.nytimes.com/gst/abstract.html?res=980DEEDA1F31E132A25755C1A9679C94669ED7CF,0
1897-01-16T00:00:00Z,The Oldest Paper in France.,https://query.nytimes.com/gst/abstract.html?res=9C02E7D91F31E132A25755C1A9679C94669ED7CF,0
1897-01-16T00:00:00Z,Order of Founders and Patriots.,https://query.nytimes.com/gst/abstract.html?res=9C01EEDA1F31E132A25755C1A9679C94669ED7CF,0
1897-01-16T00:00:00Z,ECKELS TO BE A BANKER.; Understood He Will Manage the General Trust Company of Chicago.,https://query.nytimes.com/gst/abstract.html?res=9C0DEFDA1F31E132A25755C1A9679C94669ED7CF,0
1897-01-16T00:00:00Z,On Book Bindings.,https://query.nytimes.com/gst/abstract.html?res=9A00E7D91F31E132A25755C1A9679C94669ED7CF,0
1897-01-16T00:00:00Z,Prof. Brown and Warszawiak Case.,https://query.nytimes.com/gst/abstract.html?res=9B02EEDA1F31E132A25755C1A9679C94669ED7CF,0
1897-01-16T00:00:00Z,CHICAGO'S FILTHY WATER.; It Is So Bad It Is Not Allowed in the Public Schools.,https://query.nytimes.com/gst/abstract.html?res=9F0DEFDA1F31E132A25755C1A9679C94669ED7CF,0
1897-01-16T00:00:00Z,Midwinter Fair.,https://query.nytimes.com/gst/abstract.html?res=9F02EEDA1F31E132A25755C1A9679C94669ED7CF,0
1897-01-16T00:00:00Z,"WAGNER'S MUSIC DRAMA; ""TRISTAN UND ISOLDE"" WAS SUNG LAST NIGHT. Mme. Litvinne Better than Was Anticipated -- Jean de Reszke Appeared, Though He Had Been Ill.",https://query.nytimes.com/gst/abstract.html?res=9D0DEEDA1F31E132A25755C1A9679C94669ED7CF,0
1897-01-16T00:00:00Z,WORKING OF THE RAINES LAW.,https://query.nytimes.com/gst/abstract.html?res=9503EEDA1F31E132A25755C1A9679C94669ED7CF,0
1897-01-16T00:00:00Z,ART AND ARTISTS,https://query.nytimes.com/gst/abstract.html?res=9503E7D91F31E132A25755C1A9679C94669ED7CF,0
1897-01-16T00:00:00Z,Some Pictures in the Galleries.,https://query.nytimes.com/gst/abstract.html?res=9A03E7D91F31E132A25755C1A9679C94669ED7CF,0
1897-01-16T00:00:00Z,Hobart's Gift to Rutgers.,https://query.nytimes.com/gst/abstract.html?res=980CEEDA1F31E132A25755C1A9679C94669ED7CF,0
1897-01-16T00:00:00Z,"STAMPEDE ENDED A STRIKE; Wall Street Mesenger Boys Had a Grievance, but Yielded.",https://query.nytimes.com/gst/abstract.html?res=9E0DEEDA1F31E132A25755C1A9679C94669ED7CF,0
1897-01-16T00:00:00Z,Barge Thought to be a Filibuster.,https://query.nytimes.com/gst/abstract.html?res=9905EEDA1F31E132A25755C1A9679C94669ED7CF,0
1897-01-16T00:00:00Z,More Readers for History and Fiction.,https://query.nytimes.com/gst/abstract.html?res=9800E7D91F31E132A25755C1A9679C94669ED7CF,0
1897-01-16T00:00:00Z,LOSSES BY FIRE.,https://query.nytimes.com/gst/abstract.html?res=9C07EEDA1F31E132A25755C1A9679C94669ED7CF,0
1897-01-16T00:00:00Z,REFORMS FOR CUBA.; The Cabinet Council at Madrid Decides on Immediate Action.,https://query.nytimes.com/gst/abstract.html?res=9805EEDA1F31E132A25755C1A9679C94669ED7CF,0
1897-01-16T00:00:00Z,BUSHNELL MAY BE A SENATOR.; Possible the Ohio Legislature May Elect Him to Succeed Sherman.,https://query.nytimes.com/gst/abstract.html?res=9B03EFDA1F31E132A25755C1A9679C94669ED7CF,0
1897-01-16T00:00:00Z,Article 17 -- No Title,https://query.nytimes.com/gst/abstract.html?res=9F0CEEDA1F31E132A25755C1A9679C94669ED7CF,0
1897-01-16T00:00:00Z,DEATH LIST OF A DAY.,https://query.nytimes.com/gst/abstract.html?res=9C05E7D91F31E132A25755C1A9679C94669ED7CF,0
1897-01-16T00:00:00Z,Kerens Nominated in Missouri.,https://query.nytimes.com/gst/abstract.html?res=9503EFDA1F31E132A25755C1A9679C94669ED7CF,0
1897-01-16T00:00:00Z,Editorial Article 1 -- No Title,https://query.nytimes.com/gst/abstract.html?res=9403EEDA1F31E132A25755C1A9679C94669ED7CF,0
1897-01-16T00:00:00Z,LORD ROBERTS.; A Great Soldier's Story of His Own Career in India and Afghanistan.*,https://query.nytimes.com/gst/abstract.html?res=9801E7D91F31E132A25755C1A9679C94669ED7CF,0
1897-01-16T00:00:00Z,A PLETHORA OF FISH.; Boston's Market Is Glutted by Yesterday's Receipts.,https://query.nytimes.com/gst/abstract.html?res=950DEFDA1F31E132A25755C1A9679C94669ED7CF,0
1897-01-16T00:00:00Z,NEW YORK LEGISLATURE; SENATOR LEXOW WANTS AN INVESTIGATION OF TRUSTS. to Prevent Legislation -- Bills Introduced in Both Houses -- Adjourment Till Monday. SENATE.,https://query.nytimes.com/gst/abstract.html?res=9501EEDA1F31E132A25755C1A9679C94669ED7CF,0
1897-01-16T00:00:00Z,PRINCESS CHIMAY A SPY?; Police Raid Her Rooms and Find Letters from a Monarch.,https://query.nytimes.com/gst/abstract.html?res=990DEEDA1F31E132A25755C1A9679C94669ED7CF,0
1897-01-16T00:00:00Z,CAMPBELL WILL CONTEST.; Lawyer Spink Says Mr. Campbell Expected a Contest.,https://query.nytimes.com/gst/abstract.html?res=9D06EEDA1F31E132A25755C1A9679C94669ED7CF,0
1897-01-16T00:00:00Z,Saranac and Lake Placid Leased.,https://query.nytimes.com/gst/abstract.html?res=9404EEDA1F31E132A25755C1A9679C94669ED7CF,0
1897-01-16T00:00:00Z,CREDITORS ARE SURPRISED.; Assets of a Dead Banker Turn Out Unexpectedly Large.,https://query.nytimes.com/gst/abstract.html?res=9B0DEFDA1F31E132A25755C1A9679C94669ED7CF,0
1897-01-16T00:00:00Z,Louisville Jockey Club Entries.,https://query.nytimes.com/gst/abstract.html?res=9D0CEFDA1F31E132A25755C1A9679C94669ED7CF,0
1897-01-16T00:00:00Z,RAINES LAW'S WORKINGS; COMMISSIONER LYMAN'S REPORT TO THE LEGISLATURE. The Number of Authorized Places for Selling Liquor Reduced and Revenues Increased -- Amendments Needed to Prevent Evasions.,https://query.nytimes.com/gst/abstract.html?res=9900EEDA1F31E132A25755C1A9679C94669ED7CF,0
1897-01-16T00:00:00Z,GOING TO FIGHT FOR CUBA.; Lieut. Charles E. Hays Resigns from the United States Army.,https://query.nytimes.com/gst/abstract.html?res=9F05EEDA1F31E132A25755C1A9679C94669ED7CF,0
1897-01-16T00:00:00Z,Foreign Notes of Interest.,https://query.nytimes.com/gst/abstract.html?res=9C0CEEDA1F31E132A25755C1A9679C94669ED7CF,0
1897-01-16T00:00:00Z,WORK OF REMOVING REFUSE.; What Col. Waring Says of Contracts Made by Individuals.,https://query.nytimes.com/gst/abstract.html?res=9D05E7D91F31E132A25755C1A9679C94669ED7CF,0
1897-01-16T00:00:00Z,THE VOICE OF THE PULPIT.,https://query.nytimes.com/gst/abstract.html?res=9C03EEDA1F31E132A25755C1A9679C94669ED7CF,0
1897-01-16T00:00:00Z,"A Longer Presidential Term.; Hon. A.B. Cornell, in the January Forum:",https://query.nytimes.com/gst/abstract.html?res=9902E7D91F31E132A25755C1A9679C94669ED7CF,0
1897-01-16T00:00:00Z,Remarkably Attractive and Educative.,https://query.nytimes.com/gst/abstract.html?res=9502EEDA1F31E132A25755C1A9679C94669ED7CF,0
1897-01-16T00:00:00Z,A Monument to Whittier.,https://query.nytimes.com/gst/abstract.html?res=9501E7D91F31E132A25755C1A9679C94669ED7CF,0
1897-01-16T00:00:00Z,North Dakota Senatorship.,https://query.nytimes.com/gst/abstract.html?res=9E02EFDA1F31E132A25755C1A9679C94669ED7CF,0
1897-01-16T00:00:00Z,The Pope's Chamberlain Dead.,https://query.nytimes.com/gst/abstract.html?res=990DEFDA1F31E132A25755C1A9679C94669ED7CF,0
1897-01-16T00:00:00Z,Article 3 -- No Title,https://query.nytimes.com/gst/abstract.html?res=9B0CEFDA1F31E132A25755C1A9679C94669ED7CF,0
1897-01-16T00:00:00Z,"A PECULIAR LIQUOR CASE.; Decision at Richmond Va., in a Suit Growing Out of the Evacuation.",https://query.nytimes.com/gst/abstract.html?res=9E05E7D91F31E132A25755C1A9679C94669ED7CF,0
1897-01-16T00:00:00Z,THE BAR AND THE SHYSTERS.,https://query.nytimes.com/gst/abstract.html?res=9903EEDA1F31E132A25755C1A9679C94669ED7CF,0
1897-01-16T00:00:00Z,Front Page 1 -- No Title,https://query.nytimes.com/gst/abstract.html?res=9E03EFDA1F31E132A25755C1A9679C94669ED7CF,0
1897-01-16T00:00:00Z,THE MONROE DOCTRINE; It's Relation to the Nicaragua Canal and other Isthmian Transit Schemes.*,https://query.nytimes.com/gst/abstract.html?res=980DE7D91F31E132A25755C1A9679C94669ED7CF,0
1897-01-16T00:00:00Z,NEW CORPORATIONS.,https://query.nytimes.com/gst/abstract.html?res=9E06EEDA1F31E132A25755C1A9679C94669ED7CF,0
1897-01-16T00:00:00Z,Two More Ballots in Idaho.,https://query.nytimes.com/gst/abstract.html?res=9403EFDA1F31E132A25755C1A9679C94669ED7CF,0
1897-01-16T00:00:00Z,WORK OF THE ASSEMBLY.; The Bill for a Hall of Records in This City Advanced to Third Reading and Recommend-Bills Introduced. ASSEMBLY.,https://query.nytimes.com/gst/abstract.html?res=9E00EEDA1F31E132A25755C1A9679C94669ED7CF,0
1897-01-16T00:00:00Z,Article 7 -- No Title,https://query.nytimes.com/gst/abstract.html?res=9D05EEDA1F31E132A25755C1A9679C94669ED7CF,0
1897-01-16T00:00:00Z,TAMMANY AT THE POLLS; HAYES WON THE LEADERSHIP IN HIS DISTRICT. PURROY DID NOT BEAT THE REGULARS Contestants in the Twenty-first District Were Overwhelmingly Defeated and Joined with the Victors in a Love Feast.,https://query.nytimes.com/gst/abstract.html?res=9A0CEFDA1F31E132A25755C1A9679C94669ED7CF,0
1897-01-16T00:00:00Z,MR. PLATT FOR SENATOR.,https://query.nytimes.com/gst/abstract.html?res=9E03EEDA1F31E132A25755C1A9679C94669ED7CF,0
1897-01-16T00:00:00Z,The Life of Books and Cheap Books.,https://query.nytimes.com/gst/abstract.html?res=9500E7D91F31E132A25755C1A9679C94669ED7CF,0
1897-01-16T00:00:00Z,Lofty Ideals.,https://query.nytimes.com/gst/abstract.html?res=9A02EEDA1F31E132A25755C1A9679C94669ED7CF,0
1897-01-16T00:00:00Z,QUAY OPPOSES SMITH.; Representative Harmer a Pennsylvania Possibility.,https://query.nytimes.com/gst/abstract.html?res=9802EFDA1F31E132A25755C1A9679C94669ED7CF,0
1897-01-16T00:00:00Z,Honors for Prof. Lewis Swift.,https://query.nytimes.com/gst/abstract.html?res=9E01EEDA1F31E132A25755C1A9679C94669ED7CF,0
1897-01-16T00:00:00Z,MR. SHERMAN HAS ACCEPTED; CONSENTS TO SERVE AS THE SECRETARY OF STATE. NO OTHER PORTFOLIO GIVEN OUT It IS Believed at Canton that ex-Gov. Long Will Represent New England in the Cabinet -- Gen. Alger's Chances.,https://query.nytimes.com/gst/abstract.html?res=9902EFDA1F31E132A25755C1A9679C94669ED7CF,0
1897-01-16T00:00:00Z,NEWS OF THE RAILROADS; THE SOFT-COAL WAR NOW IN AN ACUTE STAGE. Reports of Unfair Dealing Which Are Denied -- A New Agreement Which Is Receiving Signatures.,https://query.nytimes.com/gst/abstract.html?res=9D04EEDA1F31E132A25755C1A9679C94669ED7CF,0
1897-01-16T00:00:00Z,The Boy Who Saved a Train.,https://query.nytimes.com/gst/abstract.html?res=9402EEDA1F31E132A25755C1A9679C94669ED7CF,0
1897-01-16T00:00:00Z,A Danish Hunting Supper.,https://query.nytimes.com/gst/abstract.html?res=9F0DE7D91F31E132A25755C1A9679C94669ED7CF,0
1897-01-16T00:00:00Z,"Alley ""L's"" Reorganization.",https://query.nytimes.com/gst/abstract.html?res=9804EEDA1F31E132A25755C1A9679C94669ED7CF,0
1897-01-16T00:00:00Z,"PACIFIC RAILWAY CLAIMS; BY FORECLOSURE THE GOVERNMENT MAY RECOVER THEM. ATTORNEY GENERAL HARMON'S OPINION J. Pierpont Morgan, the Vanderbilts, Huntington, and Others Said to be Ready to Purchase the Lines.",https://query.nytimes.com/gst/abstract.html?res=9500EFDA1F31E132A25755C1A9679C94669ED7CF,0
1897-01-16T00:00:00Z,HE IS CHARGED WITH THEFT.; Arrest of a Former Employe of a New York Company.,https://query.nytimes.com/gst/abstract.html?res=9A05EEDA1F31E132A25755C1A9679C94669ED7CF,0
1897-01-16T00:00:00Z,Article 9 -- No Title,https://query.nytimes.com/gst/abstract.html?res=9D07EEDA1F31E132A25755C1A9679C94669ED7CF,0
1897-01-16T00:00:00Z,NEWTOWN CREEK BRIDGE.; Plans of Engineer McLaughlin Approved by Joint Committee.,https://query.nytimes.com/gst/abstract.html?res=9406EEDA1F31E132A25755C1A9679C94669ED7CF,0
1897-01-16T00:00:00Z,FOREIGN MISSIONS LAUDED; INTERDENOMINATIONAL MEETING HEARS PRAISE FOR THEM. TWENTY-TWO SECTS WERE REPRESENTED. Gen. Beaver Praised Arbitration Treaty -- It Was Indorsed by Resolution -- Dr. Storrs and Bishop Fowler on Foreign Missions.,https://query.nytimes.com/gst/abstract.html?res=9803EEDA1F31E132A25755C1A9679C94669ED7CF,0
1897-01-16T00:00:00Z,For One Salon in Paris.,https://query.nytimes.com/gst/abstract.html?res=9400E7D91F31E132A25755C1A9679C94669ED7CF,0
1897-01-16T00:00:00Z,Article 16 -- No Title,https://query.nytimes.com/gst/abstract.html?res=9E0CEEDA1F31E132A25755C1A9679C94669ED7CF,0
1897-01-16T00:00:00Z,Tennyson and Fields.,https://query.nytimes.com/gst/abstract.html?res=9A02E7D91F31E132A25755C1A9679C94669ED7CF,0
1897-01-16T00:00:00Z,LEFT HER HUSBAND IN HAWAII.; Mrs. W.W. Dimond Sails for San Francisco -- A Man with Her.,https://query.nytimes.com/gst/abstract.html?res=9F03EFDA1F31E132A25755C1A9679C94669ED7CF,0
1897-01-16T00:00:00Z,Editorial Article 3 -- No Title,https://query.nytimes.com/gst/abstract.html?res=9D02EEDA1F31E132A25755C1A9679C94669ED7CF,0
1897-01-16T00:00:00Z,MR. LEXOW'S PURPOSE.; Speculation as to the object of the Proposed Trust Investigation.,https://query.nytimes.com/gst/abstract.html?res=9F00EEDA1F31E132A25755C1A9679C94669ED7CF,0
1897-01-16T00:00:00Z,PARADE OF CAVALRYMEN; BROOKLYN'S CRACK COMPANY DRILLS IN THE GARDEN. An Offer to Contribute to the Hospital Fund for National Guardsmen -- Results of the Contests.,https://query.nytimes.com/gst/abstract.html?res=9507EEDA1F31E132A25755C1A9679C94669ED7CF,0
1897-01-16T00:00:00Z,Article 2 -- No Title,https://query.nytimes.com/gst/abstract.html?res=990CEFDA1F31E132A25755C1A9679C94669ED7CF,0
1897-01-16T00:00:00Z,A SURPRISE TO RAILROADERS.; Receivers Appointed for the Wheeling and Lake Erie.,https://query.nytimes.com/gst/abstract.html?res=9E04EEDA1F31E132A25755C1A9679C94669ED7CF,0
1897-01-16T00:00:00Z,IT STRIKES PROMIMENT MEN.; Exposure of the Harrison International Telephone Company.,https://query.nytimes.com/gst/abstract.html?res=9505EEDA1F31E132A25755C1A9679C94669ED7CF,0
1897-01-16T00:00:00Z,THE CRAMPS' NEW PROJECT.; Will Manufacture Cofferdam and Ship Padding in the West.,https://query.nytimes.com/gst/abstract.html?res=9F02EFDA1F31E132A25755C1A9679C94669ED7CF,0
1897-01-16T00:00:00Z,Auctioneer Phil C. Kidd Drops Dead.,https://query.nytimes.com/gst/abstract.html?res=9B02EFDA1F31E132A25755C1A9679C94669ED7CF,0
1897-01-16T00:00:00Z,Teaching a Governor Manners.,https://query.nytimes.com/gst/abstract.html?res=9D02E7D91F31E132A25755C1A9679C94669ED7CF,0
1897-01-16T00:00:00Z,Review 2 -- No Title,https://query.nytimes.com/gst/abstract.html?res=9803E7D91F31E132A25755C1A9679C94669ED7CF,0
1897-01-16T00:00:00Z,TOPICS OF THE TIMES.,https://query.nytimes.com/gst/abstract.html?res=9902EEDA1F31E132A25755C1A9679C94669ED7CF,0
1897-01-16T00:00:00Z,ILLEGAL SIDEWALK SHOWS; VIOLATORS GET SMALL COMFORT FROM THE MAYOR. Members of the Washington Market Merchants' Association Seek His Approval of a Bill to Legalize the Display of Goods.,https://query.nytimes.com/gst/abstract.html?res=9C01E7D91F31E132A25755C1A9679C94669ED7CF,0
1897-01-16T00:00:00Z,CANNOT OPEN THE VAULT.; Officials of a Louisville Bank in a Strange Predicament.,https://query.nytimes.com/gst/abstract.html?res=9A02EFDA1F31E132A25755C1A9679C94669ED7CF,0
1897-01-16T00:00:00Z,Exempt Fiemen at Odds.,https://query.nytimes.com/gst/abstract.html?res=9E01E7D91F31E132A25755C1A9679C94669ED7CF,0
1897-01-16T00:00:00Z,LUDLOW STREET JAIL.,https://query.nytimes.com/gst/abstract.html?res=9F03EEDA1F31E132A25755C1A9679C94669ED7CF,0
1897-01-16T00:00:00Z,SCIENTIFIC BOOKS.; A Recent Treasury Opinion as to Importations and the Views of Several Publishers.,https://query.nytimes.com/gst/abstract.html?res=9D00E7D91F31E132A25755C1A9679C94669ED7CF,0
1897-01-16T00:00:00Z,Senate and Arbitration Treaty.,https://query.nytimes.com/gst/abstract.html?res=9C0CEFDA1F31E132A25755C1A9679C94669ED7CF,0
1897-01-16T00:00:00Z,THE PRESIDENT'S SORROW.; A High Tribute by Mr. Cleveland to the Deceased Minister.,https://query.nytimes.com/gst/abstract.html?res=9B07EEDA1F31E132A25755C1A9679C94669ED7CF,0
