pub_date,main_headline,article_url,classification
1897-01-10T00:00:00Z,IN THE REAL ESTATE FIELD; BROADWAY SALES THE FEATURE OF LAST WEEK'S BUSINESS. Increase in Values Since 1892 -- The Washington Heights District -- New Schoolhouse or Tenements -- The Ill-fated Syndicate Building.,https://query.nytimes.com/gst/abstract.html?res=9C03E3D9153CE433A25753C1A9679C94669ED7CF,0
1897-01-10T00:00:00Z,Editorial Article 2 -- No Title,https://query.nytimes.com/gst/abstract.html?res=9A04E3D9153CE433A25753C1A9679C94669ED7CF,0
1897-01-10T00:00:00Z,THE FINANCIAL SITUATION,https://query.nytimes.com/gst/abstract.html?res=9803E3D9153CE433A25753C1A9679C94669ED7CF,0
1897-01-10T00:00:00Z,Article 10 -- No Title,https://query.nytimes.com/gst/abstract.html?res=9E00E3D9153CE433A25753C1A9679C94669ED7CF,0
1897-01-10T00:00:00Z,The Brazilian Minister's Dinner.,https://query.nytimes.com/gst/abstract.html?res=990CE5D9153CE433A25753C1A9679C94669ED7CF,0
1897-01-10T00:00:00Z,A CHICAGO WOMAN ROBBED.; Lured to the Scene of the Attack by a Letter.,https://query.nytimes.com/gst/abstract.html?res=9B05E4D9153CE433A25753C1A9679C94669ED7CF,0
1897-01-10T00:00:00Z,Rescued by a Policeman.,https://query.nytimes.com/gst/abstract.html?res=9D03E3D9153CE433A25753C1A9679C94669ED7CF,0
1897-01-10T00:00:00Z,HONORS TO GEN. PORTER.; Guest of Honor at the Annual Banquet of the Lotos Club.,https://query.nytimes.com/gst/abstract.html?res=9D00E4D9153CE433A25753C1A9679C94669ED7CF,0
1897-01-10T00:00:00Z,Editorial Article 5 -- No Title,https://query.nytimes.com/gst/abstract.html?res=9504E3D9153CE433A25753C1A9679C94669ED7CF,0
1897-01-10T00:00:00Z,"YESTERDAY AT THE OPERA.; Mme. Melba Indisposed Again, and Mme. de Vere-Sapro Sings in ""La Traviata.""",https://query.nytimes.com/gst/abstract.html?res=940DE5D9153CE433A25753C1A9679C94669ED7CF,0
1897-01-10T00:00:00Z,SENT FREE FOR 100 MILES; THAT WAS A HARD PEOBLEM FOR THE BIG NEW YORK STORES. But an Old Employe with Brains Invented the Present Feasible System of Free Suburban Delivery of Goods.,https://query.nytimes.com/gst/abstract.html?res=9B0CE4D9153CE433A25753C1A9679C94669ED7CF,0
1897-01-10T00:00:00Z,MOB AT A HANGING.; Breaks Down a Fence to See an Execution.,https://query.nytimes.com/gst/abstract.html?res=9E02E4D9153CE433A25753C1A9679C94669ED7CF,0
1897-01-10T00:00:00Z,ALLEGED WIFE-POISONING.; Howard C. Benham of Batavia Charged with a Capital Crime.,https://query.nytimes.com/gst/abstract.html?res=9C07E4D9153CE433A25753C1A9679C94669ED7CF,0
1897-01-10T00:00:00Z,Nevada.,https://query.nytimes.com/gst/abstract.html?res=9B07E3D9153CE433A25753C1A9679C94669ED7CF,0
1897-01-10T00:00:00Z,An Eau Claire Bank Receiver.,https://query.nytimes.com/gst/abstract.html?res=9507E4D9153CE433A25753C1A9679C94669ED7CF,0
1897-01-10T00:00:00Z,Executive Clemency.,https://query.nytimes.com/gst/abstract.html?res=9E07E3D9153CE433A25753C1A9679C94669ED7CF,0
1897-01-10T00:00:00Z,THE CHAPMAN HEARING.; Testimony Given by Witnesses Called in the Captain's Behalf.,https://query.nytimes.com/gst/abstract.html?res=9B00E3D9153CE433A25753C1A9679C94669ED7CF,0
1897-01-10T00:00:00Z,NEWS OF THE GOLFERS.; Playing Resumed at Lakewood -- A Handsome Prize Cup.,https://query.nytimes.com/gst/abstract.html?res=9B06E4D9153CE433A25753C1A9679C94669ED7CF,0
1897-01-10T00:00:00Z,MANY SKIRMISHES REPORTED.; The Trial of Luis Sameillan was Ended Yesterday.,https://query.nytimes.com/gst/abstract.html?res=9501E5D9153CE433A25753C1A9679C94669ED7CF,0
1897-01-10T00:00:00Z,"R. AUGUSTINE SMITH DEAD; HE WAS TAKEN ILL AT UNION LEAGUE CLUB. After Sitting There for a Time, He Was Taken Home and Was Attacked with Uraemic Convulsions.",https://query.nytimes.com/gst/abstract.html?res=990DE5D9153CE433A25753C1A9679C94669ED7CF,0
1897-01-10T00:00:00Z,A Neighborly Congratulation.,https://query.nytimes.com/gst/abstract.html?res=9D07E3D9153CE433A25753C1A9679C94669ED7CF,0
1897-01-10T00:00:00Z,DR. POTTER'S FIGHT.; He May Review It in His Sermon To-day.,https://query.nytimes.com/gst/abstract.html?res=9503E3D9153CE433A25753C1A9679C94669ED7CF,0
1897-01-10T00:00:00Z,BOOKS AND AUTHORS,https://query.nytimes.com/gst/abstract.html?res=9A0DE3D9153CE433A25753C1A9679C94669ED7CF,0
1897-01-10T00:00:00Z,T.A. HAVEMEYER ON GOLF; RAPID GROWTH OF THE GAME IN THIS COUNTRY. Danger in Too Many Clubs in One Locality -- Against Expensive Clubhouses to the Detriment of the Sport.,https://query.nytimes.com/gst/abstract.html?res=940CE4D9153CE433A25753C1A9679C94669ED7CF,0
1897-01-10T00:00:00Z,HIRSCH SCHOOL GRADUATES.; Members of the Fifth Class Show Samples of Their Work.,https://query.nytimes.com/gst/abstract.html?res=9E01E4D9153CE433A25753C1A9679C94669ED7CF,0
1897-01-10T00:00:00Z,The Appeal of Robert Kneebs.,https://query.nytimes.com/gst/abstract.html?res=9806E3D9153CE433A25753C1A9679C94669ED7CF,0
1897-01-10T00:00:00Z,DEATH OF SERGT. HOWARD.; He was Connected with the Capture of Jeff Davis.,https://query.nytimes.com/gst/abstract.html?res=9D00E5D9153CE433A25753C1A9679C94669ED7CF,0
1897-01-10T00:00:00Z,Senator Vest Renominated.,https://query.nytimes.com/gst/abstract.html?res=9B00E5D9153CE433A25753C1A9679C94669ED7CF,0
1897-01-10T00:00:00Z,The Sugar Trust-Arbuckle Fight.,https://query.nytimes.com/gst/abstract.html?res=9B03E4D9153CE433A25753C1A9679C94669ED7CF,0
1897-01-10T00:00:00Z,TO SOUTHERN RESORTS.,https://query.nytimes.com/gst/abstract.html?res=9400E5D9153CE433A25753C1A9679C94669ED7CF,0
1897-01-10T00:00:00Z,WAITING FOR PARLIAMENT; THREE CABINET COUNCILS TO BE HELD IN ADVANCE. The Debate on the Speech from the Throne Expected to Last Two Weeks -- Irish Questions to be Pressed.,https://query.nytimes.com/gst/abstract.html?res=9A06E3D9153CE433A25753C1A9679C94669ED7CF,0
1897-01-10T00:00:00Z,LANDTAG AND REICHTAG.; Matters of Great Importance to be Discussed.,https://query.nytimes.com/gst/abstract.html?res=9D01E3D9153CE433A25753C1A9679C94669ED7CF,0
1897-01-10T00:00:00Z,A Sensational Labor Suit.,https://query.nytimes.com/gst/abstract.html?res=9F03E5D9153CE433A25753C1A9679C94669ED7CF,0
1897-01-10T00:00:00Z,THE WEEK IN THE CLUB WORLD.,https://query.nytimes.com/gst/abstract.html?res=9A0DE4D9153CE433A25753C1A9679C94669ED7CF,0
1897-01-10T00:00:00Z,"""Sorrows of Satan"" on the Stage.",https://query.nytimes.com/gst/abstract.html?res=9505E4D9153CE433A25753C1A9679C94669ED7CF,0
1897-01-10T00:00:00Z,The Grant Monument.,https://query.nytimes.com/gst/abstract.html?res=9D06E3D9153CE433A25753C1A9679C94669ED7CF,0
1897-01-10T00:00:00Z,Populist Legislature Warned.,https://query.nytimes.com/gst/abstract.html?res=9507E3D9153CE433A25753C1A9679C94669ED7CF,0
1897-01-10T00:00:00Z,TOPICS OF THE TIMES.,https://query.nytimes.com/gst/abstract.html?res=9907E3D9153CE433A25753C1A9679C94669ED7CF,0
1897-01-10T00:00:00Z,THE THEATRES,https://query.nytimes.com/gst/abstract.html?res=940DE3D9153CE433A25753C1A9679C94669ED7CF,0
1897-01-10T00:00:00Z,A CLOCK OF BREAD CRUMBS.,https://query.nytimes.com/gst/abstract.html?res=9E0DE3D9153CE433A25753C1A9679C94669ED7CF,0
1897-01-10T00:00:00Z,A Failure in Nebraska.,https://query.nytimes.com/gst/abstract.html?res=9407E4D9153CE433A25753C1A9679C94669ED7CF,0
1897-01-10T00:00:00Z,JEAN DE RESZKE.,https://query.nytimes.com/gst/abstract.html?res=9D0DE3D9153CE433A25753C1A9679C94669ED7CF,0
1897-01-10T00:00:00Z,MANHATTAN ELEVATED CASE.; Mr. Hendricks Asks the Commissioners to Investigate the Road.,https://query.nytimes.com/gst/abstract.html?res=9E05E4D9153CE433A25753C1A9679C94669ED7CF,0
1897-01-10T00:00:00Z,T.O. CARTER A SUICIDE.; He Registered at Manhattan Hotel Under a False Name and Took Poison.,https://query.nytimes.com/gst/abstract.html?res=9E07E4D9153CE433A25753C1A9679C94669ED7CF,0
1897-01-10T00:00:00Z,Boss Rule.,https://query.nytimes.com/gst/abstract.html?res=9407E3D9153CE433A25753C1A9679C94669ED7CF,0
1897-01-10T00:00:00Z,Drowned on the Fishing Ground.,https://query.nytimes.com/gst/abstract.html?res=9D06E4D9153CE433A25753C1A9679C94669ED7CF,0
1897-01-10T00:00:00Z,DESPERATE FIGHT IN TEXAS.; Americans and Italians Engage in a Battle at a Rock Quarry.,https://query.nytimes.com/gst/abstract.html?res=9D05E4D9153CE433A25753C1A9679C94669ED7CF,0
1897-01-10T00:00:00Z,Editorial Article 1 -- No Title,https://query.nytimes.com/gst/abstract.html?res=9505E3D9153CE433A25753C1A9679C94669ED7CF,0
1897-01-10T00:00:00Z,AN ATTEMPT AT KIDNAPPING.; Seven-Year-Old Annie Lee of Bloomfield Led Away by a Stranger.,https://query.nytimes.com/gst/abstract.html?res=9D02E4D9153CE433A25753C1A9679C94669ED7CF,0
1897-01-10T00:00:00Z,KNOCKED THROUGH A HOUSE.; Result of a Railroad Coach's Collision with a Trolley Car.,https://query.nytimes.com/gst/abstract.html?res=9A05E4D9153CE433A25753C1A9679C94669ED7CF,0
1897-01-10T00:00:00Z,BEATEN BY TEXAS RANGERS; SPANISH TROOPS DEFEATED BY THE LONE STAR COMPANY. A Train-Load of Provisions Captured and Taken to the Insurgent Camp -- A Terrible Battle on Both Sides.,https://query.nytimes.com/gst/abstract.html?res=9B01E5D9153CE433A25753C1A9679C94669ED7CF,0
1897-01-10T00:00:00Z,HEARD AND SEEN.,https://query.nytimes.com/gst/abstract.html?res=980DE3D9153CE433A25753C1A9679C94669ED7CF,0
1897-01-10T00:00:00Z,Front Page 3 -- No Title,https://query.nytimes.com/gst/abstract.html?res=9D02E5D9153CE433A25753C1A9679C94669ED7CF,0
1897-01-10T00:00:00Z,SENATOR WOLCOTT IN LONDON.; He Expresses Great Grief at the Death of Gen. Walker.,https://query.nytimes.com/gst/abstract.html?res=9B06E3D9153CE433A25753C1A9679C94669ED7CF,0
1897-01-10T00:00:00Z,FUNDING PLAN TO FAIL.; Sufficient Opposition in the Senate to Defeat the Measure.,https://query.nytimes.com/gst/abstract.html?res=980CE5D9153CE433A25753C1A9679C94669ED7CF,0
1897-01-10T00:00:00Z,JUMPED AND WAS KILLED.; A Paterson Man in Eluding the Police Lost His Life.,https://query.nytimes.com/gst/abstract.html?res=9803E4D9153CE433A25753C1A9679C94669ED7CF,0
1897-01-10T00:00:00Z,AN ACCOUNTING ASKED FOR.; Central Ohio Stockholders Want the Money Owing to Them.,https://query.nytimes.com/gst/abstract.html?res=9D04E4D9153CE433A25753C1A9679C94669ED7CF,0
1897-01-10T00:00:00Z,NATIONAL GUARD NOTES.,https://query.nytimes.com/gst/abstract.html?res=9C02E3D9153CE433A25753C1A9679C94669ED7CF,0
1897-01-10T00:00:00Z,GOSSIP OF THE CYCLERS; AN INSTRUCTIVE FEATURE OF THE COMING SHOW. The Termination of the Alliance Between the Amateur Athletic Union and the League Not Regarded as Serious.,https://query.nytimes.com/gst/abstract.html?res=990CE4D9153CE433A25753C1A9679C94669ED7CF,0
1897-01-10T00:00:00Z,SUICIDE OF A STUDENT.; A Convert from Catholicism Kills Himself with Morphine.,https://query.nytimes.com/gst/abstract.html?res=9900E4D9153CE433A25753C1A9679C94669ED7CF,0
1897-01-10T00:00:00Z,GOSSIP AT THE CAPITAL; PRESIDENT CLEVELAND GLAD TO LEAVE THE WHITE HOUSE. Little Prospect of Action on the Cuban Resolutions -- Efforts at Suppressing Noise -- Reform in the Printing Office.,https://query.nytimes.com/gst/abstract.html?res=9E02E3D9153CE433A25753C1A9679C94669ED7CF,0
1897-01-10T00:00:00Z,New Lines in Manitoba.,https://query.nytimes.com/gst/abstract.html?res=9804E4D9153CE433A25753C1A9679C94669ED7CF,0
1897-01-10T00:00:00Z,A Liverpool Theatre Burued.,https://query.nytimes.com/gst/abstract.html?res=9A01E3D9153CE433A25753C1A9679C94669ED7CF,0
1897-01-10T00:00:00Z,TALK AT CLEVELAND.; Senator Proctor Presents the Names of New Englanders.,https://query.nytimes.com/gst/abstract.html?res=9D03E5D9153CE433A25753C1A9679C94669ED7CF,0
1897-01-10T00:00:00Z,The Staff's Uniforms.,https://query.nytimes.com/gst/abstract.html?res=9A07E3D9153CE433A25753C1A9679C94669ED7CF,0
1897-01-10T00:00:00Z,WOMEN USING NARCOTICS; DR. CATHERINE G. TOWNSEND UTTERS A SIGNIFICANT WARNING. Some Slaves to the Morphine Habit -- Smoking in the Latin Quarter -- A Woman Writer Who Uses Cigarettes.,https://query.nytimes.com/gst/abstract.html?res=9F05E3D9153CE433A25753C1A9679C94669ED7CF,0
1897-01-10T00:00:00Z,MAHANY'S CANAL PROJECT.; An Engineer's Favorable Report on the Congressman's Bill.,https://query.nytimes.com/gst/abstract.html?res=9901E5D9153CE433A25753C1A9679C94669ED7CF,0
1897-01-10T00:00:00Z,DE JUSTER DENIES THE CHARGE.; He Says He Never Had a Wife and Could Not Desert One.,https://query.nytimes.com/gst/abstract.html?res=9903E4D9153CE433A25753C1A9679C94669ED7CF,0
1897-01-10T00:00:00Z,Article 2 -- No Title,https://query.nytimes.com/gst/abstract.html?res=9502E5D9153CE433A25753C1A9679C94669ED7CF,0
1897-01-10T00:00:00Z,Article 3 -- No Title,https://query.nytimes.com/gst/abstract.html?res=9F00E4D9153CE433A25753C1A9679C94669ED7CF,0
1897-01-10T00:00:00Z,Tax Collector's Accounts Short.,https://query.nytimes.com/gst/abstract.html?res=940CE5D9153CE433A25753C1A9679C94669ED7CF,0
1897-01-10T00:00:00Z,"FAILURES OF BUSINESS HOUSES.; Walker White Lead Company -- Minturn & Bell, Implement Dealers.",https://query.nytimes.com/gst/abstract.html?res=9E00E4D9153CE433A25753C1A9679C94669ED7CF,0
1897-01-10T00:00:00Z,The Mail Wagon Service Here.,https://query.nytimes.com/gst/abstract.html?res=9C01E3D9153CE433A25753C1A9679C94669ED7CF,0
1897-01-10T00:00:00Z,PLATT TO NAME OFFICERS; MANNER OF DISPOSING OF THE LEGISLATURE'S PATRONAGE. A Conference of Machine Leaders to be Held in This City Monday Night to Divide the Minor Places at Albany.,https://query.nytimes.com/gst/abstract.html?res=9400E4D9153CE433A25753C1A9679C94669ED7CF,0
1897-01-10T00:00:00Z,WATCHING THE DAUNTLESS.; Believed that She Will Sail Without Waiting for Clearance Papers.,https://query.nytimes.com/gst/abstract.html?res=9401E5D9153CE433A25753C1A9679C94669ED7CF,0
1897-01-10T00:00:00Z,CAPITOL CARVINGS CRITICISED.; The Grouping of Heads Causes Unfavorable Comment.,https://query.nytimes.com/gst/abstract.html?res=980DE4D9153CE433A25753C1A9679C94669ED7CF,0
1897-01-10T00:00:00Z,THE POLLUTION OF STREAMS.,https://query.nytimes.com/gst/abstract.html?res=9F04E3D9153CE433A25753C1A9679C94669ED7CF,0
1897-01-10T00:00:00Z,Warm Welcome for Chairman Walker.,https://query.nytimes.com/gst/abstract.html?res=9D01E4D9153CE433A25753C1A9679C94669ED7CF,0
1897-01-10T00:00:00Z,FOR A GAS COMMISSION.; Henry A. Abell Will Introduce a Bill Creating One.,https://query.nytimes.com/gst/abstract.html?res=9B02E3D9153CE433A25753C1A9679C94669ED7CF,0
1897-01-10T00:00:00Z,Long-Felt Want May Be Filled.,https://query.nytimes.com/gst/abstract.html?res=9F07E3D9153CE433A25753C1A9679C94669ED7CF,0
1897-01-10T00:00:00Z,FRUIT OUTLOOK IN ULSTER.; Average Harvest Expected of All Varieties Except Peaches.,https://query.nytimes.com/gst/abstract.html?res=9805E3D9153CE433A25753C1A9679C94669ED7CF,0
1897-01-10T00:00:00Z,FRIENDS OF DUBOIS JUBILANT.; Predict the Re-election of the Idaho Senator.,https://query.nytimes.com/gst/abstract.html?res=9A00E5D9153CE433A25753C1A9679C94669ED7CF,0
1897-01-11T00:00:00Z,McKinley's Inauguration Boots.,https://query.nytimes.com/gst/abstract.html?res=9F04E5DE1230E333A25752C1A9679C94669ED7CF,0
1897-01-11T00:00:00Z,"A SERMON FOR THE ACTORS.; The Rev. John Rusk Preaches in Handel Hall, Chicago.",https://query.nytimes.com/gst/abstract.html?res=9805E5DE1230E333A25752C1A9679C94669ED7CF,0
1897-01-11T00:00:00Z,"AN APPEAL TO POPULISTS; CHAIRMAN WASHBURN HAS AN EYE TO THE FUTURE. The People's Party, He Says, Should Be an Independent Party -- Its Members Should Not Remain Camp Followers of the Democrats.",https://query.nytimes.com/gst/abstract.html?res=9F07E4DE1230E333A25752C1A9679C94669ED7CF,0
1897-01-11T00:00:00Z,"THE NEW WOMAN DISCUSSED; PROF. ADLER DECLARES HIMSELF IN SYMPATHY WITH HER. But Says the New Woman's Party Is Agitation, and Denounces Agitation as an Aberration -- Remove Artificial Restrictions.",https://query.nytimes.com/gst/abstract.html?res=9B07E4DE1230E333A25752C1A9679C94669ED7CF,0
1897-01-11T00:00:00Z,"A $200,000 Fire in Minneapolis.",https://query.nytimes.com/gst/abstract.html?res=9F0CE5DE1230E333A25752C1A9679C94669ED7CF,0
1897-01-11T00:00:00Z,Front Page 1 -- No Title,https://query.nytimes.com/gst/abstract.html?res=9C07E5DE1230E333A25752C1A9679C94669ED7CF,0
1897-01-11T00:00:00Z,NEBRASKA'S ELECTORAL VOTES; Reported that Sewall Will Get Two and Watson Six.,https://query.nytimes.com/gst/abstract.html?res=9E0CE5DE1230E333A25752C1A9679C94669ED7CF,0
1897-01-11T00:00:00Z,Death of James J. Hart.,https://query.nytimes.com/gst/abstract.html?res=990CE5DE1230E333A25752C1A9679C94669ED7CF,0
1897-01-11T00:00:00Z,A Proposed Populist Law.,https://query.nytimes.com/gst/abstract.html?res=9807E4DE1230E333A25752C1A9679C94669ED7CF,0
1897-01-11T00:00:00Z,Obituary 1 -- No Title,https://query.nytimes.com/gst/abstract.html?res=9E05E4DE1230E333A25752C1A9679C94669ED7CF,0
1897-01-11T00:00:00Z,Officers Beaten by Ruffians.,https://query.nytimes.com/gst/abstract.html?res=9407E5DE1230E333A25752C1A9679C94669ED7CF,0
1897-01-11T00:00:00Z,Article 7 -- No Title,https://query.nytimes.com/gst/abstract.html?res=9C05E4DE1230E333A25752C1A9679C94669ED7CF,0
1897-01-11T00:00:00Z,"A STEAMER IN DISTRESS.; Signals for Help While Off White Head, Nova Scotia.",https://query.nytimes.com/gst/abstract.html?res=9F05E5DE1230E333A25752C1A9679C94669ED7CF,0
1897-01-11T00:00:00Z,"WARNING FROM DR. POTTER; RAYS HARM CAN COME BUT FROM ONE SOURCE. He Denounced the Treatment He Has Received, and Declares that His Enemies Have Tried to Intimidate His Lawyers.",https://query.nytimes.com/gst/abstract.html?res=9504E4DE1230E333A25752C1A9679C94669ED7CF,0
1897-01-11T00:00:00Z,THE FINANCIAL MARKETS,https://query.nytimes.com/gst/abstract.html?res=9C04E4DE1230E333A25752C1A9679C94669ED7CF,0
1897-01-11T00:00:00Z,Article 2 -- No Title,https://query.nytimes.com/gst/abstract.html?res=9F0DE5DE1230E333A25752C1A9679C94669ED7CF,0
1897-01-11T00:00:00Z,Against Bloomers and Bicycles.,https://query.nytimes.com/gst/abstract.html?res=9D04E5DE1230E333A25752C1A9679C94669ED7CF,0
1897-01-11T00:00:00Z,Editorial Article 3 -- No Title,https://query.nytimes.com/gst/abstract.html?res=9F03E5DE1230E333A25752C1A9679C94669ED7CF,0
1897-01-11T00:00:00Z,POSTAL REFORM IN THE SENATE.,https://query.nytimes.com/gst/abstract.html?res=9C03E5DE1230E333A25752C1A9679C94669ED7CF,0
1897-01-11T00:00:00Z,Confederate Soldiers' Homes.,https://query.nytimes.com/gst/abstract.html?res=9403E5DE1230E333A25752C1A9679C94669ED7CF,0
1897-01-11T00:00:00Z,WHAT THE PAPERS SAY; Weyler's Batteries.,https://query.nytimes.com/gst/abstract.html?res=9B03E5DE1230E333A25752C1A9679C94669ED7CF,0
1897-01-11T00:00:00Z,Accused of Embezzlement.,https://query.nytimes.com/gst/abstract.html?res=9D0CE5DE1230E333A25752C1A9679C94669ED7CF,0
1897-01-11T00:00:00Z,THE PRESIDENTIAL VOTE; IT WILL BE CAST BY THE ELECTORS IN EACH STATE TO-DAY. A Delay in Sending the Certificates to Washington from New York Caused by Failure to Notify Gov. Black.,https://query.nytimes.com/gst/abstract.html?res=940DE5DE1230E333A25752C1A9679C94669ED7CF,0
1897-01-11T00:00:00Z,THE OUTLOOK.,https://query.nytimes.com/gst/abstract.html?res=9B00E5DE1230E333A25752C1A9679C94669ED7CF,0
1897-01-11T00:00:00Z,CHILIAN CLAIMS COMMISSION.; It Is to be Rehabilitated and Complete Its Work.,https://query.nytimes.com/gst/abstract.html?res=9E01E5DE1230E333A25752C1A9679C94669ED7CF,0
1897-01-11T00:00:00Z,DOES THE COMMITTEE WANT THE FACTS?,https://query.nytimes.com/gst/abstract.html?res=9A00E5DE1230E333A25752C1A9679C94669ED7CF,0
1897-01-11T00:00:00Z,The Thames Overflowing Its Banks.,https://query.nytimes.com/gst/abstract.html?res=9502E5DE1230E333A25752C1A9679C94669ED7CF,0
1897-01-11T00:00:00Z,Article 1 -- No Title,https://query.nytimes.com/gst/abstract.html?res=9E0DE5DE1230E333A25752C1A9679C94669ED7CF,0
1897-01-11T00:00:00Z,WORKING HARD FOR PLATT; TRYING TO SECURE A UNANIMOUS VOTE FOR HIM. Attempt Being Made by His Friends to Get the Support of Every Republican Legislator in the Senatorial Election.,https://query.nytimes.com/gst/abstract.html?res=980DE5DE1230E333A25752C1A9679C94669ED7CF,0
1897-01-11T00:00:00Z,Exports of Paper.,https://query.nytimes.com/gst/abstract.html?res=9F05E4DE1230E333A25752C1A9679C94669ED7CF,0
1897-01-11T00:00:00Z,"A NEW BANK FOR CHICAGO.; To be Called the General Trust Company, with a Capital of $5,000,000.",https://query.nytimes.com/gst/abstract.html?res=9E05E5DE1230E333A25752C1A9679C94669ED7CF,0
1897-01-11T00:00:00Z,MR. OLCOTT'S POSITION.,https://query.nytimes.com/gst/abstract.html?res=9500E5DE1230E333A25752C1A9679C94669ED7CF,0
1897-01-11T00:00:00Z,Article 4 -- No Title,https://query.nytimes.com/gst/abstract.html?res=9B0CE5DE1230E333A25752C1A9679C94669ED7CF,0
1897-01-11T00:00:00Z,Obituary 2 -- No Title,https://query.nytimes.com/gst/abstract.html?res=9905E4DE1230E333A25752C1A9679C94669ED7CF,0
1897-01-11T00:00:00Z,AS TO BRITISH SENTIMENT.,https://query.nytimes.com/gst/abstract.html?res=9505E4DE1230E333A25752C1A9679C94669ED7CF,0
1897-01-11T00:00:00Z,GOSSIP OF THE CABINET; McKINLEY WANTS TO GIVE A PORTFOLIO TO SHERMAN. Friendship for Hanna May Lead the Ohio Senator to Accept It -- More Talk About Cullom -- McKinley's Eye on ex-Gov. Long of Massachusetts.,https://query.nytimes.com/gst/abstract.html?res=9E04E5DE1230E333A25752C1A9679C94669ED7CF,0
1897-01-11T00:00:00Z,Foreign Notes of Interest.,https://query.nytimes.com/gst/abstract.html?res=9D0DE5DE1230E333A25752C1A9679C94669ED7CF,0
1897-01-11T00:00:00Z,TROOP F COMES TO TOWN; MARCHED DOWN FIFTH AVENUE WITHOUT MUSIC. Looked as if There Would Be Music at the Station Until Inspector Brooks Modified His Words to Trooper Capt. Dodd.,https://query.nytimes.com/gst/abstract.html?res=9A05E5DE1230E333A25752C1A9679C94669ED7CF,0
1897-01-11T00:00:00Z,MUST COMMISSION PRIME.; The Governor and the Courts at Variance in Iowa.,https://query.nytimes.com/gst/abstract.html?res=9C04E5DE1230E333A25752C1A9679C94669ED7CF,0
1897-01-11T00:00:00Z,CURRENT NOTES.,https://query.nytimes.com/gst/abstract.html?res=9A03E5DE1230E333A25752C1A9679C94669ED7CF,0
1897-01-11T00:00:00Z,"Waiting for a ""Norther"" at Colon.",https://query.nytimes.com/gst/abstract.html?res=9B02E5DE1230E333A25752C1A9679C94669ED7CF,0
1897-01-11T00:00:00Z,The Washington Senatorship.,https://query.nytimes.com/gst/abstract.html?res=9904E5DE1230E333A25752C1A9679C94669ED7CF,0
1897-01-11T00:00:00Z,THE SPANIARDS AROUSED.; Popular Impatience over the Cuban and Philippine Rebellions.,https://query.nytimes.com/gst/abstract.html?res=9B05E5DE1230E333A25752C1A9679C94669ED7CF,0
1897-01-11T00:00:00Z,ARREST OF THE RAWSONS.; A New Jersey Officer Apprehends the Twins and an Associate.,https://query.nytimes.com/gst/abstract.html?res=9A0CE5DE1230E333A25752C1A9679C94669ED7CF,0
1897-01-11T00:00:00Z,One Secret of Longevity.,https://query.nytimes.com/gst/abstract.html?res=9A06E5DE1230E333A25752C1A9679C94669ED7CF,0
1897-01-11T00:00:00Z,An Ideal Newspaper.,https://query.nytimes.com/gst/abstract.html?res=9C02E5DE1230E333A25752C1A9679C94669ED7CF,0
1897-01-11T00:00:00Z,The Post Office Department.,https://query.nytimes.com/gst/abstract.html?res=9503E5DE1230E333A25752C1A9679C94669ED7CF,0
1897-01-11T00:00:00Z,LOOKS FAVORABLE TO DUBOIS.; Those Who Oppose His Re-election to the Senate Do Not Combine.,https://query.nytimes.com/gst/abstract.html?res=9804E5DE1230E333A25752C1A9679C94669ED7CF,0
1897-01-11T00:00:00Z,SOME BOSTON REMARKS.,https://query.nytimes.com/gst/abstract.html?res=9E04E4DE1230E333A25752C1A9679C94669ED7CF,0
1897-01-11T00:00:00Z,Editorial Article 5 -- No Title,https://query.nytimes.com/gst/abstract.html?res=9903E5DE1230E333A25752C1A9679C94669ED7CF,0
1897-01-11T00:00:00Z,REVIVAL OF MANUFACTURING.; Cambria Rail Mill and Other Concerns Resume Work.,https://query.nytimes.com/gst/abstract.html?res=9504E5DE1230E333A25752C1A9679C94669ED7CF,0
1897-01-11T00:00:00Z,THE MONETARY CONVENTION.; It Will Open in Indianapolis To-morrow and Probably Last Three Days.,https://query.nytimes.com/gst/abstract.html?res=9D07E5DE1230E333A25752C1A9679C94669ED7CF,0
1897-01-11T00:00:00Z,Death of Joshua M. Whitcomb.,https://query.nytimes.com/gst/abstract.html?res=9C0CE5DE1230E333A25752C1A9679C94669ED7CF,0
1897-01-11T00:00:00Z,Article 8 -- No Title,https://query.nytimes.com/gst/abstract.html?res=9D05E4DE1230E333A25752C1A9679C94669ED7CF,0
1897-01-11T00:00:00Z,Article 5 -- No Title,https://query.nytimes.com/gst/abstract.html?res=940CE5DE1230E333A25752C1A9679C94669ED7CF,0
1897-01-11T00:00:00Z,Pinkerton Detective a Suicide.,https://query.nytimes.com/gst/abstract.html?res=9905E5DE1230E333A25752C1A9679C94669ED7CF,0
1897-01-11T00:00:00Z,MANY PASSENGERS INJURED.; A Railroad Train Crashes into a Street Car in Minneapolis.,https://query.nytimes.com/gst/abstract.html?res=950CE6DE1230E333A25752C1A9679C94669ED7CF,0
1897-01-11T00:00:00Z,A HORSE'S COLD BATH.; It Broke Through the Ice at Van Cortlandt Park.,https://query.nytimes.com/gst/abstract.html?res=9907E4DE1230E333A25752C1A9679C94669ED7CF,0
1897-01-11T00:00:00Z,NORFOLK RACING STABLES BURN; Hostler Probably Fatally Burned Trying to Save Tiddleywinks.,https://query.nytimes.com/gst/abstract.html?res=9405E5DE1230E333A25752C1A9679C94669ED7CF,0
1897-01-11T00:00:00Z,CREMORNE MISSION.; Celebration of the Fifteenth Anniversary of Its Founding.,https://query.nytimes.com/gst/abstract.html?res=9F06E5DE1230E333A25752C1A9679C94669ED7CF,0
1897-01-11T00:00:00Z,Princes in the Reichstag Hall.,https://query.nytimes.com/gst/abstract.html?res=9402E5DE1230E333A25752C1A9679C94669ED7CF,0
1897-01-11T00:00:00Z,Big Contract for a New York Firm.,https://query.nytimes.com/gst/abstract.html?res=9F07E5DE1230E333A25752C1A9679C94669ED7CF,0
1897-01-11T00:00:00Z,HARM DONE BY REVIVALS.; A Boston Clergyman Who Does Not Believe in Them.,https://query.nytimes.com/gst/abstract.html?res=9D05E5DE1230E333A25752C1A9679C94669ED7CF,0
1897-01-11T00:00:00Z,CHICAGO'S EXCLUSIVE 300.; A Charmed Circle Formed Within the Society of the City.,https://query.nytimes.com/gst/abstract.html?res=9505E5DE1230E333A25752C1A9679C94669ED7CF,0
1897-01-11T00:00:00Z,TWO FIRES IN BUFFALO.; Great Loss on a Clothing Building and a Lumber Yard.,https://query.nytimes.com/gst/abstract.html?res=9B07E5DE1230E333A25752C1A9679C94669ED7CF,0
1897-01-11T00:00:00Z,TALK OVER MAGISTRATE MOTT.; Labor Union Would Have Commission Look into His Sanity.,https://query.nytimes.com/gst/abstract.html?res=9C07E4DE1230E333A25752C1A9679C94669ED7CF,0
